aiter/configs/a8w8_bpreshuffle_tuned_gemm.csv
cu_num,M,N,K,q_dtype_w,kernelId,splitK,us,kernelName,tflops,bw,errRatio
80,192,1536,5120,torch.float8_e4m3fnuz,0,0,50.9249,a8w8_bpreshuffle_256x128x128x128_16x16_16x16_8x32x1_8x32x1_1x32x1x8_8x8x1_2x1_intrawave_v3,59.3,185.32,0.0
80,1,512,7168,torch.float8_e4m3fnuz,10,1,11.5805,a8w8_bpreshuffle_128x16x32x512_16x16_16x16_32x4x1_32x4x1_1x16x1x8_4x4x1_1x1_intrawave_v1,0.63,317.62,0.0
80,1,1280,8192,torch.float8_e4m3fnuz,11,0,14.3155,a8w8_bpreshuffle_256x16x64x512_16x16_16x16_32x8x1_32x8x1_1x16x1x16_4x4x1_1x1_intrawave_v1,1.46,733.23,0.0
80,1,2112,7168,torch.float8_e4m3fnuz,11,0,13.4147,a8w8_bpreshuffle_256x16x64x512_16x16_16x16_32x8x1_32x8x1_1x16x1x16_4x4x1_1x1_intrawave_v1,2.26,1129.37,0.0
80,1,4096,512,torch.float8_e4m3fnuz,9,0,4.2138,a8w8_bpreshuffle_128x16x32x128_16x16_16x16_8x16x1_8x16x1_1x16x1x8_4x4x1_1x1_intrawave_v1,1.0,499.75,0.0
80,1,4608,4096,torch.float8_e4m3fnuz,11,0,10.5838,a8w8_bpreshuffle_256x16x64x512_16x16_16x16_32x8x1_32x8x1_1x16x1x16_4x4x1_1x1_intrawave_v1,3.57,1784.58,0.0
80,1,4608,7168,torch.float8_e4m3fnuz,5,0,13.8515,a8w8_bpreshuffle_256x16x64x512_16x16_16x16_32x8x1_32x8x1_1x16x1x16_4x4x1_1x1_intrawave_v1,4.77,2385.77,0.0
80,1,7168,256,torch.float8_e4m3fnuz,75,0,6.4606,a8w8_bpreshuffle_128x16x256x64_16x16_16x16_4x16x1_4x32x1_1x16x1x8_8x8x1_1x2_intrawave_v1,0.57,286.29,0.0
80,1,7168,2304,torch.float8_e4m3fnuz,29,0,10.1762,a8w8_bpreshuffle_256x16x64x256_16x16_16x16_16x16x1_16x16x1_1x16x1x16_4x4x1_1x1_intrawave_v2,3.25,1624.55,0.0
80,1,8192,1024,torch.float8_e4m3fnuz,15,0,6.4482,a8w8_bpreshuffle_256x16x64x256_16x16_16x16_16x16x1_16x16x1_1x16x1x16_4x4x1_1x1_intrawave_v1,2.6,1303.62,0.0
80,1,9216,4096,torch.float8_e4m3fnuz,19,0,14.4331,a8w8_bpreshuffle_256x16x64x512_16x16_16x16_32x8x1_32x8x1_1x16x1x16_4x4x1_1x1_intrawave_v2,5.23,2616.99,0.0
80,2,4608,4096,torch.float8_e4m3fnuz,5,0,10.661,a8w8_bpreshuffle_256x16x64x512_16x16_16x16_32x8x1_32x8x1_1x16x1x16_4x4x1_1x1_intrawave_v1,7.08,1772.91,0.0
80,2,9216,4096,torch.float8_e4m3fnuz,5,0,14.4331,a8w8_bpreshuffle_256x16x64x512_16x16_16x16_32x8x1_32x8x1_1x16x1x16_4x4x1_1x1_intrawave_v1,10.46,2618.55,0.0
80,4,4608,4096,torch.float8_e4m3fnuz,5,0,10.4863,a8w8_bpreshuffle_256x16x64x512_16x16_16x16_32x8x1_32x8x1_1x16x1x16_4x4x1_1x1_intrawave_v1,14.4,1804.99,0.0
80,4,9216,4096,torch.float8_e4m3fnuz,11,0,14.6151,a8w8_bpreshuffle_256x16x64x512_16x16_16x16_32x8x1_32x8x1_1x16x1x16_4x4x1_1x1_intrawave_v1,20.66,2589.02,0.0
80,8,4608,4096,torch.float8_e4m3fnuz,5,0,10.8626,a8w8_bpreshuffle_256x16x64x512_16x16_16x16_32x8x1_32x8x1_1x16x1x16_4x4x1_1x1_intrawave_v1,27.8,1747.36,0.0
80,8,9216,4096,torch.float8_e4m3fnuz,5,0,15.0571,a8w8_bpreshuffle_256x16x64x512_16x16_16x16_32x8x1_32x8x1_1x16x1x16_4x4x1_1x1_intrawave_v1,40.11,2519.01,0.0
80,16,512,7168,torch.float8_e4m3fnuz,24,0,10.7923,a8w8_bpreshuffle_128x16x32x512_16x16_16x16_32x4x1_32x4x1_1x16x1x8_4x4x1_1x1_intrawave_v2,10.88,352.2,0.0
80,16,576,7168,torch.float8_e4m3fnuz,10,0,11.091,a8w8_bpreshuffle_128x16x32x512_16x16_16x16_32x4x1_32x4x1_1x16x1x8_4x4x1_1x1_intrawave_v1,11.91,384.27,0.0
80,16,1536,7168,torch.float8_e4m3fnuz,10,0,11.2927,a8w8_bpreshuffle_128x16x32x512_16x16_16x16_32x4x1_32x4x1_1x16x1x8_4x4x1_1x1_intrawave_v1,31.2,989.48,0.0
80,16,2112,7168,torch.float8_e4m3fnuz,24,0,11.7534,a8w8_bpreshuffle_128x16x32x512_16x16_16x16_32x4x1_32x4x1_1x16x1x8_4x4x1_1x1_intrawave_v2,41.22,1303.55,0.0
80,16,3072,1536,torch.float8_e4m3fnuz,11,0,5.8974,a8w8_bpreshuffle_256x16x64x512_16x16_16x16_32x8x1_32x8x1_1x16x1x16_4x4x1_1x1_intrawave_v1,25.6,820.95,0.0
80,16,4096,512,torch.float8_e4m3fnuz,9,0,4.939,a8w8_bpreshuffle_128x16x32x128_16x16_16x16_8x16x1_8x16x1_1x16x1x8_4x4x1_1x1_intrawave_v1,13.59,452.81,0.0
80,16,4608,4096,torch.float8_e4m3fnuz,24,0,10.8403,a8w8_bpreshuffle_128x16x32x512_16x16_16x16_32x4x1_32x4x1_1x16x1x8_4x4x1_1x1_intrawave_v2,55.72,1760.78,0.0
80,16,4608,7168,torch.float8_e4m3fnuz,5,0,14.1863,a8w8_bpreshuffle_256x16x64x512_16x16_16x16_32x8x1_32x8x1_1x16x1x16_4x4x1_1x1_intrawave_v1,74.51,2346.79,0.0
80,16,7168,256,torch.float8_e4m3fnuz,75,0,6.629,a8w8_bpreshuffle_128x16x256x64_16x16_16x16_4x16x1_4x32x1_1x16x1x8_8x8x1_1x2_intrawave_v1,8.86,312.03,0.0
80,16,7168,2048,torch.float8_e4m3fnuz,10,0,8.769,a8w8_bpreshuffle_128x16x32x512_16x16_16x16_32x4x1_32x4x1_1x16x1x8_4x4x1_1x1_intrawave_v1,53.57,1703.98,0.0
80,16,7168,2304,torch.float8_e4m3fnuz,15,0,10.491,a8w8_bpreshuffle_256x16x64x256_16x16_16x16_16x16x1_16x16x1_1x16x1x16_4x4x1_1x1_intrawave_v1,50.37,1599.59,0.0
80,16,9216,4096,torch.float8_e4m3fnuz,11,0,15.5867,a8w8_bpreshuffle_256x16x64x512_16x16_16x16_32x8x1_32x8x1_1x16x1x16_4x4x1_1x1_intrawave_v1,77.5,2444.98,0.0
80,32,512,7168,torch.float8_e4m3fnuz,10,0,11.1022,a8w8_bpreshuffle_128x16x32x512_16x16_16x16_32x4x1_32x4x1_1x16x1x8_4x4x1_1x1_intrawave_v1,21.16,354.18,0.0
80,32,576,7168,torch.float8_e4m3fnuz,10,0,11.199,a8w8_bpreshuffle_128x16x32x512_16x16_16x16_32x4x1_32x4x1_1x16x1x8_4x4x1_1x1_intrawave_v1,23.6,392.45,0.0
80,32,1280,8192,torch.float8_e4m3fnuz,24,0,12.4575,a8w8_bpreshuffle_128x16x32x512_16x16_16x16_32x4x1_32x4x1_1x16x1x8_4x4x1_1x1_intrawave_v2,53.87,869.34,0.0
80,32,1536,7168,torch.float8_e4m3fnuz,19,0,12.6967,a8w8_bpreshuffle_256x16x64x512_16x16_16x16_32x8x1_32x8x1_1x16x1x16_4x4x1_1x1_intrawave_v2,55.5,892.97,0.0
80,32,2112,7168,torch.float8_e4m3fnuz,5,0,13.1607,a8w8_bpreshuffle_256x16x64x512_16x16_16x16_32x8x1_32x8x1_1x16x1x16_4x4x1_1x1_intrawave_v1,73.62,1178.0,0.0
80,32,3072,1536,torch.float8_e4m3fnuz,112,0,6.9922,a8w8_bpreshuffle_256x32x64x256_16x16_16x16_16x16x1_16x16x1_1x32x1x8_8x8x1_2x1_intrawave_v1,43.19,709.98,0.0
80,32,4096,512,torch.float8_e4m3fnuz,9,0,4.8822,a8w8_bpreshuffle_128x16x32x128_16x16_16x16_8x16x1_8x16x1_1x16x1x8_4x4x1_1x1_intrawave_v1,27.49,486.6,0.0
80,32,4608,4096,torch.float8_e4m3fnuz,6,0,13.4935,a8w8_bpreshuffle_256x16x128x512_16x16_16x16_32x8x1_32x8x1_1x16x1x16_8x8x1_1x2_intrawave_v1,89.52,1430.34,0.0
80,32,4608,7168,torch.float8_e4m3fnuz,12,0,19.4019,a8w8_bpreshuffle_256x32x64x512_16x16_16x16_32x8x1_32x8x1_1x32x1x8_8x8x1_1x2_intrawave_v1,108.95,1729.44,0.0
80,32,7168,256,torch.float8_e4m3fnuz,75,0,6.8302,a8w8_bpreshuffle_128x16x256x64_16x16_16x16_4x16x1_4x32x1_1x16x1x8_8x8x1_1x2_intrawave_v1,17.19,337.03,0.0
80,32,7168,2048,torch.float8_e4m3fnuz,119,0,11.0711,a8w8_bpreshuffle_256x32x128x256_16x16_16x16_16x16x1_16x16x1_1x16x1x16_8x8x1_1x2_intrawave_v1,84.86,1373.34,0.0
80,32,7168,2304,torch.float8_e4m3fnuz,119,0,11.6614,a8w8_bpreshuffle_256x32x128x256_16x16_16x16_16x16x1_16x16x1_1x16x1x16_8x8x1_1x2_intrawave_v1,90.64,1461.88,0.0
80,32,8192,1024,torch.float8_e4m3fnuz,119,0,7.4863,a8w8_bpreshuffle_256x32x128x256_16x16_16x16_16x16x1_16x16x1_1x16x1x16_8x8x1_1x2_intrawave_v1,71.71,1194.94,0.0
80,32,9216,4096,torch.float8_e4m3fnuz,119,0,18.4783,a8w8_bpreshuffle_256x32x128x256_16x16_16x16_16x16x1_16x16x1_1x16x1x16_8x8x1_1x2_intrawave_v1,130.74,2081.88,0.0
80,48,512,7168,torch.float8_e4m3fnuz,10,0,11.2279,a8w8_bpreshuffle_128x16x32x512_16x16_16x16_32x4x1_32x4x1_1x16x1x8_4x4x1_1x1_intrawave_v1,31.38,361.89,0.0
80,48,2112,7168,torch.float8_e4m3fnuz,10,0,18.4707,a8w8_bpreshuffle_128x16x32x512_16x16_16x16_32x4x1_32x4x1_1x16x1x8_4x4x1_1x1_intrawave_v1,78.68,849.22,0.0
80,48,4096,512,torch.float8_e4m3fnuz,9,0,5.3534,a8w8_bpreshuffle_128x16x32x128_16x16_16x16_8x16x1_8x16x1_1x16x1x8_4x4x1_1x1_intrawave_v1,37.61,469.78,0.0
80,48,4608,7168,torch.float8_e4m3fnuz,113,0,22.5027,a8w8_bpreshuffle_256x48x64x256_16x16_16x16_16x16x1_16x16x1_1x16x1x16_4x4x1_1x1_intrawave_v1,140.91,1502.78,0.0
80,48,7168,256,torch.float8_e4m3fnuz,75,0,7.0126,a8w8_bpreshuffle_128x16x256x64_16x16_16x16_4x16x1_4x32x1_1x16x1x8_8x8x1_1x2_intrawave_v1,25.12,361.55,0.0
80,48,7168,2304,torch.float8_e4m3fnuz,113,0,13.6727,a8w8_bpreshuffle_256x48x64x256_16x16_16x16_16x16x1_16x16x1_1x16x1x16_4x4x1_1x1_intrawave_v1,115.96,1266.3,0.0
80,64,512,7168,torch.float8_e4m3fnuz,10,0,11.1263,a8w8_bpreshuffle_128x16x32x512_16x16_16x16_32x4x1_32x4x1_1x16x1x8_4x4x1_1x1_intrawave_v1,42.22,376.97,0.0
80,64,576,7168,torch.float8_e4m3fnuz,24,0,11.163,a8w8_bpreshuffle_128x16x32x512_16x16_16x16_32x4x1_32x4x1_1x16x1x8_4x4x1_1x1_intrawave_v2,47.34,417.56,0.0
80,64,1280,8192,torch.float8_e4m3fnuz,19,0,13.7807,a8w8_bpreshuffle_256x16x64x512_16x16_16x16_32x8x1_32x8x1_1x16x1x16_4x4x1_1x1_intrawave_v2,97.4,810.84,0.0
80,64,1536,7168,torch.float8_e4m3fnuz,19,0,16.9363,a8w8_bpreshuffle_256x16x64x512_16x16_16x16_32x8x1_32x8x1_1x16x1x16_4x4x1_1x1_intrawave_v2,83.21,688.78,0.0
80,64,2112,7168,torch.float8_e4m3fnuz,112,0,18.9179,a8w8_bpreshuffle_256x32x64x256_16x16_16x16_16x16x1_16x16x1_1x32x1x8_8x8x1_2x1_intrawave_v1,102.43,838.78,0.0
80,64,3072,1536,torch.float8_e4m3fnuz,114,0,9.0146,a8w8_bpreshuffle_256x64x64x256_16x16_16x16_16x16x1_16x16x1_1x32x1x8_8x8x1_2x1_intrawave_v3,67.0,577.96,0.0
80,64,4096,512,torch.float8_e4m3fnuz,77,0,5.8414,a8w8_bpreshuffle_256x64x64x128_16x16_16x16_8x32x1_8x32x1_1x32x1x8_8x8x1_2x1_intrawave_v3,45.95,454.38,0.0
80,64,4608,4096,torch.float8_e4m3fnuz,114,0,16.3715,a8w8_bpreshuffle_256x64x64x256_16x16_16x16_16x16x1_16x16x1_1x32x1x8_8x8x1_2x1_intrawave_v3,147.57,1204.92,0.0
80,64,4608,7168,torch.float8_e4m3fnuz,114,0,24.7999,a8w8_bpreshuffle_256x64x64x256_16x16_16x16_16x16x1_16x16x1_1x32x1x8_8x8x1_2x1_intrawave_v3,170.48,1374.15,0.0
80,64,7168,256,torch.float8_e4m3fnuz,75,0,7.6886,a8w8_bpreshuffle_128x16x256x64_16x16_16x16_4x16x1_4x32x1_1x16x1x8_8x8x1_1x2_intrawave_v1,30.55,360.13,0.0
80,64,7168,2048,torch.float8_e4m3fnuz,112,0,14.2819,a8w8_bpreshuffle_256x32x64x256_16x16_16x16_16x16x1_16x16x1_1x32x1x8_8x8x1_2x1_intrawave_v1,131.57,1101.3,0.0
80,64,7168,2304,torch.float8_e4m3fnuz,112,0,15.5151,a8w8_bpreshuffle_256x32x64x256_16x16_16x16_16x16x1_16x16x1_1x32x1x8_8x8x1_2x1_intrawave_v1,136.25,1133.09,0.0
80,64,8192,1024,torch.float8_e4m3fnuz,114,0,10.9842,a8w8_bpreshuffle_256x64x64x256_16x16_16x16_16x16x1_16x16x1_1x32x1x8_8x8x1_2x1_intrawave_v3,97.75,865.13,0.0
80,64,9216,4096,torch.float8_e4m3fnuz,114,0,25.0703,a8w8_bpreshuffle_256x64x64x256_16x16_16x16_16x16x1_16x16x1_1x32x1x8_8x8x1_2x1_intrawave_v3,192.73,1563.23,0.0
80,80,512,7168,torch.float8_e4m3fnuz,24,0,11.2303,a8w8_bpreshuffle_128x16x32x512_16x16_16x16_32x4x1_32x4x1_1x16x1x8_4x4x1_1x1_intrawave_v2,52.29,385.15,0.0
80,80,2112,7168,torch.float8_e4m3fnuz,113,0,24.3931,a8w8_bpreshuffle_256x48x64x256_16x16_16x16_16x16x1_16x16x1_1x16x1x16_4x4x1_1x1_intrawave_v1,99.3,657.98,0.0
80,80,4096,512,torch.float8_e4m3fnuz,76,0,6.8102,a8w8_bpreshuffle_256x32x64x128_16x16_16x16_8x32x1_8x32x1_1x32x1x8_8x8x1_2x1_intrawave_v1,49.27,410.19,0.0
80,80,4608,7168,torch.float8_e4m3fnuz,115,0,28.9995,a8w8_bpreshuffle_256x80x64x256_16x16_16x16_16x16x1_16x16x1_1x16x1x16_4x4x1_1x1_intrawave_v3,182.24,1184.19,0.0
80,80,7168,256,torch.float8_e4m3fnuz,75,0,8.2998,a8w8_bpreshuffle_128x16x256x64_16x16_16x16_4x16x1_4x32x1_1x16x1x8_8x8x1_1x2_intrawave_v1,35.37,361.74,0.0
80,80,7168,2304,torch.float8_e4m3fnuz,113,0,18.9055,a8w8_bpreshuffle_256x48x64x256_16x16_16x16_16x16x1_16x16x1_1x16x1x16_4x4x1_1x1_intrawave_v1,139.77,943.97,0.0
80,96,512,7168,torch.float8_e4m3fnuz,10,0,11.6635,a8w8_bpreshuffle_128x16x32x512_16x16_16x16_32x4x1_32x4x1_1x16x1x8_4x4x1_1x1_intrawave_v1,60.41,382.08,0.0
80,96,2112,7168,torch.float8_e4m3fnuz,113,0,22.3255,a8w8_bpreshuffle_256x48x64x256_16x16_16x16_16x16x1_16x16x1_1x16x1x16_4x4x1_1x1_intrawave_v1,130.19,727.08,0.0
80,96,4096,512,torch.float8_e4m3fnuz,76,0,6.6322,a8w8_bpreshuffle_256x32x64x128_16x16_16x16_8x32x1_8x32x1_1x32x1x8_8x8x1_2x1_intrawave_v1,60.71,442.2,0.0
80,96,4608,7168,torch.float8_e4m3fnuz,120,0,29.4707,a8w8_bpreshuffle_256x48x128x256_16x16_16x16_16x16x1_16x16x1_1x16x1x16_8x8x1_1x2_intrawave_v1,215.19,1174.15,0.0
80,96,7168,256,torch.float8_e4m3fnuz,75,0,8.6194,a8w8_bpreshuffle_128x16x256x64_16x16_16x16_4x16x1_4x32x1_1x16x1x8_8x8x1_1x2_intrawave_v1,40.88,375.41,0.0
80,96,7168,2304,torch.float8_e4m3fnuz,84,0,19.1495,a8w8_bpreshuffle_256x32x128x128_16x16_16x16_8x32x1_8x32x1_1x32x1x8_8x8x1_2x1_intrawave_v1,165.59,945.85,0.0
80,112,512,7168,torch.float8_e4m3fnuz,10,0,11.9903,a8w8_bpreshuffle_128x16x32x512_16x16_16x16_32x4x1_32x4x1_1x16x1x8_4x4x1_1x1_intrawave_v1,68.56,382.6,0.0
80,112,2112,7168,torch.float8_e4m3fnuz,112,0,25.9619,a8w8_bpreshuffle_256x32x64x256_16x16_16x16_16x16x1_16x16x1_1x32x1x8_8x8x1_2x1_intrawave_v1,130.62,632.26,0.0
80,112,4096,512,torch.float8_e4m3fnuz,76,0,7.3154,a8w8_bpreshuffle_256x32x64x128_16x16_16x16_8x32x1_8x32x1_1x32x1x8_8x8x1_2x1_intrawave_v1,64.22,419.94,0.0
80,112,4608,7168,torch.float8_e4m3fnuz,117,0,37.2568,a8w8_bpreshuffle_256x112x64x256_16x16_16x16_16x16x1_16x16x1_1x16x1x16_4x4x1_1x1_intrawave_v3,198.59,935.81,0.0
80,112,7168,256,torch.float8_e4m3fnuz,75,0,9.207,a8w8_bpreshuffle_128x16x256x64_16x16_16x16_4x16x1_4x32x1_1x16x1x8_8x8x1_1x2_intrawave_v1,44.64,376.81,0.0
80,112,7168,2304,torch.float8_e4m3fnuz,119,0,21.7835,a8w8_bpreshuffle_256x32x128x256_16x16_16x16_16x16x1_16x16x1_1x16x1x16_8x8x1_1x2_intrawave_v1,169.82,843.7,0.0
80,128,512,7168,torch.float8_e4m3fnuz,19,0,12.3367,a8w8_bpreshuffle_256x16x64x512_16x16_16x16_32x8x1_32x8x1_1x16x1x16_4x4x1_1x1_intrawave_v2,76.16,382.48,0.0
80,128,576,7168,torch.float8_e4m3fnuz,25,0,12.3755,a8w8_bpreshuffle_256x16x64x512_16x16_16x16_32x8x1_32x8x1_1x16x1x16_4x4x1_1x1_intrawave_v2,85.41,419.68,0.0
80,128,1280,8192,torch.float8_e4m3fnuz,6,0,20.0,a8w8_bpreshuffle_256x16x128x512_16x16_16x16_32x8x1_32x8x1_1x16x1x16_8x8x1_1x2_intrawave_v1,134.22,593.1,0.0
80,128,1536,7168,torch.float8_e4m3fnuz,112,0,22.8955,a8w8_bpreshuffle_256x32x64x256_16x16_16x16_16x16x1_16x16x1_1x32x1x8_8x8x1_2x1_intrawave_v1,123.11,538.13,0.0
80,128,2112,7168,torch.float8_e4m3fnuz,114,0,24.5755,a8w8_bpreshuffle_256x64x64x256_16x16_16x16_16x16x1_16x16x1_1x32x1x8_8x8x1_2x1_intrawave_v3,157.7,675.35,0.0
80,128,3072,1536,torch.float8_e4m3fnuz,112,0,11.1838,a8w8_bpreshuffle_256x32x64x256_16x16_16x16_16x16x1_16x16x1_1x32x1x8_8x8x1_2x1_intrawave_v1,108.01,509.81,0.0
80,128,4096,512,torch.float8_e4m3fnuz,76,0,7.2018,a8w8_bpreshuffle_256x32x64x128_16x16_16x16_8x32x1_8x32x1_1x32x1x8_8x8x1_2x1_intrawave_v1,74.55,445.9,0.0
80,128,4608,4096,torch.float8_e4m3fnuz,121,0,24.6387,a8w8_bpreshuffle_256x64x128x256_16x16_16x16_16x16x1_16x16x1_1x16x1x16_8x8x1_1x2_intrawave_v3,196.11,835.2,0.0
80,128,4608,7168,torch.float8_e4m3fnuz,114,0,38.7224,a8w8_bpreshuffle_256x64x64x256_16x16_16x16_16x16x1_16x16x1_1x32x1x8_8x8x1_2x1_intrawave_v3,218.37,907.16,0.0
80,128,7168,256,torch.float8_e4m3fnuz,73,0,10.1406,a8w8_bpreshuffle_256x32x256x64_16x16_16x16_4x32x1_4x64x1_1x32x1x8_8x8x1_2x1_intrawave_v1,46.32,365.14,0.0
80,128,7168,2048,torch.float8_e4m3fnuz,119,0,20.5111,a8w8_bpreshuffle_256x32x128x256_16x16_16x16_16x16x1_16x16x1_1x16x1x16_8x8x1_1x2_intrawave_v1,183.22,817.96,0.0
80,128,7168,2304,torch.float8_e4m3fnuz,84,0,21.9275,a8w8_bpreshuffle_256x32x128x128_16x16_16x16_8x32x1_8x32x1_1x32x1x8_8x8x1_2x1_intrawave_v1,192.81,850.3,0.0
80,128,8192,1024,torch.float8_e4m3fnuz,121,0,14.9703,a8w8_bpreshuffle_256x64x128x256_16x16_16x16_16x16x1_16x16x1_1x16x1x16_8x8x1_1x2_intrawave_v3,143.45,709.19,0.0
80,128,9216,4096,torch.float8_e4m3fnuz,121,0,39.1328,a8w8_bpreshuffle_256x64x128x256_16x16_16x16_16x16x1_16x16x1_1x16x1x16_8x8x1_1x2_intrawave_v3,246.95,1038.32,0.0
80,192,1280,8192,torch.float8_e4m3fnuz,113,0,24.3731,a8w8_bpreshuffle_256x48x64x256_16x16_16x16_16x16x1_16x16x1_1x16x1x16_4x4x1_1x1_intrawave_v1,165.2,514.92,0.0
80,192,8192,1024,torch.float8_e4m3fnuz,85,0,18.7963,a8w8_bpreshuffle_256x64x128x128_16x16_16x16_8x32x1_8x32x1_1x32x1x8_8x8x1_2x1_intrawave_v3,171.38,624.11,0.0
80,256,512,7168,torch.float8_e4m3fnuz,6,0,17.5859,a8w8_bpreshuffle_256x16x128x512_16x16_16x16_32x8x1_32x8x1_1x16x1x16_8x8x1_1x2_intrawave_v1,106.85,327.94,0.0
80,256,576,7168,torch.float8_e4m3fnuz,112,0,18.3779,a8w8_bpreshuffle_256x32x64x256_16x16_16x16_16x16x1_16x16x1_1x32x1x8_8x8x1_2x1_intrawave_v1,115.03,340.56,0.0
80,256,1280,8192,torch.float8_e4m3fnuz,114,0,26.7743,a8w8_bpreshuffle_256x64x64x256_16x16_16x16_16x16x1_16x16x1_1x32x1x8_8x8x1_2x1_intrawave_v3,200.52,494.44,0.0
80,256,1536,7168,torch.float8_e4m3fnuz,120,0,31.1851,a8w8_bpreshuffle_256x48x128x256_16x16_16x16_16x16x1_16x16x1_1x16x1x16_8x8x1_1x2_intrawave_v1,180.76,437.12,0.0
80,256,2112,7168,torch.float8_e4m3fnuz,114,0,37.3908,a8w8_bpreshuffle_256x64x64x256_16x16_16x16_16x16x1_16x16x1_1x32x1x8_8x8x1_2x1_intrawave_v3,207.3,482.88,0.0
80,256,3072,1536,torch.float8_e4m3fnuz,120,0,16.0983,a8w8_bpreshuffle_256x48x128x256_16x16_16x16_16x16x1_16x16x1_1x16x1x16_8x8x1_1x2_intrawave_v1,150.07,415.24,0.0
80,256,4096,512,torch.float8_e4m3fnuz,76,0,10.9814,a8w8_bpreshuffle_256x32x64x128_16x16_16x16_8x32x1_8x32x1_1x32x1x8_8x8x1_2x1_intrawave_v1,97.78,393.88,0.0
80,256,4608,4096,torch.float8_e4m3fnuz,85,0,37.982,a8w8_bpreshuffle_256x64x128x128_16x16_16x16_8x32x1_8x32x1_1x32x1x8_8x8x1_2x1_intrawave_v3,254.43,586.65,0.0
80,256,4608,7168,torch.float8_e4m3fnuz,121,0,62.2609,a8w8_bpreshuffle_256x64x128x256_16x16_16x16_16x16x1_16x16x1_1x16x1x16_8x8x1_1x2_intrawave_v3,271.62,597.88,0.0
80,256,7168,256,torch.float8_e4m3fnuz,73,0,11.5078,a8w8_bpreshuffle_256x32x256x64_16x16_16x16_4x32x1_4x64x1_1x32x1x8_8x8x1_2x1_intrawave_v1,81.64,484.07,0.0
80,256,7168,2048,torch.float8_e4m3fnuz,85,0,30.5235,a8w8_bpreshuffle_256x64x128x128_16x16_16x16_8x32x1_8x32x1_1x32x1x8_8x8x1_2x1_intrawave_v3,246.24,618.36,0.0
80,256,7168,2304,torch.float8_e4m3fnuz,85,0,32.0436,a8w8_bpreshuffle_256x64x128x128_16x16_16x16_8x32x1_8x32x1_1x32x1x8_8x8x1_2x1_intrawave_v3,263.88,648.33,0.0
80,256,8192,1024,torch.float8_e4m3fnuz,70,0,23.9267,a8w8_bpreshuffle_256x128x128x128_16x16_16x16_8x32x1_8x32x1_1x32x1x8_8x8x1_2x1_intrawave_v3,179.51,536.85,0.0
80,256,9216,4096,torch.float8_e4m3fnuz,70,0,64.6741,a8w8_bpreshuffle_256x128x128x128_16x16_16x16_8x32x1_8x32x1_1x32x1x8_8x8x1_2x1_intrawave_v3,298.84,672.85,0.0
80,320,1280,8192,torch.float8_e4m3fnuz,115,0,32.2959,a8w8_bpreshuffle_256x80x64x256_16x16_16x16_16x16x1_16x16x1_1x16x1x16_4x4x1_1x1_intrawave_v3,207.79,431.21,0.0
80,320,8192,1024,torch.float8_e4m3fnuz,85,0,24.7583,a8w8_bpreshuffle_256x64x128x128_16x16_16x16_8x32x1_8x32x1_1x32x1x8_8x8x1_2x1_intrawave_v3,216.84,563.82,0.0
80,512,512,7168,torch.float8_e4m3fnuz,119,0,23.6639,a8w8_bpreshuffle_256x32x128x256_16x16_16x16_16x16x1_16x16x1_1x16x1x16_8x8x1_1x2_intrawave_v1,158.81,332.33,0.0
80,512,576,7168,torch.float8_e4m3fnuz,114,0,23.9199,a8w8_bpreshuffle_256x64x64x256_16x16_16x16_16x16x1_16x16x1_1x32x1x8_8x8x1_2x1_intrawave_v3,176.75,350.7,0.0
80,512,1280,8192,torch.float8_e4m3fnuz,114,0,42.3216,a8w8_bpreshuffle_256x64x64x256_16x16_16x16_16x16x1_16x16x1_1x32x1x8_8x8x1_2x1_intrawave_v3,253.71,377.84,0.0
80,512,1536,7168,torch.float8_e4m3fnuz,128,0,47.65,a8w8_bpreshuffle_256x64x192x256_16x16_16x16_16x16x1_16x16x1_1x32x1x8_8x8x1_2x1_intrawave_v3,236.61,341.09,0.0
80,512,2112,7168,torch.float8_e4m3fnuz,129,0,60.4509,a8w8_bpreshuffle_256x80x192x256_16x16_16x16_16x16x1_16x16x1_1x16x1x16_4x4x1_1x1_intrawave_v3,256.44,346.92,0.0
80,512,3072,1536,torch.float8_e4m3fnuz,85,0,24.3751,a8w8_bpreshuffle_256x64x128x128_16x16_16x16_8x32x1_8x32x1_1x32x1x8_8x8x1_2x1_intrawave_v3,198.23,354.9,0.0
80,512,4096,512,torch.float8_e4m3fnuz,85,0,15.7231,a8w8_bpreshuffle_256x64x128x128_16x16_16x16_8x32x1_8x32x1_1x32x1x8_8x8x1_2x1_intrawave_v3,136.58,416.81,0.0
80,512,4608,7168,torch.float8_e4m3fnuz,70,0,105.5819,a8w8_bpreshuffle_256x128x128x128_16x16_16x16_8x32x1_8x32x1_1x32x1x8_8x8x1_2x1_intrawave_v3,320.35,392.29,0.0
80,512,7168,256,torch.float8_e4m3fnuz,72,0,16.1951,a8w8_bpreshuffle_256x64x256x64_16x16_16x16_4x64x1_4x64x1_1x16x1x16_8x8x1_1x2_intrawave_v1,116.03,574.63,0.0
80,512,7168,2048,torch.float8_e4m3fnuz,71,0,53.438,a8w8_bpreshuffle_256x128x128x64_16x16_16x16_4x64x1_4x64x1_1x32x1x8_8x8x1_2x1_intrawave_v3,281.31,431.69,0.0
80,512,7168,2304,torch.float8_e4m3fnuz,72,0,57.4769,a8w8_bpreshuffle_256x64x256x64_16x16_16x16_4x64x1_4x64x1_1x16x1x16_8x8x1_1x2_intrawave_v1,294.23,435.56,0.0
80,512,8192,1024,torch.float8_e4m3fnuz,85,0,37.882,a8w8_bpreshuffle_256x64x128x128_16x16_16x16_8x32x1_8x32x1_1x32x1x8_8x8x1_2x1_intrawave_v3,226.76,456.72,0.0
80,1024,512,7168,torch.float8_e4m3fnuz,114,0,36.6616,a8w8_bpreshuffle_256x64x64x256_16x16_16x16_16x16x1_16x16x1_1x32x1x8_8x8x1_2x1_intrawave_v3,205.02,328.92,0.0
80,1024,576,7168,torch.float8_e4m3fnuz,114,0,37.1872,a8w8_bpreshuffle_256x64x64x256_16x16_16x16_16x16x1_16x16x1_1x32x1x8_8x8x1_2x1_intrawave_v3,227.38,340.13,0.0
80,1024,1280,8192,torch.float8_e4m3fnuz,85,0,68.1209,a8w8_bpreshuffle_256x64x128x128_16x16_16x16_8x32x1_8x32x1_1x32x1x8_8x8x1_2x1_intrawave_v3,315.25,315.55,0.0
80,1024,1536,7168,torch.float8_e4m3fnuz,136,0,74.0965,a8w8_bpreshuffle_256x80x256x256_16x16_16x16_16x16x1_16x16x1_1x16x1x16_8x8x1_1x2_intrawave_v3,304.31,290.11,0.0
80,1024,2112,7168,torch.float8_e4m3fnuz,93,0,115.8099,a8w8_bpreshuffle_256x64x192x128_16x16_16x16_8x32x1_8x32x1_1x32x1x8_8x8x1_2x1_intrawave_v3,267.72,231.45,0.0
80,1024,3072,1536,torch.float8_e4m3fnuz,85,0,38.8336,a8w8_bpreshuffle_256x64x128x128_16x16_16x16_8x32x1_8x32x1_1x32x1x8_8x8x1_2x1_intrawave_v3,248.85,324.02,0.0
80,1024,4096,512,torch.float8_e4m3fnuz,85,0,24.9039,a8w8_bpreshuffle_256x64x128x128_16x16_16x16_8x32x1_8x32x1_1x32x1x8_8x8x1_2x1_intrawave_v3,172.46,442.1,0.0
80,1024,4608,4096,torch.float8_e4m3fnuz,71,0,120.44,a8w8_bpreshuffle_256x128x128x64_16x16_16x16_4x64x1_4x64x1_1x32x1x8_8x8x1_2x1_intrawave_v3,320.95,269.89,0.0
80,1024,4608,7168,torch.float8_e4m3fnuz,93,0,189.1551,a8w8_bpreshuffle_256x64x192x128_16x16_16x16_8x32x1_8x32x1_1x32x1x8_8x8x1_2x1_intrawave_v3,357.62,263.31,0.0
80,1024,7168,256,torch.float8_e4m3fnuz,71,0,27.7779,a8w8_bpreshuffle_256x128x128x64_16x16_16x16_4x64x1_4x64x1_1x32x1x8_8x8x1_2x1_intrawave_v3,135.29,603.98,0.0
80,1024,7168,2048,torch.float8_e4m3fnuz,71,0,98.0567,a8w8_bpreshuffle_256x128x128x64_16x16_16x16_4x64x1_4x64x1_1x32x1x8_8x8x1_2x1_intrawave_v3,306.61,320.81,0.0
80,1024,7168,2304,torch.float8_e4m3fnuz,85,0,107.3839,a8w8_bpreshuffle_256x64x128x128_16x16_16x16_8x32x1_8x32x1_1x32x1x8_8x8x1_2x1_intrawave_v3,314.97,312.47,0.0
80,1024,8192,1024,torch.float8_e4m3fnuz,71,0,67.0889,a8w8_bpreshuffle_256x128x128x64_16x16_16x16_4x64x1_4x64x1_1x32x1x8_8x8x1_2x1_intrawave_v3,256.08,390.74,0.0
80,1024,9216,4096,torch.float8_e4m3fnuz,93,0,219.0276,a8w8_bpreshuffle_256x64x192x128_16x16_16x16_8x32x1_8x32x1_1x32x1x8_8x8x1_2x1_intrawave_v3,352.97,277.67,0.0
80,1536,512,7168,torch.float8_e4m3fnuz,120,0,48.0728,a8w8_bpreshuffle_256x48x128x256_16x16_16x16_16x16x1_16x16x1_1x16x1x16_8x8x1_1x2_intrawave_v1,234.53,338.09,0.0
80,1536,576,7168,torch.float8_e4m3fnuz,128,0,47.2304,a8w8_bpreshuffle_256x64x192x256_16x16_16x16_16x16x1_16x16x1_1x32x1x8_8x8x1_2x1_intrawave_v3,268.55,358.0,0.0
80,1536,1536,7168,torch.float8_e4m3fnuz,0,0,105.4423,a8w8_bpreshuffle_256x128x128x128_16x16_16x16_8x32x1_8x32x1_1x32x1x8_8x8x1_2x1_intrawave_v3,320.77,253.59,0.0
80,1536,2112,7168,torch.float8_e4m3fnuz,68,0,148.9129,a8w8_bpreshuffle_256x128x192x128_16x16_16x16_8x32x1_8x32x1_1x32x1x8_8x8x1_2x1_intrawave_v3,312.31,219.17,0.0
80,1536,3072,1536,torch.float8_e4m3fnuz,93,0,51.4668,a8w8_bpreshuffle_256x64x192x128_16x16_16x16_8x32x1_8x32x1_1x32x1x8_8x8x1_2x1_intrawave_v3,281.65,320.89,0.0
80,1536,4096,512,torch.float8_e4m3fnuz,85,0,33.2015,a8w8_bpreshuffle_256x64x128x128_16x16_16x16_8x32x1_8x32x1_1x32x1x8_8x8x1_2x1_intrawave_v3,194.04,465.84,0.0
80,1536,4608,7168,torch.float8_e4m3fnuz,85,0,279.9019,a8w8_bpreshuffle_256x64x128x128_16x16_16x16_8x32x1_8x32x1_1x32x1x8_8x8x1_2x1_intrawave_v3,362.51,207.92,0.0
80,1536,7168,256,torch.float8_e4m3fnuz,71,0,37.3284,a8w8_bpreshuffle_256x128x128x64_16x16_16x16_4x64x1_4x64x1_1x32x1x8_8x8x1_2x1_intrawave_v3,151.01,649.59,0.0
80,1536,7168,2048,torch.float8_e4m3fnuz,85,0,138.0452,a8w8_bpreshuffle_256x64x128x128_16x16_16x16_8x32x1_8x32x1_1x32x1x8_8x8x1_2x1_intrawave_v3,326.68,288.64,0.0
80,1536,7168,2304,torch.float8_e4m3fnuz,85,0,150.2725,a8w8_bpreshuffle_256x64x128x128_16x16_16x16_8x32x1_8x32x1_1x32x1x8_8x8x1_2x1_intrawave_v3,337.62,279.99,0.0
80,2048,512,7168,torch.float8_e4m3fnuz,85,0,58.1113,a8w8_bpreshuffle_256x64x128x128_16x16_16x16_8x32x1_8x32x1_1x32x1x8_8x8x1_2x1_intrawave_v3,258.68,351.86,0.0
80,2048,576,7168,torch.float8_e4m3fnuz,129,0,60.7837,a8w8_bpreshuffle_256x80x192x256_16x16_16x16_16x16x1_16x16x1_1x16x1x16_4x4x1_1x1_intrawave_v3,278.22,348.25,0.0
80,2048,1280,8192,torch.float8_e4m3fnuz,0,0,119.2848,a8w8_bpreshuffle_256x128x128x128_16x16_16x16_8x32x1_8x32x1_1x32x1x8_8x8x1_2x1_intrawave_v3,360.06,272.51,0.0
80,2048,1536,7168,torch.float8_e4m3fnuz,85,0,138.8692,a8w8_bpreshuffle_256x64x128x128_16x16_16x16_8x32x1_8x32x1_1x32x1x8_8x8x1_2x1_intrawave_v3,324.75,230.3,0.0
80,2048,2112,7168,torch.float8_e4m3fnuz,93,0,186.5271,a8w8_bpreshuffle_256x64x192x128_16x16_16x16_8x32x1_8x32x1_1x32x1x8_8x8x1_2x1_intrawave_v3,332.44,206.24,0.0
80,2048,3072,1536,torch.float8_e4m3fnuz,72,0,69.8541,a8w8_bpreshuffle_256x64x256x64_16x16_16x16_4x64x1_4x64x1_1x16x1x16_8x8x1_1x2_intrawave_v1,276.68,292.71,0.0
80,2048,4096,512,torch.float8_e4m3fnuz,71,0,43.6672,a8w8_bpreshuffle_256x128x128x64_16x16_16x16_4x64x1_4x64x1_1x32x1x8_8x8x1_2x1_intrawave_v3,196.71,456.25,0.0
80,2048,4608,4096,torch.float8_e4m3fnuz,68,0,218.9032,a8w8_bpreshuffle_256x128x192x128_16x16_16x16_8x32x1_8x32x1_1x32x1x8_8x8x1_2x1_intrawave_v3,353.17,210.77,0.0
80,2048,4608,7168,torch.float8_e4m3fnuz,93,0,366.0791,a8w8_bpreshuffle_256x64x192x128_16x16_16x16_8x32x1_8x32x1_1x32x1x8_8x8x1_2x1_intrawave_v3,369.57,181.89,0.0
80,2048,7168,256,torch.float8_e4m3fnuz,71,0,48.0096,a8w8_bpreshuffle_256x128x128x64_16x16_16x16_4x64x1_4x64x1_1x32x1x8_8x8x1_2x1_intrawave_v3,156.56,660.69,0.0
80,2048,7168,2048,torch.float8_e4m3fnuz,85,0,186.7051,a8w8_bpreshuffle_256x64x128x128_16x16_16x16_8x32x1_8x32x1_1x32x1x8_8x8x1_2x1_intrawave_v3,322.06,258.35,0.0
80,2048,7168,2304,torch.float8_e4m3fnuz,85,0,199.0359,a8w8_bpreshuffle_256x64x128x128_16x16_16x16_8x32x1_8x32x1_1x32x1x8_8x8x1_2x1_intrawave_v3,339.87,254.19,0.0
80,2048,8192,1024,torch.float8_e4m3fnuz,71,0,120.4715,a8w8_bpreshuffle_256x128x128x64_16x16_16x16_4x64x1_4x64x1_1x32x1x8_8x8x1_2x1_intrawave_v3,285.21,365.57,0.0
80,2048,9216,4096,torch.float8_e4m3fnuz,68,0,425.2314,a8w8_bpreshuffle_256x128x192x128_16x16_16x16_8x32x1_8x32x1_1x32x1x8_8x8x1_2x1_intrawave_v3,363.61,197.27,0.0
80,4096,512,7168,torch.float8_e4m3fnuz,85,0,101.7067,a8w8_bpreshuffle_256x64x128x128_16x16_16x16_8x32x1_8x32x1_1x32x1x8_8x8x1_2x1_intrawave_v3,295.6,366.0,0.0
80,4096,576,7168,torch.float8_e4m3fnuz,93,0,113.3711,a8w8_bpreshuffle_256x64x192x128_16x16_16x16_8x32x1_8x32x1_1x32x1x8_8x8x1_2x1_intrawave_v3,298.34,337.01,0.0
80,4096,1280,8192,torch.float8_e4m3fnuz,71,0,234.5689,a8w8_bpreshuffle_256x128x128x64_16x16_16x16_4x64x1_4x64x1_1x32x1x8_8x8x1_2x1_intrawave_v3,366.2,232.45,0.0
80,4096,1536,7168,torch.float8_e4m3fnuz,85,0,256.917,a8w8_bpreshuffle_256x64x128x128_16x16_16x16_8x32x1_8x32x1_1x32x1x8_8x8x1_2x1_intrawave_v3,351.06,206.11,0.0
80,4096,2112,7168,torch.float8_e4m3fnuz,93,0,329.2957,a8w8_bpreshuffle_256x64x192x128_16x16_16x16_8x32x1_8x32x1_1x32x1x8_8x8x1_2x1_intrawave_v3,376.61,187.67,0.0
80,4096,3072,1536,torch.float8_e4m3fnuz,93,0,123.6652,a8w8_bpreshuffle_256x64x192x128_16x16_16x16_8x32x1_8x32x1_1x32x1x8_8x8x1_2x1_intrawave_v3,312.58,292.53,0.0
80,4096,4096,512,torch.float8_e4m3fnuz,71,0,75.7421,a8w8_bpreshuffle_256x128x128x64_16x16_16x16_4x64x1_4x64x1_1x32x1x8_8x8x1_2x1_intrawave_v3,226.82,498.39,0.0
80,4096,4608,4096,torch.float8_e4m3fnuz,85,0,420.6946,a8w8_bpreshuffle_256x64x128x128_16x16_16x16_8x32x1_8x32x1_1x32x1x8_8x8x1_2x1_intrawave_v3,367.53,174.47,0.0
80,4096,4608,7168,torch.float8_e4m3fnuz,85,0,715.7879,a8w8_bpreshuffle_256x64x128x128_16x16_16x16_8x32x1_8x32x1_1x32x1x8_8x8x1_2x1_intrawave_v3,378.02,139.9,0.0
80,4096,7168,256,torch.float8_e4m3fnuz,71,0,85.7258,a8w8_bpreshuffle_256x128x128x64_16x16_16x16_4x64x1_4x64x1_1x32x1x8_8x8x1_2x1_intrawave_v3,175.35,718.61,0.0
80,4096,7168,2048,torch.float8_e4m3fnuz,71,0,345.3094,a8w8_bpreshuffle_256x128x128x64_16x16_16x16_4x64x1_4x64x1_1x32x1x8_8x8x1_2x1_intrawave_v3,348.26,236.86,0.0
80,4096,7168,2304,torch.float8_e4m3fnuz,71,0,379.4759,a8w8_bpreshuffle_256x128x128x64_16x16_16x16_4x64x1_4x64x1_1x32x1x8_8x8x1_2x1_intrawave_v3,356.52,223.13,0.0
80,4096,8192,1024,torch.float8_e4m3fnuz,71,0,227.2969,a8w8_bpreshuffle_256x128x128x64_16x16_16x16_4x64x1_4x64x1_1x32x1x8_8x8x1_2x1_intrawave_v3,302.33,350.61,0.0
80,4096,9216,4096,torch.float8_e4m3fnuz,71,0,812.5832,a8w8_bpreshuffle_256x128x128x64_16x16_16x16_4x64x1_4x64x1_1x32x1x8_8x8x1_2x1_intrawave_v3,380.56,160.01,0.0
80,4240,9216,4096,torch.float8_e4m3fnuz,93,0,903.6056,a8w8_bpreshuffle_256x64x192x128_16x16_16x16_8x32x1_8x32x1_1x32x1x8_8x8x1_2x1_intrawave_v3,354.26,147.48,0.0
80,8192,512,7168,torch.float8_e4m3fnuz,85,0,195.7643,a8w8_bpreshuffle_256x64x128x128_16x16_16x16_8x32x1_8x32x1_1x32x1x8_8x8x1_2x1_intrawave_v3,307.15,361.55,0.0
80,8192,576,7168,torch.float8_e4m3fnuz,93,0,191.4823,a8w8_bpreshuffle_256x64x192x128_16x16_16x16_8x32x1_8x32x1_1x32x1x8_8x8x1_2x1_intrawave_v3,353.27,377.51,0.0
80,8192,1280,8192,torch.float8_e4m3fnuz,71,0,452.4299,a8w8_bpreshuffle_256x128x128x64_16x16_16x16_4x64x1_4x64x1_1x32x1x8_8x8x1_2x1_intrawave_v3,379.72,217.86,0.0
80,8192,1536,7168,torch.float8_e4m3fnuz,72,0,501.1581,a8w8_bpreshuffle_256x64x256x64_16x16_16x16_4x64x1_4x64x1_1x16x1x16_8x8x1_1x2_intrawave_v1,359.94,189.35,0.0
80,8192,2112,7168,torch.float8_e4m3fnuz,68,0,649.3748,a8w8_bpreshuffle_256x128x192x128_16x16_16x16_8x32x1_8x32x1_1x32x1x8_8x8x1_2x1_intrawave_v3,381.96,167.03,0.0
80,8192,3072,1536,torch.float8_e4m3fnuz,71,0,235.4545,a8w8_bpreshuffle_256x128x128x64_16x16_16x16_4x64x1_4x64x1_1x32x1x8_8x8x1_2x1_intrawave_v3,328.34,287.25,0.0
80,8192,4096,512,torch.float8_e4m3fnuz,71,0,140.1016,a8w8_bpreshuffle_256x128x128x64_16x16_16x16_4x64x1_4x64x1_1x32x1x8_8x8x1_2x1_intrawave_v3,245.25,523.91,0.0
80,8192,4608,7168,torch.float8_e4m3fnuz,93,0,1405.0902,a8w8_bpreshuffle_256x64x192x128_16x16_16x16_8x32x1_8x32x1_1x32x1x8_8x8x1_2x1_intrawave_v3,385.15,119.03,0.0
80,8192,7168,256,torch.float8_e4m3fnuz,71,0,158.8437,a8w8_bpreshuffle_256x128x128x64_16x16_16x16_4x64x1_4x64x1_1x32x1x8_8x8x1_2x1_intrawave_v3,189.27,764.1,0.0
80,8192,7168,2048,torch.float8_e4m3fnuz,71,0,665.8308,a8w8_bpreshuffle_256x128x128x64_16x16_16x16_4x64x1_4x64x1_1x32x1x8_8x8x1_2x1_intrawave_v3,361.23,223.63,0.0
80,8192,7168,2304,torch.float8_e4m3fnuz,71,0,736.4592,a8w8_bpreshuffle_256x128x128x64_16x16_16x16_4x64x1_4x64x1_1x32x1x8_8x8x1_2x1_intrawave_v3,367.41,207.52,0.0
80,8192,8192,1024,torch.float8_e4m3fnuz,71,0,434.801,a8w8_bpreshuffle_256x128x128x64_16x16_16x16_4x64x1_4x64x1_1x32x1x8_8x8x1_2x1_intrawave_v3,316.1,347.27,0.0
80,16384,512,7168,torch.float8_e4m3fnuz,85,0,354.1062,a8w8_bpreshuffle_256x64x128x128_16x16_16x16_8x32x1_8x32x1_1x32x1x8_8x8x1_2x1_intrawave_v3,339.61,389.4,0.0
80,16384,576,7168,torch.float8_e4m3fnuz,68,0,372.1747,a8w8_bpreshuffle_256x128x192x128_16x16_16x16_8x32x1_8x32x1_1x32x1x8_8x8x1_2x1_intrawave_v3,363.52,377.36,0.0
80,16384,1280,8192,torch.float8_e4m3fnuz,71,0,902.6619,a8w8_bpreshuffle_256x128x128x64_16x16_16x16_4x64x1_4x64x1_1x32x1x8_8x8x1_2x1_intrawave_v3,380.65,206.77,0.0
80,16384,1536,7168,torch.float8_e4m3fnuz,68,0,940.0969,a8w8_bpreshuffle_256x128x192x128_16x16_16x16_8x32x1_8x32x1_1x32x1x8_8x8x1_2x1_intrawave_v3,383.77,190.17,0.0
80,16384,2112,7168,torch.float8_e4m3fnuz,93,0,1284.8613,a8w8_bpreshuffle_256x64x192x128_16x16_16x16_8x32x1_8x32x1_1x32x1x8_8x8x1_2x1_intrawave_v3,386.09,157.05,0.0
80,16384,3072,1536,torch.float8_e4m3fnuz,71,0,450.9699,a8w8_bpreshuffle_256x128x128x64_16x16_16x16_4x64x1_4x64x1_1x32x1x8_8x8x1_2x1_intrawave_v3,342.86,289.48,0.0
80,16384,4096,512,torch.float8_e4m3fnuz,71,0,268.2002,a8w8_bpreshuffle_256x128x128x64_16x16_16x16_4x64x1_4x64x1_1x32x1x8_8x8x1_2x1_intrawave_v3,256.22,539.54,0.0
80,16384,4608,4096,torch.float8_e4m3fnuz,93,0,1613.6388,a8w8_bpreshuffle_256x64x192x128_16x16_16x16_8x32x1_8x32x1_1x32x1x8_8x8x1_2x1_intrawave_v3,383.28,146.86,0.0
80,16384,4608,7168,torch.float8_e4m3fnuz,93,0,2770.8265,a8w8_bpreshuffle_256x64x192x128_16x16_16x16_8x32x1_8x32x1_1x32x1x8_8x8x1_2x1_intrawave_v3,390.62,108.8,0.0
80,16384,7168,256,torch.float8_e4m3fnuz,71,0,306.2344,a8w8_bpreshuffle_256x128x128x64_16x16_16x16_4x64x1_4x64x1_1x32x1x8_8x8x1_2x1_intrawave_v3,196.35,786.69,0.0
80,16384,7168,2048,torch.float8_e4m3fnuz,71,0,1322.9659,a8w8_bpreshuffle_256x128x128x64_16x16_16x16_4x64x1_4x64x1_1x32x1x8_8x8x1_2x1_intrawave_v3,363.6,214.0,0.0
80,16384,7168,2304,torch.float8_e4m3fnuz,71,0,1464.8949,a8w8_bpreshuffle_256x128x128x64_16x16_16x16_4x64x1_4x64x1_1x32x1x8_8x8x1_2x1_intrawave_v3,369.42,197.38,0.0
80,16384,8192,1024,torch.float8_e4m3fnuz,71,0,849.5169,a8w8_bpreshuffle_256x128x128x64_16x16_16x16_4x64x1_4x64x1_1x32x1x8_8x8x1_2x1_intrawave_v3,323.57,345.61,0.0
80,16384,9216,4096,torch.float8_e4m3fnuz,71,0,3218.0651,a8w8_bpreshuffle_256x128x128x64_16x16_16x16_4x64x1_4x64x1_1x32x1x8_8x8x1_2x1_intrawave_v3,384.38,126.43,0.0
80,20480,512,7168,torch.float8_e4m3fnuz,70,0,411.9813,a8w8_bpreshuffle_256x128x128x128_16x16_16x16_8x32x1_8x32x1_1x32x1x8_8x8x1_2x1_intrawave_v3,364.88,416.14,0.0
80,20480,576,7168,torch.float8_e4m3fnuz,68,0,439.759,a8w8_bpreshuffle_256x128x192x128_16x16_16x16_8x32x1_8x32x1_1x32x1x8_8x8x1_2x1_intrawave_v3,384.56,396.86,0.0
80,20480,1536,7168,torch.float8_e4m3fnuz,93,0,1157.9543,a8w8_bpreshuffle_256x64x192x128_16x16_16x16_8x32x1_8x32x1_1x32x1x8_8x8x1_2x1_intrawave_v3,389.46,190.62,0.0
80,20480,3072,1536,torch.float8_e4m3fnuz,71,0,557.954,a8w8_bpreshuffle_256x128x128x64_16x16_16x16_4x64x1_4x64x1_1x32x1x8_8x8x1_2x1_intrawave_v3,346.4,290.36,0.0
80,20480,4096,512,torch.float8_e4m3fnuz,71,0,331.5621,a8w8_bpreshuffle_256x128x128x64_16x16_16x16_4x64x1_4x64x1_1x32x1x8_8x8x1_2x1_intrawave_v3,259.07,543.96,0.0
80,20480,4608,7168,torch.float8_e4m3fnuz,68,0,3421.2891,a8w8_bpreshuffle_256x128x192x128_16x16_16x16_8x32x1_8x32x1_1x32x1x8_8x8x1_2x1_intrawave_v3,395.44,107.73,0.0
80,20480,7168,256,torch.float8_e4m3fnuz,71,0,381.5807,a8w8_bpreshuffle_256x128x128x64_16x16_16x16_4x64x1_4x64x1_1x32x1x8_8x8x1_2x1_intrawave_v3,196.98,787.98,0.0
80,20480,7168,2048,torch.float8_e4m3fnuz,71,0,1639.9077,a8w8_bpreshuffle_256x128x128x64_16x16_16x16_4x64x1_4x64x1_1x32x1x8_8x8x1_2x1_intrawave_v3,366.66,213.56,0.0
80,20480,7168,2304,torch.float8_e4m3fnuz,71,0,1805.4245,a8w8_bpreshuffle_256x128x128x64_16x16_16x16_4x64x1_4x64x1_1x32x1x8_8x8x1_2x1_intrawave_v3,374.68,197.9,0.0
80,32768,512,7168,torch.float8_e4m3fnuz,70,0,664.7692,a8w8_bpreshuffle_256x128x128x128_16x16_16x16_8x32x1_8x32x1_1x32x1x8_8x8x1_2x1_intrawave_v3,361.81,409.32,0.0
80,32768,2112,7168,torch.float8_e4m3fnuz,93,0,2566.2639,a8w8_bpreshuffle_256x64x192x128_16x16_16x16_8x32x1_8x32x1_1x32x1x8_8x8x1_2x1_intrawave_v3,386.61,151.36,0.0
80,32768,4096,512,torch.float8_e4m3fnuz,71,0,523.3298,a8w8_bpreshuffle_256x128x128x64_16x16_16x16_4x64x1_4x64x1_1x32x1x8_8x8x1_2x1_intrawave_v3,262.62,549.0,0.0
80,32768,4608,4096,torch.float8_e4m3fnuz,93,0,3207.2182,a8w8_bpreshuffle_256x64x192x128_16x16_16x16_8x32x1_8x32x1_1x32x1x8_8x8x1_2x1_intrawave_v3,385.68,141.89,0.0
80,32768,4608,7168,torch.float8_e4m3fnuz,68,0,5527.6346,a8w8_bpreshuffle_256x128x192x128_16x16_16x16_8x32x1_8x32x1_1x32x1x8_8x8x1_2x1_intrawave_v3,391.61,103.1,0.0
80,32768,7168,256,torch.float8_e4m3fnuz,71,0,600.9077,a8w8_bpreshuffle_256x128x128x64_16x16_16x16_4x64x1_4x64x1_1x32x1x8_8x8x1_2x1_intrawave_v3,200.13,798.77,0.0
80,32768,7168,2304,torch.float8_e4m3fnuz,71,0,2907.7206,a8w8_bpreshuffle_256x128x128x64_16x16_16x16_4x64x1_4x64x1_1x32x1x8_8x8x1_2x1_intrawave_v3,372.23,193.2,0.0
80,32768,9216,4096,torch.float8_e4m3fnuz,68,0,6437.3643,a8w8_bpreshuffle_256x128x192x128_16x16_16x16_8x32x1_8x32x1_1x32x1x8_8x8x1_2x1_intrawave_v3,384.3,120.54,0.0
256,1,800,5120,torch.float8_e4m3fn,10,0,11.3133,a8w8_bpreshuffle_128x16x32x512_16x16_16x16_32x4x1_32x4x1_1x16x1x8_4x4x1_1x1_intrawave_v1,0.72,362.65,0.0
256,1,1280,8192,torch.float8_e4m3fn,10,0,12.9809,a8w8_bpreshuffle_128x16x32x512_16x16_16x16_32x4x1_32x4x1_1x16x1x8_4x4x1_1x1_intrawave_v1,1.62,808.61,0.0
256,1,2304,16384,torch.float8_e4m3fn,10,0,28.7056,a8w8_bpreshuffle_128x16x32x512_16x16_16x16_32x4x1_32x4x1_1x16x1x8_4x4x1_1x1_intrawave_v1,2.63,1315.76,0.0
256,1,2560,8192,torch.float8_e4m3fn,10,0,12.8571,a8w8_bpreshuffle_128x16x32x512_16x16_16x16_32x4x1_32x4x1_1x16x1x8_4x4x1_1x1_intrawave_v1,3.26,1632.16,0.0
256,1,4608,16384,torch.float8_e4m3fn,10,0,29.8957,a8w8_bpreshuffle_128x16x32x512_16x16_16x16_32x4x1_32x4x1_1x16x1x8_4x4x1_1x1_intrawave_v1,5.05,2526.22,0.0
256,1,5120,640,torch.float8_e4m3fn,23,0,5.7466,a8w8_bpreshuffle_128x16x32x128_16x16_16x16_8x16x1_8x16x1_1x16x1x8_4x4x1_1x1_intrawave_v2,1.14,572.11,0.0
256,1,5120,1280,torch.float8_e4m3fn,108,0,6.8374,a8w8_bpreshuffle_256x16x64x256_16x16_16x16_16x16x1_16x16x1_1x16x1x16_4x4x1_1x1_intrawave_v1,1.92,960.18,0.0
256,1,5120,3200,torch.float8_e4m3fn,23,0,15.188,a8w8_bpreshuffle_128x16x32x128_16x16_16x16_8x16x1_8x16x1_1x16x1x8_4x4x1_1x1_intrawave_v2,2.16,1079.63,0.0
256,1,5120,5120,torch.float8_e4m3fn,10,0,11.7201,a8w8_bpreshuffle_128x16x32x512_16x16_16x16_32x4x1_32x4x1_1x16x1x8_4x4x1_1x1_intrawave_v1,4.47,2238.02,0.0
256,1,5120,6400,torch.float8_e4m3fn,108,0,19.1846,a8w8_bpreshuffle_256x16x64x256_16x16_16x16_16x16x1_16x16x1_1x16x1x16_4x4x1_1x1_intrawave_v1,3.42,1708.9,0.0
256,1,5120,25600,torch.float8_e4m3fn,10,0,46.1466,a8w8_bpreshuffle_128x16x32x512_16x16_16x16_32x4x1_32x4x1_1x16x1x8_4x4x1_1x1_intrawave_v1,5.68,2841.12,0.0
256,1,6400,5120,torch.float8_e4m3fn,24,0,12.5759,a8w8_bpreshuffle_128x16x32x512_16x16_16x16_32x4x1_32x4x1_1x16x1x8_4x4x1_1x1_intrawave_v2,5.21,2607.04,0.0
256,1,7168,8192,torch.float8_e4m3fn,24,0,15.0501,a8w8_bpreshuffle_128x16x32x512_16x16_16x16_32x4x1_32x4x1_1x16x1x8_4x4x1_1x1_intrawave_v2,7.8,3903.15,0.0
256,1,8192,1024,torch.float8_e4m3fn,108,0,5.9704,a8w8_bpreshuffle_256x16x64x256_16x16_16x16_16x16x1_16x16x1_1x16x1x16_4x4x1_1x1_intrawave_v1,2.81,1407.95,0.0
256,1,8192,2048,torch.float8_e4m3fn,10,0,5.8009,a8w8_bpreshuffle_128x16x32x512_16x16_16x16_32x4x1_32x4x1_1x16x1x8_4x4x1_1x1_intrawave_v1,5.78,2895.35,0.0
256,1,8192,3584,torch.float8_e4m3fn,10,0,7.8125,a8w8_bpreshuffle_128x16x32x512_16x16_16x16_32x4x1_32x4x1_1x16x1x8_4x4x1_1x1_intrawave_v1,7.52,3760.65,0.0
256,1,8192,7168,torch.float8_e4m3fn,24,0,13.9797,a8w8_bpreshuffle_128x16x32x512_16x16_16x16_32x4x1_32x4x1_1x16x1x8_4x4x1_1x1_intrawave_v2,8.4,4202.08,0.0
256,1,8192,8192,torch.float8_e4m3fn,10,0,14.8978,a8w8_bpreshuffle_128x16x32x512_16x16_16x16_32x4x1_32x4x1_1x16x1x8_4x4x1_1x1_intrawave_v1,9.01,4506.27,0.0
256,1,8192,28672,torch.float8_e4m3fn,10,0,46.0411,a8w8_bpreshuffle_128x16x32x512_16x16_16x16_32x4x1_32x4x1_1x16x1x8_4x4x1_1x1_intrawave_v1,10.2,5102.53,0.0
256,1,9216,16384,torch.float8_e4m3fn,10,0,35.2763,a8w8_bpreshuffle_128x16x32x512_16x16_16x16_32x4x1_32x4x1_1x16x1x8_4x4x1_1x1_intrawave_v1,8.56,4281.34,0.0
256,1,10240,8192,torch.float8_e4m3fn,10,0,16.9524,a8w8_bpreshuffle_128x16x32x512_16x16_16x16_32x4x1_32x4x1_1x16x1x8_4x4x1_1x1_intrawave_v1,9.9,4950.02,0.0
256,1,12800,5120,torch.float8_e4m3fn,10,0,14.7141,a8w8_bpreshuffle_128x16x32x512_16x16_16x16_32x4x1_32x4x1_1x16x1x8_4x4x1_1x1_intrawave_v1,8.91,4456.05,0.0
256,1,13312,16384,torch.float8_e4m3fn,10,0,40.7795,a8w8_bpreshuffle_128x16x32x512_16x16_16x16_32x4x1_32x4x1_1x16x1x8_4x4x1_1x1_intrawave_v1,10.7,5349.42,0.0
256,1,14336,8192,torch.float8_e4m3fn,10,0,21.766,a8w8_bpreshuffle_128x16x32x512_16x16_16x16_32x4x1_32x4x1_1x16x1x8_4x4x1_1x1_intrawave_v1,10.79,5397.29,0.0
256,1,16384,2048,torch.float8_e4m3fn,24,0,9.9256,a8w8_bpreshuffle_128x16x32x512_16x16_16x16_32x4x1_32x4x1_1x16x1x8_4x4x1_1x1_intrawave_v2,6.76,3384.1,0.0
256,1,16384,4096,torch.float8_e4m3fn,24,0,14.6481,a8w8_bpreshuffle_128x16x32x512_16x16_16x16_32x4x1_32x4x1_1x16x1x8_4x4x1_1x1_intrawave_v2,9.16,4583.92,0.0
256,1,16384,6656,torch.float8_e4m3fn,24,0,21.1312,a8w8_bpreshuffle_128x16x32x512_16x16_16x16_32x4x1_32x4x1_1x16x1x8_4x4x1_1x1_intrawave_v2,10.32,5162.57,0.0
256,1,16384,8192,torch.float8_e4m3fn,10,0,25.6037,a8w8_bpreshuffle_128x16x32x512_16x16_16x16_32x4x1_32x4x1_1x16x1x8_4x4x1_1x1_intrawave_v1,10.48,5243.72,0.0
256,1,16384,13312,torch.float8_e4m3fn,11,0,39.322,a8w8_bpreshuffle_256x16x64x512_16x16_16x16_32x8x1_32x8x1_1x16x1x16_4x4x1_1x1_intrawave_v1,11.09,5547.78,0.0
256,1,16384,26624,torch.float8_e4m3fn,5,0,73.9656,a8w8_bpreshuffle_256x16x64x512_16x16_16x16_32x8x1_32x8x1_1x16x1x16_4x4x1_1x1_intrawave_v1,11.79,5898.24,0.0
256,1,26624,16384,torch.float8_e4m3fn,6,0,76.8576,a8w8_bpreshuffle_256x16x128x512_16x16_16x16_32x8x1_32x8x1_1x16x1x16_8x8x1_1x2_intrawave_v1,11.35,5676.44,0.0
256,1,51200,5120,torch.float8_e4m3fn,16,0,45.1392,a8w8_bpreshuffle_256x16x128x256_16x16_16x16_16x16x1_16x16x1_1x16x1x16_8x8x1_1x2_intrawave_v1,11.61,5809.84,0.0
256,1,53248,16384,torch.float8_e4m3fn,23,0,150.2505,a8w8_bpreshuffle_128x16x32x128_16x16_16x16_8x16x1_8x16x1_1x16x1x8_4x4x1_1x1_intrawave_v2,11.61,5807.22,0.0
256,1,57344,8192,torch.float8_e4m3fn,9,0,77.922,a8w8_bpreshuffle_128x16x32x128_16x16_16x16_8x16x1_8x16x1_1x16x1x8_4x4x1_1x1_intrawave_v1,12.06,6030.2,0.0
256,4,16384,6656,torch.float8_e4m3fn,11,0,20.7235,a8w8_bpreshuffle_256x16x64x512_16x16_16x16_32x8x1_32x8x1_1x16x1x16_4x4x1_1x1_intrawave_v1,42.1,5269.84,0.0
256,8,6656,16384,torch.float8_e4m3fn,10,0,31.2392,a8w8_bpreshuffle_128x16x32x512_16x16_16x16_32x4x1_32x4x1_1x16x1x8_4x4x1_1x1_intrawave_v1,55.85,3498.47,0.0
256,8,16384,6656,torch.float8_e4m3fn,11,0,20.8171,a8w8_bpreshuffle_256x16x64x512_16x16_16x16_32x8x1_32x8x1_1x16x1x16_4x4x1_1x1_intrawave_v1,83.82,5253.72,0.0
256,16,800,5120,torch.float8_e4m3fn,24,0,10.5404,a8w8_bpreshuffle_128x16x32x512_16x16_16x16_32x4x1_32x4x1_1x16x1x8_4x4x1_1x1_intrawave_v2,12.44,398.8,0.0
256,16,1280,8192,torch.float8_e4m3fn,10,0,12.0223,a8w8_bpreshuffle_128x16x32x512_16x16_16x16_32x4x1_32x4x1_1x16x1x8_4x4x1_1x1_intrawave_v1,27.91,886.5,0.0
256,16,2304,16384,torch.float8_e4m3fn,24,0,24.7047,a8w8_bpreshuffle_128x16x32x512_16x16_16x16_32x4x1_32x4x1_1x16x1x8_4x4x1_1x1_intrawave_v2,48.9,1541.59,0.0
256,16,2560,8192,torch.float8_e4m3fn,10,0,11.95,a8w8_bpreshuffle_128x16x32x512_16x16_16x16_32x4x1_32x4x1_1x16x1x8_4x4x1_1x1_intrawave_v1,56.16,1772.76,0.0
256,16,4608,16384,torch.float8_e4m3fn,24,0,25.8456,a8w8_bpreshuffle_128x16x32x512_16x16_16x16_32x4x1_32x4x1_1x16x1x8_4x4x1_1x1_intrawave_v2,93.48,2936.94,0.0
256,16,5120,640,torch.float8_e4m3fn,23,0,5.7485,a8w8_bpreshuffle_128x16x32x128_16x16_16x16_8x16x1_8x16x1_1x16x1x8_4x4x1_1x1_intrawave_v2,18.24,600.31,0.0
256,16,5120,1280,torch.float8_e4m3fn,29,0,6.7718,a8w8_bpreshuffle_256x16x64x256_16x16_16x16_16x16x1_16x16x1_1x16x1x16_4x4x1_1x1_intrawave_v2,30.97,995.0,0.0
256,16,5120,3200,torch.float8_e4m3fn,23,0,14.71,a8w8_bpreshuffle_128x16x32x128_16x16_16x16_8x16x1_8x16x1_1x16x1x8_4x4x1_1x1_intrawave_v2,35.64,1128.42,0.0
256,16,5120,5120,torch.float8_e4m3fn,24,0,10.554,a8w8_bpreshuffle_128x16x32x512_16x16_16x16_32x4x1_32x4x1_1x16x1x8_4x4x1_1x1_intrawave_v2,79.48,2507.12,0.0
256,16,5120,6400,torch.float8_e4m3fn,15,0,19.3187,a8w8_bpreshuffle_256x16x64x256_16x16_16x16_16x16x1_16x16x1_1x16x1x16_4x4x1_1x1_intrawave_v1,54.28,1709.96,0.0
256,16,5120,25600,torch.float8_e4m3fn,24,0,39.1761,a8w8_bpreshuffle_128x16x32x512_16x16_16x16_32x4x1_32x4x1_1x16x1x8_4x4x1_1x1_intrawave_v2,107.06,3360.35,0.0
256,16,6400,5120,torch.float8_e4m3fn,10,0,11.3305,a8w8_bpreshuffle_128x16x32x512_16x16_16x16_32x4x1_32x4x1_1x16x1x8_4x4x1_1x1_intrawave_v1,92.54,2917.32,0.0
256,16,7168,8192,torch.float8_e4m3fn,10,0,13.6022,a8w8_bpreshuffle_128x16x32x512_16x16_16x16_32x4x1_32x4x1_1x16x1x8_4x4x1_1x1_intrawave_v1,138.14,4343.47,0.0
256,16,8192,1024,torch.float8_e4m3fn,15,0,5.9167,a8w8_bpreshuffle_256x16x64x256_16x16_16x16_16x16x1_16x16x1_1x16x1x16_4x4x1_1x1_intrawave_v1,45.37,1464.86,0.0
256,16,8192,2048,torch.float8_e4m3fn,10,0,5.6214,a8w8_bpreshuffle_128x16x32x512_16x16_16x16_32x4x1_32x4x1_1x16x1x8_4x4x1_1x1_intrawave_v1,95.5,3036.99,0.0
256,16,8192,3584,torch.float8_e4m3fn,10,0,7.8314,a8w8_bpreshuffle_128x16x32x512_16x16_16x16_32x4x1_32x4x1_1x16x1x8_4x4x1_1x1_intrawave_v1,119.97,3789.82,0.0
256,16,8192,7168,torch.float8_e4m3fn,10,0,12.5267,a8w8_bpreshuffle_128x16x32x512_16x16_16x16_32x4x1_32x4x1_1x16x1x8_4x4x1_1x1_intrawave_v1,150.0,4717.69,0.0
256,16,8192,8192,torch.float8_e4m3fn,10,0,13.9737,a8w8_bpreshuffle_128x16x32x512_16x16_16x16_32x4x1_32x4x1_1x16x1x8_4x4x1_1x1_intrawave_v1,153.68,4830.65,0.0
256,16,8192,28672,torch.float8_e4m3fn,10,0,41.1742,a8w8_bpreshuffle_128x16x32x512_16x16_16x16_32x4x1_32x4x1_1x16x1x8_4x4x1_1x1_intrawave_v1,182.55,5722.08,0.0
256,16,9216,16384,torch.float8_e4m3fn,24,0,32.3786,a8w8_bpreshuffle_128x16x32x512_16x16_16x16_32x4x1_32x4x1_1x16x1x8_4x4x1_1x1_intrawave_v2,149.23,4680.62,0.0
256,16,10240,8192,torch.float8_e4m3fn,10,0,17.892,a8w8_bpreshuffle_128x16x32x512_16x16_16x16_32x4x1_32x4x1_1x16x1x8_4x4x1_1x1_intrawave_v1,150.03,4714.11,0.0
256,16,12800,5120,torch.float8_e4m3fn,5,0,14.0716,a8w8_bpreshuffle_256x16x64x512_16x16_16x16_32x8x1_32x8x1_1x16x1x16_4x4x1_1x1_intrawave_v1,149.03,4692.25,0.0
256,16,13312,16384,torch.float8_e4m3fn,10,0,40.3808,a8w8_bpreshuffle_128x16x32x512_16x16_16x16_32x4x1_32x4x1_1x16x1x8_4x4x1_1x1_intrawave_v1,172.84,5418.22,0.0
256,16,14336,8192,torch.float8_e4m3fn,10,0,21.2685,a8w8_bpreshuffle_128x16x32x512_16x16_16x16_32x4x1_32x4x1_1x16x1x8_4x4x1_1x1_intrawave_v1,176.7,5549.54,0.0
256,16,16384,2048,torch.float8_e4m3fn,10,0,7.7604,a8w8_bpreshuffle_128x16x32x512_16x16_16x16_32x4x1_32x4x1_1x16x1x8_4x4x1_1x1_intrawave_v1,138.36,4395.58,0.0
256,16,16384,4096,torch.float8_e4m3fn,26,0,17.4151,a8w8_bpreshuffle_256x32x64x512_16x16_16x16_32x8x1_32x8x1_1x32x1x8_8x8x1_1x2_intrawave_v2,123.31,3887.36,0.0
256,16,16384,6656,torch.float8_e4m3fn,24,0,20.8707,a8w8_bpreshuffle_128x16x32x512_16x16_16x16_32x4x1_32x4x1_1x16x1x8_4x4x1_1x1_intrawave_v2,167.2,5255.34,0.0
256,16,16384,8192,torch.float8_e4m3fn,10,0,25.0145,a8w8_bpreshuffle_128x16x32x512_16x16_16x16_32x4x1_32x4x1_1x16x1x8_4x4x1_1x1_intrawave_v1,171.7,5391.8,0.0
256,16,16384,13312,torch.float8_e4m3fn,5,0,37.8531,a8w8_bpreshuffle_256x16x64x512_16x16_16x16_32x8x1_32x8x1_1x16x1x16_4x4x1_1x1_intrawave_v1,184.38,5781.33,0.0
256,16,16384,26624,torch.float8_e4m3fn,11,0,72.6906,a8w8_bpreshuffle_256x16x64x512_16x16_16x16_32x8x1_32x8x1_1x16x1x16_4x4x1_1x1_intrawave_v1,192.03,6013.95,0.0
256,16,26624,16384,torch.float8_e4m3fn,6,0,77.3342,a8w8_bpreshuffle_256x16x128x512_16x16_16x16_32x8x1_32x8x1_1x16x1x16_8x8x1_1x2_intrawave_v1,180.5,5654.96,0.0
256,16,51200,5120,torch.float8_e4m3fn,17,0,46.1585,a8w8_bpreshuffle_256x16x256x256_16x16_16x16_16x16x1_16x16x1_1x16x1x16_8x8x1_1x2_intrawave_v1,181.73,5716.48,0.0
256,16,53248,16384,torch.float8_e4m3fn,31,0,151.3677,a8w8_bpreshuffle_256x16x256x256_16x16_16x16_16x16x1_16x16x1_1x16x1x16_8x8x1_1x2_intrawave_v2,184.43,5776.54,0.0
256,16,57344,8192,torch.float8_e4m3fn,23,0,79.5497,a8w8_bpreshuffle_128x16x32x128_16x16_16x16_8x16x1_8x16x1_1x16x1x8_4x4x1_1x1_intrawave_v2,188.97,5929.98,0.0
256,32,800,5120,torch.float8_e4m3fn,24,0,10.2279,a8w8_bpreshuffle_128x16x32x512_16x16_16x16_32x4x1_32x4x1_1x16x1x8_4x4x1_1x1_intrawave_v2,25.63,421.5,0.0
256,32,1280,8192,torch.float8_e4m3fn,10,0,11.3752,a8w8_bpreshuffle_128x16x32x512_16x16_16x16_32x4x1_32x4x1_1x16x1x8_4x4x1_1x1_intrawave_v1,59.0,952.06,0.0
256,32,2304,16384,torch.float8_e4m3fn,24,0,25.2915,a8w8_bpreshuffle_128x16x32x512_16x16_16x16_32x4x1_32x4x1_1x16x1x8_4x4x1_1x1_intrawave_v2,95.52,1519.11,0.0
256,32,2560,8192,torch.float8_e4m3fn,10,0,12.0316,a8w8_bpreshuffle_128x16x32x512_16x16_16x16_32x4x1_32x4x1_1x16x1x8_4x4x1_1x1_intrawave_v1,111.55,1778.44,0.0
256,32,4608,16384,torch.float8_e4m3fn,24,0,29.2704,a8w8_bpreshuffle_128x16x32x512_16x16_16x16_32x4x1_32x4x1_1x16x1x8_4x4x1_1x1_intrawave_v2,165.08,2607.3,0.0
256,32,5120,640,torch.float8_e4m3fn,23,0,6.4386,a8w8_bpreshuffle_128x16x32x128_16x16_16x16_8x16x1_8x16x1_1x16x1x8_4x4x1_1x1_intrawave_v2,32.57,563.0,0.0
256,32,5120,1280,torch.float8_e4m3fn,29,0,6.9951,a8w8_bpreshuffle_256x16x64x256_16x16_16x16_16x16x1_16x16x1_1x16x1x16_4x4x1_1x1_intrawave_v2,59.96,989.58,0.0
256,32,5120,3200,torch.float8_e4m3fn,9,0,15.6619,a8w8_bpreshuffle_128x16x32x128_16x16_16x16_8x16x1_8x16x1_1x16x1x8_4x4x1_1x1_intrawave_v1,66.95,1073.57,0.0
256,32,5120,5120,torch.float8_e4m3fn,11,0,11.6951,a8w8_bpreshuffle_256x16x64x512_16x16_16x16_32x8x1_32x8x1_1x16x1x16_4x4x1_1x1_intrawave_v1,143.46,2283.51,0.0
256,32,5120,6400,torch.float8_e4m3fn,15,0,19.3178,a8w8_bpreshuffle_256x16x64x256_16x16_16x16_16x16x1_16x16x1_1x16x1x16_4x4x1_1x1_intrawave_v1,108.56,1723.82,0.0
256,32,5120,25600,torch.float8_e4m3fn,24,0,44.1556,a8w8_bpreshuffle_128x16x32x512_16x16_16x16_32x4x1_32x4x1_1x16x1x8_4x4x1_1x1_intrawave_v2,189.98,2994.39,0.0
256,32,6400,5120,torch.float8_e4m3fn,5,0,12.3982,a8w8_bpreshuffle_256x16x64x512_16x16_16x16_32x8x1_32x8x1_1x16x1x16_4x4x1_1x1_intrawave_v1,169.15,2689.22,0.0
256,32,7168,8192,torch.float8_e4m3fn,11,0,15.5322,a8w8_bpreshuffle_256x16x64x512_16x16_16x16_32x8x1_32x8x1_1x16x1x16_4x4x1_1x1_intrawave_v1,241.96,3826.96,0.0
256,32,8192,1024,torch.float8_e4m3fn,108,0,6.0451,a8w8_bpreshuffle_256x16x64x256_16x16_16x16_16x16x1_16x16x1_1x16x1x16_4x4x1_1x1_intrawave_v1,88.81,1479.82,0.0
256,32,8192,2048,torch.float8_e4m3fn,5,0,6.2663,a8w8_bpreshuffle_256x16x64x512_16x16_16x16_32x8x1_32x8x1_1x16x1x16_4x4x1_1x1_intrawave_v1,171.35,2771.5,0.0
256,32,8192,3584,torch.float8_e4m3fn,5,0,7.9538,a8w8_bpreshuffle_256x16x64x512_16x16_16x16_32x8x1_32x8x1_1x16x1x16_4x4x1_1x1_intrawave_v1,236.25,3771.67,0.0
256,32,8192,7168,torch.float8_e4m3fn,11,0,14.5895,a8w8_bpreshuffle_256x16x64x512_16x16_16x16_32x8x1_32x8x1_1x16x1x16_4x4x1_1x1_intrawave_v1,257.59,4076.49,0.0
256,32,8192,8192,torch.float8_e4m3fn,5,0,15.7818,a8w8_bpreshuffle_256x16x64x512_16x16_16x16_32x8x1_32x8x1_1x16x1x16_4x4x1_1x1_intrawave_v1,272.15,4302.13,0.0
256,32,8192,28672,torch.float8_e4m3fn,5,0,47.2548,a8w8_bpreshuffle_256x16x64x512_16x16_16x16_32x8x1_32x8x1_1x16x1x16_4x4x1_1x1_intrawave_v1,318.11,5001.03,0.0
256,32,9216,16384,torch.float8_e4m3fn,24,0,39.3729,a8w8_bpreshuffle_128x16x32x512_16x16_16x16_32x4x1_32x4x1_1x16x1x8_4x4x1_1x1_intrawave_v2,245.44,3863.29,0.0
256,32,10240,8192,torch.float8_e4m3fn,10,0,22.5861,a8w8_bpreshuffle_128x16x32x512_16x16_16x16_32x4x1_32x4x1_1x16x1x8_4x4x1_1x1_intrawave_v1,237.7,3754.68,0.0
256,32,12800,5120,torch.float8_e4m3fn,12,0,17.5533,a8w8_bpreshuffle_256x32x64x512_16x16_16x16_32x8x1_32x8x1_1x32x1x8_8x8x1_1x2_intrawave_v1,238.95,3789.55,0.0
256,32,13312,16384,torch.float8_e4m3fn,12,0,46.3062,a8w8_bpreshuffle_256x32x64x512_16x16_16x16_32x8x1_32x8x1_1x32x1x8_8x8x1_1x2_intrawave_v1,301.44,4739.76,0.0
256,32,14336,8192,torch.float8_e4m3fn,6,0,26.4468,a8w8_bpreshuffle_256x16x128x512_16x16_16x16_32x8x1_32x8x1_1x16x1x16_8x8x1_1x2_intrawave_v1,284.2,4485.24,0.0
256,32,16384,2048,torch.float8_e4m3fn,6,0,9.6867,a8w8_bpreshuffle_256x16x128x512_16x16_16x16_32x8x1_32x8x1_1x16x1x16_8x8x1_1x2_intrawave_v1,221.69,3578.98,0.0
256,32,16384,4096,torch.float8_e4m3fn,26,0,17.6799,a8w8_bpreshuffle_256x32x64x512_16x16_16x16_32x8x1_32x8x1_1x32x1x8_8x8x1_1x2_intrawave_v2,242.93,3862.49,0.0
256,32,16384,6656,torch.float8_e4m3fn,12,0,23.1146,a8w8_bpreshuffle_256x32x64x512_16x16_16x16_32x8x1_32x8x1_1x32x1x8_8x8x1_1x2_intrawave_v1,301.94,4772.46,0.0
256,32,16384,8192,torch.float8_e4m3fn,19,0,28.8166,a8w8_bpreshuffle_256x16x64x512_16x16_16x16_32x8x1_32x8x1_1x16x1x16_4x4x1_1x1_intrawave_v2,298.09,4703.14,0.0
256,32,16384,13312,torch.float8_e4m3fn,12,0,40.7803,a8w8_bpreshuffle_256x32x64x512_16x16_16x16_32x8x1_32x8x1_1x32x1x8_8x8x1_1x2_intrawave_v1,342.29,5384.42,0.0
256,32,16384,26624,torch.float8_e4m3fn,12,0,77.4146,a8w8_bpreshuffle_256x32x64x512_16x16_16x16_32x8x1_32x8x1_1x32x1x8_8x8x1_1x2_intrawave_v1,360.62,5659.24,0.0
256,32,26624,16384,torch.float8_e4m3fn,119,0,80.3452,a8w8_bpreshuffle_256x32x128x256_16x16_16x16_16x16x1_16x16x1_1x16x1x16_8x8x1_1x2_intrawave_v1,347.47,5456.9,0.0
256,32,51200,5120,torch.float8_e4m3fn,133,0,47.8343,a8w8_bpreshuffle_256x32x256x256_16x16_16x16_16x16x1_16x16x1_1x16x1x16_8x8x1_1x2_intrawave_v1,350.74,5552.18,0.0
256,32,53248,16384,torch.float8_e4m3fn,136,0,154.4861,a8w8_bpreshuffle_256x80x256x256_16x16_16x16_16x16x1_16x16x1_1x16x1x16_8x8x1_1x2_intrawave_v3,361.42,5672.66,0.0
256,32,57344,8192,torch.float8_e4m3fn,85,0,86.5188,a8w8_bpreshuffle_256x64x128x128_16x16_16x16_8x32x1_8x32x1_1x32x1x8_8x8x1_2x1_intrawave_v3,347.49,5475.04,0.0
256,64,192,1024,torch.float8_e4m3fn,15,0,4.5229,a8w8_bpreshuffle_256x16x64x256_16x16_16x16_16x16x1_16x16x1_1x16x1x16_4x4x1_1x1_intrawave_v1,5.56,63.39,0.0
256,64,800,5120,torch.float8_e4m3fn,10,0,10.5456,a8w8_bpreshuffle_128x16x32x512_16x16_16x16_32x4x1_32x4x1_1x16x1x8_4x4x1_1x1_intrawave_v1,49.72,429.19,0.0
256,64,1280,8192,torch.float8_e4m3fn,10,0,11.9979,a8w8_bpreshuffle_128x16x32x512_16x16_16x16_32x4x1_32x4x1_1x16x1x8_4x4x1_1x1_intrawave_v1,111.87,931.32,0.0
256,64,2304,16384,torch.float8_e4m3fn,19,0,27.9421,a8w8_bpreshuffle_256x16x64x512_16x16_16x16_32x8x1_32x8x1_1x16x1x16_4x4x1_1x1_intrawave_v2,172.92,1399.04,0.0
256,64,2560,8192,torch.float8_e4m3fn,5,0,12.8533,a8w8_bpreshuffle_256x16x64x512_16x16_16x16_32x8x1_32x8x1_1x16x1x16_4x4x1_1x1_intrawave_v1,208.85,1697.89,0.0
256,64,4608,16384,torch.float8_e4m3fn,10,0,36.4754,a8w8_bpreshuffle_128x16x32x512_16x16_16x16_32x4x1_32x4x1_1x16x1x8_4x4x1_1x1_intrawave_v1,264.94,2114.74,0.0
256,64,5120,640,torch.float8_e4m3fn,23,0,6.7207,a8w8_bpreshuffle_128x16x32x128_16x16_16x16_8x16x1_8x16x1_1x16x1x8_4x4x1_1x1_intrawave_v2,62.41,591.18,0.0
256,64,5120,1280,torch.float8_e4m3fn,29,0,7.6564,a8w8_bpreshuffle_256x16x64x256_16x16_16x16_16x16x1_16x16x1_1x16x1x16_4x4x1_1x1_intrawave_v2,109.56,952.26,0.0
256,64,5120,3200,torch.float8_e4m3fn,23,0,15.6284,a8w8_bpreshuffle_128x16x32x128_16x16_16x16_8x16x1_8x16x1_1x16x1x8_4x4x1_1x1_intrawave_v2,134.19,1103.39,0.0
256,64,5120,5120,torch.float8_e4m3fn,10,0,14.3407,a8w8_bpreshuffle_128x16x32x512_16x16_16x16_32x4x1_32x4x1_1x16x1x8_4x4x1_1x1_intrawave_v1,233.98,1896.52,0.0
256,64,5120,6400,torch.float8_e4m3fn,15,0,19.7146,a8w8_bpreshuffle_256x16x64x256_16x16_16x16_16x16x1_16x16x1_1x16x1x16_4x4x1_1x1_intrawave_v1,212.75,1716.14,0.0
256,64,5120,25600,torch.float8_e4m3fn,24,0,52.8565,a8w8_bpreshuffle_128x16x32x512_16x16_16x16_32x4x1_32x4x1_1x16x1x8_4x4x1_1x1_intrawave_v2,317.41,2523.17,0.0
256,64,6400,5120,torch.float8_e4m3fn,12,0,14.7961,a8w8_bpreshuffle_256x32x64x512_16x16_16x16_32x8x1_32x8x1_1x32x1x8_8x8x1_1x2_intrawave_v1,283.47,2292.15,0.0
256,64,7168,8192,torch.float8_e4m3fn,12,0,20.6714,a8w8_bpreshuffle_256x32x64x512_16x16_16x16_32x8x1_32x8x1_1x32x1x8_8x8x1_1x2_intrawave_v1,363.6,2910.4,0.0
256,64,8192,2048,torch.float8_e4m3fn,5,0,7.5112,a8w8_bpreshuffle_256x16x64x512_16x16_16x16_32x8x1_32x8x1_1x16x1x16_4x4x1_1x1_intrawave_v1,285.9,2390.68,0.0
256,64,8192,3584,torch.float8_e4m3fn,12,0,11.0813,a8w8_bpreshuffle_256x32x64x512_16x16_16x16_32x8x1_32x8x1_1x32x1x8_8x8x1_1x2_intrawave_v1,339.14,2764.85,0.0
256,64,8192,7168,torch.float8_e4m3fn,12,0,19.2039,a8w8_bpreshuffle_256x32x64x512_16x16_16x16_32x8x1_32x8x1_1x32x1x8_8x8x1_1x2_intrawave_v1,391.39,3136.22,0.0
256,64,8192,8192,torch.float8_e4m3fn,12,0,21.1081,a8w8_bpreshuffle_256x32x64x512_16x16_16x16_32x8x1_32x8x1_1x32x1x8_8x8x1_1x2_intrawave_v1,406.95,3253.81,0.0
256,64,8192,28672,torch.float8_e4m3fn,12,0,64.9256,a8w8_bpreshuffle_256x32x64x512_16x16_16x16_32x8x1_32x8x1_1x32x1x8_8x8x1_1x2_intrawave_v1,463.06,3662.11,0.0
256,64,9216,16384,torch.float8_e4m3fn,114,0,56.6696,a8w8_bpreshuffle_256x64x64x256_16x16_16x16_16x16x1_16x16x1_1x32x1x8_8x8x1_2x1_intrawave_v3,341.05,2703.8,0.0
256,64,10240,8192,torch.float8_e4m3fn,114,0,25.5687,a8w8_bpreshuffle_256x64x64x256_16x16_16x16_16x16x1_16x16x1_1x32x1x8_8x8x1_2x1_intrawave_v3,419.94,3352.58,0.0
256,64,12800,5120,torch.float8_e4m3fn,119,0,21.9262,a8w8_bpreshuffle_256x32x128x256_16x16_16x16_16x16x1_16x16x1_1x16x1x16_8x8x1_1x2_intrawave_v1,382.58,3078.6,0.0
256,64,13312,16384,torch.float8_e4m3fn,114,0,60.16,a8w8_bpreshuffle_256x64x64x256_16x16_16x16_16x16x1_16x16x1_1x32x1x8_8x8x1_2x1_intrawave_v3,464.05,3671.15,0.0
256,64,14336,8192,torch.float8_e4m3fn,114,0,29.5848,a8w8_bpreshuffle_256x64x64x256_16x16_16x16_16x16x1_16x16x1_1x32x1x8_8x8x1_2x1_intrawave_v3,508.11,4049.37,0.0
256,64,16384,2048,torch.float8_e4m3fn,119,0,11.4341,a8w8_bpreshuffle_256x32x128x256_16x16_16x16_16x16x1_16x16x1_1x16x1x16_8x8x1_1x2_intrawave_v1,375.63,3129.47,0.0
256,64,16384,4096,torch.float8_e4m3fn,119,0,20.8735,a8w8_bpreshuffle_256x32x128x256_16x16_16x16_16x16x1_16x16x1_1x16x1x16_8x8x1_1x2_intrawave_v1,411.52,3328.06,0.0
256,64,16384,6656,torch.float8_e4m3fn,119,0,29.3009,a8w8_bpreshuffle_256x32x128x256_16x16_16x16_16x16x1_16x16x1_1x16x1x16_8x8x1_1x2_intrawave_v1,476.39,3807.9,0.0
256,64,16384,8192,torch.float8_e4m3fn,119,0,35.6664,a8w8_bpreshuffle_256x32x128x256_16x16_16x16_16x16x1_16x16x1_1x16x1x16_8x8x1_1x2_intrawave_v1,481.68,3836.64,0.0
256,64,16384,13312,torch.float8_e4m3fn,119,0,53.1879,a8w8_bpreshuffle_256x32x128x256_16x16_16x16_16x16x1_16x16x1_1x16x1x16_8x8x1_1x2_intrawave_v1,524.88,4156.08,0.0
256,64,16384,26624,torch.float8_e4m3fn,119,0,102.4795,a8w8_bpreshuffle_256x32x128x256_16x16_16x16_16x16x1_16x16x1_1x16x1x16_8x8x1_1x2_intrawave_v1,544.84,4293.63,0.0
256,64,26624,16384,torch.float8_e4m3fn,121,0,91.6538,a8w8_bpreshuffle_256x64x128x256_16x16_16x16_16x16x1_16x16x1_1x16x1x16_8x8x1_1x2_intrawave_v3,609.19,4807.92,0.0
256,64,51200,5120,torch.float8_e4m3fn,135,0,54.3316,a8w8_bpreshuffle_256x64x256x256_16x16_16x16_16x16x1_16x16x1_1x16x1x16_8x8x1_1x2_intrawave_v3,617.59,4951.54,0.0
256,64,53248,16384,torch.float8_e4m3fn,135,0,156.5996,a8w8_bpreshuffle_256x64x256x256_16x16_16x16_16x16x1_16x16x1_1x16x1x16_8x8x1_1x2_intrawave_v3,713.09,5621.21,0.0
256,64,57344,8192,torch.float8_e4m3fn,85,0,87.6062,a8w8_bpreshuffle_256x64x128x128_16x16_16x16_8x32x1_8x32x1_1x32x1x8_8x8x1_2x1_intrawave_v3,686.36,5451.97,0.0
256,128,800,5120,torch.float8_e4m3fn,24,0,9.9852,a8w8_bpreshuffle_128x16x32x512_16x16_16x16_32x4x1_32x4x1_1x16x1x8_4x4x1_1x1_intrawave_v2,105.01,496.35,0.0
256,128,1280,8192,torch.float8_e4m3fn,5,0,12.228,a8w8_bpreshuffle_256x16x64x512_16x16_16x16_32x8x1_32x8x1_1x16x1x16_4x4x1_1x1_intrawave_v1,219.53,970.07,0.0
256,128,2304,16384,torch.float8_e4m3fn,24,0,33.0153,a8w8_bpreshuffle_128x16x32x512_16x16_16x16_32x4x1_32x4x1_1x16x1x8_4x4x1_1x1_intrawave_v2,292.7,1224.76,0.0
256,128,2560,8192,torch.float8_e4m3fn,10,0,17.8034,a8w8_bpreshuffle_128x16x32x512_16x16_16x16_32x4x1_32x4x1_1x16x1x8_4x4x1_1x1_intrawave_v1,301.56,1273.66,0.0
256,128,4608,16384,torch.float8_e4m3fn,108,0,54.3179,a8w8_bpreshuffle_256x16x64x256_16x16_16x16_16x16x1_16x16x1_1x16x1x16_4x4x1_1x1_intrawave_v1,355.82,1450.25,0.0
256,128,5120,640,torch.float8_e4m3fn,23,0,6.3513,a8w8_bpreshuffle_128x16x32x128_16x16_16x16_8x16x1_8x16x1_1x16x1x8_4x4x1_1x1_intrawave_v2,132.08,735.19,0.0
256,128,5120,1280,torch.float8_e4m3fn,29,0,7.7817,a8w8_bpreshuffle_256x16x64x256_16x16_16x16_16x16x1_16x16x1_1x16x1x16_4x4x1_1x1_intrawave_v2,215.6,1031.67,0.0
256,128,5120,3200,torch.float8_e4m3fn,23,0,16.0101,a8w8_bpreshuffle_128x16x32x128_16x16_16x16_8x16x1_8x16x1_1x16x1x8_4x4x1_1x1_intrawave_v2,261.98,1130.81,0.0
256,128,5120,5120,torch.float8_e4m3fn,108,0,19.63,a8w8_bpreshuffle_256x16x64x256_16x16_16x16_16x16x1_16x16x1_1x16x1x16_4x4x1_1x1_intrawave_v1,341.87,1435.58,0.0
256,128,5120,6400,torch.float8_e4m3fn,29,0,22.9859,a8w8_bpreshuffle_256x16x64x256_16x16_16x16_16x16x1_16x16x1_1x16x1x16_4x4x1_1x1_intrawave_v2,364.95,1518.23,0.0
256,128,5120,25600,torch.float8_e4m3fn,114,0,83.5847,a8w8_bpreshuffle_256x64x64x256_16x16_16x16_16x16x1_16x16x1_1x32x1x8_8x8x1_2x1_intrawave_v3,401.44,1623.02,0.0
256,128,6400,5120,torch.float8_e4m3fn,114,0,20.5908,a8w8_bpreshuffle_256x64x64x256_16x16_16x16_16x16x1_16x16x1_1x32x1x8_8x8x1_2x1_intrawave_v3,407.4,1702.79,0.0
256,128,7168,8192,torch.float8_e4m3fn,114,0,23.7352,a8w8_bpreshuffle_256x64x64x256_16x16_16x16_16x16x1_16x16x1_1x32x1x8_8x8x1_2x1_intrawave_v3,633.34,2595.46,0.0
256,128,8192,1024,torch.float8_e4m3fn,119,0,6.9407,a8w8_bpreshuffle_256x32x128x256_16x16_16x16_16x16x1_16x16x1_1x16x1x16_8x8x1_1x2_intrawave_v1,309.4,1529.65,0.0
256,128,8192,2048,torch.float8_e4m3fn,114,0,8.8614,a8w8_bpreshuffle_256x64x64x256_16x16_16x16_16x16x1_16x16x1_1x32x1x8_8x8x1_2x1_intrawave_v3,484.68,2159.54,0.0
256,128,8192,3584,torch.float8_e4m3fn,114,0,12.978,a8w8_bpreshuffle_256x64x64x256_16x16_16x16_16x16x1_16x16x1_1x32x1x8_8x8x1_2x1_intrawave_v3,579.15,2459.24,0.0
256,128,8192,7168,torch.float8_e4m3fn,114,0,21.6976,a8w8_bpreshuffle_256x64x64x256_16x16_16x16_16x16x1_16x16x1_1x32x1x8_8x8x1_2x1_intrawave_v3,692.81,2845.24,0.0
256,128,8192,8192,torch.float8_e4m3fn,114,0,24.8294,a8w8_bpreshuffle_256x64x64x256_16x16_16x16_16x16x1_16x16x1_1x32x1x8_8x8x1_2x1_intrawave_v3,691.92,2829.49,0.0
256,128,8192,28672,torch.float8_e4m3fn,114,0,75.1872,a8w8_bpreshuffle_256x64x64x256_16x16_16x16_16x16x1_16x16x1_1x32x1x8_8x8x1_2x1_intrawave_v3,799.73,3200.65,0.0
256,128,9216,16384,torch.float8_e4m3fn,126,0,72.8197,a8w8_bpreshuffle_256x32x192x256_16x16_16x16_16x16x1_16x16x1_1x32x1x8_8x8x1_2x1_intrawave_v1,530.83,2134.74,0.0
256,128,10240,8192,torch.float8_e4m3fn,113,0,30.4124,a8w8_bpreshuffle_256x48x64x256_16x16_16x16_16x16x1_16x16x1_1x16x1x16_4x4x1_1x1_intrawave_v1,706.12,2878.96,0.0
256,128,12800,5120,torch.float8_e4m3fn,65,0,28.9421,a8w8_bpreshuffle_256x128x64x256_16x16_16x16_16x16x1_16x16x1_1x32x1x8_8x8x1_2x1_intrawave_v3,579.68,2400.25,0.0
256,128,13312,16384,torch.float8_e4m3fn,144,0,79.9061,a8w8_bpreshuffle_256x128x64x256_16x16_16x16_16x16x1_16x16x1_1x32x1x8_8x8x1_2x1_intrawave_v3,698.75,2798.4,0.0
256,128,14336,8192,torch.float8_e4m3fn,144,0,36.1842,a8w8_bpreshuffle_256x128x64x256_16x16_16x16_16x16x1_16x16x1_1x32x1x8_8x8x1_2x1_intrawave_v3,830.88,3376.03,0.0
256,128,16384,2048,torch.float8_e4m3fn,119,0,15.5043,a8w8_bpreshuffle_256x32x128x256_16x16_16x16_16x16x1_16x16x1_1x16x1x16_8x8x1_1x2_intrawave_v1,554.04,2451.63,0.0
256,128,16384,4096,torch.float8_e4m3fn,121,0,26.5935,a8w8_bpreshuffle_256x64x128x256_16x16_16x16_16x16x1_16x16x1_1x16x1x16_8x8x1_1x2_intrawave_v3,646.02,2700.94,0.0
256,128,16384,6656,torch.float8_e4m3fn,65,0,39.0387,a8w8_bpreshuffle_256x128x64x256_16x16_16x16_16x16x1_16x16x1_1x32x1x8_8x8x1_2x1_intrawave_v3,715.12,2922.69,0.0
256,128,16384,8192,torch.float8_e4m3fn,121,0,45.9107,a8w8_bpreshuffle_256x64x128x256_16x16_16x16_16x16x1_16x16x1_1x16x1x16_8x8x1_1x2_intrawave_v3,748.4,3037.65,0.0
256,128,16384,13312,torch.float8_e4m3fn,65,0,70.6454,a8w8_bpreshuffle_256x128x64x256_16x16_16x16_16x16x1_16x16x1_1x32x1x8_8x8x1_2x1_intrawave_v3,790.35,3170.79,0.0
256,128,16384,26624,torch.float8_e4m3fn,144,0,134.0597,a8w8_bpreshuffle_256x128x64x256_16x16_16x16_16x16x1_16x16x1_1x32x1x8_8x8x1_2x1_intrawave_v3,832.98,3310.54,0.0
256,128,26624,16384,torch.float8_e4m3fn,139,0,108.1175,a8w8_bpreshuffle_256x128x128x256_16x16_16x16_16x16x1_16x16x1_1x16x1x16_8x8x1_1x2_intrawave_v3,1032.85,4117.01,0.0
256,128,51200,5120,torch.float8_e4m3fn,154,0,65.6842,a8w8_bpreshuffle_256x128x256x256_16x16_16x16_16x16x1_16x16x1_1x16x1x16_8x8x1_1x2_intrawave_v3,1021.69,4200.5,0.0
256,128,53248,16384,torch.float8_e4m3fn,154,0,184.7497,a8w8_bpreshuffle_256x128x256x256_16x16_16x16_16x16x1_16x16x1_1x16x1x16_8x8x1_1x2_intrawave_v3,1208.87,4807.28,0.0
256,128,57344,8192,torch.float8_e4m3fn,54,0,95.8445,a8w8_bpreshuffle_256x160x256x128_16x16_16x16_8x32x1_8x32x1_1x32x1x8_8x8x1_2x1_intrawave_v3,1254.73,5065.4,0.0
256,256,800,5120,torch.float8_e4m3fn,24,0,11.6817,a8w8_bpreshuffle_128x16x32x512_16x16_16x16_32x4x1_32x4x1_1x16x1x8_4x4x1_1x1_intrawave_v2,179.52,497.9,0.0
256,256,1280,8192,torch.float8_e4m3fn,12,0,17.1516,a8w8_bpreshuffle_256x32x64x512_16x16_16x16_32x8x1_32x8x1_1x32x1x8_8x8x1_1x2_intrawave_v1,313.02,771.84,0.0
256,256,2304,16384,torch.float8_e4m3fn,15,0,52.6426,a8w8_bpreshuffle_256x16x64x256_16x16_16x16_16x16x1_16x16x1_1x16x1x16_4x4x1_1x1_intrawave_v1,367.14,819.16,0.0
256,256,2560,8192,torch.float8_e4m3fn,114,0,21.4545,a8w8_bpreshuffle_256x64x64x256_16x16_16x16_16x16x1_16x16x1_1x32x1x8_8x8x1_2x1_intrawave_v3,500.47,1136.33,0.0
256,256,4608,16384,torch.float8_e4m3fn,116,0,68.5478,a8w8_bpreshuffle_256x96x64x256_16x16_16x16_16x16x1_16x16x1_1x32x1x8_8x8x1_2x1_intrawave_v3,563.91,1196.99,0.0
256,256,5120,640,torch.float8_e4m3fn,76,0,7.7921,a8w8_bpreshuffle_256x32x64x128_16x16_16x16_8x32x1_8x32x1_1x32x1x8_8x8x1_2x1_intrawave_v1,215.31,777.98,0.0
256,256,5120,1280,torch.float8_e4m3fn,119,0,10.1726,a8w8_bpreshuffle_256x32x128x256_16x16_16x16_16x16x1_16x16x1_1x16x1x16_8x8x1_1x2_intrawave_v1,329.85,934.15,0.0
256,256,5120,3200,torch.float8_e4m3fn,77,0,19.1458,a8w8_bpreshuffle_256x64x64x128_16x16_16x16_8x32x1_8x32x1_1x32x1x8_8x8x1_2x1_intrawave_v3,438.14,1035.46,0.0
256,256,5120,5120,torch.float8_e4m3fn,116,0,25.9267,a8w8_bpreshuffle_256x96x64x256_16x16_16x16_16x16x1_16x16x1_1x32x1x8_8x8x1_2x1_intrawave_v3,517.68,1162.76,0.0
256,256,5120,6400,torch.float8_e4m3fn,65,0,28.085,a8w8_bpreshuffle_256x128x64x256_16x16_16x16_16x16x1_16x16x1_1x32x1x8_8x8x1_2x1_intrawave_v3,597.37,1318.42,0.0
256,256,5120,25600,torch.float8_e4m3fn,116,0,106.6527,a8w8_bpreshuffle_256x96x64x256_16x16_16x16_16x16x1_16x16x1_1x32x1x8_8x8x1_2x1_intrawave_v3,629.23,1314.99,0.0
256,256,6400,5120,torch.float8_e4m3fn,65,0,26.9347,a8w8_bpreshuffle_256x128x64x256_16x16_16x16_16x16x1_16x16x1_1x32x1x8_8x8x1_2x1_intrawave_v3,622.88,1386.89,0.0
256,256,7168,8192,torch.float8_e4m3fn,65,0,29.6374,a8w8_bpreshuffle_256x128x64x256_16x16_16x16_16x16x1_16x16x1_1x32x1x8_8x8x1_2x1_intrawave_v3,1014.42,2175.88,0.0
256,256,8192,1024,torch.float8_e4m3fn,77,0,9.7085,a8w8_bpreshuffle_256x64x64x128_16x16_16x16_8x32x1_8x32x1_1x32x1x8_8x8x1_2x1_intrawave_v3,442.39,1323.07,0.0
256,256,8192,2048,torch.float8_e4m3fn,114,0,11.9681,a8w8_bpreshuffle_256x64x64x256_16x16_16x16_16x16x1_16x16x1_1x32x1x8_8x8x1_2x1_intrawave_v3,717.74,1796.09,0.0
256,256,8192,3584,torch.float8_e4m3fn,144,0,16.6491,a8w8_bpreshuffle_256x128x64x256_16x16_16x16_16x16x1_16x16x1_1x32x1x8_8x8x1_2x1_intrawave_v3,902.89,2070.5,0.0
256,256,8192,7168,torch.float8_e4m3fn,65,0,28.6205,a8w8_bpreshuffle_256x128x64x256_16x16_16x16_16x16x1_16x16x1_1x32x1x8_8x8x1_2x1_intrawave_v3,1050.46,2262.35,0.0
256,256,8192,8192,torch.float8_e4m3fn,144,0,30.9086,a8w8_bpreshuffle_256x128x64x256_16x16_16x16_16x16x1_16x16x1_1x32x1x8_8x8x1_2x1_intrawave_v3,1111.66,2374.75,0.0
256,256,8192,28672,torch.float8_e4m3fn,65,0,95.3629,a8w8_bpreshuffle_256x128x64x256_16x16_16x16_16x16x1_16x16x1_1x32x1x8_8x8x1_2x1_intrawave_v3,1261.07,2583.98,0.0
256,256,9216,16384,torch.float8_e4m3fn,124,0,84.3085,a8w8_bpreshuffle_256x112x128x256_16x16_16x16_16x16x1_16x16x1_1x16x1x16_8x8x1_1x2_intrawave_v3,916.98,1896.7,0.0
256,256,10240,8192,torch.float8_e4m3fn,123,0,38.8017,a8w8_bpreshuffle_256x96x128x256_16x16_16x16_16x16x1_16x16x1_1x16x1x16_8x8x1_1x2_intrawave_v3,1106.9,2351.09,0.0
256,256,12800,5120,torch.float8_e4m3fn,139,0,34.8457,a8w8_bpreshuffle_256x128x128x256_16x16_16x16_16x16x1_16x16x1_1x16x1x16_8x8x1_1x2_intrawave_v3,962.94,2106.44,0.0
256,256,13312,16384,torch.float8_e4m3fn,139,0,92.6483,a8w8_bpreshuffle_256x128x128x256_16x16_16x16_16x16x1_16x16x1_1x16x1x16_8x8x1_1x2_intrawave_v3,1205.3,2472.94,0.0
256,256,14336,8192,torch.float8_e4m3fn,139,0,45.4901,a8w8_bpreshuffle_256x128x128x256_16x16_16x16_16x16x1_16x16x1_1x16x1x16_8x8x1_1x2_intrawave_v3,1321.82,2789.13,0.0
256,256,16384,2048,torch.float8_e4m3fn,139,0,18.9985,a8w8_bpreshuffle_256x128x128x256_16x16_16x16_16x16x1_16x16x1_1x16x1x16_8x8x1_1x2_intrawave_v3,904.28,2235.3,0.0
256,256,16384,4096,torch.float8_e4m3fn,63,0,32.6482,a8w8_bpreshuffle_256x128x128x256_16x16_16x16_16x16x1_16x16x1_1x32x1x8_8x8x1_2x1_intrawave_v3,1052.42,2344.57,0.0
256,256,16384,6656,torch.float8_e4m3fn,139,0,46.695,a8w8_bpreshuffle_256x128x128x256_16x16_16x16_16x16x1_16x16x1_1x16x1x16_8x8x1_1x2_intrawave_v3,1195.73,2551.55,0.0
256,256,16384,8192,torch.float8_e4m3fn,139,0,55.672,a8w8_bpreshuffle_256x128x128x256_16x16_16x16_16x16x1_16x16x1_1x16x1x16_8x8x1_1x2_intrawave_v3,1234.36,2599.21,0.0
256,256,16384,13312,torch.float8_e4m3fn,139,0,83.1524,a8w8_bpreshuffle_256x128x128x256_16x16_16x16_16x16x1_16x16x1_1x16x1x16_8x8x1_1x2_intrawave_v3,1342.95,2764.81,0.0
256,256,16384,26624,torch.float8_e4m3fn,139,0,163.3311,a8w8_bpreshuffle_256x128x128x256_16x16_16x16_16x16x1_16x16x1_1x16x1x16_8x8x1_1x2_intrawave_v3,1367.4,2763.78,0.0
256,256,26624,16384,torch.float8_e4m3fn,154,0,141.6113,a8w8_bpreshuffle_256x128x256x256_16x16_16x16_16x16x1_16x16x1_1x16x1x16_8x8x1_1x2_intrawave_v3,1577.12,3206.19,0.0
256,256,51200,5120,torch.float8_e4m3fn,154,0,97.921,a8w8_bpreshuffle_256x128x256x256_16x16_16x16_16x16x1_16x16x1_1x16x1x16_8x8x1_1x2_intrawave_v3,1370.67,2958.19,0.0
256,256,53248,16384,torch.float8_e4m3fn,154,0,276.3785,a8w8_bpreshuffle_256x128x256x256_16x16_16x16_16x16x1_16x16x1_1x16x1x16_8x8x1_1x2_intrawave_v3,1616.18,3270.42,0.0
256,256,57344,8192,torch.float8_e4m3fn,33,0,129.4795,a8w8_bpreshuffle_256x256x256x128_16x16_16x16_8x32x1_8x32x1_1x32x1x8_8x8x1_2x1_intrawave_v3,1857.58,3871.03,0.0
256,512,800,5120,torch.float8_e4m3fn,10,0,15.082,a8w8_bpreshuffle_128x16x32x512_16x16_16x16_32x4x1_32x4x1_1x16x1x8_4x4x1_1x1_intrawave_v1,278.1,499.71,0.0
256,512,1280,8192,torch.float8_e4m3fn,114,0,21.033,a8w8_bpreshuffle_256x64x64x256_16x16_16x16_16x16x1_16x16x1_1x32x1x8_8x8x1_2x1_intrawave_v3,510.5,760.27,0.0
256,512,2304,16384,torch.float8_e4m3fn,115,0,63.7872,a8w8_bpreshuffle_256x80x64x256_16x16_16x16_16x16x1_16x16x1_1x16x1x16_4x4x1_1x1_intrawave_v3,605.99,760.29,0.0
256,512,2560,8192,torch.float8_e4m3fn,113,0,27.2155,a8w8_bpreshuffle_256x48x64x256_16x16_16x16_16x16x1_16x16x1_1x16x1x16_4x4x1_1x1_intrawave_v1,789.07,1021.01,0.0
256,512,4608,16384,torch.float8_e4m3fn,124,0,84.5982,a8w8_bpreshuffle_256x112x128x256_16x16_16x16_16x16x1_16x16x1_1x16x1x16_8x8x1_1x2_intrawave_v3,913.84,1047.36,0.0
256,512,5120,640,torch.float8_e4m3fn,77,0,9.0563,a8w8_bpreshuffle_256x64x64x128_16x16_16x16_8x32x1_8x32x1_1x32x1x8_8x8x1_2x1_intrawave_v3,370.51,976.93,0.0
256,512,5120,1280,torch.float8_e4m3fn,77,0,12.8224,a8w8_bpreshuffle_256x64x64x128_16x16_16x16_8x32x1_8x32x1_1x32x1x8_8x8x1_2x1_intrawave_v3,523.37,971.1,0.0
256,512,5120,3200,torch.float8_e4m3fn,85,0,23.0489,a8w8_bpreshuffle_256x64x128x128_16x16_16x16_8x32x1_8x32x1_1x32x1x8_8x8x1_2x1_intrawave_v3,727.9,1009.39,0.0
256,512,5120,5120,torch.float8_e4m3fn,124,0,31.9895,a8w8_bpreshuffle_256x112x128x256_16x16_16x16_16x16x1_16x16x1_1x16x1x16_8x8x1_1x2_intrawave_v3,839.14,1065.31,0.0
256,512,5120,6400,torch.float8_e4m3fn,139,0,36.8067,a8w8_bpreshuffle_256x128x128x256_16x16_16x16_16x16x1_16x16x1_1x16x1x16_8x8x1_1x2_intrawave_v3,911.64,1121.74,0.0
256,512,5120,25600,torch.float8_e4m3fn,124,0,128.0705,a8w8_bpreshuffle_256x112x128x256_16x16_16x16_16x16x1_16x16x1_1x16x1x16_8x8x1_1x2_intrawave_v3,1048.0,1166.72,0.0
256,512,6400,5120,torch.float8_e4m3fn,124,0,33.3791,a8w8_bpreshuffle_256x112x128x256_16x16_16x16_16x16x1_16x16x1_1x16x1x16_8x8x1_1x2_intrawave_v3,1005.25,1256.57,0.0
256,512,7168,8192,torch.float8_e4m3fn,63,0,42.0669,a8w8_bpreshuffle_256x128x128x256_16x16_16x16_16x16x1_16x16x1_1x32x1x8_8x8x1_2x1_intrawave_v3,1429.38,1670.07,0.0
256,512,8192,1024,torch.float8_e4m3fn,85,0,11.5306,a8w8_bpreshuffle_256x64x128x128_16x16_16x16_8x32x1_8x32x1_1x32x1x8_8x8x1_2x1_intrawave_v3,744.97,1500.49,0.0
256,512,8192,2048,torch.float8_e4m3fn,139,0,15.6554,a8w8_bpreshuffle_256x128x128x256_16x16_16x16_16x16x1_16x16x1_1x16x1x16_8x8x1_1x2_intrawave_v3,1097.38,1674.46,0.0
256,512,8192,3584,torch.float8_e4m3fn,139,0,22.7592,a8w8_bpreshuffle_256x128x128x256_16x16_16x16_16x16x1_16x16x1_1x16x1x16_8x8x1_1x2_intrawave_v3,1320.99,1739.24,0.0
256,512,8192,7168,torch.float8_e4m3fn,139,0,39.3552,a8w8_bpreshuffle_256x128x128x256_16x16_16x16_16x16x1_16x16x1_1x16x1x16_8x8x1_1x2_intrawave_v3,1527.87,1798.46,0.0
256,512,8192,8192,torch.float8_e4m3fn,139,0,43.6902,a8w8_bpreshuffle_256x128x128x256_16x16_16x16_16x16x1_16x16x1_1x16x1x16_8x8x1_1x2_intrawave_v3,1572.88,1824.02,0.0
256,512,8192,28672,torch.float8_e4m3fn,139,0,133.9721,a8w8_bpreshuffle_256x128x128x256_16x16_16x16_16x16x1_16x16x1_1x16x1x16_8x8x1_1x2_intrawave_v3,1795.29,1925.4,0.0
256,512,9216,16384,torch.float8_e4m3fn,149,0,104.8693,a8w8_bpreshuffle_256x128x192x256_16x16_16x16_16x16x1_16x16x1_1x32x1x8_8x8x1_2x1_intrawave_v3,1474.4,1609.82,0.0
256,512,10240,8192,torch.float8_e4m3fn,143,0,55.4465,a8w8_bpreshuffle_256x192x128x128_16x16_16x16_8x32x1_8x32x1_1x16x1x16_8x8x1_1x2_intrawave_v3,1549.23,1777.68,0.0
256,512,12800,5120,torch.float8_e4m3fn,138,0,46.2157,a8w8_bpreshuffle_256x112x256x256_16x16_16x16_16x16x1_16x16x1_1x16x1x16_8x8x1_1x2_intrawave_v3,1452.08,1758.38,0.0
256,512,13312,16384,torch.float8_e4m3fn,154,0,127.8746,a8w8_bpreshuffle_256x128x256x256_16x16_16x16_16x16x1_16x16x1_1x16x1x16_8x8x1_1x2_intrawave_v3,1746.54,1877.81,0.0
256,512,14336,8192,torch.float8_e4m3fn,154,0,63.6195,a8w8_bpreshuffle_256x128x256x256_16x16_16x16_16x16x1_16x16x1_1x16x1x16_8x8x1_1x2_intrawave_v3,1890.29,2142.66,0.0
256,512,16384,2048,torch.float8_e4m3fn,154,0,27.0054,a8w8_bpreshuffle_256x128x256x256_16x16_16x16_16x16x1_16x16x1_1x16x1x16_8x8x1_1x2_intrawave_v3,1272.33,1902.59,0.0
256,512,16384,4096,torch.float8_e4m3fn,154,0,43.8782,a8w8_bpreshuffle_256x128x256x256_16x16_16x16_16x16x1_16x16x1_1x16x1x16_8x8x1_1x2_intrawave_v3,1566.14,1959.59,0.0
256,512,16384,6656,torch.float8_e4m3fn,154,0,64.427,a8w8_bpreshuffle_256x128x256x256_16x16_16x16_16x16x1_16x16x1_1x16x1x16_8x8x1_1x2_intrawave_v3,1733.27,2005.94,0.0
256,512,16384,8192,torch.float8_e4m3fn,154,0,73.6131,a8w8_bpreshuffle_256x128x256x256_16x16_16x16_16x16x1_16x16x1_1x16x1x16_8x8x1_1x2_intrawave_v3,1867.04,2108.17,0.0
256,512,16384,13312,torch.float8_e4m3fn,154,0,114.1614,a8w8_bpreshuffle_256x128x256x256_16x16_16x16_16x16x1_16x16x1_1x16x1x16_8x8x1_1x2_intrawave_v3,1956.34,2117.15,0.0
256,512,16384,26624,torch.float8_e4m3fn,154,0,214.713,a8w8_bpreshuffle_256x128x256x256_16x16_16x16_16x16x1_16x16x1_1x16x1x16_8x8x1_1x2_intrawave_v3,2080.34,2173.21,0.0
256,512,26624,16384,torch.float8_e4m3fn,154,0,250.2793,a8w8_bpreshuffle_256x128x256x256_16x16_16x16_16x16x1_16x16x1_1x16x1x16_8x8x1_1x2_intrawave_v3,1784.71,1885.33,0.0
256,512,51200,5120,torch.float8_e4m3fn,158,0,174.8476,a8w8_bpreshuffle_256x192x256x128_16x16_16x16_8x32x1_8x32x1_1x16x1x16_8x8x1_1x2_intrawave_v3,1535.25,1814.12,0.0
256,512,53248,16384,torch.float8_e4m3fn,154,0,492.8785,a8w8_bpreshuffle_256x128x256x256_16x16_16x16_16x16x1_16x16x1_1x16x1x16_8x8x1_1x2_intrawave_v3,1812.52,1897.69,0.0
256,512,57344,8192,torch.float8_e4m3fn,33,0,227.0683,a8w8_bpreshuffle_256x256x256x128_16x16_16x16_8x32x1_8x32x1_1x32x1x8_8x8x1_2x1_intrawave_v3,2118.47,2345.89,0.0
256,1024,800,5120,torch.float8_e4m3fn,24,0,24.558,a8w8_bpreshuffle_128x16x32x512_16x16_16x16_32x4x1_32x4x1_1x16x1x8_4x4x1_1x1_intrawave_v2,341.58,446.99,0.0
256,1024,1280,8192,torch.float8_e4m3fn,113,0,26.819,a8w8_bpreshuffle_256x48x64x256_16x16_16x16_16x16x1_16x16x1_1x16x1x16_4x4x1_1x1_intrawave_v1,800.73,801.51,0.0
256,1024,2304,16384,torch.float8_e4m3fn,124,0,81.3585,a8w8_bpreshuffle_256x112x128x256_16x16_16x16_16x16x1_16x16x1_1x16x1x16_8x8x1_1x2_intrawave_v3,950.23,728.19,0.0
256,1024,2560,8192,torch.float8_e4m3fn,123,0,37.4372,a8w8_bpreshuffle_256x96x128x256_16x16_16x16_16x16x1_16x16x1_1x16x1x16_8x8x1_1x2_intrawave_v3,1147.25,924.29,0.0
256,1024,4608,16384,torch.float8_e4m3fn,149,0,104.0599,a8w8_bpreshuffle_256x128x192x256_16x16_16x16_16x16x1_16x16x1_1x32x1x8_8x8x1_2x1_intrawave_v3,1485.86,977.44,0.0
256,1024,5120,640,torch.float8_e4m3fn,86,0,11.1521,a8w8_bpreshuffle_256x96x128x128_16x16_16x16_8x32x1_8x32x1_1x32x1x8_8x8x1_2x1_intrawave_v3,601.76,1292.84,0.0
256,1024,5120,1280,torch.float8_e4m3fn,86,0,16.1465,a8w8_bpreshuffle_256x96x128x128_16x16_16x16_8x32x1_8x32x1_1x32x1x8_8x8x1_2x1_intrawave_v3,831.25,1136.47,0.0
256,1024,5120,3200,torch.float8_e4m3fn,51,0,29.1651,a8w8_bpreshuffle_256x192x128x128_16x16_16x16_8x32x1_8x32x1_1x32x1x8_8x8x1_2x1_intrawave_v3,1150.5,1033.65,0.0
256,1024,5120,5120,torch.float8_e4m3fn,137,0,40.2614,a8w8_bpreshuffle_256x96x256x256_16x16_16x16_16x16x1_16x16x1_1x16x1x16_8x8x1_1x2_intrawave_v3,1333.46,1041.77,0.0
256,1024,5120,6400,torch.float8_e4m3fn,137,0,48.5222,a8w8_bpreshuffle_256x96x256x256_16x16_16x16_16x16x1_16x16x1_1x16x1x16_8x8x1_1x2_intrawave_v3,1383.05,1026.49,0.0
256,1024,5120,25600,torch.float8_e4m3fn,137,0,162.5939,a8w8_bpreshuffle_256x96x256x256_16x16_16x16_16x16x1_16x16x1_1x16x1x16_8x8x1_1x2_intrawave_v3,1650.96,1031.85,0.0
256,1024,6400,5120,torch.float8_e4m3fn,138,0,45.101,a8w8_bpreshuffle_256x112x256x256_16x16_16x16_16x16x1_16x16x1_1x16x1x16_8x8x1_1x2_intrawave_v3,1487.97,1133.41,0.0
256,1024,7168,8192,torch.float8_e4m3fn,154,0,62.2696,a8w8_bpreshuffle_256x128x256x256_16x16_16x16_16x16x1_16x16x1_1x16x1x16_8x8x1_1x2_intrawave_v3,1931.26,1313.46,0.0
256,1024,8192,1024,torch.float8_e4m3fn,0,0,16.8199,a8w8_bpreshuffle_256x128x128x128_16x16_16x16_8x32x1_8x32x1_1x32x1x8_8x8x1_2x1_intrawave_v3,1021.4,1558.53,0.0
256,1024,8192,2048,torch.float8_e4m3fn,154,0,23.1654,a8w8_bpreshuffle_256x128x256x256_16x16_16x16_16x16x1_16x16x1_1x16x1x16_8x8x1_1x2_intrawave_v3,1483.24,1539.0,0.0
256,1024,8192,3584,torch.float8_e4m3fn,154,0,34.8454,a8w8_bpreshuffle_256x128x256x256_16x16_16x16_16x16x1_16x16x1_1x16x1x16_8x8x1_1x2_intrawave_v3,1725.61,1429.38,0.0
256,1024,8192,7168,torch.float8_e4m3fn,154,0,59.0054,a8w8_bpreshuffle_256x128x256x256_16x16_16x16_16x16x1_16x16x1_1x16x1x16_8x8x1_1x2_intrawave_v3,2038.1,1403.9,0.0
256,1024,8192,8192,torch.float8_e4m3fn,154,0,64.2479,a8w8_bpreshuffle_256x128x256x256_16x16_16x16_16x16x1_16x16x1_1x16x1x16_8x8x1_1x2_intrawave_v3,2139.2,1436.23,0.0
256,1024,8192,28672,torch.float8_e4m3fn,154,0,197.2769,a8w8_bpreshuffle_256x128x256x256_16x16_16x16_16x16x1_16x16x1_1x16x1x16_8x8x1_1x2_intrawave_v3,2438.38,1424.49,0.0
256,1024,9216,16384,torch.float8_e4m3fn,54,0,178.1558,a8w8_bpreshuffle_256x160x256x128_16x16_16x16_8x32x1_8x32x1_1x32x1x8_8x8x1_2x1_intrawave_v3,1735.77,1047.66,0.0
256,1024,10240,8192,torch.float8_e4m3fn,158,0,83.5863,a8w8_bpreshuffle_256x192x256x128_16x16_16x16_8x32x1_8x32x1_1x16x1x16_8x8x1_1x2_intrawave_v3,2055.35,1354.84,0.0
256,1024,12800,5120,torch.float8_e4m3fn,138,0,86.9605,a8w8_bpreshuffle_256x112x256x256_16x16_16x16_16x16x1_16x16x1_1x16x1x16_8x8x1_1x2_intrawave_v3,1543.43,1115.37,0.0
256,1024,13312,16384,torch.float8_e4m3fn,154,0,243.5736,a8w8_bpreshuffle_256x128x256x256_16x16_16x16_16x16x1_16x16x1_1x16x1x16_8x8x1_1x2_intrawave_v3,1833.85,1076.24,0.0
256,1024,14336,8192,torch.float8_e4m3fn,33,0,112.839,a8w8_bpreshuffle_256x256x256x128_16x16_16x16_8x32x1_8x32x1_1x32x1x8_8x8x1_2x1_intrawave_v3,2131.52,1375.32,0.0
256,1024,16384,2048,torch.float8_e4m3fn,33,0,49.7279,a8w8_bpreshuffle_256x256x256x128_16x16_16x16_8x32x1_8x32x1_1x32x1x8_8x8x1_2x1_intrawave_v3,1381.91,1391.69,0.0
256,1024,16384,4096,torch.float8_e4m3fn,33,0,81.4525,a8w8_bpreshuffle_256x256x256x128_16x16_16x16_8x32x1_8x32x1_1x32x1x8_8x8x1_2x1_intrawave_v3,1687.35,1287.35,0.0
256,1024,16384,6656,torch.float8_e4m3fn,2,0,120.523,a8w8_bpreshuffle_256x256x256x128_16x16_16x16_8x32x1_8x32x1_1x32x1x8_8x8x1_1x2_intrawave_v3,1853.08,1239.78,0.0
256,1024,16384,8192,torch.float8_e4m3fn,154,0,136.0178,a8w8_bpreshuffle_256x128x256x256_16x16_16x16_16x16x1_16x16x1_1x16x1x16_8x8x1_1x2_intrawave_v3,2020.9,1295.13,0.0
256,1024,16384,13312,torch.float8_e4m3fn,154,0,214.8294,a8w8_bpreshuffle_256x128x256x256_16x16_16x16_16x16x1_16x16x1_1x16x1x16_8x8x1_1x2_intrawave_v3,2079.22,1234.89,0.0
256,1024,16384,26624,torch.float8_e4m3fn,154,0,412.5087,a8w8_bpreshuffle_256x128x256x256_16x16_16x16_16x16x1_16x16x1_1x16x1x16_8x8x1_1x2_intrawave_v3,2165.66,1204.88,0.0
256,1024,26624,16384,torch.float8_e4m3fn,33,0,467.1211,a8w8_bpreshuffle_256x256x256x128_16x16_16x16_8x32x1_8x32x1_1x32x1x8_8x8x1_2x1_intrawave_v3,1912.47,1086.47,0.0
256,1024,51200,5120,torch.float8_e4m3fn,40,0,288.5662,a8w8_bpreshuffle_256x224x256x128_16x16_16x16_8x32x1_8x32x1_1x32x1x8_8x8x1_2x1_intrawave_v3,1860.48,1289.98,0.0
256,1024,53248,16384,torch.float8_e4m3fn,154,0,850.624,a8w8_bpreshuffle_256x128x256x256_16x16_16x16_16x16x1_16x16x1_1x16x1x16_8x8x1_1x2_intrawave_v3,2100.47,1173.54,0.0
256,1024,57344,8192,torch.float8_e4m3fn,33,0,409.7151,a8w8_bpreshuffle_256x256x256x128_16x16_16x16_8x32x1_8x32x1_1x32x1x8_8x8x1_2x1_intrawave_v3,2348.15,1453.67,0.0
256,2048,800,5120,torch.float8_e4m3fn,24,0,41.7422,a8w8_bpreshuffle_128x16x32x512_16x16_16x16_32x4x1_32x4x1_1x16x1x8_4x4x1_1x1_intrawave_v2,401.92,427.83,0.0
256,2048,1280,8192,torch.float8_e4m3fn,123,0,36.7116,a8w8_bpreshuffle_256x96x128x256_16x16_16x16_16x16x1_16x16x1_1x16x1x16_8x8x1_1x2_intrawave_v3,1169.92,885.44,0.0
256,2048,2304,16384,torch.float8_e4m3fn,131,0,101.2648,a8w8_bpreshuffle_256x112x192x256_16x16_16x16_16x16x1_16x16x1_1x16x1x16_4x4x1_1x1_intrawave_v3,1526.88,797.32,0.0
256,2048,2560,8192,torch.float8_e4m3fn,138,0,55.1683,a8w8_bpreshuffle_256x112x256x256_16x16_16x16_16x16x1_16x16x1_1x16x1x16_8x8x1_1x2_intrawave_v3,1557.04,874.32,0.0
256,2048,4608,16384,torch.float8_e4m3fn,68,0,176.1003,a8w8_bpreshuffle_256x128x192x128_16x16_16x16_8x32x1_8x32x1_1x32x1x8_8x8x1_2x1_intrawave_v3,1756.03,726.44,0.0
256,2048,5120,640,torch.float8_e4m3fn,102,0,16.8369,a8w8_bpreshuffle_256x96x256x128_16x16_16x16_8x32x1_8x32x1_1x32x1x8_8x8x1_2x1_intrawave_v3,797.16,1518.04,0.0
256,2048,5120,1280,torch.float8_e4m3fn,102,0,24.8167,a8w8_bpreshuffle_256x96x256x128_16x16_16x16_8x32x1_8x32x1_1x32x1x8_8x8x1_2x1_intrawave_v3,1081.67,1214.77,0.0
256,2048,5120,3200,torch.float8_e4m3fn,158,0,41.6304,a8w8_bpreshuffle_256x192x256x128_16x16_16x16_8x32x1_8x32x1_1x16x1x16_8x8x1_1x2_intrawave_v3,1612.02,1054.74,0.0
256,2048,5120,5120,torch.float8_e4m3fn,102,0,71.8612,a8w8_bpreshuffle_256x96x256x128_16x16_16x16_8x32x1_8x32x1_1x32x1x8_8x8x1_2x1_intrawave_v3,1494.19,802.54,0.0
256,2048,5120,6400,torch.float8_e4m3fn,158,0,76.511,a8w8_bpreshuffle_256x192x256x128_16x16_16x16_8x32x1_8x32x1_1x16x1x16_8x8x1_1x2_intrawave_v3,1754.23,873.69,0.0
256,2048,5120,25600,torch.float8_e4m3fn,137,0,301.0835,a8w8_bpreshuffle_256x96x256x256_16x16_16x16_16x16x1_16x16x1_1x16x1x16_8x8x1_1x2_intrawave_v3,1783.13,679.12,0.0
256,2048,6400,5120,torch.float8_e4m3fn,138,0,84.6213,a8w8_bpreshuffle_256x112x256x256_16x16_16x16_16x16x1_16x16x1_1x16x1x16_8x8x1_1x2_intrawave_v3,1586.1,820.93,0.0
256,2048,7168,8192,torch.float8_e4m3fn,33,0,112.617,a8w8_bpreshuffle_256x256x256x128_16x16_16x16_8x32x1_8x32x1_1x32x1x8_8x8x1_2x1_intrawave_v3,2135.72,931.1,0.0
256,2048,8192,1024,torch.float8_e4m3fn,86,0,28.9708,a8w8_bpreshuffle_256x96x128x128_16x16_16x16_8x32x1_8x32x1_1x32x1x8_8x8x1_2x1_intrawave_v3,1186.01,1520.16,0.0
256,2048,8192,2048,torch.float8_e4m3fn,33,0,42.2356,a8w8_bpreshuffle_256x256x256x128_16x16_16x16_8x32x1_8x32x1_1x32x1x8_8x8x1_2x1_intrawave_v3,1627.05,1291.0,0.0
256,2048,8192,3584,torch.float8_e4m3fn,33,0,61.9146,a8w8_bpreshuffle_256x256x256x128_16x16_16x16_8x32x1_8x32x1_1x32x1x8_8x8x1_2x1_intrawave_v3,1942.34,1134.7,0.0
256,2048,8192,7168,torch.float8_e4m3fn,33,0,105.8446,a8w8_bpreshuffle_256x256x256x128_16x16_16x16_8x32x1_8x32x1_1x32x1x8_8x8x1_2x1_intrawave_v3,2272.37,1010.49,0.0
256,2048,8192,8192,torch.float8_e4m3fn,33,0,117.6729,a8w8_bpreshuffle_256x256x256x128_16x16_16x16_8x32x1_8x32x1_1x32x1x8_8x8x1_2x1_intrawave_v3,2335.95,998.03,0.0
256,2048,8192,28672,torch.float8_e4m3fn,33,0,357.8032,a8w8_bpreshuffle_256x256x256x128_16x16_16x16_8x32x1_8x32x1_1x32x1x8_8x8x1_2x1_intrawave_v3,2688.83,914.35,0.0
256,2048,9216,16384,torch.float8_e4m3fn,68,0,305.2233,a8w8_bpreshuffle_256x128x192x128_16x16_16x16_8x32x1_8x32x1_1x32x1x8_8x8x1_2x1_intrawave_v3,2026.3,728.31,0.0
256,2048,10240,8192,torch.float8_e4m3fn,158,0,156.1052,a8w8_bpreshuffle_256x192x256x128_16x16_16x16_8x32x1_8x32x1_1x16x1x16_8x8x1_1x2_intrawave_v3,2201.06,913.53,0.0
256,2048,12800,5120,torch.float8_e4m3fn,40,0,154.2962,a8w8_bpreshuffle_256x224x256x128_16x16_16x16_8x32x1_8x32x1_1x32x1x8_8x8x1_2x1_intrawave_v3,1739.74,832.49,0.0
256,2048,13312,16384,torch.float8_e4m3fn,138,0,457.646,a8w8_bpreshuffle_256x112x256x256_16x16_16x16_16x16x1_16x16x1_1x16x1x16_8x8x1_1x2_intrawave_v3,1952.06,669.04,0.0
256,2048,14336,8192,torch.float8_e4m3fn,54,0,205.0365,a8w8_bpreshuffle_256x160x256x128_16x16_16x16_8x32x1_8x32x1_1x32x1x8_8x8x1_2x1_intrawave_v3,2346.1,940.99,0.0
256,2048,16384,2048,torch.float8_e4m3fn,33,0,89.7238,a8w8_bpreshuffle_256x256x256x128_16x16_16x16_8x32x1_8x32x1_1x32x1x8_8x8x1_2x1_intrawave_v3,1531.8,1168.67,0.0
256,2048,16384,4096,torch.float8_e4m3fn,33,0,146.1468,a8w8_bpreshuffle_256x256x256x128_16x16_16x16_8x32x1_8x32x1_1x32x1x8_8x8x1_2x1_intrawave_v3,1880.83,975.77,0.0
256,2048,16384,6656,torch.float8_e4m3fn,33,0,216.3109,a8w8_bpreshuffle_256x256x256x128_16x16_16x16_8x32x1_8x32x1_1x32x1x8_8x8x1_2x1_intrawave_v3,2064.97,877.4,0.0
256,2048,16384,8192,torch.float8_e4m3fn,33,0,253.8314,a8w8_bpreshuffle_256x256x256x128_16x16_16x16_8x32x1_8x32x1_1x32x1x8_8x8x1_2x1_intrawave_v3,2165.83,859.25,0.0
256,2048,16384,13312,torch.float8_e4m3fn,33,0,388.9416,a8w8_bpreshuffle_256x256x256x128_16x16_16x16_8x32x1_8x32x1_1x32x1x8_8x8x1_2x1_intrawave_v3,2296.88,803.4,0.0
256,2048,16384,26624,torch.float8_e4m3fn,154,0,777.8647,a8w8_bpreshuffle_256x128x256x256_16x16_16x16_16x16x1_16x16x1_1x16x1x16_8x8x1_1x2_intrawave_v3,2296.94,717.15,0.0
256,2048,26624,16384,torch.float8_e4m3fn,154,0,848.1746,a8w8_bpreshuffle_256x128x256x256_16x16_16x16_16x16x1_16x16x1_1x16x1x16_8x8x1_1x2_intrawave_v3,2106.53,682.42,0.0
256,2048,51200,5120,torch.float8_e4m3fn,33,0,524.9075,a8w8_bpreshuffle_256x256x256x128_16x16_16x16_8x32x1_8x32x1_1x32x1x8_8x8x1_2x1_intrawave_v3,2045.58,918.91,0.0
256,2048,53248,16384,torch.float8_e4m3fn,33,0,1541.2203,a8w8_bpreshuffle_256x256x256x128_16x16_16x16_8x32x1_8x32x1_1x32x1x8_8x8x1_2x1_intrawave_v3,2318.56,729.34,0.0
256,2048,57344,8192,torch.float8_e4m3fn,33,0,762.0358,a8w8_bpreshuffle_256x256x256x128_16x16_16x16_8x32x1_8x32x1_1x32x1x8_8x8x1_2x1_intrawave_v3,2525.01,946.7,0.0
256,4096,800,5120,torch.float8_e4m3fn,69,0,50.1312,a8w8_bpreshuffle_256x128x160x128_16x16_16x16_8x32x1_8x32x1_1x64x1x4_8x8x1_2x1_intrawave_v3,669.33,630.77,0.0
256,4096,1280,8192,torch.float8_e4m3fn,137,0,53.9659,a8w8_bpreshuffle_256x96x256x256_16x16_16x16_16x16x1_16x16x1_1x16x1x16_8x8x1_1x2_intrawave_v3,1591.73,1010.38,0.0
256,4096,2304,16384,torch.float8_e4m3fn,68,0,177.9892,a8w8_bpreshuffle_256x128x192x128_16x16_16x16_8x32x1_8x32x1_1x32x1x8_8x8x1_2x1_intrawave_v3,1737.4,695.17,0.0
256,4096,2560,8192,torch.float8_e4m3fn,158,0,83.4719,a8w8_bpreshuffle_256x192x256x128_16x16_16x16_8x32x1_8x32x1_1x16x1x16_8x8x1_1x2_intrawave_v3,2058.16,904.47,0.0
256,4096,4608,16384,torch.float8_e4m3fn,68,0,307.0339,a8w8_bpreshuffle_256x128x192x128_16x16_16x16_8x32x1_8x32x1_1x32x1x8_8x8x1_2x1_intrawave_v3,2014.36,587.41,0.0
256,4096,5120,640,torch.float8_e4m3fn,102,0,28.9248,a8w8_bpreshuffle_256x96x256x128_16x16_16x16_8x32x1_8x32x1_1x32x1x8_8x8x1_2x1_intrawave_v3,928.05,1653.99,0.0
256,4096,5120,1280,torch.float8_e4m3fn,102,0,42.5949,a8w8_bpreshuffle_256x96x256x128_16x16_16x16_8x32x1_8x32x1_1x32x1x8_8x8x1_2x1_intrawave_v3,1260.41,1261.64,0.0
256,4096,5120,3200,torch.float8_e4m3fn,47,0,80.2905,a8w8_bpreshuffle_256x192x256x128_16x16_16x16_8x32x1_8x32x1_1x32x1x8_8x8x1_2x1_intrawave_v3,1671.65,889.7,0.0
256,4096,5120,5120,torch.float8_e4m3fn,138,0,121.2408,a8w8_bpreshuffle_256x112x256x256_16x16_16x16_16x16x1_16x16x1_1x16x1x16_8x8x1_1x2_intrawave_v3,1771.25,735.14,0.0
256,4096,5120,6400,torch.float8_e4m3fn,158,0,135.91,a8w8_bpreshuffle_256x192x256x128_16x16_16x16_8x32x1_8x32x1_1x16x1x16_8x8x1_1x2_intrawave_v3,1975.1,742.59,0.0
256,4096,5120,25600,torch.float8_e4m3fn,138,0,505.012,a8w8_bpreshuffle_256x112x256x256_16x16_16x16_16x16x1_16x16x1_1x16x1x16_8x8x1_1x2_intrawave_v3,2126.17,550.23,0.0
256,4096,6400,5120,torch.float8_e4m3fn,40,0,148.8986,a8w8_bpreshuffle_256x224x256x128_16x16_16x16_8x32x1_8x32x1_1x32x1x8_8x8x1_2x1_intrawave_v3,1802.81,713.02,0.0
256,4096,7168,8192,torch.float8_e4m3fn,156,0,206.7372,a8w8_bpreshuffle_256x160x256x128_16x16_16x16_8x32x1_8x32x1_1x16x1x16_8x8x1_1x2_intrawave_v3,2326.8,730.37,0.0
256,4096,8192,1024,torch.float8_e4m3fn,86,0,49.3525,a8w8_bpreshuffle_256x96x128x128_16x16_16x16_8x32x1_8x32x1_1x32x1x8_8x8x1_2x1_intrawave_v3,1392.42,1614.75,0.0
256,4096,8192,2048,torch.float8_e4m3fn,143,0,80.1603,a8w8_bpreshuffle_256x192x128x128_16x16_16x16_8x32x1_8x32x1_1x16x1x16_8x8x1_1x2_intrawave_v3,1714.55,1151.13,0.0
256,4096,8192,3584,torch.float8_e4m3fn,33,0,117.1442,a8w8_bpreshuffle_256x256x256x128_16x16_16x16_8x32x1_8x32x1_1x32x1x8_8x8x1_2x1_intrawave_v3,2053.18,948.82,0.0
256,4096,8192,7168,torch.float8_e4m3fn,33,0,196.6543,a8w8_bpreshuffle_256x256x256x128_16x16_16x16_8x32x1_8x32x1_1x32x1x8_8x8x1_2x1_intrawave_v3,2446.1,789.15,0.0
256,4096,8192,8192,torch.float8_e4m3fn,33,0,221.6286,a8w8_bpreshuffle_256x256x256x128_16x16_16x16_8x32x1_8x32x1_1x32x1x8_8x8x1_2x1_intrawave_v3,2480.53,757.0,0.0
256,4096,8192,28672,torch.float8_e4m3fn,33,0,686.9896,a8w8_bpreshuffle_256x256x256x128_16x16_16x16_8x32x1_8x32x1_1x32x1x8_8x8x1_2x1_intrawave_v3,2800.84,610.53,0.0
256,4096,9216,16384,torch.float8_e4m3fn,95,0,554.8485,a8w8_bpreshuffle_256x128x192x128_16x16_16x16_8x32x1_8x32x1_1x16x1x16_4x4x1_1x1_intrawave_v3,2229.35,529.16,0.0
256,4096,10240,8192,torch.float8_e4m3fn,106,0,283.3828,a8w8_bpreshuffle_256x224x256x128_16x16_16x16_8x32x1_8x32x1_1x16x1x16_4x4x1_1x1_intrawave_v3,2424.97,710.44,0.0
256,4096,12800,5120,torch.float8_e4m3fn,40,0,270.4291,a8w8_bpreshuffle_256x224x256x128_16x16_16x16_8x32x1_8x32x1_1x32x1x8_8x8x1_2x1_intrawave_v3,1985.26,707.64,0.0
256,4096,13312,16384,torch.float8_e4m3fn,154,0,842.3709,a8w8_bpreshuffle_256x128x256x256_16x16_16x16_16x16x1_16x16x1_1x16x1x16_8x8x1_1x2_intrawave_v3,2121.04,468.04,0.0
256,4096,14336,8192,torch.float8_e4m3fn,158,0,387.5867,a8w8_bpreshuffle_256x192x256x128_16x16_16x16_8x32x1_8x32x1_1x16x1x16_8x8x1_1x2_intrawave_v3,2482.21,692.58,0.0
256,4096,16384,2048,torch.float8_e4m3fn,102,0,160.9167,a8w8_bpreshuffle_256x96x256x128_16x16_16x16_8x32x1_8x32x1_1x32x1x8_8x8x1_2x1_intrawave_v3,1708.2,1094.73,0.0
256,4096,16384,4096,torch.float8_e4m3fn,33,0,255.2978,a8w8_bpreshuffle_256x256x256x128_16x16_16x16_8x32x1_8x32x1_1x32x1x8_8x8x1_2x1_intrawave_v3,2153.39,854.31,0.0
256,4096,16384,6656,torch.float8_e4m3fn,33,0,407.5508,a8w8_bpreshuffle_256x256x256x128_16x16_16x16_8x32x1_8x32x1_1x32x1x8_8x8x1_2x1_intrawave_v3,2192.0,663.8,0.0
256,4096,16384,8192,torch.float8_e4m3fn,33,0,471.5371,a8w8_bpreshuffle_256x256x256x128_16x16_16x16_8x32x1_8x32x1_1x32x1x8_8x8x1_2x1_intrawave_v3,2331.76,640.44,0.0
256,4096,16384,13312,torch.float8_e4m3fn,33,0,740.5043,a8w8_bpreshuffle_256x256x256x128_16x16_16x16_8x32x1_8x32x1_1x32x1x8_8x8x1_2x1_intrawave_v3,2412.82,549.42,0.0
256,4096,16384,26624,torch.float8_e4m3fn,33,0,1511.0293,a8w8_bpreshuffle_256x256x256x128_16x16_16x16_8x32x1_8x32x1_1x32x1x8_8x8x1_2x1_intrawave_v3,2364.89,449.68,0.0
256,4096,26624,16384,torch.float8_e4m3fn,33,0,1553.947,a8w8_bpreshuffle_256x256x256x128_16x16_16x16_8x32x1_8x32x1_1x32x1x8_8x8x1_2x1_intrawave_v3,2299.57,464.25,0.0
256,4096,51200,5120,torch.float8_e4m3fn,33,0,979.1344,a8w8_bpreshuffle_256x256x256x128_16x16_16x16_8x32x1_8x32x1_1x32x1x8_8x8x1_2x1_intrawave_v3,2193.25,717.52,0.0
256,4096,53248,16384,torch.float8_e4m3fn,33,0,2910.6751,a8w8_bpreshuffle_256x256x256x128_16x16_16x16_8x32x1_8x32x1_1x32x1x8_8x8x1_2x1_intrawave_v3,2455.38,472.65,0.0
256,4096,57344,8192,torch.float8_e4m3fn,33,0,1497.7395,a8w8_bpreshuffle_256x256x256x128_16x16_16x16_8x32x1_8x32x1_1x32x1x8_8x8x1_2x1_intrawave_v3,2569.4,649.7,0.0
256,8192,800,5120,torch.float8_e4m3fn,69,0,67.6989,a8w8_bpreshuffle_256x128x160x128_16x16_16x16_8x32x1_8x32x1_1x64x1x4_8x8x1_2x1_intrawave_v3,991.28,873.67,0.0
256,8192,1280,8192,torch.float8_e4m3fn,158,0,83.0796,a8w8_bpreshuffle_256x192x256x128_16x16_16x16_8x32x1_8x32x1_1x16x1x16_8x8x1_1x2_intrawave_v3,2067.88,1186.41,0.0
256,8192,2304,16384,torch.float8_e4m3fn,149,0,311.0895,a8w8_bpreshuffle_256x128x192x256_16x16_16x16_16x16x1_16x16x1_1x32x1x8_8x8x1_2x1_intrawave_v3,1988.09,674.13,0.0
256,8192,2560,8192,torch.float8_e4m3fn,158,0,155.4584,a8w8_bpreshuffle_256x192x256x128_16x16_16x16_8x32x1_8x32x1_1x16x1x16_8x8x1_1x2_intrawave_v3,2210.22,836.39,0.0
256,8192,4608,16384,torch.float8_e4m3fn,154,0,561.2735,a8w8_bpreshuffle_256x128x256x256_16x16_16x16_16x16x1_16x16x1_1x16x1x16_8x8x1_1x2_intrawave_v3,2203.83,508.15,0.0
256,8192,5120,640,torch.float8_e4m3fn,143,0,50.4892,a8w8_bpreshuffle_256x192x128x128_16x16_16x16_8x32x1_8x32x1_1x16x1x16_8x8x1_1x2_intrawave_v3,1063.34,1830.21,0.0
256,8192,5120,1280,torch.float8_e4m3fn,143,0,77.0321,a8w8_bpreshuffle_256x192x128x128_16x16_16x16_8x32x1_8x32x1_1x16x1x16_8x8x1_1x2_intrawave_v3,1393.89,1310.17,0.0
256,8192,5120,3200,torch.float8_e4m3fn,40,0,139.3777,a8w8_bpreshuffle_256x224x256x128_16x16_16x16_8x32x1_8x32x1_1x32x1x8_8x8x1_2x1_intrawave_v3,1925.96,907.49,0.0
256,8192,5120,5120,torch.float8_e4m3fn,154,0,215.948,a8w8_bpreshuffle_256x128x256x256_16x16_16x16_16x16x1_16x16x1_1x16x1x16_8x8x1_1x2_intrawave_v3,1988.89,704.07,0.0
256,8192,5120,6400,torch.float8_e4m3fn,40,0,242.9206,a8w8_bpreshuffle_256x224x256x128_16x16_16x16_8x32x1_8x32x1_1x32x1x8_8x8x1_2x1_intrawave_v3,2210.07,696.04,0.0
256,8192,5120,25600,torch.float8_e4m3fn,154,0,938.5635,a8w8_bpreshuffle_256x128x256x256_16x16_16x16_16x16x1_16x16x1_1x16x1x16_8x8x1_1x2_intrawave_v3,2288.05,452.47,0.0
256,8192,6400,5120,torch.float8_e4m3fn,40,0,270.3545,a8w8_bpreshuffle_256x224x256x128_16x16_16x16_8x32x1_8x32x1_1x32x1x8_8x8x1_2x1_intrawave_v3,1985.8,664.2,0.0
256,8192,7168,8192,torch.float8_e4m3fn,158,0,385.4824,a8w8_bpreshuffle_256x192x256x128_16x16_16x16_8x32x1_8x32x1_1x16x1x16_8x8x1_1x2_intrawave_v3,2495.76,631.08,0.0
256,8192,8192,1024,torch.float8_e4m3fn,51,0,92.436,a8w8_bpreshuffle_256x192x128x128_16x16_16x16_8x32x1_8x32x1_1x32x1x8_8x8x1_2x1_intrawave_v3,1486.86,1633.51,0.0
256,8192,8192,2048,torch.float8_e4m3fn,51,0,141.6683,a8w8_bpreshuffle_256x192x128x128_16x16_16x16_8x32x1_8x32x1_1x32x1x8_8x8x1_2x1_intrawave_v3,1940.29,1184.26,0.0
256,8192,8192,3584,torch.float8_e4m3fn,143,0,222.4514,a8w8_bpreshuffle_256x192x128x128_16x16_16x16_8x32x1_8x32x1_1x16x1x16_8x8x1_1x2_intrawave_v3,2162.43,867.33,0.0
256,8192,8192,7168,torch.float8_e4m3fn,33,0,383.1227,a8w8_bpreshuffle_256x256x256x128_16x16_16x16_8x32x1_8x32x1_1x32x1x8_8x8x1_2x1_intrawave_v3,2511.13,656.86,0.0
256,8192,8192,8192,torch.float8_e4m3fn,33,0,424.8317,a8w8_bpreshuffle_256x256x256x128_16x16_16x16_8x32x1_8x32x1_1x32x1x8_8x8x1_2x1_intrawave_v3,2588.11,631.86,0.0
256,8192,8192,28672,torch.float8_e4m3fn,33,0,1389.0293,a8w8_bpreshuffle_256x256x256x128_16x16_16x16_8x32x1_8x32x1_1x32x1x8_8x8x1_2x1_intrawave_v3,2770.49,434.82,0.0
256,8192,9216,16384,torch.float8_e4m3fn,154,0,1095.3193,a8w8_bpreshuffle_256x128x256x256_16x16_16x16_16x16x1_16x16x1_1x16x1x16_8x8x1_1x2_intrawave_v3,2258.61,398.25,0.0
256,8192,10240,8192,torch.float8_e4m3fn,33,0,533.4106,a8w8_bpreshuffle_256x256x256x128_16x16_16x16_8x32x1_8x32x1_1x32x1x8_8x8x1_2x1_intrawave_v3,2576.61,597.6,0.0
256,8192,12800,5120,torch.float8_e4m3fn,158,0,519.2638,a8w8_bpreshuffle_256x192x256x128_16x16_16x16_8x32x1_8x32x1_1x16x1x16_8x8x1_1x2_intrawave_v3,2067.82,610.85,0.0
256,8192,13312,16384,torch.float8_e4m3fn,33,0,1546.1027,a8w8_bpreshuffle_256x256x256x128_16x16_16x16_8x32x1_8x32x1_1x32x1x8_8x8x1_2x1_intrawave_v3,2311.24,368.94,0.0
256,8192,14336,8192,torch.float8_e4m3fn,33,0,734.9548,a8w8_bpreshuffle_256x256x256x128_16x16_16x16_8x32x1_8x32x1_1x32x1x8_8x8x1_2x1_intrawave_v3,2618.05,570.69,0.0
256,8192,16384,2048,torch.float8_e4m3fn,102,0,303.9224,a8w8_bpreshuffle_256x96x256x128_16x16_16x16_8x32x1_8x32x1_1x32x1x8_8x8x1_2x1_intrawave_v3,1808.87,1048.84,0.0
256,8192,16384,4096,torch.float8_e4m3fn,33,0,497.9337,a8w8_bpreshuffle_256x256x256x128_16x16_16x16_8x32x1_8x32x1_1x32x1x8_8x8x1_2x1_intrawave_v3,2208.15,741.26,0.0
256,8192,16384,6656,torch.float8_e4m3fn,33,0,770.3086,a8w8_bpreshuffle_256x256x256x128_16x16_16x16_8x32x1_8x32x1_1x32x1x8_8x8x1_2x1_intrawave_v3,2319.47,560.83,0.0
256,8192,16384,8192,torch.float8_e4m3fn,33,0,903.531,a8w8_bpreshuffle_256x256x256x128_16x16_16x16_8x32x1_8x32x1_1x32x1x8_8x8x1_2x1_intrawave_v3,2433.81,519.92,0.0
256,8192,16384,13312,torch.float8_e4m3fn,107,0,1430.2158,a8w8_bpreshuffle_256x256x256x128_16x16_16x16_8x32x1_8x32x1_1x16x1x16_4x4x1_1x1_intrawave_v3,2498.51,416.43,0.0
256,8192,16384,26624,torch.float8_e4m3fn,154,0,3033.7821,a8w8_bpreshuffle_256x128x256x256_16x16_16x16_16x16x1_16x16x1_1x16x1x16_8x8x1_1x2_intrawave_v3,2355.75,304.16,0.0
256,8192,26624,16384,torch.float8_e4m3fn,33,0,2904.3718,a8w8_bpreshuffle_256x256x256x128_16x16_16x16_8x32x1_8x32x1_1x32x1x8_8x8x1_2x1_intrawave_v3,2460.71,346.59,0.0
256,8192,51200,5120,torch.float8_e4m3fn,33,0,1857.9691,a8w8_bpreshuffle_256x256x256x128_16x16_16x16_8x32x1_8x32x1_1x32x1x8_8x8x1_2x1_intrawave_v3,2311.65,615.16,0.0
256,8192,53248,16384,torch.float8_e4m3fn,33,0,5722.4616,a8w8_bpreshuffle_256x256x256x128_16x16_16x16_8x32x1_8x32x1_1x32x1x8_8x8x1_2x1_intrawave_v3,2497.82,328.36,0.0
256,8192,57344,8192,torch.float8_e4m3fn,33,0,2991.7292,a8w8_bpreshuffle_256x256x256x128_16x16_16x16_8x32x1_8x32x1_1x32x1x8_8x8x1_2x1_intrawave_v3,2572.62,493.49,0.0
256,16384,800,5120,torch.float8_e4m3fn,69,0,108.6586,a8w8_bpreshuffle_256x128x160x128_16x16_16x16_8x32x1_8x32x1_1x64x1x4_8x8x1_2x1_intrawave_v3,1235.22,1050.97,0.0
256,16384,1280,8192,torch.float8_e4m3fn,158,0,157.7142,a8w8_bpreshuffle_256x192x256x128_16x16_16x16_8x32x1_8x32x1_1x16x1x16_8x8x1_1x2_intrawave_v3,2178.61,1183.45,0.0
256,16384,2304,16384,torch.float8_e4m3fn,154,0,577.0581,a8w8_bpreshuffle_256x128x256x256_16x16_16x16_16x16x1_16x16x1_1x16x1x16_8x8x1_1x2_intrawave_v3,2143.55,661.43,0.0
256,16384,2560,8192,torch.float8_e4m3fn,154,0,283.4813,a8w8_bpreshuffle_256x128x256x256_16x16_16x16_16x16x1_16x16x1_1x16x1x16_8x8x1_1x2_intrawave_v3,2424.13,843.35,0.0
256,16384,4608,16384,torch.float8_e4m3fn,154,0,1050.0065,a8w8_bpreshuffle_256x128x256x256_16x16_16x16_16x16x1_16x16x1_1x16x1x16_8x8x1_1x2_intrawave_v3,2356.08,471.36,0.0
256,16384,5120,640,torch.float8_e4m3fn,143,0,91.8209,a8w8_bpreshuffle_256x192x128x128_16x16_16x16_8x32x1_8x32x1_1x16x1x16_8x8x1_1x2_intrawave_v3,1169.39,1977.05,0.0
256,16384,5120,1280,torch.float8_e4m3fn,143,0,139.3615,a8w8_bpreshuffle_256x192x128x128_16x16_16x16_8x32x1_8x32x1_1x16x1x16_8x8x1_1x2_intrawave_v3,1540.94,1401.37,0.0
256,16384,5120,3200,torch.float8_e4m3fn,33,0,250.8978,a8w8_bpreshuffle_256x256x256x128_16x16_16x16_8x32x1_8x32x1_1x32x1x8_8x8x1_2x1_intrawave_v3,2139.8,942.95,0.0
256,16384,5120,5120,torch.float8_e4m3fn,33,0,403.9327,a8w8_bpreshuffle_256x256x256x128_16x16_16x16_8x32x1_8x32x1_1x32x1x8_8x8x1_2x1_intrawave_v3,2126.58,687.92,0.0
256,16384,5120,6400,torch.float8_e4m3fn,107,0,443.5168,a8w8_bpreshuffle_256x256x256x128_16x16_16x16_8x32x1_8x32x1_1x16x1x16_4x4x1_1x1_intrawave_v3,2420.97,688.58,0.0
256,16384,5120,25600,torch.float8_e4m3fn,154,0,1817.1823,a8w8_bpreshuffle_256x128x256x256_16x16_16x16_16x16x1_16x16x1_1x16x1x16_8x8x1_1x2_intrawave_v3,2363.53,395.27,0.0
256,16384,6400,5120,torch.float8_e4m3fn,154,0,516.4428,a8w8_bpreshuffle_256x128x256x256_16x16_16x16_16x16x1_16x16x1_1x16x1x16_8x8x1_1x2_intrawave_v3,2079.11,631.96,0.0
256,16384,7168,8192,torch.float8_e4m3fn,154,0,761.2665,a8w8_bpreshuffle_256x128x256x256_16x16_16x16_16x16x1_16x16x1_1x16x1x16_8x8x1_1x2_intrawave_v3,2527.56,561.98,0.0
256,16384,8192,1024,torch.float8_e4m3fn,143,0,172.4777,a8w8_bpreshuffle_256x192x128x128_16x16_16x16_8x32x1_8x32x1_1x16x1x16_8x8x1_1x2_intrawave_v3,1593.7,1702.26,0.0
256,16384,8192,2048,torch.float8_e4m3fn,51,0,272.4657,a8w8_bpreshuffle_256x192x128x128_16x16_16x16_8x32x1_8x32x1_1x32x1x8_8x8x1_2x1_intrawave_v3,2017.71,1169.93,0.0
256,16384,8192,3584,torch.float8_e4m3fn,33,0,421.1579,a8w8_bpreshuffle_256x256x256x128_16x16_16x16_8x32x1_8x32x1_1x32x1x8_8x8x1_2x1_intrawave_v3,2284.35,846.51,0.0
256,16384,8192,7168,torch.float8_e4m3fn,158,0,753.6754,a8w8_bpreshuffle_256x192x256x128_16x16_16x16_8x32x1_8x32x1_1x16x1x16_8x8x1_1x2_intrawave_v3,2553.02,589.9,0.0
256,16384,8192,8192,torch.float8_e4m3fn,158,0,852.0249,a8w8_bpreshuffle_256x192x256x128_16x16_16x16_8x32x1_8x32x1_1x16x1x16_8x8x1_1x2_intrawave_v3,2580.94,551.35,0.0
256,16384,8192,28672,torch.float8_e4m3fn,33,0,2785.3542,a8w8_bpreshuffle_256x256x256x128_16x16_16x16_8x32x1_8x32x1_1x32x1x8_8x8x1_2x1_intrawave_v3,2763.23,349.36,0.0
256,16384,9216,16384,torch.float8_e4m3fn,33,0,2047.2744,a8w8_bpreshuffle_256x256x256x128_16x16_16x16_8x32x1_8x32x1_1x32x1x8_8x8x1_2x1_intrawave_v3,2416.78,352.38,0.0
256,16384,10240,8192,torch.float8_e4m3fn,33,0,1068.7185,a8w8_bpreshuffle_256x256x256x128_16x16_16x16_8x32x1_8x32x1_1x32x1x8_8x8x1_2x1_intrawave_v3,2572.03,518.05,0.0
256,16384,12800,5120,torch.float8_e4m3fn,33,0,974.5645,a8w8_bpreshuffle_256x256x256x128_16x16_16x16_8x32x1_8x32x1_1x32x1x8_8x8x1_2x1_intrawave_v3,2203.53,583.7,0.0
256,16384,13312,16384,torch.float8_e4m3fn,33,0,2958.4415,a8w8_bpreshuffle_256x256x256x128_16x16_16x16_8x32x1_8x32x1_1x32x1x8_8x8x1_2x1_intrawave_v3,2415.74,311.9,0.0
256,16384,14336,8192,torch.float8_e4m3fn,158,0,1477.5648,a8w8_bpreshuffle_256x192x256x128_16x16_16x16_8x32x1_8x32x1_1x16x1x16_8x8x1_1x2_intrawave_v3,2604.48,488.25,0.0
256,16384,16384,2048,torch.float8_e4m3fn,102,0,598.3663,a8w8_bpreshuffle_256x96x256x128_16x16_16x16_8x32x1_8x32x1_1x32x1x8_8x8x1_2x1_intrawave_v3,1837.52,1009.38,0.0
256,16384,16384,4096,torch.float8_e4m3fn,33,0,988.8674,a8w8_bpreshuffle_256x256x256x128_16x16_16x16_8x32x1_8x32x1_1x32x1x8_8x8x1_2x1_intrawave_v3,2223.78,678.64,0.0
256,16384,16384,6656,torch.float8_e4m3fn,33,0,1537.3785,a8w8_bpreshuffle_256x256x256x128_16x16_16x16_8x32x1_8x32x1_1x32x1x8_8x8x1_2x1_intrawave_v3,2324.35,491.08,0.0
256,16384,16384,8192,torch.float8_e4m3fn,33,0,1794.5054,a8w8_bpreshuffle_256x256x256x128_16x16_16x16_8x32x1_8x32x1_1x32x1x8_8x8x1_2x1_intrawave_v3,2450.84,448.76,0.0
256,16384,16384,13312,torch.float8_e4m3fn,33,0,2976.2278,a8w8_bpreshuffle_256x256x256x128_16x16_16x16_8x32x1_8x32x1_1x32x1x8_8x8x1_2x1_intrawave_v3,2401.3,326.95,0.0
256,16384,16384,26624,torch.float8_e4m3fn,154,0,6167.0855,a8w8_bpreshuffle_256x128x256x256_16x16_16x16_16x16x1_16x16x1_1x16x1x16_8x8x1_1x2_intrawave_v3,2317.73,228.52,0.0
256,16384,26624,16384,torch.float8_e4m3fn,33,0,5797.7818,a8w8_bpreshuffle_256x256x256x128_16x16_16x16_8x32x1_8x32x1_1x32x1x8_8x8x1_2x1_intrawave_v3,2465.37,272.01,0.0
256,16384,51200,5120,torch.float8_e4m3fn,33,0,3711.513,a8w8_bpreshuffle_256x256x256x128_16x16_16x16_8x32x1_8x32x1_1x32x1x8_8x8x1_2x1_intrawave_v3,2314.4,545.26,0.0
256,16384,53248,16384,torch.float8_e4m3fn,33,0,11284.2706,a8w8_bpreshuffle_256x256x256x128_16x16_16x16_8x32x1_8x32x1_1x32x1x8_8x8x1_2x1_intrawave_v3,2533.38,255.73,0.0
256,16384,57344,8192,torch.float8_e4m3fn,33,0,5984.2692,a8w8_bpreshuffle_256x256x256x128_16x16_16x16_8x32x1_8x32x1_1x32x1x8_8x8x1_2x1_intrawave_v3,2572.27,414.93,0.0
256,32768,800,5120,torch.float8_e4m3fn,69,0,196.771,a8w8_bpreshuffle_256x128x160x128_16x16_16x16_8x32x1_8x32x1_1x64x1x4_8x8x1_2x1_intrawave_v3,1364.2,1139.89,0.0
256,32768,1280,8192,torch.float8_e4m3fn,154,0,288.2725,a8w8_bpreshuffle_256x128x256x256_16x16_16x16_16x16x1_16x16x1_1x16x1x16_8x8x1_1x2_intrawave_v3,2383.84,1258.56,0.0
256,32768,2304,16384,torch.float8_e4m3fn,154,0,1073.694,a8w8_bpreshuffle_256x128x256x256_16x16_16x16_16x16x1_16x16x1_1x16x1x16_8x8x1_1x2_intrawave_v3,2304.1,675.81,0.0
256,32768,2560,8192,torch.float8_e4m3fn,158,0,549.7961,a8w8_bpreshuffle_256x192x256x128_16x16_16x16_8x32x1_8x32x1_1x16x1x16_8x8x1_1x2_intrawave_v3,2499.82,831.54,0.0
256,32768,4608,16384,torch.float8_e4m3fn,154,0,2120.2853,a8w8_bpreshuffle_256x128x256x256_16x16_16x16_16x16x1_16x16x1_1x16x1x16_8x8x1_1x2_intrawave_v3,2333.55,431.24,0.0
256,32768,5120,640,torch.float8_e4m3fn,143,0,181.1291,a8w8_bpreshuffle_256x192x128x128_16x16_16x16_8x32x1_8x32x1_1x16x1x16_8x8x1_1x2_intrawave_v3,1185.61,1986.39,0.0
256,32768,5120,1280,torch.float8_e4m3fn,102,0,269.995,a8w8_bpreshuffle_256x96x256x128_16x16_16x16_8x32x1_8x32x1_1x32x1x8_8x8x1_2x1_intrawave_v3,1590.76,1422.4,0.0
256,32768,5120,3200,torch.float8_e4m3fn,33,0,492.1153,a8w8_bpreshuffle_256x256x256x128_16x16_16x16_8x32x1_8x32x1_1x32x1x8_8x8x1_2x1_intrawave_v3,2181.89,928.21,0.0
256,32768,5120,5120,torch.float8_e4m3fn,33,0,764.8154,a8w8_bpreshuffle_256x256x256x128_16x16_16x16_8x32x1_8x32x1_1x32x1x8_8x8x1_2x1_intrawave_v3,2246.28,692.36,0.0
256,32768,5120,6400,torch.float8_e4m3fn,33,0,868.9521,a8w8_bpreshuffle_256x256x256x128_16x16_16x16_8x32x1_8x32x1_1x32x1x8_8x8x1_2x1_intrawave_v3,2471.35,665.2,0.0
256,32768,5120,25600,torch.float8_e4m3fn,154,0,3714.3301,a8w8_bpreshuffle_256x128x256x256_16x16_16x16_16x16x1_16x16x1_1x16x1x16_8x8x1_1x2_intrawave_v3,2312.65,351.47,0.0
256,32768,6400,5120,torch.float8_e4m3fn,33,0,980.8335,a8w8_bpreshuffle_256x256x256x128_16x16_16x16_8x32x1_8x32x1_1x32x1x8_8x8x1_2x1_intrawave_v3,2189.45,632.09,0.0
256,32768,7168,8192,torch.float8_e4m3fn,158,0,1484.7467,a8w8_bpreshuffle_256x192x256x128_16x16_16x16_8x32x1_8x32x1_1x16x1x16_8x8x1_1x2_intrawave_v3,2591.88,536.74,0.0
256,32768,8192,1024,torch.float8_e4m3fn,143,0,340.0384,a8w8_bpreshuffle_256x192x128x128_16x16_16x16_8x32x1_8x32x1_1x16x1x16_8x8x1_1x2_intrawave_v3,1616.75,1702.2,0.0
256,32768,8192,2048,torch.float8_e4m3fn,143,0,536.6149,a8w8_bpreshuffle_256x192x128x128_16x16_16x16_8x32x1_8x32x1_1x16x1x16_8x8x1_1x2_intrawave_v3,2048.98,1156.8,0.0
256,32768,8192,3584,torch.float8_e4m3fn,51,0,841.2106,a8w8_bpreshuffle_256x192x128x128_16x16_16x16_8x32x1_8x32x1_1x32x1x8_8x8x1_2x1_intrawave_v3,2287.35,812.72,0.0
256,32768,8192,7168,torch.float8_e4m3fn,158,0,1500.7026,a8w8_bpreshuffle_256x192x256x128_16x16_16x16_8x32x1_8x32x1_1x16x1x16_8x8x1_1x2_intrawave_v3,2564.33,553.39,0.0
256,32768,8192,8192,torch.float8_e4m3fn,158,0,1696.016,a8w8_bpreshuffle_256x192x256x128_16x16_16x16_8x32x1_8x32x1_1x16x1x16_8x8x1_1x2_intrawave_v3,2593.16,514.39,0.0
256,32768,8192,28672,torch.float8_e4m3fn,33,0,5558.3544,a8w8_bpreshuffle_256x256x256x128_16x16_16x16_8x32x1_8x32x1_1x32x1x8_8x8x1_2x1_intrawave_v3,2769.37,307.87,0.0
256,32768,9216,16384,torch.float8_e4m3fn,33,0,4103.0357,a8w8_bpreshuffle_256x256x256x128_16x16_16x16_8x32x1_8x32x1_1x32x1x8_8x8x1_2x1_intrawave_v3,2411.78,314.85,0.0
256,32768,10240,8192,torch.float8_e4m3fn,158,0,2102.9024,a8w8_bpreshuffle_256x192x256x128_16x16_16x16_8x32x1_8x32x1_1x16x1x16_8x8x1_1x2_intrawave_v3,2614.27,486.67,0.0
256,32768,12800,5120,torch.float8_e4m3fn,33,0,1888.3681,a8w8_bpreshuffle_256x256x256x128_16x16_16x16_8x32x1_8x32x1_1x32x1x8_8x8x1_2x1_intrawave_v3,2274.43,567.78,0.0
256,32768,13312,16384,torch.float8_e4m3fn,33,0,6036.8682,a8w8_bpreshuffle_256x256x256x128_16x16_16x16_8x32x1_8x32x1_1x32x1x8_8x8x1_2x1_intrawave_v3,2367.73,269.58,0.0
256,32768,14336,8192,torch.float8_e4m3fn,158,0,2945.0068,a8w8_bpreshuffle_256x192x256x128_16x16_16x16_8x32x1_8x32x1_1x16x1x16_8x8x1_1x2_intrawave_v3,2613.43,450.05,0.0
256,32768,16384,2048,torch.float8_e4m3fn,102,0,1180.9193,a8w8_bpreshuffle_256x96x256x128_16x16_16x16_8x32x1_8x32x1_1x32x1x8_8x8x1_2x1_intrawave_v3,1862.13,994.48,0.0
256,32768,16384,4096,torch.float8_e4m3fn,33,0,1989.9333,a8w8_bpreshuffle_256x256x256x128_16x16_16x16_8x32x1_8x32x1_1x32x1x8_8x8x1_2x1_intrawave_v3,2210.15,640.76,0.0
256,32768,16384,6656,torch.float8_e4m3fn,33,0,3099.1632,a8w8_bpreshuffle_256x256x256x128_16x16_16x16_8x32x1_8x32x1_1x32x1x8_8x8x1_2x1_intrawave_v3,2306.05,452.02,0.0
256,32768,16384,8192,torch.float8_e4m3fn,33,0,3588.7344,a8w8_bpreshuffle_256x256x256x128_16x16_16x16_8x32x1_8x32x1_1x32x1x8_8x8x1_2x1_intrawave_v3,2451.03,411.4,0.0
256,32768,16384,13312,torch.float8_e4m3fn,33,0,5598.3345,a8w8_bpreshuffle_256x256x256x128_16x16_16x16_8x32x1_8x32x1_1x32x1x8_8x8x1_2x1_intrawave_v3,2553.2,308.67,0.0
256,32768,16384,26624,torch.float8_e4m3fn,154,0,12187.7899,a8w8_bpreshuffle_256x128x256x256_16x16_16x16_16x16x1_16x16x1_1x16x1x16_8x8x1_1x2_intrawave_v3,2345.57,195.47,0.0
256,32768,26624,16384,torch.float8_e4m3fn,33,0,11524.899,a8w8_bpreshuffle_256x256x256x128_16x16_16x16_8x32x1_8x32x1_1x32x1x8_8x8x1_2x1_intrawave_v3,2480.48,235.83,0.0
256,32768,51200,5120,torch.float8_e4m3fn,33,0,7575.0119,a8w8_bpreshuffle_256x256x256x128_16x16_16x16_8x32x1_8x32x1_1x32x1x8_8x8x1_2x1_intrawave_v3,2267.97,499.72,0.0
256,32768,53248,16384,torch.float8_e4m3fn,33,0,22600.3968,a8w8_bpreshuffle_256x256x256x128_16x16_16x16_8x32x1_8x32x1_1x32x1x8_8x8x1_2x1_intrawave_v3,2529.81,216.76,0.0
256,32768,57344,8192,torch.float8_e4m3fn,158,0,11963.3054,a8w8_bpreshuffle_256x192x256x128_16x16_16x16_8x32x1_8x32x1_1x16x1x16_8x8x1_1x2_intrawave_v3,2573.4,375.84,0.0
80,192,128,5120,torch.int8,160,8,12.1485,_ZN5aiter42I8gemm_bf16_perTokenI8_BpreShuffle_128x128E,20.72,138.91,0.1606
80,64,1536,5120,torch.int8,160,6,12.9215,_ZN5aiter42I8gemm_bf16_perTokenI8_BpreShuffle_128x128E,77.9,649.2,0.1336
80,80,1536,5120,torch.int8,160,6,13.5695,_ZN5aiter42I8gemm_bf16_perTokenI8_BpreShuffle_128x128E,92.73,627.86,0.135
80,128,1536,5120,torch.int8,160,6,14.3572,_ZN5aiter42I8gemm_bf16_perTokenI8_BpreShuffle_128x128E,140.23,620.8,0.1335
80,150,1536,5120,torch.int8,161,6,18.1719,_ZN5aiter42I8gemm_bf16_perTokenI8_BpreShuffle_192x128E,129.83,500.39,0.1344
80,192,1536,5120,torch.int8,161,6,18.2027,_ZN5aiter42I8gemm_bf16_perTokenI8_BpreShuffle_192x128E,165.9,518.45,0.1342
80,220,1536,5120,torch.int8,160,3,21.1629,_ZN5aiter42I8gemm_bf16_perTokenI8_BpreShuffle_128x128E,163.51,456.77,0.0857
80,256,1536,5120,torch.int8,160,3,21.3733,_ZN5aiter42I8gemm_bf16_perTokenI8_BpreShuffle_128x128E,188.39,466.07,0.0853
80,384,1536,5120,torch.int8,161,3,26.9758,_ZN5aiter42I8gemm_bf16_perTokenI8_BpreShuffle_192x128E,223.9,408.15,0.0875
80,448,1536,5120,torch.int8,161,2,33.1084,_ZN5aiter42I8gemm_bf16_perTokenI8_BpreShuffle_192x128E,212.83,348.38,0.0523
80,512,1536,5120,torch.int8,161,2,33.5781,_ZN5aiter42I8gemm_bf16_perTokenI8_BpreShuffle_192x128E,239.83,359.12,0.0534
80,128,8192,1024,torch.int8,160,1,14.9178,_ZN5aiter42I8gemm_bf16_perTokenI8_BpreShuffle_128x128E,143.95,711.69,0.0
80,192,8192,1024,torch.int8,161,1,19.5799,_ZN5aiter42I8gemm_bf16_perTokenI8_BpreShuffle_192x128E,164.52,599.13,0.0007
80,256,8192,1024,torch.int8,160,1,27.0157,_ZN5aiter42I8gemm_bf16_perTokenI8_BpreShuffle_128x128E,158.98,475.47,0.0
80,320,8192,1024,torch.int8,161,1,34.1636,_ZN5aiter42I8gemm_bf16_perTokenI8_BpreShuffle_192x128E,157.15,408.6,0.0
80,512,8192,1024,torch.int8,161,1,49.4192,_ZN5aiter42I8gemm_bf16_perTokenI8_BpreShuffle_192x128E,173.82,350.1,0.0003
80,1024,8192,1024,torch.int8,161,1,82.0338,_ZN5aiter42I8gemm_bf16_perTokenI8_BpreShuffle_192x128E,209.42,319.56,0.0
80,2048,8192,1024,torch.int8,161,1,147.0079,_ZN5aiter42I8gemm_bf16_perTokenI8_BpreShuffle_192x128E,233.73,299.58,0.0003
80,4096,8192,1024,torch.int8,161,1,288.7332,_ZN5aiter42I8gemm_bf16_perTokenI8_BpreShuffle_192x128E,238.0,276.0,0.0003
80,8192,8192,1024,torch.int8,161,1,563.934,_ZN5aiter42I8gemm_bf16_perTokenI8_BpreShuffle_192x128E,243.71,267.75,0.0006
80,16384,8192,1024,torch.int8,161,1,1104.9189,_ZN5aiter42I8gemm_bf16_perTokenI8_BpreShuffle_192x128E,248.78,265.72,0.0004
80,128,1280,8192,torch.int8,161,8,18.4707,_ZN5aiter42I8gemm_bf16_perTokenI8_BpreShuffle_192x128E,145.33,642.21,0.1588
80,192,1280,5120,torch.int8,161,8,16.3619,_ZN5aiter42I8gemm_bf16_perTokenI8_BpreShuffle_192x128E,153.81,490.66,0.1651
80,192,1280,8192,torch.int8,161,8,19.5141,_ZN5aiter42I8gemm_bf16_perTokenI8_BpreShuffle_192x128E,206.34,643.13,0.1637
80,192,1280,1024,torch.int8,160,6,9.0346,_ZN5aiter42I8gemm_bf16_perTokenI8_BpreShuffle_128x128E,55.71,221.24,0.0914
80,192,1536,1024,torch.int8,160,3,10.3979,_ZN5aiter42I8gemm_bf16_perTokenI8_BpreShuffle_128x128E,58.09,226.9,0.0725
80,256,1280,8192,torch.int8,160,4,23.0901,_ZN5aiter42I8gemm_bf16_perTokenI8_BpreShuffle_128x128E,232.51,573.33,0.1074
80,320,1280,8192,torch.int8,161,4,29.0859,_ZN5aiter42I8gemm_bf16_perTokenI8_BpreShuffle_192x128E,230.73,478.8,0.107
80,512,1280,8192,torch.int8,160,2,38.6745,_ZN5aiter42I8gemm_bf16_perTokenI8_BpreShuffle_128x128E,277.64,413.47,0.0542
80,1024,1280,8192,torch.int8,160,1,69.7841,_ZN5aiter42I8gemm_bf16_perTokenI8_BpreShuffle_128x128E,307.73,308.03,0.0
80,2048,1280,8192,torch.int8,160,1,132.2413,_ZN5aiter42I8gemm_bf16_perTokenI8_BpreShuffle_128x128E,324.78,245.81,0.0
80,4096,1280,8192,torch.int8,161,1,251.3328,_ZN5aiter42I8gemm_bf16_perTokenI8_BpreShuffle_192x128E,341.78,216.95,0.0021
80,8192,1280,8192,torch.int8,161,1,496.6916,_ZN5aiter42I8gemm_bf16_perTokenI8_BpreShuffle_192x128E,345.89,198.45,0.0016
80,16384,1280,8192,torch.int8,161,1,906.8273,_ZN5aiter42I8gemm_bf16_perTokenI8_BpreShuffle_192x128E,378.9,205.82,0.0021
80,192,8192,5120,torch.int8,161,1,60.0426,_ZN5aiter42I8gemm_bf16_perTokenI8_BpreShuffle_192x128E,268.25,767.32,0.0026
80,1,512,7168,torch.float8_e4m3fnuz,10,1,11.5805,a8w8_bpreshuffle_128x16x32x512_16x16_16x16_32x4x1_32x4x1_1x16x1x8_4x4x1_1x1_intrawave_v1,0.63,317.62,0
80,1,1280,8192,torch.float8_e4m3fnuz,11,0,14.3155,a8w8_bpreshuffle_256x16x64x512_16x16_16x16_32x8x1_32x8x1_1x16x1x16_4x4x1_1x1_intrawave_v1,1.46,733.23,0
80,1,2112,7168,torch.float8_e4m3fnuz,11,0,13.4147,a8w8_bpreshuffle_256x16x64x512_16x16_16x16_32x8x1_32x8x1_1x16x1x16_4x4x1_1x1_intrawave_v1,2.26,1129.37,0
80,1,4096,512,torch.float8_e4m3fnuz,9,0,4.2138,a8w8_bpreshuffle_128x16x32x128_16x16_16x16_8x16x1_8x16x1_1x16x1x8_4x4x1_1x1_intrawave_v1,1,499.75,0
80,1,4608,4096,torch.float8_e4m3fnuz,11,0,10.5838,a8w8_bpreshuffle_256x16x64x512_16x16_16x16_32x8x1_32x8x1_1x16x1x16_4x4x1_1x1_intrawave_v1,3.57,1784.58,0
80,1,4608,7168,torch.float8_e4m3fnuz,5,0,13.8515,a8w8_bpreshuffle_256x16x64x512_16x16_16x16_32x8x1_32x8x1_1x16x1x16_4x4x1_1x1_intrawave_v1,4.77,2385.77,0
80,1,7168,256,torch.float8_e4m3fnuz,75,0,6.4606,a8w8_bpreshuffle_128x16x256x64_16x16_16x16_4x16x1_4x32x1_1x16x1x8_8x8x1_1x2_intrawave_v1,0.57,286.29,0
80,1,7168,2304,torch.float8_e4m3fnuz,29,0,10.1762,a8w8_bpreshuffle_256x16x64x256_16x16_16x16_16x16x1_16x16x1_1x16x1x16_4x4x1_1x1_intrawave_v2,3.25,1624.55,0
80,1,8192,1024,torch.float8_e4m3fnuz,15,0,6.4482,a8w8_bpreshuffle_256x16x64x256_16x16_16x16_16x16x1_16x16x1_1x16x1x16_4x4x1_1x1_intrawave_v1,2.6,1303.62,0
80,1,9216,4096,torch.float8_e4m3fnuz,19,0,14.4331,a8w8_bpreshuffle_256x16x64x512_16x16_16x16_32x8x1_32x8x1_1x16x1x16_4x4x1_1x1_intrawave_v2,5.23,2616.99,0
80,2,4608,4096,torch.float8_e4m3fnuz,5,0,10.661,a8w8_bpreshuffle_256x16x64x512_16x16_16x16_32x8x1_32x8x1_1x16x1x16_4x4x1_1x1_intrawave_v1,7.08,1772.91,0
80,2,9216,4096,torch.float8_e4m3fnuz,5,0,14.4331,a8w8_bpreshuffle_256x16x64x512_16x16_16x16_32x8x1_32x8x1_1x16x1x16_4x4x1_1x1_intrawave_v1,10.46,2618.55,0
80,4,4608,4096,torch.float8_e4m3fnuz,5,0,10.4863,a8w8_bpreshuffle_256x16x64x512_16x16_16x16_32x8x1_32x8x1_1x16x1x16_4x4x1_1x1_intrawave_v1,14.4,1804.99,0
80,4,9216,4096,torch.float8_e4m3fnuz,11,0,14.6151,a8w8_bpreshuffle_256x16x64x512_16x16_16x16_32x8x1_32x8x1_1x16x1x16_4x4x1_1x1_intrawave_v1,20.66,2589.02,0
80,8,4608,4096,torch.float8_e4m3fnuz,5,0,10.8626,a8w8_bpreshuffle_256x16x64x512_16x16_16x16_32x8x1_32x8x1_1x16x1x16_4x4x1_1x1_intrawave_v1,27.8,1747.36,0
80,8,9216,4096,torch.float8_e4m3fnuz,5,0,15.0571,a8w8_bpreshuffle_256x16x64x512_16x16_16x16_32x8x1_32x8x1_1x16x1x16_4x4x1_1x1_intrawave_v1,40.11,2519.01,0
80,16,512,7168,torch.float8_e4m3fnuz,24,0,10.7923,a8w8_bpreshuffle_128x16x32x512_16x16_16x16_32x4x1_32x4x1_1x16x1x8_4x4x1_1x1_intrawave_v2,10.88,352.2,0
80,16,576,7168,torch.float8_e4m3fnuz,10,0,11.091,a8w8_bpreshuffle_128x16x32x512_16x16_16x16_32x4x1_32x4x1_1x16x1x8_4x4x1_1x1_intrawave_v1,11.91,384.27,0
80,16,1536,7168,torch.float8_e4m3fnuz,10,0,11.2927,a8w8_bpreshuffle_128x16x32x512_16x16_16x16_32x4x1_32x4x1_1x16x1x8_4x4x1_1x1_intrawave_v1,31.2,989.48,0
80,16,2112,7168,torch.float8_e4m3fnuz,24,0,11.7534,a8w8_bpreshuffle_128x16x32x512_16x16_16x16_32x4x1_32x4x1_1x16x1x8_4x4x1_1x1_intrawave_v2,41.22,1303.55,0
80,16,3072,1536,torch.float8_e4m3fnuz,11,0,5.8974,a8w8_bpreshuffle_256x16x64x512_16x16_16x16_32x8x1_32x8x1_1x16x1x16_4x4x1_1x1_intrawave_v1,25.6,820.95,0
80,16,4096,512,torch.float8_e4m3fnuz,9,0,4.939,a8w8_bpreshuffle_128x16x32x128_16x16_16x16_8x16x1_8x16x1_1x16x1x8_4x4x1_1x1_intrawave_v1,13.59,452.81,0
80,16,4608,4096,torch.float8_e4m3fnuz,24,0,10.8403,a8w8_bpreshuffle_128x16x32x512_16x16_16x16_32x4x1_32x4x1_1x16x1x8_4x4x1_1x1_intrawave_v2,55.72,1760.78,0
80,16,4608,7168,torch.float8_e4m3fnuz,5,0,14.1863,a8w8_bpreshuffle_256x16x64x512_16x16_16x16_32x8x1_32x8x1_1x16x1x16_4x4x1_1x1_intrawave_v1,74.51,2346.79,0
80,16,7168,256,torch.float8_e4m3fnuz,75,0,6.629,a8w8_bpreshuffle_128x16x256x64_16x16_16x16_4x16x1_4x32x1_1x16x1x8_8x8x1_1x2_intrawave_v1,8.86,312.03,0
80,16,7168,2048,torch.float8_e4m3fnuz,10,0,8.769,a8w8_bpreshuffle_128x16x32x512_16x16_16x16_32x4x1_32x4x1_1x16x1x8_4x4x1_1x1_intrawave_v1,53.57,1703.98,0
80,16,7168,2304,torch.float8_e4m3fnuz,15,0,10.491,a8w8_bpreshuffle_256x16x64x256_16x16_16x16_16x16x1_16x16x1_1x16x1x16_4x4x1_1x1_intrawave_v1,50.37,1599.59,0
80,16,9216,4096,torch.float8_e4m3fnuz,11,0,15.5867,a8w8_bpreshuffle_256x16x64x512_16x16_16x16_32x8x1_32x8x1_1x16x1x16_4x4x1_1x1_intrawave_v1,77.5,2444.98,0
80,32,1280,8192,torch.float8_e4m3fnuz,24,0,12.4575,a8w8_bpreshuffle_128x16x32x512_16x16_16x16_32x4x1_32x4x1_1x16x1x8_4x4x1_1x1_intrawave_v2,53.87,869.34,0
80,32,4608,4096,torch.float8_e4m3fnuz,6,0,13.4935,a8w8_bpreshuffle_256x16x128x512_16x16_16x16_32x8x1_32x8x1_1x16x1x16_8x8x1_1x2_intrawave_v1,89.52,1430.34,0
80,32,7168,256,torch.float8_e4m3fnuz,75,0,6.8302,a8w8_bpreshuffle_128x16x256x64_16x16_16x16_4x16x1_4x32x1_1x16x1x8_8x8x1_1x2_intrawave_v1,17.19,337.03,0
80,32,8192,1024,torch.float8_e4m3fnuz,119,0,7.4863,a8w8_bpreshuffle_256x32x128x256_16x16_16x16_16x16x1_16x16x1_1x16x1x16_8x8x1_1x2_intrawave_v1,71.71,1194.94,0
80,32,9216,4096,torch.float8_e4m3fnuz,119,0,18.4783,a8w8_bpreshuffle_256x32x128x256_16x16_16x16_16x16x1_16x16x1_1x16x1x16_8x8x1_1x2_intrawave_v1,130.74,2081.88,0
80,48,512,7168,torch.float8_e4m3fnuz,10,0,11.2279,a8w8_bpreshuffle_128x16x32x512_16x16_16x16_32x4x1_32x4x1_1x16x1x8_4x4x1_1x1_intrawave_v1,31.38,361.89,0
80,48,2112,7168,torch.float8_e4m3fnuz,10,0,18.4707,a8w8_bpreshuffle_128x16x32x512_16x16_16x16_32x4x1_32x4x1_1x16x1x8_4x4x1_1x1_intrawave_v1,78.68,849.22,0
80,48,4096,512,torch.float8_e4m3fnuz,9,0,5.3534,a8w8_bpreshuffle_128x16x32x128_16x16_16x16_8x16x1_8x16x1_1x16x1x8_4x4x1_1x1_intrawave_v1,37.61,469.78,0
80,48,4608,7168,torch.float8_e4m3fnuz,113,0,22.5027,a8w8_bpreshuffle_256x48x64x256_16x16_16x16_16x16x1_16x16x1_1x16x1x16_4x4x1_1x1_intrawave_v1,140.91,1502.78,0
80,48,7168,256,torch.float8_e4m3fnuz,75,0,7.0126,a8w8_bpreshuffle_128x16x256x64_16x16_16x16_4x16x1_4x32x1_1x16x1x8_8x8x1_1x2_intrawave_v1,25.12,361.55,0
80,48,7168,2304,torch.float8_e4m3fnuz,113,0,13.6727,a8w8_bpreshuffle_256x48x64x256_16x16_16x16_16x16x1_16x16x1_1x16x1x16_4x4x1_1x1_intrawave_v1,115.96,1266.3,0
80,64,512,7168,torch.float8_e4m3fnuz,10,0,11.1263,a8w8_bpreshuffle_128x16x32x512_16x16_16x16_32x4x1_32x4x1_1x16x1x8_4x4x1_1x1_intrawave_v1,42.22,376.97,0
80,64,576,7168,torch.float8_e4m3fnuz,24,0,11.163,a8w8_bpreshuffle_128x16x32x512_16x16_16x16_32x4x1_32x4x1_1x16x1x8_4x4x1_1x1_intrawave_v2,47.34,417.56,0
80,64,1280,8192,torch.float8_e4m3fnuz,19,0,13.7807,a8w8_bpreshuffle_256x16x64x512_16x16_16x16_32x8x1_32x8x1_1x16x1x16_4x4x1_1x1_intrawave_v2,97.4,810.84,0
80,64,1536,5120,torch.int8,160,6,12.9215,_ZN5aiter42I8gemm_bf16_perTokenI8_BpreShuffle_128x128E,77.9,649.2,0.1336
80,64,1536,7168,torch.float8_e4m3fnuz,19,0,16.9363,a8w8_bpreshuffle_256x16x64x512_16x16_16x16_32x8x1_32x8x1_1x16x1x16_4x4x1_1x1_intrawave_v2,83.21,688.78,0
80,64,2112,7168,torch.float8_e4m3fnuz,112,0,18.9179,a8w8_bpreshuffle_256x32x64x256_16x16_16x16_16x16x1_16x16x1_1x32x1x8_8x8x1_2x1_intrawave_v1,102.43,838.78,0
80,64,3072,1536,torch.float8_e4m3fnuz,114,0,9.0146,a8w8_bpreshuffle_256x64x64x256_16x16_16x16_16x16x1_16x16x1_1x32x1x8_8x8x1_2x1_intrawave_v3,67,577.96,0
80,64,4096,512,torch.float8_e4m3fnuz,77,0,5.8414,a8w8_bpreshuffle_256x64x64x128_16x16_16x16_8x32x1_8x32x1_1x32x1x8_8x8x1_2x1_intrawave_v3,45.95,454.38,0
80,64,4608,4096,torch.float8_e4m3fnuz,114,0,16.3715,a8w8_bpreshuffle_256x64x64x256_16x16_16x16_16x16x1_16x16x1_1x32x1x8_8x8x1_2x1_intrawave_v3,147.57,1204.92,0
80,64,4608,7168,torch.float8_e4m3fnuz,114,0,24.7999,a8w8_bpreshuffle_256x64x64x256_16x16_16x16_16x16x1_16x16x1_1x32x1x8_8x8x1_2x1_intrawave_v3,170.48,1374.15,0
80,64,7168,256,torch.float8_e4m3fnuz,75,0,7.6886,a8w8_bpreshuffle_128x16x256x64_16x16_16x16_4x16x1_4x32x1_1x16x1x8_8x8x1_1x2_intrawave_v1,30.55,360.13,0
80,64,7168,2048,torch.float8_e4m3fnuz,112,0,14.2819,a8w8_bpreshuffle_256x32x64x256_16x16_16x16_16x16x1_16x16x1_1x32x1x8_8x8x1_2x1_intrawave_v1,131.57,1101.3,0
80,64,7168,2304,torch.float8_e4m3fnuz,112,0,15.5151,a8w8_bpreshuffle_256x32x64x256_16x16_16x16_16x16x1_16x16x1_1x32x1x8_8x8x1_2x1_intrawave_v1,136.25,1133.09,0
80,64,8192,1024,torch.float8_e4m3fnuz,114,0,10.9842,a8w8_bpreshuffle_256x64x64x256_16x16_16x16_16x16x1_16x16x1_1x32x1x8_8x8x1_2x1_intrawave_v3,97.75,865.13,0
80,64,9216,4096,torch.float8_e4m3fnuz,114,0,25.0703,a8w8_bpreshuffle_256x64x64x256_16x16_16x16_16x16x1_16x16x1_1x32x1x8_8x8x1_2x1_intrawave_v3,192.73,1563.23,0
80,80,1536,5120,torch.int8,160,6,13.5695,_ZN5aiter42I8gemm_bf16_perTokenI8_BpreShuffle_128x128E,92.73,627.86,0.135
80,112,512,7168,torch.float8_e4m3fnuz,10,0,11.9903,a8w8_bpreshuffle_128x16x32x512_16x16_16x16_32x4x1_32x4x1_1x16x1x8_4x4x1_1x1_intrawave_v1,68.56,382.6,0
80,112,2112,7168,torch.float8_e4m3fnuz,112,0,25.9619,a8w8_bpreshuffle_256x32x64x256_16x16_16x16_16x16x1_16x16x1_1x32x1x8_8x8x1_2x1_intrawave_v1,130.62,632.26,0
80,112,4096,512,torch.float8_e4m3fnuz,76,0,7.3154,a8w8_bpreshuffle_256x32x64x128_16x16_16x16_8x32x1_8x32x1_1x32x1x8_8x8x1_2x1_intrawave_v1,64.22,419.94,0
80,112,4608,7168,torch.float8_e4m3fnuz,117,0,37.2568,a8w8_bpreshuffle_256x112x64x256_16x16_16x16_16x16x1_16x16x1_1x16x1x16_4x4x1_1x1_intrawave_v3,198.59,935.81,0
80,112,7168,256,torch.float8_e4m3fnuz,75,0,9.207,a8w8_bpreshuffle_128x16x256x64_16x16_16x16_4x16x1_4x32x1_1x16x1x8_8x8x1_1x2_intrawave_v1,44.64,376.81,0
80,112,7168,2304,torch.float8_e4m3fnuz,119,0,21.7835,a8w8_bpreshuffle_256x32x128x256_16x16_16x16_16x16x1_16x16x1_1x16x1x16_8x8x1_1x2_intrawave_v1,169.82,843.7,0
80,128,1280,8192,torch.int8,161,8,18.4707,_ZN5aiter42I8gemm_bf16_perTokenI8_BpreShuffle_192x128E,145.33,642.21,0.1588
80,128,1536,5120,torch.int8,160,6,14.3572,_ZN5aiter42I8gemm_bf16_perTokenI8_BpreShuffle_128x128E,140.23,620.8,0.1335
80,128,1536,7168,torch.float8_e4m3fnuz,112,0,22.8955,a8w8_bpreshuffle_256x32x64x256_16x16_16x16_16x16x1_16x16x1_1x32x1x8_8x8x1_2x1_intrawave_v1,123.11,538.13,0
80,128,3072,1536,torch.float8_e4m3fnuz,112,0,11.1838,a8w8_bpreshuffle_256x32x64x256_16x16_16x16_16x16x1_16x16x1_1x32x1x8_8x8x1_2x1_intrawave_v1,108.01,509.81,0
80,128,4608,4096,torch.float8_e4m3fnuz,121,0,24.6387,a8w8_bpreshuffle_256x64x128x256_16x16_16x16_16x16x1_16x16x1_1x16x1x16_8x8x1_1x2_intrawave_v3,196.11,835.2,0
80,128,8192,1024,torch.int8,160,1,14.9178,_ZN5aiter42I8gemm_bf16_perTokenI8_BpreShuffle_128x128E,143.95,711.69,0
80,128,9216,4096,torch.float8_e4m3fnuz,121,0,39.1328,a8w8_bpreshuffle_256x64x128x256_16x16_16x16_16x16x1_16x16x1_1x16x1x16_8x8x1_1x2_intrawave_v3,246.95,1038.32,0
80,150,1536,5120,torch.int8,161,6,18.1719,_ZN5aiter42I8gemm_bf16_perTokenI8_BpreShuffle_192x128E,129.83,500.39,0.1344
80,192,128,5120,torch.int8,160,8,12.1485,_ZN5aiter42I8gemm_bf16_perTokenI8_BpreShuffle_128x128E,20.72,138.91,0.1606
80,192,1280,1024,torch.int8,160,6,9.0346,_ZN5aiter42I8gemm_bf16_perTokenI8_BpreShuffle_128x128E,55.71,221.24,0.0914
80,192,1280,5120,torch.int8,161,8,16.3619,_ZN5aiter42I8gemm_bf16_perTokenI8_BpreShuffle_192x128E,153.81,490.66,0.1651
80,192,1280,8192,torch.int8,161,8,19.5141,_ZN5aiter42I8gemm_bf16_perTokenI8_BpreShuffle_192x128E,206.34,643.13,0.1637
80,192,1536,1024,torch.int8,160,3,10.3979,_ZN5aiter42I8gemm_bf16_perTokenI8_BpreShuffle_128x128E,58.09,226.9,0.0725
80,192,1536,5120,torch.int8,161,6,18.2027,_ZN5aiter42I8gemm_bf16_perTokenI8_BpreShuffle_192x128E,165.9,518.45,0.1342
80,192,8192,1024,torch.float8_e4m3fnuz,85,0,18.7963,a8w8_bpreshuffle_256x64x128x128_16x16_16x16_8x32x1_8x32x1_1x32x1x8_8x8x1_2x1_intrawave_v3,171.38,624.11,0
80,192,8192,5120,torch.int8,161,1,60.0426,_ZN5aiter42I8gemm_bf16_perTokenI8_BpreShuffle_192x128E,268.25,767.32,0.0026
80,220,1536,5120,torch.int8,160,3,21.1629,_ZN5aiter42I8gemm_bf16_perTokenI8_BpreShuffle_128x128E,163.51,456.77,0.0857
80,256,1280,8192,torch.int8,160,4,23.0901,_ZN5aiter42I8gemm_bf16_perTokenI8_BpreShuffle_128x128E,232.51,573.33,0.1074
80,256,1536,5120,torch.int8,160,3,21.3733,_ZN5aiter42I8gemm_bf16_perTokenI8_BpreShuffle_128x128E,188.39,466.07,0.0853
80,256,4608,4096,torch.float8_e4m3fnuz,85,0,37.982,a8w8_bpreshuffle_256x64x128x128_16x16_16x16_8x32x1_8x32x1_1x32x1x8_8x8x1_2x1_intrawave_v3,254.43,586.65,0
80,256,8192,1024,torch.float8_e4m3fnuz,70,0,23.9267,a8w8_bpreshuffle_256x128x128x128_16x16_16x16_8x32x1_8x32x1_1x32x1x8_8x8x1_2x1_intrawave_v3,179.51,536.85,0
80,256,9216,4096,torch.float8_e4m3fnuz,70,0,64.6741,a8w8_bpreshuffle_256x128x128x128_16x16_16x16_8x32x1_8x32x1_1x32x1x8_8x8x1_2x1_intrawave_v3,298.84,672.85,0
80,320,1280,8192,torch.int8,161,4,29.0859,_ZN5aiter42I8gemm_bf16_perTokenI8_BpreShuffle_192x128E,230.73,478.8,0.107
80,320,8192,1024,torch.float8_e4m3fnuz,85,0,24.7583,a8w8_bpreshuffle_256x64x128x128_16x16_16x16_8x32x1_8x32x1_1x32x1x8_8x8x1_2x1_intrawave_v3,216.84,563.82,0
80,384,1536,5120,torch.int8,161,3,26.9758,_ZN5aiter42I8gemm_bf16_perTokenI8_BpreShuffle_192x128E,223.9,408.15,0.0875
80,448,1536,5120,torch.int8,161,2,33.1084,_ZN5aiter42I8gemm_bf16_perTokenI8_BpreShuffle_192x128E,212.83,348.38,0.0523
80,512,512,7168,torch.float8_e4m3fnuz,119,0,23.6639,a8w8_bpreshuffle_256x32x128x256_16x16_16x16_16x16x1_16x16x1_1x16x1x16_8x8x1_1x2_intrawave_v1,158.81,332.33,0
80,512,576,7168,torch.float8_e4m3fnuz,114,0,23.9199,a8w8_bpreshuffle_256x64x64x256_16x16_16x16_16x16x1_16x16x1_1x32x1x8_8x8x1_2x1_intrawave_v3,176.75,350.7,0
80,512,1280,8192,torch.int8,160,2,38.6745,_ZN5aiter42I8gemm_bf16_perTokenI8_BpreShuffle_128x128E,277.64,413.47,0.0542
80,512,1536,5120,torch.int8,161,2,33.5781,_ZN5aiter42I8gemm_bf16_perTokenI8_BpreShuffle_192x128E,239.83,359.12,0.0534
80,512,1536,7168,torch.float8_e4m3fnuz,128,0,47.65,a8w8_bpreshuffle_256x64x192x256_16x16_16x16_16x16x1_16x16x1_1x32x1x8_8x8x1_2x1_intrawave_v3,236.61,341.09,0
80,512,2112,7168,torch.float8_e4m3fnuz,129,0,60.4509,a8w8_bpreshuffle_256x80x192x256_16x16_16x16_16x16x1_16x16x1_1x16x1x16_4x4x1_1x1_intrawave_v3,256.44,346.92,0
80,512,3072,1536,torch.float8_e4m3fnuz,85,0,24.3751,a8w8_bpreshuffle_256x64x128x128_16x16_16x16_8x32x1_8x32x1_1x32x1x8_8x8x1_2x1_intrawave_v3,198.23,354.9,0
80,512,4096,512,torch.float8_e4m3fnuz,85,0,15.7231,a8w8_bpreshuffle_256x64x128x128_16x16_16x16_8x32x1_8x32x1_1x32x1x8_8x8x1_2x1_intrawave_v3,136.58,416.81,0
80,512,4608,7168,torch.float8_e4m3fnuz,70,0,105.5819,a8w8_bpreshuffle_256x128x128x128_16x16_16x16_8x32x1_8x32x1_1x32x1x8_8x8x1_2x1_intrawave_v3,320.35,392.29,0
80,512,7168,256,torch.float8_e4m3fnuz,72,0,16.1951,a8w8_bpreshuffle_256x64x256x64_16x16_16x16_4x64x1_4x64x1_1x16x1x16_8x8x1_1x2_intrawave_v1,116.03,574.63,0
80,512,7168,2048,torch.float8_e4m3fnuz,71,0,53.438,a8w8_bpreshuffle_256x128x128x64_16x16_16x16_4x64x1_4x64x1_1x32x1x8_8x8x1_2x1_intrawave_v3,281.31,431.69,0
80,512,7168,2304,torch.float8_e4m3fnuz,72,0,57.4769,a8w8_bpreshuffle_256x64x256x64_16x16_16x16_4x64x1_4x64x1_1x16x1x16_8x8x1_1x2_intrawave_v1,294.23,435.56,0
80,512,8192,1024,torch.float8_e4m3fnuz,85,0,37.882,a8w8_bpreshuffle_256x64x128x128_16x16_16x16_8x32x1_8x32x1_1x32x1x8_8x8x1_2x1_intrawave_v3,226.76,456.72,0
80,1024,1280,8192,torch.float8_e4m3fnuz,85,0,68.1209,a8w8_bpreshuffle_256x64x128x128_16x16_16x16_8x32x1_8x32x1_1x32x1x8_8x8x1_2x1_intrawave_v3,315.25,315.55,0
80,1024,4608,4096,torch.float8_e4m3fnuz,71,0,120.44,a8w8_bpreshuffle_256x128x128x64_16x16_16x16_4x64x1_4x64x1_1x32x1x8_8x8x1_2x1_intrawave_v3,320.95,269.89,0
80,1024,8192,1024,torch.float8_e4m3fnuz,71,0,67.0889,a8w8_bpreshuffle_256x128x128x64_16x16_16x16_4x64x1_4x64x1_1x32x1x8_8x8x1_2x1_intrawave_v3,256.08,390.74,0
80,1024,9216,4096,torch.float8_e4m3fnuz,93,0,219.0276,a8w8_bpreshuffle_256x64x192x128_16x16_16x16_8x32x1_8x32x1_1x32x1x8_8x8x1_2x1_intrawave_v3,352.97,277.67,0
80,2048,512,7168,torch.float8_e4m3fnuz,85,0,58.1113,a8w8_bpreshuffle_256x64x128x128_16x16_16x16_8x32x1_8x32x1_1x32x1x8_8x8x1_2x1_intrawave_v3,258.68,351.86,0
80,2048,576,7168,torch.float8_e4m3fnuz,129,0,60.7837,a8w8_bpreshuffle_256x80x192x256_16x16_16x16_16x16x1_16x16x1_1x16x1x16_4x4x1_1x1_intrawave_v3,278.22,348.25,0
80,2048,1280,8192,torch.float8_e4m3fnuz,0,0,119.2848,a8w8_bpreshuffle_256x128x128x128_16x16_16x16_8x32x1_8x32x1_1x32x1x8_8x8x1_2x1_intrawave_v3,360.06,272.51,0
80,2048,1536,7168,torch.float8_e4m3fnuz,85,0,138.8692,a8w8_bpreshuffle_256x64x128x128_16x16_16x16_8x32x1_8x32x1_1x32x1x8_8x8x1_2x1_intrawave_v3,324.75,230.3,0
80,2048,2112,7168,torch.float8_e4m3fnuz,93,0,186.5271,a8w8_bpreshuffle_256x64x192x128_16x16_16x16_8x32x1_8x32x1_1x32x1x8_8x8x1_2x1_intrawave_v3,332.44,206.24,0
80,2048,3072,1536,torch.float8_e4m3fnuz,72,0,69.8541,a8w8_bpreshuffle_256x64x256x64_16x16_16x16_4x64x1_4x64x1_1x16x1x16_8x8x1_1x2_intrawave_v1,276.68,292.71,0
80,2048,4096,512,torch.float8_e4m3fnuz,71,0,43.6672,a8w8_bpreshuffle_256x128x128x64_16x16_16x16_4x64x1_4x64x1_1x32x1x8_8x8x1_2x1_intrawave_v3,196.71,456.25,0
80,2048,4608,4096,torch.float8_e4m3fnuz,68,0,218.9032,a8w8_bpreshuffle_256x128x192x128_16x16_16x16_8x32x1_8x32x1_1x32x1x8_8x8x1_2x1_intrawave_v3,353.17,210.77,0
80,2048,4608,7168,torch.float8_e4m3fnuz,93,0,366.0791,a8w8_bpreshuffle_256x64x192x128_16x16_16x16_8x32x1_8x32x1_1x32x1x8_8x8x1_2x1_intrawave_v3,369.57,181.89,0
80,2048,7168,256,torch.float8_e4m3fnuz,71,0,48.0096,a8w8_bpreshuffle_256x128x128x64_16x16_16x16_4x64x1_4x64x1_1x32x1x8_8x8x1_2x1_intrawave_v3,156.56,660.69,0
80,2048,7168,2048,torch.float8_e4m3fnuz,85,0,186.7051,a8w8_bpreshuffle_256x64x128x128_16x16_16x16_8x32x1_8x32x1_1x32x1x8_8x8x1_2x1_intrawave_v3,322.06,258.35,0
80,2048,7168,2304,torch.float8_e4m3fnuz,85,0,199.0359,a8w8_bpreshuffle_256x64x128x128_16x16_16x16_8x32x1_8x32x1_1x32x1x8_8x8x1_2x1_intrawave_v3,339.87,254.19,0
80,2048,8192,1024,torch.float8_e4m3fnuz,71,0,120.4715,a8w8_bpreshuffle_256x128x128x64_16x16_16x16_4x64x1_4x64x1_1x32x1x8_8x8x1_2x1_intrawave_v3,285.21,365.57,0
80,2048,9216,4096,torch.float8_e4m3fnuz,68,0,425.2314,a8w8_bpreshuffle_256x128x192x128_16x16_16x16_8x32x1_8x32x1_1x32x1x8_8x8x1_2x1_intrawave_v3,363.61,197.27,0
80,4096,512,7168,torch.float8_e4m3fnuz,85,0,101.7067,a8w8_bpreshuffle_256x64x128x128_16x16_16x16_8x32x1_8x32x1_1x32x1x8_8x8x1_2x1_intrawave_v3,295.6,366,0
80,4096,576,7168,torch.float8_e4m3fnuz,93,0,113.3711,a8w8_bpreshuffle_256x64x192x128_16x16_16x16_8x32x1_8x32x1_1x32x1x8_8x8x1_2x1_intrawave_v3,298.34,337.01,0
80,4096,1280,8192,torch.float8_e4m3fnuz,71,0,234.5689,a8w8_bpreshuffle_256x128x128x64_16x16_16x16_4x64x1_4x64x1_1x32x1x8_8x8x1_2x1_intrawave_v3,366.2,232.45,0
80,4096,1536,7168,torch.float8_e4m3fnuz,85,0,256.917,a8w8_bpreshuffle_256x64x128x128_16x16_16x16_8x32x1_8x32x1_1x32x1x8_8x8x1_2x1_intrawave_v3,351.06,206.11,0
80,4096,2112,7168,torch.float8_e4m3fnuz,93,0,329.2957,a8w8_bpreshuffle_256x64x192x128_16x16_16x16_8x32x1_8x32x1_1x32x1x8_8x8x1_2x1_intrawave_v3,376.61,187.67,0
80,4096,3072,1536,torch.float8_e4m3fnuz,93,0,123.6652,a8w8_bpreshuffle_256x64x192x128_16x16_16x16_8x32x1_8x32x1_1x32x1x8_8x8x1_2x1_intrawave_v3,312.58,292.53,0
80,4096,4096,512,torch.float8_e4m3fnuz,71,0,75.7421,a8w8_bpreshuffle_256x128x128x64_16x16_16x16_4x64x1_4x64x1_1x32x1x8_8x8x1_2x1_intrawave_v3,226.82,498.39,0
80,4096,4608,4096,torch.float8_e4m3fnuz,85,0,420.6946,a8w8_bpreshuffle_256x64x128x128_16x16_16x16_8x32x1_8x32x1_1x32x1x8_8x8x1_2x1_intrawave_v3,367.53,174.47,0
80,4096,4608,7168,torch.float8_e4m3fnuz,85,0,715.7879,a8w8_bpreshuffle_256x64x128x128_16x16_16x16_8x32x1_8x32x1_1x32x1x8_8x8x1_2x1_intrawave_v3,378.02,139.9,0
80,4096,7168,256,torch.float8_e4m3fnuz,71,0,85.7258,a8w8_bpreshuffle_256x128x128x64_16x16_16x16_4x64x1_4x64x1_1x32x1x8_8x8x1_2x1_intrawave_v3,175.35,718.61,0
80,4096,7168,2048,torch.float8_e4m3fnuz,71,0,345.3094,a8w8_bpreshuffle_256x128x128x64_16x16_16x16_4x64x1_4x64x1_1x32x1x8_8x8x1_2x1_intrawave_v3,348.26,236.86,0
80,4096,7168,2304,torch.float8_e4m3fnuz,71,0,379.4759,a8w8_bpreshuffle_256x128x128x64_16x16_16x16_4x64x1_4x64x1_1x32x1x8_8x8x1_2x1_intrawave_v3,356.52,223.13,0
80,4096,8192,1024,torch.float8_e4m3fnuz,71,0,227.2969,a8w8_bpreshuffle_256x128x128x64_16x16_16x16_4x64x1_4x64x1_1x32x1x8_8x8x1_2x1_intrawave_v3,302.33,350.61,0
80,4096,9216,4096,torch.float8_e4m3fnuz,71,0,812.5832,a8w8_bpreshuffle_256x128x128x64_16x16_16x16_4x64x1_4x64x1_1x32x1x8_8x8x1_2x1_intrawave_v3,380.56,160.01,0
80,4240,9216,4096,torch.float8_e4m3fnuz,93,0,903.6056,a8w8_bpreshuffle_256x64x192x128_16x16_16x16_8x32x1_8x32x1_1x32x1x8_8x8x1_2x1_intrawave_v3,354.26,147.48,0
80,8192,576,7168,torch.float8_e4m3fnuz,93,0,191.4823,a8w8_bpreshuffle_256x64x192x128_16x16_16x16_8x32x1_8x32x1_1x32x1x8_8x8x1_2x1_intrawave_v3,353.27,377.51,0
80,8192,1280,8192,torch.float8_e4m3fnuz,71,0,452.4299,a8w8_bpreshuffle_256x128x128x64_16x16_16x16_4x64x1_4x64x1_1x32x1x8_8x8x1_2x1_intrawave_v3,379.72,217.86,0
80,8192,1536,7168,torch.float8_e4m3fnuz,72,0,501.1581,a8w8_bpreshuffle_256x64x256x64_16x16_16x16_4x64x1_4x64x1_1x16x1x16_8x8x1_1x2_intrawave_v1,359.94,189.35,0
80,8192,3072,1536,torch.float8_e4m3fnuz,71,0,235.4545,a8w8_bpreshuffle_256x128x128x64_16x16_16x16_4x64x1_4x64x1_1x32x1x8_8x8x1_2x1_intrawave_v3,328.34,287.25,0
80,8192,4608,7168,torch.float8_e4m3fnuz,93,0,1405.0902,a8w8_bpreshuffle_256x64x192x128_16x16_16x16_8x32x1_8x32x1_1x32x1x8_8x8x1_2x1_intrawave_v3,385.15,119.03,0
80,8192,7168,256,torch.float8_e4m3fnuz,71,0,158.8437,a8w8_bpreshuffle_256x128x128x64_16x16_16x16_4x64x1_4x64x1_1x32x1x8_8x8x1_2x1_intrawave_v3,189.27,764.1,0
80,8192,7168,2048,torch.float8_e4m3fnuz,71,0,665.8308,a8w8_bpreshuffle_256x128x128x64_16x16_16x16_4x64x1_4x64x1_1x32x1x8_8x8x1_2x1_intrawave_v3,361.23,223.63,0
80,8192,8192,1024,torch.float8_e4m3fnuz,71,0,434.801,a8w8_bpreshuffle_256x128x128x64_16x16_16x16_4x64x1_4x64x1_1x32x1x8_8x8x1_2x1_intrawave_v3,316.1,347.27,0
80,16384,1280,8192,torch.float8_e4m3fnuz,71,0,902.6619,a8w8_bpreshuffle_256x128x128x64_16x16_16x16_4x64x1_4x64x1_1x32x1x8_8x8x1_2x1_intrawave_v3,380.65,206.77,0
80,16384,4608,4096,torch.float8_e4m3fnuz,93,0,1613.6388,a8w8_bpreshuffle_256x64x192x128_16x16_16x16_8x32x1_8x32x1_1x32x1x8_8x8x1_2x1_intrawave_v3,383.28,146.86,0
80,16384,8192,1024,torch.float8_e4m3fnuz,71,0,849.5169,a8w8_bpreshuffle_256x128x128x64_16x16_16x16_4x64x1_4x64x1_1x32x1x8_8x8x1_2x1_intrawave_v3,323.57,345.61,0
80,16384,9216,4096,torch.float8_e4m3fnuz,71,0,3218.0651,a8w8_bpreshuffle_256x128x128x64_16x16_16x16_4x64x1_4x64x1_1x32x1x8_8x8x1_2x1_intrawave_v3,384.38,126.43,0
80,20480,512,7168,torch.float8_e4m3fnuz,70,0,411.9813,a8w8_bpreshuffle_256x128x128x128_16x16_16x16_8x32x1_8x32x1_1x32x1x8_8x8x1_2x1_intrawave_v3,364.88,416.14,0
80,20480,576,7168,torch.float8_e4m3fnuz,68,0,439.759,a8w8_bpreshuffle_256x128x192x128_16x16_16x16_8x32x1_8x32x1_1x32x1x8_8x8x1_2x1_intrawave_v3,384.56,396.86,0
80,20480,1536,7168,torch.float8_e4m3fnuz,93,0,1157.9543,a8w8_bpreshuffle_256x64x192x128_16x16_16x16_8x32x1_8x32x1_1x32x1x8_8x8x1_2x1_intrawave_v3,389.46,190.62,0
80,20480,3072,1536,torch.float8_e4m3fnuz,71,0,557.954,a8w8_bpreshuffle_256x128x128x64_16x16_16x16_4x64x1_4x64x1_1x32x1x8_8x8x1_2x1_intrawave_v3,346.4,290.36,0
80,20480,4096,512,torch.float8_e4m3fnuz,71,0,331.5621,a8w8_bpreshuffle_256x128x128x64_16x16_16x16_4x64x1_4x64x1_1x32x1x8_8x8x1_2x1_intrawave_v3,259.07,543.96,0
80,20480,4608,7168,torch.float8_e4m3fnuz,68,0,3421.2891,a8w8_bpreshuffle_256x128x192x128_16x16_16x16_8x32x1_8x32x1_1x32x1x8_8x8x1_2x1_intrawave_v3,395.44,107.73,0
80,20480,7168,256,torch.float8_e4m3fnuz,71,0,381.5807,a8w8_bpreshuffle_256x128x128x64_16x16_16x16_4x64x1_4x64x1_1x32x1x8_8x8x1_2x1_intrawave_v3,196.98,787.98,0
80,20480,7168,2048,torch.float8_e4m3fnuz,71,0,1639.9077,a8w8_bpreshuffle_256x128x128x64_16x16_16x16_4x64x1_4x64x1_1x32x1x8_8x8x1_2x1_intrawave_v3,366.66,213.56,0
80,20480,7168,2304,torch.float8_e4m3fnuz,71,0,1805.4245,a8w8_bpreshuffle_256x128x128x64_16x16_16x16_4x64x1_4x64x1_1x32x1x8_8x8x1_2x1_intrawave_v3,374.68,197.9,0
80,32768,512,7168,torch.float8_e4m3fnuz,70,0,664.7692,a8w8_bpreshuffle_256x128x128x128_16x16_16x16_8x32x1_8x32x1_1x32x1x8_8x8x1_2x1_intrawave_v3,361.81,409.32,0
80,32768,2112,7168,torch.float8_e4m3fnuz,93,0,2566.2639,a8w8_bpreshuffle_256x64x192x128_16x16_16x16_8x32x1_8x32x1_1x32x1x8_8x8x1_2x1_intrawave_v3,386.61,151.36,0
80,32768,4096,512,torch.float8_e4m3fnuz,71,0,523.3298,a8w8_bpreshuffle_256x128x128x64_16x16_16x16_4x64x1_4x64x1_1x32x1x8_8x8x1_2x1_intrawave_v3,262.62,549,0
80,32768,4608,4096,torch.float8_e4m3fnuz,93,0,3207.2182,a8w8_bpreshuffle_256x64x192x128_16x16_16x16_8x32x1_8x32x1_1x32x1x8_8x8x1_2x1_intrawave_v3,385.68,141.89,0
80,32768,4608,7168,torch.float8_e4m3fnuz,68,0,5527.6346,a8w8_bpreshuffle_256x128x192x128_16x16_16x16_8x32x1_8x32x1_1x32x1x8_8x8x1_2x1_intrawave_v3,391.61,103.1,0
80,32768,7168,256,torch.float8_e4m3fnuz,71,0,600.9077,a8w8_bpreshuffle_256x128x128x64_16x16_16x16_4x64x1_4x64x1_1x32x1x8_8x8x1_2x1_intrawave_v3,200.13,798.77,0
80,32768,7168,2304,torch.float8_e4m3fnuz,71,0,2907.7206,a8w8_bpreshuffle_256x128x128x64_16x16_16x16_4x64x1_4x64x1_1x32x1x8_8x8x1_2x1_intrawave_v3,372.23,193.2,0
80,32768,9216,4096,torch.float8_e4m3fnuz,68,0,6437.3643,a8w8_bpreshuffle_256x128x192x128_16x16_16x16_8x32x1_8x32x1_1x32x1x8_8x8x1_2x1_intrawave_v3,384.3,120.54,0
256,1,800,5120,torch.float8_e4m3fn,10,0,11.3133,a8w8_bpreshuffle_128x16x32x512_16x16_16x16_32x4x1_32x4x1_1x16x1x8_4x4x1_1x1_intrawave_v1,0.72,362.65,0
256,1,1280,8192,torch.float8_e4m3fn,10,0,12.9809,a8w8_bpreshuffle_128x16x32x512_16x16_16x16_32x4x1_32x4x1_1x16x1x8_4x4x1_1x1_intrawave_v1,1.62,808.61,0
256,1,2304,16384,torch.float8_e4m3fn,10,0,28.7056,a8w8_bpreshuffle_128x16x32x512_16x16_16x16_32x4x1_32x4x1_1x16x1x8_4x4x1_1x1_intrawave_v1,2.63,1315.76,0
256,1,2560,8192,torch.float8_e4m3fn,10,0,12.8571,a8w8_bpreshuffle_128x16x32x512_16x16_16x16_32x4x1_32x4x1_1x16x1x8_4x4x1_1x1_intrawave_v1,3.26,1632.16,0
256,1,4608,16384,torch.float8_e4m3fn,10,0,29.8957,a8w8_bpreshuffle_128x16x32x512_16x16_16x16_32x4x1_32x4x1_1x16x1x8_4x4x1_1x1_intrawave_v1,5.05,2526.22,0
256,1,5120,640,torch.float8_e4m3fn,23,0,5.7466,a8w8_bpreshuffle_128x16x32x128_16x16_16x16_8x16x1_8x16x1_1x16x1x8_4x4x1_1x1_intrawave_v2,1.14,572.11,0
256,1,5120,1280,torch.float8_e4m3fn,108,0,6.8374,a8w8_bpreshuffle_256x16x64x256_16x16_16x16_16x16x1_16x16x1_1x16x1x16_4x4x1_1x1_intrawave_v1,1.92,960.18,0
256,1,5120,3200,torch.float8_e4m3fn,23,0,15.188,a8w8_bpreshuffle_128x16x32x128_16x16_16x16_8x16x1_8x16x1_1x16x1x8_4x4x1_1x1_intrawave_v2,2.16,1079.63,0
256,1,5120,5120,torch.float8_e4m3fn,10,0,11.7201,a8w8_bpreshuffle_128x16x32x512_16x16_16x16_32x4x1_32x4x1_1x16x1x8_4x4x1_1x1_intrawave_v1,4.47,2238.02,0
256,1,5120,6400,torch.float8_e4m3fn,108,0,19.1846,a8w8_bpreshuffle_256x16x64x256_16x16_16x16_16x16x1_16x16x1_1x16x1x16_4x4x1_1x1_intrawave_v1,3.42,1708.9,0
256,1,5120,25600,torch.float8_e4m3fn,10,0,46.1466,a8w8_bpreshuffle_128x16x32x512_16x16_16x16_32x4x1_32x4x1_1x16x1x8_4x4x1_1x1_intrawave_v1,5.68,2841.12,0
256,1,6400,5120,torch.float8_e4m3fn,24,0,12.5759,a8w8_bpreshuffle_128x16x32x512_16x16_16x16_32x4x1_32x4x1_1x16x1x8_4x4x1_1x1_intrawave_v2,5.21,2607.04,0
256,1,7168,8192,torch.float8_e4m3fn,24,0,15.0501,a8w8_bpreshuffle_128x16x32x512_16x16_16x16_32x4x1_32x4x1_1x16x1x8_4x4x1_1x1_intrawave_v2,7.8,3903.15,0
256,1,8192,1024,torch.float8_e4m3fn,108,0,5.9704,a8w8_bpreshuffle_256x16x64x256_16x16_16x16_16x16x1_16x16x1_1x16x1x16_4x4x1_1x1_intrawave_v1,2.81,1407.95,0
256,1,8192,2048,torch.float8_e4m3fn,10,0,5.8009,a8w8_bpreshuffle_128x16x32x512_16x16_16x16_32x4x1_32x4x1_1x16x1x8_4x4x1_1x1_intrawave_v1,5.78,2895.35,0
256,1,8192,3584,torch.float8_e4m3fn,10,0,7.8125,a8w8_bpreshuffle_128x16x32x512_16x16_16x16_32x4x1_32x4x1_1x16x1x8_4x4x1_1x1_intrawave_v1,7.52,3760.65,0
256,1,8192,7168,torch.float8_e4m3fn,24,0,13.9797,a8w8_bpreshuffle_128x16x32x512_16x16_16x16_32x4x1_32x4x1_1x16x1x8_4x4x1_1x1_intrawave_v2,8.4,4202.08,0
256,1,8192,8192,torch.float8_e4m3fn,10,0,14.8978,a8w8_bpreshuffle_128x16x32x512_16x16_16x16_32x4x1_32x4x1_1x16x1x8_4x4x1_1x1_intrawave_v1,9.01,4506.27,0
256,1,8192,28672,torch.float8_e4m3fn,10,0,46.0411,a8w8_bpreshuffle_128x16x32x512_16x16_16x16_32x4x1_32x4x1_1x16x1x8_4x4x1_1x1_intrawave_v1,10.2,5102.53,0
256,1,9216,16384,torch.float8_e4m3fn,10,0,35.2763,a8w8_bpreshuffle_128x16x32x512_16x16_16x16_32x4x1_32x4x1_1x16x1x8_4x4x1_1x1_intrawave_v1,8.56,4281.34,0
256,1,10240,8192,torch.float8_e4m3fn,10,0,16.9524,a8w8_bpreshuffle_128x16x32x512_16x16_16x16_32x4x1_32x4x1_1x16x1x8_4x4x1_1x1_intrawave_v1,9.9,4950.02,0
256,1,12800,5120,torch.float8_e4m3fn,10,0,14.7141,a8w8_bpreshuffle_128x16x32x512_16x16_16x16_32x4x1_32x4x1_1x16x1x8_4x4x1_1x1_intrawave_v1,8.91,4456.05,0
256,1,13312,16384,torch.float8_e4m3fn,10,0,40.7795,a8w8_bpreshuffle_128x16x32x512_16x16_16x16_32x4x1_32x4x1_1x16x1x8_4x4x1_1x1_intrawave_v1,10.7,5349.42,0
256,1,14336,8192,torch.float8_e4m3fn,10,0,21.766,a8w8_bpreshuffle_128x16x32x512_16x16_16x16_32x4x1_32x4x1_1x16x1x8_4x4x1_1x1_intrawave_v1,10.79,5397.29,0
256,1,16384,2048,torch.float8_e4m3fn,24,0,9.9256,a8w8_bpreshuffle_128x16x32x512_16x16_16x16_32x4x1_32x4x1_1x16x1x8_4x4x1_1x1_intrawave_v2,6.76,3384.1,0
256,1,16384,4096,torch.float8_e4m3fn,24,0,14.6481,a8w8_bpreshuffle_128x16x32x512_16x16_16x16_32x4x1_32x4x1_1x16x1x8_4x4x1_1x1_intrawave_v2,9.16,4583.92,0
256,1,16384,6656,torch.float8_e4m3fn,24,0,21.1312,a8w8_bpreshuffle_128x16x32x512_16x16_16x16_32x4x1_32x4x1_1x16x1x8_4x4x1_1x1_intrawave_v2,10.32,5162.57,0
256,1,16384,8192,torch.float8_e4m3fn,10,0,25.6037,a8w8_bpreshuffle_128x16x32x512_16x16_16x16_32x4x1_32x4x1_1x16x1x8_4x4x1_1x1_intrawave_v1,10.48,5243.72,0
256,1,16384,13312,torch.float8_e4m3fn,11,0,39.322,a8w8_bpreshuffle_256x16x64x512_16x16_16x16_32x8x1_32x8x1_1x16x1x16_4x4x1_1x1_intrawave_v1,11.09,5547.78,0
256,1,16384,26624,torch.float8_e4m3fn,5,0,73.9656,a8w8_bpreshuffle_256x16x64x512_16x16_16x16_32x8x1_32x8x1_1x16x1x16_4x4x1_1x1_intrawave_v1,11.79,5898.24,0
256,1,26624,16384,torch.float8_e4m3fn,6,0,76.8576,a8w8_bpreshuffle_256x16x128x512_16x16_16x16_32x8x1_32x8x1_1x16x1x16_8x8x1_1x2_intrawave_v1,11.35,5676.44,0
256,1,51200,5120,torch.float8_e4m3fn,16,0,45.1392,a8w8_bpreshuffle_256x16x128x256_16x16_16x16_16x16x1_16x16x1_1x16x1x16_8x8x1_1x2_intrawave_v1,11.61,5809.84,0
256,1,53248,16384,torch.float8_e4m3fn,23,0,150.2505,a8w8_bpreshuffle_128x16x32x128_16x16_16x16_8x16x1_8x16x1_1x16x1x8_4x4x1_1x1_intrawave_v2,11.61,5807.22,0
256,1,57344,8192,torch.float8_e4m3fn,9,0,77.922,a8w8_bpreshuffle_128x16x32x128_16x16_16x16_8x16x1_8x16x1_1x16x1x8_4x4x1_1x1_intrawave_v1,12.06,6030.2,0
256,4,16384,6656,torch.float8_e4m3fn,11,0,20.7235,a8w8_bpreshuffle_256x16x64x512_16x16_16x16_32x8x1_32x8x1_1x16x1x16_4x4x1_1x1_intrawave_v1,42.1,5269.84,0
256,8,6656,16384,torch.float8_e4m3fn,10,0,31.2392,a8w8_bpreshuffle_128x16x32x512_16x16_16x16_32x4x1_32x4x1_1x16x1x8_4x4x1_1x1_intrawave_v1,55.85,3498.47,0
256,8,16384,6656,torch.float8_e4m3fn,11,0,20.8171,a8w8_bpreshuffle_256x16x64x512_16x16_16x16_32x8x1_32x8x1_1x16x1x16_4x4x1_1x1_intrawave_v1,83.82,5253.72,0
256,16,800,5120,torch.float8_e4m3fn,24,0,10.5404,a8w8_bpreshuffle_128x16x32x512_16x16_16x16_32x4x1_32x4x1_1x16x1x8_4x4x1_1x1_intrawave_v2,12.44,398.8,0
256,16,1280,8192,torch.float8_e4m3fn,10,0,12.0223,a8w8_bpreshuffle_128x16x32x512_16x16_16x16_32x4x1_32x4x1_1x16x1x8_4x4x1_1x1_intrawave_v1,27.91,886.5,0
256,16,2304,16384,torch.float8_e4m3fn,24,0,24.7047,a8w8_bpreshuffle_128x16x32x512_16x16_16x16_32x4x1_32x4x1_1x16x1x8_4x4x1_1x1_intrawave_v2,48.9,1541.59,0
256,16,2560,8192,torch.float8_e4m3fn,10,0,11.95,a8w8_bpreshuffle_128x16x32x512_16x16_16x16_32x4x1_32x4x1_1x16x1x8_4x4x1_1x1_intrawave_v1,56.16,1772.76,0
256,16,4608,16384,torch.float8_e4m3fn,24,0,25.8456,a8w8_bpreshuffle_128x16x32x512_16x16_16x16_32x4x1_32x4x1_1x16x1x8_4x4x1_1x1_intrawave_v2,93.48,2936.94,0
256,16,5120,640,torch.float8_e4m3fn,23,0,5.7485,a8w8_bpreshuffle_128x16x32x128_16x16_16x16_8x16x1_8x16x1_1x16x1x8_4x4x1_1x1_intrawave_v2,18.24,600.31,0
256,16,5120,1280,torch.float8_e4m3fn,29,0,6.7718,a8w8_bpreshuffle_256x16x64x256_16x16_16x16_16x16x1_16x16x1_1x16x1x16_4x4x1_1x1_intrawave_v2,30.97,995,0
256,16,5120,3200,torch.float8_e4m3fn,23,0,14.71,a8w8_bpreshuffle_128x16x32x128_16x16_16x16_8x16x1_8x16x1_1x16x1x8_4x4x1_1x1_intrawave_v2,35.64,1128.42,0
256,16,5120,5120,torch.float8_e4m3fn,24,0,10.554,a8w8_bpreshuffle_128x16x32x512_16x16_16x16_32x4x1_32x4x1_1x16x1x8_4x4x1_1x1_intrawave_v2,79.48,2507.12,0
256,16,5120,6400,torch.float8_e4m3fn,15,0,19.3187,a8w8_bpreshuffle_256x16x64x256_16x16_16x16_16x16x1_16x16x1_1x16x1x16_4x4x1_1x1_intrawave_v1,54.28,1709.96,0
256,16,5120,25600,torch.float8_e4m3fn,24,0,39.1761,a8w8_bpreshuffle_128x16x32x512_16x16_16x16_32x4x1_32x4x1_1x16x1x8_4x4x1_1x1_intrawave_v2,107.06,3360.35,0
256,16,6400,5120,torch.float8_e4m3fn,10,0,11.3305,a8w8_bpreshuffle_128x16x32x512_16x16_16x16_32x4x1_32x4x1_1x16x1x8_4x4x1_1x1_intrawave_v1,92.54,2917.32,0
256,16,7168,8192,torch.float8_e4m3fn,10,0,13.6022,a8w8_bpreshuffle_128x16x32x512_16x16_16x16_32x4x1_32x4x1_1x16x1x8_4x4x1_1x1_intrawave_v1,138.14,4343.47,0
256,16,8192,1024,torch.float8_e4m3fn,15,0,5.9167,a8w8_bpreshuffle_256x16x64x256_16x16_16x16_16x16x1_16x16x1_1x16x1x16_4x4x1_1x1_intrawave_v1,45.37,1464.86,0
256,16,8192,2048,torch.float8_e4m3fn,10,0,5.6214,a8w8_bpreshuffle_128x16x32x512_16x16_16x16_32x4x1_32x4x1_1x16x1x8_4x4x1_1x1_intrawave_v1,95.5,3036.99,0
256,16,8192,3584,torch.float8_e4m3fn,10,0,7.8314,a8w8_bpreshuffle_128x16x32x512_16x16_16x16_32x4x1_32x4x1_1x16x1x8_4x4x1_1x1_intrawave_v1,119.97,3789.82,0
256,16,8192,7168,torch.float8_e4m3fn,10,0,12.5267,a8w8_bpreshuffle_128x16x32x512_16x16_16x16_32x4x1_32x4x1_1x16x1x8_4x4x1_1x1_intrawave_v1,150,4717.69,0
256,16,8192,8192,torch.float8_e4m3fn,10,0,13.9737,a8w8_bpreshuffle_128x16x32x512_16x16_16x16_32x4x1_32x4x1_1x16x1x8_4x4x1_1x1_intrawave_v1,153.68,4830.65,0
256,16,8192,28672,torch.float8_e4m3fn,10,0,41.1742,a8w8_bpreshuffle_128x16x32x512_16x16_16x16_32x4x1_32x4x1_1x16x1x8_4x4x1_1x1_intrawave_v1,182.55,5722.08,0
256,16,9216,16384,torch.float8_e4m3fn,24,0,32.3786,a8w8_bpreshuffle_128x16x32x512_16x16_16x16_32x4x1_32x4x1_1x16x1x8_4x4x1_1x1_intrawave_v2,149.23,4680.62,0
256,16,10240,8192,torch.float8_e4m3fn,10,0,17.892,a8w8_bpreshuffle_128x16x32x512_16x16_16x16_32x4x1_32x4x1_1x16x1x8_4x4x1_1x1_intrawave_v1,150.03,4714.11,0
256,16,12800,5120,torch.float8_e4m3fn,5,0,14.0716,a8w8_bpreshuffle_256x16x64x512_16x16_16x16_32x8x1_32x8x1_1x16x1x16_4x4x1_1x1_intrawave_v1,149.03,4692.25,0
256,16,13312,16384,torch.float8_e4m3fn,10,0,40.3808,a8w8_bpreshuffle_128x16x32x512_16x16_16x16_32x4x1_32x4x1_1x16x1x8_4x4x1_1x1_intrawave_v1,172.84,5418.22,0
256,16,14336,8192,torch.float8_e4m3fn,10,0,21.2685,a8w8_bpreshuffle_128x16x32x512_16x16_16x16_32x4x1_32x4x1_1x16x1x8_4x4x1_1x1_intrawave_v1,176.7,5549.54,0
256,16,16384,2048,torch.float8_e4m3fn,10,0,7.7604,a8w8_bpreshuffle_128x16x32x512_16x16_16x16_32x4x1_32x4x1_1x16x1x8_4x4x1_1x1_intrawave_v1,138.36,4395.58,0
256,16,16384,4096,torch.float8_e4m3fn,26,0,17.4151,a8w8_bpreshuffle_256x32x64x512_16x16_16x16_32x8x1_32x8x1_1x32x1x8_8x8x1_1x2_intrawave_v2,123.31,3887.36,0
256,16,16384,6656,torch.float8_e4m3fn,24,0,20.8707,a8w8_bpreshuffle_128x16x32x512_16x16_16x16_32x4x1_32x4x1_1x16x1x8_4x4x1_1x1_intrawave_v2,167.2,5255.34,0
256,16,16384,8192,torch.float8_e4m3fn,10,0,25.0145,a8w8_bpreshuffle_128x16x32x512_16x16_16x16_32x4x1_32x4x1_1x16x1x8_4x4x1_1x1_intrawave_v1,171.7,5391.8,0
256,16,16384,13312,torch.float8_e4m3fn,5,0,37.8531,a8w8_bpreshuffle_256x16x64x512_16x16_16x16_32x8x1_32x8x1_1x16x1x16_4x4x1_1x1_intrawave_v1,184.38,5781.33,0
256,16,16384,26624,torch.float8_e4m3fn,11,0,72.6906,a8w8_bpreshuffle_256x16x64x512_16x16_16x16_32x8x1_32x8x1_1x16x1x16_4x4x1_1x1_intrawave_v1,192.03,6013.95,0
256,16,26624,16384,torch.float8_e4m3fn,6,0,77.3342,a8w8_bpreshuffle_256x16x128x512_16x16_16x16_32x8x1_32x8x1_1x16x1x16_8x8x1_1x2_intrawave_v1,180.5,5654.96,0
256,16,51200,5120,torch.float8_e4m3fn,17,0,46.1585,a8w8_bpreshuffle_256x16x256x256_16x16_16x16_16x16x1_16x16x1_1x16x1x16_8x8x1_1x2_intrawave_v1,181.73,5716.48,0
256,16,53248,16384,torch.float8_e4m3fn,31,0,151.3677,a8w8_bpreshuffle_256x16x256x256_16x16_16x16_16x16x1_16x16x1_1x16x1x16_8x8x1_1x2_intrawave_v2,184.43,5776.54,0
256,16,57344,8192,torch.float8_e4m3fn,23,0,79.5497,a8w8_bpreshuffle_128x16x32x128_16x16_16x16_8x16x1_8x16x1_1x16x1x8_4x4x1_1x1_intrawave_v2,188.97,5929.98,0
256,32,800,5120,torch.float8_e4m3fn,24,0,10.2279,a8w8_bpreshuffle_128x16x32x512_16x16_16x16_32x4x1_32x4x1_1x16x1x8_4x4x1_1x1_intrawave_v2,25.63,421.5,0
256,32,1280,8192,torch.float8_e4m3fn,10,0,11.3752,a8w8_bpreshuffle_128x16x32x512_16x16_16x16_32x4x1_32x4x1_1x16x1x8_4x4x1_1x1_intrawave_v1,59,952.06,0
256,32,2304,16384,torch.float8_e4m3fn,24,0,25.2915,a8w8_bpreshuffle_128x16x32x512_16x16_16x16_32x4x1_32x4x1_1x16x1x8_4x4x1_1x1_intrawave_v2,95.52,1519.11,0
256,32,2560,8192,torch.float8_e4m3fn,10,0,12.0316,a8w8_bpreshuffle_128x16x32x512_16x16_16x16_32x4x1_32x4x1_1x16x1x8_4x4x1_1x1_intrawave_v1,111.55,1778.44,0
256,32,4608,16384,torch.float8_e4m3fn,24,0,29.2704,a8w8_bpreshuffle_128x16x32x512_16x16_16x16_32x4x1_32x4x1_1x16x1x8_4x4x1_1x1_intrawave_v2,165.08,2607.3,0
256,32,5120,640,torch.float8_e4m3fn,23,0,6.4386,a8w8_bpreshuffle_128x16x32x128_16x16_16x16_8x16x1_8x16x1_1x16x1x8_4x4x1_1x1_intrawave_v2,32.57,563,0
256,32,5120,1280,torch.float8_e4m3fn,29,0,6.9951,a8w8_bpreshuffle_256x16x64x256_16x16_16x16_16x16x1_16x16x1_1x16x1x16_4x4x1_1x1_intrawave_v2,59.96,989.58,0
256,32,5120,3200,torch.float8_e4m3fn,9,0,15.6619,a8w8_bpreshuffle_128x16x32x128_16x16_16x16_8x16x1_8x16x1_1x16x1x8_4x4x1_1x1_intrawave_v1,66.95,1073.57,0
256,32,5120,5120,torch.float8_e4m3fn,11,0,11.6951,a8w8_bpreshuffle_256x16x64x512_16x16_16x16_32x8x1_32x8x1_1x16x1x16_4x4x1_1x1_intrawave_v1,143.46,2283.51,0
256,32,5120,6400,torch.float8_e4m3fn,15,0,19.3178,a8w8_bpreshuffle_256x16x64x256_16x16_16x16_16x16x1_16x16x1_1x16x1x16_4x4x1_1x1_intrawave_v1,108.56,1723.82,0
256,32,5120,25600,torch.float8_e4m3fn,24,0,44.1556,a8w8_bpreshuffle_128x16x32x512_16x16_16x16_32x4x1_32x4x1_1x16x1x8_4x4x1_1x1_intrawave_v2,189.98,2994.39,0
256,32,6400,5120,torch.float8_e4m3fn,5,0,12.3982,a8w8_bpreshuffle_256x16x64x512_16x16_16x16_32x8x1_32x8x1_1x16x1x16_4x4x1_1x1_intrawave_v1,169.15,2689.22,0
256,32,7168,8192,torch.float8_e4m3fn,11,0,15.5322,a8w8_bpreshuffle_256x16x64x512_16x16_16x16_32x8x1_32x8x1_1x16x1x16_4x4x1_1x1_intrawave_v1,241.96,3826.96,0
256,32,8192,1024,torch.float8_e4m3fn,108,0,6.0451,a8w8_bpreshuffle_256x16x64x256_16x16_16x16_16x16x1_16x16x1_1x16x1x16_4x4x1_1x1_intrawave_v1,88.81,1479.82,0
256,32,8192,2048,torch.float8_e4m3fn,5,0,6.2663,a8w8_bpreshuffle_256x16x64x512_16x16_16x16_32x8x1_32x8x1_1x16x1x16_4x4x1_1x1_intrawave_v1,171.35,2771.5,0
256,32,8192,3584,torch.float8_e4m3fn,5,0,7.9538,a8w8_bpreshuffle_256x16x64x512_16x16_16x16_32x8x1_32x8x1_1x16x1x16_4x4x1_1x1_intrawave_v1,236.25,3771.67,0
256,32,8192,7168,torch.float8_e4m3fn,11,0,14.5895,a8w8_bpreshuffle_256x16x64x512_16x16_16x16_32x8x1_32x8x1_1x16x1x16_4x4x1_1x1_intrawave_v1,257.59,4076.49,0
256,32,8192,8192,torch.float8_e4m3fn,5,0,15.7818,a8w8_bpreshuffle_256x16x64x512_16x16_16x16_32x8x1_32x8x1_1x16x1x16_4x4x1_1x1_intrawave_v1,272.15,4302.13,0
256,32,8192,28672,torch.float8_e4m3fn,5,0,47.2548,a8w8_bpreshuffle_256x16x64x512_16x16_16x16_32x8x1_32x8x1_1x16x1x16_4x4x1_1x1_intrawave_v1,318.11,5001.03,0
256,32,9216,16384,torch.float8_e4m3fn,24,0,39.3729,a8w8_bpreshuffle_128x16x32x512_16x16_16x16_32x4x1_32x4x1_1x16x1x8_4x4x1_1x1_intrawave_v2,245.44,3863.29,0
256,32,10240,8192,torch.float8_e4m3fn,10,0,22.5861,a8w8_bpreshuffle_128x16x32x512_16x16_16x16_32x4x1_32x4x1_1x16x1x8_4x4x1_1x1_intrawave_v1,237.7,3754.68,0
256,32,12800,5120,torch.float8_e4m3fn,12,0,17.5533,a8w8_bpreshuffle_256x32x64x512_16x16_16x16_32x8x1_32x8x1_1x32x1x8_8x8x1_1x2_intrawave_v1,238.95,3789.55,0
256,32,13312,16384,torch.float8_e4m3fn,12,0,46.3062,a8w8_bpreshuffle_256x32x64x512_16x16_16x16_32x8x1_32x8x1_1x32x1x8_8x8x1_1x2_intrawave_v1,301.44,4739.76,0
256,32,14336,8192,torch.float8_e4m3fn,6,0,26.4468,a8w8_bpreshuffle_256x16x128x512_16x16_16x16_32x8x1_32x8x1_1x16x1x16_8x8x1_1x2_intrawave_v1,284.2,4485.24,0
256,32,16384,2048,torch.float8_e4m3fn,6,0,9.6867,a8w8_bpreshuffle_256x16x128x512_16x16_16x16_32x8x1_32x8x1_1x16x1x16_8x8x1_1x2_intrawave_v1,221.69,3578.98,0
256,32,16384,4096,torch.float8_e4m3fn,26,0,17.6799,a8w8_bpreshuffle_256x32x64x512_16x16_16x16_32x8x1_32x8x1_1x32x1x8_8x8x1_1x2_intrawave_v2,242.93,3862.49,0
256,32,16384,6656,torch.float8_e4m3fn,12,0,23.1146,a8w8_bpreshuffle_256x32x64x512_16x16_16x16_32x8x1_32x8x1_1x32x1x8_8x8x1_1x2_intrawave_v1,301.94,4772.46,0
256,32,16384,8192,torch.float8_e4m3fn,19,0,28.8166,a8w8_bpreshuffle_256x16x64x512_16x16_16x16_32x8x1_32x8x1_1x16x1x16_4x4x1_1x1_intrawave_v2,298.09,4703.14,0
256,32,16384,13312,torch.float8_e4m3fn,12,0,40.7803,a8w8_bpreshuffle_256x32x64x512_16x16_16x16_32x8x1_32x8x1_1x32x1x8_8x8x1_1x2_intrawave_v1,342.29,5384.42,0
256,32,16384,26624,torch.float8_e4m3fn,12,0,77.4146,a8w8_bpreshuffle_256x32x64x512_16x16_16x16_32x8x1_32x8x1_1x32x1x8_8x8x1_1x2_intrawave_v1,360.62,5659.24,0
256,32,26624,16384,torch.float8_e4m3fn,119,0,80.3452,a8w8_bpreshuffle_256x32x128x256_16x16_16x16_16x16x1_16x16x1_1x16x1x16_8x8x1_1x2_intrawave_v1,347.47,5456.9,0
256,32,51200,5120,torch.float8_e4m3fn,133,0,47.8343,a8w8_bpreshuffle_256x32x256x256_16x16_16x16_16x16x1_16x16x1_1x16x1x16_8x8x1_1x2_intrawave_v1,350.74,5552.18,0
256,32,53248,16384,torch.float8_e4m3fn,136,0,154.4861,a8w8_bpreshuffle_256x80x256x256_16x16_16x16_16x16x1_16x16x1_1x16x1x16_8x8x1_1x2_intrawave_v3,361.42,5672.66,0
256,32,57344,8192,torch.float8_e4m3fn,85,0,86.5188,a8w8_bpreshuffle_256x64x128x128_16x16_16x16_8x32x1_8x32x1_1x32x1x8_8x8x1_2x1_intrawave_v3,347.49,5475.04,0
256,64,192,1024,torch.float8_e4m3fn,15,0,4.5229,a8w8_bpreshuffle_256x16x64x256_16x16_16x16_16x16x1_16x16x1_1x16x1x16_4x4x1_1x1_intrawave_v1,5.56,63.39,0
256,64,800,5120,torch.float8_e4m3fn,10,0,10.5456,a8w8_bpreshuffle_128x16x32x512_16x16_16x16_32x4x1_32x4x1_1x16x1x8_4x4x1_1x1_intrawave_v1,49.72,429.19,0
256,64,1280,8192,torch.float8_e4m3fn,10,0,11.9979,a8w8_bpreshuffle_128x16x32x512_16x16_16x16_32x4x1_32x4x1_1x16x1x8_4x4x1_1x1_intrawave_v1,111.87,931.32,0
256,64,2304,16384,torch.float8_e4m3fn,19,0,27.9421,a8w8_bpreshuffle_256x16x64x512_16x16_16x16_32x8x1_32x8x1_1x16x1x16_4x4x1_1x1_intrawave_v2,172.92,1399.04,0
256,64,2560,8192,torch.float8_e4m3fn,5,0,12.8533,a8w8_bpreshuffle_256x16x64x512_16x16_16x16_32x8x1_32x8x1_1x16x1x16_4x4x1_1x1_intrawave_v1,208.85,1697.89,0
256,64,4608,16384,torch.float8_e4m3fn,10,0,36.4754,a8w8_bpreshuffle_128x16x32x512_16x16_16x16_32x4x1_32x4x1_1x16x1x8_4x4x1_1x1_intrawave_v1,264.94,2114.74,0
256,64,5120,640,torch.float8_e4m3fn,23,0,6.7207,a8w8_bpreshuffle_128x16x32x128_16x16_16x16_8x16x1_8x16x1_1x16x1x8_4x4x1_1x1_intrawave_v2,62.41,591.18,0
256,64,5120,1280,torch.float8_e4m3fn,29,0,7.6564,a8w8_bpreshuffle_256x16x64x256_16x16_16x16_16x16x1_16x16x1_1x16x1x16_4x4x1_1x1_intrawave_v2,109.56,952.26,0
256,64,5120,3200,torch.float8_e4m3fn,23,0,15.6284,a8w8_bpreshuffle_128x16x32x128_16x16_16x16_8x16x1_8x16x1_1x16x1x8_4x4x1_1x1_intrawave_v2,134.19,1103.39,0
256,64,5120,5120,torch.float8_e4m3fn,10,0,14.3407,a8w8_bpreshuffle_128x16x32x512_16x16_16x16_32x4x1_32x4x1_1x16x1x8_4x4x1_1x1_intrawave_v1,233.98,1896.52,0
256,64,5120,6400,torch.float8_e4m3fn,15,0,19.7146,a8w8_bpreshuffle_256x16x64x256_16x16_16x16_16x16x1_16x16x1_1x16x1x16_4x4x1_1x1_intrawave_v1,212.75,1716.14,0
256,64,5120,25600,torch.float8_e4m3fn,24,0,52.8565,a8w8_bpreshuffle_128x16x32x512_16x16_16x16_32x4x1_32x4x1_1x16x1x8_4x4x1_1x1_intrawave_v2,317.41,2523.17,0
256,64,6400,5120,torch.float8_e4m3fn,12,0,14.7961,a8w8_bpreshuffle_256x32x64x512_16x16_16x16_32x8x1_32x8x1_1x32x1x8_8x8x1_1x2_intrawave_v1,283.47,2292.15,0
256,64,7168,8192,torch.float8_e4m3fn,12,0,20.6714,a8w8_bpreshuffle_256x32x64x512_16x16_16x16_32x8x1_32x8x1_1x32x1x8_8x8x1_1x2_intrawave_v1,363.6,2910.4,0
256,64,8192,2048,torch.float8_e4m3fn,5,0,7.5112,a8w8_bpreshuffle_256x16x64x512_16x16_16x16_32x8x1_32x8x1_1x16x1x16_4x4x1_1x1_intrawave_v1,285.9,2390.68,0
256,64,8192,3584,torch.float8_e4m3fn,12,0,11.0813,a8w8_bpreshuffle_256x32x64x512_16x16_16x16_32x8x1_32x8x1_1x32x1x8_8x8x1_1x2_intrawave_v1,339.14,2764.85,0
256,64,8192,7168,torch.float8_e4m3fn,12,0,19.2039,a8w8_bpreshuffle_256x32x64x512_16x16_16x16_32x8x1_32x8x1_1x32x1x8_8x8x1_1x2_intrawave_v1,391.39,3136.22,0
256,64,8192,8192,torch.float8_e4m3fn,12,0,21.1081,a8w8_bpreshuffle_256x32x64x512_16x16_16x16_32x8x1_32x8x1_1x32x1x8_8x8x1_1x2_intrawave_v1,406.95,3253.81,0
256,64,8192,28672,torch.float8_e4m3fn,12,0,64.9256,a8w8_bpreshuffle_256x32x64x512_16x16_16x16_32x8x1_32x8x1_1x32x1x8_8x8x1_1x2_intrawave_v1,463.06,3662.11,0
256,64,9216,16384,torch.float8_e4m3fn,114,0,56.6696,a8w8_bpreshuffle_256x64x64x256_16x16_16x16_16x16x1_16x16x1_1x32x1x8_8x8x1_2x1_intrawave_v3,341.05,2703.8,0
256,64,10240,8192,torch.float8_e4m3fn,114,0,25.5687,a8w8_bpreshuffle_256x64x64x256_16x16_16x16_16x16x1_16x16x1_1x32x1x8_8x8x1_2x1_intrawave_v3,419.94,3352.58,0
256,64,12800,5120,torch.float8_e4m3fn,119,0,21.9262,a8w8_bpreshuffle_256x32x128x256_16x16_16x16_16x16x1_16x16x1_1x16x1x16_8x8x1_1x2_intrawave_v1,382.58,3078.6,0
256,64,13312,16384,torch.float8_e4m3fn,114,0,60.16,a8w8_bpreshuffle_256x64x64x256_16x16_16x16_16x16x1_16x16x1_1x32x1x8_8x8x1_2x1_intrawave_v3,464.05,3671.15,0
256,64,14336,8192,torch.float8_e4m3fn,114,0,29.5848,a8w8_bpreshuffle_256x64x64x256_16x16_16x16_16x16x1_16x16x1_1x32x1x8_8x8x1_2x1_intrawave_v3,508.11,4049.37,0
256,64,16384,2048,torch.float8_e4m3fn,119,0,11.4341,a8w8_bpreshuffle_256x32x128x256_16x16_16x16_16x16x1_16x16x1_1x16x1x16_8x8x1_1x2_intrawave_v1,375.63,3129.47,0
256,64,16384,4096,torch.float8_e4m3fn,119,0,20.8735,a8w8_bpreshuffle_256x32x128x256_16x16_16x16_16x16x1_16x16x1_1x16x1x16_8x8x1_1x2_intrawave_v1,411.52,3328.06,0
256,64,16384,6656,torch.float8_e4m3fn,119,0,29.3009,a8w8_bpreshuffle_256x32x128x256_16x16_16x16_16x16x1_16x16x1_1x16x1x16_8x8x1_1x2_intrawave_v1,476.39,3807.9,0
256,64,16384,8192,torch.float8_e4m3fn,119,0,35.6664,a8w8_bpreshuffle_256x32x128x256_16x16_16x16_16x16x1_16x16x1_1x16x1x16_8x8x1_1x2_intrawave_v1,481.68,3836.64,0
256,64,16384,13312,torch.float8_e4m3fn,119,0,53.1879,a8w8_bpreshuffle_256x32x128x256_16x16_16x16_16x16x1_16x16x1_1x16x1x16_8x8x1_1x2_intrawave_v1,524.88,4156.08,0
256,64,16384,26624,torch.float8_e4m3fn,119,0,102.4795,a8w8_bpreshuffle_256x32x128x256_16x16_16x16_16x16x1_16x16x1_1x16x1x16_8x8x1_1x2_intrawave_v1,544.84,4293.63,0
256,64,26624,16384,torch.float8_e4m3fn,121,0,91.6538,a8w8_bpreshuffle_256x64x128x256_16x16_16x16_16x16x1_16x16x1_1x16x1x16_8x8x1_1x2_intrawave_v3,609.19,4807.92,0
256,64,51200,5120,torch.float8_e4m3fn,135,0,54.3316,a8w8_bpreshuffle_256x64x256x256_16x16_16x16_16x16x1_16x16x1_1x16x1x16_8x8x1_1x2_intrawave_v3,617.59,4951.54,0
256,64,53248,16384,torch.float8_e4m3fn,135,0,156.5996,a8w8_bpreshuffle_256x64x256x256_16x16_16x16_16x16x1_16x16x1_1x16x1x16_8x8x1_1x2_intrawave_v3,713.09,5621.21,0
256,64,57344,8192,torch.float8_e4m3fn,85,0,87.6062,a8w8_bpreshuffle_256x64x128x128_16x16_16x16_8x32x1_8x32x1_1x32x1x8_8x8x1_2x1_intrawave_v3,686.36,5451.97,0
256,128,800,5120,torch.float8_e4m3fn,24,0,9.9852,a8w8_bpreshuffle_128x16x32x512_16x16_16x16_32x4x1_32x4x1_1x16x1x8_4x4x1_1x1_intrawave_v2,105.01,496.35,0
256,128,1280,8192,torch.float8_e4m3fn,5,0,12.228,a8w8_bpreshuffle_256x16x64x512_16x16_16x16_32x8x1_32x8x1_1x16x1x16_4x4x1_1x1_intrawave_v1,219.53,970.07,0
256,128,2304,16384,torch.float8_e4m3fn,24,0,33.0153,a8w8_bpreshuffle_128x16x32x512_16x16_16x16_32x4x1_32x4x1_1x16x1x8_4x4x1_1x1_intrawave_v2,292.7,1224.76,0
256,128,2560,8192,torch.float8_e4m3fn,10,0,17.8034,a8w8_bpreshuffle_128x16x32x512_16x16_16x16_32x4x1_32x4x1_1x16x1x8_4x4x1_1x1_intrawave_v1,301.56,1273.66,0
256,128,4608,16384,torch.float8_e4m3fn,108,0,54.3179,a8w8_bpreshuffle_256x16x64x256_16x16_16x16_16x16x1_16x16x1_1x16x1x16_4x4x1_1x1_intrawave_v1,355.82,1450.25,0
256,128,5120,640,torch.float8_e4m3fn,23,0,6.3513,a8w8_bpreshuffle_128x16x32x128_16x16_16x16_8x16x1_8x16x1_1x16x1x8_4x4x1_1x1_intrawave_v2,132.08,735.19,0
256,128,5120,1280,torch.float8_e4m3fn,29,0,7.7817,a8w8_bpreshuffle_256x16x64x256_16x16_16x16_16x16x1_16x16x1_1x16x1x16_4x4x1_1x1_intrawave_v2,215.6,1031.67,0
256,128,5120,3200,torch.float8_e4m3fn,23,0,16.0101,a8w8_bpreshuffle_128x16x32x128_16x16_16x16_8x16x1_8x16x1_1x16x1x8_4x4x1_1x1_intrawave_v2,261.98,1130.81,0
256,128,5120,5120,torch.float8_e4m3fn,108,0,19.63,a8w8_bpreshuffle_256x16x64x256_16x16_16x16_16x16x1_16x16x1_1x16x1x16_4x4x1_1x1_intrawave_v1,341.87,1435.58,0
256,128,5120,6400,torch.float8_e4m3fn,29,0,22.9859,a8w8_bpreshuffle_256x16x64x256_16x16_16x16_16x16x1_16x16x1_1x16x1x16_4x4x1_1x1_intrawave_v2,364.95,1518.23,0
256,128,5120,25600,torch.float8_e4m3fn,114,0,83.5847,a8w8_bpreshuffle_256x64x64x256_16x16_16x16_16x16x1_16x16x1_1x32x1x8_8x8x1_2x1_intrawave_v3,401.44,1623.02,0
256,128,6400,5120,torch.float8_e4m3fn,114,0,20.5908,a8w8_bpreshuffle_256x64x64x256_16x16_16x16_16x16x1_16x16x1_1x32x1x8_8x8x1_2x1_intrawave_v3,407.4,1702.79,0
256,128,7168,8192,torch.float8_e4m3fn,114,0,23.7352,a8w8_bpreshuffle_256x64x64x256_16x16_16x16_16x16x1_16x16x1_1x32x1x8_8x8x1_2x1_intrawave_v3,633.34,2595.46,0
256,128,8192,1024,torch.float8_e4m3fn,119,0,6.9407,a8w8_bpreshuffle_256x32x128x256_16x16_16x16_16x16x1_16x16x1_1x16x1x16_8x8x1_1x2_intrawave_v1,309.4,1529.65,0
256,128,8192,2048,torch.float8_e4m3fn,114,0,8.8614,a8w8_bpreshuffle_256x64x64x256_16x16_16x16_16x16x1_16x16x1_1x32x1x8_8x8x1_2x1_intrawave_v3,484.68,2159.54,0
256,128,8192,3584,torch.float8_e4m3fn,114,0,12.978,a8w8_bpreshuffle_256x64x64x256_16x16_16x16_16x16x1_16x16x1_1x32x1x8_8x8x1_2x1_intrawave_v3,579.15,2459.24,0
256,128,8192,7168,torch.float8_e4m3fn,114,0,21.6976,a8w8_bpreshuffle_256x64x64x256_16x16_16x16_16x16x1_16x16x1_1x32x1x8_8x8x1_2x1_intrawave_v3,692.81,2845.24,0
256,128,8192,8192,torch.float8_e4m3fn,114,0,24.8294,a8w8_bpreshuffle_256x64x64x256_16x16_16x16_16x16x1_16x16x1_1x32x1x8_8x8x1_2x1_intrawave_v3,691.92,2829.49,0
256,128,8192,28672,torch.float8_e4m3fn,114,0,75.1872,a8w8_bpreshuffle_256x64x64x256_16x16_16x16_16x16x1_16x16x1_1x32x1x8_8x8x1_2x1_intrawave_v3,799.73,3200.65,0
256,128,9216,16384,torch.float8_e4m3fn,126,0,72.8197,a8w8_bpreshuffle_256x32x192x256_16x16_16x16_16x16x1_16x16x1_1x32x1x8_8x8x1_2x1_intrawave_v1,530.83,2134.74,0
256,128,10240,8192,torch.float8_e4m3fn,113,0,30.4124,a8w8_bpreshuffle_256x48x64x256_16x16_16x16_16x16x1_16x16x1_1x16x1x16_4x4x1_1x1_intrawave_v1,706.12,2878.96,0
256,128,12800,5120,torch.float8_e4m3fn,65,0,28.9421,a8w8_bpreshuffle_256x128x64x256_16x16_16x16_16x16x1_16x16x1_1x32x1x8_8x8x1_2x1_intrawave_v3,579.68,2400.25,0
256,128,13312,16384,torch.float8_e4m3fn,144,0,79.9061,a8w8_bpreshuffle_256x128x64x256_16x16_16x16_16x16x1_16x16x1_1x32x1x8_8x8x1_2x1_intrawave_v3,698.75,2798.4,0
256,128,14336,8192,torch.float8_e4m3fn,144,0,36.1842,a8w8_bpreshuffle_256x128x64x256_16x16_16x16_16x16x1_16x16x1_1x32x1x8_8x8x1_2x1_intrawave_v3,830.88,3376.03,0
256,128,16384,2048,torch.float8_e4m3fn,119,0,15.5043,a8w8_bpreshuffle_256x32x128x256_16x16_16x16_16x16x1_16x16x1_1x16x1x16_8x8x1_1x2_intrawave_v1,554.04,2451.63,0
256,128,16384,4096,torch.float8_e4m3fn,121,0,26.5935,a8w8_bpreshuffle_256x64x128x256_16x16_16x16_16x16x1_16x16x1_1x16x1x16_8x8x1_1x2_intrawave_v3,646.02,2700.94,0
256,128,16384,6656,torch.float8_e4m3fn,65,0,39.0387,a8w8_bpreshuffle_256x128x64x256_16x16_16x16_16x16x1_16x16x1_1x32x1x8_8x8x1_2x1_intrawave_v3,715.12,2922.69,0
256,128,16384,8192,torch.float8_e4m3fn,121,0,45.9107,a8w8_bpreshuffle_256x64x128x256_16x16_16x16_16x16x1_16x16x1_1x16x1x16_8x8x1_1x2_intrawave_v3,748.4,3037.65,0
256,128,16384,13312,torch.float8_e4m3fn,65,0,70.6454,a8w8_bpreshuffle_256x128x64x256_16x16_16x16_16x16x1_16x16x1_1x32x1x8_8x8x1_2x1_intrawave_v3,790.35,3170.79,0
256,128,16384,26624,torch.float8_e4m3fn,144,0,134.0597,a8w8_bpreshuffle_256x128x64x256_16x16_16x16_16x16x1_16x16x1_1x32x1x8_8x8x1_2x1_intrawave_v3,832.98,3310.54,0
256,128,26624,16384,torch.float8_e4m3fn,139,0,108.1175,a8w8_bpreshuffle_256x128x128x256_16x16_16x16_16x16x1_16x16x1_1x16x1x16_8x8x1_1x2_intrawave_v3,1032.85,4117.01,0
256,128,51200,5120,torch.float8_e4m3fn,154,0,65.6842,a8w8_bpreshuffle_256x128x256x256_16x16_16x16_16x16x1_16x16x1_1x16x1x16_8x8x1_1x2_intrawave_v3,1021.69,4200.5,0
256,128,53248,16384,torch.float8_e4m3fn,154,0,184.7497,a8w8_bpreshuffle_256x128x256x256_16x16_16x16_16x16x1_16x16x1_1x16x1x16_8x8x1_1x2_intrawave_v3,1208.87,4807.28,0
256,128,57344,8192,torch.float8_e4m3fn,54,0,95.8445,a8w8_bpreshuffle_256x160x256x128_16x16_16x16_8x32x1_8x32x1_1x32x1x8_8x8x1_2x1_intrawave_v3,1254.73,5065.4,0
256,256,800,5120,torch.float8_e4m3fn,24,0,11.6817,a8w8_bpreshuffle_128x16x32x512_16x16_16x16_32x4x1_32x4x1_1x16x1x8_4x4x1_1x1_intrawave_v2,179.52,497.9,0
256,256,1280,8192,torch.float8_e4m3fn,12,0,17.1516,a8w8_bpreshuffle_256x32x64x512_16x16_16x16_32x8x1_32x8x1_1x32x1x8_8x8x1_1x2_intrawave_v1,313.02,771.84,0
256,256,2304,16384,torch.float8_e4m3fn,15,0,52.6426,a8w8_bpreshuffle_256x16x64x256_16x16_16x16_16x16x1_16x16x1_1x16x1x16_4x4x1_1x1_intrawave_v1,367.14,819.16,0
256,256,2560,8192,torch.float8_e4m3fn,114,0,21.4545,a8w8_bpreshuffle_256x64x64x256_16x16_16x16_16x16x1_16x16x1_1x32x1x8_8x8x1_2x1_intrawave_v3,500.47,1136.33,0
256,256,4608,16384,torch.float8_e4m3fn,116,0,68.5478,a8w8_bpreshuffle_256x96x64x256_16x16_16x16_16x16x1_16x16x1_1x32x1x8_8x8x1_2x1_intrawave_v3,563.91,1196.99,0
256,256,5120,640,torch.float8_e4m3fn,76,0,7.7921,a8w8_bpreshuffle_256x32x64x128_16x16_16x16_8x32x1_8x32x1_1x32x1x8_8x8x1_2x1_intrawave_v1,215.31,777.98,0
256,256,5120,1280,torch.float8_e4m3fn,119,0,10.1726,a8w8_bpreshuffle_256x32x128x256_16x16_16x16_16x16x1_16x16x1_1x16x1x16_8x8x1_1x2_intrawave_v1,329.85,934.15,0
256,256,5120,3200,torch.float8_e4m3fn,77,0,19.1458,a8w8_bpreshuffle_256x64x64x128_16x16_16x16_8x32x1_8x32x1_1x32x1x8_8x8x1_2x1_intrawave_v3,438.14,1035.46,0
256,256,5120,5120,torch.float8_e4m3fn,116,0,25.9267,a8w8_bpreshuffle_256x96x64x256_16x16_16x16_16x16x1_16x16x1_1x32x1x8_8x8x1_2x1_intrawave_v3,517.68,1162.76,0
256,256,5120,6400,torch.float8_e4m3fn,65,0,28.085,a8w8_bpreshuffle_256x128x64x256_16x16_16x16_16x16x1_16x16x1_1x32x1x8_8x8x1_2x1_intrawave_v3,597.37,1318.42,0
256,256,5120,25600,torch.float8_e4m3fn,116,0,106.6527,a8w8_bpreshuffle_256x96x64x256_16x16_16x16_16x16x1_16x16x1_1x32x1x8_8x8x1_2x1_intrawave_v3,629.23,1314.99,0
256,256,6400,5120,torch.float8_e4m3fn,65,0,26.9347,a8w8_bpreshuffle_256x128x64x256_16x16_16x16_16x16x1_16x16x1_1x32x1x8_8x8x1_2x1_intrawave_v3,622.88,1386.89,0
256,256,7168,8192,torch.float8_e4m3fn,65,0,29.6374,a8w8_bpreshuffle_256x128x64x256_16x16_16x16_16x16x1_16x16x1_1x32x1x8_8x8x1_2x1_intrawave_v3,1014.42,2175.88,0
256,256,8192,1024,torch.float8_e4m3fn,77,0,9.7085,a8w8_bpreshuffle_256x64x64x128_16x16_16x16_8x32x1_8x32x1_1x32x1x8_8x8x1_2x1_intrawave_v3,442.39,1323.07,0
256,256,8192,2048,torch.float8_e4m3fn,114,0,11.9681,a8w8_bpreshuffle_256x64x64x256_16x16_16x16_16x16x1_16x16x1_1x32x1x8_8x8x1_2x1_intrawave_v3,717.74,1796.09,0
256,256,8192,3584,torch.float8_e4m3fn,144,0,16.6491,a8w8_bpreshuffle_256x128x64x256_16x16_16x16_16x16x1_16x16x1_1x32x1x8_8x8x1_2x1_intrawave_v3,902.89,2070.5,0
256,256,8192,7168,torch.float8_e4m3fn,65,0,28.6205,a8w8_bpreshuffle_256x128x64x256_16x16_16x16_16x16x1_16x16x1_1x32x1x8_8x8x1_2x1_intrawave_v3,1050.46,2262.35,0
256,256,8192,8192,torch.float8_e4m3fn,144,0,30.9086,a8w8_bpreshuffle_256x128x64x256_16x16_16x16_16x16x1_16x16x1_1x32x1x8_8x8x1_2x1_intrawave_v3,1111.66,2374.75,0
256,256,8192,28672,torch.float8_e4m3fn,65,0,95.3629,a8w8_bpreshuffle_256x128x64x256_16x16_16x16_16x16x1_16x16x1_1x32x1x8_8x8x1_2x1_intrawave_v3,1261.07,2583.98,0
256,256,9216,16384,torch.float8_e4m3fn,124,0,84.3085,a8w8_bpreshuffle_256x112x128x256_16x16_16x16_16x16x1_16x16x1_1x16x1x16_8x8x1_1x2_intrawave_v3,916.98,1896.7,0
256,256,10240,8192,torch.float8_e4m3fn,123,0,38.8017,a8w8_bpreshuffle_256x96x128x256_16x16_16x16_16x16x1_16x16x1_1x16x1x16_8x8x1_1x2_intrawave_v3,1106.9,2351.09,0
256,256,12800,5120,torch.float8_e4m3fn,139,0,34.8457,a8w8_bpreshuffle_256x128x128x256_16x16_16x16_16x16x1_16x16x1_1x16x1x16_8x8x1_1x2_intrawave_v3,962.94,2106.44,0
256,256,13312,16384,torch.float8_e4m3fn,139,0,92.6483,a8w8_bpreshuffle_256x128x128x256_16x16_16x16_16x16x1_16x16x1_1x16x1x16_8x8x1_1x2_intrawave_v3,1205.3,2472.94,0
256,256,14336,8192,torch.float8_e4m3fn,139,0,45.4901,a8w8_bpreshuffle_256x128x128x256_16x16_16x16_16x16x1_16x16x1_1x16x1x16_8x8x1_1x2_intrawave_v3,1321.82,2789.13,0
256,256,16384,2048,torch.float8_e4m3fn,139,0,18.9985,a8w8_bpreshuffle_256x128x128x256_16x16_16x16_16x16x1_16x16x1_1x16x1x16_8x8x1_1x2_intrawave_v3,904.28,2235.3,0
256,256,16384,4096,torch.float8_e4m3fn,63,0,32.6482,a8w8_bpreshuffle_256x128x128x256_16x16_16x16_16x16x1_16x16x1_1x32x1x8_8x8x1_2x1_intrawave_v3,1052.42,2344.57,0
256,256,16384,6656,torch.float8_e4m3fn,139,0,46.695,a8w8_bpreshuffle_256x128x128x256_16x16_16x16_16x16x1_16x16x1_1x16x1x16_8x8x1_1x2_intrawave_v3,1195.73,2551.55,0
256,256,16384,8192,torch.float8_e4m3fn,139,0,55.672,a8w8_bpreshuffle_256x128x128x256_16x16_16x16_16x16x1_16x16x1_1x16x1x16_8x8x1_1x2_intrawave_v3,1234.36,2599.21,0
256,256,16384,13312,torch.float8_e4m3fn,139,0,83.1524,a8w8_bpreshuffle_256x128x128x256_16x16_16x16_16x16x1_16x16x1_1x16x1x16_8x8x1_1x2_intrawave_v3,1342.95,2764.81,0
256,256,16384,26624,torch.float8_e4m3fn,139,0,163.3311,a8w8_bpreshuffle_256x128x128x256_16x16_16x16_16x16x1_16x16x1_1x16x1x16_8x8x1_1x2_intrawave_v3,1367.4,2763.78,0
256,256,26624,16384,torch.float8_e4m3fn,154,0,141.6113,a8w8_bpreshuffle_256x128x256x256_16x16_16x16_16x16x1_16x16x1_1x16x1x16_8x8x1_1x2_intrawave_v3,1577.12,3206.19,0
256,256,51200,5120,torch.float8_e4m3fn,154,0,97.921,a8w8_bpreshuffle_256x128x256x256_16x16_16x16_16x16x1_16x16x1_1x16x1x16_8x8x1_1x2_intrawave_v3,1370.67,2958.19,0
256,256,53248,16384,torch.float8_e4m3fn,154,0,276.3785,a8w8_bpreshuffle_256x128x256x256_16x16_16x16_16x16x1_16x16x1_1x16x1x16_8x8x1_1x2_intrawave_v3,1616.18,3270.42,0
256,256,57344,8192,torch.float8_e4m3fn,33,0,129.4795,a8w8_bpreshuffle_256x256x256x128_16x16_16x16_8x32x1_8x32x1_1x32x1x8_8x8x1_2x1_intrawave_v3,1857.58,3871.03,0
256,512,800,5120,torch.float8_e4m3fn,10,0,15.082,a8w8_bpreshuffle_128x16x32x512_16x16_16x16_32x4x1_32x4x1_1x16x1x8_4x4x1_1x1_intrawave_v1,278.1,499.71,0
256,512,1280,8192,torch.float8_e4m3fn,114,0,21.033,a8w8_bpreshuffle_256x64x64x256_16x16_16x16_16x16x1_16x16x1_1x32x1x8_8x8x1_2x1_intrawave_v3,510.5,760.27,0
256,512,2304,16384,torch.float8_e4m3fn,115,0,63.7872,a8w8_bpreshuffle_256x80x64x256_16x16_16x16_16x16x1_16x16x1_1x16x1x16_4x4x1_1x1_intrawave_v3,605.99,760.29,0
256,512,2560,8192,torch.float8_e4m3fn,113,0,27.2155,a8w8_bpreshuffle_256x48x64x256_16x16_16x16_16x16x1_16x16x1_1x16x1x16_4x4x1_1x1_intrawave_v1,789.07,1021.01,0
256,512,4608,16384,torch.float8_e4m3fn,124,0,84.5982,a8w8_bpreshuffle_256x112x128x256_16x16_16x16_16x16x1_16x16x1_1x16x1x16_8x8x1_1x2_intrawave_v3,913.84,1047.36,0
256,512,5120,640,torch.float8_e4m3fn,77,0,9.0563,a8w8_bpreshuffle_256x64x64x128_16x16_16x16_8x32x1_8x32x1_1x32x1x8_8x8x1_2x1_intrawave_v3,370.51,976.93,0
256,512,5120,1280,torch.float8_e4m3fn,77,0,12.8224,a8w8_bpreshuffle_256x64x64x128_16x16_16x16_8x32x1_8x32x1_1x32x1x8_8x8x1_2x1_intrawave_v3,523.37,971.1,0
256,512,5120,3200,torch.float8_e4m3fn,85,0,23.0489,a8w8_bpreshuffle_256x64x128x128_16x16_16x16_8x32x1_8x32x1_1x32x1x8_8x8x1_2x1_intrawave_v3,727.9,1009.39,0
256,512,5120,5120,torch.float8_e4m3fn,124,0,31.9895,a8w8_bpreshuffle_256x112x128x256_16x16_16x16_16x16x1_16x16x1_1x16x1x16_8x8x1_1x2_intrawave_v3,839.14,1065.31,0
256,512,5120,6400,torch.float8_e4m3fn,139,0,36.8067,a8w8_bpreshuffle_256x128x128x256_16x16_16x16_16x16x1_16x16x1_1x16x1x16_8x8x1_1x2_intrawave_v3,911.64,1121.74,0
256,512,5120,25600,torch.float8_e4m3fn,124,0,128.0705,a8w8_bpreshuffle_256x112x128x256_16x16_16x16_16x16x1_16x16x1_1x16x1x16_8x8x1_1x2_intrawave_v3,1048,1166.72,0
256,512,6400,5120,torch.float8_e4m3fn,124,0,33.3791,a8w8_bpreshuffle_256x112x128x256_16x16_16x16_16x16x1_16x16x1_1x16x1x16_8x8x1_1x2_intrawave_v3,1005.25,1256.57,0
256,512,7168,8192,torch.float8_e4m3fn,63,0,42.0669,a8w8_bpreshuffle_256x128x128x256_16x16_16x16_16x16x1_16x16x1_1x32x1x8_8x8x1_2x1_intrawave_v3,1429.38,1670.07,0
256,512,8192,1024,torch.float8_e4m3fn,85,0,11.5306,a8w8_bpreshuffle_256x64x128x128_16x16_16x16_8x32x1_8x32x1_1x32x1x8_8x8x1_2x1_intrawave_v3,744.97,1500.49,0
256,512,8192,2048,torch.float8_e4m3fn,139,0,15.6554,a8w8_bpreshuffle_256x128x128x256_16x16_16x16_16x16x1_16x16x1_1x16x1x16_8x8x1_1x2_intrawave_v3,1097.38,1674.46,0
256,512,8192,3584,torch.float8_e4m3fn,139,0,22.7592,a8w8_bpreshuffle_256x128x128x256_16x16_16x16_16x16x1_16x16x1_1x16x1x16_8x8x1_1x2_intrawave_v3,1320.99,1739.24,0
256,512,8192,7168,torch.float8_e4m3fn,139,0,39.3552,a8w8_bpreshuffle_256x128x128x256_16x16_16x16_16x16x1_16x16x1_1x16x1x16_8x8x1_1x2_intrawave_v3,1527.87,1798.46,0
256,512,8192,8192,torch.float8_e4m3fn,139,0,43.6902,a8w8_bpreshuffle_256x128x128x256_16x16_16x16_16x16x1_16x16x1_1x16x1x16_8x8x1_1x2_intrawave_v3,1572.88,1824.02,0
256,512,8192,28672,torch.float8_e4m3fn,139,0,133.9721,a8w8_bpreshuffle_256x128x128x256_16x16_16x16_16x16x1_16x16x1_1x16x1x16_8x8x1_1x2_intrawave_v3,1795.29,1925.4,0
256,512,9216,16384,torch.float8_e4m3fn,149,0,104.8693,a8w8_bpreshuffle_256x128x192x256_16x16_16x16_16x16x1_16x16x1_1x32x1x8_8x8x1_2x1_intrawave_v3,1474.4,1609.82,0
256,512,10240,8192,torch.float8_e4m3fn,143,0,55.4465,a8w8_bpreshuffle_256x192x128x128_16x16_16x16_8x32x1_8x32x1_1x16x1x16_8x8x1_1x2_intrawave_v3,1549.23,1777.68,0
256,512,12800,5120,torch.float8_e4m3fn,138,0,46.2157,a8w8_bpreshuffle_256x112x256x256_16x16_16x16_16x16x1_16x16x1_1x16x1x16_8x8x1_1x2_intrawave_v3,1452.08,1758.38,0
256,512,13312,16384,torch.float8_e4m3fn,154,0,127.8746,a8w8_bpreshuffle_256x128x256x256_16x16_16x16_16x16x1_16x16x1_1x16x1x16_8x8x1_1x2_intrawave_v3,1746.54,1877.81,0
256,512,14336,8192,torch.float8_e4m3fn,154,0,63.6195,a8w8_bpreshuffle_256x128x256x256_16x16_16x16_16x16x1_16x16x1_1x16x1x16_8x8x1_1x2_intrawave_v3,1890.29,2142.66,0
256,512,16384,2048,torch.float8_e4m3fn,154,0,27.0054,a8w8_bpreshuffle_256x128x256x256_16x16_16x16_16x16x1_16x16x1_1x16x1x16_8x8x1_1x2_intrawave_v3,1272.33,1902.59,0
256,512,16384,4096,torch.float8_e4m3fn,154,0,43.8782,a8w8_bpreshuffle_256x128x256x256_16x16_16x16_16x16x1_16x16x1_1x16x1x16_8x8x1_1x2_intrawave_v3,1566.14,1959.59,0
256,512,16384,6656,torch.float8_e4m3fn,154,0,64.427,a8w8_bpreshuffle_256x128x256x256_16x16_16x16_16x16x1_16x16x1_1x16x1x16_8x8x1_1x2_intrawave_v3,1733.27,2005.94,0
256,512,16384,8192,torch.float8_e4m3fn,154,0,73.6131,a8w8_bpreshuffle_256x128x256x256_16x16_16x16_16x16x1_16x16x1_1x16x1x16_8x8x1_1x2_intrawave_v3,1867.04,2108.17,0
256,512,16384,13312,torch.float8_e4m3fn,154,0,114.1614,a8w8_bpreshuffle_256x128x256x256_16x16_16x16_16x16x1_16x16x1_1x16x1x16_8x8x1_1x2_intrawave_v3,1956.34,2117.15,0
256,512,16384,26624,torch.float8_e4m3fn,154,0,214.713,a8w8_bpreshuffle_256x128x256x256_16x16_16x16_16x16x1_16x16x1_1x16x1x16_8x8x1_1x2_intrawave_v3,2080.34,2173.21,0
256,512,26624,16384,torch.float8_e4m3fn,154,0,250.2793,a8w8_bpreshuffle_256x128x256x256_16x16_16x16_16x16x1_16x16x1_1x16x1x16_8x8x1_1x2_intrawave_v3,1784.71,1885.33,0
256,512,51200,5120,torch.float8_e4m3fn,158,0,174.8476,a8w8_bpreshuffle_256x192x256x128_16x16_16x16_8x32x1_8x32x1_1x16x1x16_8x8x1_1x2_intrawave_v3,1535.25,1814.12,0
256,512,53248,16384,torch.float8_e4m3fn,154,0,492.8785,a8w8_bpreshuffle_256x128x256x256_16x16_16x16_16x16x1_16x16x1_1x16x1x16_8x8x1_1x2_intrawave_v3,1812.52,1897.69,0
256,512,57344,8192,torch.float8_e4m3fn,33,0,227.0683,a8w8_bpreshuffle_256x256x256x128_16x16_16x16_8x32x1_8x32x1_1x32x1x8_8x8x1_2x1_intrawave_v3,2118.47,2345.89,0
256,1024,800,5120,torch.float8_e4m3fn,24,0,24.558,a8w8_bpreshuffle_128x16x32x512_16x16_16x16_32x4x1_32x4x1_1x16x1x8_4x4x1_1x1_intrawave_v2,341.58,446.99,0
256,1024,1280,8192,torch.float8_e4m3fn,113,0,26.819,a8w8_bpreshuffle_256x48x64x256_16x16_16x16_16x16x1_16x16x1_1x16x1x16_4x4x1_1x1_intrawave_v1,800.73,801.51,0
256,1024,2304,16384,torch.float8_e4m3fn,124,0,81.3585,a8w8_bpreshuffle_256x112x128x256_16x16_16x16_16x16x1_16x16x1_1x16x1x16_8x8x1_1x2_intrawave_v3,950.23,728.19,0
256,1024,2560,8192,torch.float8_e4m3fn,123,0,37.4372,a8w8_bpreshuffle_256x96x128x256_16x16_16x16_16x16x1_16x16x1_1x16x1x16_8x8x1_1x2_intrawave_v3,1147.25,924.29,0
256,1024,4608,16384,torch.float8_e4m3fn,149,0,104.0599,a8w8_bpreshuffle_256x128x192x256_16x16_16x16_16x16x1_16x16x1_1x32x1x8_8x8x1_2x1_intrawave_v3,1485.86,977.44,0
256,1024,5120,640,torch.float8_e4m3fn,86,0,11.1521,a8w8_bpreshuffle_256x96x128x128_16x16_16x16_8x32x1_8x32x1_1x32x1x8_8x8x1_2x1_intrawave_v3,601.76,1292.84,0
256,1024,5120,1280,torch.float8_e4m3fn,86,0,16.1465,a8w8_bpreshuffle_256x96x128x128_16x16_16x16_8x32x1_8x32x1_1x32x1x8_8x8x1_2x1_intrawave_v3,831.25,1136.47,0
256,1024,5120,3200,torch.float8_e4m3fn,51,0,29.1651,a8w8_bpreshuffle_256x192x128x128_16x16_16x16_8x32x1_8x32x1_1x32x1x8_8x8x1_2x1_intrawave_v3,1150.5,1033.65,0
256,1024,5120,5120,torch.float8_e4m3fn,137,0,40.2614,a8w8_bpreshuffle_256x96x256x256_16x16_16x16_16x16x1_16x16x1_1x16x1x16_8x8x1_1x2_intrawave_v3,1333.46,1041.77,0
256,1024,5120,6400,torch.float8_e4m3fn,137,0,48.5222,a8w8_bpreshuffle_256x96x256x256_16x16_16x16_16x16x1_16x16x1_1x16x1x16_8x8x1_1x2_intrawave_v3,1383.05,1026.49,0
256,1024,5120,25600,torch.float8_e4m3fn,137,0,162.5939,a8w8_bpreshuffle_256x96x256x256_16x16_16x16_16x16x1_16x16x1_1x16x1x16_8x8x1_1x2_intrawave_v3,1650.96,1031.85,0
256,1024,6400,5120,torch.float8_e4m3fn,138,0,45.101,a8w8_bpreshuffle_256x112x256x256_16x16_16x16_16x16x1_16x16x1_1x16x1x16_8x8x1_1x2_intrawave_v3,1487.97,1133.41,0
256,1024,7168,8192,torch.float8_e4m3fn,154,0,62.2696,a8w8_bpreshuffle_256x128x256x256_16x16_16x16_16x16x1_16x16x1_1x16x1x16_8x8x1_1x2_intrawave_v3,1931.26,1313.46,0
256,1024,8192,1024,torch.float8_e4m3fn,0,0,16.8199,a8w8_bpreshuffle_256x128x128x128_16x16_16x16_8x32x1_8x32x1_1x32x1x8_8x8x1_2x1_intrawave_v3,1021.4,1558.53,0
256,1024,8192,2048,torch.float8_e4m3fn,154,0,23.1654,a8w8_bpreshuffle_256x128x256x256_16x16_16x16_16x16x1_16x16x1_1x16x1x16_8x8x1_1x2_intrawave_v3,1483.24,1539,0
256,1024,8192,3584,torch.float8_e4m3fn,154,0,34.8454,a8w8_bpreshuffle_256x128x256x256_16x16_16x16_16x16x1_16x16x1_1x16x1x16_8x8x1_1x2_intrawave_v3,1725.61,1429.38,0
256,1024,8192,7168,torch.float8_e4m3fn,154,0,59.0054,a8w8_bpreshuffle_256x128x256x256_16x16_16x16_16x16x1_16x16x1_1x16x1x16_8x8x1_1x2_intrawave_v3,2038.1,1403.9,0
256,1024,8192,8192,torch.float8_e4m3fn,154,0,64.2479,a8w8_bpreshuffle_256x128x256x256_16x16_16x16_16x16x1_16x16x1_1x16x1x16_8x8x1_1x2_intrawave_v3,2139.2,1436.23,0
256,1024,8192,28672,torch.float8_e4m3fn,154,0,197.2769,a8w8_bpreshuffle_256x128x256x256_16x16_16x16_16x16x1_16x16x1_1x16x1x16_8x8x1_1x2_intrawave_v3,2438.38,1424.49,0
256,1024,9216,16384,torch.float8_e4m3fn,54,0,178.1558,a8w8_bpreshuffle_256x160x256x128_16x16_16x16_8x32x1_8x32x1_1x32x1x8_8x8x1_2x1_intrawave_v3,1735.77,1047.66,0
256,1024,10240,8192,torch.float8_e4m3fn,158,0,83.5863,a8w8_bpreshuffle_256x192x256x128_16x16_16x16_8x32x1_8x32x1_1x16x1x16_8x8x1_1x2_intrawave_v3,2055.35,1354.84,0
256,1024,12800,5120,torch.float8_e4m3fn,138,0,86.9605,a8w8_bpreshuffle_256x112x256x256_16x16_16x16_16x16x1_16x16x1_1x16x1x16_8x8x1_1x2_intrawave_v3,1543.43,1115.37,0
256,1024,13312,16384,torch.float8_e4m3fn,154,0,243.5736,a8w8_bpreshuffle_256x128x256x256_16x16_16x16_16x16x1_16x16x1_1x16x1x16_8x8x1_1x2_intrawave_v3,1833.85,1076.24,0
256,1024,14336,8192,torch.float8_e4m3fn,33,0,112.839,a8w8_bpreshuffle_256x256x256x128_16x16_16x16_8x32x1_8x32x1_1x32x1x8_8x8x1_2x1_intrawave_v3,2131.52,1375.32,0
256,1024,16384,2048,torch.float8_e4m3fn,33,0,49.7279,a8w8_bpreshuffle_256x256x256x128_16x16_16x16_8x32x1_8x32x1_1x32x1x8_8x8x1_2x1_intrawave_v3,1381.91,1391.69,0
256,1024,16384,4096,torch.float8_e4m3fn,33,0,81.4525,a8w8_bpreshuffle_256x256x256x128_16x16_16x16_8x32x1_8x32x1_1x32x1x8_8x8x1_2x1_intrawave_v3,1687.35,1287.35,0
256,1024,16384,6656,torch.float8_e4m3fn,2,0,120.523,a8w8_bpreshuffle_256x256x256x128_16x16_16x16_8x32x1_8x32x1_1x32x1x8_8x8x1_1x2_intrawave_v3,1853.08,1239.78,0
256,1024,16384,8192,torch.float8_e4m3fn,154,0,136.0178,a8w8_bpreshuffle_256x128x256x256_16x16_16x16_16x16x1_16x16x1_1x16x1x16_8x8x1_1x2_intrawave_v3,2020.9,1295.13,0
256,1024,16384,13312,torch.float8_e4m3fn,154,0,214.8294,a8w8_bpreshuffle_256x128x256x256_16x16_16x16_16x16x1_16x16x1_1x16x1x16_8x8x1_1x2_intrawave_v3,2079.22,1234.89,0
256,1024,16384,26624,torch.float8_e4m3fn,154,0,412.5087,a8w8_bpreshuffle_256x128x256x256_16x16_16x16_16x16x1_16x16x1_1x16x1x16_8x8x1_1x2_intrawave_v3,2165.66,1204.88,0
256,1024,26624,16384,torch.float8_e4m3fn,33,0,467.1211,a8w8_bpreshuffle_256x256x256x128_16x16_16x16_8x32x1_8x32x1_1x32x1x8_8x8x1_2x1_intrawave_v3,1912.47,1086.47,0
256,1024,51200,5120,torch.float8_e4m3fn,40,0,288.5662,a8w8_bpreshuffle_256x224x256x128_16x16_16x16_8x32x1_8x32x1_1x32x1x8_8x8x1_2x1_intrawave_v3,1860.48,1289.98,0
256,1024,53248,16384,torch.float8_e4m3fn,154,0,850.624,a8w8_bpreshuffle_256x128x256x256_16x16_16x16_16x16x1_16x16x1_1x16x1x16_8x8x1_1x2_intrawave_v3,2100.47,1173.54,0
256,1024,57344,8192,torch.float8_e4m3fn,33,0,409.7151,a8w8_bpreshuffle_256x256x256x128_16x16_16x16_8x32x1_8x32x1_1x32x1x8_8x8x1_2x1_intrawave_v3,2348.15,1453.67,0
256,2048,800,5120,torch.float8_e4m3fn,24,0,41.7422,a8w8_bpreshuffle_128x16x32x512_16x16_16x16_32x4x1_32x4x1_1x16x1x8_4x4x1_1x1_intrawave_v2,401.92,427.83,0
256,2048,1280,8192,torch.float8_e4m3fn,123,0,36.7116,a8w8_bpreshuffle_256x96x128x256_16x16_16x16_16x16x1_16x16x1_1x16x1x16_8x8x1_1x2_intrawave_v3,1169.92,885.44,0
256,2048,2304,16384,torch.float8_e4m3fn,131,0,101.2648,a8w8_bpreshuffle_256x112x192x256_16x16_16x16_16x16x1_16x16x1_1x16x1x16_4x4x1_1x1_intrawave_v3,1526.88,797.32,0
256,2048,2560,8192,torch.float8_e4m3fn,138,0,55.1683,a8w8_bpreshuffle_256x112x256x256_16x16_16x16_16x16x1_16x16x1_1x16x1x16_8x8x1_1x2_intrawave_v3,1557.04,874.32,0
256,2048,4608,16384,torch.float8_e4m3fn,68,0,176.1003,a8w8_bpreshuffle_256x128x192x128_16x16_16x16_8x32x1_8x32x1_1x32x1x8_8x8x1_2x1_intrawave_v3,1756.03,726.44,0
256,2048,5120,640,torch.float8_e4m3fn,102,0,16.8369,a8w8_bpreshuffle_256x96x256x128_16x16_16x16_8x32x1_8x32x1_1x32x1x8_8x8x1_2x1_intrawave_v3,797.16,1518.04,0
256,2048,5120,1280,torch.float8_e4m3fn,102,0,24.8167,a8w8_bpreshuffle_256x96x256x128_16x16_16x16_8x32x1_8x32x1_1x32x1x8_8x8x1_2x1_intrawave_v3,1081.67,1214.77,0
256,2048,5120,3200,torch.float8_e4m3fn,158,0,41.6304,a8w8_bpreshuffle_256x192x256x128_16x16_16x16_8x32x1_8x32x1_1x16x1x16_8x8x1_1x2_intrawave_v3,1612.02,1054.74,0
256,2048,5120,5120,torch.float8_e4m3fn,102,0,71.8612,a8w8_bpreshuffle_256x96x256x128_16x16_16x16_8x32x1_8x32x1_1x32x1x8_8x8x1_2x1_intrawave_v3,1494.19,802.54,0
256,2048,5120,6400,torch.float8_e4m3fn,158,0,76.511,a8w8_bpreshuffle_256x192x256x128_16x16_16x16_8x32x1_8x32x1_1x16x1x16_8x8x1_1x2_intrawave_v3,1754.23,873.69,0
256,2048,5120,25600,torch.float8_e4m3fn,137,0,301.0835,a8w8_bpreshuffle_256x96x256x256_16x16_16x16_16x16x1_16x16x1_1x16x1x16_8x8x1_1x2_intrawave_v3,1783.13,679.12,0
256,2048,6400,5120,torch.float8_e4m3fn,138,0,84.6213,a8w8_bpreshuffle_256x112x256x256_16x16_16x16_16x16x1_16x16x1_1x16x1x16_8x8x1_1x2_intrawave_v3,1586.1,820.93,0
256,2048,7168,8192,torch.float8_e4m3fn,33,0,112.617,a8w8_bpreshuffle_256x256x256x128_16x16_16x16_8x32x1_8x32x1_1x32x1x8_8x8x1_2x1_intrawave_v3,2135.72,931.1,0
256,2048,8192,1024,torch.float8_e4m3fn,86,0,28.9708,a8w8_bpreshuffle_256x96x128x128_16x16_16x16_8x32x1_8x32x1_1x32x1x8_8x8x1_2x1_intrawave_v3,1186.01,1520.16,0
256,2048,8192,2048,torch.float8_e4m3fn,33,0,42.2356,a8w8_bpreshuffle_256x256x256x128_16x16_16x16_8x32x1_8x32x1_1x32x1x8_8x8x1_2x1_intrawave_v3,1627.05,1291,0
256,2048,8192,3584,torch.float8_e4m3fn,33,0,61.9146,a8w8_bpreshuffle_256x256x256x128_16x16_16x16_8x32x1_8x32x1_1x32x1x8_8x8x1_2x1_intrawave_v3,1942.34,1134.7,0
256,2048,8192,7168,torch.float8_e4m3fn,33,0,105.8446,a8w8_bpreshuffle_256x256x256x128_16x16_16x16_8x32x1_8x32x1_1x32x1x8_8x8x1_2x1_intrawave_v3,2272.37,1010.49,0
256,2048,8192,8192,torch.float8_e4m3fn,33,0,117.6729,a8w8_bpreshuffle_256x256x256x128_16x16_16x16_8x32x1_8x32x1_1x32x1x8_8x8x1_2x1_intrawave_v3,2335.95,998.03,0
256,2048,8192,28672,torch.float8_e4m3fn,33,0,357.8032,a8w8_bpreshuffle_256x256x256x128_16x16_16x16_8x32x1_8x32x1_1x32x1x8_8x8x1_2x1_intrawave_v3,2688.83,914.35,0
256,2048,9216,16384,torch.float8_e4m3fn,68,0,305.2233,a8w8_bpreshuffle_256x128x192x128_16x16_16x16_8x32x1_8x32x1_1x32x1x8_8x8x1_2x1_intrawave_v3,2026.3,728.31,0
256,2048,10240,8192,torch.float8_e4m3fn,158,0,156.1052,a8w8_bpreshuffle_256x192x256x128_16x16_16x16_8x32x1_8x32x1_1x16x1x16_8x8x1_1x2_intrawave_v3,2201.06,913.53,0
256,2048,12800,5120,torch.float8_e4m3fn,40,0,154.2962,a8w8_bpreshuffle_256x224x256x128_16x16_16x16_8x32x1_8x32x1_1x32x1x8_8x8x1_2x1_intrawave_v3,1739.74,832.49,0
256,2048,13312,16384,torch.float8_e4m3fn,138,0,457.646,a8w8_bpreshuffle_256x112x256x256_16x16_16x16_16x16x1_16x16x1_1x16x1x16_8x8x1_1x2_intrawave_v3,1952.06,669.04,0
256,2048,14336,8192,torch.float8_e4m3fn,54,0,205.0365,a8w8_bpreshuffle_256x160x256x128_16x16_16x16_8x32x1_8x32x1_1x32x1x8_8x8x1_2x1_intrawave_v3,2346.1,940.99,0
256,2048,16384,2048,torch.float8_e4m3fn,33,0,89.7238,a8w8_bpreshuffle_256x256x256x128_16x16_16x16_8x32x1_8x32x1_1x32x1x8_8x8x1_2x1_intrawave_v3,1531.8,1168.67,0
256,2048,16384,4096,torch.float8_e4m3fn,33,0,146.1468,a8w8_bpreshuffle_256x256x256x128_16x16_16x16_8x32x1_8x32x1_1x32x1x8_8x8x1_2x1_intrawave_v3,1880.83,975.77,0
256,2048,16384,6656,torch.float8_e4m3fn,33,0,216.3109,a8w8_bpreshuffle_256x256x256x128_16x16_16x16_8x32x1_8x32x1_1x32x1x8_8x8x1_2x1_intrawave_v3,2064.97,877.4,0
256,2048,16384,8192,torch.float8_e4m3fn,33,0,253.8314,a8w8_bpreshuffle_256x256x256x128_16x16_16x16_8x32x1_8x32x1_1x32x1x8_8x8x1_2x1_intrawave_v3,2165.83,859.25,0
256,2048,16384,13312,torch.float8_e4m3fn,33,0,388.9416,a8w8_bpreshuffle_256x256x256x128_16x16_16x16_8x32x1_8x32x1_1x32x1x8_8x8x1_2x1_intrawave_v3,2296.88,803.4,0
256,2048,16384,26624,torch.float8_e4m3fn,154,0,777.8647,a8w8_bpreshuffle_256x128x256x256_16x16_16x16_16x16x1_16x16x1_1x16x1x16_8x8x1_1x2_intrawave_v3,2296.94,717.15,0
256,2048,26624,16384,torch.float8_e4m3fn,154,0,848.1746,a8w8_bpreshuffle_256x128x256x256_16x16_16x16_16x16x1_16x16x1_1x16x1x16_8x8x1_1x2_intrawave_v3,2106.53,682.42,0
256,2048,51200,5120,torch.float8_e4m3fn,33,0,524.9075,a8w8_bpreshuffle_256x256x256x128_16x16_16x16_8x32x1_8x32x1_1x32x1x8_8x8x1_2x1_intrawave_v3,2045.58,918.91,0
256,2048,53248,16384,torch.float8_e4m3fn,33,0,1541.2203,a8w8_bpreshuffle_256x256x256x128_16x16_16x16_8x32x1_8x32x1_1x32x1x8_8x8x1_2x1_intrawave_v3,2318.56,729.34,0
256,2048,57344,8192,torch.float8_e4m3fn,33,0,762.0358,a8w8_bpreshuffle_256x256x256x128_16x16_16x16_8x32x1_8x32x1_1x32x1x8_8x8x1_2x1_intrawave_v3,2525.01,946.7,0
256,4096,800,5120,torch.float8_e4m3fn,69,0,50.1312,a8w8_bpreshuffle_256x128x160x128_16x16_16x16_8x32x1_8x32x1_1x64x1x4_8x8x1_2x1_intrawave_v3,669.33,630.77,0
256,4096,1280,8192,torch.float8_e4m3fn,137,0,53.9659,a8w8_bpreshuffle_256x96x256x256_16x16_16x16_16x16x1_16x16x1_1x16x1x16_8x8x1_1x2_intrawave_v3,1591.73,1010.38,0
256,4096,2304,16384,torch.float8_e4m3fn,68,0,177.9892,a8w8_bpreshuffle_256x128x192x128_16x16_16x16_8x32x1_8x32x1_1x32x1x8_8x8x1_2x1_intrawave_v3,1737.4,695.17,0
256,4096,2560,8192,torch.float8_e4m3fn,158,0,83.4719,a8w8_bpreshuffle_256x192x256x128_16x16_16x16_8x32x1_8x32x1_1x16x1x16_8x8x1_1x2_intrawave_v3,2058.16,904.47,0
256,4096,4608,16384,torch.float8_e4m3fn,68,0,307.0339,a8w8_bpreshuffle_256x128x192x128_16x16_16x16_8x32x1_8x32x1_1x32x1x8_8x8x1_2x1_intrawave_v3,2014.36,587.41,0
256,4096,5120,640,torch.float8_e4m3fn,102,0,28.9248,a8w8_bpreshuffle_256x96x256x128_16x16_16x16_8x32x1_8x32x1_1x32x1x8_8x8x1_2x1_intrawave_v3,928.05,1653.99,0
256,4096,5120,1280,torch.float8_e4m3fn,102,0,42.5949,a8w8_bpreshuffle_256x96x256x128_16x16_16x16_8x32x1_8x32x1_1x32x1x8_8x8x1_2x1_intrawave_v3,1260.41,1261.64,0
256,4096,5120,3200,torch.float8_e4m3fn,47,0,80.2905,a8w8_bpreshuffle_256x192x256x128_16x16_16x16_8x32x1_8x32x1_1x32x1x8_8x8x1_2x1_intrawave_v3,1671.65,889.7,0
256,4096,5120,5120,torch.float8_e4m3fn,138,0,121.2408,a8w8_bpreshuffle_256x112x256x256_16x16_16x16_16x16x1_16x16x1_1x16x1x16_8x8x1_1x2_intrawave_v3,1771.25,735.14,0
256,4096,5120,6400,torch.float8_e4m3fn,158,0,135.91,a8w8_bpreshuffle_256x192x256x128_16x16_16x16_8x32x1_8x32x1_1x16x1x16_8x8x1_1x2_intrawave_v3,1975.1,742.59,0
256,4096,5120,25600,torch.float8_e4m3fn,138,0,505.012,a8w8_bpreshuffle_256x112x256x256_16x16_16x16_16x16x1_16x16x1_1x16x1x16_8x8x1_1x2_intrawave_v3,2126.17,550.23,0
256,4096,6400,5120,torch.float8_e4m3fn,40,0,148.8986,a8w8_bpreshuffle_256x224x256x128_16x16_16x16_8x32x1_8x32x1_1x32x1x8_8x8x1_2x1_intrawave_v3,1802.81,713.02,0
256,4096,7168,8192,torch.float8_e4m3fn,156,0,206.7372,a8w8_bpreshuffle_256x160x256x128_16x16_16x16_8x32x1_8x32x1_1x16x1x16_8x8x1_1x2_intrawave_v3,2326.8,730.37,0
256,4096,8192,1024,torch.float8_e4m3fn,86,0,49.3525,a8w8_bpreshuffle_256x96x128x128_16x16_16x16_8x32x1_8x32x1_1x32x1x8_8x8x1_2x1_intrawave_v3,1392.42,1614.75,0
256,4096,8192,2048,torch.float8_e4m3fn,143,0,80.1603,a8w8_bpreshuffle_256x192x128x128_16x16_16x16_8x32x1_8x32x1_1x16x1x16_8x8x1_1x2_intrawave_v3,1714.55,1151.13,0
256,4096,8192,3584,torch.float8_e4m3fn,33,0,117.1442,a8w8_bpreshuffle_256x256x256x128_16x16_16x16_8x32x1_8x32x1_1x32x1x8_8x8x1_2x1_intrawave_v3,2053.18,948.82,0
256,4096,8192,7168,torch.float8_e4m3fn,33,0,196.6543,a8w8_bpreshuffle_256x256x256x128_16x16_16x16_8x32x1_8x32x1_1x32x1x8_8x8x1_2x1_intrawave_v3,2446.1,789.15,0
256,4096,8192,8192,torch.float8_e4m3fn,33,0,221.6286,a8w8_bpreshuffle_256x256x256x128_16x16_16x16_8x32x1_8x32x1_1x32x1x8_8x8x1_2x1_intrawave_v3,2480.53,757,0
256,4096,8192,28672,torch.float8_e4m3fn,33,0,686.9896,a8w8_bpreshuffle_256x256x256x128_16x16_16x16_8x32x1_8x32x1_1x32x1x8_8x8x1_2x1_intrawave_v3,2800.84,610.53,0
256,4096,9216,16384,torch.float8_e4m3fn,95,0,554.8485,a8w8_bpreshuffle_256x128x192x128_16x16_16x16_8x32x1_8x32x1_1x16x1x16_4x4x1_1x1_intrawave_v3,2229.35,529.16,0
256,4096,10240,8192,torch.float8_e4m3fn,106,0,283.3828,a8w8_bpreshuffle_256x224x256x128_16x16_16x16_8x32x1_8x32x1_1x16x1x16_4x4x1_1x1_intrawave_v3,2424.97,710.44,0
256,4096,12800,5120,torch.float8_e4m3fn,40,0,270.4291,a8w8_bpreshuffle_256x224x256x128_16x16_16x16_8x32x1_8x32x1_1x32x1x8_8x8x1_2x1_intrawave_v3,1985.26,707.64,0
256,4096,13312,16384,torch.float8_e4m3fn,154,0,842.3709,a8w8_bpreshuffle_256x128x256x256_16x16_16x16_16x16x1_16x16x1_1x16x1x16_8x8x1_1x2_intrawave_v3,2121.04,468.04,0
256,4096,14336,8192,torch.float8_e4m3fn,158,0,387.5867,a8w8_bpreshuffle_256x192x256x128_16x16_16x16_8x32x1_8x32x1_1x16x1x16_8x8x1_1x2_intrawave_v3,2482.21,692.58,0
256,4096,16384,2048,torch.float8_e4m3fn,102,0,160.9167,a8w8_bpreshuffle_256x96x256x128_16x16_16x16_8x32x1_8x32x1_1x32x1x8_8x8x1_2x1_intrawave_v3,1708.2,1094.73,0
256,4096,16384,4096,torch.float8_e4m3fn,33,0,255.2978,a8w8_bpreshuffle_256x256x256x128_16x16_16x16_8x32x1_8x32x1_1x32x1x8_8x8x1_2x1_intrawave_v3,2153.39,854.31,0
256,4096,16384,6656,torch.float8_e4m3fn,33,0,407.5508,a8w8_bpreshuffle_256x256x256x128_16x16_16x16_8x32x1_8x32x1_1x32x1x8_8x8x1_2x1_intrawave_v3,2192,663.8,0
256,4096,16384,8192,torch.float8_e4m3fn,33,0,471.5371,a8w8_bpreshuffle_256x256x256x128_16x16_16x16_8x32x1_8x32x1_1x32x1x8_8x8x1_2x1_intrawave_v3,2331.76,640.44,0
256,4096,16384,13312,torch.float8_e4m3fn,33,0,740.5043,a8w8_bpreshuffle_256x256x256x128_16x16_16x16_8x32x1_8x32x1_1x32x1x8_8x8x1_2x1_intrawave_v3,2412.82,549.42,0
256,4096,16384,26624,torch.float8_e4m3fn,33,0,1511.0293,a8w8_bpreshuffle_256x256x256x128_16x16_16x16_8x32x1_8x32x1_1x32x1x8_8x8x1_2x1_intrawave_v3,2364.89,449.68,0
256,4096,26624,16384,torch.float8_e4m3fn,33,0,1553.947,a8w8_bpreshuffle_256x256x256x128_16x16_16x16_8x32x1_8x32x1_1x32x1x8_8x8x1_2x1_intrawave_v3,2299.57,464.25,0
256,4096,51200,5120,torch.float8_e4m3fn,33,0,979.1344,a8w8_bpreshuffle_256x256x256x128_16x16_16x16_8x32x1_8x32x1_1x32x1x8_8x8x1_2x1_intrawave_v3,2193.25,717.52,0
256,4096,53248,16384,torch.float8_e4m3fn,33,0,2910.6751,a8w8_bpreshuffle_256x256x256x128_16x16_16x16_8x32x1_8x32x1_1x32x1x8_8x8x1_2x1_intrawave_v3,2455.38,472.65,0
256,4096,57344,8192,torch.float8_e4m3fn,33,0,1497.7395,a8w8_bpreshuffle_256x256x256x128_16x16_16x16_8x32x1_8x32x1_1x32x1x8_8x8x1_2x1_intrawave_v3,2569.4,649.7,0
256,8192,800,5120,torch.float8_e4m3fn,69,0,67.6989,a8w8_bpreshuffle_256x128x160x128_16x16_16x16_8x32x1_8x32x1_1x64x1x4_8x8x1_2x1_intrawave_v3,991.28,873.67,0
256,8192,1280,8192,torch.float8_e4m3fn,158,0,83.0796,a8w8_bpreshuffle_256x192x256x128_16x16_16x16_8x32x1_8x32x1_1x16x1x16_8x8x1_1x2_intrawave_v3,2067.88,1186.41,0
256,8192,2304,16384,torch.float8_e4m3fn,149,0,311.0895,a8w8_bpreshuffle_256x128x192x256_16x16_16x16_16x16x1_16x16x1_1x32x1x8_8x8x1_2x1_intrawave_v3,1988.09,674.13,0
256,8192,2560,8192,torch.float8_e4m3fn,158,0,155.4584,a8w8_bpreshuffle_256x192x256x128_16x16_16x16_8x32x1_8x32x1_1x16x1x16_8x8x1_1x2_intrawave_v3,2210.22,836.39,0
256,8192,4608,16384,torch.float8_e4m3fn,154,0,561.2735,a8w8_bpreshuffle_256x128x256x256_16x16_16x16_16x16x1_16x16x1_1x16x1x16_8x8x1_1x2_intrawave_v3,2203.83,508.15,0
256,8192,5120,640,torch.float8_e4m3fn,143,0,50.4892,a8w8_bpreshuffle_256x192x128x128_16x16_16x16_8x32x1_8x32x1_1x16x1x16_8x8x1_1x2_intrawave_v3,1063.34,1830.21,0
256,8192,5120,1280,torch.float8_e4m3fn,143,0,77.0321,a8w8_bpreshuffle_256x192x128x128_16x16_16x16_8x32x1_8x32x1_1x16x1x16_8x8x1_1x2_intrawave_v3,1393.89,1310.17,0
256,8192,5120,3200,torch.float8_e4m3fn,40,0,139.3777,a8w8_bpreshuffle_256x224x256x128_16x16_16x16_8x32x1_8x32x1_1x32x1x8_8x8x1_2x1_intrawave_v3,1925.96,907.49,0
256,8192,5120,5120,torch.float8_e4m3fn,154,0,215.948,a8w8_bpreshuffle_256x128x256x256_16x16_16x16_16x16x1_16x16x1_1x16x1x16_8x8x1_1x2_intrawave_v3,1988.89,704.07,0
256,8192,5120,6400,torch.float8_e4m3fn,40,0,242.9206,a8w8_bpreshuffle_256x224x256x128_16x16_16x16_8x32x1_8x32x1_1x32x1x8_8x8x1_2x1_intrawave_v3,2210.07,696.04,0
256,8192,5120,25600,torch.float8_e4m3fn,154,0,938.5635,a8w8_bpreshuffle_256x128x256x256_16x16_16x16_16x16x1_16x16x1_1x16x1x16_8x8x1_1x2_intrawave_v3,2288.05,452.47,0
256,8192,6400,5120,torch.float8_e4m3fn,40,0,270.3545,a8w8_bpreshuffle_256x224x256x128_16x16_16x16_8x32x1_8x32x1_1x32x1x8_8x8x1_2x1_intrawave_v3,1985.8,664.2,0
256,8192,7168,8192,torch.float8_e4m3fn,158,0,385.4824,a8w8_bpreshuffle_256x192x256x128_16x16_16x16_8x32x1_8x32x1_1x16x1x16_8x8x1_1x2_intrawave_v3,2495.76,631.08,0
256,8192,8192,1024,torch.float8_e4m3fn,51,0,92.436,a8w8_bpreshuffle_256x192x128x128_16x16_16x16_8x32x1_8x32x1_1x32x1x8_8x8x1_2x1_intrawave_v3,1486.86,1633.51,0
256,8192,8192,2048,torch.float8_e4m3fn,51,0,141.6683,a8w8_bpreshuffle_256x192x128x128_16x16_16x16_8x32x1_8x32x1_1x32x1x8_8x8x1_2x1_intrawave_v3,1940.29,1184.26,0
256,8192,8192,3584,torch.float8_e4m3fn,143,0,222.4514,a8w8_bpreshuffle_256x192x128x128_16x16_16x16_8x32x1_8x32x1_1x16x1x16_8x8x1_1x2_intrawave_v3,2162.43,867.33,0
256,8192,8192,7168,torch.float8_e4m3fn,33,0,383.1227,a8w8_bpreshuffle_256x256x256x128_16x16_16x16_8x32x1_8x32x1_1x32x1x8_8x8x1_2x1_intrawave_v3,2511.13,656.86,0
256,8192,8192,8192,torch.float8_e4m3fn,33,0,424.8317,a8w8_bpreshuffle_256x256x256x128_16x16_16x16_8x32x1_8x32x1_1x32x1x8_8x8x1_2x1_intrawave_v3,2588.11,631.86,0
256,8192,8192,28672,torch.float8_e4m3fn,33,0,1389.0293,a8w8_bpreshuffle_256x256x256x128_16x16_16x16_8x32x1_8x32x1_1x32x1x8_8x8x1_2x1_intrawave_v3,2770.49,434.82,0
256,8192,9216,16384,torch.float8_e4m3fn,154,0,1095.3193,a8w8_bpreshuffle_256x128x256x256_16x16_16x16_16x16x1_16x16x1_1x16x1x16_8x8x1_1x2_intrawave_v3,2258.61,398.25,0
256,8192,10240,8192,torch.float8_e4m3fn,33,0,533.4106,a8w8_bpreshuffle_256x256x256x128_16x16_16x16_8x32x1_8x32x1_1x32x1x8_8x8x1_2x1_intrawave_v3,2576.61,597.6,0
256,8192,12800,5120,torch.float8_e4m3fn,158,0,519.2638,a8w8_bpreshuffle_256x192x256x128_16x16_16x16_8x32x1_8x32x1_1x16x1x16_8x8x1_1x2_intrawave_v3,2067.82,610.85,0
256,8192,13312,16384,torch.float8_e4m3fn,33,0,1546.1027,a8w8_bpreshuffle_256x256x256x128_16x16_16x16_8x32x1_8x32x1_1x32x1x8_8x8x1_2x1_intrawave_v3,2311.24,368.94,0
256,8192,14336,8192,torch.float8_e4m3fn,33,0,734.9548,a8w8_bpreshuffle_256x256x256x128_16x16_16x16_8x32x1_8x32x1_1x32x1x8_8x8x1_2x1_intrawave_v3,2618.05,570.69,0
256,8192,16384,2048,torch.float8_e4m3fn,102,0,303.9224,a8w8_bpreshuffle_256x96x256x128_16x16_16x16_8x32x1_8x32x1_1x32x1x8_8x8x1_2x1_intrawave_v3,1808.87,1048.84,0
256,8192,16384,4096,torch.float8_e4m3fn,33,0,497.9337,a8w8_bpreshuffle_256x256x256x128_16x16_16x16_8x32x1_8x32x1_1x32x1x8_8x8x1_2x1_intrawave_v3,2208.15,741.26,0
256,8192,16384,6656,torch.float8_e4m3fn,33,0,770.3086,a8w8_bpreshuffle_256x256x256x128_16x16_16x16_8x32x1_8x32x1_1x32x1x8_8x8x1_2x1_intrawave_v3,2319.47,560.83,0
256,8192,16384,8192,torch.float8_e4m3fn,33,0,903.531,a8w8_bpreshuffle_256x256x256x128_16x16_16x16_8x32x1_8x32x1_1x32x1x8_8x8x1_2x1_intrawave_v3,2433.81,519.92,0
256,8192,16384,13312,torch.float8_e4m3fn,107,0,1430.2158,a8w8_bpreshuffle_256x256x256x128_16x16_16x16_8x32x1_8x32x1_1x16x1x16_4x4x1_1x1_intrawave_v3,2498.51,416.43,0
256,8192,16384,26624,torch.float8_e4m3fn,154,0,3033.7821,a8w8_bpreshuffle_256x128x256x256_16x16_16x16_16x16x1_16x16x1_1x16x1x16_8x8x1_1x2_intrawave_v3,2355.75,304.16,0
256,8192,26624,16384,torch.float8_e4m3fn,33,0,2904.3718,a8w8_bpreshuffle_256x256x256x128_16x16_16x16_8x32x1_8x32x1_1x32x1x8_8x8x1_2x1_intrawave_v3,2460.71,346.59,0
256,8192,51200,5120,torch.float8_e4m3fn,33,0,1857.9691,a8w8_bpreshuffle_256x256x256x128_16x16_16x16_8x32x1_8x32x1_1x32x1x8_8x8x1_2x1_intrawave_v3,2311.65,615.16,0
256,8192,53248,16384,torch.float8_e4m3fn,33,0,5722.4616,a8w8_bpreshuffle_256x256x256x128_16x16_16x16_8x32x1_8x32x1_1x32x1x8_8x8x1_2x1_intrawave_v3,2497.82,328.36,0
256,8192,57344,8192,torch.float8_e4m3fn,33,0,2991.7292,a8w8_bpreshuffle_256x256x256x128_16x16_16x16_8x32x1_8x32x1_1x32x1x8_8x8x1_2x1_intrawave_v3,2572.62,493.49,0
256,16384,800,5120,torch.float8_e4m3fn,69,0,108.6586,a8w8_bpreshuffle_256x128x160x128_16x16_16x16_8x32x1_8x32x1_1x64x1x4_8x8x1_2x1_intrawave_v3,1235.22,1050.97,0
256,16384,1280,8192,torch.float8_e4m3fn,158,0,157.7142,a8w8_bpreshuffle_256x192x256x128_16x16_16x16_8x32x1_8x32x1_1x16x1x16_8x8x1_1x2_intrawave_v3,2178.61,1183.45,0
256,16384,2304,16384,torch.float8_e4m3fn,154,0,577.0581,a8w8_bpreshuffle_256x128x256x256_16x16_16x16_16x16x1_16x16x1_1x16x1x16_8x8x1_1x2_intrawave_v3,2143.55,661.43,0
256,16384,2560,8192,torch.float8_e4m3fn,154,0,283.4813,a8w8_bpreshuffle_256x128x256x256_16x16_16x16_16x16x1_16x16x1_1x16x1x16_8x8x1_1x2_intrawave_v3,2424.13,843.35,0
256,16384,4608,16384,torch.float8_e4m3fn,154,0,1050.0065,a8w8_bpreshuffle_256x128x256x256_16x16_16x16_16x16x1_16x16x1_1x16x1x16_8x8x1_1x2_intrawave_v3,2356.08,471.36,0
256,16384,5120,640,torch.float8_e4m3fn,143,0,91.8209,a8w8_bpreshuffle_256x192x128x128_16x16_16x16_8x32x1_8x32x1_1x16x1x16_8x8x1_1x2_intrawave_v3,1169.39,1977.05,0
256,16384,5120,1280,torch.float8_e4m3fn,143,0,139.3615,a8w8_bpreshuffle_256x192x128x128_16x16_16x16_8x32x1_8x32x1_1x16x1x16_8x8x1_1x2_intrawave_v3,1540.94,1401.37,0
256,16384,5120,3200,torch.float8_e4m3fn,33,0,250.8978,a8w8_bpreshuffle_256x256x256x128_16x16_16x16_8x32x1_8x32x1_1x32x1x8_8x8x1_2x1_intrawave_v3,2139.8,942.95,0
256,16384,5120,5120,torch.float8_e4m3fn,33,0,403.9327,a8w8_bpreshuffle_256x256x256x128_16x16_16x16_8x32x1_8x32x1_1x32x1x8_8x8x1_2x1_intrawave_v3,2126.58,687.92,0
256,16384,5120,6400,torch.float8_e4m3fn,107,0,443.5168,a8w8_bpreshuffle_256x256x256x128_16x16_16x16_8x32x1_8x32x1_1x16x1x16_4x4x1_1x1_intrawave_v3,2420.97,688.58,0
256,16384,5120,25600,torch.float8_e4m3fn,154,0,1817.1823,a8w8_bpreshuffle_256x128x256x256_16x16_16x16_16x16x1_16x16x1_1x16x1x16_8x8x1_1x2_intrawave_v3,2363.53,395.27,0
256,16384,6400,5120,torch.float8_e4m3fn,154,0,516.4428,a8w8_bpreshuffle_256x128x256x256_16x16_16x16_16x16x1_16x16x1_1x16x1x16_8x8x1_1x2_intrawave_v3,2079.11,631.96,0
256,16384,7168,8192,torch.float8_e4m3fn,154,0,761.2665,a8w8_bpreshuffle_256x128x256x256_16x16_16x16_16x16x1_16x16x1_1x16x1x16_8x8x1_1x2_intrawave_v3,2527.56,561.98,0
256,16384,8192,1024,torch.float8_e4m3fn,143,0,172.4777,a8w8_bpreshuffle_256x192x128x128_16x16_16x16_8x32x1_8x32x1_1x16x1x16_8x8x1_1x2_intrawave_v3,1593.7,1702.26,0
256,16384,8192,2048,torch.float8_e4m3fn,51,0,272.4657,a8w8_bpreshuffle_256x192x128x128_16x16_16x16_8x32x1_8x32x1_1x32x1x8_8x8x1_2x1_intrawave_v3,2017.71,1169.93,0
256,16384,8192,3584,torch.float8_e4m3fn,33,0,421.1579,a8w8_bpreshuffle_256x256x256x128_16x16_16x16_8x32x1_8x32x1_1x32x1x8_8x8x1_2x1_intrawave_v3,2284.35,846.51,0
256,16384,8192,7168,torch.float8_e4m3fn,158,0,753.6754,a8w8_bpreshuffle_256x192x256x128_16x16_16x16_8x32x1_8x32x1_1x16x1x16_8x8x1_1x2_intrawave_v3,2553.02,589.9,0
256,16384,8192,8192,torch.float8_e4m3fn,158,0,852.0249,a8w8_bpreshuffle_256x192x256x128_16x16_16x16_8x32x1_8x32x1_1x16x1x16_8x8x1_1x2_intrawave_v3,2580.94,551.35,0
256,16384,8192,28672,torch.float8_e4m3fn,33,0,2785.3542,a8w8_bpreshuffle_256x256x256x128_16x16_16x16_8x32x1_8x32x1_1x32x1x8_8x8x1_2x1_intrawave_v3,2763.23,349.36,0
256,16384,9216,16384,torch.float8_e4m3fn,33,0,2047.2744,a8w8_bpreshuffle_256x256x256x128_16x16_16x16_8x32x1_8x32x1_1x32x1x8_8x8x1_2x1_intrawave_v3,2416.78,352.38,0
256,16384,10240,8192,torch.float8_e4m3fn,33,0,1068.7185,a8w8_bpreshuffle_256x256x256x128_16x16_16x16_8x32x1_8x32x1_1x32x1x8_8x8x1_2x1_intrawave_v3,2572.03,518.05,0
256,16384,12800,5120,torch.float8_e4m3fn,33,0,974.5645,a8w8_bpreshuffle_256x256x256x128_16x16_16x16_8x32x1_8x32x1_1x32x1x8_8x8x1_2x1_intrawave_v3,2203.53,583.7,0
256,16384,13312,16384,torch.float8_e4m3fn,33,0,2958.4415,a8w8_bpreshuffle_256x256x256x128_16x16_16x16_8x32x1_8x32x1_1x32x1x8_8x8x1_2x1_intrawave_v3,2415.74,311.9,0
256,16384,14336,8192,torch.float8_e4m3fn,158,0,1477.5648,a8w8_bpreshuffle_256x192x256x128_16x16_16x16_8x32x1_8x32x1_1x16x1x16_8x8x1_1x2_intrawave_v3,2604.48,488.25,0
256,16384,16384,2048,torch.float8_e4m3fn,102,0,598.3663,a8w8_bpreshuffle_256x96x256x128_16x16_16x16_8x32x1_8x32x1_1x32x1x8_8x8x1_2x1_intrawave_v3,1837.52,1009.38,0
256,16384,16384,4096,torch.float8_e4m3fn,33,0,988.8674,a8w8_bpreshuffle_256x256x256x128_16x16_16x16_8x32x1_8x32x1_1x32x1x8_8x8x1_2x1_intrawave_v3,2223.78,678.64,0
256,16384,16384,6656,torch.float8_e4m3fn,33,0,1537.3785,a8w8_bpreshuffle_256x256x256x128_16x16_16x16_8x32x1_8x32x1_1x32x1x8_8x8x1_2x1_intrawave_v3,2324.35,491.08,0
256,16384,16384,8192,torch.float8_e4m3fn,33,0,1794.5054,a8w8_bpreshuffle_256x256x256x128_16x16_16x16_8x32x1_8x32x1_1x32x1x8_8x8x1_2x1_intrawave_v3,2450.84,448.76,0
256,16384,16384,13312,torch.float8_e4m3fn,33,0,2976.2278,a8w8_bpreshuffle_256x256x256x128_16x16_16x16_8x32x1_8x32x1_1x32x1x8_8x8x1_2x1_intrawave_v3,2401.3,326.95,0
256,16384,16384,26624,torch.float8_e4m3fn,154,0,6167.0855,a8w8_bpreshuffle_256x128x256x256_16x16_16x16_16x16x1_16x16x1_1x16x1x16_8x8x1_1x2_intrawave_v3,2317.73,228.52,0
256,16384,26624,16384,torch.float8_e4m3fn,33,0,5797.7818,a8w8_bpreshuffle_256x256x256x128_16x16_16x16_8x32x1_8x32x1_1x32x1x8_8x8x1_2x1_intrawave_v3,2465.37,272.01,0
256,16384,51200,5120,torch.float8_e4m3fn,33,0,3711.513,a8w8_bpreshuffle_256x256x256x128_16x16_16x16_8x32x1_8x32x1_1x32x1x8_8x8x1_2x1_intrawave_v3,2314.4,545.26,0
256,16384,53248,16384,torch.float8_e4m3fn,33,0,11284.2706,a8w8_bpreshuffle_256x256x256x128_16x16_16x16_8x32x1_8x32x1_1x32x1x8_8x8x1_2x1_intrawave_v3,2533.38,255.73,0
256,16384,57344,8192,torch.float8_e4m3fn,33,0,5984.2692,a8w8_bpreshuffle_256x256x256x128_16x16_16x16_8x32x1_8x32x1_1x32x1x8_8x8x1_2x1_intrawave_v3,2572.27,414.93,0
256,32768,800,5120,torch.float8_e4m3fn,69,0,196.771,a8w8_bpreshuffle_256x128x160x128_16x16_16x16_8x32x1_8x32x1_1x64x1x4_8x8x1_2x1_intrawave_v3,1364.2,1139.89,0
256,32768,1280,8192,torch.float8_e4m3fn,154,0,288.2725,a8w8_bpreshuffle_256x128x256x256_16x16_16x16_16x16x1_16x16x1_1x16x1x16_8x8x1_1x2_intrawave_v3,2383.84,1258.56,0
256,32768,2304,16384,torch.float8_e4m3fn,154,0,1073.694,a8w8_bpreshuffle_256x128x256x256_16x16_16x16_16x16x1_16x16x1_1x16x1x16_8x8x1_1x2_intrawave_v3,2304.1,675.81,0
256,32768,2560,8192,torch.float8_e4m3fn,158,0,549.7961,a8w8_bpreshuffle_256x192x256x128_16x16_16x16_8x32x1_8x32x1_1x16x1x16_8x8x1_1x2_intrawave_v3,2499.82,831.54,0
256,32768,4608,16384,torch.float8_e4m3fn,154,0,2120.2853,a8w8_bpreshuffle_256x128x256x256_16x16_16x16_16x16x1_16x16x1_1x16x1x16_8x8x1_1x2_intrawave_v3,2333.55,431.24,0
256,32768,5120,640,torch.float8_e4m3fn,143,0,181.1291,a8w8_bpreshuffle_256x192x128x128_16x16_16x16_8x32x1_8x32x1_1x16x1x16_8x8x1_1x2_intrawave_v3,1185.61,1986.39,0
256,32768,5120,1280,torch.float8_e4m3fn,102,0,269.995,a8w8_bpreshuffle_256x96x256x128_16x16_16x16_8x32x1_8x32x1_1x32x1x8_8x8x1_2x1_intrawave_v3,1590.76,1422.4,0
256,32768,5120,3200,torch.float8_e4m3fn,33,0,492.1153,a8w8_bpreshuffle_256x256x256x128_16x16_16x16_8x32x1_8x32x1_1x32x1x8_8x8x1_2x1_intrawave_v3,2181.89,928.21,0
256,32768,5120,5120,torch.float8_e4m3fn,33,0,764.8154,a8w8_bpreshuffle_256x256x256x128_16x16_16x16_8x32x1_8x32x1_1x32x1x8_8x8x1_2x1_intrawave_v3,2246.28,692.36,0
256,32768,5120,6400,torch.float8_e4m3fn,33,0,868.9521,a8w8_bpreshuffle_256x256x256x128_16x16_16x16_8x32x1_8x32x1_1x32x1x8_8x8x1_2x1_intrawave_v3,2471.35,665.2,0
256,32768,5120,25600,torch.float8_e4m3fn,154,0,3714.3301,a8w8_bpreshuffle_256x128x256x256_16x16_16x16_16x16x1_16x16x1_1x16x1x16_8x8x1_1x2_intrawave_v3,2312.65,351.47,0
256,32768,6400,5120,torch.float8_e4m3fn,33,0,980.8335,a8w8_bpreshuffle_256x256x256x128_16x16_16x16_8x32x1_8x32x1_1x32x1x8_8x8x1_2x1_intrawave_v3,2189.45,632.09,0
256,32768,7168,8192,torch.float8_e4m3fn,158,0,1484.7467,a8w8_bpreshuffle_256x192x256x128_16x16_16x16_8x32x1_8x32x1_1x16x1x16_8x8x1_1x2_intrawave_v3,2591.88,536.74,0
256,32768,8192,1024,torch.float8_e4m3fn,143,0,340.0384,a8w8_bpreshuffle_256x192x128x128_16x16_16x16_8x32x1_8x32x1_1x16x1x16_8x8x1_1x2_intrawave_v3,1616.75,1702.2,0
256,32768,8192,2048,torch.float8_e4m3fn,143,0,536.6149,a8w8_bpreshuffle_256x192x128x128_16x16_16x16_8x32x1_8x32x1_1x16x1x16_8x8x1_1x2_intrawave_v3,2048.98,1156.8,0
256,32768,8192,3584,torch.float8_e4m3fn,51,0,841.2106,a8w8_bpreshuffle_256x192x128x128_16x16_16x16_8x32x1_8x32x1_1x32x1x8_8x8x1_2x1_intrawave_v3,2287.35,812.72,0
256,32768,8192,7168,torch.float8_e4m3fn,158,0,1500.7026,a8w8_bpreshuffle_256x192x256x128_16x16_16x16_8x32x1_8x32x1_1x16x1x16_8x8x1_1x2_intrawave_v3,2564.33,553.39,0
256,32768,8192,8192,torch.float8_e4m3fn,158,0,1696.016,a8w8_bpreshuffle_256x192x256x128_16x16_16x16_8x32x1_8x32x1_1x16x1x16_8x8x1_1x2_intrawave_v3,2593.16,514.39,0
256,32768,8192,28672,torch.float8_e4m3fn,33,0,5558.3544,a8w8_bpreshuffle_256x256x256x128_16x16_16x16_8x32x1_8x32x1_1x32x1x8_8x8x1_2x1_intrawave_v3,2769.37,307.87,0
256,32768,9216,16384,torch.float8_e4m3fn,33,0,4103.0357,a8w8_bpreshuffle_256x256x256x128_16x16_16x16_8x32x1_8x32x1_1x32x1x8_8x8x1_2x1_intrawave_v3,2411.78,314.85,0
256,32768,10240,8192,torch.float8_e4m3fn,158,0,2102.9024,a8w8_bpreshuffle_256x192x256x128_16x16_16x16_8x32x1_8x32x1_1x16x1x16_8x8x1_1x2_intrawave_v3,2614.27,486.67,0
256,32768,12800,5120,torch.float8_e4m3fn,33,0,1888.3681,a8w8_bpreshuffle_256x256x256x128_16x16_16x16_8x32x1_8x32x1_1x32x1x8_8x8x1_2x1_intrawave_v3,2274.43,567.78,0
256,32768,13312,16384,torch.float8_e4m3fn,33,0,6036.8682,a8w8_bpreshuffle_256x256x256x128_16x16_16x16_8x32x1_8x32x1_1x32x1x8_8x8x1_2x1_intrawave_v3,2367.73,269.58,0
256,32768,14336,8192,torch.float8_e4m3fn,158,0,2945.0068,a8w8_bpreshuffle_256x192x256x128_16x16_16x16_8x32x1_8x32x1_1x16x1x16_8x8x1_1x2_intrawave_v3,2613.43,450.05,0
256,32768,16384,2048,torch.float8_e4m3fn,102,0,1180.9193,a8w8_bpreshuffle_256x96x256x128_16x16_16x16_8x32x1_8x32x1_1x32x1x8_8x8x1_2x1_intrawave_v3,1862.13,994.48,0
256,32768,16384,4096,torch.float8_e4m3fn,33,0,1989.9333,a8w8_bpreshuffle_256x256x256x128_16x16_16x16_8x32x1_8x32x1_1x32x1x8_8x8x1_2x1_intrawave_v3,2210.15,640.76,0
256,32768,16384,6656,torch.float8_e4m3fn,33,0,3099.1632,a8w8_bpreshuffle_256x256x256x128_16x16_16x16_8x32x1_8x32x1_1x32x1x8_8x8x1_2x1_intrawave_v3,2306.05,452.02,0
256,32768,16384,8192,torch.float8_e4m3fn,33,0,3588.7344,a8w8_bpreshuffle_256x256x256x128_16x16_16x16_8x32x1_8x32x1_1x32x1x8_8x8x1_2x1_intrawave_v3,2451.03,411.4,0
256,32768,16384,13312,torch.float8_e4m3fn,33,0,5598.3345,a8w8_bpreshuffle_256x256x256x128_16x16_16x16_8x32x1_8x32x1_1x32x1x8_8x8x1_2x1_intrawave_v3,2553.2,308.67,0
256,32768,16384,26624,torch.float8_e4m3fn,154,0,12187.7899,a8w8_bpreshuffle_256x128x256x256_16x16_16x16_16x16x1_16x16x1_1x16x1x16_8x8x1_1x2_intrawave_v3,2345.57,195.47,0
256,32768,26624,16384,torch.float8_e4m3fn,33,0,11524.899,a8w8_bpreshuffle_256x256x256x128_16x16_16x16_8x32x1_8x32x1_1x32x1x8_8x8x1_2x1_intrawave_v3,2480.48,235.83,0
256,32768,51200,5120,torch.float8_e4m3fn,33,0,7575.0119,a8w8_bpreshuffle_256x256x256x128_16x16_16x16_8x32x1_8x32x1_1x32x1x8_8x8x1_2x1_intrawave_v3,2267.97,499.72,0
256,32768,53248,16384,torch.float8_e4m3fn,33,0,22600.3968,a8w8_bpreshuffle_256x256x256x128_16x16_16x16_8x32x1_8x32x1_1x32x1x8_8x8x1_2x1_intrawave_v3,2529.81,216.76,0
256,32768,57344,8192,torch.float8_e4m3fn,158,0,11963.3054,a8w8_bpreshuffle_256x192x256x128_16x16_16x16_8x32x1_8x32x1_1x16x1x16_8x8x1_1x2_intrawave_v3,2573.4,375.84,0
304,1,896,5120,torch.float8_e4m3fnuz,10,0,8.2482,a8w8_bpreshuffle_128x16x32x512_16x16_16x16_32x4x1_32x4x1_1x16x1x8_4x4x1_1x1_intrawave_v1,1.11,557.02,0
304,1,1024,5632,torch.float8_e4m3fnuz,10,0,8.625,a8w8_bpreshuffle_128x16x32x512_16x16_16x16_32x4x1_32x4x1_1x16x1x8_4x4x1_1x1_intrawave_v1,1.34,669.55,0
304,1,1056,1408,torch.float8_e4m3fnuz,9,0,6.0164,a8w8_bpreshuffle_128x16x32x128_16x16_16x16_8x16x1_8x16x1_1x16x1x8_4x4x1_1x1_intrawave_v1,0.49,247.72,0
304,1,1280,4096,torch.float8_e4m3fnuz,10,0,7.2866,a8w8_bpreshuffle_128x16x32x512_16x16_16x16_32x4x1_32x4x1_1x16x1x8_4x4x1_1x1_intrawave_v1,1.44,720.44,0
304,1,4096,640,torch.float8_e4m3fnuz,9,0,5.0085,a8w8_bpreshuffle_128x16x32x128_16x16_16x16_8x16x1_8x16x1_1x16x1x8_4x4x1_1x1_intrawave_v1,1.05,525.16,0
304,1,5120,640,torch.float8_e4m3fnuz,9,0,5.4773,a8w8_bpreshuffle_128x16x32x128_16x16_16x16_8x16x1_8x16x1_1x16x1x8_4x4x1_1x1_intrawave_v1,1.2,600.24,0
304,1,5120,2048,torch.float8_e4m3fnuz,10,0,5.8933,a8w8_bpreshuffle_128x16x32x512_16x16_16x16_32x4x1_32x4x1_1x16x1x8_4x4x1_1x1_intrawave_v1,3.56,1781.35,0
304,2,1024,5632,torch.int8,160,1,35.8813,_ZN5aiter42I8gemm_bf16_perTokenI8_BpreShuffle_128x128E,0.64,161.16,0
304,2,1056,1408,torch.int8,160,1,8.9703,_ZN5aiter42I8gemm_bf16_perTokenI8_BpreShuffle_128x128E,0.66,166.54,0.0303
304,2,1280,4096,torch.int8,160,1,24.7527,_ZN5aiter42I8gemm_bf16_perTokenI8_BpreShuffle_128x128E,0.85,212.35,0
304,8,192,7168,torch.float8_e4m3fnuz,5,0,7.9504,a8w8_bpreshuffle_256x16x64x512_16x16_16x16_32x8x1_32x8x1_1x16x1x16_4x4x1_1x1_intrawave_v1,2.77,180.7,0
304,8,512,7168,torch.float8_e4m3fnuz,10,0,9.8014,a8w8_bpreshuffle_128x16x32x512_16x16_16x16_32x4x1_32x4x1_1x16x1x8_4x4x1_1x1_intrawave_v1,5.99,381.12,0
304,8,576,7168,torch.float8_e4m3fnuz,10,0,9.7683,a8w8_bpreshuffle_128x16x32x512_16x16_16x16_32x4x1_32x4x1_1x16x1x8_4x4x1_1x1_intrawave_v1,6.76,429.48,0
304,8,1024,5632,torch.float8_e4m3fnuz,10,0,8.7781,a8w8_bpreshuffle_128x16x32x512_16x16_16x16_32x4x1_32x4x1_1x16x1x8_4x4x1_1x1_intrawave_v1,10.51,663.99,0
304,8,1056,1408,torch.float8_e4m3fnuz,9,0,6.1657,a8w8_bpreshuffle_128x16x32x128_16x16_16x16_8x16x1_8x16x1_1x16x1x8_4x4x1_1x1_intrawave_v1,3.86,245.72,0
304,8,1280,4096,torch.float8_e4m3fnuz,10,0,7.3002,a8w8_bpreshuffle_128x16x32x512_16x16_16x16_32x4x1_32x4x1_1x16x1x8_4x4x1_1x1_intrawave_v1,11.49,725.48,0
304,8,1536,7168,torch.float8_e4m3fnuz,10,0,9.8337,a8w8_bpreshuffle_128x16x32x512_16x16_16x16_32x4x1_32x4x1_1x16x1x8_4x4x1_1x1_intrawave_v1,17.91,1127.95,0
304,8,2112,7168,torch.float8_e4m3fnuz,10,0,9.8898,a8w8_bpreshuffle_128x16x32x512_16x16_16x16_32x4x1_32x4x1_1x16x1x8_4x4x1_1x1_intrawave_v1,24.49,1539.97,0
304,8,3072,1536,torch.float8_e4m3fnuz,10,0,4.706,a8w8_bpreshuffle_128x16x32x512_16x16_16x16_32x4x1_32x4x1_1x16x1x8_4x4x1_1x1_intrawave_v1,16.04,1015.73,0
304,8,3072,4096,torch.float8_e4m3fnuz,10,0,7.1998,a8w8_bpreshuffle_128x16x32x512_16x16_16x16_32x4x1_32x4x1_1x16x1x8_4x4x1_1x1_intrawave_v1,27.96,1759.05,0
304,8,3584,6144,torch.float8_e4m3fnuz,10,0,9.6734,a8w8_bpreshuffle_128x16x32x512_16x16_16x16_32x4x1_32x4x1_1x16x1x8_4x4x1_1x1_intrawave_v1,36.42,2287.36,0
304,8,4096,512,torch.float8_e4m3fnuz,9,0,3.5807,a8w8_bpreshuffle_128x16x32x128_16x16_16x16_8x16x1_8x16x1_1x16x1x8_4x4x1_1x1_intrawave_v1,9.37,605.13,0
304,8,4096,3072,torch.float8_e4m3fnuz,10,0,6.5088,a8w8_bpreshuffle_128x16x32x512_16x16_16x16_32x4x1_32x4x1_1x16x1x8_4x4x1_1x1_intrawave_v1,30.93,1947.06,0
304,8,4608,7168,torch.float8_e4m3fnuz,11,0,11.0568,a8w8_bpreshuffle_256x16x64x512_16x16_16x16_32x8x1_32x8x1_1x16x1x16_4x4x1_1x1_intrawave_v1,47.8,2999.17,0
304,8,6144,768,torch.float8_e4m3fnuz,108,0,4.6743,a8w8_bpreshuffle_256x16x64x256_16x16_16x16_16x16x1_16x16x1_1x16x1x16_4x4x1_1x1_intrawave_v1,16.15,1031.82,0
304,8,6144,1024,torch.float8_e4m3fnuz,108,0,5.2957,a8w8_bpreshuffle_256x16x64x256_16x16_16x16_16x16x1_16x16x1_1x16x1x16_4x4x1_1x1_intrawave_v1,19.01,1208.14,0
304,8,6144,1536,torch.float8_e4m3fnuz,10,0,5.5949,a8w8_bpreshuffle_128x16x32x512_16x16_16x16_32x4x1_32x4x1_1x16x1x8_4x4x1_1x1_intrawave_v1,26.99,1706.51,0
304,8,6144,2048,torch.float8_e4m3fnuz,10,0,5.6744,a8w8_bpreshuffle_128x16x32x512_16x16_16x16_32x4x1_32x4x1_1x16x1x8_4x4x1_1x1_intrawave_v1,35.48,2237.7,0
304,8,7168,256,torch.float8_e4m3fnuz,75,0,6.0665,a8w8_bpreshuffle_128x16x256x64_16x16_16x16_4x16x1_4x32x1_1x16x1x8_8x8x1_1x2_intrawave_v1,4.84,321.72,0
304,8,7168,2048,torch.float8_e4m3fnuz,10,0,6.1705,a8w8_bpreshuffle_128x16x32x512_16x16_16x16_32x4x1_32x4x1_1x16x1x8_4x4x1_1x1_intrawave_v1,38.07,2400.31,0
304,8,7168,2304,torch.float8_e4m3fnuz,108,0,7.5372,a8w8_bpreshuffle_256x16x64x256_16x16_16x16_16x16x1_16x16x1_1x16x1x16_4x4x1_1x1_intrawave_v1,35.06,2208.8,0
304,16,896,5120,torch.float8_e4m3fnuz,10,0,7.4177,a8w8_bpreshuffle_128x16x32x512_16x16_16x16_32x4x1_32x4x1_1x16x1x8_4x4x1_1x1_intrawave_v1,19.79,633.37,0
304,16,1024,5632,torch.float8_e4m3fnuz,10,0,8.4408,a8w8_bpreshuffle_128x16x32x512_16x16_16x16_32x4x1_32x4x1_1x16x1x8_4x4x1_1x1_intrawave_v1,21.86,697.81,0
304,16,1056,1408,torch.float8_e4m3fnuz,9,0,5.5281,a8w8_bpreshuffle_128x16x32x128_16x16_16x16_8x16x1_8x16x1_1x16x1x8_4x4x1_1x1_intrawave_v1,8.61,279.15,0
304,16,1280,4096,torch.float8_e4m3fnuz,10,0,6.707,a8w8_bpreshuffle_128x16x32x512_16x16_16x16_32x4x1_32x4x1_1x16x1x8_4x4x1_1x1_intrawave_v1,25.01,797.58,0
304,16,1408,1408,torch.int8,160,1,11.9579,_ZN5aiter42I8gemm_bf16_perTokenI8_BpreShuffle_128x128E,5.31,171.44,0
304,16,1536,2048,torch.int8,160,1,13.7573,_ZN5aiter42I8gemm_bf16_perTokenI8_BpreShuffle_128x128E,7.32,234.61,0
304,16,1792,6144,torch.int8,160,1,35.4348,_ZN5aiter42I8gemm_bf16_perTokenI8_BpreShuffle_128x128E,9.94,315.11,0
304,16,2048,1536,torch.int8,160,1,12.2665,_ZN5aiter42I8gemm_bf16_perTokenI8_BpreShuffle_128x128E,8.21,263.79,0
304,16,2048,6144,torch.int8,160,1,35.1889,_ZN5aiter42I8gemm_bf16_perTokenI8_BpreShuffle_128x128E,11.44,362.24,0
304,16,3072,4096,torch.int8,160,1,24.7649,_ZN5aiter42I8gemm_bf16_perTokenI8_BpreShuffle_128x128E,16.26,514.71,0
304,16,3584,6144,torch.int8,160,1,36.0032,_ZN5aiter42I8gemm_bf16_perTokenI8_BpreShuffle_128x128E,19.57,617.53,0
304,16,4096,640,torch.float8_e4m3fnuz,9,0,4.8344,a8w8_bpreshuffle_128x16x32x128_16x16_16x16_8x16x1_8x16x1_1x16x1x8_4x4x1_1x1_intrawave_v1,17.35,571.48,0
304,16,4096,1024,torch.int8,160,1,9.0262,_ZN5aiter42I8gemm_bf16_perTokenI8_BpreShuffle_128x128E,14.87,481.02,0
304,16,4096,3072,torch.int8,160,1,19.5588,_ZN5aiter42I8gemm_bf16_perTokenI8_BpreShuffle_128x128E,20.59,652.55,0
304,16,5120,640,torch.float8_e4m3fnuz,9,0,5.0526,a8w8_bpreshuffle_128x16x32x128_16x16_16x16_8x16x1_8x16x1_1x16x1x8_4x4x1_1x1_intrawave_v1,20.75,682.99,0
304,16,5120,2048,torch.float8_e4m3fnuz,10,0,5.5418,a8w8_bpreshuffle_128x16x32x512_16x16_16x16_32x4x1_32x4x1_1x16x1x8_4x4x1_1x1_intrawave_v1,60.55,1927.6,0
304,16,6144,768,torch.int8,160,1,8.7092,_ZN5aiter42I8gemm_bf16_perTokenI8_BpreShuffle_128x128E,17.34,565.78,0
304,16,6144,1024,torch.int8,160,1,9.6839,_ZN5aiter42I8gemm_bf16_perTokenI8_BpreShuffle_128x128E,20.79,671.68,0
304,16,6144,1536,torch.int8,160,1,12.3726,_ZN5aiter42I8gemm_bf16_perTokenI8_BpreShuffle_128x128E,24.41,780.63,0
304,16,6144,2048,torch.int8,160,1,14.3441,_ZN5aiter42I8gemm_bf16_perTokenI8_BpreShuffle_128x128E,28.07,893.21,0
304,32,192,7168,torch.float8_e4m3fnuz,10,0,7.9144,a8w8_bpreshuffle_128x16x32x512_16x16_16x16_32x4x1_32x4x1_1x16x1x8_4x4x1_1x1_intrawave_v1,11.13,204.43,0
304,32,512,7168,torch.float8_e4m3fnuz,10,0,9.5364,a8w8_bpreshuffle_128x16x32x512_16x16_16x16_32x4x1_32x4x1_1x16x1x8_4x4x1_1x1_intrawave_v1,24.63,412.33,0
304,32,576,7168,torch.float8_e4m3fnuz,8,0,9.6393,a8w8_bpreshuffle_128x32x16x512_16x16_16x16_32x4x1_32x4x1_1x32x1x4_4x4x1_1x1_intrawave_v1,27.41,455.95,0
304,32,1408,1408,torch.float8_e4m3fnuz,9,0,6.3881,a8w8_bpreshuffle_128x16x32x128_16x16_16x16_8x16x1_8x16x1_1x16x1x8_4x4x1_1x1_intrawave_v1,19.86,331.5,0
304,32,1536,2048,torch.float8_e4m3fnuz,8,0,5.2971,a8w8_bpreshuffle_128x32x16x512_16x16_16x16_32x4x1_32x4x1_1x32x1x4_4x4x1_1x1_intrawave_v1,38.01,624.79,0
304,32,1536,7168,torch.float8_e4m3fnuz,8,0,9.7376,a8w8_bpreshuffle_128x32x16x512_16x16_16x16_32x4x1_32x4x1_1x32x1x4_4x4x1_1x1_intrawave_v1,72.36,1164.32,0
304,32,1792,6144,torch.float8_e4m3fnuz,8,0,8.8348,a8w8_bpreshuffle_128x32x16x512_16x16_16x16_32x4x1_32x4x1_1x32x1x4_4x4x1_1x1_intrawave_v1,79.76,1281.45,0
304,32,2048,1536,torch.float8_e4m3fnuz,8,0,5.022,a8w8_bpreshuffle_128x32x16x512_16x16_16x16_32x4x1_32x4x1_1x32x1x4_4x4x1_1x1_intrawave_v1,40.09,662.28,0
304,32,2048,6144,torch.float8_e4m3fnuz,8,0,8.9283,a8w8_bpreshuffle_128x32x16x512_16x16_16x16_32x4x1_32x4x1_1x32x1x4_4x4x1_1x1_intrawave_v1,90.2,1446.03,0
304,32,2112,7168,torch.float8_e4m3fnuz,8,0,9.9181,a8w8_bpreshuffle_128x32x16x512_16x16_16x16_32x4x1_32x4x1_1x32x1x4_4x4x1_1x1_intrawave_v1,97.69,1563.14,0
304,32,3072,1536,torch.float8_e4m3fnuz,8,0,5.2411,a8w8_bpreshuffle_128x32x16x512_16x16_16x16_32x4x1_32x4x1_1x32x1x4_4x4x1_1x1_intrawave_v1,57.62,947.2,0
304,32,3072,4096,torch.float8_e4m3fnuz,10,0,7.6252,a8w8_bpreshuffle_128x16x32x512_16x16_16x16_32x4x1_32x4x1_1x16x1x8_4x4x1_1x1_intrawave_v1,105.61,1693.15,0
304,32,3584,6144,torch.float8_e4m3fnuz,11,0,10.3377,a8w8_bpreshuffle_256x16x64x512_16x16_16x16_32x8x1_32x8x1_1x16x1x16_4x4x1_1x1_intrawave_v1,136.32,2171.28,0
304,32,4096,512,torch.float8_e4m3fnuz,9,0,4.4444,a8w8_bpreshuffle_128x16x32x128_16x16_16x16_8x16x1_8x16x1_1x16x1x8_4x4x1_1x1_intrawave_v1,30.2,534.53,0
304,32,4096,1024,torch.float8_e4m3fnuz,108,0,5.6326,a8w8_bpreshuffle_256x16x64x256_16x16_16x16_16x16x1_16x16x1_1x16x1x16_4x4x1_1x1_intrawave_v1,47.66,797.01,0
304,32,4096,3072,torch.float8_e4m3fnuz,10,0,6.9884,a8w8_bpreshuffle_128x16x32x512_16x16_16x16_32x4x1_32x4x1_1x16x1x8_4x4x1_1x1_intrawave_v1,115.23,1852.12,0
304,32,4608,7168,torch.float8_e4m3fnuz,5,0,12.3678,a8w8_bpreshuffle_256x16x64x512_16x16_16x16_32x8x1_32x8x1_1x16x1x16_4x4x1_1x1_intrawave_v1,170.92,2713.05,0
304,32,6144,768,torch.float8_e4m3fnuz,108,0,5.379,a8w8_bpreshuffle_256x16x64x256_16x16_16x16_16x16x1_16x16x1_1x16x1x16_4x4x1_1x1_intrawave_v1,56.14,954.9,0
304,32,6144,1024,torch.float8_e4m3fnuz,108,0,5.9744,a8w8_bpreshuffle_256x16x64x256_16x16_16x16_16x16x1_16x16x1_1x16x1x16_4x4x1_1x1_intrawave_v1,67.4,1124.37,0
304,32,6144,1536,torch.float8_e4m3fnuz,5,0,6.3689,a8w8_bpreshuffle_256x16x64x512_16x16_16x16_32x8x1_32x8x1_1x16x1x16_4x4x1_1x1_intrawave_v1,94.83,1551.22,0
304,32,6144,2048,torch.float8_e4m3fnuz,11,0,6.9009,a8w8_bpreshuffle_256x16x64x512_16x16_16x16_32x8x1_32x8x1_1x16x1x16_4x4x1_1x1_intrawave_v1,116.7,1889.85,0
304,32,7168,2048,torch.float8_e4m3fnuz,5,0,7.4427,a8w8_bpreshuffle_256x16x64x512_16x16_16x16_32x8x1_32x8x1_1x16x1x16_4x4x1_1x1_intrawave_v1,126.23,2042.85,0
304,32,7168,2304,torch.float8_e4m3fnuz,108,0,8.4354,a8w8_bpreshuffle_256x16x64x256_16x16_16x16_16x16x1_16x16x1_1x16x1x16_4x4x1_1x1_intrawave_v1,125.3,2020.95,0
304,40,192,7168,torch.float8_e4m3fnuz,10,0,9.038,a8w8_bpreshuffle_128x16x32x512_16x16_16x16_32x4x1_32x4x1_1x16x1x8_4x4x1_1x1_intrawave_v1,12.18,185.7,0
304,40,512,7168,torch.float8_e4m3fnuz,10,0,10.1705,a8w8_bpreshuffle_128x16x32x512_16x16_16x16_32x4x1_32x4x1_1x16x1x8_4x4x1_1x1_intrawave_v1,28.87,393.07,0
304,40,576,7168,torch.float8_e4m3fnuz,10,0,10.3446,a8w8_bpreshuffle_128x16x32x512_16x16_16x16_32x4x1_32x4x1_1x16x1x8_4x4x1_1x1_intrawave_v1,31.93,431.29,0
304,40,896,5120,torch.float8_e4m3fnuz,10,0,8.5152,a8w8_bpreshuffle_128x16x32x512_16x16_16x16_32x4x1_32x4x1_1x16x1x8_4x4x1_1x1_intrawave_v1,43.1,571.21,0
304,40,1024,5632,torch.float8_e4m3fnuz,10,0,9.0254,a8w8_bpreshuffle_128x16x32x512_16x16_16x16_32x4x1_32x4x1_1x16x1x8_4x4x1_1x1_intrawave_v1,51.12,673.03,0
304,40,1056,1408,torch.float8_e4m3fnuz,9,0,6.4446,a8w8_bpreshuffle_128x16x32x128_16x16_16x16_8x16x1_8x16x1_1x16x1x8_4x4x1_1x1_intrawave_v1,18.46,252.56,0
304,40,1280,4096,torch.float8_e4m3fnuz,10,0,7.6528,a8w8_bpreshuffle_128x16x32x512_16x16_16x16_32x4x1_32x4x1_1x16x1x8_4x4x1_1x1_intrawave_v1,54.81,719.88,0
304,40,1536,7168,torch.float8_e4m3fnuz,10,0,10.6376,a8w8_bpreshuffle_128x16x32x512_16x16_16x16_32x4x1_32x4x1_1x16x1x8_4x4x1_1x1_intrawave_v1,82.8,1073.52,0
304,40,2048,1536,torch.int8,161,1,13.4239,_ZN5aiter42I8gemm_bf16_perTokenI8_BpreShuffle_192x128E,18.75,251.12,0
304,40,2048,6144,torch.int8,160,1,37.1006,_ZN5aiter42I8gemm_bf16_perTokenI8_BpreShuffle_128x128E,27.13,350.2,0
304,40,2112,7168,torch.float8_e4m3fnuz,10,0,10.7135,a8w8_bpreshuffle_128x16x32x512_16x16_16x16_32x4x1_32x4x1_1x16x1x8_4x4x1_1x1_intrawave_v1,113.04,1455.59,0
304,40,3072,1536,torch.float8_e4m3fnuz,10,0,5.362,a8w8_bpreshuffle_128x16x32x512_16x16_16x16_32x4x1_32x4x1_1x16x1x8_4x4x1_1x1_intrawave_v1,70.4,937.3,0
304,40,3072,4096,torch.int8,160,1,26.1189,_ZN5aiter42I8gemm_bf16_perTokenI8_BpreShuffle_128x128E,38.54,497.44,0
304,40,3584,6144,torch.float8_e4m3fnuz,11,0,11.39,a8w8_bpreshuffle_256x16x64x512_16x16_16x16_32x8x1_32x8x1_1x16x1x16_4x4x1_1x1_intrawave_v1,154.66,1980.03,0
304,40,4096,512,torch.float8_e4m3fnuz,9,0,4.6477,a8w8_bpreshuffle_128x16x32x128_16x16_16x16_8x16x1_8x16x1_1x16x1x8_4x4x1_1x1_intrawave_v1,36.1,526.13,0
304,40,4096,640,torch.float8_e4m3fnuz,9,0,5.665,a8w8_bpreshuffle_128x16x32x128_16x16_16x16_8x16x1_8x16x1_1x16x1x8_4x4x1_1x1_intrawave_v1,37.02,525.11,0
304,40,4096,3072,torch.float8_e4m3fnuz,5,0,7.7085,a8w8_bpreshuffle_256x16x64x512_16x16_16x16_32x8x1_32x8x1_1x16x1x16_4x4x1_1x1_intrawave_v1,130.59,1690.79,0
304,40,4608,7168,torch.float8_e4m3fnuz,5,0,15.1782,a8w8_bpreshuffle_256x16x64x512_16x16_16x16_32x8x1_32x8x1_1x16x1x16_4x4x1_1x1_intrawave_v1,174.09,2219.33,0
304,40,5120,640,torch.float8_e4m3fnuz,9,0,5.8866,a8w8_bpreshuffle_128x16x32x128_16x16_16x16_8x16x1_8x16x1_1x16x1x8_4x4x1_1x1_intrawave_v1,44.53,630.58,0
304,40,5120,2048,torch.float8_e4m3fnuz,5,0,6.6333,a8w8_bpreshuffle_256x16x64x512_16x16_16x16_32x8x1_32x8x1_1x16x1x16_4x4x1_1x1_intrawave_v1,126.46,1654.87,0
304,40,6144,768,torch.int8,160,1,8.8034,_ZN5aiter42I8gemm_bf16_perTokenI8_BpreShuffle_128x128E,42.88,595.32,0
304,40,6144,1024,torch.int8,160,1,10.842,_ZN5aiter42I8gemm_bf16_perTokenI8_BpreShuffle_128x128E,46.42,629.4,0
304,40,6144,1536,torch.float8_e4m3fnuz,5,0,6.7282,a8w8_bpreshuffle_256x16x64x512_16x16_16x16_32x8x1_32x8x1_1x16x1x16_4x4x1_1x1_intrawave_v1,112.21,1484.82,0
304,40,6144,2048,torch.float8_e4m3fnuz,15,0,7.7325,a8w8_bpreshuffle_256x16x64x256_16x16_16x16_16x16x1_16x16x1_1x16x1x16_4x4x1_1x1_intrawave_v1,130.18,1701.44,0
304,40,7168,256,torch.float8_e4m3fnuz,75,0,6.8458,a8w8_bpreshuffle_128x16x256x64_16x16_16x16_4x16x1_4x32x1_1x16x1x8_8x8x1_1x2_intrawave_v1,21.44,353.31,0
304,40,7168,2048,torch.float8_e4m3fnuz,6,0,8.6639,a8w8_bpreshuffle_256x16x128x512_16x16_16x16_32x8x1_32x8x1_1x16x1x16_8x8x1_1x2_intrawave_v1,135.55,1770.04,0
304,40,7168,2304,torch.float8_e4m3fnuz,113,0,9.3832,a8w8_bpreshuffle_256x48x64x256_16x16_16x16_16x16x1_16x16x1_1x16x1x16_4x4x1_1x1_intrawave_v1,140.81,1831,0
304,48,896,5120,torch.float8_e4m3fnuz,10,0,8.0393,a8w8_bpreshuffle_128x16x32x512_16x16_16x16_32x4x1_32x4x1_1x16x1x8_4x4x1_1x1_intrawave_v1,54.78,611.91,0
304,48,1024,5632,torch.float8_e4m3fnuz,10,0,8.9427,a8w8_bpreshuffle_128x16x32x512_16x16_16x16_32x4x1_32x4x1_1x16x1x8_4x4x1_1x1_intrawave_v1,61.91,686.12,0
304,48,1056,1408,torch.float8_e4m3fnuz,9,0,6.3748,a8w8_bpreshuffle_128x16x32x128_16x16_16x16_8x16x1_8x16x1_1x16x1x8_4x4x1_1x1_intrawave_v1,22.39,259.74,0
304,48,1280,4096,torch.float8_e4m3fnuz,10,0,7.1977,a8w8_bpreshuffle_128x16x32x512_16x16_16x16_32x4x1_32x4x1_1x16x1x8_4x4x1_1x1_intrawave_v1,69.93,772.8,0
304,48,4096,640,torch.float8_e4m3fnuz,23,0,5.6254,a8w8_bpreshuffle_128x16x32x128_16x16_16x16_8x16x1_8x16x1_1x16x1x8_4x4x1_1x1_intrawave_v2,44.74,541.36,0
304,48,5120,640,torch.float8_e4m3fnuz,9,0,5.847,a8w8_bpreshuffle_128x16x32x128_16x16_16x16_8x16x1_8x16x1_1x16x1x8_4x4x1_1x1_intrawave_v1,53.8,649.74,0
304,48,5120,2048,torch.float8_e4m3fnuz,11,0,6.7558,a8w8_bpreshuffle_256x16x64x512_16x16_16x16_32x8x1_32x8x1_1x16x1x16_4x4x1_1x1_intrawave_v1,149,1639.42,0
304,56,192,7168,torch.float8_e4m3fnuz,10,0,9.0678,a8w8_bpreshuffle_128x16x32x512_16x16_16x16_32x4x1_32x4x1_1x16x1x8_4x4x1_1x1_intrawave_v1,17,198.41,0
304,56,512,7168,torch.float8_e4m3fnuz,10,0,10.3769,a8w8_bpreshuffle_128x16x32x512_16x16_16x16_32x4x1_32x4x1_1x16x1x8_4x4x1_1x1_intrawave_v1,39.61,397.88,0
304,56,576,7168,torch.float8_e4m3fnuz,10,0,10.3798,a8w8_bpreshuffle_128x16x32x512_16x16_16x16_32x4x1_32x4x1_1x16x1x8_4x4x1_1x1_intrawave_v1,44.55,442.66,0
304,56,896,5120,torch.float8_e4m3fnuz,10,0,8.5862,a8w8_bpreshuffle_128x16x32x512_16x16_16x16_32x4x1_32x4x1_1x16x1x8_4x4x1_1x1_intrawave_v1,59.84,579.37,0
304,56,1024,5632,torch.float8_e4m3fnuz,10,0,9.0306,a8w8_bpreshuffle_128x16x32x512_16x16_16x16_32x4x1_32x4x1_1x16x1x8_4x4x1_1x1_intrawave_v1,71.53,686.25,0
304,56,1056,1408,torch.float8_e4m3fnuz,9,0,6.5442,a8w8_bpreshuffle_128x16x32x128_16x16_16x16_8x16x1_8x16x1_1x16x1x8_4x4x1_1x1_intrawave_v1,25.45,257.32,0
304,56,1280,4096,torch.float8_e4m3fnuz,10,0,7.5679,a8w8_bpreshuffle_128x16x32x512_16x16_16x16_32x4x1_32x4x1_1x16x1x8_4x4x1_1x1_intrawave_v1,77.59,742.03,0
304,56,1536,7168,torch.float8_e4m3fnuz,10,0,10.6077,a8w8_bpreshuffle_128x16x32x512_16x16_16x16_32x4x1_32x4x1_1x16x1x8_4x4x1_1x1_intrawave_v1,116.25,1091.99,0
304,56,2048,1536,torch.float8_e4m3fnuz,10,0,4.6892,a8w8_bpreshuffle_128x16x32x512_16x16_16x16_32x4x1_32x4x1_1x16x1x8_4x4x1_1x1_intrawave_v1,75.13,738.1,0
304,56,2048,6144,torch.float8_e4m3fnuz,10,0,9.447,a8w8_bpreshuffle_128x16x32x512_16x16_16x16_32x4x1_32x4x1_1x16x1x8_4x4x1_1x1_intrawave_v1,149.18,1392.65,0
304,56,2112,7168,torch.float8_e4m3fnuz,11,0,11.2841,a8w8_bpreshuffle_256x16x64x512_16x16_16x16_32x8x1_32x8x1_1x16x1x16_4x4x1_1x1_intrawave_v1,150.26,1398.14,0
304,56,3072,1536,torch.float8_e4m3fnuz,11,0,5.7838,a8w8_bpreshuffle_256x16x64x512_16x16_16x16_32x8x1_32x8x1_1x16x1x16_4x4x1_1x1_intrawave_v1,91.37,890.19,0
304,56,3072,4096,torch.float8_e4m3fnuz,11,0,8.8774,a8w8_bpreshuffle_256x16x64x512_16x16_16x16_32x8x1_32x8x1_1x16x1x16_4x4x1_1x1_intrawave_v1,158.75,1482.01,0
304,56,3584,6144,torch.float8_e4m3fnuz,11,0,12.6272,a8w8_bpreshuffle_256x16x64x512_16x16_16x16_32x8x1_32x8x1_1x16x1x16_4x4x1_1x1_intrawave_v1,195.31,1802.9,0
304,56,4096,512,torch.float8_e4m3fnuz,9,0,4.6004,a8w8_bpreshuffle_128x16x32x128_16x16_16x16_8x16x1_8x16x1_1x16x1x8_4x4x1_1x1_intrawave_v1,51.06,561.82,0
304,56,4096,640,torch.float8_e4m3fnuz,9,0,5.8188,a8w8_bpreshuffle_128x16x32x128_16x16_16x16_8x16x1_8x16x1_1x16x1x8_4x4x1_1x1_intrawave_v1,50.46,535.51,0
304,56,4096,3072,torch.float8_e4m3fnuz,5,0,8.5307,a8w8_bpreshuffle_256x16x64x512_16x16_16x16_32x8x1_32x8x1_1x16x1x16_4x4x1_1x1_intrawave_v1,165.2,1548.96,0
304,56,4608,7168,torch.float8_e4m3fnuz,5,0,16.3651,a8w8_bpreshuffle_256x16x64x512_16x16_16x16_32x8x1_32x8x1_1x16x1x16_4x4x1_1x1_intrawave_v1,226.05,2074.39,0
304,56,5120,640,torch.float8_e4m3fnuz,9,0,5.9278,a8w8_bpreshuffle_128x16x32x128_16x16_16x16_8x16x1_8x16x1_1x16x1x8_4x4x1_1x1_intrawave_v1,61.91,655.57,0
304,56,5120,2048,torch.float8_e4m3fnuz,108,0,7.8393,a8w8_bpreshuffle_256x16x64x256_16x16_16x16_16x16x1_16x16x1_1x16x1x16_4x4x1_1x1_intrawave_v1,149.81,1425.37,0
304,56,6144,768,torch.float8_e4m3fnuz,15,0,5.2308,a8w8_bpreshuffle_256x16x64x256_16x16_16x16_16x16x1_16x16x1_1x16x1x16_4x4x1_1x1_intrawave_v1,101.03,1041.85,0
304,56,6144,1024,torch.float8_e4m3fnuz,108,0,6.3516,a8w8_bpreshuffle_256x16x64x256_16x16_16x16_16x16x1_16x16x1_1x16x1x16_4x4x1_1x1_intrawave_v1,110.94,1107.9,0
304,56,6144,1536,torch.float8_e4m3fnuz,12,0,7.5368,a8w8_bpreshuffle_256x32x64x512_16x16_16x16_32x8x1_32x8x1_1x32x1x8_8x8x1_1x2_intrawave_v1,140.24,1354.86,0
304,56,6144,2048,torch.float8_e4m3fnuz,112,0,8.3853,a8w8_bpreshuffle_256x32x64x256_16x16_16x16_16x16x1_16x16x1_1x32x1x8_8x8x1_2x1_intrawave_v1,168.07,1596.33,0
304,56,7168,256,torch.float8_e4m3fnuz,75,0,7.1288,a8w8_bpreshuffle_128x16x256x64_16x16_16x16_4x16x1_4x32x1_1x16x1x8_8x8x1_1x2_intrawave_v1,28.83,372.03,0
304,56,7168,2048,torch.float8_e4m3fnuz,112,0,9.3151,a8w8_bpreshuffle_256x32x64x256_16x16_16x16_16x16x1_16x16x1_1x32x1x8_8x8x1_2x1_intrawave_v1,176.51,1674.44,0
304,56,7168,2304,torch.float8_e4m3fnuz,112,0,10.3941,a8w8_bpreshuffle_256x32x64x256_16x16_16x16_16x16x1_16x16x1_1x32x1x8_8x8x1_2x1_intrawave_v1,177.96,1678.54,0
304,64,896,5120,torch.float8_e4m3fnuz,10,0,8.0891,a8w8_bpreshuffle_128x16x32x512_16x16_16x16_32x4x1_32x4x1_1x16x1x8_4x4x1_1x1_intrawave_v1,72.59,621.81,0
304,64,1024,5632,torch.float8_e4m3fnuz,8,0,8.9391,a8w8_bpreshuffle_128x32x16x512_16x16_16x16_32x4x1_32x4x1_1x32x1x4_4x4x1_1x1_intrawave_v1,82.58,700.15,0
304,64,1056,1408,torch.float8_e4m3fnuz,9,0,6.4809,a8w8_bpreshuffle_128x16x32x128_16x16_16x16_8x16x1_8x16x1_1x16x1x8_4x4x1_1x1_intrawave_v1,29.37,264.18,0
304,64,1280,4096,torch.float8_e4m3fnuz,10,0,7.3343,a8w8_bpreshuffle_128x16x32x512_16x16_16x16_32x4x1_32x4x1_1x16x1x8_4x4x1_1x1_intrawave_v1,91.5,772.93,0
304,64,3072,4096,torch.int8,160,1,29.6085,_ZN5aiter42I8gemm_bf16_perTokenI8_BpreShuffle_128x128E,54.4,447.11,0
304,64,3584,6144,torch.int8,160,1,42.0617,_ZN5aiter42I8gemm_bf16_perTokenI8_BpreShuffle_128x128E,67.01,543.77,0
304,64,4096,640,torch.float8_e4m3fnuz,9,0,5.7071,a8w8_bpreshuffle_128x16x32x128_16x16_16x16_8x16x1_8x16x1_1x16x1x8_4x4x1_1x1_intrawave_v1,58.79,558.37,0
304,64,4096,3072,torch.int8,160,1,22.8106,_ZN5aiter42I8gemm_bf16_perTokenI8_BpreShuffle_128x128E,70.61,583.23,0
304,64,5120,640,torch.float8_e4m3fnuz,9,0,5.937,a8w8_bpreshuffle_128x16x32x128_16x16_16x16_8x16x1_8x16x1_1x16x1x8_4x4x1_1x1_intrawave_v1,70.65,669.21,0
304,64,5120,2048,torch.float8_e4m3fnuz,15,0,7.8191,a8w8_bpreshuffle_256x16x64x256_16x16_16x16_16x16x1_16x16x1_1x16x1x16_4x4x1_1x1_intrawave_v1,171.65,1441.62,0
304,64,6144,1536,torch.int8,160,1,13.8865,_ZN5aiter42I8gemm_bf16_perTokenI8_BpreShuffle_128x128E,86.99,743.31,0
304,64,6144,2048,torch.int8,160,1,16.4517,_ZN5aiter42I8gemm_bf16_perTokenI8_BpreShuffle_128x128E,97.9,820.61,0
304,72,192,7168,torch.float8_e4m3fnuz,10,0,8.5043,a8w8_bpreshuffle_128x16x32x512_16x16_16x16_32x4x1_32x4x1_1x16x1x8_4x4x1_1x1_intrawave_v1,23.3,225.77,0
304,72,512,7168,torch.float8_e4m3fnuz,10,0,10.3901,a8w8_bpreshuffle_128x16x32x512_16x16_16x16_32x4x1_32x4x1_1x16x1x8_4x4x1_1x1_intrawave_v1,50.86,409.99,0
304,72,576,7168,torch.float8_e4m3fnuz,10,0,10.5019,a8w8_bpreshuffle_128x16x32x512_16x16_16x16_32x4x1_32x4x1_1x16x1x8_4x4x1_1x1_intrawave_v1,56.61,450.19,0
304,72,1536,7168,torch.float8_e4m3fnuz,11,0,11.538,a8w8_bpreshuffle_256x16x64x512_16x16_16x16_32x8x1_32x8x1_1x16x1x16_4x4x1_1x1_intrawave_v1,137.41,1018.14,0
304,72,2112,7168,torch.float8_e4m3fnuz,5,0,14.8331,a8w8_bpreshuffle_256x16x64x512_16x16_16x16_32x8x1_32x8x1_1x16x1x16_4x4x1_1x1_intrawave_v1,146.97,1075.91,0
304,72,3072,1536,torch.float8_e4m3fnuz,8,0,5.8637,a8w8_bpreshuffle_128x32x16x512_16x16_16x16_32x4x1_32x4x1_1x32x1x4_4x4x1_1x1_intrawave_v1,115.88,899.01,0
304,72,3072,4096,torch.float8_e4m3fnuz,12,0,10.094,a8w8_bpreshuffle_256x32x64x512_16x16_16x16_32x8x1_32x8x1_1x32x1x8_8x8x1_1x2_intrawave_v1,179.51,1319.61,0
304,72,3584,6144,torch.float8_e4m3fnuz,12,0,15.1297,a8w8_bpreshuffle_256x32x64x512_16x16_16x16_32x8x1_32x8x1_1x32x1x8_8x8x1_1x2_intrawave_v1,209.58,1518.77,0
304,72,4096,512,torch.float8_e4m3fnuz,9,0,4.5002,a8w8_bpreshuffle_128x16x32x128_16x16_16x16_8x16x1_8x16x1_1x16x1x8_4x4x1_1x1_intrawave_v1,67.11,605.27,0
304,72,4096,3072,torch.float8_e4m3fnuz,112,0,9.5443,a8w8_bpreshuffle_256x32x64x256_16x16_16x16_16x16x1_16x16x1_1x32x1x8_8x8x1_2x1_intrawave_v1,189.85,1403.34,0
304,72,4608,7168,torch.float8_e4m3fnuz,12,0,18.9748,a8w8_bpreshuffle_256x32x64x512_16x16_16x16_32x8x1_32x8x1_1x32x1x8_8x8x1_1x2_intrawave_v1,250.67,1802.91,0
304,72,6144,1536,torch.float8_e4m3fnuz,112,0,7.8282,a8w8_bpreshuffle_256x32x64x256_16x16_16x16_16x16x1_16x16x1_1x32x1x8_8x8x1_2x1_intrawave_v1,173.6,1332.68,0
304,72,6144,2048,torch.float8_e4m3fnuz,112,0,8.8006,a8w8_bpreshuffle_256x32x64x256_16x16_16x16_16x16x1_16x16x1_1x32x1x8_8x8x1_2x1_intrawave_v1,205.89,1547.07,0
304,72,7168,256,torch.float8_e4m3fnuz,75,0,7.0504,a8w8_bpreshuffle_128x16x256x64_16x16_16x16_4x16x1_4x32x1_1x16x1x8_8x8x1_1x2_intrawave_v1,37.48,409.29,0
304,72,7168,2048,torch.float8_e4m3fnuz,113,0,9.8937,a8w8_bpreshuffle_256x48x64x256_16x16_16x16_16x16x1_16x16x1_1x16x1x16_4x4x1_1x1_intrawave_v1,213.66,1603.01,0
304,72,7168,2304,torch.float8_e4m3fnuz,113,0,10.4905,a8w8_bpreshuffle_256x48x64x256_16x16_16x16_16x16x1_16x16x1_1x16x1x16_4x4x1_1x1_intrawave_v1,226.7,1688.49,0
304,80,192,7168,torch.float8_e4m3fnuz,10,0,7.3417,a8w8_bpreshuffle_128x16x32x512_16x16_16x16_32x4x1_32x4x1_1x16x1x8_4x4x1_1x1_intrawave_v1,29.99,269.75,0
304,80,512,7168,torch.float8_e4m3fnuz,10,0,9.3725,a8w8_bpreshuffle_128x16x32x512_16x16_16x16_32x4x1_32x4x1_1x16x1x8_4x4x1_1x1_intrawave_v1,62.65,461.5,0
304,80,576,7168,torch.float8_e4m3fnuz,10,0,9.3269,a8w8_bpreshuffle_128x16x32x512_16x16_16x16_32x4x1_32x4x1_1x16x1x8_4x4x1_1x1_intrawave_v1,70.83,514.04,0
304,80,896,5120,torch.float8_e4m3fnuz,10,0,7.8819,a8w8_bpreshuffle_128x16x32x512_16x16_16x16_32x4x1_32x4x1_1x16x1x8_4x4x1_1x1_intrawave_v1,93.13,652.19,0
304,80,1024,5632,torch.float8_e4m3fnuz,10,0,8.7505,a8w8_bpreshuffle_128x16x32x512_16x16_16x16_32x4x1_32x4x1_1x16x1x8_4x4x1_1x1_intrawave_v1,105.45,729.28,0
304,80,1056,1408,torch.float8_e4m3fnuz,9,0,5.921,a8w8_bpreshuffle_128x16x32x128_16x16_16x16_8x16x1_8x16x1_1x16x1x8_4x4x1_1x1_intrawave_v1,40.18,298.67,0
304,80,1280,4096,torch.float8_e4m3fnuz,10,0,7.5789,a8w8_bpreshuffle_128x16x32x512_16x16_16x16_32x4x1_32x4x1_1x16x1x8_4x4x1_1x1_intrawave_v1,110.68,762.03,0
304,80,1536,7168,torch.float8_e4m3fnuz,11,0,11.6846,a8w8_bpreshuffle_256x16x64x512_16x16_16x16_32x8x1_32x8x1_1x16x1x16_4x4x1_1x1_intrawave_v1,150.76,1012.38,0
304,80,2112,7168,torch.float8_e4m3fnuz,5,0,14.4805,a8w8_bpreshuffle_256x16x64x512_16x16_16x16_32x8x1_32x8x1_1x16x1x16_4x4x1_1x1_intrawave_v1,167.27,1108.4,0
304,80,3072,1536,torch.float8_e4m3fnuz,8,0,6.0533,a8w8_bpreshuffle_128x32x16x512_16x16_16x16_32x4x1_32x4x1_1x32x1x4_4x4x1_1x1_intrawave_v1,124.72,881.01,0
304,80,3072,4096,torch.float8_e4m3fnuz,12,0,10.1751,a8w8_bpreshuffle_256x32x64x512_16x16_16x16_32x8x1_32x8x1_1x32x1x8_8x8x1_1x2_intrawave_v1,197.86,1317.15,0
304,80,3584,6144,torch.float8_e4m3fnuz,112,0,15.4311,a8w8_bpreshuffle_256x32x64x256_16x16_16x16_16x16x1_16x16x1_1x32x1x8_8x8x1_2x1_intrawave_v1,228.32,1496.01,0
304,80,4096,512,torch.float8_e4m3fnuz,9,0,4.5094,a8w8_bpreshuffle_128x16x32x128_16x16_16x16_8x16x1_8x16x1_1x16x1x8_4x4x1_1x1_intrawave_v1,74.41,619.48,0
304,80,4096,640,torch.float8_e4m3fnuz,9,0,5.2812,a8w8_bpreshuffle_128x16x32x128_16x16_16x16_8x16x1_8x16x1_1x16x1x8_4x4x1_1x1_intrawave_v1,79.42,630.16,0
304,80,4096,3072,torch.float8_e4m3fnuz,112,0,9.6969,a8w8_bpreshuffle_256x32x64x256_16x16_16x16_16x16x1_16x16x1_1x32x1x8_8x8x1_2x1_intrawave_v1,207.62,1390.55,0
304,80,4608,7168,torch.float8_e4m3fnuz,12,0,18.9687,a8w8_bpreshuffle_256x32x64x512_16x16_16x16_32x8x1_32x8x1_1x32x1x8_8x8x1_1x2_intrawave_v1,278.61,1810.4,0
304,80,5120,640,torch.float8_e4m3fnuz,9,0,5.532,a8w8_bpreshuffle_128x16x32x128_16x16_16x16_8x16x1_8x16x1_1x16x1x8_4x4x1_1x1_intrawave_v1,94.77,749.67,0
304,80,5120,2048,torch.float8_e4m3fnuz,112,0,8.0866,a8w8_bpreshuffle_256x32x64x256_16x16_16x16_16x16x1_16x16x1_1x32x1x8_8x8x1_2x1_intrawave_v1,207.47,1418.25,0
304,80,6144,1536,torch.float8_e4m3fnuz,113,0,7.8486,a8w8_bpreshuffle_256x48x64x256_16x16_16x16_16x16x1_16x16x1_1x16x1x16_4x4x1_1x1_intrawave_v1,192.38,1343.31,0
304,80,6144,2048,torch.float8_e4m3fnuz,112,0,8.8502,a8w8_bpreshuffle_256x32x64x256_16x16_16x16_16x16x1_16x16x1_1x32x1x8_8x8x1_2x1_intrawave_v1,227.48,1551.35,0
304,80,7168,256,torch.float8_e4m3fnuz,75,0,7.0446,a8w8_bpreshuffle_128x16x256x64_16x16_16x16_4x16x1_4x32x1_1x16x1x8_8x8x1_1x2_intrawave_v1,41.68,426.19,0
304,80,7168,2048,torch.float8_e4m3fnuz,113,0,9.9461,a8w8_bpreshuffle_256x48x64x256_16x16_16x16_16x16x1_16x16x1_1x16x1x16_4x4x1_1x1_intrawave_v1,236.15,1607.74,0
304,80,7168,2304,torch.float8_e4m3fnuz,113,0,10.6692,a8w8_bpreshuffle_256x48x64x256_16x16_16x16_16x16x1_16x16x1_1x16x1x16_4x4x1_1x1_intrawave_v1,247.67,1672.69,0
304,88,896,5120,torch.float8_e4m3fnuz,10,0,8.5549,a8w8_bpreshuffle_128x16x32x512_16x16_16x16_32x4x1_32x4x1_1x16x1x8_4x4x1_1x1_intrawave_v1,94.38,607.35,0
304,88,1024,5632,torch.float8_e4m3fnuz,10,0,8.8441,a8w8_bpreshuffle_128x16x32x512_16x16_16x16_32x4x1_32x4x1_1x16x1x8_4x4x1_1x1_intrawave_v1,114.77,728.51,0
304,88,1056,1408,torch.float8_e4m3fnuz,9,0,6.0582,a8w8_bpreshuffle_128x16x32x128_16x16_16x16_8x16x1_8x16x1_1x16x1x8_4x4x1_1x1_intrawave_v1,43.2,296.56,0
304,88,1280,4096,torch.float8_e4m3fnuz,5,0,7.7045,a8w8_bpreshuffle_256x16x64x512_16x16_16x16_32x8x1_32x8x1_1x16x1x16_4x4x1_1x1_intrawave_v1,119.77,756.52,0
304,88,4096,640,torch.float8_e4m3fnuz,9,0,5.2686,a8w8_bpreshuffle_128x16x32x128_16x16_16x16_8x16x1_8x16x1_1x16x1x8_4x4x1_1x1_intrawave_v1,87.57,645.08,0
304,88,5120,640,torch.float8_e4m3fnuz,9,0,5.5425,a8w8_bpreshuffle_128x16x32x128_16x16_16x16_8x16x1_8x16x1_1x16x1x8_4x4x1_1x1_intrawave_v1,104.05,763.96,0
304,88,5120,2048,torch.float8_e4m3fnuz,112,0,8.4686,a8w8_bpreshuffle_256x32x64x256_16x16_16x16_16x16x1_16x16x1_1x32x1x8_8x8x1_2x1_intrawave_v1,217.92,1365.88,0
304,88,6144,2048,torch.int8,161,1,18.424,_ZN5aiter42I8gemm_bf16_perTokenI8_BpreShuffle_192x128E,120.2,751.44,0
304,96,192,7168,torch.float8_e4m3fnuz,10,0,7.6977,a8w8_bpreshuffle_128x16x32x512_16x16_16x16_32x4x1_32x4x1_1x16x1x8_4x4x1_1x1_intrawave_v1,34.33,272.97,0
304,96,512,7168,torch.float8_e4m3fnuz,10,0,9.1186,a8w8_bpreshuffle_128x16x32x512_16x16_16x16_32x4x1_32x4x1_1x16x1x8_4x4x1_1x1_intrawave_v1,77.28,488.72,0
304,96,576,7168,torch.float8_e4m3fnuz,10,0,9.3393,a8w8_bpreshuffle_128x16x32x512_16x16_16x16_32x4x1_32x4x1_1x16x1x8_4x4x1_1x1_intrawave_v1,84.88,527.61,0
304,96,1536,7168,torch.float8_e4m3fnuz,8,0,10.6427,a8w8_bpreshuffle_128x32x16x512_16x16_16x16_32x4x1_32x4x1_1x32x1x4_4x4x1_1x1_intrawave_v1,198.63,1126.88,0
304,96,2048,6144,torch.float8_e4m3fnuz,11,0,10.8557,a8w8_bpreshuffle_256x16x64x512_16x16_16x16_32x8x1_32x8x1_1x16x1x16_4x4x1_1x1_intrawave_v1,222.55,1249.66,0
304,96,2112,7168,torch.float8_e4m3fnuz,11,0,12.3746,a8w8_bpreshuffle_256x16x64x512_16x16_16x16_32x8x1_32x8x1_1x16x1x16_4x4x1_1x1_intrawave_v1,234.89,1311.76,0
304,96,3072,1536,torch.float8_e4m3fnuz,11,0,5.662,a8w8_bpreshuffle_256x16x64x512_16x16_16x16_32x8x1_32x8x1_1x16x1x16_4x4x1_1x1_intrawave_v1,160.01,963.59,0
304,96,3072,4096,torch.float8_e4m3fnuz,112,0,10.5884,a8w8_bpreshuffle_256x32x64x256_16x16_16x16_16x16x1_16x16x1_1x32x1x8_8x8x1_2x1_intrawave_v1,228.17,1281.21,0
304,96,3584,6144,torch.float8_e4m3fnuz,112,0,15.187,a8w8_bpreshuffle_256x32x64x256_16x16_16x16_16x16x1_16x16x1_1x32x1x8_8x8x1_2x1_intrawave_v1,278.39,1534.08,0
304,96,4096,512,torch.float8_e4m3fnuz,9,0,4.4592,a8w8_bpreshuffle_128x16x32x128_16x16_16x16_8x16x1_8x16x1_1x16x1x8_4x4x1_1x1_intrawave_v1,90.3,657.68,0
304,96,4096,3072,torch.float8_e4m3fnuz,112,0,9.9237,a8w8_bpreshuffle_256x32x64x256_16x16_16x16_16x16x1_16x16x1_1x32x1x8_8x8x1_2x1_intrawave_v1,243.45,1376.93,0
304,96,4608,7168,torch.float8_e4m3fnuz,12,0,19.2281,a8w8_bpreshuffle_256x32x64x512_16x16_16x16_32x8x1_32x8x1_1x32x1x8_8x8x1_1x2_intrawave_v1,329.82,1799.61,0
304,96,6144,768,torch.float8_e4m3fnuz,112,0,5.441,a8w8_bpreshuffle_256x32x64x256_16x16_16x16_16x16x1_16x16x1_1x32x1x8_8x8x1_2x1_intrawave_v1,166.51,1097.59,0
304,96,6144,1024,torch.float8_e4m3fnuz,112,0,6.2639,a8w8_bpreshuffle_256x32x64x256_16x16_16x16_16x16x1_16x16x1_1x32x1x8_8x8x1_2x1_intrawave_v1,192.84,1208.42,0
304,96,6144,1536,torch.float8_e4m3fnuz,112,0,8.0511,a8w8_bpreshuffle_256x32x64x256_16x16_16x16_16x16x1_16x16x1_1x32x1x8_8x8x1_2x1_intrawave_v1,225.05,1337,0
304,96,6144,2048,torch.float8_e4m3fnuz,112,0,8.8001,a8w8_bpreshuffle_256x32x64x256_16x16_16x16_16x16x1_16x16x1_1x32x1x8_8x8x1_2x1_intrawave_v1,274.53,1586.25,0
304,96,7168,256,torch.float8_e4m3fnuz,75,0,7.0075,a8w8_bpreshuffle_128x16x256x64_16x16_16x16_4x16x1_4x32x1_1x16x1x8_8x8x1_1x2_intrawave_v1,50.28,461.77,0
304,96,7168,2048,torch.float8_e4m3fnuz,113,0,9.8981,a8w8_bpreshuffle_256x48x64x256_16x16_16x16_16x16x1_16x16x1_1x16x1x16_4x4x1_1x1_intrawave_v1,284.76,1642.03,0
304,96,7168,2304,torch.float8_e4m3fnuz,113,0,11.2502,a8w8_bpreshuffle_256x48x64x256_16x16_16x16_16x16x1_16x16x1_1x16x1x16_4x4x1_1x1_intrawave_v1,281.85,1609.97,0
304,104,192,7168,torch.float8_e4m3fnuz,10,0,9.1128,a8w8_bpreshuffle_128x16x32x512_16x16_16x16_32x4x1_32x4x1_1x16x1x8_4x4x1_1x1_intrawave_v1,31.41,237.21,0
304,104,512,7168,torch.float8_e4m3fnuz,5,0,10.5543,a8w8_bpreshuffle_256x16x64x512_16x16_16x16_32x8x1_32x8x1_1x16x1x16_4x4x1_1x1_intrawave_v1,72.33,428.45,0
304,104,576,7168,torch.float8_e4m3fnuz,5,0,10.6761,a8w8_bpreshuffle_256x16x64x512_16x16_16x16_32x8x1_32x8x1_1x16x1x16_4x4x1_1x1_intrawave_v1,80.44,467.78,0
304,104,896,5120,torch.float8_e4m3fnuz,11,0,8.6073,a8w8_bpreshuffle_256x16x64x512_16x16_16x16_32x8x1_32x8x1_1x16x1x16_4x4x1_1x1_intrawave_v1,110.86,616.5,0
304,104,1024,5632,torch.float8_e4m3fnuz,10,0,9.0325,a8w8_bpreshuffle_128x16x32x512_16x16_16x16_32x4x1_32x4x1_1x16x1x8_4x4x1_1x1_intrawave_v1,132.81,726.92,0
304,104,1056,1408,torch.float8_e4m3fnuz,9,0,5.9467,a8w8_bpreshuffle_128x16x32x128_16x16_16x16_8x16x1_8x16x1_1x16x1x8_4x4x1_1x1_intrawave_v1,52.01,311.59,0
304,104,1280,4096,torch.float8_e4m3fnuz,11,0,7.7129,a8w8_bpreshuffle_256x16x64x512_16x16_16x16_32x8x1_32x8x1_1x16x1x16_4x4x1_1x1_intrawave_v1,141.39,769.5,0
304,104,1536,7168,torch.float8_e4m3fnuz,11,0,11.7648,a8w8_bpreshuffle_256x16x64x512_16x16_16x16_32x8x1_32x8x1_1x16x1x16_4x4x1_1x1_intrawave_v1,194.66,1026.37,0
304,104,2112,7168,torch.float8_e4m3fnuz,5,0,13.0617,a8w8_bpreshuffle_256x16x64x512_16x16_16x16_32x8x1_32x8x1_1x16x1x16_4x4x1_1x1_intrawave_v1,241.08,1249.73,0
304,104,3072,1536,torch.float8_e4m3fnuz,15,0,6.4396,a8w8_bpreshuffle_256x16x64x256_16x16_16x16_16x16x1_16x16x1_1x16x1x16_4x4x1_1x1_intrawave_v1,152.41,856.78,0
304,104,3072,4096,torch.float8_e4m3fnuz,12,0,11.8566,a8w8_bpreshuffle_256x32x64x512_16x16_16x16_32x8x1_32x8x1_1x32x1x8_8x8x1_1x2_intrawave_v1,220.74,1151.08,0
304,104,3584,6144,torch.float8_e4m3fnuz,12,0,16.6926,a8w8_bpreshuffle_256x32x64x512_16x16_16x16_32x8x1_32x8x1_1x32x1x8_8x8x1_1x2_intrawave_v1,274.38,1402.09,0
304,104,4096,512,torch.float8_e4m3fnuz,9,0,4.9459,a8w8_bpreshuffle_128x16x32x128_16x16_16x16_8x16x1_8x16x1_1x16x1x8_4x4x1_1x1_intrawave_v1,88.2,607.04,0
304,104,4096,640,torch.float8_e4m3fnuz,9,0,5.3361,a8w8_bpreshuffle_128x16x32x128_16x16_16x16_8x16x1_8x16x1_1x16x1x8_4x4x1_1x1_intrawave_v1,102.18,663.4,0
304,104,4096,3072,torch.float8_e4m3fnuz,12,0,10.8557,a8w8_bpreshuffle_256x32x64x512_16x16_16x16_32x8x1_32x8x1_1x32x1x8_8x8x1_1x2_intrawave_v1,241.09,1267.02,0
304,104,4608,7168,torch.float8_e4m3fnuz,12,0,20.891,a8w8_bpreshuffle_256x32x64x512_16x16_16x16_32x8x1_32x8x1_1x32x1x8_8x8x1_1x2_intrawave_v1,328.86,1662.63,0
304,104,5120,640,torch.float8_e4m3fnuz,9,0,5.603,a8w8_bpreshuffle_128x16x32x128_16x16_16x16_8x16x1_8x16x1_1x16x1x8_4x4x1_1x1_intrawave_v1,121.64,786.78,0
304,104,5120,2048,torch.float8_e4m3fnuz,119,0,9.4237,a8w8_bpreshuffle_256x32x128x256_16x16_16x16_16x16x1_16x16x1_1x16x1x16_8x8x1_1x2_intrawave_v1,231.44,1248.31,0
304,104,6144,768,torch.float8_e4m3fnuz,112,0,6.4396,a8w8_bpreshuffle_256x32x64x256_16x16_16x16_16x16x1_16x16x1_1x32x1x8_8x8x1_2x1_intrawave_v1,152.41,943.6,0
304,104,6144,1024,torch.float8_e4m3fnuz,113,0,7.4259,a8w8_bpreshuffle_256x48x64x256_16x16_16x16_16x16x1_16x16x1_1x16x1x16_4x4x1_1x1_intrawave_v1,176.22,1033.67,0
304,104,6144,1536,torch.float8_e4m3fnuz,119,0,9.0545,a8w8_bpreshuffle_256x32x128x256_16x16_16x16_16x16x1_16x16x1_1x16x1x16_8x8x1_1x2_intrawave_v1,216.79,1201.05,0
304,104,6144,2048,torch.float8_e4m3fnuz,113,0,10.4208,a8w8_bpreshuffle_256x48x64x256_16x16_16x16_16x16x1_16x16x1_1x16x1x16_4x4x1_1x1_intrawave_v1,251.16,1350.55,0
304,104,7168,256,torch.float8_e4m3fnuz,75,0,7.1783,a8w8_bpreshuffle_128x16x256x64_16x16_16x16_4x16x1_4x32x1_1x16x1x8_8x8x1_1x2_intrawave_v1,53.17,467.04,0
304,104,7168,2048,torch.float8_e4m3fnuz,119,0,10.9056,a8w8_bpreshuffle_256x32x128x256_16x16_16x16_16x16x1_16x16x1_1x16x1x16_8x8x1_1x2_intrawave_v1,279.99,1502.35,0
304,104,7168,2304,torch.float8_e4m3fnuz,119,0,12.2172,a8w8_bpreshuffle_256x32x128x256_16x16_16x16_16x16x1_16x16x1_1x16x1x16_8x8x1_1x2_intrawave_v1,281.17,1493.44,0
304,112,896,5120,torch.float8_e4m3fnuz,10,0,7.9961,a8w8_bpreshuffle_128x16x32x512_16x16_16x16_32x4x1_32x4x1_1x16x1x8_4x4x1_1x1_intrawave_v1,128.51,670.53,0
304,112,1024,5632,torch.float8_e4m3fnuz,10,0,8.6843,a8w8_bpreshuffle_128x16x32x512_16x16_16x16_32x4x1_32x4x1_1x16x1x8_4x4x1_1x1_intrawave_v1,148.76,763.14,0
304,112,1056,1408,torch.float8_e4m3fnuz,9,0,6.5019,a8w8_bpreshuffle_128x16x32x128_16x16_16x16_8x16x1_8x16x1_1x16x1x8_4x4x1_1x1_intrawave_v1,51.22,289.31,0
304,112,1280,4096,torch.float8_e4m3fnuz,10,0,7.4717,a8w8_bpreshuffle_128x16x32x512_16x16_16x16_32x4x1_32x4x1_1x16x1x8_4x4x1_1x1_intrawave_v1,157.18,801.47,0
304,112,4096,640,torch.float8_e4m3fnuz,9,0,5.6144,a8w8_bpreshuffle_128x16x32x128_16x16_16x16_8x16x1_8x16x1_1x16x1x8_4x4x1_1x1_intrawave_v1,104.59,643.1,0
304,112,5120,640,torch.float8_e4m3fnuz,9,0,5.8846,a8w8_bpreshuffle_128x16x32x128_16x16_16x16_8x16x1_8x16x1_1x16x1x8_4x4x1_1x1_intrawave_v1,124.73,763.92,0
304,112,5120,2048,torch.float8_e4m3fnuz,119,0,10.023,a8w8_bpreshuffle_256x32x128x256_16x16_16x16_16x16x1_16x16x1_1x16x1x16_8x8x1_1x2_intrawave_v1,234.34,1183.48,0
304,128,512,7168,torch.float8_e4m3fnuz,10,0,9.1306,a8w8_bpreshuffle_128x16x32x512_16x16_16x16_32x4x1_32x4x1_1x16x1x8_4x4x1_1x1_intrawave_v1,102.9,516.79,0
304,128,576,7168,torch.float8_e4m3fnuz,10,0,9.1715,a8w8_bpreshuffle_128x16x32x512_16x16_16x16_32x4x1_32x4x1_1x16x1x8_4x4x1_1x1_intrawave_v1,115.24,566.29,0
304,128,1024,5632,torch.float8_e4m3fnuz,10,0,8.4989,a8w8_bpreshuffle_128x16x32x512_16x16_16x16_32x4x1_32x4x1_1x16x1x8_4x4x1_1x1_intrawave_v1,173.72,794.24,0
304,128,1056,1408,torch.float8_e4m3fnuz,9,0,5.9057,a8w8_bpreshuffle_128x16x32x128_16x16_16x16_8x16x1_8x16x1_1x16x1x8_4x4x1_1x1_intrawave_v1,64.45,328.06,0
304,128,1280,4096,torch.float8_e4m3fnuz,5,0,7.4994,a8w8_bpreshuffle_256x16x64x512_16x16_16x16_32x8x1_32x8x1_1x16x1x16_4x4x1_1x1_intrawave_v1,178.97,812.71,0
304,128,2112,7168,torch.float8_e4m3fnuz,11,0,14.1801,a8w8_bpreshuffle_256x16x64x512_16x16_16x16_32x8x1_32x8x1_1x16x1x16_4x4x1_1x1_intrawave_v1,273.31,1170.44,0
304,128,4096,512,torch.float8_e4m3fnuz,9,0,4.6279,a8w8_bpreshuffle_128x16x32x128_16x16_16x16_8x16x1_8x16x1_1x16x1x8_4x4x1_1x1_intrawave_v1,116.01,693.89,0
304,128,4608,7168,torch.float8_e4m3fnuz,12,0,21.1748,a8w8_bpreshuffle_256x32x64x512_16x16_16x16_32x8x1_32x8x1_1x32x1x8_8x8x1_1x2_intrawave_v1,399.33,1658.92,0
304,128,7168,256,torch.float8_e4m3fnuz,75,0,6.9238,a8w8_bpreshuffle_128x16x256x64_16x16_16x16_4x16x1_4x32x1_1x16x1x8_8x8x1_1x2_intrawave_v1,67.85,534.79,0
304,128,7168,2048,torch.float8_e4m3fnuz,119,0,10.8117,a8w8_bpreshuffle_256x32x128x256_16x16_16x16_16x16x1_16x16x1_1x16x1x16_8x8x1_1x2_intrawave_v1,347.6,1551.76,0
304,128,7168,2304,torch.float8_e4m3fnuz,114,0,11.7056,a8w8_bpreshuffle_256x64x64x256_16x16_16x16_16x16x1_16x16x1_1x32x1x8_8x8x1_2x1_intrawave_v3,361.18,1592.83,0
304,136,512,7168,torch.float8_e4m3fnuz,11,0,10.5723,a8w8_bpreshuffle_256x16x64x512_16x16_16x16_32x8x1_32x8x1_1x16x1x16_4x4x1_1x1_intrawave_v1,94.42,452.52,0
304,136,576,7168,torch.float8_e4m3fnuz,11,0,10.6463,a8w8_bpreshuffle_256x16x64x512_16x16_16x16_32x8x1_32x8x1_1x16x1x16_4x4x1_1x1_intrawave_v1,105.48,494.1,0
304,136,896,5120,torch.float8_e4m3fnuz,5,0,8.6547,a8w8_bpreshuffle_256x16x64x512_16x16_16x16_32x8x1_32x8x1_1x16x1x16_4x4x1_1x1_intrawave_v1,144.18,638.68,0
304,136,1024,5632,torch.float8_e4m3fnuz,5,0,9.7728,a8w8_bpreshuffle_256x16x64x512_16x16_16x16_32x8x1_32x8x1_1x16x1x16_4x4x1_1x1_intrawave_v1,160.51,697,0
304,136,1056,1408,torch.float8_e4m3fnuz,9,0,6.1206,a8w8_bpreshuffle_128x16x32x128_16x16_16x16_8x16x1_8x16x1_1x16x1x8_4x4x1_1x1_intrawave_v1,66.08,321.14,0
304,136,1280,4096,torch.float8_e4m3fnuz,11,0,8.5965,a8w8_bpreshuffle_256x16x64x512_16x16_16x16_32x8x1_32x8x1_1x16x1x16_4x4x1_1x1_intrawave_v1,165.89,715.19,0
304,136,2112,7168,torch.float8_e4m3fnuz,12,0,16.6555,a8w8_bpreshuffle_256x32x64x512_16x16_16x16_32x8x1_32x8x1_1x32x1x8_8x8x1_1x2_intrawave_v1,247.23,1001.96,0
304,136,3072,1536,torch.float8_e4m3fnuz,112,0,7.3275,a8w8_bpreshuffle_256x32x64x256_16x16_16x16_16x16x1_16x16x1_1x32x1x8_8x8x1_2x1_intrawave_v1,175.16,786.5,0
304,136,4096,512,torch.float8_e4m3fnuz,9,0,5.2226,a8w8_bpreshuffle_128x16x32x128_16x16_16x16_8x16x1_8x16x1_1x16x1x8_4x4x1_1x1_intrawave_v1,109.22,628.21,0
304,136,4096,640,torch.float8_e4m3fnuz,9,0,5.4346,a8w8_bpreshuffle_128x16x32x128_16x16_16x16_8x16x1_8x16x1_1x16x1x8_4x4x1_1x1_intrawave_v1,131.2,703.38,0
304,136,4608,7168,torch.float8_e4m3fnuz,113,0,23.9184,a8w8_bpreshuffle_256x48x64x256_16x16_16x16_16x16x1_16x16x1_1x16x1x16_4x4x1_1x1_intrawave_v1,375.62,1474.11,0
304,136,5120,640,torch.float8_e4m3fnuz,9,0,6.0226,a8w8_bpreshuffle_128x16x32x128_16x16_16x16_8x16x1_8x16x1_1x16x1x8_4x4x1_1x1_intrawave_v1,147.99,789.77,0
304,136,5120,2048,torch.float8_e4m3fnuz,113,0,9.8833,a8w8_bpreshuffle_256x48x64x256_16x16_16x16_16x16x1_16x16x1_1x16x1x16_4x4x1_1x1_intrawave_v1,288.58,1230.05,0
304,136,7168,256,torch.float8_e4m3fnuz,75,0,7.3572,a8w8_bpreshuffle_128x16x256x64_16x16_16x16_4x16x1_4x32x1_1x16x1x8_8x8x1_1x2_intrawave_v1,67.84,519.15,0
304,136,7168,2048,torch.float8_e4m3fnuz,120,0,12.2091,a8w8_bpreshuffle_256x48x128x256_16x16_16x16_16x16x1_16x16x1_1x16x1x16_8x8x1_1x2_intrawave_v1,327.05,1384.89,0
304,136,7168,2304,torch.float8_e4m3fnuz,120,0,13.6317,a8w8_bpreshuffle_256x48x128x256_16x16_16x16_16x16x1_16x16x1_1x16x1x16_8x8x1_1x2_intrawave_v1,329.53,1377.53,0
304,144,896,5120,torch.float8_e4m3fnuz,5,0,8.7299,a8w8_bpreshuffle_256x16x64x512_16x16_16x16_32x8x1_32x8x1_1x16x1x16_4x4x1_1x1_intrawave_v1,151.34,639.51,0
304,144,1024,5632,torch.float8_e4m3fnuz,5,0,9.7963,a8w8_bpreshuffle_256x16x64x512_16x16_16x16_32x8x1_32x8x1_1x16x1x16_4x4x1_1x1_intrawave_v1,169.55,701.6,0
304,144,1056,1408,torch.float8_e4m3fnuz,9,0,6.583,a8w8_bpreshuffle_128x16x32x128_16x16_16x16_8x16x1_8x16x1_1x16x1x8_4x4x1_1x1_intrawave_v1,65.05,302.86,0
304,144,1280,4096,torch.float8_e4m3fnuz,11,0,8.9235,a8w8_bpreshuffle_256x16x64x512_16x16_16x16_32x8x1_32x8x1_1x16x1x16_4x4x1_1x1_intrawave_v1,169.21,694.95,0
304,144,4096,640,torch.float8_e4m3fnuz,9,0,5.71,a8w8_bpreshuffle_128x16x32x128_16x16_16x16_8x16x1_8x16x1_1x16x1x8_4x4x1_1x1_intrawave_v1,132.22,681.83,0
304,144,5120,640,torch.float8_e4m3fnuz,9,0,6.3964,a8w8_bpreshuffle_128x16x32x128_16x16_16x16_8x16x1_8x16x1_1x16x1x8_4x4x1_1x1_intrawave_v1,147.54,757.23,0
304,144,5120,2048,torch.float8_e4m3fnuz,113,0,10.1435,a8w8_bpreshuffle_256x48x64x256_16x16_16x16_16x16x1_16x16x1_1x16x1x16_4x4x1_1x1_intrawave_v1,297.72,1208.19,0
304,152,512,7168,torch.float8_e4m3fnuz,5,0,10.4383,a8w8_bpreshuffle_256x16x64x512_16x16_16x16_32x8x1_32x8x1_1x16x1x16_4x4x1_1x1_intrawave_v1,106.88,470.88,0
304,152,576,7168,torch.float8_e4m3fnuz,11,0,10.479,a8w8_bpreshuffle_256x16x64x512_16x16_16x16_32x8x1_32x8x1_1x16x1x16_4x4x1_1x1_intrawave_v1,119.78,514.69,0
304,152,2112,7168,torch.float8_e4m3fnuz,12,0,16.9194,a8w8_bpreshuffle_256x32x64x512_16x16_16x16_32x8x1_32x8x1_1x32x1x8_8x8x1_1x2_intrawave_v1,272.01,997.1,0
304,152,3072,1536,torch.float8_e4m3fnuz,112,0,7.1593,a8w8_bpreshuffle_256x32x64x256_16x16_16x16_16x16x1_16x16x1_1x32x1x8_8x8x1_2x1_intrawave_v1,200.36,822.14,0
304,152,4096,512,torch.float8_e4m3fnuz,9,0,5.049,a8w8_bpreshuffle_128x16x32x128_16x16_16x16_8x16x1_8x16x1_1x16x1x8_4x4x1_1x1_intrawave_v1,126.27,677.39,0
304,152,4608,7168,torch.float8_e4m3fnuz,113,0,25.7474,a8w8_bpreshuffle_256x48x64x256_16x16_16x16_16x16x1_16x16x1_1x16x1x16_4x4x1_1x1_intrawave_v1,389.99,1379.58,0
304,152,7168,256,torch.float8_e4m3fnuz,75,0,7.2082,a8w8_bpreshuffle_128x16x256x64_16x16_16x16_4x16x1_4x32x1_1x16x1x8_8x8x1_1x2_intrawave_v1,77.39,562.28,0
304,152,7168,2048,torch.float8_e4m3fnuz,120,0,13.3207,a8w8_bpreshuffle_256x48x128x256_16x16_16x16_16x16x1_16x16x1_1x16x1x16_8x8x1_1x2_intrawave_v1,335.02,1289,0
304,152,7168,2304,torch.float8_e4m3fnuz,120,0,14.4593,a8w8_bpreshuffle_256x48x128x256_16x16_16x16_16x16x1_16x16x1_1x16x1x16_8x8x1_1x2_intrawave_v1,347.22,1317.1,0
304,160,896,5120,torch.float8_e4m3fnuz,10,0,8.2634,a8w8_bpreshuffle_128x16x32x512_16x16_16x16_32x4x1_32x4x1_1x16x1x8_4x4x1_1x1_intrawave_v1,177.65,688.99,0
304,160,1024,5632,torch.float8_e4m3fnuz,11,0,9.3846,a8w8_bpreshuffle_256x16x64x512_16x16_16x16_32x8x1_32x8x1_1x16x1x16_4x4x1_1x1_intrawave_v1,196.65,745.47,0
304,160,1056,1408,torch.float8_e4m3fnuz,9,0,6.035,a8w8_bpreshuffle_128x16x32x128_16x16_16x16_8x16x1_8x16x1_1x16x1x8_4x4x1_1x1_intrawave_v1,78.84,339.69,0
304,160,1280,4096,torch.float8_e4m3fnuz,11,0,8.573,a8w8_bpreshuffle_256x16x64x512_16x16_16x16_32x8x1_32x8x1_1x16x1x16_4x4x1_1x1_intrawave_v1,195.7,735.78,0
304,160,4096,640,torch.float8_e4m3fnuz,9,0,5.6642,a8w8_bpreshuffle_128x16x32x128_16x16_16x16_8x16x1_8x16x1_1x16x1x8_4x4x1_1x1_intrawave_v1,148.1,712.29,0
304,160,5120,640,torch.float8_e4m3fnuz,76,0,6.2143,a8w8_bpreshuffle_256x32x64x128_16x16_16x16_8x32x1_8x32x1_1x32x1x8_8x8x1_2x1_intrawave_v1,168.74,807.43,0
304,160,5120,2048,torch.float8_e4m3fnuz,114,0,10.7603,a8w8_bpreshuffle_256x64x64x256_16x16_16x16_16x16x1_16x16x1_1x32x1x8_8x8x1_2x1_intrawave_v3,311.84,1157.2,0
304,168,192,7168,torch.float8_e4m3fnuz,10,0,9.7562,a8w8_bpreshuffle_128x16x32x512_16x16_16x16_32x4x1_32x4x1_1x16x1x8_4x4x1_1x1_intrawave_v1,47.4,271.11,0
304,168,512,7168,torch.float8_e4m3fnuz,11,0,10.5517,a8w8_bpreshuffle_256x16x64x512_16x16_16x16_32x8x1_32x8x1_1x16x1x16_4x4x1_1x1_intrawave_v1,116.87,478.24,0
304,168,576,7168,torch.float8_e4m3fnuz,11,0,10.7055,a8w8_bpreshuffle_256x16x64x512_16x16_16x16_32x8x1_32x8x1_1x16x1x16_4x4x1_1x1_intrawave_v1,129.58,516.23,0
304,168,896,5120,torch.int8,160,1,40.2089,_ZN5aiter42I8gemm_bf16_perTokenI8_BpreShuffle_128x128E,38.33,142.97,0
304,168,1024,5632,torch.int8,160,1,37.2612,_ZN5aiter42I8gemm_bf16_perTokenI8_BpreShuffle_128x128E,52,189.4,0
304,168,1056,1408,torch.int8,160,1,11.86,_ZN5aiter42I8gemm_bf16_perTokenI8_BpreShuffle_128x128E,42.12,175.23,0.0303
304,168,1280,4096,torch.int8,160,1,28.5867,_ZN5aiter42I8gemm_bf16_perTokenI8_BpreShuffle_128x128E,61.62,222.52,0
304,168,1536,7168,torch.float8_e4m3fnuz,11,0,13.9725,a8w8_bpreshuffle_256x16x64x512_16x16_16x16_32x8x1_32x8x1_1x16x1x16_4x4x1_1x1_intrawave_v1,264.76,911.1,0
304,168,1792,6144,torch.float8_e4m3fnuz,6,0,15.2425,a8w8_bpreshuffle_256x16x128x512_16x16_16x16_32x8x1_32x8x1_1x16x1x16_8x8x1_1x2_intrawave_v1,242.7,829.55,0
304,168,2048,1536,torch.float8_e4m3fnuz,108,0,6.4417,a8w8_bpreshuffle_256x16x64x256_16x16_16x16_16x16x1_16x16x1_1x16x1x16_4x4x1_1x1_intrawave_v1,164.08,635.22,0
304,168,2048,6144,torch.float8_e4m3fnuz,12,0,16.2689,a8w8_bpreshuffle_256x32x64x512_16x16_16x16_32x8x1_32x8x1_1x32x1x8_8x8x1_1x2_intrawave_v1,259.87,879.18,0
304,168,2112,7168,torch.float8_e4m3fnuz,12,0,17.7406,a8w8_bpreshuffle_256x32x64x512_16x16_16x16_32x8x1_32x8x1_1x32x1x8_8x8x1_1x2_intrawave_v1,286.72,961.22,0
304,168,3072,1536,torch.float8_e4m3fnuz,112,0,7.665,a8w8_bpreshuffle_256x32x64x256_16x16_16x16_16x16x1_16x16x1_1x32x1x8_8x8x1_2x1_intrawave_v1,206.84,783.93,0
304,168,3072,4096,torch.float8_e4m3fnuz,114,0,14.3623,a8w8_bpreshuffle_256x64x64x256_16x16_16x16_16x16x1_16x16x1_1x32x1x8_8x8x1_2x1_intrawave_v3,294.37,995.89,0
304,168,3584,6144,torch.float8_e4m3fnuz,113,0,20.3793,a8w8_bpreshuffle_256x48x64x256_16x16_16x16_16x16x1_16x16x1_1x16x1x16_4x4x1_1x1_intrawave_v1,363.05,1190.25,0
304,168,4096,512,torch.float8_e4m3fnuz,9,0,5.4872,a8w8_bpreshuffle_128x16x32x128_16x16_16x16_8x16x1_8x16x1_1x16x1x8_4x4x1_1x1_intrawave_v1,128.42,648.68,0
304,168,4096,640,torch.int8,160,1,9.0252,_ZN5aiter42I8gemm_bf16_perTokenI8_BpreShuffle_128x128E,97.59,454.86,0
304,168,4096,3072,torch.float8_e4m3fnuz,114,0,12.8078,a8w8_bpreshuffle_256x64x64x256_16x16_16x16_16x16x1_16x16x1_1x32x1x8_8x8x1_2x1_intrawave_v3,330.1,1130.19,0
304,168,4608,7168,torch.float8_e4m3fnuz,113,0,26.0007,a8w8_bpreshuffle_256x48x64x256_16x16_16x16_16x16x1_16x16x1_1x16x1x16_4x4x1_1x1_intrawave_v1,426.84,1376.22,0
304,168,5120,640,torch.int8,160,1,9.2384,_ZN5aiter42I8gemm_bf16_perTokenI8_BpreShuffle_128x128E,119.18,552.55,0
