aiter/configs/model_configs/a8w8_bpreshuffle_tuned_gemm_dsv3.csv
cu_num,M,N,K,q_dtype_w,kernelId,splitK,us,kernelName,tflops,bw,errRatio
80,1,512,7168,torch.float8_e4m3fnuz,5,0,12.4802,a8w8_bpreshuffle_256x16x64x512_16x16_16x16_32x8x1_32x8x1_1x16x1x16_4x4x1_1x1_intrawave_v1,5.88,294.72,0
80,1,1280,8192,torch.float8_e4m3fnuz,11,0,14.3155,a8w8_bpreshuffle_256x16x64x512_16x16_16x16_32x8x1_32x8x1_1x16x1x16_4x4x1_1x1_intrawave_v1,14.65,733.23,0
80,1,2112,7168,torch.float8_e4m3fnuz,11,0,13.4147,a8w8_bpreshuffle_256x16x64x512_16x16_16x16_32x8x1_32x8x1_1x16x1x16_4x4x1_1x1_intrawave_v1,22.57,1129.37,0
80,1,2240,7168,torch.float8_e4m3fnuz,10,0,11.8963,a8w8_bpreshuffle_128x16x32x512_16x16_16x16_32x4x1_32x4x1_1x16x1x8_4x4x1_1x1_intrawave_v1,26.99,1350.67,0
80,1,4096,512,torch.float8_e4m3fnuz,9,0,4.2138,a8w8_bpreshuffle_128x16x32x128_16x16_16x16_8x16x1_8x16x1_1x16x1x8_4x4x1_1x1_intrawave_v1,9.95,499.75,0
80,1,4608,4096,torch.float8_e4m3fnuz,11,0,10.5838,a8w8_bpreshuffle_256x16x64x512_16x16_16x16_32x8x1_32x8x1_1x16x1x16_4x4x1_1x1_intrawave_v1,35.67,1784.58,0
80,1,4608,7168,torch.float8_e4m3fnuz,5,0,13.8515,a8w8_bpreshuffle_256x16x64x512_16x16_16x16_32x8x1_32x8x1_1x16x1x16_4x4x1_1x1_intrawave_v1,47.69,2385.77,0
80,1,7168,256,torch.float8_e4m3fnuz,75,0,6.4606,a8w8_bpreshuffle_128x16x256x64_16x16_16x16_4x16x1_4x32x1_1x16x1x8_8x8x1_1x2_intrawave_v1,5.68,286.29,0
80,1,7168,2304,torch.float8_e4m3fnuz,29,0,10.1762,a8w8_bpreshuffle_256x16x64x256_16x16_16x16_16x16x1_16x16x1_1x16x1x16_4x4x1_1x1_intrawave_v2,32.46,1624.55,0
80,1,8192,1024,torch.float8_e4m3fnuz,15,0,6.4482,a8w8_bpreshuffle_256x16x64x256_16x16_16x16_16x16x1_16x16x1_1x16x1x16_4x4x1_1x1_intrawave_v1,26.02,1303.62,0
80,1,9216,4096,torch.float8_e4m3fnuz,19,0,14.4331,a8w8_bpreshuffle_256x16x64x512_16x16_16x16_32x8x1_32x8x1_1x16x1x16_4x4x1_1x1_intrawave_v2,52.31,2616.99,0
80,1,11264,1536,torch.float8_e4m3fnuz,108,0,9.3388,a8w8_bpreshuffle_256x16x64x256_16x16_16x16_16x16x1_16x16x1_1x16x1x16_4x4x1_1x1_intrawave_v1,37.05,1855.22,0
80,2,4608,4096,torch.float8_e4m3fnuz,5,0,10.661,a8w8_bpreshuffle_256x16x64x512_16x16_16x16_32x8x1_32x8x1_1x16x1x16_4x4x1_1x1_intrawave_v1,70.82,1772.91,0
80,2,9216,4096,torch.float8_e4m3fnuz,5,0,14.4331,a8w8_bpreshuffle_256x16x64x512_16x16_16x16_32x8x1_32x8x1_1x16x1x16_4x4x1_1x1_intrawave_v1,104.62,2618.55,0
80,4,4608,4096,torch.float8_e4m3fnuz,5,0,10.4863,a8w8_bpreshuffle_256x16x64x512_16x16_16x16_32x8x1_32x8x1_1x16x1x16_4x4x1_1x1_intrawave_v1,143.99,1804.99,0
80,4,9216,4096,torch.float8_e4m3fnuz,11,0,14.6151,a8w8_bpreshuffle_256x16x64x512_16x16_16x16_32x8x1_32x8x1_1x16x1x16_4x4x1_1x1_intrawave_v1,206.63,2589.02,0
80,8,4608,4096,torch.float8_e4m3fnuz,5,0,10.8626,a8w8_bpreshuffle_256x16x64x512_16x16_16x16_32x8x1_32x8x1_1x16x1x16_4x4x1_1x1_intrawave_v1,278.01,1747.36,0
80,8,9216,4096,torch.float8_e4m3fnuz,5,0,15.0571,a8w8_bpreshuffle_256x16x64x512_16x16_16x16_32x8x1_32x8x1_1x16x1x16_4x4x1_1x1_intrawave_v1,401.13,2519.01,0
80,16,512,7168,torch.float8_e4m3fnuz,24,0,10.7923,a8w8_bpreshuffle_128x16x32x512_16x16_16x16_32x4x1_32x4x1_1x16x1x8_4x4x1_1x1_intrawave_v2,108.82,352.20,0
80,16,576,7168,torch.float8_e4m3fnuz,10,0,11.091,a8w8_bpreshuffle_128x16x32x512_16x16_16x16_32x4x1_32x4x1_1x16x1x8_4x4x1_1x1_intrawave_v1,119.12,384.27,0
80,16,1536,7168,torch.float8_e4m3fnuz,10,0,11.2927,a8w8_bpreshuffle_128x16x32x512_16x16_16x16_32x4x1_32x4x1_1x16x1x8_4x4x1_1x1_intrawave_v1,311.99,989.48,0
80,16,2112,7168,torch.float8_e4m3fnuz,24,0,11.7534,a8w8_bpreshuffle_128x16x32x512_16x16_16x16_32x4x1_32x4x1_1x16x1x8_4x4x1_1x1_intrawave_v2,412.17,1303.55,0
80,16,2240,7168,torch.float8_e4m3fnuz,10,0,11.1279,a8w8_bpreshuffle_128x16x32x512_16x16_16x16_32x4x1_32x4x1_1x16x1x8_4x4x1_1x1_intrawave_v1,461.72,1459.64,0
80,16,3072,1536,torch.float8_e4m3fnuz,11,0,5.8974,a8w8_bpreshuffle_256x16x64x512_16x16_16x16_32x8x1_32x8x1_1x16x1x16_4x4x1_1x1_intrawave_v1,256.04,820.95,0
80,16,4096,512,torch.float8_e4m3fnuz,9,0,4.939,a8w8_bpreshuffle_128x16x32x128_16x16_16x16_8x16x1_8x16x1_1x16x1x8_4x4x1_1x1_intrawave_v1,135.88,452.81,0
80,16,4608,4096,torch.float8_e4m3fnuz,24,0,10.8403,a8w8_bpreshuffle_128x16x32x512_16x16_16x16_32x4x1_32x4x1_1x16x1x8_4x4x1_1x1_intrawave_v2,557.16,1760.78,0
80,16,4608,7168,torch.float8_e4m3fnuz,5,0,14.1863,a8w8_bpreshuffle_256x16x64x512_16x16_16x16_32x8x1_32x8x1_1x16x1x16_4x4x1_1x1_intrawave_v1,745.06,2346.79,0
80,16,7168,256,torch.float8_e4m3fnuz,75,0,6.629,a8w8_bpreshuffle_128x16x256x64_16x16_16x16_4x16x1_4x32x1_1x16x1x8_8x8x1_1x2_intrawave_v1,88.58,312.03,0
80,16,7168,2048,torch.float8_e4m3fnuz,10,0,8.769,a8w8_bpreshuffle_128x16x32x512_16x16_16x16_32x4x1_32x4x1_1x16x1x8_4x4x1_1x1_intrawave_v1,535.71,1703.98,0
80,16,7168,2304,torch.float8_e4m3fnuz,15,0,10.491,a8w8_bpreshuffle_256x16x64x256_16x16_16x16_16x16x1_16x16x1_1x16x1x16_4x4x1_1x1_intrawave_v1,503.75,1599.59,0
80,16,9216,4096,torch.float8_e4m3fnuz,11,0,15.5867,a8w8_bpreshuffle_256x16x64x512_16x16_16x16_32x8x1_32x8x1_1x16x1x16_4x4x1_1x1_intrawave_v1,774.99,2444.98,0
80,16,11264,1536,torch.float8_e4m3fnuz,10,0,9.7876,a8w8_bpreshuffle_128x16x32x512_16x16_16x16_32x4x1_32x4x1_1x16x1x8_4x4x1_1x1_intrawave_v1,565.66,1807.03,0
80,32,512,7168,torch.float8_e4m3fnuz,10,0,11.1022,a8w8_bpreshuffle_128x16x32x512_16x16_16x16_32x4x1_32x4x1_1x16x1x8_4x4x1_1x1_intrawave_v1,211.56,354.18,0
80,32,576,7168,torch.float8_e4m3fnuz,10,0,11.199,a8w8_bpreshuffle_128x16x32x512_16x16_16x16_32x4x1_32x4x1_1x16x1x8_4x4x1_1x1_intrawave_v1,235.95,392.45,0
80,32,1280,8192,torch.float8_e4m3fnuz,24,0,12.4575,a8w8_bpreshuffle_128x16x32x512_16x16_16x16_32x4x1_32x4x1_1x16x1x8_4x4x1_1x1_intrawave_v2,538.70,869.34,0
80,32,1536,7168,torch.float8_e4m3fnuz,19,0,12.6967,a8w8_bpreshuffle_256x16x64x512_16x16_16x16_32x8x1_32x8x1_1x16x1x16_4x4x1_1x1_intrawave_v2,554.98,892.97,0
80,32,2112,7168,torch.float8_e4m3fnuz,5,0,13.1607,a8w8_bpreshuffle_256x16x64x512_16x16_16x16_32x8x1_32x8x1_1x16x1x16_4x4x1_1x1_intrawave_v1,736.20,1178.00,0
80,32,2240,7168,torch.float8_e4m3fnuz,11,0,12.8275,a8w8_bpreshuffle_256x16x64x512_16x16_16x16_32x8x1_32x8x1_1x16x1x16_4x4x1_1x1_intrawave_v1,801.09,1280.77,0
80,32,3072,1536,torch.float8_e4m3fnuz,112,0,6.9922,a8w8_bpreshuffle_256x32x64x256_16x16_16x16_16x16x1_16x16x1_1x32x1x8_8x8x1_2x1_intrawave_v1,431.90,709.98,0
80,32,4096,512,torch.float8_e4m3fnuz,9,0,4.8822,a8w8_bpreshuffle_128x16x32x128_16x16_16x16_8x16x1_8x16x1_1x16x1x8_4x4x1_1x1_intrawave_v1,274.91,486.60,0
80,32,4608,4096,torch.float8_e4m3fnuz,6,0,13.4935,a8w8_bpreshuffle_256x16x128x512_16x16_16x16_32x8x1_32x8x1_1x16x1x16_8x8x1_1x2_intrawave_v1,895.22,1430.34,0
80,32,4608,7168,torch.float8_e4m3fnuz,12,0,19.4019,a8w8_bpreshuffle_256x32x64x512_16x16_16x16_32x8x1_32x8x1_1x32x1x8_8x8x1_1x2_intrawave_v1,1089.55,1729.44,0
80,32,7168,256,torch.float8_e4m3fnuz,75,0,6.8302,a8w8_bpreshuffle_128x16x256x64_16x16_16x16_4x16x1_4x32x1_1x16x1x8_8x8x1_1x2_intrawave_v1,171.94,337.03,0
80,32,7168,2048,torch.float8_e4m3fnuz,119,0,11.0711,a8w8_bpreshuffle_256x32x128x256_16x16_16x16_16x16x1_16x16x1_1x16x1x16_8x8x1_1x2_intrawave_v1,848.63,1373.34,0
80,32,7168,2304,torch.float8_e4m3fnuz,119,0,11.6614,a8w8_bpreshuffle_256x32x128x256_16x16_16x16_16x16x1_16x16x1_1x16x1x16_8x8x1_1x2_intrawave_v1,906.38,1461.88,0
80,32,7168,16384,torch.float8_e4m3fnuz,119,0,53.2367,a8w8_bpreshuffle_256x32x128x256_16x16_16x16_16x16x1_16x16x1_1x16x1x16_8x8x1_1x2_intrawave_v1,1411.84,2224.47,0
80,32,8192,1024,torch.float8_e4m3fnuz,119,0,7.4863,a8w8_bpreshuffle_256x32x128x256_16x16_16x16_16x16x1_16x16x1_1x16x1x16_8x8x1_1x2_intrawave_v1,717.14,1194.94,0
80,32,9216,4096,torch.float8_e4m3fnuz,119,0,18.4783,a8w8_bpreshuffle_256x32x128x256_16x16_16x16_16x16x1_16x16x1_1x16x1x16_8x8x1_1x2_intrawave_v1,1307.44,2081.88,0
80,32,11264,1536,torch.float8_e4m3fnuz,76,0,12.5451,a8w8_bpreshuffle_256x32x64x128_16x16_16x16_8x32x1_8x32x1_1x32x1x8_8x8x1_2x1_intrawave_v1,882.65,1440.53,0
80,32,24576,1536,torch.float8_e4m3fnuz,112,0,19.3781,a8w8_bpreshuffle_256x32x64x256_16x16_16x16_16x16x1_16x16x1_1x32x1x8_8x8x1_2x1_intrawave_v1,1246.73,2031.71,0
80,48,512,7168,torch.float8_e4m3fnuz,10,0,11.2279,a8w8_bpreshuffle_128x16x32x512_16x16_16x16_32x4x1_32x4x1_1x16x1x8_4x4x1_1x1_intrawave_v1,313.79,361.89,0
80,48,2112,7168,torch.float8_e4m3fnuz,10,0,18.4707,a8w8_bpreshuffle_128x16x32x512_16x16_16x16_32x4x1_32x4x1_1x16x1x8_4x4x1_1x1_intrawave_v1,786.83,849.22,0
80,48,2240,7168,torch.float8_e4m3fnuz,10,0,18.3626,a8w8_bpreshuffle_128x16x32x512_16x16_16x16_32x4x1_32x4x1_1x16x1x8_4x4x1_1x1_intrawave_v1,839.43,904.85,0
80,48,4096,512,torch.float8_e4m3fnuz,9,0,5.3534,a8w8_bpreshuffle_128x16x32x128_16x16_16x16_8x16x1_8x16x1_1x16x1x8_4x4x1_1x1_intrawave_v1,376.07,469.78,0
80,48,4608,7168,torch.float8_e4m3fnuz,113,0,22.5027,a8w8_bpreshuffle_256x48x64x256_16x16_16x16_16x16x1_16x16x1_1x16x1x16_4x4x1_1x1_intrawave_v1,1409.12,1502.78,0
80,48,7168,256,torch.float8_e4m3fnuz,75,0,7.0126,a8w8_bpreshuffle_128x16x256x64_16x16_16x16_4x16x1_4x32x1_1x16x1x8_8x8x1_1x2_intrawave_v1,251.21,361.55,0
80,48,7168,2304,torch.float8_e4m3fnuz,113,0,13.6727,a8w8_bpreshuffle_256x48x64x256_16x16_16x16_16x16x1_16x16x1_1x16x1x16_4x4x1_1x1_intrawave_v1,1159.57,1266.30,0
80,48,11264,1536,torch.float8_e4m3fnuz,113,0,15.2534,a8w8_bpreshuffle_256x48x64x256_16x16_16x16_16x16x1_16x16x1_1x16x1x16_4x4x1_1x1_intrawave_v1,1088.90,1210.00,0
80,64,512,7168,torch.float8_e4m3fnuz,10,0,11.1263,a8w8_bpreshuffle_128x16x32x512_16x16_16x16_32x4x1_32x4x1_1x16x1x8_4x4x1_1x1_intrawave_v1,422.21,376.97,0
80,64,576,7168,torch.float8_e4m3fnuz,24,0,11.163,a8w8_bpreshuffle_128x16x32x512_16x16_16x16_32x4x1_32x4x1_1x16x1x8_4x4x1_1x1_intrawave_v2,473.42,417.56,0
80,64,1280,8192,torch.float8_e4m3fnuz,19,0,13.7807,a8w8_bpreshuffle_256x16x64x512_16x16_16x16_32x8x1_32x8x1_1x16x1x16_4x4x1_1x1_intrawave_v2,973.95,810.84,0
80,64,1536,7168,torch.float8_e4m3fnuz,19,0,16.9363,a8w8_bpreshuffle_256x16x64x512_16x16_16x16_32x8x1_32x8x1_1x16x1x16_4x4x1_1x1_intrawave_v2,832.11,688.78,0
80,64,2112,7168,torch.float8_e4m3fnuz,112,0,18.9179,a8w8_bpreshuffle_256x32x64x256_16x16_16x16_16x16x1_16x16x1_1x32x1x8_8x8x1_2x1_intrawave_v1,1024.30,838.78,0
80,64,2240,7168,torch.float8_e4m3fnuz,12,0,18.6485,a8w8_bpreshuffle_256x32x64x512_16x16_16x16_32x8x1_32x8x1_1x32x1x8_8x8x1_1x2_intrawave_v1,1102.08,900.97,0
80,64,3072,1536,torch.float8_e4m3fnuz,114,0,9.0146,a8w8_bpreshuffle_256x64x64x256_16x16_16x16_16x16x1_16x16x1_1x32x1x8_8x8x1_2x1_intrawave_v3,670.00,577.96,0
80,64,4096,512,torch.float8_e4m3fnuz,77,0,5.8414,a8w8_bpreshuffle_256x64x64x128_16x16_16x16_8x32x1_8x32x1_1x32x1x8_8x8x1_2x1_intrawave_v3,459.54,454.38,0
80,64,4608,4096,torch.float8_e4m3fnuz,114,0,16.3715,a8w8_bpreshuffle_256x64x64x256_16x16_16x16_16x16x1_16x16x1_1x32x1x8_8x8x1_2x1_intrawave_v3,1475.69,1204.92,0
80,64,4608,7168,torch.float8_e4m3fnuz,114,0,24.7999,a8w8_bpreshuffle_256x64x64x256_16x16_16x16_16x16x1_16x16x1_1x32x1x8_8x8x1_2x1_intrawave_v3,1704.79,1374.15,0
80,64,7168,256,torch.float8_e4m3fnuz,75,0,7.6886,a8w8_bpreshuffle_128x16x256x64_16x16_16x16_4x16x1_4x32x1_1x16x1x8_8x8x1_1x2_intrawave_v1,305.49,360.13,0
80,64,7168,2048,torch.float8_e4m3fnuz,112,0,14.2819,a8w8_bpreshuffle_256x32x64x256_16x16_16x16_16x16x1_16x16x1_1x32x1x8_8x8x1_2x1_intrawave_v1,1315.69,1101.30,0
80,64,7168,2304,torch.float8_e4m3fnuz,112,0,15.5151,a8w8_bpreshuffle_256x32x64x256_16x16_16x16_16x16x1_16x16x1_1x32x1x8_8x8x1_2x1_intrawave_v1,1362.50,1133.09,0
80,64,7168,16384,torch.float8_e4m3fnuz,121,0,81.4496,a8w8_bpreshuffle_256x64x128x256_16x16_16x16_16x16x1_16x16x1_1x16x1x16_8x8x1_1x2_intrawave_v3,1845.61,1466.02,0
80,64,8192,1024,torch.float8_e4m3fnuz,114,0,10.9842,a8w8_bpreshuffle_256x64x64x256_16x16_16x16_16x16x1_16x16x1_1x32x1x8_8x8x1_2x1_intrawave_v3,977.53,865.13,0
80,64,9216,4096,torch.float8_e4m3fnuz,114,0,25.0703,a8w8_bpreshuffle_256x64x64x256_16x16_16x16_16x16x1_16x16x1_1x32x1x8_8x8x1_2x1_intrawave_v3,1927.32,1563.23,0
80,64,11264,1536,torch.float8_e4m3fnuz,112,0,17.4734,a8w8_bpreshuffle_256x32x64x256_16x16_16x16_16x16x1_16x16x1_1x32x1x8_8x8x1_2x1_intrawave_v1,1267.41,1078.30,0
80,64,24576,1536,torch.float8_e4m3fnuz,93,0,27.4074,a8w8_bpreshuffle_256x64x192x128_16x16_16x16_8x32x1_8x32x1_1x32x1x8_8x8x1_2x1_intrawave_v3,1762.97,1495.68,0
80,80,512,7168,torch.float8_e4m3fnuz,24,0,11.2303,a8w8_bpreshuffle_128x16x32x512_16x16_16x16_32x4x1_32x4x1_1x16x1x8_4x4x1_1x1_intrawave_v2,522.87,385.15,0
80,80,2112,7168,torch.float8_e4m3fnuz,113,0,24.3931,a8w8_bpreshuffle_256x48x64x256_16x16_16x16_16x16x1_16x16x1_1x16x1x16_4x4x1_1x1_intrawave_v1,992.99,657.98,0
80,80,2240,7168,torch.float8_e4m3fnuz,113,0,23.5984,a8w8_bpreshuffle_256x48x64x256_16x16_16x16_16x16x1_16x16x1_1x16x1x16_4x4x1_1x1_intrawave_v1,1088.64,719.89,0
80,80,4096,512,torch.float8_e4m3fnuz,76,0,6.8102,a8w8_bpreshuffle_256x32x64x128_16x16_16x16_8x32x1_8x32x1_1x32x1x8_8x8x1_2x1_intrawave_v1,492.71,410.19,0
80,80,4608,7168,torch.float8_e4m3fnuz,115,0,28.9995,a8w8_bpreshuffle_256x80x64x256_16x16_16x16_16x16x1_16x16x1_1x16x1x16_4x4x1_1x1_intrawave_v3,1822.38,1184.19,0
80,80,7168,256,torch.float8_e4m3fnuz,75,0,8.2998,a8w8_bpreshuffle_128x16x256x64_16x16_16x16_4x16x1_4x32x1_1x16x1x8_8x8x1_1x2_intrawave_v1,353.75,361.74,0
80,80,7168,2304,torch.float8_e4m3fnuz,113,0,18.9055,a8w8_bpreshuffle_256x48x64x256_16x16_16x16_16x16x1_16x16x1_1x16x1x16_4x4x1_1x1_intrawave_v1,1397.69,943.97,0
80,80,11264,1536,torch.float8_e4m3fnuz,100,0,21.6601,a8w8_bpreshuffle_256x32x256x128_16x16_16x16_8x32x1_8x32x1_1x32x1x8_8x8x1_2x1_intrawave_v1,1278.04,887.65,0
80,96,512,7168,torch.float8_e4m3fnuz,10,0,11.6635,a8w8_bpreshuffle_128x16x32x512_16x16_16x16_32x4x1_32x4x1_1x16x1x8_4x4x1_1x1_intrawave_v1,604.14,382.08,0
80,96,2112,7168,torch.float8_e4m3fnuz,113,0,22.3255,a8w8_bpreshuffle_256x48x64x256_16x16_16x16_16x16x1_16x16x1_1x16x1x16_4x4x1_1x1_intrawave_v1,1301.94,727.08,0
80,96,2240,7168,torch.float8_e4m3fnuz,113,0,21.7057,a8w8_bpreshuffle_256x48x64x256_16x16_16x16_16x16x1_16x16x1_1x16x1x16_4x4x1_1x1_intrawave_v1,1420.28,791.25,0
80,96,3072,1536,torch.float8_e4m3fnuz,112,0,9.6664,a8w8_bpreshuffle_256x32x64x256_16x16_16x16_16x16x1_16x16x1_1x32x1x8_8x8x1_2x1_intrawave_v1,937.24,564.42,0
80,96,4096,512,torch.float8_e4m3fnuz,76,0,6.6322,a8w8_bpreshuffle_256x32x64x128_16x16_16x16_8x32x1_8x32x1_1x32x1x8_8x8x1_2x1_intrawave_v1,607.12,442.20,0
80,96,4608,7168,torch.float8_e4m3fnuz,120,0,29.4707,a8w8_bpreshuffle_256x48x128x256_16x16_16x16_16x16x1_16x16x1_1x16x1x16_8x8x1_1x2_intrawave_v1,2151.90,1174.15,0
80,96,7168,256,torch.float8_e4m3fnuz,75,0,8.6194,a8w8_bpreshuffle_128x16x256x64_16x16_16x16_4x16x1_4x32x1_1x16x1x8_8x8x1_1x2_intrawave_v1,408.75,375.41,0
80,96,7168,2048,torch.float8_e4m3fnuz,113,0,17.6925,a8w8_bpreshuffle_256x48x64x256_16x16_16x16_16x16x1_16x16x1_1x16x1x16_4x4x1_1x1_intrawave_v1,1593.09,918.63,0
80,96,7168,2304,torch.float8_e4m3fnuz,84,0,19.1495,a8w8_bpreshuffle_256x32x128x128_16x16_16x16_8x32x1_8x32x1_1x32x1x8_8x8x1_2x1_intrawave_v1,1655.86,945.85,0
80,96,7168,16384,torch.float8_e4m3fnuz,113,0,98.4525,a8w8_bpreshuffle_256x48x64x256_16x16_16x16_16x16x1_16x16x1_1x16x1x16_4x4x1_1x1_intrawave_v1,2290.30,1222.82,0
80,96,11264,1536,torch.float8_e4m3fnuz,119,0,21.7177,a8w8_bpreshuffle_256x32x128x256_16x16_16x16_16x16x1_16x16x1_1x16x1x16_8x8x1_1x2_intrawave_v1,1529.58,903.03,0
80,96,24576,1536,torch.float8_e4m3fnuz,94,0,34.225,a8w8_bpreshuffle_256x96x192x128_16x16_16x16_8x32x1_8x32x1_1x32x1x8_8x8x1_2x1_intrawave_v3,2117.68,1245.14,0
80,112,512,7168,torch.float8_e4m3fnuz,10,0,11.9903,a8w8_bpreshuffle_128x16x32x512_16x16_16x16_32x4x1_32x4x1_1x16x1x8_4x4x1_1x1_intrawave_v1,685.62,382.60,0
80,112,2112,7168,torch.float8_e4m3fnuz,112,0,25.9619,a8w8_bpreshuffle_256x32x64x256_16x16_16x16_16x16x1_16x16x1_1x32x1x8_8x8x1_2x1_intrawave_v1,1306.18,632.26,0
80,112,2240,7168,torch.float8_e4m3fnuz,112,0,26.1124,a8w8_bpreshuffle_256x32x64x256_16x16_16x16_16x16x1_16x16x1_1x32x1x8_8x8x1_2x1_intrawave_v1,1377.36,664.85,0
80,112,4096,512,torch.float8_e4m3fnuz,76,0,7.3154,a8w8_bpreshuffle_256x32x64x128_16x16_16x16_8x32x1_8x32x1_1x32x1x8_8x8x1_2x1_intrawave_v1,642.15,419.94,0
80,112,4608,7168,torch.float8_e4m3fnuz,117,0,37.2568,a8w8_bpreshuffle_256x112x64x256_16x16_16x16_16x16x1_16x16x1_1x16x1x16_4x4x1_1x1_intrawave_v3,1985.88,935.81,0
80,112,7168,256,torch.float8_e4m3fnuz,75,0,9.207,a8w8_bpreshuffle_128x16x256x64_16x16_16x16_4x16x1_4x32x1_1x16x1x8_8x8x1_1x2_intrawave_v1,446.44,376.81,0
80,112,7168,2304,torch.float8_e4m3fnuz,119,0,21.7835,a8w8_bpreshuffle_256x32x128x256_16x16_16x16_16x16x1_16x16x1_1x16x1x16_8x8x1_1x2_intrawave_v1,1698.25,843.70,0
80,112,11264,1536,torch.float8_e4m3fnuz,85,0,25.6868,a8w8_bpreshuffle_256x64x128x128_16x16_16x16_8x32x1_8x32x1_1x32x1x8_8x8x1_2x1_intrawave_v3,1508.77,778.48,0
80,128,512,7168,torch.float8_e4m3fnuz,19,0,12.3367,a8w8_bpreshuffle_256x16x64x512_16x16_16x16_32x8x1_32x8x1_1x16x1x16_4x4x1_1x1_intrawave_v2,761.57,382.48,0
80,128,576,7168,torch.float8_e4m3fnuz,25,0,12.3755,a8w8_bpreshuffle_256x16x64x512_16x16_16x16_32x8x1_32x8x1_1x16x1x16_4x4x1_1x1_intrawave_v2,854.08,419.68,0
80,128,1280,8192,torch.float8_e4m3fnuz,6,0,20.4871,a8w8_bpreshuffle_256x16x128x512_16x16_16x16_32x8x1_32x8x1_1x16x1x16_8x8x1_1x2_intrawave_v1,1310.27,579.00,0
80,128,1536,7168,torch.float8_e4m3fnuz,112,0,22.8955,a8w8_bpreshuffle_256x32x64x256_16x16_16x16_16x16x1_16x16x1_1x32x1x8_8x8x1_2x1_intrawave_v1,1231.06,538.13,0
80,128,2112,7168,torch.float8_e4m3fnuz,114,0,24.5755,a8w8_bpreshuffle_256x64x64x256_16x16_16x16_16x16x1_16x16x1_1x32x1x8_8x8x1_2x1_intrawave_v3,1576.99,675.35,0
80,128,2240,7168,torch.float8_e4m3fnuz,114,0,23.9804,a8w8_bpreshuffle_256x64x64x256_16x16_16x16_16x16x1_16x16x1_1x32x1x8_8x8x1_2x1_intrawave_v3,1714.07,731.73,0
80,128,3072,1536,torch.float8_e4m3fnuz,112,0,11.1838,a8w8_bpreshuffle_256x32x64x256_16x16_16x16_16x16x1_16x16x1_1x32x1x8_8x8x1_2x1_intrawave_v1,1080.10,509.81,0
80,128,4096,512,torch.float8_e4m3fnuz,76,0,7.2018,a8w8_bpreshuffle_256x32x64x128_16x16_16x16_8x32x1_8x32x1_1x32x1x8_8x8x1_2x1_intrawave_v1,745.47,445.90,0
80,128,4608,4096,torch.float8_e4m3fnuz,121,0,24.6387,a8w8_bpreshuffle_256x64x128x256_16x16_16x16_16x16x1_16x16x1_1x16x1x16_8x8x1_1x2_intrawave_v3,1961.08,835.20,0
80,128,4608,7168,torch.float8_e4m3fnuz,114,0,38.7224,a8w8_bpreshuffle_256x64x64x256_16x16_16x16_16x16x1_16x16x1_1x32x1x8_8x8x1_2x1_intrawave_v3,2183.68,907.16,0
80,128,7168,256,torch.float8_e4m3fnuz,73,0,10.1406,a8w8_bpreshuffle_256x32x256x64_16x16_16x16_4x32x1_4x64x1_1x32x1x8_8x8x1_2x1_intrawave_v1,463.25,365.14,0
80,128,7168,2048,torch.float8_e4m3fnuz,119,0,20.5111,a8w8_bpreshuffle_256x32x128x256_16x16_16x16_16x16x1_16x16x1_1x16x1x16_8x8x1_1x2_intrawave_v1,1832.23,817.96,0
80,128,7168,2304,torch.float8_e4m3fnuz,84,0,21.9275,a8w8_bpreshuffle_256x32x128x128_16x16_16x16_8x32x1_8x32x1_1x32x1x8_8x8x1_2x1_intrawave_v1,1928.11,850.30,0
80,128,7168,16384,torch.float8_e4m3fnuz,114,0,119.9291,a8w8_bpreshuffle_256x64x64x256_16x16_16x16_16x16x1_16x16x1_1x32x1x8_8x8x1_2x1_intrawave_v3,2506.88,1012.04,0
80,128,8192,1024,torch.float8_e4m3fnuz,121,0,14.9703,a8w8_bpreshuffle_256x64x128x256_16x16_16x16_16x16x1_16x16x1_1x16x1x16_8x8x1_1x2_intrawave_v3,1434.50,709.19,0
80,128,9216,4096,torch.float8_e4m3fnuz,121,0,39.1328,a8w8_bpreshuffle_256x64x128x256_16x16_16x16_16x16x1_16x16x1_1x16x1x16_8x8x1_1x2_intrawave_v3,2469.46,1038.32,0
80,128,11264,1536,torch.float8_e4m3fnuz,85,0,26.4316,a8w8_bpreshuffle_256x64x128x128_16x16_16x16_8x32x1_8x32x1_1x32x1x8_8x8x1_2x1_intrawave_v3,1675.72,771.11,0
80,128,24576,1536,torch.float8_e4m3fnuz,85,0,42.5762,a8w8_bpreshuffle_256x64x128x128_16x16_16x16_8x32x1_8x32x1_1x32x1x8_8x8x1_2x1_intrawave_v3,2269.74,1039.00,0
80,160,2112,7168,torch.float8_e4m3fnuz,115,0,28.9398,a8w8_bpreshuffle_256x80x64x256_16x16_16x16_16x16x1_16x16x1_1x16x1x16_4x4x1_1x1_intrawave_v3,1673.96,586.10,0
80,160,3072,1536,torch.float8_e4m3fnuz,112,0,11.4913,a8w8_bpreshuffle_256x32x64x256_16x16_16x16_16x16x1_16x16x1_1x32x1x8_8x8x1_2x1_intrawave_v1,1313.99,517.56,0
80,160,7168,2048,torch.float8_e4m3fnuz,119,0,25.3574,a8w8_bpreshuffle_256x32x128x256_16x16_16x16_16x16x1_16x16x1_1x16x1x16_8x8x1_1x2_intrawave_v1,1852.56,682.31,0
80,160,7168,16384,torch.float8_e4m3fnuz,136,0,150.746,a8w8_bpreshuffle_256x80x256x256_16x16_16x16_16x16x1_16x16x1_1x16x1x16_8x8x1_1x2_intrawave_v3,2493.00,811.67,0
80,160,24576,1536,torch.float8_e4m3fnuz,93,0,55.5159,a8w8_bpreshuffle_256x64x192x128_16x16_16x16_8x32x1_8x32x1_1x32x1x8_8x8x1_2x1_intrawave_v3,2175.88,826.05,0
80,192,1280,8192,torch.float8_e4m3fnuz,113,0,24.3731,a8w8_bpreshuffle_256x48x64x256_16x16_16x16_16x16x1_16x16x1_1x16x1x16_4x4x1_1x1_intrawave_v1,1652.04,514.92,0
80,192,2112,7168,torch.float8_e4m3fnuz,126,0,32.1086,a8w8_bpreshuffle_256x32x192x256_16x16_16x16_16x16x1_16x16x1_1x32x1x8_8x8x1_2x1_intrawave_v1,1810.51,539.61,0
80,192,2240,7168,torch.float8_e4m3fnuz,113,0,32.2862,a8w8_bpreshuffle_256x48x64x256_16x16_16x16_16x16x1_16x16x1_1x16x1x16_4x4x1_1x1_intrawave_v1,1909.68,566.58,0
80,192,3072,1536,torch.float8_e4m3fnuz,119,0,12.4325,a8w8_bpreshuffle_256x32x128x256_16x16_16x16_16x16x1_16x16x1_1x16x1x16_8x8x1_1x2_intrawave_v1,1457.42,498.14,0
80,192,7168,2048,torch.float8_e4m3fnuz,120,0,28.1354,a8w8_bpreshuffle_256x48x128x256_16x16_16x16_16x16x1_16x16x1_1x16x1x16_8x8x1_1x2_intrawave_v1,2003.58,633.57,0
80,192,7168,16384,torch.float8_e4m3fnuz,120,0,162.2601,a8w8_bpreshuffle_256x48x128x256_16x16_16x16_16x16x1_16x16x1_1x16x1x16_8x8x1_1x2_intrawave_v1,2779.31,760.13,0
80,192,8192,1024,torch.float8_e4m3fnuz,85,0,18.7963,a8w8_bpreshuffle_256x64x128x128_16x16_16x16_8x32x1_8x32x1_1x32x1x8_8x8x1_2x1_intrawave_v3,1713.76,624.11,0
80,192,11264,1536,torch.float8_e4m3fnuz,85,0,31.3634,a8w8_bpreshuffle_256x64x128x128_16x16_16x16_8x32x1_8x32x1_1x32x1x8_8x8x1_2x1_intrawave_v3,2118.32,698.96,0
80,192,24576,1536,torch.float8_e4m3fnuz,93,0,55.8139,a8w8_bpreshuffle_256x64x192x128_16x16_16x16_8x32x1_8x32x1_1x32x1x8_8x8x1_2x1_intrawave_v3,2597.12,850.70,0
80,224,2112,7168,torch.float8_e4m3fnuz,126,0,32.5198,a8w8_bpreshuffle_256x32x192x256_16x16_16x16_16x16x1_16x16x1_1x32x1x8_8x8x1_2x1_intrawave_v1,2085.56,544.00,0
80,224,3072,1536,torch.float8_e4m3fnuz,113,0,14.6673,a8w8_bpreshuffle_256x48x64x256_16x16_16x16_16x16x1_16x16x1_1x16x1x16_4x4x1_1x1_intrawave_v1,1441.25,439.00,0
80,224,7168,2048,torch.float8_e4m3fnuz,85,0,30.5218,a8w8_bpreshuffle_256x64x128x128_16x16_16x16_8x32x1_8x32x1_1x32x1x8_8x8x1_2x1_intrawave_v3,2154.74,601.21,0
80,224,7168,16384,torch.float8_e4m3fnuz,85,0,185.5598,a8w8_bpreshuffle_256x64x128x128_16x16_16x16_8x32x1_8x32x1_1x32x1x8_8x8x1_2x1_intrawave_v3,2835.39,669.98,0
80,224,24576,1536,torch.float8_e4m3fnuz,85,0,71.3416,a8w8_bpreshuffle_256x64x128x128_16x16_16x16_8x32x1_8x32x1_1x32x1x8_8x8x1_2x1_intrawave_v3,2370.49,688.28,0
80,256,512,7168,torch.float8_e4m3fnuz,6,0,17.5859,a8w8_bpreshuffle_256x16x128x512_16x16_16x16_32x8x1_32x8x1_1x16x1x16_8x8x1_1x2_intrawave_v1,1068.50,327.94,0
80,256,576,7168,torch.float8_e4m3fnuz,112,0,18.3779,a8w8_bpreshuffle_256x32x64x256_16x16_16x16_16x16x1_16x16x1_1x32x1x8_8x8x1_2x1_intrawave_v1,1150.26,340.56,0
80,256,1280,8192,torch.float8_e4m3fnuz,114,0,26.7743,a8w8_bpreshuffle_256x64x64x256_16x16_16x16_16x16x1_16x16x1_1x32x1x8_8x8x1_2x1_intrawave_v3,2005.17,494.44,0
80,256,1536,7168,torch.float8_e4m3fnuz,120,0,31.1851,a8w8_bpreshuffle_256x48x128x256_16x16_16x16_16x16x1_16x16x1_1x16x1x16_8x8x1_1x2_intrawave_v1,1807.64,437.12,0
80,256,2112,7168,torch.float8_e4m3fnuz,114,0,37.3908,a8w8_bpreshuffle_256x64x64x256_16x16_16x16_16x16x1_16x16x1_1x32x1x8_8x8x1_2x1_intrawave_v3,2072.99,482.88,0
80,256,2240,7168,torch.float8_e4m3fnuz,114,0,37.1525,a8w8_bpreshuffle_256x64x64x256_16x16_16x16_16x16x1_16x16x1_1x32x1x8_8x8x1_2x1_intrawave_v3,2212.73,512.43,0
80,256,3072,1536,torch.float8_e4m3fnuz,120,0,16.0983,a8w8_bpreshuffle_256x48x128x256_16x16_16x16_16x16x1_16x16x1_1x16x1x16_8x8x1_1x2_intrawave_v1,1500.73,415.24,0
80,256,4096,512,torch.float8_e4m3fnuz,76,0,10.9814,a8w8_bpreshuffle_256x32x64x128_16x16_16x16_8x32x1_8x32x1_1x32x1x8_8x8x1_2x1_intrawave_v1,977.78,393.88,0
80,256,4608,4096,torch.float8_e4m3fnuz,85,0,37.982,a8w8_bpreshuffle_256x64x128x128_16x16_16x16_8x32x1_8x32x1_1x32x1x8_8x8x1_2x1_intrawave_v3,2544.28,586.65,0
80,256,4608,7168,torch.float8_e4m3fnuz,121,0,62.2609,a8w8_bpreshuffle_256x64x128x256_16x16_16x16_16x16x1_16x16x1_1x16x1x16_8x8x1_1x2_intrawave_v3,2716.22,597.88,0
80,256,7168,256,torch.float8_e4m3fnuz,73,0,11.5078,a8w8_bpreshuffle_256x32x256x64_16x16_16x16_4x32x1_4x64x1_1x32x1x8_8x8x1_2x1_intrawave_v1,816.42,484.07,0
80,256,7168,2048,torch.float8_e4m3fnuz,85,0,30.5235,a8w8_bpreshuffle_256x64x128x128_16x16_16x16_8x32x1_8x32x1_1x32x1x8_8x8x1_2x1_intrawave_v3,2462.43,618.36,0
80,256,7168,2304,torch.float8_e4m3fnuz,85,0,32.0436,a8w8_bpreshuffle_256x64x128x128_16x16_16x16_8x32x1_8x32x1_1x32x1x8_8x8x1_2x1_intrawave_v3,2638.82,648.33,0
80,256,7168,16384,torch.float8_e4m3fnuz,85,0,186.0958,a8w8_bpreshuffle_256x64x128x128_16x16_16x16_8x32x1_8x32x1_1x32x1x8_8x8x1_2x1_intrawave_v3,3231.11,673.34,0
80,256,8192,1024,torch.float8_e4m3fnuz,70,0,23.9267,a8w8_bpreshuffle_256x128x128x128_16x16_16x16_8x32x1_8x32x1_1x32x1x8_8x8x1_2x1_intrawave_v3,1795.05,536.85,0
80,256,9216,4096,torch.float8_e4m3fnuz,70,0,64.6741,a8w8_bpreshuffle_256x128x128x128_16x16_16x16_8x32x1_8x32x1_1x32x1x8_8x8x1_2x1_intrawave_v3,2988.42,672.85,0
80,256,11264,1536,torch.float8_e4m3fnuz,85,0,41.1,a8w8_bpreshuffle_256x64x128x128_16x16_16x16_8x32x1_8x32x1_1x32x1x8_8x8x1_2x1_intrawave_v3,2155.32,570.85,0
80,256,24576,1536,torch.float8_e4m3fnuz,85,0,72.5312,a8w8_bpreshuffle_256x64x128x128_16x16_16x16_8x32x1_8x32x1_1x32x1x8_8x8x1_2x1_intrawave_v3,2664.70,699.35,0
80,288,2112,7168,torch.float8_e4m3fnuz,113,0,44.2402,a8w8_bpreshuffle_256x48x64x256_16x16_16x16_16x16x1_16x16x1_1x16x1x16_4x4x1_1x1_intrawave_v1,1971.05,416.36,0
80,288,3072,1536,torch.float8_e4m3fnuz,120,0,16.2173,a8w8_bpreshuffle_256x48x128x256_16x16_16x16_16x16x1_16x16x1_1x16x1x16_8x8x1_1x2_intrawave_v1,1675.93,427.35,0
80,288,7168,2048,torch.float8_e4m3fnuz,85,0,38.1402,a8w8_bpreshuffle_256x64x128x128_16x16_16x16_8x32x1_8x32x1_1x32x1x8_8x8x1_2x1_intrawave_v3,2217.01,508.61,0
80,288,7168,16384,torch.float8_e4m3fnuz,85,0,243.1421,a8w8_bpreshuffle_256x64x128x128_16x16_16x16_8x32x1_8x32x1_1x32x1x8_8x8x1_2x1_intrawave_v3,2782.15,519.40,0
80,288,24576,1536,torch.float8_e4m3fnuz,94,0,79.4368,a8w8_bpreshuffle_256x96x192x128_16x16_16x16_8x32x1_8x32x1_1x32x1x8_8x8x1_2x1_intrawave_v3,2737.18,658.98,0
80,320,1280,8192,torch.float8_e4m3fnuz,115,0,32.2959,a8w8_bpreshuffle_256x80x64x256_16x16_16x16_16x16x1_16x16x1_1x16x1x16_4x4x1_1x1_intrawave_v3,2077.94,431.21,0
80,320,2112,7168,torch.float8_e4m3fnuz,113,0,45.9122,a8w8_bpreshuffle_256x48x64x256_16x16_16x16_16x16x1_16x16x1_1x16x1x16_4x4x1_1x1_intrawave_v1,2110.30,409.13,0
80,320,3072,1536,torch.float8_e4m3fnuz,119,0,16.7997,a8w8_bpreshuffle_256x32x128x256_16x16_16x16_16x16x1_16x16x1_1x16x1x16_8x8x1_1x2_intrawave_v1,1797.59,427.16,0
80,320,7168,2048,torch.float8_e4m3fnuz,85,0,38.8094,a8w8_bpreshuffle_256x64x128x128_16x16_16x16_8x32x1_8x32x1_1x32x1x8_8x8x1_2x1_intrawave_v3,2420.87,513.35,0
80,320,7168,16384,torch.float8_e4m3fnuz,101,0,239.9889,a8w8_bpreshuffle_256x64x256x128_16x16_16x16_8x32x1_8x32x1_1x32x1x8_8x8x1_2x1_intrawave_v3,3131.89,530.32,0
80,320,8192,1024,torch.float8_e4m3fnuz,85,0,24.7583,a8w8_bpreshuffle_256x64x128x128_16x16_16x16_8x32x1_8x32x1_1x32x1x8_8x8x1_2x1_intrawave_v3,2168.45,563.82,0
80,320,24576,1536,torch.float8_e4m3fnuz,93,0,84.1633,a8w8_bpreshuffle_256x64x192x128_16x16_16x16_8x32x1_8x32x1_1x32x1x8_8x8x1_2x1_intrawave_v3,2870.51,641.24,0
80,352,2112,7168,torch.float8_e4m3fnuz,128,0,49.7251,a8w8_bpreshuffle_256x64x192x256_16x16_16x16_16x16x1_16x16x1_1x32x1x8_8x8x1_2x1_intrawave_v3,2143.33,385.09,0
80,352,3072,1536,torch.float8_e4m3fnuz,85,0,18.9609,a8w8_bpreshuffle_256x64x128x128_16x16_16x16_8x32x1_8x32x1_1x32x1x8_8x8x1_2x1_intrawave_v3,1751.97,391.43,0
80,352,7168,2048,torch.float8_e4m3fnuz,100,0,45.5887,a8w8_bpreshuffle_256x32x256x128_16x16_16x16_8x32x1_8x32x1_1x32x1x8_8x8x1_2x1_intrawave_v1,2266.96,448.52,0
80,352,7168,16384,torch.float8_e4m3fnuz,86,0,289.7112,a8w8_bpreshuffle_256x96x128x128_16x16_16x16_8x32x1_8x32x1_1x32x1x8_8x8x1_2x1_intrawave_v3,2853.81,442.70,0
80,352,24576,1536,torch.float8_e4m3fnuz,93,0,101.4118,a8w8_bpreshuffle_256x64x192x128_16x16_16x16_8x32x1_8x32x1_1x32x1x8_8x8x1_2x1_intrawave_v3,2620.51,548.17,0
80,384,2112,7168,torch.float8_e4m3fnuz,128,0,47.5375,a8w8_bpreshuffle_256x64x192x256_16x16_16x16_16x16x1_16x16x1_1x32x1x8_8x8x1_2x1_intrawave_v3,2445.78,410.48,0
80,384,3072,1536,torch.float8_e4m3fnuz,85,0,18.7893,a8w8_bpreshuffle_256x64x128x128_16x16_16x16_8x32x1_8x32x1_1x32x1x8_8x8x1_2x1_intrawave_v3,1928.69,408.09,0
80,384,7168,2048,torch.float8_e4m3fnuz,86,0,45.0074,a8w8_bpreshuffle_256x96x128x128_16x16_16x16_8x32x1_8x32x1_1x32x1x8_8x8x1_2x1_intrawave_v3,2504.99,465.96,0
80,384,7168,16384,torch.float8_e4m3fnuz,86,0,268.8438,a8w8_bpreshuffle_256x96x128x128_16x16_16x16_8x32x1_8x32x1_1x32x1x8_8x8x1_2x1_intrawave_v3,3354.90,480.71,0
80,384,24576,1536,torch.float8_e4m3fnuz,93,0,99.8625,a8w8_bpreshuffle_256x64x192x128_16x16_16x16_8x32x1_8x32x1_1x32x1x8_8x8x1_2x1_intrawave_v3,2903.09,572.92,0
80,512,512,7168,torch.float8_e4m3fnuz,119,0,23.6639,a8w8_bpreshuffle_256x32x128x256_16x16_16x16_16x16x1_16x16x1_1x16x1x16_8x8x1_1x2_intrawave_v1,1588.11,332.33,0
80,512,576,7168,torch.float8_e4m3fnuz,114,0,23.9199,a8w8_bpreshuffle_256x64x64x256_16x16_16x16_16x16x1_16x16x1_1x32x1x8_8x8x1_2x1_intrawave_v3,1767.51,350.70,0
80,512,1280,8192,torch.float8_e4m3fnuz,114,0,42.3216,a8w8_bpreshuffle_256x64x64x256_16x16_16x16_16x16x1_16x16x1_1x32x1x8_8x8x1_2x1_intrawave_v3,2537.10,377.84,0
80,512,1536,7168,torch.float8_e4m3fnuz,128,0,47.65,a8w8_bpreshuffle_256x64x192x256_16x16_16x16_16x16x1_16x16x1_1x32x1x8_8x8x1_2x1_intrawave_v3,2366.06,341.09,0
80,512,2112,7168,torch.float8_e4m3fnuz,129,0,60.4509,a8w8_bpreshuffle_256x80x192x256_16x16_16x16_16x16x1_16x16x1_1x16x1x16_4x4x1_1x1_intrawave_v3,2564.42,346.92,0
80,512,2240,7168,torch.float8_e4m3fnuz,62,0,66.3638,a8w8_bpreshuffle_256x128x64x128_16x16_16x16_8x32x1_8x32x1_1x32x1x8_8x8x1_2x1_intrawave_v3,2477.51,331.81,0
80,512,3072,1536,torch.float8_e4m3fnuz,85,0,24.3751,a8w8_bpreshuffle_256x64x128x128_16x16_16x16_8x32x1_8x32x1_1x32x1x8_8x8x1_2x1_intrawave_v3,1982.28,354.90,0
80,512,4096,512,torch.float8_e4m3fnuz,85,0,15.7231,a8w8_bpreshuffle_256x64x128x128_16x16_16x16_8x32x1_8x32x1_1x32x1x8_8x8x1_2x1_intrawave_v3,1365.81,416.81,0
80,512,4608,7168,torch.float8_e4m3fnuz,70,0,105.5819,a8w8_bpreshuffle_256x128x128x128_16x16_16x16_8x32x1_8x32x1_1x32x1x8_8x8x1_2x1_intrawave_v3,3203.47,392.29,0
80,512,7168,256,torch.float8_e4m3fnuz,72,0,16.1951,a8w8_bpreshuffle_256x64x256x64_16x16_16x16_4x64x1_4x64x1_1x16x1x16_8x8x1_1x2_intrawave_v1,1160.26,574.63,0
80,512,7168,2048,torch.float8_e4m3fnuz,71,0,53.438,a8w8_bpreshuffle_256x128x128x64_16x16_16x16_4x64x1_4x64x1_1x32x1x8_8x8x1_2x1_intrawave_v3,2813.05,431.69,0
80,512,7168,2304,torch.float8_e4m3fnuz,72,0,57.4769,a8w8_bpreshuffle_256x64x256x64_16x16_16x16_4x64x1_4x64x1_1x16x1x16_8x8x1_1x2_intrawave_v1,2942.30,435.56,0
80,512,8192,1024,torch.float8_e4m3fnuz,85,0,37.882,a8w8_bpreshuffle_256x64x128x128_16x16_16x16_8x32x1_8x32x1_1x32x1x8_8x8x1_2x1_intrawave_v3,2267.55,456.72,0
80,512,11264,1536,torch.float8_e4m3fnuz,85,0,63.9678,a8w8_bpreshuffle_256x64x128x128_16x16_16x16_8x32x1_8x32x1_1x32x1x8_8x8x1_2x1_intrawave_v3,2769.63,463.08,0
80,1024,512,7168,torch.float8_e4m3fnuz,114,0,36.6616,a8w8_bpreshuffle_256x64x64x256_16x16_16x16_16x16x1_16x16x1_1x32x1x8_8x8x1_2x1_intrawave_v3,2050.15,328.92,0
80,1024,576,7168,torch.float8_e4m3fnuz,114,0,37.1872,a8w8_bpreshuffle_256x64x64x256_16x16_16x16_16x16x1_16x16x1_1x32x1x8_8x8x1_2x1_intrawave_v3,2273.82,340.13,0
80,1024,1280,8192,torch.float8_e4m3fnuz,85,0,68.1209,a8w8_bpreshuffle_256x64x128x128_16x16_16x16_8x32x1_8x32x1_1x32x1x8_8x8x1_2x1_intrawave_v3,3152.46,315.55,0
80,1024,1536,7168,torch.float8_e4m3fnuz,136,0,74.0965,a8w8_bpreshuffle_256x80x256x256_16x16_16x16_16x16x1_16x16x1_1x16x1x16_8x8x1_1x2_intrawave_v3,3043.14,290.11,0
80,1024,2112,7168,torch.float8_e4m3fnuz,93,0,115.8099,a8w8_bpreshuffle_256x64x192x128_16x16_16x16_8x32x1_8x32x1_1x32x1x8_8x8x1_2x1_intrawave_v3,2677.17,231.45,0
80,1024,2240,7168,torch.float8_e4m3fnuz,114,0,120.7469,a8w8_bpreshuffle_256x64x64x256_16x16_16x16_16x16x1_16x16x1_1x32x1x8_8x8x1_2x1_intrawave_v3,2723.33,231.76,0
80,1024,3072,1536,torch.float8_e4m3fnuz,85,0,38.8336,a8w8_bpreshuffle_256x64x128x128_16x16_16x16_8x32x1_8x32x1_1x32x1x8_8x8x1_2x1_intrawave_v3,2488.48,324.02,0
80,1024,4096,512,torch.float8_e4m3fnuz,85,0,24.9039,a8w8_bpreshuffle_256x64x128x128_16x16_16x16_8x32x1_8x32x1_1x32x1x8_8x8x1_2x1_intrawave_v3,1724.62,442.10,0
80,1024,4608,4096,torch.float8_e4m3fnuz,71,0,120.44,a8w8_bpreshuffle_256x128x128x64_16x16_16x16_4x64x1_4x64x1_1x32x1x8_8x8x1_2x1_intrawave_v3,3209.46,269.89,0
80,1024,4608,7168,torch.float8_e4m3fnuz,93,0,189.1551,a8w8_bpreshuffle_256x64x192x128_16x16_16x16_8x32x1_8x32x1_1x32x1x8_8x8x1_2x1_intrawave_v3,3576.20,263.31,0
80,1024,7168,256,torch.float8_e4m3fnuz,71,0,27.7779,a8w8_bpreshuffle_256x128x128x64_16x16_16x16_4x64x1_4x64x1_1x32x1x8_8x8x1_2x1_intrawave_v3,1352.91,603.98,0
80,1024,7168,2048,torch.float8_e4m3fnuz,71,0,98.0567,a8w8_bpreshuffle_256x128x128x64_16x16_16x16_4x64x1_4x64x1_1x32x1x8_8x8x1_2x1_intrawave_v3,3066.06,320.81,0
80,1024,7168,2304,torch.float8_e4m3fnuz,85,0,107.3839,a8w8_bpreshuffle_256x64x128x128_16x16_16x16_8x32x1_8x32x1_1x32x1x8_8x8x1_2x1_intrawave_v3,3149.71,312.47,0
80,1024,8192,1024,torch.float8_e4m3fnuz,71,0,67.0889,a8w8_bpreshuffle_256x128x128x64_16x16_16x16_4x64x1_4x64x1_1x32x1x8_8x8x1_2x1_intrawave_v3,2560.76,390.74,0
80,1024,9216,4096,torch.float8_e4m3fnuz,93,0,219.0276,a8w8_bpreshuffle_256x64x192x128_16x16_16x16_8x32x1_8x32x1_1x32x1x8_8x8x1_2x1_intrawave_v3,3529.67,277.67,0
80,1024,11264,1536,torch.float8_e4m3fnuz,85,0,116.8538,a8w8_bpreshuffle_256x64x128x128_16x16_16x16_8x32x1_8x32x1_1x32x1x8_8x8x1_2x1_intrawave_v3,3032.29,358.94,0
80,1536,512,7168,torch.float8_e4m3fnuz,120,0,48.0728,a8w8_bpreshuffle_256x48x128x256_16x16_16x16_16x16x1_16x16x1_1x16x1x16_8x8x1_1x2_intrawave_v1,2345.25,338.09,0
80,1536,576,7168,torch.float8_e4m3fnuz,128,0,47.2304,a8w8_bpreshuffle_256x64x192x256_16x16_16x16_16x16x1_16x16x1_1x32x1x8_8x8x1_2x1_intrawave_v3,2685.47,358.00,0
80,1536,1536,7168,torch.float8_e4m3fnuz,0,0,105.4423,a8w8_bpreshuffle_256x128x128x128_16x16_16x16_8x32x1_8x32x1_1x32x1x8_8x8x1_2x1_intrawave_v3,3207.71,253.59,0
80,1536,2112,7168,torch.float8_e4m3fnuz,68,0,148.9129,a8w8_bpreshuffle_256x128x192x128_16x16_16x16_8x32x1_8x32x1_1x32x1x8_8x8x1_2x1_intrawave_v3,3123.06,219.17,0
80,1536,2240,7168,torch.float8_e4m3fnuz,48,0,177.0619,a8w8_bpreshuffle_256x192x224x128_16x16_16x16_8x32x1_8x32x1_1x64x1x4_8x8x1_2x1_intrawave_v3,2785.75,191.73,0
80,1536,3072,1536,torch.float8_e4m3fnuz,93,0,51.4668,a8w8_bpreshuffle_256x64x192x128_16x16_16x16_8x32x1_8x32x1_1x32x1x8_8x8x1_2x1_intrawave_v3,2816.48,320.89,0
80,1536,4096,512,torch.float8_e4m3fnuz,85,0,33.2015,a8w8_bpreshuffle_256x64x128x128_16x16_16x16_8x32x1_8x32x1_1x32x1x8_8x8x1_2x1_intrawave_v3,1940.41,465.84,0
80,1536,4608,7168,torch.float8_e4m3fnuz,85,0,279.9019,a8w8_bpreshuffle_256x64x128x128_16x16_16x16_8x32x1_8x32x1_1x32x1x8_8x8x1_2x1_intrawave_v3,3625.15,207.92,0
80,1536,7168,256,torch.float8_e4m3fnuz,71,0,37.3284,a8w8_bpreshuffle_256x128x128x64_16x16_16x16_4x64x1_4x64x1_1x32x1x8_8x8x1_2x1_intrawave_v3,1510.15,649.59,0
80,1536,7168,2048,torch.float8_e4m3fnuz,85,0,138.0452,a8w8_bpreshuffle_256x64x128x128_16x16_16x16_8x32x1_8x32x1_1x32x1x8_8x8x1_2x1_intrawave_v3,3266.84,288.64,0
80,1536,7168,2304,torch.float8_e4m3fnuz,85,0,150.2725,a8w8_bpreshuffle_256x64x128x128_16x16_16x16_8x32x1_8x32x1_1x32x1x8_8x8x1_2x1_intrawave_v3,3376.15,279.99,0
80,1536,11264,1536,torch.float8_e4m3fnuz,85,0,168.9501,a8w8_bpreshuffle_256x64x128x128_16x16_16x16_8x32x1_8x32x1_1x32x1x8_8x8x1_2x1_intrawave_v3,3145.91,321.18,0
80,2048,512,7168,torch.float8_e4m3fnuz,85,0,58.1113,a8w8_bpreshuffle_256x64x128x128_16x16_16x16_8x32x1_8x32x1_1x32x1x8_8x8x1_2x1_intrawave_v3,2586.83,351.86,0
80,2048,576,7168,torch.float8_e4m3fnuz,129,0,60.7837,a8w8_bpreshuffle_256x80x192x256_16x16_16x16_16x16x1_16x16x1_1x16x1x16_4x4x1_1x1_intrawave_v3,2782.23,348.25,0
80,2048,1280,8192,torch.float8_e4m3fnuz,0,0,119.2848,a8w8_bpreshuffle_256x128x128x128_16x16_16x16_8x32x1_8x32x1_1x32x1x8_8x8x1_2x1_intrawave_v3,3600.60,272.51,0
80,2048,1536,7168,torch.float8_e4m3fnuz,85,0,138.8692,a8w8_bpreshuffle_256x64x128x128_16x16_16x16_8x32x1_8x32x1_1x32x1x8_8x8x1_2x1_intrawave_v3,3247.46,230.30,0
80,2048,2112,7168,torch.float8_e4m3fnuz,93,0,186.5271,a8w8_bpreshuffle_256x64x192x128_16x16_16x16_8x32x1_8x32x1_1x32x1x8_8x8x1_2x1_intrawave_v3,3324.37,206.24,0
80,2048,2240,7168,torch.float8_e4m3fnuz,79,0,230.9106,a8w8_bpreshuffle_256x128x64x128_16x16_16x16_8x32x1_8x32x1_1x16x1x16_4x4x1_1x1_intrawave_v3,2848.14,172.84,0
80,2048,3072,1536,torch.float8_e4m3fnuz,72,0,69.8541,a8w8_bpreshuffle_256x64x256x64_16x16_16x16_4x64x1_4x64x1_1x16x1x16_8x8x1_1x2_intrawave_v1,2766.82,292.71,0
80,2048,4096,512,torch.float8_e4m3fnuz,71,0,43.6672,a8w8_bpreshuffle_256x128x128x64_16x16_16x16_4x64x1_4x64x1_1x32x1x8_8x8x1_2x1_intrawave_v3,1967.14,456.25,0
80,2048,4608,4096,torch.float8_e4m3fnuz,68,0,218.9032,a8w8_bpreshuffle_256x128x192x128_16x16_16x16_8x32x1_8x32x1_1x32x1x8_8x8x1_2x1_intrawave_v3,3531.67,210.77,0
80,2048,4608,7168,torch.float8_e4m3fnuz,93,0,366.0791,a8w8_bpreshuffle_256x64x192x128_16x16_16x16_8x32x1_8x32x1_1x32x1x8_8x8x1_2x1_intrawave_v3,3695.69,181.89,0
80,2048,7168,256,torch.float8_e4m3fnuz,71,0,48.0096,a8w8_bpreshuffle_256x128x128x64_16x16_16x16_4x64x1_4x64x1_1x32x1x8_8x8x1_2x1_intrawave_v3,1565.56,660.69,0
80,2048,7168,2048,torch.float8_e4m3fnuz,85,0,186.7051,a8w8_bpreshuffle_256x64x128x128_16x16_16x16_8x32x1_8x32x1_1x32x1x8_8x8x1_2x1_intrawave_v3,3220.56,258.35,0
80,2048,7168,2304,torch.float8_e4m3fnuz,85,0,199.0359,a8w8_bpreshuffle_256x64x128x128_16x16_16x16_8x32x1_8x32x1_1x32x1x8_8x8x1_2x1_intrawave_v3,3398.67,254.19,0
80,2048,8192,1024,torch.float8_e4m3fnuz,71,0,120.4715,a8w8_bpreshuffle_256x128x128x64_16x16_16x16_4x64x1_4x64x1_1x32x1x8_8x8x1_2x1_intrawave_v3,2852.11,365.57,0
80,2048,9216,4096,torch.float8_e4m3fnuz,68,0,425.2314,a8w8_bpreshuffle_256x128x192x128_16x16_16x16_8x32x1_8x32x1_1x32x1x8_8x8x1_2x1_intrawave_v3,3636.11,197.27,0
80,2048,11264,1536,torch.float8_e4m3fnuz,71,0,217.6677,a8w8_bpreshuffle_256x128x128x64_16x16_16x16_4x64x1_4x64x1_1x32x1x8_8x8x1_2x1_intrawave_v3,3255.74,305.90,0
80,4096,512,7168,torch.float8_e4m3fnuz,85,0,101.7067,a8w8_bpreshuffle_256x64x128x128_16x16_16x16_8x32x1_8x32x1_1x32x1x8_8x8x1_2x1_intrawave_v3,2956.03,366.00,0
80,4096,576,7168,torch.float8_e4m3fnuz,93,0,113.3711,a8w8_bpreshuffle_256x64x192x128_16x16_16x16_8x32x1_8x32x1_1x32x1x8_8x8x1_2x1_intrawave_v3,2983.38,337.01,0
80,4096,1280,8192,torch.float8_e4m3fnuz,71,0,234.5689,a8w8_bpreshuffle_256x128x128x64_16x16_16x16_4x64x1_4x64x1_1x32x1x8_8x8x1_2x1_intrawave_v3,3662.01,232.45,0
80,4096,1536,7168,torch.float8_e4m3fnuz,85,0,256.917,a8w8_bpreshuffle_256x64x128x128_16x16_16x16_8x32x1_8x32x1_1x32x1x8_8x8x1_2x1_intrawave_v3,3510.64,206.11,0
80,4096,2112,7168,torch.float8_e4m3fnuz,93,0,329.2957,a8w8_bpreshuffle_256x64x192x128_16x16_16x16_8x32x1_8x32x1_1x32x1x8_8x8x1_2x1_intrawave_v3,3766.13,187.67,0
80,4096,2240,7168,torch.float8_e4m3fnuz,69,0,437.1832,a8w8_bpreshuffle_256x128x160x128_16x16_16x16_8x32x1_8x32x1_1x64x1x4_8x8x1_2x1_intrawave_v3,3008.66,145.86,0
80,4096,3072,1536,torch.float8_e4m3fnuz,93,0,123.6652,a8w8_bpreshuffle_256x64x192x128_16x16_16x16_8x32x1_8x32x1_1x32x1x8_8x8x1_2x1_intrawave_v3,3125.75,292.53,0
80,4096,4096,512,torch.float8_e4m3fnuz,71,0,75.7421,a8w8_bpreshuffle_256x128x128x64_16x16_16x16_4x64x1_4x64x1_1x32x1x8_8x8x1_2x1_intrawave_v3,2268.21,498.39,0
80,4096,4608,4096,torch.float8_e4m3fnuz,85,0,420.6946,a8w8_bpreshuffle_256x64x128x128_16x16_16x16_8x32x1_8x32x1_1x32x1x8_8x8x1_2x1_intrawave_v3,3675.32,174.47,0
80,4096,4608,7168,torch.float8_e4m3fnuz,85,0,715.7879,a8w8_bpreshuffle_256x64x128x128_16x16_16x16_8x32x1_8x32x1_1x32x1x8_8x8x1_2x1_intrawave_v3,3780.21,139.90,0
80,4096,7168,256,torch.float8_e4m3fnuz,71,0,85.7258,a8w8_bpreshuffle_256x128x128x64_16x16_16x16_4x64x1_4x64x1_1x32x1x8_8x8x1_2x1_intrawave_v3,1753.54,718.61,0
80,4096,7168,2048,torch.float8_e4m3fnuz,71,0,345.3094,a8w8_bpreshuffle_256x128x128x64_16x16_16x16_4x64x1_4x64x1_1x32x1x8_8x8x1_2x1_intrawave_v3,3482.65,236.86,0
80,4096,7168,2304,torch.float8_e4m3fnuz,71,0,379.4759,a8w8_bpreshuffle_256x128x128x64_16x16_16x16_4x64x1_4x64x1_1x32x1x8_8x8x1_2x1_intrawave_v3,3565.22,223.13,0
80,4096,8192,1024,torch.float8_e4m3fnuz,71,0,227.2969,a8w8_bpreshuffle_256x128x128x64_16x16_16x16_4x64x1_4x64x1_1x32x1x8_8x8x1_2x1_intrawave_v3,3023.34,350.61,0
80,4096,9216,4096,torch.float8_e4m3fnuz,71,0,812.5832,a8w8_bpreshuffle_256x128x128x64_16x16_16x16_4x64x1_4x64x1_1x32x1x8_8x8x1_2x1_intrawave_v3,3805.61,160.01,0
80,4096,11264,1536,torch.float8_e4m3fnuz,71,0,417.0421,a8w8_bpreshuffle_256x128x128x64_16x16_16x16_4x64x1_4x64x1_1x32x1x8_8x8x1_2x1_intrawave_v3,3398.55,277.83,0
80,4240,9216,4096,torch.float8_e4m3fnuz,93,0,903.6056,a8w8_bpreshuffle_256x64x192x128_16x16_16x16_8x32x1_8x32x1_1x32x1x8_8x8x1_2x1_intrawave_v3,3542.58,147.48,0
80,8192,512,7168,torch.float8_e4m3fnuz,85,0,195.7643,a8w8_bpreshuffle_256x64x128x128_16x16_16x16_8x32x1_8x32x1_1x32x1x8_8x8x1_2x1_intrawave_v3,3071.53,361.55,0
80,8192,576,7168,torch.float8_e4m3fnuz,93,0,191.4823,a8w8_bpreshuffle_256x64x192x128_16x16_16x16_8x32x1_8x32x1_1x32x1x8_8x8x1_2x1_intrawave_v3,3532.74,377.51,0
80,8192,1280,8192,torch.float8_e4m3fnuz,71,0,452.4299,a8w8_bpreshuffle_256x128x128x64_16x16_16x16_4x64x1_4x64x1_1x32x1x8_8x8x1_2x1_intrawave_v3,3797.24,217.86,0
80,8192,1536,7168,torch.float8_e4m3fnuz,72,0,501.1581,a8w8_bpreshuffle_256x64x256x64_16x16_16x16_4x64x1_4x64x1_1x16x1x16_8x8x1_1x2_intrawave_v1,3599.44,189.35,0
80,8192,2112,7168,torch.float8_e4m3fnuz,68,0,649.3748,a8w8_bpreshuffle_256x128x192x128_16x16_16x16_8x32x1_8x32x1_1x32x1x8_8x8x1_2x1_intrawave_v3,3819.59,167.03,0
80,8192,2240,7168,torch.float8_e4m3fnuz,69,0,857.9718,a8w8_bpreshuffle_256x128x160x128_16x16_16x16_8x32x1_8x32x1_1x64x1x4_8x8x1_2x1_intrawave_v3,3066.15,129.93,0
80,8192,3072,1536,torch.float8_e4m3fnuz,71,0,235.4545,a8w8_bpreshuffle_256x128x128x64_16x16_16x16_4x64x1_4x64x1_1x32x1x8_8x8x1_2x1_intrawave_v3,3283.41,287.25,0
80,8192,4096,512,torch.float8_e4m3fnuz,71,0,140.1016,a8w8_bpreshuffle_256x128x128x64_16x16_16x16_4x64x1_4x64x1_1x32x1x8_8x8x1_2x1_intrawave_v3,2452.49,523.91,0
80,8192,4608,7168,torch.float8_e4m3fnuz,93,0,1405.0902,a8w8_bpreshuffle_256x64x192x128_16x16_16x16_8x32x1_8x32x1_1x32x1x8_8x8x1_2x1_intrawave_v3,3851.47,119.03,0
80,8192,7168,256,torch.float8_e4m3fnuz,71,0,158.8437,a8w8_bpreshuffle_256x128x128x64_16x16_16x16_4x64x1_4x64x1_1x32x1x8_8x8x1_2x1_intrawave_v3,1892.73,764.10,0
80,8192,7168,2048,torch.float8_e4m3fnuz,71,0,665.8308,a8w8_bpreshuffle_256x128x128x64_16x16_16x16_4x64x1_4x64x1_1x32x1x8_8x8x1_2x1_intrawave_v3,3612.30,223.63,0
80,8192,7168,2304,torch.float8_e4m3fnuz,71,0,736.4592,a8w8_bpreshuffle_256x128x128x64_16x16_16x16_4x64x1_4x64x1_1x32x1x8_8x8x1_2x1_intrawave_v3,3674.11,207.52,0
80,8192,8192,1024,torch.float8_e4m3fnuz,71,0,434.801,a8w8_bpreshuffle_256x128x128x64_16x16_16x16_4x64x1_4x64x1_1x32x1x8_8x8x1_2x1_intrawave_v3,3160.96,347.27,0
80,8192,11264,1536,torch.float8_e4m3fnuz,71,0,818.2792,a8w8_bpreshuffle_256x128x128x64_16x16_16x16_4x64x1_4x64x1_1x32x1x8_8x8x1_2x1_intrawave_v3,3464.19,262.05,0
80,16384,512,7168,torch.float8_e4m3fnuz,85,0,354.1062,a8w8_bpreshuffle_256x64x128x128_16x16_16x16_8x32x1_8x32x1_1x32x1x8_8x8x1_2x1_intrawave_v3,3396.13,389.40,0
80,16384,576,7168,torch.float8_e4m3fnuz,68,0,372.1747,a8w8_bpreshuffle_256x128x192x128_16x16_16x16_8x32x1_8x32x1_1x32x1x8_8x8x1_2x1_intrawave_v3,3635.16,377.36,0
80,16384,1280,8192,torch.float8_e4m3fnuz,71,0,902.6619,a8w8_bpreshuffle_256x128x128x64_16x16_16x16_4x64x1_4x64x1_1x32x1x8_8x8x1_2x1_intrawave_v3,3806.49,206.77,0
80,16384,1536,7168,torch.float8_e4m3fnuz,68,0,940.0969,a8w8_bpreshuffle_256x128x192x128_16x16_16x16_8x32x1_8x32x1_1x32x1x8_8x8x1_2x1_intrawave_v3,3837.66,190.17,0
80,16384,2112,7168,torch.float8_e4m3fnuz,93,0,1284.8613,a8w8_bpreshuffle_256x64x192x128_16x16_16x16_8x32x1_8x32x1_1x32x1x8_8x8x1_2x1_intrawave_v3,3860.87,157.05,0
80,16384,2240,7168,torch.float8_e4m3fnuz,69,0,1644.8521,a8w8_bpreshuffle_256x128x160x128_16x16_16x16_8x32x1_8x32x1_1x64x1x4_8x8x1_2x1_intrawave_v3,3198.67,125.78,0
80,16384,3072,1536,torch.float8_e4m3fnuz,71,0,450.9699,a8w8_bpreshuffle_256x128x128x64_16x16_16x16_4x64x1_4x64x1_1x32x1x8_8x8x1_2x1_intrawave_v3,3428.58,289.48,0
80,16384,4096,512,torch.float8_e4m3fnuz,71,0,268.2002,a8w8_bpreshuffle_256x128x128x64_16x16_16x16_4x64x1_4x64x1_1x32x1x8_8x8x1_2x1_intrawave_v3,2562.25,539.54,0
80,16384,4608,4096,torch.float8_e4m3fnuz,93,0,1613.6388,a8w8_bpreshuffle_256x64x192x128_16x16_16x16_8x32x1_8x32x1_1x32x1x8_8x8x1_2x1_intrawave_v3,3832.80,146.86,0
80,16384,4608,7168,torch.float8_e4m3fnuz,93,0,2770.8265,a8w8_bpreshuffle_256x64x192x128_16x16_16x16_8x32x1_8x32x1_1x32x1x8_8x8x1_2x1_intrawave_v3,3906.17,108.80,0
80,16384,7168,256,torch.float8_e4m3fnuz,71,0,306.2344,a8w8_bpreshuffle_256x128x128x64_16x16_16x16_4x64x1_4x64x1_1x32x1x8_8x8x1_2x1_intrawave_v3,1963.51,786.69,0
80,16384,7168,2048,torch.float8_e4m3fnuz,71,0,1322.9659,a8w8_bpreshuffle_256x128x128x64_16x16_16x16_4x64x1_4x64x1_1x32x1x8_8x8x1_2x1_intrawave_v3,3636.04,214.00,0
80,16384,7168,2304,torch.float8_e4m3fnuz,71,0,1464.8949,a8w8_bpreshuffle_256x128x128x64_16x16_16x16_4x64x1_4x64x1_1x32x1x8_8x8x1_2x1_intrawave_v3,3694.23,197.38,0
80,16384,8192,1024,torch.float8_e4m3fnuz,71,0,849.5169,a8w8_bpreshuffle_256x128x128x64_16x16_16x16_4x64x1_4x64x1_1x32x1x8_8x8x1_2x1_intrawave_v3,3235.70,345.61,0
80,16384,9216,4096,torch.float8_e4m3fnuz,71,0,3218.0651,a8w8_bpreshuffle_256x128x128x64_16x16_16x16_4x64x1_4x64x1_1x32x1x8_8x8x1_2x1_intrawave_v3,3843.77,126.43,0
80,16384,11264,1536,torch.float8_e4m3fnuz,72,0,1650.9527,a8w8_bpreshuffle_256x64x256x64_16x16_16x16_4x64x1_4x64x1_1x16x1x16_8x8x1_1x2_intrawave_v1,3433.99,249.29,0
80,20480,512,7168,torch.float8_e4m3fnuz,70,0,411.9813,a8w8_bpreshuffle_256x128x128x128_16x16_16x16_8x32x1_8x32x1_1x32x1x8_8x8x1_2x1_intrawave_v3,3648.80,416.14,0
80,20480,576,7168,torch.float8_e4m3fnuz,68,0,439.759,a8w8_bpreshuffle_256x128x192x128_16x16_16x16_8x32x1_8x32x1_1x32x1x8_8x8x1_2x1_intrawave_v3,3845.61,396.86,0
80,20480,1536,7168,torch.float8_e4m3fnuz,93,0,1157.9543,a8w8_bpreshuffle_256x64x192x128_16x16_16x16_8x32x1_8x32x1_1x32x1x8_8x8x1_2x1_intrawave_v3,3894.55,190.62,0
80,20480,3072,1536,torch.float8_e4m3fnuz,71,0,557.954,a8w8_bpreshuffle_256x128x128x64_16x16_16x16_4x64x1_4x64x1_1x32x1x8_8x8x1_2x1_intrawave_v3,3463.97,290.36,0
80,20480,4096,512,torch.float8_e4m3fnuz,71,0,331.5621,a8w8_bpreshuffle_256x128x128x64_16x16_16x16_4x64x1_4x64x1_1x32x1x8_8x8x1_2x1_intrawave_v3,2590.75,543.96,0
80,20480,4608,7168,torch.float8_e4m3fnuz,68,0,3421.2891,a8w8_bpreshuffle_256x128x192x128_16x16_16x16_8x32x1_8x32x1_1x32x1x8_8x8x1_2x1_intrawave_v3,3954.40,107.73,0
80,20480,7168,256,torch.float8_e4m3fnuz,71,0,381.5807,a8w8_bpreshuffle_256x128x128x64_16x16_16x16_4x64x1_4x64x1_1x32x1x8_8x8x1_2x1_intrawave_v3,1969.75,787.98,0
80,20480,7168,2048,torch.float8_e4m3fnuz,71,0,1639.9077,a8w8_bpreshuffle_256x128x128x64_16x16_16x16_4x64x1_4x64x1_1x32x1x8_8x8x1_2x1_intrawave_v3,3666.64,213.56,0
80,20480,7168,2304,torch.float8_e4m3fnuz,71,0,1805.4245,a8w8_bpreshuffle_256x128x128x64_16x16_16x16_4x64x1_4x64x1_1x32x1x8_8x8x1_2x1_intrawave_v3,3746.80,197.90,0
80,32768,512,7168,torch.float8_e4m3fnuz,70,0,664.7692,a8w8_bpreshuffle_256x128x128x128_16x16_16x16_8x32x1_8x32x1_1x32x1x8_8x8x1_2x1_intrawave_v3,3618.07,409.32,0
80,32768,2112,7168,torch.float8_e4m3fnuz,93,0,2566.2639,a8w8_bpreshuffle_256x64x192x128_16x16_16x16_8x32x1_8x32x1_1x32x1x8_8x8x1_2x1_intrawave_v3,3866.08,151.36,0
80,32768,2240,7168,torch.float8_e4m3fnuz,69,0,3196.032,a8w8_bpreshuffle_256x128x160x128_16x16_16x16_8x32x1_8x32x1_1x64x1x4_8x8x1_2x1_intrawave_v3,3292.42,124.45,0
80,32768,4096,512,torch.float8_e4m3fnuz,71,0,523.3298,a8w8_bpreshuffle_256x128x128x64_16x16_16x16_4x64x1_4x64x1_1x32x1x8_8x8x1_2x1_intrawave_v3,2626.24,549.00,0
80,32768,4608,4096,torch.float8_e4m3fnuz,93,0,3207.2182,a8w8_bpreshuffle_256x64x192x128_16x16_16x16_8x32x1_8x32x1_1x32x1x8_8x8x1_2x1_intrawave_v3,3856.77,141.89,0
80,32768,4608,7168,torch.float8_e4m3fnuz,68,0,5527.6346,a8w8_bpreshuffle_256x128x192x128_16x16_16x16_8x32x1_8x32x1_1x32x1x8_8x8x1_2x1_intrawave_v3,3916.08,103.10,0
80,32768,7168,256,torch.float8_e4m3fnuz,71,0,600.9077,a8w8_bpreshuffle_256x128x128x64_16x16_16x16_4x64x1_4x64x1_1x32x1x8_8x8x1_2x1_intrawave_v3,2001.29,798.77,0
80,32768,7168,2304,torch.float8_e4m3fnuz,71,0,2907.7206,a8w8_bpreshuffle_256x128x128x64_16x16_16x16_4x64x1_4x64x1_1x32x1x8_8x8x1_2x1_intrawave_v3,3722.27,193.20,0
80,32768,9216,4096,torch.float8_e4m3fnuz,68,0,6437.3643,a8w8_bpreshuffle_256x128x192x128_16x16_16x16_8x32x1_8x32x1_1x32x1x8_8x8x1_2x1_intrawave_v3,3843.03,120.54,0
80,32768,11264,1536,torch.float8_e4m3fnuz,72,0,3296.9348,a8w8_bpreshuffle_256x64x256x64_16x16_16x16_4x64x1_4x64x1_1x16x1x16_8x8x1_1x2_intrawave_v1,3439.17,244.42,0
80,49152,2112,7168,torch.float8_e4m3fnuz,93,0,3805.7733,a8w8_bpreshuffle_256x64x192x128_16x16_16x16_8x32x1_8x32x1_1x32x1x8_8x8x1_2x1_intrawave_v3,3910.39,151.11,0
80,49152,2240,7168,torch.float8_e4m3fnuz,69,0,4812.8899,a8w8_bpreshuffle_256x128x160x128_16x16_16x16_8x32x1_8x32x1_1x64x1x4_8x8x1_2x1_intrawave_v3,3279.53,122.29,0
80,49152,11264,1536,torch.float8_e4m3fnuz,71,0,4796.016,a8w8_bpreshuffle_256x128x128x64_16x16_16x16_4x64x1_4x64x1_1x32x1x8_8x8x1_2x1_intrawave_v3,3546.29,250.23,0
80,65536,2112,7168,torch.float8_e4m3fnuz,93,0,5062.5452,a8w8_bpreshuffle_256x64x192x128_16x16_16x16_8x32x1_8x32x1_1x32x1x8_8x8x1_2x1_intrawave_v3,3919.52,150.46,0
80,65536,2240,7168,torch.float8_e4m3fnuz,69,0,6365.1402,a8w8_bpreshuffle_256x128x160x128_16x16_16x16_8x32x1_8x32x1_1x64x1x4_8x8x1_2x1_intrawave_v3,3306.34,122.45,0
80,65536,11264,1536,torch.float8_e4m3fnuz,71,0,6394.7949,a8w8_bpreshuffle_256x128x128x64_16x16_16x16_4x64x1_4x64x1_1x32x1x8_8x8x1_2x1_intrawave_v3,3546.23,249.32,0
80,73728,2112,7168,torch.float8_e4m3fnuz,93,0,5700.3689,a8w8_bpreshuffle_256x64x192x128_16x16_16x16_8x32x1_8x32x1_1x32x1x8_8x8x1_2x1_intrawave_v3,3916.08,150.00,0
80,73728,2240,7168,torch.float8_e4m3fnuz,69,0,7155.8623,a8w8_bpreshuffle_256x128x160x128_16x16_16x16_8x32x1_8x32x1_1x64x1x4_8x8x1_2x1_intrawave_v3,3308.62,122.26,0
80,73728,11264,1536,torch.float8_e4m3fnuz,71,0,7197.2388,a8w8_bpreshuffle_256x128x128x64_16x16_16x16_4x64x1_4x64x1_1x32x1x8_8x8x1_2x1_intrawave_v3,3544.71,248.91,0
80,131072,2112,7168,torch.float8_e4m3fnuz,93,0,10093.2233,a8w8_bpreshuffle_256x64x192x128_16x16_16x16_8x32x1_8x32x1_1x32x1x8_8x8x1_2x1_intrawave_v3,3931.90,149.44,0
80,131072,2240,7168,torch.float8_e4m3fnuz,69,0,12728.0402,a8w8_bpreshuffle_256x128x160x128_16x16_16x16_8x32x1_8x32x1_1x64x1x4_8x8x1_2x1_intrawave_v3,3306.93,121.21,0
80,131072,11264,1536,torch.float8_e4m3fnuz,71,0,12851.8716,a8w8_bpreshuffle_256x128x128x64_16x16_16x16_4x64x1_4x64x1_1x32x1x8_8x8x1_2x1_intrawave_v3,3529.05,246.77,0
80,1,128,7168,torch.float8_e4m3fnuz,25,0,10.735,a8w8_bpreshuffle_256x16x64x512_16x16_16x16_32x8x1_32x8x1_1x16x1x16_4x4x1_1x1_intrawave_v2,0,0,0
80,1,576,7168,torch.float8_e4m3fnuz,10,0,11.2398,a8w8_bpreshuffle_128x16x32x512_16x16_16x16_32x4x1_32x4x1_1x16x1x8_4x4x1_1x1_intrawave_v1,0,0,0
80,1,1536,7168,torch.float8_e4m3fnuz,10,0,11.721,a8w8_bpreshuffle_128x16x32x512_16x16_16x16_32x4x1_32x4x1_1x16x1x8_4x4x1_1x1_intrawave_v1,0,0,0
80,1,3072,1536,torch.float8_e4m3fnuz,5,0,5.6562,a8w8_bpreshuffle_256x16x64x512_16x16_16x16_32x8x1_32x8x1_1x16x1x16_4x4x1_1x1_intrawave_v1,0,0,0
80,1,4096,7168,torch.float8_e4m3fnuz,11,0,13.4343,a8w8_bpreshuffle_256x16x64x512_16x16_16x16_32x8x1_32x8x1_1x16x1x16_4x4x1_1x1_intrawave_v1,0,0,0
80,1,7168,2048,torch.float8_e4m3fnuz,10,0,9.1526,a8w8_bpreshuffle_128x16x32x512_16x16_16x16_32x4x1_32x4x1_1x16x1x8_4x4x1_1x1_intrawave_v1,0,0,0
80,1,7168,16384,torch.float8_e4m3fnuz,24,0,39.678,a8w8_bpreshuffle_128x16x32x512_16x16_16x16_32x4x1_32x4x1_1x16x1x8_4x4x1_1x1_intrawave_v2,0,0,0
80,1,7168,18432,torch.float8_e4m3fnuz,10,0,42.556,a8w8_bpreshuffle_128x16x32x512_16x16_16x16_32x4x1_32x4x1_1x16x1x8_4x4x1_1x1_intrawave_v1,0,0,0
80,1,8192,1536,torch.float8_e4m3fnuz,11,0,7.6538,a8w8_bpreshuffle_256x16x64x512_16x16_16x16_32x8x1_32x8x1_1x16x1x16_4x4x1_1x1_intrawave_v1,0,0,0
80,1,24576,1536,torch.float8_e4m3fnuz,15,0,13.5093,a8w8_bpreshuffle_256x16x64x256_16x16_16x16_16x16x1_16x16x1_1x16x1x16_4x4x1_1x1_intrawave_v1,0,0,0
80,1,32768,512,torch.float8_e4m3fnuz,9,0,9.7066,a8w8_bpreshuffle_128x16x32x128_16x16_16x16_8x16x1_8x16x1_1x16x1x8_4x4x1_1x1_intrawave_v1,0,0,0
80,1,32768,1536,torch.float8_e4m3fnuz,15,0,17.5611,a8w8_bpreshuffle_256x16x64x256_16x16_16x16_16x16x1_16x16x1_1x16x1x16_4x4x1_1x1_intrawave_v1,0,0,0
80,1,36864,7168,torch.float8_e4m3fnuz,6,0,76.2189,a8w8_bpreshuffle_256x16x128x512_16x16_16x16_32x8x1_32x8x1_1x16x1x16_8x8x1_1x2_intrawave_v1,0,0,0
80,2,128,7168,torch.float8_e4m3fnuz,10,0,10.1434,a8w8_bpreshuffle_128x16x32x512_16x16_16x16_32x4x1_32x4x1_1x16x1x8_4x4x1_1x1_intrawave_v1,0,0,0
80,2,512,7168,torch.float8_e4m3fnuz,10,0,11.2907,a8w8_bpreshuffle_128x16x32x512_16x16_16x16_32x4x1_32x4x1_1x16x1x8_4x4x1_1x1_intrawave_v1,0,0,0
80,2,576,7168,torch.float8_e4m3fnuz,10,0,11.5102,a8w8_bpreshuffle_128x16x32x512_16x16_16x16_32x4x1_32x4x1_1x16x1x8_4x4x1_1x1_intrawave_v1,0,0,0
80,2,1536,7168,torch.float8_e4m3fnuz,10,0,12.1679,a8w8_bpreshuffle_128x16x32x512_16x16_16x16_32x4x1_32x4x1_1x16x1x8_4x4x1_1x1_intrawave_v1,0,0,0
80,2,2240,7168,torch.float8_e4m3fnuz,10,0,12.1906,a8w8_bpreshuffle_128x16x32x512_16x16_16x16_32x4x1_32x4x1_1x16x1x8_4x4x1_1x1_intrawave_v1,0,0,0
80,2,3072,1536,torch.float8_e4m3fnuz,11,0,5.911,a8w8_bpreshuffle_256x16x64x512_16x16_16x16_32x8x1_32x8x1_1x16x1x16_4x4x1_1x1_intrawave_v1,0,0,0
80,2,4096,512,torch.float8_e4m3fnuz,23,0,4.4526,a8w8_bpreshuffle_128x16x32x128_16x16_16x16_8x16x1_8x16x1_1x16x1x8_4x4x1_1x1_intrawave_v2,0,0,0
80,2,4096,7168,torch.float8_e4m3fnuz,11,0,13.2939,a8w8_bpreshuffle_256x16x64x512_16x16_16x16_32x8x1_32x8x1_1x16x1x16_4x4x1_1x1_intrawave_v1,0,0,0
80,2,4608,7168,torch.float8_e4m3fnuz,5,0,13.597,a8w8_bpreshuffle_256x16x64x512_16x16_16x16_32x8x1_32x8x1_1x16x1x16_4x4x1_1x1_intrawave_v1,0,0,0
80,2,7168,256,torch.float8_e4m3fnuz,75,0,6.3266,a8w8_bpreshuffle_128x16x256x64_16x16_16x16_4x16x1_4x32x1_1x16x1x8_8x8x1_1x2_intrawave_v1,0,0,0
80,2,7168,2048,torch.float8_e4m3fnuz,5,0,8.5166,a8w8_bpreshuffle_256x16x64x512_16x16_16x16_32x8x1_32x8x1_1x16x1x16_4x4x1_1x1_intrawave_v1,0,0,0
80,2,7168,2304,torch.float8_e4m3fnuz,29,0,9.905,a8w8_bpreshuffle_256x16x64x256_16x16_16x16_16x16x1_16x16x1_1x16x1x16_4x4x1_1x1_intrawave_v2,0,0,0
80,2,7168,16384,torch.float8_e4m3fnuz,10,0,37.3783,a8w8_bpreshuffle_128x16x32x512_16x16_16x16_32x4x1_32x4x1_1x16x1x8_4x4x1_1x1_intrawave_v1,0,0,0
80,2,7168,18432,torch.float8_e4m3fnuz,10,0,42.2924,a8w8_bpreshuffle_128x16x32x512_16x16_16x16_32x4x1_32x4x1_1x16x1x8_4x4x1_1x1_intrawave_v1,0,0,0
80,2,8192,1536,torch.float8_e4m3fnuz,5,0,7.8006,a8w8_bpreshuffle_256x16x64x512_16x16_16x16_32x8x1_32x8x1_1x16x1x16_4x4x1_1x1_intrawave_v1,0,0,0
80,2,11264,1536,torch.float8_e4m3fnuz,15,0,9.4898,a8w8_bpreshuffle_256x16x64x256_16x16_16x16_16x16x1_16x16x1_1x16x1x16_4x4x1_1x1_intrawave_v1,0,0,0
80,2,24576,1536,torch.float8_e4m3fnuz,108,0,13.6777,a8w8_bpreshuffle_256x16x64x256_16x16_16x16_16x16x1_16x16x1_1x16x1x16_4x4x1_1x1_intrawave_v1,0,0,0
80,2,32768,512,torch.float8_e4m3fnuz,9,0,9.513,a8w8_bpreshuffle_128x16x32x128_16x16_16x16_8x16x1_8x16x1_1x16x1x8_4x4x1_1x1_intrawave_v1,0,0,0
80,2,32768,1536,torch.float8_e4m3fnuz,108,0,17.4059,a8w8_bpreshuffle_256x16x64x256_16x16_16x16_16x16x1_16x16x1_1x16x1x16_4x4x1_1x1_intrawave_v1,0,0,0
80,2,36864,7168,torch.float8_e4m3fnuz,20,0,78.3165,a8w8_bpreshuffle_256x16x128x512_16x16_16x16_32x8x1_32x8x1_1x16x1x16_8x8x1_1x2_intrawave_v2,0,0,0
80,4,128,7168,torch.float8_e4m3fnuz,10,0,10.0606,a8w8_bpreshuffle_128x16x32x512_16x16_16x16_32x4x1_32x4x1_1x16x1x8_4x4x1_1x1_intrawave_v1,0,0,0
80,4,512,7168,torch.float8_e4m3fnuz,10,0,11.6471,a8w8_bpreshuffle_128x16x32x512_16x16_16x16_32x4x1_32x4x1_1x16x1x8_4x4x1_1x1_intrawave_v1,0,0,0
80,4,576,7168,torch.float8_e4m3fnuz,10,0,11.6411,a8w8_bpreshuffle_128x16x32x512_16x16_16x16_32x4x1_32x4x1_1x16x1x8_4x4x1_1x1_intrawave_v1,0,0,0
80,4,1536,7168,torch.float8_e4m3fnuz,10,0,12.2579,a8w8_bpreshuffle_128x16x32x512_16x16_16x16_32x4x1_32x4x1_1x16x1x8_4x4x1_1x1_intrawave_v1,0,0,0
80,4,2240,7168,torch.float8_e4m3fnuz,10,0,12.3558,a8w8_bpreshuffle_128x16x32x512_16x16_16x16_32x4x1_32x4x1_1x16x1x8_4x4x1_1x1_intrawave_v1,0,0,0
80,4,3072,1536,torch.float8_e4m3fnuz,11,0,5.8834,a8w8_bpreshuffle_256x16x64x512_16x16_16x16_32x8x1_32x8x1_1x16x1x16_4x4x1_1x1_intrawave_v1,0,0,0
80,4,4096,512,torch.float8_e4m3fnuz,23,0,4.5342,a8w8_bpreshuffle_128x16x32x128_16x16_16x16_8x16x1_8x16x1_1x16x1x8_4x4x1_1x1_intrawave_v2,0,0,0
80,4,4096,7168,torch.float8_e4m3fnuz,5,0,13.5363,a8w8_bpreshuffle_256x16x64x512_16x16_16x16_32x8x1_32x8x1_1x16x1x16_4x4x1_1x1_intrawave_v1,0,0,0
80,4,4608,7168,torch.float8_e4m3fnuz,5,0,13.6563,a8w8_bpreshuffle_256x16x64x512_16x16_16x16_32x8x1_32x8x1_1x16x1x16_4x4x1_1x1_intrawave_v1,0,0,0
80,4,7168,256,torch.float8_e4m3fnuz,73,0,6.9558,a8w8_bpreshuffle_256x32x256x64_16x16_16x16_4x32x1_4x64x1_1x32x1x8_8x8x1_2x1_intrawave_v1,0,0,0
80,4,7168,2048,torch.float8_e4m3fnuz,108,0,8.5722,a8w8_bpreshuffle_256x16x64x256_16x16_16x16_16x16x1_16x16x1_1x16x1x16_4x4x1_1x1_intrawave_v1,0,0,0
80,4,7168,2304,torch.float8_e4m3fnuz,108,0,9.9551,a8w8_bpreshuffle_256x16x64x256_16x16_16x16_16x16x1_16x16x1_1x16x1x16_4x4x1_1x1_intrawave_v1,0,0,0
80,4,7168,16384,torch.float8_e4m3fnuz,10,0,37.6428,a8w8_bpreshuffle_128x16x32x512_16x16_16x16_32x4x1_32x4x1_1x16x1x8_4x4x1_1x1_intrawave_v1,0,0,0
80,4,7168,18432,torch.float8_e4m3fnuz,10,0,42.1052,a8w8_bpreshuffle_128x16x32x512_16x16_16x16_32x4x1_32x4x1_1x16x1x8_4x4x1_1x1_intrawave_v1,0,0,0
80,4,8192,1536,torch.float8_e4m3fnuz,6,0,8.0606,a8w8_bpreshuffle_256x16x128x512_16x16_16x16_32x8x1_32x8x1_1x16x1x16_8x8x1_1x2_intrawave_v1,0,0,0
80,4,11264,1536,torch.float8_e4m3fnuz,10,0,9.667,a8w8_bpreshuffle_128x16x32x512_16x16_16x16_32x4x1_32x4x1_1x16x1x8_4x4x1_1x1_intrawave_v1,0,0,0
80,4,24576,1536,torch.float8_e4m3fnuz,15,0,13.9333,a8w8_bpreshuffle_256x16x64x256_16x16_16x16_16x16x1_16x16x1_1x16x1x16_4x4x1_1x1_intrawave_v1,0,0,0
80,4,32768,512,torch.float8_e4m3fnuz,23,0,9.1702,a8w8_bpreshuffle_128x16x32x128_16x16_16x16_8x16x1_8x16x1_1x16x1x8_4x4x1_1x1_intrawave_v2,0,0,0
80,4,32768,1536,torch.float8_e4m3fnuz,109,0,18.3707,a8w8_bpreshuffle_256x16x128x256_16x16_16x16_16x16x1_16x16x1_1x16x1x16_8x8x1_1x2_intrawave_v1,0,0,0
80,4,36864,7168,torch.float8_e4m3fnuz,32,0,78.8657,a8w8_bpreshuffle_256x16x512x256_16x16_16x16_16x16x1_16x16x1_1x16x1x16_8x8x1_1x2_intrawave_v2,0,0,0
80,8,128,7168,torch.float8_e4m3fnuz,10,0,10.4198,a8w8_bpreshuffle_128x16x32x512_16x16_16x16_32x4x1_32x4x1_1x16x1x8_4x4x1_1x1_intrawave_v1,0,0,0
80,8,512,7168,torch.float8_e4m3fnuz,10,0,11.7575,a8w8_bpreshuffle_128x16x32x512_16x16_16x16_32x4x1_32x4x1_1x16x1x8_4x4x1_1x1_intrawave_v1,0,0,0
80,8,576,7168,torch.float8_e4m3fnuz,10,0,11.871,a8w8_bpreshuffle_128x16x32x512_16x16_16x16_32x4x1_32x4x1_1x16x1x8_4x4x1_1x1_intrawave_v1,0,0,0
80,8,1536,7168,torch.float8_e4m3fnuz,10,0,12.559,a8w8_bpreshuffle_128x16x32x512_16x16_16x16_32x4x1_32x4x1_1x16x1x8_4x4x1_1x1_intrawave_v1,0,0,0
80,8,2240,7168,torch.float8_e4m3fnuz,10,0,12.6438,a8w8_bpreshuffle_128x16x32x512_16x16_16x16_32x4x1_32x4x1_1x16x1x8_4x4x1_1x1_intrawave_v1,0,0,0
80,8,3072,1536,torch.float8_e4m3fnuz,10,0,5.8254,a8w8_bpreshuffle_128x16x32x512_16x16_16x16_32x4x1_32x4x1_1x16x1x8_4x4x1_1x1_intrawave_v1,0,0,0
80,8,4096,512,torch.float8_e4m3fnuz,9,0,4.1858,a8w8_bpreshuffle_128x16x32x128_16x16_16x16_8x16x1_8x16x1_1x16x1x8_4x4x1_1x1_intrawave_v1,0,0,0
80,8,4096,7168,torch.float8_e4m3fnuz,11,0,13.6103,a8w8_bpreshuffle_256x16x64x512_16x16_16x16_32x8x1_32x8x1_1x16x1x16_4x4x1_1x1_intrawave_v1,0,0,0
80,8,4608,7168,torch.float8_e4m3fnuz,5,0,13.8099,a8w8_bpreshuffle_256x16x64x512_16x16_16x16_32x8x1_32x8x1_1x16x1x16_4x4x1_1x1_intrawave_v1,0,0,0
80,8,7168,256,torch.float8_e4m3fnuz,75,0,6.2842,a8w8_bpreshuffle_128x16x256x64_16x16_16x16_4x16x1_4x32x1_1x16x1x8_8x8x1_1x2_intrawave_v1,0,0,0
80,8,7168,2048,torch.float8_e4m3fnuz,24,0,8.685,a8w8_bpreshuffle_128x16x32x512_16x16_16x16_32x4x1_32x4x1_1x16x1x8_4x4x1_1x1_intrawave_v2,0,0,0
80,8,7168,2304,torch.float8_e4m3fnuz,108,0,10.0038,a8w8_bpreshuffle_256x16x64x256_16x16_16x16_16x16x1_16x16x1_1x16x1x16_4x4x1_1x1_intrawave_v1,0,0,0
80,8,7168,16384,torch.float8_e4m3fnuz,10,0,39.2255,a8w8_bpreshuffle_128x16x32x512_16x16_16x16_32x4x1_32x4x1_1x16x1x8_4x4x1_1x1_intrawave_v1,0,0,0
80,8,7168,18432,torch.float8_e4m3fnuz,24,0,45.0508,a8w8_bpreshuffle_128x16x32x512_16x16_16x16_32x4x1_32x4x1_1x16x1x8_4x4x1_1x1_intrawave_v2,0,0,0
80,8,8192,1536,torch.float8_e4m3fnuz,5,0,8.1558,a8w8_bpreshuffle_256x16x64x512_16x16_16x16_32x8x1_32x8x1_1x16x1x16_4x4x1_1x1_intrawave_v1,0,0,0
80,8,11264,1536,torch.float8_e4m3fnuz,10,0,10.0366,a8w8_bpreshuffle_128x16x32x512_16x16_16x16_32x4x1_32x4x1_1x16x1x8_4x4x1_1x1_intrawave_v1,0,0,0
80,8,24576,1536,torch.float8_e4m3fnuz,9,0,14.5085,a8w8_bpreshuffle_128x16x32x128_16x16_16x16_8x16x1_8x16x1_1x16x1x8_4x4x1_1x1_intrawave_v1,0,0,0
80,8,32768,512,torch.float8_e4m3fnuz,9,0,9.9258,a8w8_bpreshuffle_128x16x32x128_16x16_16x16_8x16x1_8x16x1_1x16x1x8_4x4x1_1x1_intrawave_v1,0,0,0
80,8,32768,1536,torch.float8_e4m3fnuz,5,0,18.2531,a8w8_bpreshuffle_256x16x64x512_16x16_16x16_32x8x1_32x8x1_1x16x1x16_4x4x1_1x1_intrawave_v1,0,0,0
80,8,36864,7168,torch.float8_e4m3fnuz,111,0,79.5469,a8w8_bpreshuffle_256x16x512x256_16x16_16x16_16x16x1_16x16x1_1x16x1x16_8x8x1_1x2_intrawave_v1,0,0,0
80,16,128,7168,torch.float8_e4m3fnuz,19,0,10.0946,a8w8_bpreshuffle_256x16x64x512_16x16_16x16_32x8x1_32x8x1_1x16x1x16_4x4x1_1x1_intrawave_v2,0,0,0
80,16,4096,7168,torch.float8_e4m3fnuz,11,0,13.1683,a8w8_bpreshuffle_256x16x64x512_16x16_16x16_32x8x1_32x8x1_1x16x1x16_4x4x1_1x1_intrawave_v1,0,0,0
80,16,7168,16384,torch.float8_e4m3fnuz,6,0,42.1056,a8w8_bpreshuffle_256x16x128x512_16x16_16x16_32x8x1_32x8x1_1x16x1x16_8x8x1_1x2_intrawave_v1,0,0,0
80,16,7168,18432,torch.float8_e4m3fnuz,6,0,45.8424,a8w8_bpreshuffle_256x16x128x512_16x16_16x16_32x8x1_32x8x1_1x16x1x16_8x8x1_1x2_intrawave_v1,0,0,0
80,16,8192,1536,torch.float8_e4m3fnuz,6,0,7.9894,a8w8_bpreshuffle_256x16x128x512_16x16_16x16_32x8x1_32x8x1_1x16x1x16_8x8x1_1x2_intrawave_v1,0,0,0
80,16,24576,1536,torch.float8_e4m3fnuz,5,0,15.7929,a8w8_bpreshuffle_256x16x64x512_16x16_16x16_32x8x1_32x8x1_1x16x1x16_4x4x1_1x1_intrawave_v1,0,0,0
80,16,32768,512,torch.float8_e4m3fnuz,9,0,10.2342,a8w8_bpreshuffle_128x16x32x128_16x16_16x16_8x16x1_8x16x1_1x16x1x8_4x4x1_1x1_intrawave_v1,0,0,0
80,16,32768,1536,torch.float8_e4m3fnuz,5,0,19.2975,a8w8_bpreshuffle_256x16x64x512_16x16_16x16_32x8x1_32x8x1_1x16x1x16_4x4x1_1x1_intrawave_v1,0,0,0
80,16,36864,7168,torch.float8_e4m3fnuz,6,0,80.7001,a8w8_bpreshuffle_256x16x128x512_16x16_16x16_32x8x1_32x8x1_1x16x1x16_8x8x1_1x2_intrawave_v1,0,0,0
80,32,128,7168,torch.float8_e4m3fnuz,10,0,10.0298,a8w8_bpreshuffle_128x16x32x512_16x16_16x16_32x4x1_32x4x1_1x16x1x8_4x4x1_1x1_intrawave_v1,0,0,0
80,32,4096,7168,torch.float8_e4m3fnuz,12,0,18.5983,a8w8_bpreshuffle_256x32x64x512_16x16_16x16_32x8x1_32x8x1_1x32x1x8_8x8x1_1x2_intrawave_v1,0,0,0
80,32,7168,18432,torch.float8_e4m3fnuz,119,0,58.5048,a8w8_bpreshuffle_256x32x128x256_16x16_16x16_16x16x1_16x16x1_1x16x1x16_8x8x1_1x2_intrawave_v1,0,0,0
80,32,8192,1536,torch.float8_e4m3fnuz,112,0,10.3018,a8w8_bpreshuffle_256x32x64x256_16x16_16x16_16x16x1_16x16x1_1x32x1x8_8x8x1_2x1_intrawave_v1,0,0,0
80,32,32768,512,torch.float8_e4m3fnuz,76,0,12.0918,a8w8_bpreshuffle_256x32x64x128_16x16_16x16_8x32x1_8x32x1_1x32x1x8_8x8x1_2x1_intrawave_v1,0,0,0
80,32,32768,1536,torch.float8_e4m3fnuz,119,0,24.3999,a8w8_bpreshuffle_256x32x128x256_16x16_16x16_16x16x1_16x16x1_1x16x1x16_8x8x1_1x2_intrawave_v1,0,0,0
80,32,36864,7168,torch.float8_e4m3fnuz,133,0,93.517,a8w8_bpreshuffle_256x32x256x256_16x16_16x16_16x16x1_16x16x1_1x16x1x16_8x8x1_1x2_intrawave_v1,0,0,0
80,64,128,7168,torch.float8_e4m3fnuz,24,0,9.9198,a8w8_bpreshuffle_128x16x32x512_16x16_16x16_32x4x1_32x4x1_1x16x1x8_4x4x1_1x1_intrawave_v2,0,0,0
80,64,4096,7168,torch.float8_e4m3fnuz,114,0,23.8807,a8w8_bpreshuffle_256x64x64x256_16x16_16x16_16x16x1_16x16x1_1x32x1x8_8x8x1_2x1_intrawave_v3,0,0,0
80,64,7168,18432,torch.float8_e4m3fnuz,121,0,89.7754,a8w8_bpreshuffle_256x64x128x256_16x16_16x16_16x16x1_16x16x1_1x16x1x16_8x8x1_1x2_intrawave_v3,0,0,0
80,64,8192,1536,torch.float8_e4m3fnuz,114,0,12.7978,a8w8_bpreshuffle_256x64x64x256_16x16_16x16_16x16x1_16x16x1_1x32x1x8_8x8x1_2x1_intrawave_v3,0,0,0
80,64,32768,512,torch.float8_e4m3fnuz,85,0,18.7478,a8w8_bpreshuffle_256x64x128x128_16x16_16x16_8x32x1_8x32x1_1x32x1x8_8x8x1_2x1_intrawave_v3,0,0,0
80,64,32768,1536,torch.float8_e4m3fnuz,101,0,34.2699,a8w8_bpreshuffle_256x64x256x128_16x16_16x16_8x32x1_8x32x1_1x32x1x8_8x8x1_2x1_intrawave_v3,0,0,0
80,64,36864,7168,torch.float8_e4m3fnuz,121,0,129.978,a8w8_bpreshuffle_256x64x128x256_16x16_16x16_16x16x1_16x16x1_1x16x1x16_8x8x1_1x2_intrawave_v3,0,0,0
80,96,128,7168,torch.float8_e4m3fnuz,25,0,10.3566,a8w8_bpreshuffle_256x16x64x512_16x16_16x16_32x8x1_32x8x1_1x16x1x16_4x4x1_1x1_intrawave_v2,0,0,0
80,96,576,7168,torch.float8_e4m3fnuz,10,0,12.065,a8w8_bpreshuffle_128x16x32x512_16x16_16x16_32x4x1_32x4x1_1x16x1x8_4x4x1_1x1_intrawave_v1,0,0,0
80,96,1536,7168,torch.float8_e4m3fnuz,6,0,18.0262,a8w8_bpreshuffle_256x16x128x512_16x16_16x16_32x8x1_32x8x1_1x16x1x16_8x8x1_1x2_intrawave_v1,0,0,0
80,96,4096,7168,torch.float8_e4m3fnuz,120,0,29.6988,a8w8_bpreshuffle_256x48x128x256_16x16_16x16_16x16x1_16x16x1_1x16x1x16_8x8x1_1x2_intrawave_v1,0,0,0
80,96,7168,18432,torch.float8_e4m3fnuz,113,0,109.8187,a8w8_bpreshuffle_256x48x64x256_16x16_16x16_16x16x1_16x16x1_1x16x1x16_4x4x1_1x1_intrawave_v1,0,0,0
80,96,8192,1536,torch.float8_e4m3fnuz,120,0,16.253,a8w8_bpreshuffle_256x48x128x256_16x16_16x16_16x16x1_16x16x1_1x16x1x16_8x8x1_1x2_intrawave_v1,0,0,0
80,96,32768,512,torch.float8_e4m3fnuz,84,0,23.8023,a8w8_bpreshuffle_256x32x128x128_16x16_16x16_8x32x1_8x32x1_1x32x1x8_8x8x1_2x1_intrawave_v1,0,0,0
80,96,32768,1536,torch.float8_e4m3fnuz,102,0,43.5312,a8w8_bpreshuffle_256x96x256x128_16x16_16x16_8x32x1_8x32x1_1x32x1x8_8x8x1_2x1_intrawave_v3,0,0,0
80,96,36864,7168,torch.float8_e4m3fnuz,102,0,155.5081,a8w8_bpreshuffle_256x96x256x128_16x16_16x16_8x32x1_8x32x1_1x32x1x8_8x8x1_2x1_intrawave_v3,0,0,0
80,128,128,7168,torch.float8_e4m3fnuz,10,0,9.909,a8w8_bpreshuffle_128x16x32x512_16x16_16x16_32x4x1_32x4x1_1x16x1x8_4x4x1_1x1_intrawave_v1,0,0,0
80,128,4096,7168,torch.float8_e4m3fnuz,121,0,38.8588,a8w8_bpreshuffle_256x64x128x256_16x16_16x16_16x16x1_16x16x1_1x16x1x16_8x8x1_1x2_intrawave_v3,0,0,0
80,128,7168,18432,torch.float8_e4m3fnuz,114,0,133.6804,a8w8_bpreshuffle_256x64x64x256_16x16_16x16_16x16x1_16x16x1_1x32x1x8_8x8x1_2x1_intrawave_v3,0,0,0
80,128,8192,1536,torch.float8_e4m3fnuz,121,0,19.1559,a8w8_bpreshuffle_256x64x128x256_16x16_16x16_16x16x1_16x16x1_1x16x1x16_8x8x1_1x2_intrawave_v3,0,0,0
80,128,32768,512,torch.float8_e4m3fnuz,85,0,28.3083,a8w8_bpreshuffle_256x64x128x128_16x16_16x16_8x32x1_8x32x1_1x32x1x8_8x8x1_2x1_intrawave_v3,0,0,0
80,128,32768,1536,torch.float8_e4m3fnuz,85,0,54.7332,a8w8_bpreshuffle_256x64x128x128_16x16_16x16_8x32x1_8x32x1_1x32x1x8_8x8x1_2x1_intrawave_v3,0,0,0
80,128,36864,7168,torch.float8_e4m3fnuz,93,0,201.1007,a8w8_bpreshuffle_256x64x192x128_16x16_16x16_8x32x1_8x32x1_1x32x1x8_8x8x1_2x1_intrawave_v3,0,0,0
80,160,128,7168,torch.float8_e4m3fnuz,10,0,10.2346,a8w8_bpreshuffle_128x16x32x512_16x16_16x16_32x4x1_32x4x1_1x16x1x8_4x4x1_1x1_intrawave_v1,0,0,0
80,160,512,7168,torch.float8_e4m3fnuz,25,0,12.1467,a8w8_bpreshuffle_256x16x64x512_16x16_16x16_32x8x1_32x8x1_1x16x1x16_4x4x1_1x1_intrawave_v2,0,0,0
80,160,576,7168,torch.float8_e4m3fnuz,10,0,16.0783,a8w8_bpreshuffle_128x16x32x512_16x16_16x16_32x4x1_32x4x1_1x16x1x8_4x4x1_1x1_intrawave_v1,0,0,0
80,160,1536,7168,torch.float8_e4m3fnuz,119,0,24.4126,a8w8_bpreshuffle_256x32x128x256_16x16_16x16_16x16x1_16x16x1_1x16x1x16_8x8x1_1x2_intrawave_v1,0,0,0
80,160,2240,7168,torch.float8_e4m3fnuz,115,0,28.9759,a8w8_bpreshuffle_256x80x64x256_16x16_16x16_16x16x1_16x16x1_1x16x1x16_4x4x1_1x1_intrawave_v3,0,0,0
80,160,4096,512,torch.float8_e4m3fnuz,84,0,7.7118,a8w8_bpreshuffle_256x32x128x128_16x16_16x16_8x32x1_8x32x1_1x32x1x8_8x8x1_2x1_intrawave_v1,0,0,0
80,160,4096,7168,torch.float8_e4m3fnuz,119,0,40.6369,a8w8_bpreshuffle_256x32x128x256_16x16_16x16_16x16x1_16x16x1_1x16x1x16_8x8x1_1x2_intrawave_v1,0,0,0
80,160,4608,7168,torch.float8_e4m3fnuz,122,0,46.244,a8w8_bpreshuffle_256x80x128x256_16x16_16x16_16x16x1_16x16x1_1x16x1x16_8x8x1_1x2_intrawave_v3,0,0,0
80,160,7168,256,torch.float8_e4m3fnuz,75,0,10.251,a8w8_bpreshuffle_128x16x256x64_16x16_16x16_4x16x1_4x32x1_1x16x1x8_8x8x1_1x2_intrawave_v1,0,0,0
80,160,7168,2304,torch.float8_e4m3fnuz,119,0,27.2747,a8w8_bpreshuffle_256x32x128x256_16x16_16x16_16x16x1_16x16x1_1x16x1x16_8x8x1_1x2_intrawave_v1,0,0,0
80,160,7168,18432,torch.float8_e4m3fnuz,136,0,168.4653,a8w8_bpreshuffle_256x80x256x256_16x16_16x16_16x16x1_16x16x1_1x16x1x16_8x8x1_1x2_intrawave_v3,0,0,0
80,160,8192,1536,torch.float8_e4m3fnuz,100,0,21.719,a8w8_bpreshuffle_256x32x256x128_16x16_16x16_8x32x1_8x32x1_1x32x1x8_8x8x1_2x1_intrawave_v1,0,0,0
80,160,11264,1536,torch.float8_e4m3fnuz,100,0,30.1239,a8w8_bpreshuffle_256x32x256x128_16x16_16x16_8x32x1_8x32x1_1x32x1x8_8x8x1_2x1_intrawave_v1,0,0,0
80,160,32768,512,torch.float8_e4m3fnuz,84,0,34.3591,a8w8_bpreshuffle_256x32x128x128_16x16_16x16_8x32x1_8x32x1_1x32x1x8_8x8x1_2x1_intrawave_v1,0,0,0
80,160,32768,1536,torch.float8_e4m3fnuz,100,0,73.0357,a8w8_bpreshuffle_256x32x256x128_16x16_16x16_8x32x1_8x32x1_1x32x1x8_8x8x1_2x1_intrawave_v1,0,0,0
80,160,36864,7168,torch.float8_e4m3fnuz,156,0,267.3258,a8w8_bpreshuffle_256x160x256x128_16x16_16x16_8x32x1_8x32x1_1x16x1x16_8x8x1_1x2_intrawave_v3,0,0,0
80,192,128,7168,torch.float8_e4m3fnuz,10,0,10.2034,a8w8_bpreshuffle_128x16x32x512_16x16_16x16_32x4x1_32x4x1_1x16x1x8_4x4x1_1x1_intrawave_v1,0,0,0
80,192,512,7168,torch.float8_e4m3fnuz,10,0,16.0911,a8w8_bpreshuffle_128x16x32x512_16x16_16x16_32x4x1_32x4x1_1x16x1x8_4x4x1_1x1_intrawave_v1,0,0,0
80,192,576,7168,torch.float8_e4m3fnuz,10,0,17.0079,a8w8_bpreshuffle_128x16x32x512_16x16_16x16_32x4x1_32x4x1_1x16x1x8_4x4x1_1x1_intrawave_v1,0,0,0
80,192,1536,7168,torch.float8_e4m3fnuz,114,0,24.0194,a8w8_bpreshuffle_256x64x64x256_16x16_16x16_16x16x1_16x16x1_1x32x1x8_8x8x1_2x1_intrawave_v3,0,0,0
80,192,4096,512,torch.float8_e4m3fnuz,84,0,9.9422,a8w8_bpreshuffle_256x32x128x128_16x16_16x16_8x32x1_8x32x1_1x32x1x8_8x8x1_2x1_intrawave_v1,0,0,0
80,192,4096,7168,torch.float8_e4m3fnuz,123,0,49.1457,a8w8_bpreshuffle_256x96x128x256_16x16_16x16_16x16x1_16x16x1_1x16x1x16_8x8x1_1x2_intrawave_v3,0,0,0
80,192,4608,7168,torch.float8_e4m3fnuz,128,0,47.9264,a8w8_bpreshuffle_256x64x192x256_16x16_16x16_16x16x1_16x16x1_1x32x1x8_8x8x1_2x1_intrawave_v3,0,0,0
80,192,7168,256,torch.float8_e4m3fnuz,73,0,10.5659,a8w8_bpreshuffle_256x32x256x64_16x16_16x16_4x32x1_4x64x1_1x32x1x8_8x8x1_2x1_intrawave_v1,0,0,0
80,192,7168,2304,torch.float8_e4m3fnuz,120,0,29.5015,a8w8_bpreshuffle_256x48x128x256_16x16_16x16_16x16x1_16x16x1_1x16x1x16_8x8x1_1x2_intrawave_v1,0,0,0
80,192,7168,18432,torch.float8_e4m3fnuz,120,0,181.5802,a8w8_bpreshuffle_256x48x128x256_16x16_16x16_16x16x1_16x16x1_1x16x1x16_8x8x1_1x2_intrawave_v1,0,0,0
80,192,8192,1536,torch.float8_e4m3fnuz,86,0,24.7435,a8w8_bpreshuffle_256x96x128x128_16x16_16x16_8x32x1_8x32x1_1x32x1x8_8x8x1_2x1_intrawave_v3,0,0,0
80,192,32768,512,torch.float8_e4m3fnuz,85,0,37.0759,a8w8_bpreshuffle_256x64x128x128_16x16_16x16_8x32x1_8x32x1_1x32x1x8_8x8x1_2x1_intrawave_v3,0,0,0
80,192,32768,1536,torch.float8_e4m3fnuz,85,0,73.3389,a8w8_bpreshuffle_256x64x128x128_16x16_16x16_8x32x1_8x32x1_1x32x1x8_8x8x1_2x1_intrawave_v3,0,0,0
80,192,36864,7168,torch.float8_e4m3fnuz,94,0,286.0543,a8w8_bpreshuffle_256x96x192x128_16x16_16x16_8x32x1_8x32x1_1x32x1x8_8x8x1_2x1_intrawave_v3,0,0,0
80,224,128,7168,torch.float8_e4m3fnuz,24,0,10.2858,a8w8_bpreshuffle_128x16x32x512_16x16_16x16_32x4x1_32x4x1_1x16x1x8_4x4x1_1x1_intrawave_v2,0,0,0
80,224,512,7168,torch.float8_e4m3fnuz,19,0,17.1051,a8w8_bpreshuffle_256x16x64x512_16x16_16x16_32x8x1_32x8x1_1x16x1x16_4x4x1_1x1_intrawave_v2,0,0,0
80,224,576,7168,torch.float8_e4m3fnuz,25,0,17.1379,a8w8_bpreshuffle_256x16x64x512_16x16_16x16_32x8x1_32x8x1_1x16x1x16_4x4x1_1x1_intrawave_v2,0,0,0
80,224,1536,7168,torch.float8_e4m3fnuz,115,0,31.7078,a8w8_bpreshuffle_256x80x64x256_16x16_16x16_16x16x1_16x16x1_1x16x1x16_4x4x1_1x1_intrawave_v3,0,0,0
80,224,2240,7168,torch.float8_e4m3fnuz,117,0,37.5099,a8w8_bpreshuffle_256x112x64x256_16x16_16x16_16x16x1_16x16x1_1x16x1x16_4x4x1_1x1_intrawave_v3,0,0,0
80,224,4096,512,torch.float8_e4m3fnuz,76,0,10.187,a8w8_bpreshuffle_256x32x64x128_16x16_16x16_8x32x1_8x32x1_1x32x1x8_8x8x1_2x1_intrawave_v1,0,0,0
80,224,4096,7168,torch.float8_e4m3fnuz,120,0,52.8765,a8w8_bpreshuffle_256x48x128x256_16x16_16x16_16x16x1_16x16x1_1x16x1x16_8x8x1_1x2_intrawave_v1,0,0,0
80,224,4608,7168,torch.float8_e4m3fnuz,124,0,56.3824,a8w8_bpreshuffle_256x112x128x256_16x16_16x16_16x16x1_16x16x1_1x16x1x16_8x8x1_1x2_intrawave_v3,0,0,0
80,224,7168,256,torch.float8_e4m3fnuz,73,0,10.9003,a8w8_bpreshuffle_256x32x256x64_16x16_16x16_4x32x1_4x64x1_1x32x1x8_8x8x1_2x1_intrawave_v1,0,0,0
80,224,7168,2304,torch.float8_e4m3fnuz,85,0,32.8835,a8w8_bpreshuffle_256x64x128x128_16x16_16x16_8x32x1_8x32x1_1x32x1x8_8x8x1_2x1_intrawave_v3,0,0,0
80,224,7168,18432,torch.float8_e4m3fnuz,85,0,207.6011,a8w8_bpreshuffle_256x64x128x128_16x16_16x16_8x32x1_8x32x1_1x32x1x8_8x8x1_2x1_intrawave_v3,0,0,0
80,224,8192,1536,torch.float8_e4m3fnuz,100,0,28.8459,a8w8_bpreshuffle_256x32x256x128_16x16_16x16_8x32x1_8x32x1_1x32x1x8_8x8x1_2x1_intrawave_v1,0,0,0
80,224,11264,1536,torch.float8_e4m3fnuz,100,0,37.6656,a8w8_bpreshuffle_256x32x256x128_16x16_16x16_8x32x1_8x32x1_1x32x1x8_8x8x1_2x1_intrawave_v1,0,0,0
80,224,32768,512,torch.float8_e4m3fnuz,84,0,45.0439,a8w8_bpreshuffle_256x32x128x128_16x16_16x16_8x32x1_8x32x1_1x32x1x8_8x8x1_2x1_intrawave_v1,0,0,0
80,224,32768,1536,torch.float8_e4m3fnuz,85,0,91.0766,a8w8_bpreshuffle_256x64x128x128_16x16_16x16_8x32x1_8x32x1_1x32x1x8_8x8x1_2x1_intrawave_v3,0,0,0
80,224,36864,7168,torch.float8_e4m3fnuz,40,0,377.2671,a8w8_bpreshuffle_256x224x256x128_16x16_16x16_8x32x1_8x32x1_1x32x1x8_8x8x1_2x1_intrawave_v3,0,0,0
80,256,128,7168,torch.float8_e4m3fnuz,10,0,10.8778,a8w8_bpreshuffle_128x16x32x512_16x16_16x16_32x4x1_32x4x1_1x16x1x8_4x4x1_1x1_intrawave_v1,0,0,0
80,256,4096,7168,torch.float8_e4m3fnuz,85,0,60.0334,a8w8_bpreshuffle_256x64x128x128_16x16_16x16_8x32x1_8x32x1_1x32x1x8_8x8x1_2x1_intrawave_v3,0,0,0
80,256,7168,18432,torch.float8_e4m3fnuz,85,0,209.5107,a8w8_bpreshuffle_256x64x128x128_16x16_16x16_8x32x1_8x32x1_1x32x1x8_8x8x1_2x1_intrawave_v3,0,0,0
80,256,8192,1536,torch.float8_e4m3fnuz,85,0,30.3059,a8w8_bpreshuffle_256x64x128x128_16x16_16x16_8x32x1_8x32x1_1x32x1x8_8x8x1_2x1_intrawave_v3,0,0,0
80,256,32768,512,torch.float8_e4m3fnuz,85,0,46.3119,a8w8_bpreshuffle_256x64x128x128_16x16_16x16_8x32x1_8x32x1_1x32x1x8_8x8x1_2x1_intrawave_v3,0,0,0
80,256,32768,1536,torch.float8_e4m3fnuz,85,0,92.2438,a8w8_bpreshuffle_256x64x128x128_16x16_16x16_8x32x1_8x32x1_1x32x1x8_8x8x1_2x1_intrawave_v3,0,0,0
80,256,36864,7168,torch.float8_e4m3fnuz,68,0,371.2046,a8w8_bpreshuffle_256x128x192x128_16x16_16x16_8x32x1_8x32x1_1x32x1x8_8x8x1_2x1_intrawave_v3,0,0,0
80,288,128,7168,torch.float8_e4m3fnuz,10,0,10.7298,a8w8_bpreshuffle_128x16x32x512_16x16_16x16_32x4x1_32x4x1_1x16x1x8_4x4x1_1x1_intrawave_v1,0,0,0
80,288,512,7168,torch.float8_e4m3fnuz,6,0,17.6475,a8w8_bpreshuffle_256x16x128x512_16x16_16x16_32x8x1_32x8x1_1x16x1x16_8x8x1_1x2_intrawave_v1,0,0,0
80,288,576,7168,torch.float8_e4m3fnuz,113,0,21.2123,a8w8_bpreshuffle_256x48x64x256_16x16_16x16_16x16x1_16x16x1_1x16x1x16_4x4x1_1x1_intrawave_v1,0,0,0
80,288,1536,7168,torch.float8_e4m3fnuz,120,0,29.6846,a8w8_bpreshuffle_256x48x128x256_16x16_16x16_16x16x1_16x16x1_1x16x1x16_8x8x1_1x2_intrawave_v1,0,0,0
80,288,2240,7168,torch.float8_e4m3fnuz,113,0,44.5,a8w8_bpreshuffle_256x48x64x256_16x16_16x16_16x16x1_16x16x1_1x16x1x16_4x4x1_1x1_intrawave_v1,0,0,0
80,288,4096,512,torch.float8_e4m3fnuz,85,0,10.8502,a8w8_bpreshuffle_256x64x128x128_16x16_16x16_8x32x1_8x32x1_1x32x1x8_8x8x1_2x1_intrawave_v3,0,0,0
80,288,4096,7168,torch.float8_e4m3fnuz,85,0,62.9998,a8w8_bpreshuffle_256x64x128x128_16x16_16x16_8x32x1_8x32x1_1x32x1x8_8x8x1_2x1_intrawave_v3,0,0,0
80,288,4608,7168,torch.float8_e4m3fnuz,130,0,66.7012,a8w8_bpreshuffle_256x96x192x256_16x16_16x16_16x16x1_16x16x1_1x32x1x8_8x8x1_2x1_intrawave_v3,0,0,0
80,288,7168,256,torch.float8_e4m3fnuz,72,0,12.7115,a8w8_bpreshuffle_256x64x256x64_16x16_16x16_4x64x1_4x64x1_1x16x1x16_8x8x1_1x2_intrawave_v1,0,0,0
80,288,7168,2304,torch.float8_e4m3fnuz,85,0,40.9768,a8w8_bpreshuffle_256x64x128x128_16x16_16x16_8x32x1_8x32x1_1x32x1x8_8x8x1_2x1_intrawave_v3,0,0,0
80,288,7168,18432,torch.float8_e4m3fnuz,85,0,272.1414,a8w8_bpreshuffle_256x64x128x128_16x16_16x16_8x32x1_8x32x1_1x32x1x8_8x8x1_2x1_intrawave_v3,0,0,0
80,288,8192,1536,torch.float8_e4m3fnuz,85,0,32.0963,a8w8_bpreshuffle_256x64x128x128_16x16_16x16_8x32x1_8x32x1_1x32x1x8_8x8x1_2x1_intrawave_v3,0,0,0
80,288,11264,1536,torch.float8_e4m3fnuz,102,0,42.7952,a8w8_bpreshuffle_256x96x256x128_16x16_16x16_8x32x1_8x32x1_1x32x1x8_8x8x1_2x1_intrawave_v3,0,0,0
80,288,32768,512,torch.float8_e4m3fnuz,84,0,53.506,a8w8_bpreshuffle_256x32x128x128_16x16_16x16_8x32x1_8x32x1_1x32x1x8_8x8x1_2x1_intrawave_v1,0,0,0
80,288,32768,1536,torch.float8_e4m3fnuz,102,0,101.9306,a8w8_bpreshuffle_256x96x256x128_16x16_16x16_8x32x1_8x32x1_1x32x1x8_8x8x1_2x1_intrawave_v3,0,0,0
80,288,36864,7168,torch.float8_e4m3fnuz,102,0,437.3066,a8w8_bpreshuffle_256x96x256x128_16x16_16x16_8x32x1_8x32x1_1x32x1x8_8x8x1_2x1_intrawave_v3,0,0,0
80,320,128,7168,torch.float8_e4m3fnuz,24,0,10.9094,a8w8_bpreshuffle_128x16x32x512_16x16_16x16_32x4x1_32x4x1_1x16x1x8_4x4x1_1x1_intrawave_v2,0,0,0
80,320,512,7168,torch.float8_e4m3fnuz,6,0,17.8315,a8w8_bpreshuffle_256x16x128x512_16x16_16x16_32x8x1_32x8x1_1x16x1x16_8x8x1_1x2_intrawave_v1,0,0,0
80,320,576,7168,torch.float8_e4m3fnuz,112,0,22.5067,a8w8_bpreshuffle_256x32x64x256_16x16_16x16_16x16x1_16x16x1_1x32x1x8_8x8x1_2x1_intrawave_v1,0,0,0
80,320,1536,7168,torch.float8_e4m3fnuz,126,0,32.1157,a8w8_bpreshuffle_256x32x192x256_16x16_16x16_16x16x1_16x16x1_1x32x1x8_8x8x1_2x1_intrawave_v1,0,0,0
80,320,2240,7168,torch.float8_e4m3fnuz,78,0,53.8992,a8w8_bpreshuffle_256x96x64x128_16x16_16x16_8x32x1_8x32x1_1x32x1x8_8x8x1_2x1_intrawave_v3,0,0,0
80,320,4096,512,torch.float8_e4m3fnuz,84,0,10.783,a8w8_bpreshuffle_256x32x128x128_16x16_16x16_8x32x1_8x32x1_1x32x1x8_8x8x1_2x1_intrawave_v1,0,0,0
80,320,4096,7168,torch.float8_e4m3fnuz,121,0,63.2822,a8w8_bpreshuffle_256x64x128x256_16x16_16x16_16x16x1_16x16x1_1x16x1x16_8x8x1_1x2_intrawave_v3,0,0,0
80,320,4608,7168,torch.float8_e4m3fnuz,136,0,72.1189,a8w8_bpreshuffle_256x80x256x256_16x16_16x16_16x16x1_16x16x1_1x16x1x16_8x8x1_1x2_intrawave_v3,0,0,0
80,320,7168,256,torch.float8_e4m3fnuz,74,0,13.0231,a8w8_bpreshuffle_256x64x256x64_16x16_16x16_4x64x1_4x64x1_1x32x1x8_8x8x1_2x1_intrawave_v1,0,0,0
80,320,7168,2304,torch.float8_e4m3fnuz,85,0,40.2392,a8w8_bpreshuffle_256x64x128x128_16x16_16x16_8x32x1_8x32x1_1x32x1x8_8x8x1_2x1_intrawave_v3,0,0,0
80,320,7168,18432,torch.float8_e4m3fnuz,101,0,270.4958,a8w8_bpreshuffle_256x64x256x128_16x16_16x16_8x32x1_8x32x1_1x32x1x8_8x8x1_2x1_intrawave_v3,0,0,0
80,320,8192,1536,torch.float8_e4m3fnuz,101,0,32.6299,a8w8_bpreshuffle_256x64x256x128_16x16_16x16_8x32x1_8x32x1_1x32x1x8_8x8x1_2x1_intrawave_v3,0,0,0
80,320,11264,1536,torch.float8_e4m3fnuz,85,0,45.0808,a8w8_bpreshuffle_256x64x128x128_16x16_16x16_8x32x1_8x32x1_1x32x1x8_8x8x1_2x1_intrawave_v3,0,0,0
80,320,32768,512,torch.float8_e4m3fnuz,85,0,55.0543,a8w8_bpreshuffle_256x64x128x128_16x16_16x16_8x32x1_8x32x1_1x32x1x8_8x8x1_2x1_intrawave_v3,0,0,0
80,320,32768,1536,torch.float8_e4m3fnuz,85,0,114.3911,a8w8_bpreshuffle_256x64x128x128_16x16_16x16_8x32x1_8x32x1_1x32x1x8_8x8x1_2x1_intrawave_v3,0,0,0
80,320,36864,7168,torch.float8_e4m3fnuz,128,0,476.2091,a8w8_bpreshuffle_256x64x192x256_16x16_16x16_16x16x1_16x16x1_1x32x1x8_8x8x1_2x1_intrawave_v3,0,0,0
80,352,128,7168,torch.float8_e4m3fnuz,10,0,11.2254,a8w8_bpreshuffle_128x16x32x512_16x16_16x16_32x4x1_32x4x1_1x16x1x8_4x4x1_1x1_intrawave_v1,0,0,0
80,352,512,7168,torch.float8_e4m3fnuz,112,0,22.2763,a8w8_bpreshuffle_256x32x64x256_16x16_16x16_16x16x1_16x16x1_1x32x1x8_8x8x1_2x1_intrawave_v1,0,0,0
80,352,576,7168,torch.float8_e4m3fnuz,112,0,22.5607,a8w8_bpreshuffle_256x32x64x256_16x16_16x16_16x16x1_16x16x1_1x32x1x8_8x8x1_2x1_intrawave_v1,0,0,0
80,352,1536,7168,torch.float8_e4m3fnuz,133,0,39.9737,a8w8_bpreshuffle_256x32x256x256_16x16_16x16_16x16x1_16x16x1_1x16x1x16_8x8x1_1x2_intrawave_v1,0,0,0
80,352,2240,7168,torch.float8_e4m3fnuz,78,0,54.0168,a8w8_bpreshuffle_256x96x64x128_16x16_16x16_8x32x1_8x32x1_1x32x1x8_8x8x1_2x1_intrawave_v3,0,0,0
80,352,4096,512,torch.float8_e4m3fnuz,84,0,12.0603,a8w8_bpreshuffle_256x32x128x128_16x16_16x16_8x32x1_8x32x1_1x32x1x8_8x8x1_2x1_intrawave_v1,0,0,0
80,352,4096,7168,torch.float8_e4m3fnuz,136,0,74.9351,a8w8_bpreshuffle_256x80x256x256_16x16_16x16_16x16x1_16x16x1_1x16x1x16_8x8x1_1x2_intrawave_v3,0,0,0
80,352,4608,7168,torch.float8_e4m3fnuz,128,0,84.2541,a8w8_bpreshuffle_256x64x192x256_16x16_16x16_16x16x1_16x16x1_1x32x1x8_8x8x1_2x1_intrawave_v3,0,0,0
80,352,7168,256,torch.float8_e4m3fnuz,75,0,15.1695,a8w8_bpreshuffle_128x16x256x64_16x16_16x16_4x16x1_4x32x1_1x16x1x8_8x8x1_1x2_intrawave_v1,0,0,0
80,352,7168,2304,torch.float8_e4m3fnuz,100,0,49.1372,a8w8_bpreshuffle_256x32x256x128_16x16_16x16_8x32x1_8x32x1_1x32x1x8_8x8x1_2x1_intrawave_v1,0,0,0
80,352,7168,18432,torch.float8_e4m3fnuz,86,0,324.6944,a8w8_bpreshuffle_256x96x128x128_16x16_16x16_8x32x1_8x32x1_1x32x1x8_8x8x1_2x1_intrawave_v3,0,0,0
80,352,8192,1536,torch.float8_e4m3fnuz,85,0,38.7583,a8w8_bpreshuffle_256x64x128x128_16x16_16x16_8x32x1_8x32x1_1x32x1x8_8x8x1_2x1_intrawave_v3,0,0,0
80,352,11264,1536,torch.float8_e4m3fnuz,85,0,51.422,a8w8_bpreshuffle_256x64x128x128_16x16_16x16_8x32x1_8x32x1_1x32x1x8_8x8x1_2x1_intrawave_v3,0,0,0
80,352,32768,512,torch.float8_e4m3fnuz,72,0,64.3624,a8w8_bpreshuffle_256x64x256x64_16x16_16x16_4x64x1_4x64x1_1x16x1x16_8x8x1_1x2_intrawave_v1,0,0,0
80,352,32768,1536,torch.float8_e4m3fnuz,71,0,132.552,a8w8_bpreshuffle_256x128x128x64_16x16_16x16_4x64x1_4x64x1_1x32x1x8_8x8x1_2x1_intrawave_v3,0,0,0
80,352,36864,7168,torch.float8_e4m3fnuz,71,0,568.6663,a8w8_bpreshuffle_256x128x128x64_16x16_16x16_4x64x1_4x64x1_1x32x1x8_8x8x1_2x1_intrawave_v3,0,0,0
80,384,128,7168,torch.float8_e4m3fnuz,10,0,11.3822,a8w8_bpreshuffle_128x16x32x512_16x16_16x16_32x4x1_32x4x1_1x16x1x8_4x4x1_1x1_intrawave_v1,0,0,0
80,384,512,7168,torch.float8_e4m3fnuz,113,0,21.2655,a8w8_bpreshuffle_256x48x64x256_16x16_16x16_16x16x1_16x16x1_1x16x1x16_4x4x1_1x1_intrawave_v1,0,0,0
80,384,576,7168,torch.float8_e4m3fnuz,113,0,21.2619,a8w8_bpreshuffle_256x48x64x256_16x16_16x16_16x16x1_16x16x1_1x16x1x16_4x4x1_1x1_intrawave_v1,0,0,0
80,384,1536,7168,torch.float8_e4m3fnuz,114,0,37.6905,a8w8_bpreshuffle_256x64x64x256_16x16_16x16_16x16x1_16x16x1_1x32x1x8_8x8x1_2x1_intrawave_v3,0,0,0
80,384,2240,7168,torch.float8_e4m3fnuz,78,0,53.062,a8w8_bpreshuffle_256x96x64x128_16x16_16x16_8x32x1_8x32x1_1x32x1x8_8x8x1_2x1_intrawave_v3,0,0,0
80,384,4096,512,torch.float8_e4m3fnuz,84,0,12.2599,a8w8_bpreshuffle_256x32x128x128_16x16_16x16_8x32x1_8x32x1_1x32x1x8_8x8x1_2x1_intrawave_v1,0,0,0
80,384,4096,7168,torch.float8_e4m3fnuz,86,0,81.866,a8w8_bpreshuffle_256x96x128x128_16x16_16x16_8x32x1_8x32x1_1x32x1x8_8x8x1_2x1_intrawave_v3,0,0,0
80,384,4608,7168,torch.float8_e4m3fnuz,93,0,81.9457,a8w8_bpreshuffle_256x64x192x128_16x16_16x16_8x32x1_8x32x1_1x32x1x8_8x8x1_2x1_intrawave_v3,0,0,0
80,384,7168,256,torch.float8_e4m3fnuz,72,0,15.1515,a8w8_bpreshuffle_256x64x256x64_16x16_16x16_4x64x1_4x64x1_1x16x1x16_8x8x1_1x2_intrawave_v1,0,0,0
80,384,7168,2304,torch.float8_e4m3fnuz,86,0,48.0036,a8w8_bpreshuffle_256x96x128x128_16x16_16x16_8x32x1_8x32x1_1x32x1x8_8x8x1_2x1_intrawave_v3,0,0,0
80,384,7168,18432,torch.float8_e4m3fnuz,86,0,300.0663,a8w8_bpreshuffle_256x96x128x128_16x16_16x16_8x32x1_8x32x1_1x32x1x8_8x8x1_2x1_intrawave_v3,0,0,0
80,384,8192,1536,torch.float8_e4m3fnuz,85,0,38.4623,a8w8_bpreshuffle_256x64x128x128_16x16_16x16_8x32x1_8x32x1_1x32x1x8_8x8x1_2x1_intrawave_v3,0,0,0
80,384,11264,1536,torch.float8_e4m3fnuz,85,0,51.3588,a8w8_bpreshuffle_256x64x128x128_16x16_16x16_8x32x1_8x32x1_1x32x1x8_8x8x1_2x1_intrawave_v3,0,0,0
80,384,32768,512,torch.float8_e4m3fnuz,85,0,63.438,a8w8_bpreshuffle_256x64x128x128_16x16_16x16_8x32x1_8x32x1_1x32x1x8_8x8x1_2x1_intrawave_v3,0,0,0
80,384,32768,1536,torch.float8_e4m3fnuz,71,0,132.9488,a8w8_bpreshuffle_256x128x128x64_16x16_16x16_4x64x1_4x64x1_1x32x1x8_8x8x1_2x1_intrawave_v3,0,0,0
80,384,36864,7168,torch.float8_e4m3fnuz,94,0,555.2415,a8w8_bpreshuffle_256x96x192x128_16x16_16x16_8x32x1_8x32x1_1x32x1x8_8x8x1_2x1_intrawave_v3,0,0,0
80,416,128,7168,torch.float8_e4m3fnuz,24,0,11.6798,a8w8_bpreshuffle_128x16x32x512_16x16_16x16_32x4x1_32x4x1_1x16x1x8_4x4x1_1x1_intrawave_v2,0,0,0
80,416,512,7168,torch.float8_e4m3fnuz,112,0,22.5591,a8w8_bpreshuffle_256x32x64x256_16x16_16x16_16x16x1_16x16x1_1x32x1x8_8x8x1_2x1_intrawave_v1,0,0,0
80,416,576,7168,torch.float8_e4m3fnuz,112,0,22.8351,a8w8_bpreshuffle_256x32x64x256_16x16_16x16_16x16x1_16x16x1_1x32x1x8_8x8x1_2x1_intrawave_v1,0,0,0
80,416,1536,7168,torch.float8_e4m3fnuz,119,0,38.3401,a8w8_bpreshuffle_256x32x128x256_16x16_16x16_16x16x1_16x16x1_1x16x1x16_8x8x1_1x2_intrawave_v1,0,0,0
80,416,2240,7168,torch.float8_e4m3fnuz,113,0,62.1588,a8w8_bpreshuffle_256x48x64x256_16x16_16x16_16x16x1_16x16x1_1x16x1x16_4x4x1_1x1_intrawave_v1,0,0,0
80,416,3072,1536,torch.float8_e4m3fnuz,100,0,20.7247,a8w8_bpreshuffle_256x32x256x128_16x16_16x16_8x32x1_8x32x1_1x32x1x8_8x8x1_2x1_intrawave_v1,0,0,0
80,416,4096,512,torch.float8_e4m3fnuz,85,0,13.5035,a8w8_bpreshuffle_256x64x128x128_16x16_16x16_8x32x1_8x32x1_1x32x1x8_8x8x1_2x1_intrawave_v3,0,0,0
80,416,4096,7168,torch.float8_e4m3fnuz,85,0,86.134,a8w8_bpreshuffle_256x64x128x128_16x16_16x16_8x32x1_8x32x1_1x32x1x8_8x8x1_2x1_intrawave_v3,0,0,0
80,416,4608,7168,torch.float8_e4m3fnuz,138,0,101.4186,a8w8_bpreshuffle_256x112x256x256_16x16_16x16_16x16x1_16x16x1_1x16x1x16_8x8x1_1x2_intrawave_v3,0,0,0
80,416,7168,256,torch.float8_e4m3fnuz,74,0,15.9059,a8w8_bpreshuffle_256x64x256x64_16x16_16x16_4x64x1_4x64x1_1x32x1x8_8x8x1_2x1_intrawave_v1,0,0,0
80,416,7168,2048,torch.float8_e4m3fnuz,85,0,48.1552,a8w8_bpreshuffle_256x64x128x128_16x16_16x16_8x32x1_8x32x1_1x32x1x8_8x8x1_2x1_intrawave_v3,0,0,0
80,416,7168,2304,torch.float8_e4m3fnuz,85,0,51.2564,a8w8_bpreshuffle_256x64x128x128_16x16_16x16_8x32x1_8x32x1_1x32x1x8_8x8x1_2x1_intrawave_v3,0,0,0
80,416,7168,16384,torch.float8_e4m3fnuz,85,0,310.2738,a8w8_bpreshuffle_256x64x128x128_16x16_16x16_8x32x1_8x32x1_1x32x1x8_8x8x1_2x1_intrawave_v3,0,0,0
80,416,7168,18432,torch.float8_e4m3fnuz,85,0,352.9218,a8w8_bpreshuffle_256x64x128x128_16x16_16x16_8x32x1_8x32x1_1x32x1x8_8x8x1_2x1_intrawave_v3,0,0,0
80,416,8192,1536,torch.float8_e4m3fnuz,72,0,43.8675,a8w8_bpreshuffle_256x64x256x64_16x16_16x16_4x64x1_4x64x1_1x16x1x16_8x8x1_1x2_intrawave_v1,0,0,0
80,416,11264,1536,torch.float8_e4m3fnuz,85,0,58.2264,a8w8_bpreshuffle_256x64x128x128_16x16_16x16_8x32x1_8x32x1_1x32x1x8_8x8x1_2x1_intrawave_v3,0,0,0
80,416,24576,1536,torch.float8_e4m3fnuz,102,0,122.5387,a8w8_bpreshuffle_256x96x256x128_16x16_16x16_8x32x1_8x32x1_1x32x1x8_8x8x1_2x1_intrawave_v3,0,0,0
80,416,32768,512,torch.float8_e4m3fnuz,84,0,73.9008,a8w8_bpreshuffle_256x32x128x128_16x16_16x16_8x32x1_8x32x1_1x32x1x8_8x8x1_2x1_intrawave_v1,0,0,0
80,416,32768,1536,torch.float8_e4m3fnuz,85,0,155.3704,a8w8_bpreshuffle_256x64x128x128_16x16_16x16_8x32x1_8x32x1_1x32x1x8_8x8x1_2x1_intrawave_v3,0,0,0
80,416,36864,7168,torch.float8_e4m3fnuz,93,0,649.7863,a8w8_bpreshuffle_256x64x192x128_16x16_16x16_8x32x1_8x32x1_1x32x1x8_8x8x1_2x1_intrawave_v3,0,0,0
80,448,128,7168,torch.float8_e4m3fnuz,10,0,11.523,a8w8_bpreshuffle_128x16x32x512_16x16_16x16_32x4x1_32x4x1_1x16x1x8_4x4x1_1x1_intrawave_v1,0,0,0
80,448,512,7168,torch.float8_e4m3fnuz,112,0,22.7188,a8w8_bpreshuffle_256x32x64x256_16x16_16x16_16x16x1_16x16x1_1x32x1x8_8x8x1_2x1_intrawave_v1,0,0,0
80,448,576,7168,torch.float8_e4m3fnuz,112,0,22.8423,a8w8_bpreshuffle_256x32x64x256_16x16_16x16_16x16x1_16x16x1_1x32x1x8_8x8x1_2x1_intrawave_v1,0,0,0
80,448,1536,7168,torch.float8_e4m3fnuz,113,0,46.246,a8w8_bpreshuffle_256x48x64x256_16x16_16x16_16x16x1_16x16x1_1x16x1x16_4x4x1_1x1_intrawave_v1,0,0,0
80,448,2240,7168,torch.float8_e4m3fnuz,114,0,70.1253,a8w8_bpreshuffle_256x64x64x256_16x16_16x16_16x16x1_16x16x1_1x32x1x8_8x8x1_2x1_intrawave_v3,0,0,0
80,448,3072,1536,torch.float8_e4m3fnuz,92,0,22.3115,a8w8_bpreshuffle_256x32x192x128_16x16_16x16_8x32x1_8x32x1_1x32x1x8_8x8x1_2x1_intrawave_v1,0,0,0
80,448,4096,512,torch.float8_e4m3fnuz,85,0,13.3723,a8w8_bpreshuffle_256x64x128x128_16x16_16x16_8x32x1_8x32x1_1x32x1x8_8x8x1_2x1_intrawave_v3,0,0,0
80,448,4096,7168,torch.float8_e4m3fnuz,85,0,84.5872,a8w8_bpreshuffle_256x64x128x128_16x16_16x16_8x32x1_8x32x1_1x32x1x8_8x8x1_2x1_intrawave_v3,0,0,0
80,448,4608,7168,torch.float8_e4m3fnuz,138,0,97.0854,a8w8_bpreshuffle_256x112x256x256_16x16_16x16_16x16x1_16x16x1_1x16x1x16_8x8x1_1x2_intrawave_v3,0,0,0
80,448,7168,256,torch.float8_e4m3fnuz,72,0,15.6539,a8w8_bpreshuffle_256x64x256x64_16x16_16x16_4x64x1_4x64x1_1x16x1x16_8x8x1_1x2_intrawave_v1,0,0,0
80,448,7168,2048,torch.float8_e4m3fnuz,85,0,47.8488,a8w8_bpreshuffle_256x64x128x128_16x16_16x16_8x32x1_8x32x1_1x32x1x8_8x8x1_2x1_intrawave_v3,0,0,0
80,448,7168,2304,torch.float8_e4m3fnuz,85,0,49.72,a8w8_bpreshuffle_256x64x128x128_16x16_16x16_8x32x1_8x32x1_1x32x1x8_8x8x1_2x1_intrawave_v3,0,0,0
80,448,7168,16384,torch.float8_e4m3fnuz,85,0,316.355,a8w8_bpreshuffle_256x64x128x128_16x16_16x16_8x32x1_8x32x1_1x32x1x8_8x8x1_2x1_intrawave_v3,0,0,0
80,448,7168,18432,torch.float8_e4m3fnuz,85,0,356.7658,a8w8_bpreshuffle_256x64x128x128_16x16_16x16_8x32x1_8x32x1_1x32x1x8_8x8x1_2x1_intrawave_v3,0,0,0
80,448,8192,1536,torch.float8_e4m3fnuz,72,0,43.8247,a8w8_bpreshuffle_256x64x256x64_16x16_16x16_4x64x1_4x64x1_1x16x1x16_8x8x1_1x2_intrawave_v1,0,0,0
80,448,11264,1536,torch.float8_e4m3fnuz,85,0,57.7888,a8w8_bpreshuffle_256x64x128x128_16x16_16x16_8x32x1_8x32x1_1x32x1x8_8x8x1_2x1_intrawave_v3,0,0,0
80,448,24576,1536,torch.float8_e4m3fnuz,93,0,117.3539,a8w8_bpreshuffle_256x64x192x128_16x16_16x16_8x32x1_8x32x1_1x32x1x8_8x8x1_2x1_intrawave_v3,0,0,0
80,448,32768,512,torch.float8_e4m3fnuz,85,0,72.2692,a8w8_bpreshuffle_256x64x128x128_16x16_16x16_8x32x1_8x32x1_1x32x1x8_8x8x1_2x1_intrawave_v3,0,0,0
80,448,32768,1536,torch.float8_e4m3fnuz,85,0,153.3388,a8w8_bpreshuffle_256x64x128x128_16x16_16x16_8x32x1_8x32x1_1x32x1x8_8x8x1_2x1_intrawave_v3,0,0,0
80,448,36864,7168,torch.float8_e4m3fnuz,93,0,631.7091,a8w8_bpreshuffle_256x64x192x128_16x16_16x16_8x32x1_8x32x1_1x32x1x8_8x8x1_2x1_intrawave_v3,0,0,0
80,480,128,7168,torch.float8_e4m3fnuz,10,0,11.607,a8w8_bpreshuffle_128x16x32x512_16x16_16x16_32x4x1_32x4x1_1x16x1x8_4x4x1_1x1_intrawave_v1,0,0,0
80,480,512,7168,torch.float8_e4m3fnuz,113,0,21.5703,a8w8_bpreshuffle_256x48x64x256_16x16_16x16_16x16x1_16x16x1_1x16x1x16_4x4x1_1x1_intrawave_v1,0,0,0
80,480,576,7168,torch.float8_e4m3fnuz,112,0,24.5819,a8w8_bpreshuffle_256x32x64x256_16x16_16x16_16x16x1_16x16x1_1x32x1x8_8x8x1_2x1_intrawave_v1,0,0,0
80,480,1536,7168,torch.float8_e4m3fnuz,113,0,45.4048,a8w8_bpreshuffle_256x48x64x256_16x16_16x16_16x16x1_16x16x1_1x16x1x16_4x4x1_1x1_intrawave_v1,0,0,0
80,480,2240,7168,torch.float8_e4m3fnuz,62,0,70.4585,a8w8_bpreshuffle_256x128x64x128_16x16_16x16_8x32x1_8x32x1_1x32x1x8_8x8x1_2x1_intrawave_v3,0,0,0
80,480,3072,1536,torch.float8_e4m3fnuz,94,0,22.3915,a8w8_bpreshuffle_256x96x192x128_16x16_16x16_8x32x1_8x32x1_1x32x1x8_8x8x1_2x1_intrawave_v3,0,0,0
80,480,4096,512,torch.float8_e4m3fnuz,86,0,14.0771,a8w8_bpreshuffle_256x96x128x128_16x16_16x16_8x32x1_8x32x1_1x32x1x8_8x8x1_2x1_intrawave_v3,0,0,0
80,480,4096,7168,torch.float8_e4m3fnuz,86,0,82.8028,a8w8_bpreshuffle_256x96x128x128_16x16_16x16_8x32x1_8x32x1_1x32x1x8_8x8x1_2x1_intrawave_v3,0,0,0
80,480,4608,7168,torch.float8_e4m3fnuz,56,0,105.9346,a8w8_bpreshuffle_256x160x192x128_16x16_16x16_8x32x1_8x32x1_1x32x1x8_8x8x1_2x1_intrawave_v3,0,0,0
80,480,7168,256,torch.float8_e4m3fnuz,72,0,16.1387,a8w8_bpreshuffle_256x64x256x64_16x16_16x16_4x64x1_4x64x1_1x16x1x16_8x8x1_1x2_intrawave_v1,0,0,0
80,480,7168,2048,torch.float8_e4m3fnuz,102,0,52.4824,a8w8_bpreshuffle_256x96x256x128_16x16_16x16_8x32x1_8x32x1_1x32x1x8_8x8x1_2x1_intrawave_v3,0,0,0
80,480,7168,2304,torch.float8_e4m3fnuz,102,0,56.9516,a8w8_bpreshuffle_256x96x256x128_16x16_16x16_8x32x1_8x32x1_1x32x1x8_8x8x1_2x1_intrawave_v3,0,0,0
80,480,7168,16384,torch.float8_e4m3fnuz,86,0,346.0471,a8w8_bpreshuffle_256x96x128x128_16x16_16x16_8x32x1_8x32x1_1x32x1x8_8x8x1_2x1_intrawave_v3,0,0,0
80,480,7168,18432,torch.float8_e4m3fnuz,102,0,379.6631,a8w8_bpreshuffle_256x96x256x128_16x16_16x16_8x32x1_8x32x1_1x32x1x8_8x8x1_2x1_intrawave_v3,0,0,0
80,480,8192,1536,torch.float8_e4m3fnuz,102,0,43.0079,a8w8_bpreshuffle_256x96x256x128_16x16_16x16_8x32x1_8x32x1_1x32x1x8_8x8x1_2x1_intrawave_v3,0,0,0
80,480,11264,1536,torch.float8_e4m3fnuz,102,0,64.1117,a8w8_bpreshuffle_256x96x256x128_16x16_16x16_8x32x1_8x32x1_1x32x1x8_8x8x1_2x1_intrawave_v3,0,0,0
80,480,24576,1536,torch.float8_e4m3fnuz,102,0,119.4687,a8w8_bpreshuffle_256x96x256x128_16x16_16x16_8x32x1_8x32x1_1x32x1x8_8x8x1_2x1_intrawave_v3,0,0,0
80,480,32768,512,torch.float8_e4m3fnuz,102,0,81.2012,a8w8_bpreshuffle_256x96x256x128_16x16_16x16_8x32x1_8x32x1_1x32x1x8_8x8x1_2x1_intrawave_v3,0,0,0
80,480,32768,1536,torch.float8_e4m3fnuz,102,0,155.1241,a8w8_bpreshuffle_256x96x256x128_16x16_16x16_8x32x1_8x32x1_1x32x1x8_8x8x1_2x1_intrawave_v3,0,0,0
80,480,36864,7168,torch.float8_e4m3fnuz,102,0,655.0492,a8w8_bpreshuffle_256x96x256x128_16x16_16x16_8x32x1_8x32x1_1x32x1x8_8x8x1_2x1_intrawave_v3,0,0,0
80,512,128,7168,torch.float8_e4m3fnuz,11,0,12.1131,a8w8_bpreshuffle_256x16x64x512_16x16_16x16_32x8x1_32x8x1_1x16x1x16_4x4x1_1x1_intrawave_v1,0,0,0
80,512,4096,7168,torch.float8_e4m3fnuz,138,0,102.7541,a8w8_bpreshuffle_256x112x256x256_16x16_16x16_16x16x1_16x16x1_1x16x1x16_8x8x1_1x2_intrawave_v3,0,0,0
80,512,7168,16384,torch.float8_e4m3fnuz,71,0,346.2792,a8w8_bpreshuffle_256x128x128x64_16x16_16x16_4x64x1_4x64x1_1x32x1x8_8x8x1_2x1_intrawave_v3,0,0,0
80,512,7168,18432,torch.float8_e4m3fnuz,70,0,389.6687,a8w8_bpreshuffle_256x128x128x128_16x16_16x16_8x32x1_8x32x1_1x32x1x8_8x8x1_2x1_intrawave_v3,0,0,0
80,512,8192,1536,torch.float8_e4m3fnuz,85,0,50.0471,a8w8_bpreshuffle_256x64x128x128_16x16_16x16_8x32x1_8x32x1_1x32x1x8_8x8x1_2x1_intrawave_v3,0,0,0
80,512,24576,1536,torch.float8_e4m3fnuz,93,0,126.7363,a8w8_bpreshuffle_256x64x192x128_16x16_16x16_8x32x1_8x32x1_1x32x1x8_8x8x1_2x1_intrawave_v3,0,0,0
80,512,32768,512,torch.float8_e4m3fnuz,85,0,82.7804,a8w8_bpreshuffle_256x64x128x128_16x16_16x16_8x32x1_8x32x1_1x32x1x8_8x8x1_2x1_intrawave_v3,0,0,0
80,512,32768,1536,torch.float8_e4m3fnuz,71,0,167.8113,a8w8_bpreshuffle_256x128x128x64_16x16_16x16_4x64x1_4x64x1_1x32x1x8_8x8x1_2x1_intrawave_v3,0,0,0
80,512,36864,7168,torch.float8_e4m3fnuz,68,0,726.0635,a8w8_bpreshuffle_256x128x192x128_16x16_16x16_8x32x1_8x32x1_1x32x1x8_8x8x1_2x1_intrawave_v3,0,0,0
80,1024,128,7168,torch.float8_e4m3fnuz,6,0,17.8979,a8w8_bpreshuffle_256x16x128x512_16x16_16x16_32x8x1_32x8x1_1x16x1x16_8x8x1_1x2_intrawave_v1,0,0,0
80,1024,4096,7168,torch.float8_e4m3fnuz,85,0,179.0322,a8w8_bpreshuffle_256x64x128x128_16x16_16x16_8x32x1_8x32x1_1x32x1x8_8x8x1_2x1_intrawave_v3,0,0,0
80,1024,7168,16384,torch.float8_e4m3fnuz,85,0,661.406,a8w8_bpreshuffle_256x64x128x128_16x16_16x16_8x32x1_8x32x1_1x32x1x8_8x8x1_2x1_intrawave_v3,0,0,0
80,1024,7168,18432,torch.float8_e4m3fnuz,85,0,745.9611,a8w8_bpreshuffle_256x64x128x128_16x16_16x16_8x32x1_8x32x1_1x32x1x8_8x8x1_2x1_intrawave_v3,0,0,0
80,1024,8192,1536,torch.float8_e4m3fnuz,71,0,90.3089,a8w8_bpreshuffle_256x128x128x64_16x16_16x16_4x64x1_4x64x1_1x32x1x8_8x8x1_2x1_intrawave_v3,0,0,0
80,1024,24576,1536,torch.float8_e4m3fnuz,68,0,241.8128,a8w8_bpreshuffle_256x128x192x128_16x16_16x16_8x32x1_8x32x1_1x32x1x8_8x8x1_2x1_intrawave_v3,0,0,0
80,1024,32768,512,torch.float8_e4m3fnuz,71,0,148.0686,a8w8_bpreshuffle_256x128x128x64_16x16_16x16_4x64x1_4x64x1_1x32x1x8_8x8x1_2x1_intrawave_v3,0,0,0
80,1024,32768,1536,torch.float8_e4m3fnuz,71,0,317.4319,a8w8_bpreshuffle_256x128x128x64_16x16_16x16_4x64x1_4x64x1_1x32x1x8_8x8x1_2x1_intrawave_v3,0,0,0
80,1024,36864,7168,torch.float8_e4m3fnuz,93,0,1406.3674,a8w8_bpreshuffle_256x64x192x128_16x16_16x16_8x32x1_8x32x1_1x32x1x8_8x8x1_2x1_intrawave_v3,0,0,0
80,2048,128,7168,torch.float8_e4m3fnuz,119,0,24.0187,a8w8_bpreshuffle_256x32x128x256_16x16_16x16_16x16x1_16x16x1_1x16x1x16_8x8x1_1x2_intrawave_v1,0,0,0
80,2048,4096,7168,torch.float8_e4m3fnuz,85,0,328.802,a8w8_bpreshuffle_256x64x128x128_16x16_16x16_8x32x1_8x32x1_1x32x1x8_8x8x1_2x1_intrawave_v3,0,0,0
80,2048,7168,16384,torch.float8_e4m3fnuz,85,0,1256.6524,a8w8_bpreshuffle_256x64x128x128_16x16_16x16_8x32x1_8x32x1_1x32x1x8_8x8x1_2x1_intrawave_v3,0,0,0
80,2048,7168,18432,torch.float8_e4m3fnuz,85,0,1411.2909,a8w8_bpreshuffle_256x64x128x128_16x16_16x16_8x32x1_8x32x1_1x32x1x8_8x8x1_2x1_intrawave_v3,0,0,0
80,2048,8192,1536,torch.float8_e4m3fnuz,71,0,160.9323,a8w8_bpreshuffle_256x128x128x64_16x16_16x16_4x64x1_4x64x1_1x32x1x8_8x8x1_2x1_intrawave_v3,0,0,0
80,2048,24576,1536,torch.float8_e4m3fnuz,71,0,459.7917,a8w8_bpreshuffle_256x128x128x64_16x16_16x16_4x64x1_4x64x1_1x32x1x8_8x8x1_2x1_intrawave_v3,0,0,0
80,2048,32768,512,torch.float8_e4m3fnuz,71,0,283.8954,a8w8_bpreshuffle_256x128x128x64_16x16_16x16_4x64x1_4x64x1_1x32x1x8_8x8x1_2x1_intrawave_v3,0,0,0
80,2048,32768,1536,torch.float8_e4m3fnuz,71,0,610.8983,a8w8_bpreshuffle_256x128x128x64_16x16_16x16_4x64x1_4x64x1_1x32x1x8_8x8x1_2x1_intrawave_v3,0,0,0
80,2048,36864,7168,torch.float8_e4m3fnuz,93,0,2759.912,a8w8_bpreshuffle_256x64x192x128_16x16_16x16_8x32x1_8x32x1_1x32x1x8_8x8x1_2x1_intrawave_v3,0,0,0
80,4096,128,7168,torch.float8_e4m3fnuz,121,0,38.9415,a8w8_bpreshuffle_256x64x128x256_16x16_16x16_16x16x1_16x16x1_1x16x1x16_8x8x1_1x2_intrawave_v3,0,0,0
80,4096,4096,7168,torch.float8_e4m3fnuz,85,0,645.3373,a8w8_bpreshuffle_256x64x128x128_16x16_16x16_8x32x1_8x32x1_1x32x1x8_8x8x1_2x1_intrawave_v3,0,0,0
80,4096,7168,16384,torch.float8_e4m3fnuz,85,0,2443.998,a8w8_bpreshuffle_256x64x128x128_16x16_16x16_8x32x1_8x32x1_1x32x1x8_8x8x1_2x1_intrawave_v3,0,0,0
80,4096,7168,18432,torch.float8_e4m3fnuz,85,0,2773.2274,a8w8_bpreshuffle_256x64x128x128_16x16_16x16_8x32x1_8x32x1_1x32x1x8_8x8x1_2x1_intrawave_v3,0,0,0
80,4096,8192,1536,torch.float8_e4m3fnuz,71,0,307.3715,a8w8_bpreshuffle_256x128x128x64_16x16_16x16_4x64x1_4x64x1_1x32x1x8_8x8x1_2x1_intrawave_v3,0,0,0
80,4096,24576,1536,torch.float8_e4m3fnuz,72,0,920.9012,a8w8_bpreshuffle_256x64x256x64_16x16_16x16_4x64x1_4x64x1_1x16x1x16_8x8x1_1x2_intrawave_v1,0,0,0
80,4096,32768,512,torch.float8_e4m3fnuz,71,0,554.3222,a8w8_bpreshuffle_256x128x128x64_16x16_16x16_4x64x1_4x64x1_1x32x1x8_8x8x1_2x1_intrawave_v3,0,0,0
80,4096,32768,1536,torch.float8_e4m3fnuz,71,0,1193.686,a8w8_bpreshuffle_256x128x128x64_16x16_16x16_4x64x1_4x64x1_1x32x1x8_8x8x1_2x1_intrawave_v3,0,0,0
80,4096,36864,7168,torch.float8_e4m3fnuz,93,0,5492.6804,a8w8_bpreshuffle_256x64x192x128_16x16_16x16_8x32x1_8x32x1_1x32x1x8_8x8x1_2x1_intrawave_v3,0,0,0
80,6144,128,7168,torch.float8_e4m3fnuz,123,0,49.1848,a8w8_bpreshuffle_256x96x128x256_16x16_16x16_16x16x1_16x16x1_1x16x1x16_8x8x1_1x2_intrawave_v3,0,0,0
80,6144,512,7168,torch.float8_e4m3fnuz,85,0,143.4871,a8w8_bpreshuffle_256x64x128x128_16x16_16x16_8x32x1_8x32x1_1x32x1x8_8x8x1_2x1_intrawave_v3,0,0,0
80,6144,576,7168,torch.float8_e4m3fnuz,68,0,151.638,a8w8_bpreshuffle_256x128x192x128_16x16_16x16_8x32x1_8x32x1_1x32x1x8_8x8x1_2x1_intrawave_v3,0,0,0
80,6144,1536,7168,torch.float8_e4m3fnuz,93,0,368.8956,a8w8_bpreshuffle_256x64x192x128_16x16_16x16_8x32x1_8x32x1_1x32x1x8_8x8x1_2x1_intrawave_v3,0,0,0
80,6144,2240,7168,torch.float8_e4m3fnuz,69,0,662.2802,a8w8_bpreshuffle_256x128x160x128_16x16_16x16_8x32x1_8x32x1_1x64x1x4_8x8x1_2x1_intrawave_v3,0,0,0
80,6144,3072,1536,torch.float8_e4m3fnuz,85,0,183.0209,a8w8_bpreshuffle_256x64x128x128_16x16_16x16_8x32x1_8x32x1_1x32x1x8_8x8x1_2x1_intrawave_v3,0,0,0
80,6144,4096,512,torch.float8_e4m3fnuz,71,0,109.7738,a8w8_bpreshuffle_256x128x128x64_16x16_16x16_4x64x1_4x64x1_1x32x1x8_8x8x1_2x1_intrawave_v3,0,0,0
80,6144,4096,7168,torch.float8_e4m3fnuz,102,0,937.0884,a8w8_bpreshuffle_256x96x256x128_16x16_16x16_8x32x1_8x32x1_1x32x1x8_8x8x1_2x1_intrawave_v3,0,0,0
80,6144,4608,7168,torch.float8_e4m3fnuz,102,0,1071.1237,a8w8_bpreshuffle_256x96x256x128_16x16_16x16_8x32x1_8x32x1_1x32x1x8_8x8x1_2x1_intrawave_v3,0,0,0
80,6144,7168,256,torch.float8_e4m3fnuz,71,0,123.4161,a8w8_bpreshuffle_256x128x128x64_16x16_16x16_4x64x1_4x64x1_1x32x1x8_8x8x1_2x1_intrawave_v3,0,0,0
80,6144,7168,2048,torch.float8_e4m3fnuz,71,0,509.0789,a8w8_bpreshuffle_256x128x128x64_16x16_16x16_4x64x1_4x64x1_1x32x1x8_8x8x1_2x1_intrawave_v3,0,0,0
80,6144,7168,2304,torch.float8_e4m3fnuz,71,0,560.4929,a8w8_bpreshuffle_256x128x128x64_16x16_16x16_4x64x1_4x64x1_1x32x1x8_8x8x1_2x1_intrawave_v3,0,0,0
80,6144,7168,16384,torch.float8_e4m3fnuz,85,0,3671.969,a8w8_bpreshuffle_256x64x128x128_16x16_16x16_8x32x1_8x32x1_1x32x1x8_8x8x1_2x1_intrawave_v3,0,0,0
80,6144,7168,18432,torch.float8_e4m3fnuz,85,0,4139.4899,a8w8_bpreshuffle_256x64x128x128_16x16_16x16_8x32x1_8x32x1_1x32x1x8_8x8x1_2x1_intrawave_v3,0,0,0
80,6144,8192,1536,torch.float8_e4m3fnuz,71,0,455.0275,a8w8_bpreshuffle_256x128x128x64_16x16_16x16_4x64x1_4x64x1_1x32x1x8_8x8x1_2x1_intrawave_v3,0,0,0
80,6144,11264,1536,torch.float8_e4m3fnuz,71,0,614.8496,a8w8_bpreshuffle_256x128x128x64_16x16_16x16_4x64x1_4x64x1_1x32x1x8_8x8x1_2x1_intrawave_v3,0,0,0
80,6144,24576,1536,torch.float8_e4m3fnuz,71,0,1348.8178,a8w8_bpreshuffle_256x128x128x64_16x16_16x16_4x64x1_4x64x1_1x32x1x8_8x8x1_2x1_intrawave_v3,0,0,0
80,6144,32768,512,torch.float8_e4m3fnuz,71,0,793.4262,a8w8_bpreshuffle_256x128x128x64_16x16_16x16_4x64x1_4x64x1_1x32x1x8_8x8x1_2x1_intrawave_v3,0,0,0
80,6144,32768,1536,torch.float8_e4m3fnuz,102,0,1794.6908,a8w8_bpreshuffle_256x96x256x128_16x16_16x16_8x32x1_8x32x1_1x32x1x8_8x8x1_2x1_intrawave_v3,0,0,0
80,6144,36864,7168,torch.float8_e4m3fnuz,93,0,8229.8778,a8w8_bpreshuffle_256x64x192x128_16x16_16x16_8x32x1_8x32x1_1x32x1x8_8x8x1_2x1_intrawave_v3,0,0,0
80,8192,128,7168,torch.float8_e4m3fnuz,124,0,61.8924,a8w8_bpreshuffle_256x112x128x256_16x16_16x16_16x16x1_16x16x1_1x16x1x16_8x8x1_1x2_intrawave_v3,0,0,0
80,8192,4096,7168,torch.float8_e4m3fnuz,85,0,1259.5274,a8w8_bpreshuffle_256x64x128x128_16x16_16x16_8x32x1_8x32x1_1x32x1x8_8x8x1_2x1_intrawave_v3,0,0,0
80,8192,7168,16384,torch.float8_e4m3fnuz,85,0,4942.7227,a8w8_bpreshuffle_256x64x128x128_16x16_16x16_8x32x1_8x32x1_1x32x1x8_8x8x1_2x1_intrawave_v3,0,0,0
80,8192,7168,18432,torch.float8_e4m3fnuz,85,0,5501.8021,a8w8_bpreshuffle_256x64x128x128_16x16_16x16_8x32x1_8x32x1_1x32x1x8_8x8x1_2x1_intrawave_v3,0,0,0
80,8192,8192,1536,torch.float8_e4m3fnuz,72,0,621.3308,a8w8_bpreshuffle_256x64x256x64_16x16_16x16_4x64x1_4x64x1_1x16x1x16_8x8x1_1x2_intrawave_v1,0,0,0
80,8192,24576,1536,torch.float8_e4m3fnuz,71,0,1786.9965,a8w8_bpreshuffle_256x128x128x64_16x16_16x16_4x64x1_4x64x1_1x32x1x8_8x8x1_2x1_intrawave_v3,0,0,0
80,8192,32768,512,torch.float8_e4m3fnuz,71,0,1053.245,a8w8_bpreshuffle_256x128x128x64_16x16_16x16_4x64x1_4x64x1_1x32x1x8_8x8x1_2x1_intrawave_v3,0,0,0
80,8192,32768,1536,torch.float8_e4m3fnuz,71,0,2345.8711,a8w8_bpreshuffle_256x128x128x64_16x16_16x16_4x64x1_4x64x1_1x32x1x8_8x8x1_2x1_intrawave_v3,0,0,0
80,8192,36864,7168,torch.float8_e4m3fnuz,93,0,10983.7146,a8w8_bpreshuffle_256x64x192x128_16x16_16x16_8x32x1_8x32x1_1x32x1x8_8x8x1_2x1_intrawave_v3,0,0,0
80,10240,128,7168,torch.float8_e4m3fnuz,121,0,63.2764,a8w8_bpreshuffle_256x64x128x256_16x16_16x16_16x16x1_16x16x1_1x16x1x16_8x8x1_1x2_intrawave_v3,0,0,0
80,10240,512,7168,torch.float8_e4m3fnuz,0,0,211.3264,a8w8_bpreshuffle_256x128x128x128_16x16_16x16_8x32x1_8x32x1_1x32x1x8_8x8x1_2x1_intrawave_v3,0,0,0
80,10240,576,7168,torch.float8_e4m3fnuz,68,0,230.3376,a8w8_bpreshuffle_256x128x192x128_16x16_16x16_8x32x1_8x32x1_1x32x1x8_8x8x1_2x1_intrawave_v3,0,0,0
80,10240,1536,7168,torch.float8_e4m3fnuz,68,0,583.4998,a8w8_bpreshuffle_256x128x192x128_16x16_16x16_8x32x1_8x32x1_1x32x1x8_8x8x1_2x1_intrawave_v3,0,0,0
80,10240,2240,7168,torch.float8_e4m3fnuz,69,0,1018.0438,a8w8_bpreshuffle_256x128x160x128_16x16_16x16_8x32x1_8x32x1_1x64x1x4_8x8x1_2x1_intrawave_v3,0,0,0
80,10240,3072,1536,torch.float8_e4m3fnuz,71,0,290.0173,a8w8_bpreshuffle_256x128x128x64_16x16_16x16_4x64x1_4x64x1_1x32x1x8_8x8x1_2x1_intrawave_v3,0,0,0
80,10240,4096,512,torch.float8_e4m3fnuz,71,0,173.8713,a8w8_bpreshuffle_256x128x128x64_16x16_16x16_4x64x1_4x64x1_1x32x1x8_8x8x1_2x1_intrawave_v3,0,0,0
80,10240,4096,7168,torch.float8_e4m3fnuz,85,0,1574.2695,a8w8_bpreshuffle_256x64x128x128_16x16_16x16_8x32x1_8x32x1_1x32x1x8_8x8x1_2x1_intrawave_v3,0,0,0
80,10240,4608,7168,torch.float8_e4m3fnuz,93,0,1722.172,a8w8_bpreshuffle_256x64x192x128_16x16_16x16_8x32x1_8x32x1_1x32x1x8_8x8x1_2x1_intrawave_v3,0,0,0
80,10240,7168,256,torch.float8_e4m3fnuz,71,0,199.187,a8w8_bpreshuffle_256x128x128x64_16x16_16x16_4x64x1_4x64x1_1x32x1x8_8x8x1_2x1_intrawave_v3,0,0,0
80,10240,7168,2048,torch.float8_e4m3fnuz,71,0,843.0746,a8w8_bpreshuffle_256x128x128x64_16x16_16x16_4x64x1_4x64x1_1x32x1x8_8x8x1_2x1_intrawave_v3,0,0,0
80,10240,7168,2304,torch.float8_e4m3fnuz,71,0,913.7132,a8w8_bpreshuffle_256x128x128x64_16x16_16x16_4x64x1_4x64x1_1x32x1x8_8x8x1_2x1_intrawave_v3,0,0,0
80,10240,7168,16384,torch.float8_e4m3fnuz,85,0,6072.4257,a8w8_bpreshuffle_256x64x128x128_16x16_16x16_8x32x1_8x32x1_1x32x1x8_8x8x1_2x1_intrawave_v3,0,0,0
80,10240,7168,18432,torch.float8_e4m3fnuz,85,0,6834.6666,a8w8_bpreshuffle_256x64x128x128_16x16_16x16_8x32x1_8x32x1_1x32x1x8_8x8x1_2x1_intrawave_v3,0,0,0
80,10240,8192,1536,torch.float8_e4m3fnuz,71,0,754.6592,a8w8_bpreshuffle_256x128x128x64_16x16_16x16_4x64x1_4x64x1_1x32x1x8_8x8x1_2x1_intrawave_v3,0,0,0
80,10240,11264,1536,torch.float8_e4m3fnuz,71,0,1039.4493,a8w8_bpreshuffle_256x128x128x64_16x16_16x16_4x64x1_4x64x1_1x32x1x8_8x8x1_2x1_intrawave_v3,0,0,0
80,10240,24576,1536,torch.float8_e4m3fnuz,71,0,2209.3759,a8w8_bpreshuffle_256x128x128x64_16x16_16x16_4x64x1_4x64x1_1x32x1x8_8x8x1_2x1_intrawave_v3,0,0,0
80,10240,32768,512,torch.float8_e4m3fnuz,72,0,1357.7711,a8w8_bpreshuffle_256x64x256x64_16x16_16x16_4x64x1_4x64x1_1x16x1x16_8x8x1_1x2_intrawave_v1,0,0,0
80,10240,32768,1536,torch.float8_e4m3fnuz,71,0,2923.8951,a8w8_bpreshuffle_256x128x128x64_16x16_16x16_4x64x1_4x64x1_1x32x1x8_8x8x1_2x1_intrawave_v3,0,0,0
80,10240,36864,7168,torch.float8_e4m3fnuz,93,0,13738.3404,a8w8_bpreshuffle_256x64x192x128_16x16_16x16_8x32x1_8x32x1_1x32x1x8_8x8x1_2x1_intrawave_v3,0,0,0
80,12288,128,7168,torch.float8_e4m3fnuz,141,0,84.5069,a8w8_bpreshuffle_256x160x128x128_16x16_16x16_8x32x1_8x32x1_1x16x1x16_8x8x1_1x2_intrawave_v3,0,0,0
80,12288,512,7168,torch.float8_e4m3fnuz,0,0,262.6171,a8w8_bpreshuffle_256x128x128x128_16x16_16x16_8x32x1_8x32x1_1x32x1x8_8x8x1_2x1_intrawave_v3,0,0,0
80,12288,576,7168,torch.float8_e4m3fnuz,94,0,285.6522,a8w8_bpreshuffle_256x96x192x128_16x16_16x16_8x32x1_8x32x1_1x32x1x8_8x8x1_2x1_intrawave_v3,0,0,0
80,12288,1536,7168,torch.float8_e4m3fnuz,94,0,718.7933,a8w8_bpreshuffle_256x96x192x128_16x16_16x16_8x32x1_8x32x1_1x32x1x8_8x8x1_2x1_intrawave_v3,0,0,0
80,12288,2240,7168,torch.float8_e4m3fnuz,69,0,1231.0498,a8w8_bpreshuffle_256x128x160x128_16x16_16x16_8x32x1_8x32x1_1x64x1x4_8x8x1_2x1_intrawave_v3,0,0,0
80,12288,3072,1536,torch.float8_e4m3fnuz,72,0,352.0628,a8w8_bpreshuffle_256x64x256x64_16x16_16x16_4x64x1_4x64x1_1x16x1x16_8x8x1_1x2_intrawave_v1,0,0,0
80,12288,4096,512,torch.float8_e4m3fnuz,71,0,207.219,a8w8_bpreshuffle_256x128x128x64_16x16_16x16_4x64x1_4x64x1_1x32x1x8_8x8x1_2x1_intrawave_v3,0,0,0
80,12288,4096,7168,torch.float8_e4m3fnuz,102,0,1858.9016,a8w8_bpreshuffle_256x96x256x128_16x16_16x16_8x32x1_8x32x1_1x32x1x8_8x8x1_2x1_intrawave_v3,0,0,0
80,12288,4608,7168,torch.float8_e4m3fnuz,68,0,2079.1883,a8w8_bpreshuffle_256x128x192x128_16x16_16x16_8x32x1_8x32x1_1x32x1x8_8x8x1_2x1_intrawave_v3,0,0,0
80,12288,7168,256,torch.float8_e4m3fnuz,71,0,243.398,a8w8_bpreshuffle_256x128x128x64_16x16_16x16_4x64x1_4x64x1_1x32x1x8_8x8x1_2x1_intrawave_v3,0,0,0
80,12288,7168,2048,torch.float8_e4m3fnuz,71,0,1001.5776,a8w8_bpreshuffle_256x128x128x64_16x16_16x16_4x64x1_4x64x1_1x32x1x8_8x8x1_2x1_intrawave_v3,0,0,0
80,12288,7168,2304,torch.float8_e4m3fnuz,72,0,1134.7441,a8w8_bpreshuffle_256x64x256x64_16x16_16x16_4x64x1_4x64x1_1x16x1x16_8x8x1_1x2_intrawave_v1,0,0,0
80,12288,7168,16384,torch.float8_e4m3fnuz,102,0,7272.8109,a8w8_bpreshuffle_256x96x256x128_16x16_16x16_8x32x1_8x32x1_1x32x1x8_8x8x1_2x1_intrawave_v3,0,0,0
80,12288,7168,18432,torch.float8_e4m3fnuz,102,0,8054.046,a8w8_bpreshuffle_256x96x256x128_16x16_16x16_8x32x1_8x32x1_1x32x1x8_8x8x1_2x1_intrawave_v3,0,0,0
80,12288,8192,1536,torch.float8_e4m3fnuz,102,0,912.1361,a8w8_bpreshuffle_256x96x256x128_16x16_16x16_8x32x1_8x32x1_1x32x1x8_8x8x1_2x1_intrawave_v3,0,0,0
80,12288,11264,1536,torch.float8_e4m3fnuz,71,0,1221.6133,a8w8_bpreshuffle_256x128x128x64_16x16_16x16_4x64x1_4x64x1_1x32x1x8_8x8x1_2x1_intrawave_v3,0,0,0
80,12288,24576,1536,torch.float8_e4m3fnuz,71,0,2656.0688,a8w8_bpreshuffle_256x128x128x64_16x16_16x16_4x64x1_4x64x1_1x32x1x8_8x8x1_2x1_intrawave_v3,0,0,0
80,12288,32768,512,torch.float8_e4m3fnuz,71,0,1573.8691,a8w8_bpreshuffle_256x128x128x64_16x16_16x16_4x64x1_4x64x1_1x32x1x8_8x8x1_2x1_intrawave_v3,0,0,0
80,12288,32768,1536,torch.float8_e4m3fnuz,71,0,3526.7572,a8w8_bpreshuffle_256x128x128x64_16x16_16x16_4x64x1_4x64x1_1x32x1x8_8x8x1_2x1_intrawave_v3,0,0,0
80,12288,36864,7168,torch.float8_e4m3fnuz,93,0,16426.5845,a8w8_bpreshuffle_256x64x192x128_16x16_16x16_8x32x1_8x32x1_1x32x1x8_8x8x1_2x1_intrawave_v3,0,0,0
80,14336,128,7168,torch.float8_e4m3fnuz,86,0,91.5501,a8w8_bpreshuffle_256x96x128x128_16x16_16x16_8x32x1_8x32x1_1x32x1x8_8x8x1_2x1_intrawave_v3,0,0,0
80,14336,512,7168,torch.float8_e4m3fnuz,102,0,306.9194,a8w8_bpreshuffle_256x96x256x128_16x16_16x16_8x32x1_8x32x1_1x32x1x8_8x8x1_2x1_intrawave_v3,0,0,0
80,14336,576,7168,torch.float8_e4m3fnuz,93,0,341.468,a8w8_bpreshuffle_256x64x192x128_16x16_16x16_8x32x1_8x32x1_1x32x1x8_8x8x1_2x1_intrawave_v3,0,0,0
80,14336,1536,7168,torch.float8_e4m3fnuz,93,0,830.4984,a8w8_bpreshuffle_256x64x192x128_16x16_16x16_8x32x1_8x32x1_1x32x1x8_8x8x1_2x1_intrawave_v3,0,0,0
80,14336,2240,7168,torch.float8_e4m3fnuz,69,0,1461.7946,a8w8_bpreshuffle_256x128x160x128_16x16_16x16_8x32x1_8x32x1_1x64x1x4_8x8x1_2x1_intrawave_v3,0,0,0
80,14336,3072,1536,torch.float8_e4m3fnuz,93,0,405.8954,a8w8_bpreshuffle_256x64x192x128_16x16_16x16_8x32x1_8x32x1_1x32x1x8_8x8x1_2x1_intrawave_v3,0,0,0
80,14336,4096,512,torch.float8_e4m3fnuz,71,0,239.3595,a8w8_bpreshuffle_256x128x128x64_16x16_16x16_4x64x1_4x64x1_1x32x1x8_8x8x1_2x1_intrawave_v3,0,0,0
80,14336,4096,7168,torch.float8_e4m3fnuz,85,0,2197.8676,a8w8_bpreshuffle_256x64x128x128_16x16_16x16_8x32x1_8x32x1_1x32x1x8_8x8x1_2x1_intrawave_v3,0,0,0
80,14336,4608,7168,torch.float8_e4m3fnuz,93,0,2431.1066,a8w8_bpreshuffle_256x64x192x128_16x16_16x16_8x32x1_8x32x1_1x32x1x8_8x8x1_2x1_intrawave_v3,0,0,0
80,14336,7168,256,torch.float8_e4m3fnuz,72,0,297.7928,a8w8_bpreshuffle_256x64x256x64_16x16_16x16_4x64x1_4x64x1_1x16x1x16_8x8x1_1x2_intrawave_v1,0,0,0
80,14336,7168,2048,torch.float8_e4m3fnuz,74,0,1199.9511,a8w8_bpreshuffle_256x64x256x64_16x16_16x16_4x64x1_4x64x1_1x32x1x8_8x8x1_2x1_intrawave_v1,0,0,0
80,14336,7168,2304,torch.float8_e4m3fnuz,71,0,1310.3925,a8w8_bpreshuffle_256x128x128x64_16x16_16x16_4x64x1_4x64x1_1x32x1x8_8x8x1_2x1_intrawave_v3,0,0,0
80,14336,7168,16384,torch.float8_e4m3fnuz,85,0,8455.8581,a8w8_bpreshuffle_256x64x128x128_16x16_16x16_8x32x1_8x32x1_1x32x1x8_8x8x1_2x1_intrawave_v3,0,0,0
80,14336,7168,18432,torch.float8_e4m3fnuz,85,0,9585.3754,a8w8_bpreshuffle_256x64x128x128_16x16_16x16_8x32x1_8x32x1_1x32x1x8_8x8x1_2x1_intrawave_v3,0,0,0
80,14336,8192,1536,torch.float8_e4m3fnuz,71,0,1039.5469,a8w8_bpreshuffle_256x128x128x64_16x16_16x16_4x64x1_4x64x1_1x32x1x8_8x8x1_2x1_intrawave_v3,0,0,0
80,14336,11264,1536,torch.float8_e4m3fnuz,71,0,1422.2274,a8w8_bpreshuffle_256x128x128x64_16x16_16x16_4x64x1_4x64x1_1x32x1x8_8x8x1_2x1_intrawave_v3,0,0,0
80,14336,24576,1536,torch.float8_e4m3fnuz,71,0,3089.1315,a8w8_bpreshuffle_256x128x128x64_16x16_16x16_4x64x1_4x64x1_1x32x1x8_8x8x1_2x1_intrawave_v3,0,0,0
80,14336,32768,512,torch.float8_e4m3fnuz,71,0,1827.3845,a8w8_bpreshuffle_256x128x128x64_16x16_16x16_4x64x1_4x64x1_1x32x1x8_8x8x1_2x1_intrawave_v3,0,0,0
80,14336,32768,1536,torch.float8_e4m3fnuz,71,0,4108.8811,a8w8_bpreshuffle_256x128x128x64_16x16_16x16_4x64x1_4x64x1_1x32x1x8_8x8x1_2x1_intrawave_v3,0,0,0
80,14336,36864,7168,torch.float8_e4m3fnuz,93,0,19165.8682,a8w8_bpreshuffle_256x64x192x128_16x16_16x16_8x32x1_8x32x1_1x32x1x8_8x8x1_2x1_intrawave_v3,0,0,0
80,16384,128,7168,torch.float8_e4m3fnuz,0,0,114.6838,a8w8_bpreshuffle_256x128x128x128_16x16_16x16_8x32x1_8x32x1_1x32x1x8_8x8x1_2x1_intrawave_v3,0,0,0
80,16384,4096,7168,torch.float8_e4m3fnuz,85,0,2498.7773,a8w8_bpreshuffle_256x64x128x128_16x16_16x16_8x32x1_8x32x1_1x32x1x8_8x8x1_2x1_intrawave_v3,0,0,0
80,16384,7168,16384,torch.float8_e4m3fnuz,85,0,9679.208,a8w8_bpreshuffle_256x64x128x128_16x16_16x16_8x32x1_8x32x1_1x32x1x8_8x8x1_2x1_intrawave_v3,0,0,0
80,16384,7168,18432,torch.float8_e4m3fnuz,85,0,10922.6859,a8w8_bpreshuffle_256x64x128x128_16x16_16x16_8x32x1_8x32x1_1x32x1x8_8x8x1_2x1_intrawave_v3,0,0,0
80,16384,8192,1536,torch.float8_e4m3fnuz,71,0,1182.4869,a8w8_bpreshuffle_256x128x128x64_16x16_16x16_4x64x1_4x64x1_1x32x1x8_8x8x1_2x1_intrawave_v3,0,0,0
80,16384,24576,1536,torch.float8_e4m3fnuz,71,0,3536.4999,a8w8_bpreshuffle_256x128x128x64_16x16_16x16_4x64x1_4x64x1_1x32x1x8_8x8x1_2x1_intrawave_v3,0,0,0
80,16384,32768,512,torch.float8_e4m3fnuz,71,0,2090.8366,a8w8_bpreshuffle_256x128x128x64_16x16_16x16_4x64x1_4x64x1_1x32x1x8_8x8x1_2x1_intrawave_v3,0,0,0
80,16384,32768,1536,torch.float8_e4m3fnuz,71,0,4672.9569,a8w8_bpreshuffle_256x128x128x64_16x16_16x16_4x64x1_4x64x1_1x32x1x8_8x8x1_2x1_intrawave_v3,0,0,0
80,16384,36864,7168,torch.float8_e4m3fnuz,71,0,21975.6028,a8w8_bpreshuffle_256x128x128x64_16x16_16x16_4x64x1_4x64x1_1x32x1x8_8x8x1_2x1_intrawave_v3,0,0,0
80,32768,128,7168,torch.float8_e4m3fnuz,121,0,208.4886,a8w8_bpreshuffle_256x64x128x256_16x16_16x16_16x16x1_16x16x1_1x16x1x16_8x8x1_1x2_intrawave_v3,0,0,0
80,32768,576,7168,torch.float8_e4m3fnuz,68,0,729.7961,a8w8_bpreshuffle_256x128x192x128_16x16_16x16_8x32x1_8x32x1_1x32x1x8_8x8x1_2x1_intrawave_v3,0,0,0
80,32768,1536,7168,torch.float8_e4m3fnuz,68,0,1872.4274,a8w8_bpreshuffle_256x128x192x128_16x16_16x16_8x32x1_8x32x1_1x32x1x8_8x8x1_2x1_intrawave_v3,0,0,0
80,32768,3072,1536,torch.float8_e4m3fnuz,71,0,909.865,a8w8_bpreshuffle_256x128x128x64_16x16_16x16_4x64x1_4x64x1_1x32x1x8_8x8x1_2x1_intrawave_v3,0,0,0
80,32768,4096,7168,torch.float8_e4m3fnuz,74,0,5016.1101,a8w8_bpreshuffle_256x64x256x64_16x16_16x16_4x64x1_4x64x1_1x32x1x8_8x8x1_2x1_intrawave_v1,0,0,0
80,32768,7168,2048,torch.float8_e4m3fnuz,72,0,2704.1764,a8w8_bpreshuffle_256x64x256x64_16x16_16x16_4x64x1_4x64x1_1x16x1x16_8x8x1_1x2_intrawave_v1,0,0,0
80,32768,7168,16384,torch.float8_e4m3fnuz,85,0,19294.1288,a8w8_bpreshuffle_256x64x128x128_16x16_16x16_8x32x1_8x32x1_1x32x1x8_8x8x1_2x1_intrawave_v3,0,0,0
80,32768,7168,18432,torch.float8_e4m3fnuz,85,0,21856.5731,a8w8_bpreshuffle_256x64x128x128_16x16_16x16_8x32x1_8x32x1_1x32x1x8_8x8x1_2x1_intrawave_v3,0,0,0
80,32768,8192,1536,torch.float8_e4m3fnuz,71,0,2344.2068,a8w8_bpreshuffle_256x128x128x64_16x16_16x16_4x64x1_4x64x1_1x32x1x8_8x8x1_2x1_intrawave_v3,0,0,0
80,32768,24576,1536,torch.float8_e4m3fnuz,71,0,7017.8836,a8w8_bpreshuffle_256x128x128x64_16x16_16x16_4x64x1_4x64x1_1x32x1x8_8x8x1_2x1_intrawave_v3,0,0,0
80,32768,32768,512,torch.float8_e4m3fnuz,71,0,4165.6734,a8w8_bpreshuffle_256x128x128x64_16x16_16x16_4x64x1_4x64x1_1x32x1x8_8x8x1_2x1_intrawave_v3,0,0,0
80,32768,32768,1536,torch.float8_e4m3fnuz,71,0,9432.9791,a8w8_bpreshuffle_256x128x128x64_16x16_16x16_4x64x1_4x64x1_1x32x1x8_8x8x1_2x1_intrawave_v3,0,0,0
80,32768,36864,7168,torch.float8_e4m3fnuz,93,0,43711.479,a8w8_bpreshuffle_256x64x192x128_16x16_16x16_8x32x1_8x32x1_1x32x1x8_8x8x1_2x1_intrawave_v3,0,0,0
80,65536,128,7168,torch.float8_e4m3fnuz,121,0,383.2232,a8w8_bpreshuffle_256x64x128x256_16x16_16x16_16x16x1_16x16x1_1x16x1x16_8x8x1_1x2_intrawave_v3,0,0,0
80,65536,512,7168,torch.float8_e4m3fnuz,70,0,1327.0618,a8w8_bpreshuffle_256x128x128x128_16x16_16x16_8x32x1_8x32x1_1x32x1x8_8x8x1_2x1_intrawave_v3,0,0,0
80,65536,576,7168,torch.float8_e4m3fnuz,93,0,1429.9239,a8w8_bpreshuffle_256x64x192x128_16x16_16x16_8x32x1_8x32x1_1x32x1x8_8x8x1_2x1_intrawave_v3,0,0,0
80,65536,1536,7168,torch.float8_e4m3fnuz,93,0,3736.9156,a8w8_bpreshuffle_256x64x192x128_16x16_16x16_8x32x1_8x32x1_1x32x1x8_8x8x1_2x1_intrawave_v3,0,0,0
80,65536,3072,1536,torch.float8_e4m3fnuz,71,0,1787.3796,a8w8_bpreshuffle_256x128x128x64_16x16_16x16_4x64x1_4x64x1_1x32x1x8_8x8x1_2x1_intrawave_v3,0,0,0
80,65536,4096,512,torch.float8_e4m3fnuz,71,0,1055.1661,a8w8_bpreshuffle_256x128x128x64_16x16_16x16_4x64x1_4x64x1_1x32x1x8_8x8x1_2x1_intrawave_v3,0,0,0
80,65536,4096,7168,torch.float8_e4m3fnuz,85,0,9976.6212,a8w8_bpreshuffle_256x64x128x128_16x16_16x16_8x32x1_8x32x1_1x32x1x8_8x8x1_2x1_intrawave_v3,0,0,0
80,65536,4608,7168,torch.float8_e4m3fnuz,68,0,11016.6648,a8w8_bpreshuffle_256x128x192x128_16x16_16x16_8x32x1_8x32x1_1x32x1x8_8x8x1_2x1_intrawave_v3,0,0,0
80,65536,7168,256,torch.float8_e4m3fnuz,71,0,1212.7558,a8w8_bpreshuffle_256x128x128x64_16x16_16x16_4x64x1_4x64x1_1x32x1x8_8x8x1_2x1_intrawave_v3,0,0,0
80,65536,7168,2048,torch.float8_e4m3fnuz,71,0,5287.9696,a8w8_bpreshuffle_256x128x128x64_16x16_16x16_4x64x1_4x64x1_1x32x1x8_8x8x1_2x1_intrawave_v3,0,0,0
80,65536,7168,2304,torch.float8_e4m3fnuz,71,0,5871.5636,a8w8_bpreshuffle_256x128x128x64_16x16_16x16_4x64x1_4x64x1_1x32x1x8_8x8x1_2x1_intrawave_v3,0,0,0
80,65536,7168,16384,torch.float8_e4m3fnuz,85,0,38748.1812,a8w8_bpreshuffle_256x64x128x128_16x16_16x16_8x32x1_8x32x1_1x32x1x8_8x8x1_2x1_intrawave_v3,0,0,0
80,65536,7168,18432,torch.float8_e4m3fnuz,85,0,43467.0784,a8w8_bpreshuffle_256x64x128x128_16x16_16x16_8x32x1_8x32x1_1x32x1x8_8x8x1_2x1_intrawave_v3,0,0,0
80,65536,8192,1536,torch.float8_e4m3fnuz,71,0,4684.7126,a8w8_bpreshuffle_256x128x128x64_16x16_16x16_4x64x1_4x64x1_1x32x1x8_8x8x1_2x1_intrawave_v3,0,0,0
80,65536,24576,1536,torch.float8_e4m3fnuz,0,0,inf,a8w8_bpreshuffle_256x128x128x128_16x16_16x16_8x32x1_8x32x1_1x32x1x8_8x8x1_2x1_intrawave_v3,0,0,0
80,65536,32768,512,torch.float8_e4m3fnuz,74,0,,a8w8_bpreshuffle_256x64x256x64_16x16_16x16_4x64x1_4x64x1_1x32x1x8_8x8x1_2x1_intrawave_v1,0,0,0
80,65536,32768,1536,torch.float8_e4m3fnuz,0,0,,a8w8_bpreshuffle_256x128x128x128_16x16_16x16_8x32x1_8x32x1_1x32x1x8_8x8x1_2x1_intrawave_v3,0,0,0
80,65536,36864,7168,torch.float8_e4m3fnuz,0,0,,a8w8_bpreshuffle_256x128x128x128_16x16_16x16_8x32x1_8x32x1_1x32x1x8_8x8x1_2x1_intrawave_v3,0,0,0
80,98304,128,7168,torch.float8_e4m3fnuz,87,0,561.5334,a8w8_bpreshuffle_256x128x128x128_16x16_16x16_8x32x1_8x32x1_1x16x1x16_4x4x1_1x1_intrawave_v3,0,0,0
80,98304,512,7168,torch.float8_e4m3fnuz,102,0,1866.4062,a8w8_bpreshuffle_256x96x256x128_16x16_16x16_8x32x1_8x32x1_1x32x1x8_8x8x1_2x1_intrawave_v3,0,0,0
80,98304,576,7168,torch.float8_e4m3fnuz,95,0,2112.9835,a8w8_bpreshuffle_256x128x192x128_16x16_16x16_8x32x1_8x32x1_1x16x1x16_4x4x1_1x1_intrawave_v3,0,0,0
80,98304,1536,7168,torch.float8_e4m3fnuz,102,0,5497.497,a8w8_bpreshuffle_256x96x256x128_16x16_16x16_8x32x1_8x32x1_1x32x1x8_8x8x1_2x1_intrawave_v3,0,0,0
80,98304,2240,7168,torch.float8_e4m3fnuz,69,0,9755.5399,a8w8_bpreshuffle_256x128x160x128_16x16_16x16_8x32x1_8x32x1_1x64x1x4_8x8x1_2x1_intrawave_v3,0,0,0
80,98304,3072,1536,torch.float8_e4m3fnuz,102,0,2698.4705,a8w8_bpreshuffle_256x96x256x128_16x16_16x16_8x32x1_8x32x1_1x32x1x8_8x8x1_2x1_intrawave_v3,0,0,0
80,98304,4096,512,torch.float8_e4m3fnuz,71,0,1607.6098,a8w8_bpreshuffle_256x128x128x64_16x16_16x16_4x64x1_4x64x1_1x32x1x8_8x8x1_2x1_intrawave_v3,0,0,0
80,98304,4096,7168,torch.float8_e4m3fnuz,102,0,14573.0079,a8w8_bpreshuffle_256x96x256x128_16x16_16x16_8x32x1_8x32x1_1x32x1x8_8x8x1_2x1_intrawave_v3,0,0,0
80,98304,4608,7168,torch.float8_e4m3fnuz,102,0,16377.2032,a8w8_bpreshuffle_256x96x256x128_16x16_16x16_8x32x1_8x32x1_1x32x1x8_8x8x1_2x1_intrawave_v3,0,0,0
80,98304,7168,256,torch.float8_e4m3fnuz,72,0,1997.5301,a8w8_bpreshuffle_256x64x256x64_16x16_16x16_4x64x1_4x64x1_1x16x1x16_8x8x1_1x2_intrawave_v1,0,0,0
80,98304,7168,2048,torch.float8_e4m3fnuz,72,0,8086.5215,a8w8_bpreshuffle_256x64x256x64_16x16_16x16_4x64x1_4x64x1_1x16x1x16_8x8x1_1x2_intrawave_v1,0,0,0
80,98304,7168,2304,torch.float8_e4m3fnuz,71,0,8879.3992,a8w8_bpreshuffle_256x128x128x64_16x16_16x16_4x64x1_4x64x1_1x32x1x8_8x8x1_2x1_intrawave_v3,0,0,0
80,98304,7168,16384,torch.float8_e4m3fnuz,102,0,57025.1637,a8w8_bpreshuffle_256x96x256x128_16x16_16x16_8x32x1_8x32x1_1x32x1x8_8x8x1_2x1_intrawave_v3,0,0,0
80,98304,7168,18432,torch.float8_e4m3fnuz,102,0,63990.1906,a8w8_bpreshuffle_256x96x256x128_16x16_16x16_8x32x1_8x32x1_1x32x1x8_8x8x1_2x1_intrawave_v3,0,0,0
80,98304,8192,1536,torch.float8_e4m3fnuz,71,0,7034.6763,a8w8_bpreshuffle_256x128x128x64_16x16_16x16_4x64x1_4x64x1_1x32x1x8_8x8x1_2x1_intrawave_v3,0,0,0
80,98304,11264,1536,torch.float8_e4m3fnuz,71,0,9673.3902,a8w8_bpreshuffle_256x128x128x64_16x16_16x16_4x64x1_4x64x1_1x32x1x8_8x8x1_2x1_intrawave_v3,0,0,0
80,98304,24576,1536,torch.float8_e4m3fnuz,0,0,,a8w8_bpreshuffle_256x128x128x128_16x16_16x16_8x32x1_8x32x1_1x32x1x8_8x8x1_2x1_intrawave_v3,0,0,0
80,98304,32768,1536,torch.float8_e4m3fnuz,0,0,,a8w8_bpreshuffle_256x128x128x128_16x16_16x16_8x32x1_8x32x1_1x32x1x8_8x8x1_2x1_intrawave_v3,0,0,0
80,131072,128,7168,torch.float8_e4m3fnuz,0,0,719.3472,a8w8_bpreshuffle_256x128x128x128_16x16_16x16_8x32x1_8x32x1_1x32x1x8_8x8x1_2x1_intrawave_v3,0,0,0
80,131072,512,7168,torch.float8_e4m3fnuz,102,0,2615.157,a8w8_bpreshuffle_256x96x256x128_16x16_16x16_8x32x1_8x32x1_1x32x1x8_8x8x1_2x1_intrawave_v3,0,0,0
80,131072,576,7168,torch.float8_e4m3fnuz,93,0,2822.5197,a8w8_bpreshuffle_256x64x192x128_16x16_16x16_8x32x1_8x32x1_1x32x1x8_8x8x1_2x1_intrawave_v3,0,0,0
80,131072,1536,7168,torch.float8_e4m3fnuz,68,0,7429.8789,a8w8_bpreshuffle_256x128x192x128_16x16_16x16_8x32x1_8x32x1_1x32x1x8_8x8x1_2x1_intrawave_v3,0,0,0
80,131072,3072,1536,torch.float8_e4m3fnuz,71,0,3559.9187,a8w8_bpreshuffle_256x128x128x64_16x16_16x16_4x64x1_4x64x1_1x32x1x8_8x8x1_2x1_intrawave_v3,0,0,0
80,131072,4096,512,torch.float8_e4m3fnuz,71,0,2125.6078,a8w8_bpreshuffle_256x128x128x64_16x16_16x16_4x64x1_4x64x1_1x32x1x8_8x8x1_2x1_intrawave_v3,0,0,0
80,131072,4096,7168,torch.float8_e4m3fnuz,85,0,19941.3998,a8w8_bpreshuffle_256x64x128x128_16x16_16x16_8x32x1_8x32x1_1x32x1x8_8x8x1_2x1_intrawave_v3,0,0,0
80,131072,4608,7168,torch.float8_e4m3fnuz,93,0,21987.1209,a8w8_bpreshuffle_256x64x192x128_16x16_16x16_8x32x1_8x32x1_1x32x1x8_8x8x1_2x1_intrawave_v3,0,0,0
80,131072,7168,256,torch.float8_e4m3fnuz,71,0,2444.3347,a8w8_bpreshuffle_256x128x128x64_16x16_16x16_4x64x1_4x64x1_1x32x1x8_8x8x1_2x1_intrawave_v3,0,0,0
80,131072,7168,2048,torch.float8_e4m3fnuz,71,0,10519.7293,a8w8_bpreshuffle_256x128x128x64_16x16_16x16_4x64x1_4x64x1_1x32x1x8_8x8x1_2x1_intrawave_v3,0,0,0
80,131072,7168,2304,torch.float8_e4m3fnuz,71,0,11621.1373,a8w8_bpreshuffle_256x128x128x64_16x16_16x16_4x64x1_4x64x1_1x32x1x8_8x8x1_2x1_intrawave_v3,0,0,0
80,131072,7168,16384,torch.float8_e4m3fnuz,85,0,77358.0635,a8w8_bpreshuffle_256x64x128x128_16x16_16x16_8x32x1_8x32x1_1x32x1x8_8x8x1_2x1_intrawave_v3,0,0,0
80,131072,7168,18432,torch.float8_e4m3fnuz,85,0,87126.4572,a8w8_bpreshuffle_256x64x128x128_16x16_16x16_8x32x1_8x32x1_1x32x1x8_8x8x1_2x1_intrawave_v3,0,0,0
80,131072,8192,1536,torch.float8_e4m3fnuz,71,0,9394.7156,a8w8_bpreshuffle_256x128x128x64_16x16_16x16_4x64x1_4x64x1_1x32x1x8_8x8x1_2x1_intrawave_v3,0,0,0
80,131072,24576,1536,torch.float8_e4m3fnuz,0,0,,a8w8_bpreshuffle_256x128x128x128_16x16_16x16_8x32x1_8x32x1_1x32x1x8_8x8x1_2x1_intrawave_v3,0,0,0
304,1,192,7168,torch.float8_e4m3fnuz,11,0,7.9598,a8w8_bpreshuffle_256x16x64x512_16x16_16x16_32x8x1_32x8x1_1x16x1x16_4x4x1_1x1_intrawave_v1,0.35,173.85,0.0
304,1,1536,7168,torch.float8_e4m3fnuz,10,0,10.1417,a8w8_bpreshuffle_128x16x32x512_16x16_16x16_32x4x1_32x4x1_1x16x1x8_4x4x1_1x1_intrawave_v1,2.17,1086.63,0.0
304,1,3072,1536,torch.float8_e4m3fnuz,10,0,5.0863,a8w8_bpreshuffle_128x16x32x512_16x16_16x16_32x4x1_32x4x1_1x16x1x8_4x4x1_1x1_intrawave_v1,1.86,929.22,0.0
304,1,576,7168,torch.float8_e4m3fnuz,10,0,9.7529,a8w8_bpreshuffle_128x16x32x512_16x16_16x16_32x4x1_32x4x1_1x16x1x8_4x4x1_1x1_intrawave_v1,0.85,424.19,0.0
304,1,7168,256,torch.float8_e4m3fnuz,75,0,6.4807,a8w8_bpreshuffle_128x16x256x64_16x16_16x16_4x16x1_4x32x1_1x16x1x8_8x8x1_1x2_intrawave_v1,0.57,285.4,0.0
304,1,7168,2048,torch.float8_e4m3fnuz,10,0,6.6123,a8w8_bpreshuffle_128x16x32x512_16x16_16x16_32x4x1_32x4x1_1x16x1x8_4x4x1_1x1_intrawave_v1,4.44,2222.59,0.0
304,1,4608,7168,torch.float8_e4m3fnuz,10,0,11.3742,a8w8_bpreshuffle_128x16x32x512_16x16_16x16_32x4x1_32x4x1_1x16x1x8_4x4x1_1x1_intrawave_v1,5.81,2905.39,0.0
304,1,7168,2304,torch.float8_e4m3fnuz,15,0,7.9435,a8w8_bpreshuffle_256x16x64x256_16x16_16x16_16x16x1_16x16x1_1x16x1x16_4x4x1_1x1_intrawave_v1,4.16,2081.16,0.0
304,1,512,7168,torch.float8_e4m3fnuz,10,0,9.8929,a8w8_bpreshuffle_128x16x32x512_16x16_16x16_32x4x1_32x4x1_1x16x1x8_4x4x1_1x1_intrawave_v1,0.74,371.8,0.0
304,1,4096,512,torch.float8_e4m3fnuz,9,0,4.1243,a8w8_bpreshuffle_128x16x32x128_16x16_16x16_8x16x1_8x16x1_1x16x1x8_4x4x1_1x1_intrawave_v1,1.02,510.6,0.0
304,1,2112,7168,torch.float8_e4m3fnuz,10,0,10.2088,a8w8_bpreshuffle_128x16x32x512_16x16_16x16_32x4x1_32x4x1_1x16x1x8_4x4x1_1x1_intrawave_v1,2.97,1484.03,0.0
304,2,192,7168,torch.float8_e4m3fnuz,11,0,8.0065,a8w8_bpreshuffle_256x16x64x512_16x16_16x16_32x8x1_32x8x1_1x16x1x16_4x4x1_1x1_intrawave_v1,0.69,173.78,0.0
304,2,1536,7168,torch.float8_e4m3fnuz,10,0,10.7042,a8w8_bpreshuffle_128x16x32x512_16x16_16x16_32x4x1_32x4x1_1x16x1x8_4x4x1_1x1_intrawave_v1,4.11,1030.49,0.0
304,2,3072,1536,torch.float8_e4m3fnuz,10,0,5.1154,a8w8_bpreshuffle_128x16x32x512_16x16_16x16_32x4x1_32x4x1_1x16x1x8_4x4x1_1x1_intrawave_v1,3.69,925.43,0.0
304,2,576,7168,torch.float8_e4m3fnuz,10,0,9.9738,a8w8_bpreshuffle_128x16x32x512_16x16_16x16_32x4x1_32x4x1_1x16x1x8_4x4x1_1x1_intrawave_v1,1.66,415.63,0.0
304,2,7168,256,torch.float8_e4m3fnuz,75,0,6.5761,a8w8_bpreshuffle_128x16x256x64_16x16_16x16_4x16x1_4x32x1_1x16x1x8_8x8x1_1x2_intrawave_v1,1.12,283.48,0.0
304,2,7168,2048,torch.float8_e4m3fnuz,10,0,6.6629,a8w8_bpreshuffle_128x16x32x512_16x16_16x16_32x4x1_32x4x1_1x16x1x8_4x4x1_1x1_intrawave_v1,8.81,2208.17,0.0
304,2,4608,7168,torch.float8_e4m3fnuz,10,0,11.3287,a8w8_bpreshuffle_128x16x32x512_16x16_16x16_32x4x1_32x4x1_1x16x1x8_4x4x1_1x1_intrawave_v1,11.66,2918.51,0.0
304,2,7168,2304,torch.float8_e4m3fnuz,108,0,8.1086,a8w8_bpreshuffle_256x16x64x256_16x16_16x16_16x16x1_16x16x1_1x16x1x16_4x4x1_1x1_intrawave_v1,8.15,2040.84,0.0
304,2,512,7168,torch.float8_e4m3fnuz,10,0,9.7808,a8w8_bpreshuffle_128x16x32x512_16x16_16x16_32x4x1_32x4x1_1x16x1x8_4x4x1_1x1_intrawave_v1,1.5,376.9,0.0
304,2,4096,512,torch.float8_e4m3fnuz,9,0,4.1657,a8w8_bpreshuffle_128x16x32x128_16x16_16x16_8x16x1_8x16x1_1x16x1x8_4x4x1_1x1_intrawave_v1,2.01,507.61,0.0
304,2,2112,7168,torch.float8_e4m3fnuz,10,0,10.2568,a8w8_bpreshuffle_128x16x32x512_16x16_16x16_32x4x1_32x4x1_1x16x1x8_4x4x1_1x1_intrawave_v1,5.9,1478.2,0.0
304,4,192,7168,torch.float8_e4m3fnuz,11,0,8.056,a8w8_bpreshuffle_256x16x64x512_16x16_16x16_32x8x1_32x8x1_1x16x1x16_4x4x1_1x1_intrawave_v1,1.37,174.59,0.0
304,4,1536,7168,torch.float8_e4m3fnuz,10,0,10.2266,a8w8_bpreshuffle_128x16x32x512_16x16_16x16_32x4x1_32x4x1_1x16x1x8_4x4x1_1x1_intrawave_v1,8.61,1080.61,0.0
304,4,3072,1536,torch.float8_e4m3fnuz,10,0,5.1395,a8w8_bpreshuffle_128x16x32x512_16x16_16x16_32x4x1_32x4x1_1x16x1x8_4x4x1_1x1_intrawave_v1,7.34,924.08,0.0
304,4,576,7168,torch.float8_e4m3fnuz,10,0,10.1064,a8w8_bpreshuffle_128x16x32x512_16x16_16x16_32x4x1_32x4x1_1x16x1x8_4x4x1_1x1_intrawave_v1,3.27,411.82,0.0
304,4,7168,256,torch.float8_e4m3fnuz,75,0,6.6757,a8w8_bpreshuffle_128x16x256x64_16x16_16x16_4x16x1_4x32x1_1x16x1x8_8x8x1_1x2_intrawave_v1,2.2,283.62,0.0
304,4,7168,2048,torch.float8_e4m3fnuz,10,0,6.6651,a8w8_bpreshuffle_128x16x32x512_16x16_16x16_32x4x1_32x4x1_1x16x1x8_4x4x1_1x1_intrawave_v1,17.62,2212.36,0.0
304,4,4608,7168,torch.float8_e4m3fnuz,10,0,11.5259,a8w8_bpreshuffle_128x16x32x512_16x16_16x16_32x4x1_32x4x1_1x16x1x8_4x4x1_1x1_intrawave_v1,22.93,2871.42,0.0
304,4,7168,2304,torch.float8_e4m3fnuz,15,0,8.2327,a8w8_bpreshuffle_256x16x64x256_16x16_16x16_16x16x1_16x16x1_1x16x1x16_4x4x1_1x1_intrawave_v1,16.05,2014.12,0.0
304,4,512,7168,torch.float8_e4m3fnuz,10,0,9.9555,a8w8_bpreshuffle_128x16x32x512_16x16_16x16_32x4x1_32x4x1_1x16x1x8_4x4x1_1x1_intrawave_v1,2.95,371.93,0.0
304,4,4096,512,torch.float8_e4m3fnuz,9,0,4.1876,a8w8_bpreshuffle_128x16x32x128_16x16_16x16_8x16x1_8x16x1_1x16x1x8_4x4x1_1x1_intrawave_v1,4.01,509.11,0.0
304,4,2112,7168,torch.float8_e4m3fnuz,10,0,10.2625,a8w8_bpreshuffle_128x16x32x512_16x16_16x16_32x4x1_32x4x1_1x16x1x8_4x4x1_1x1_intrawave_v1,11.8,1479.6,0.0
304,8,192,7168,torch.float8_e4m3fnuz,11,0,8.1037,a8w8_bpreshuffle_256x16x64x512_16x16_16x16_32x8x1_32x8x1_1x16x1x16_4x4x1_1x1_intrawave_v1,2.72,177.29,0.0
304,8,1536,7168,torch.float8_e4m3fnuz,10,0,10.2198,a8w8_bpreshuffle_128x16x32x512_16x16_16x16_32x4x1_32x4x1_1x16x1x8_4x4x1_1x1_intrawave_v1,17.24,1085.34,0.0
304,8,3072,1536,torch.float8_e4m3fnuz,8,0,5.1831,a8w8_bpreshuffle_128x32x16x512_16x16_16x16_32x4x1_32x4x1_1x32x1x4_4x4x1_1x1_intrawave_v1,14.57,922.23,0.0
304,8,576,7168,torch.float8_e4m3fnuz,10,0,10.0822,a8w8_bpreshuffle_128x16x32x512_16x16_16x16_32x4x1_32x4x1_1x16x1x8_4x4x1_1x1_intrawave_v1,6.55,416.11,0.0
304,8,7168,256,torch.float8_e4m3fnuz,75,0,6.7254,a8w8_bpreshuffle_128x16x256x64_16x16_16x16_4x16x1_4x32x1_1x16x1x8_8x8x1_1x2_intrawave_v1,4.37,290.2,0.0
304,8,7168,2048,torch.float8_e4m3fnuz,10,0,6.6284,a8w8_bpreshuffle_128x16x32x512_16x16_16x16_32x4x1_32x4x1_1x16x1x8_4x4x1_1x1_intrawave_v1,35.44,2234.5,0.0
304,8,4608,7168,torch.float8_e4m3fnuz,10,0,11.6312,a8w8_bpreshuffle_128x16x32x512_16x16_16x16_32x4x1_32x4x1_1x16x1x8_4x4x1_1x1_intrawave_v1,45.44,2851.06,0.0
304,8,7168,2304,torch.float8_e4m3fnuz,15,0,8.2654,a8w8_bpreshuffle_256x16x64x256_16x16_16x16_16x16x1_16x16x1_1x16x1x16_4x4x1_1x1_intrawave_v1,31.97,2014.2,0.0
304,8,512,7168,torch.float8_e4m3fnuz,10,0,10.0434,a8w8_bpreshuffle_128x16x32x512_16x16_16x16_32x4x1_32x4x1_1x16x1x8_4x4x1_1x1_intrawave_v1,5.85,371.94,0.0
304,8,4096,512,torch.float8_e4m3fnuz,9,0,4.1657,a8w8_bpreshuffle_128x16x32x128_16x16_16x16_8x16x1_8x16x1_1x16x1x8_4x4x1_1x1_intrawave_v1,8.05,520.15,0.0
304,8,2112,7168,torch.float8_e4m3fnuz,10,0,10.281,a8w8_bpreshuffle_128x16x32x512_16x16_16x16_32x4x1_32x4x1_1x16x1x8_4x4x1_1x1_intrawave_v1,23.56,1481.37,0.0
304,16,192,7168,torch.float8_e4m3fnuz,10,0,7.628,a8w8_bpreshuffle_128x16x32x512_16x16_16x16_32x4x1_32x4x1_1x16x1x8_4x4x1_1x1_intrawave_v1,5.77,196.26,0.0
304,16,1536,7168,torch.float8_e4m3fnuz,24,0,9.9805,a8w8_bpreshuffle_128x16x32x512_16x16_16x16_32x4x1_32x4x1_1x16x1x8_4x4x1_1x1_intrawave_v2,35.3,1119.57,0.0
304,16,3072,1536,torch.float8_e4m3fnuz,10,0,5.1922,a8w8_bpreshuffle_128x16x32x512_16x16_16x16_32x4x1_32x4x1_1x16x1x8_4x4x1_1x1_intrawave_v1,29.08,932.45,0.0
304,16,576,7168,torch.float8_e4m3fnuz,10,0,9.2802,a8w8_bpreshuffle_128x16x32x512_16x16_16x16_32x4x1_32x4x1_1x16x1x8_4x4x1_1x1_intrawave_v1,14.24,459.25,0.0
304,16,7168,256,torch.float8_e4m3fnuz,75,0,6.858,a8w8_bpreshuffle_128x16x256x64_16x16_16x16_4x16x1_4x32x1_1x16x1x8_8x8x1_1x2_intrawave_v1,8.56,301.62,0.0
304,16,7168,2048,torch.float8_e4m3fnuz,10,0,6.543,a8w8_bpreshuffle_128x16x32x512_16x16_16x16_32x4x1_32x4x1_1x16x1x8_4x4x1_1x1_intrawave_v1,71.8,2283.69,0.0
304,16,4608,7168,torch.float8_e4m3fnuz,10,0,11.3216,a8w8_bpreshuffle_128x16x32x512_16x16_16x16_32x4x1_32x4x1_1x16x1x8_4x4x1_1x1_intrawave_v1,93.36,2940.6,0.0
304,16,7168,2304,torch.float8_e4m3fnuz,15,0,8.6363,a8w8_bpreshuffle_256x16x64x256_16x16_16x16_16x16x1_16x16x1_1x16x1x16_4x4x1_1x1_intrawave_v1,61.19,1943.11,0.0
304,16,512,7168,torch.float8_e4m3fnuz,10,0,9.2677,a8w8_bpreshuffle_128x16x32x512_16x16_16x16_32x4x1_32x4x1_1x16x1x8_4x4x1_1x1_intrawave_v1,12.67,410.14,0.0
304,16,4096,512,torch.float8_e4m3fnuz,9,0,4.2231,a8w8_bpreshuffle_128x16x32x128_16x16_16x16_8x16x1_8x16x1_1x16x1x8_4x4x1_1x1_intrawave_v1,15.89,529.57,0.0
304,16,2112,7168,torch.float8_e4m3fnuz,10,0,9.5767,a8w8_bpreshuffle_128x16x32x512_16x16_16x16_32x4x1_32x4x1_1x16x1x8_4x4x1_1x1_intrawave_v1,50.59,1599.83,0.0
304,24,192,7168,torch.float8_e4m3fnuz,10,0,8.9893,a8w8_bpreshuffle_128x16x32x512_16x16_16x16_32x4x1_32x4x1_1x16x1x8_4x4x1_1x1_intrawave_v1,7.35,173.26,0.0
304,24,1536,7168,torch.float8_e4m3fnuz,10,0,10.5171,a8w8_bpreshuffle_128x16x32x512_16x16_16x16_32x4x1_32x4x1_1x16x1x8_4x4x1_1x1_intrawave_v1,50.25,1070.24,0.0
304,24,3072,1536,torch.float8_e4m3fnuz,8,0,5.3456,a8w8_bpreshuffle_128x32x16x512_16x16_16x16_32x4x1_32x4x1_1x32x1x4_4x4x1_1x1_intrawave_v1,42.37,917.19,0.0
304,24,576,7168,torch.float8_e4m3fnuz,10,0,10.2915,a8w8_bpreshuffle_128x16x32x512_16x16_16x16_32x4x1_32x4x1_1x16x1x8_4x4x1_1x1_intrawave_v1,19.26,420.58,0.0
304,24,7168,256,torch.float8_e4m3fnuz,75,0,6.9823,a8w8_bpreshuffle_128x16x256x64_16x16_16x16_4x16x1_4x32x1_1x16x1x8_8x8x1_1x2_intrawave_v1,12.61,312.97,0.0
304,24,7168,2048,torch.float8_e4m3fnuz,5,0,7.5,a8w8_bpreshuffle_256x16x64x512_16x16_16x16_32x8x1_32x8x1_1x16x1x16_4x4x1_1x1_intrawave_v1,93.95,2009.77,0.0
304,24,4608,7168,torch.float8_e4m3fnuz,5,0,12.9148,a8w8_bpreshuffle_256x16x64x512_16x16_16x16_32x8x1_32x8x1_1x16x1x16_4x4x1_1x1_intrawave_v1,122.76,2587.99,0.0
304,24,7168,2304,torch.float8_e4m3fnuz,108,0,9.454,a8w8_bpreshuffle_256x16x64x256_16x16_16x16_16x16x1_16x16x1_1x16x1x16_4x4x1_1x1_intrawave_v1,83.85,1789.13,0.0
304,24,512,7168,torch.float8_e4m3fnuz,10,0,10.1455,a8w8_bpreshuffle_128x16x32x512_16x16_16x16_32x4x1_32x4x1_1x16x1x8_4x4x1_1x1_intrawave_v1,17.36,381.12,0.0
304,24,4096,512,torch.float8_e4m3fnuz,9,0,4.4164,a8w8_bpreshuffle_128x16x32x128_16x16_16x16_8x16x1_8x16x1_1x16x1x8_4x4x1_1x1_intrawave_v1,22.79,522.16,0.0
304,24,2112,7168,torch.float8_e4m3fnuz,10,0,10.6387,a8w8_bpreshuffle_128x16x32x512_16x16_16x16_32x4x1_32x4x1_1x16x1x8_4x4x1_1x1_intrawave_v1,68.3,1448.69,0.0
304,32,192,7168,torch.float8_e4m3fnuz,10,0,7.9442,a8w8_bpreshuffle_128x16x32x512_16x16_16x16_32x4x1_32x4x1_1x16x1x8_4x4x1_1x1_intrawave_v1,11.09,203.66,0.0
304,32,1536,7168,torch.float8_e4m3fnuz,8,0,9.735,a8w8_bpreshuffle_128x32x16x512_16x16_16x16_32x4x1_32x4x1_1x32x1x4_4x4x1_1x1_intrawave_v1,72.38,1164.64,0.0
304,32,3072,1536,torch.float8_e4m3fnuz,8,0,5.2047,a8w8_bpreshuffle_128x32x16x512_16x16_16x16_32x4x1_32x4x1_1x32x1x4_4x4x1_1x1_intrawave_v1,58.02,953.82,0.0
304,32,576,7168,torch.float8_e4m3fnuz,10,0,9.5786,a8w8_bpreshuffle_128x16x32x512_16x16_16x16_32x4x1_32x4x1_1x16x1x8_4x4x1_1x1_intrawave_v1,27.59,458.84,0.0
304,32,7168,256,torch.float8_e4m3fnuz,75,0,7.001,a8w8_bpreshuffle_128x16x256x64_16x16_16x16_4x16x1_4x32x1_1x16x1x8_8x8x1_1x2_intrawave_v1,16.77,328.8,0.0
304,32,7168,2048,torch.float8_e4m3fnuz,5,0,7.5753,a8w8_bpreshuffle_256x16x64x512_16x16_16x16_32x8x1_32x8x1_1x16x1x16_4x4x1_1x1_intrawave_v1,124.02,2007.1,0.0
304,32,4608,7168,torch.float8_e4m3fnuz,10,0,12.9976,a8w8_bpreshuffle_128x16x32x512_16x16_16x16_32x4x1_32x4x1_1x16x1x8_4x4x1_1x1_intrawave_v1,162.64,2581.59,0.0
304,32,7168,2304,torch.float8_e4m3fnuz,108,0,9.3934,a8w8_bpreshuffle_256x16x64x256_16x16_16x16_16x16x1_16x16x1_1x16x1x16_4x4x1_1x1_intrawave_v1,112.52,1814.84,0.0
304,32,512,7168,torch.float8_e4m3fnuz,8,0,9.4788,a8w8_bpreshuffle_128x32x16x512_16x16_16x16_32x4x1_32x4x1_1x32x1x4_4x4x1_1x1_intrawave_v1,24.78,414.84,0.0
304,32,4096,512,torch.float8_e4m3fnuz,9,0,4.5431,a8w8_bpreshuffle_128x16x32x128_16x16_16x16_8x16x1_8x16x1_1x16x1x8_4x4x1_1x1_intrawave_v1,29.54,522.92,0.0
304,32,2112,7168,torch.float8_e4m3fnuz,8,0,9.8396,a8w8_bpreshuffle_128x32x16x512_16x16_16x16_32x4x1_32x4x1_1x32x1x4_4x4x1_1x1_intrawave_v1,98.47,1575.61,0.0
304,40,192,7168,torch.float8_e4m3fnuz,10,0,9.0473,a8w8_bpreshuffle_128x16x32x512_16x16_16x16_32x4x1_32x4x1_1x16x1x8_4x4x1_1x1_intrawave_v1,12.17,185.51,0.0
304,40,1536,7168,torch.float8_e4m3fnuz,10,0,10.5674,a8w8_bpreshuffle_128x16x32x512_16x16_16x16_32x4x1_32x4x1_1x16x1x8_4x4x1_1x1_intrawave_v1,83.35,1080.65,0.0
304,40,3072,1536,torch.float8_e4m3fnuz,10,0,5.4107,a8w8_bpreshuffle_128x16x32x512_16x16_16x16_32x4x1_32x4x1_1x16x1x8_4x4x1_1x1_intrawave_v1,69.77,928.86,0.0
304,40,576,7168,torch.float8_e4m3fnuz,10,0,10.2227,a8w8_bpreshuffle_128x16x32x512_16x16_16x16_32x4x1_32x4x1_1x16x1x8_4x4x1_1x1_intrawave_v1,32.31,436.44,0.0
304,40,7168,256,torch.float8_e4m3fnuz,75,0,7.096,a8w8_bpreshuffle_128x16x256x64_16x16_16x16_4x16x1_4x32x1_1x16x1x8_8x8x1_1x2_intrawave_v1,20.69,340.85,0.0
304,40,7168,2048,torch.float8_e4m3fnuz,16,0,8.8385,a8w8_bpreshuffle_256x16x128x256_16x16_16x16_16x16x1_16x16x1_1x16x1x16_8x8x1_1x2_intrawave_v1,132.87,1735.07,0.0
304,40,4608,7168,torch.float8_e4m3fnuz,11,0,14.8667,a8w8_bpreshuffle_256x16x64x512_16x16_16x16_32x8x1_32x8x1_1x16x1x16_4x4x1_1x1_intrawave_v1,177.74,2265.84,0.0
304,40,7168,2304,torch.float8_e4m3fnuz,15,0,10.2228,a8w8_bpreshuffle_256x16x64x256_16x16_16x16_16x16x1_16x16x1_1x16x1x16_4x4x1_1x1_intrawave_v1,129.24,1680.62,0.0
304,40,512,7168,torch.float8_e4m3fnuz,10,0,10.3029,a8w8_bpreshuffle_128x16x32x512_16x16_16x16_32x4x1_32x4x1_1x16x1x8_4x4x1_1x1_intrawave_v1,28.5,388.02,0.0
304,40,4096,512,torch.float8_e4m3fnuz,9,0,4.5666,a8w8_bpreshuffle_128x16x32x128_16x16_16x16_8x16x1_8x16x1_1x16x1x8_4x4x1_1x1_intrawave_v1,36.74,535.48,0.0
304,40,2112,7168,torch.float8_e4m3fnuz,10,0,10.7172,a8w8_bpreshuffle_128x16x32x512_16x16_16x16_32x4x1_32x4x1_1x16x1x8_4x4x1_1x1_intrawave_v1,113.01,1455.09,0.0
304,48,192,7168,torch.float8_e4m3fnuz,10,0,7.8747,a8w8_bpreshuffle_128x16x32x512_16x16_16x16_32x4x1_32x4x1_1x16x1x8_4x4x1_1x1_intrawave_v1,16.78,220.8,0.0
304,48,1536,7168,torch.float8_e4m3fnuz,10,0,9.876,a8w8_bpreshuffle_128x16x32x512_16x16_16x16_32x4x1_32x4x1_1x16x1x8_4x4x1_1x1_intrawave_v1,107.02,1164.6,0.0
304,48,3072,1536,torch.float8_e4m3fnuz,10,0,5.4023,a8w8_bpreshuffle_128x16x32x512_16x16_16x16_32x4x1_32x4x1_1x16x1x8_4x4x1_1x1_intrawave_v1,83.85,941.68,0.0
304,48,576,7168,torch.float8_e4m3fnuz,10,0,9.6683,a8w8_bpreshuffle_128x16x32x512_16x16_16x16_32x4x1_32x4x1_1x16x1x8_4x4x1_1x1_intrawave_v1,41.0,468.35,0.0
304,48,7168,256,torch.float8_e4m3fnuz,75,0,7.3119,a8w8_bpreshuffle_128x16x256x64_16x16_16x16_4x16x1_4x32x1_1x16x1x8_8x8x1_1x2_intrawave_v1,24.09,346.75,0.0
304,48,7168,2048,torch.float8_e4m3fnuz,6,0,8.8648,a8w8_bpreshuffle_256x16x128x512_16x16_16x16_32x8x1_32x8x1_1x16x1x16_8x8x1_1x2_intrawave_v1,158.98,1744.71,0.0
304,48,4608,7168,torch.float8_e4m3fnuz,11,0,15.3254,a8w8_bpreshuffle_256x16x64x512_16x16_16x16_32x8x1_32x8x1_1x16x1x16_4x4x1_1x1_intrawave_v1,206.9,2206.57,0.0
304,48,7168,2304,torch.float8_e4m3fnuz,113,0,10.3048,a8w8_bpreshuffle_256x48x64x256_16x16_16x16_16x16x1_16x16x1_1x16x1x16_4x4x1_1x1_intrawave_v1,153.86,1680.17,0.0
304,48,512,7168,torch.float8_e4m3fnuz,10,0,9.4713,a8w8_bpreshuffle_128x16x32x512_16x16_16x16_32x4x1_32x4x1_1x16x1x8_4x4x1_1x1_intrawave_v1,37.2,429.0,0.0
304,48,4096,512,torch.float8_e4m3fnuz,9,0,4.5888,a8w8_bpreshuffle_128x16x32x128_16x16_16x16_8x16x1_8x16x1_1x16x1x8_4x4x1_1x1_intrawave_v1,43.87,548.06,0.0
304,48,2112,7168,torch.float8_e4m3fnuz,10,0,10.2406,a8w8_bpreshuffle_128x16x32x512_16x16_16x16_32x4x1_32x4x1_1x16x1x8_4x4x1_1x1_intrawave_v1,141.92,1531.71,0.0
304,56,192,7168,torch.float8_e4m3fnuz,10,0,9.1108,a8w8_bpreshuffle_128x16x32x512_16x16_16x16_32x4x1_32x4x1_1x16x1x8_4x4x1_1x1_intrawave_v1,16.92,197.48,0.0
304,56,1536,7168,torch.float8_e4m3fnuz,10,0,10.7733,a8w8_bpreshuffle_128x16x32x512_16x16_16x16_32x4x1_32x4x1_1x16x1x8_4x4x1_1x1_intrawave_v1,114.46,1075.2,0.0
304,56,3072,1536,torch.float8_e4m3fnuz,5,0,5.7584,a8w8_bpreshuffle_256x16x64x512_16x16_16x16_32x8x1_32x8x1_1x16x1x16_4x4x1_1x1_intrawave_v1,91.78,894.12,0.0
304,56,576,7168,torch.float8_e4m3fnuz,10,0,10.3535,a8w8_bpreshuffle_128x16x32x512_16x16_16x16_32x4x1_32x4x1_1x16x1x8_4x4x1_1x1_intrawave_v1,44.66,443.78,0.0
304,56,7168,256,torch.float8_e4m3fnuz,75,0,7.0556,a8w8_bpreshuffle_128x16x256x64_16x16_16x16_4x16x1_4x32x1_1x16x1x8_8x8x1_1x2_intrawave_v1,29.13,375.89,0.0
304,56,7168,2048,torch.float8_e4m3fnuz,112,0,9.3602,a8w8_bpreshuffle_256x32x64x256_16x16_16x16_16x16x1_16x16x1_1x32x1x8_8x8x1_2x1_intrawave_v1,175.66,1666.37,0.0
304,56,4608,7168,torch.float8_e4m3fnuz,5,0,15.8431,a8w8_bpreshuffle_256x16x64x512_16x16_16x16_32x8x1_32x8x1_1x16x1x16_4x4x1_1x1_intrawave_v1,233.5,2142.74,0.0
304,56,7168,2304,torch.float8_e4m3fnuz,112,0,10.7591,a8w8_bpreshuffle_256x32x64x256_16x16_16x16_16x16x1_16x16x1_1x32x1x8_8x8x1_2x1_intrawave_v1,171.92,1621.6,0.0
304,56,512,7168,torch.float8_e4m3fnuz,10,0,10.2808,a8w8_bpreshuffle_128x16x32x512_16x16_16x16_32x4x1_32x4x1_1x16x1x8_4x4x1_1x1_intrawave_v1,39.98,401.6,0.0
304,56,4096,512,torch.float8_e4m3fnuz,9,0,4.7658,a8w8_bpreshuffle_128x16x32x128_16x16_16x16_8x16x1_8x16x1_1x16x1x8_4x4x1_1x1_intrawave_v1,49.28,542.32,0.0
304,56,2112,7168,torch.float8_e4m3fnuz,11,0,11.2718,a8w8_bpreshuffle_256x16x64x512_16x16_16x16_32x8x1_32x8x1_1x16x1x16_4x4x1_1x1_intrawave_v1,150.42,1399.67,0.0
304,64,192,7168,torch.float8_e4m3fnuz,10,0,7.9802,a8w8_bpreshuffle_128x16x32x512_16x16_16x16_32x4x1_32x4x1_1x16x1x8_4x4x1_1x1_intrawave_v1,22.07,233.02,0.0
304,64,1536,7168,torch.float8_e4m3fnuz,8,0,10.0367,a8w8_bpreshuffle_128x32x16x512_16x16_16x16_32x4x1_32x4x1_1x32x1x4_4x4x1_1x1_intrawave_v1,140.41,1162.28,0.0
304,64,3072,1536,torch.float8_e4m3fnuz,5,0,5.7123,a8w8_bpreshuffle_256x16x64x512_16x16_16x16_32x8x1_32x8x1_1x16x1x16_4x4x1_1x1_intrawave_v1,105.73,912.09,0.0
304,64,576,7168,torch.float8_e4m3fnuz,10,0,9.5954,a8w8_bpreshuffle_128x16x32x512_16x16_16x16_32x4x1_32x4x1_1x16x1x8_4x4x1_1x1_intrawave_v1,55.08,485.78,0.0
304,64,7168,256,torch.float8_e4m3fnuz,75,0,7.1394,a8w8_bpreshuffle_128x16x256x64_16x16_16x16_4x16x1_4x32x1_1x16x1x8_8x8x1_1x2_intrawave_v1,32.9,387.83,0.0
304,64,7168,2048,torch.float8_e4m3fnuz,112,0,9.2696,a8w8_bpreshuffle_256x32x64x256_16x16_16x16_16x16x1_16x16x1_1x32x1x8_8x8x1_2x1_intrawave_v1,202.71,1696.8,0.0
304,64,4608,7168,torch.float8_e4m3fnuz,11,0,15.9941,a8w8_bpreshuffle_256x16x64x512_16x16_16x16_32x8x1_32x8x1_1x16x1x16_4x4x1_1x1_intrawave_v1,264.34,2130.71,0.0
304,64,7168,2304,torch.float8_e4m3fnuz,112,0,10.9205,a8w8_bpreshuffle_256x32x64x256_16x16_16x16_16x16x1_16x16x1_1x32x1x8_8x8x1_2x1_intrawave_v1,193.57,1609.82,0.0
304,64,512,7168,torch.float8_e4m3fnuz,10,0,9.5526,a8w8_bpreshuffle_128x16x32x512_16x16_16x16_32x4x1_32x4x1_1x16x1x8_4x4x1_1x1_intrawave_v1,49.18,439.07,0.0
304,64,4096,512,torch.float8_e4m3fnuz,9,0,4.7633,a8w8_bpreshuffle_128x16x32x128_16x16_16x16_8x16x1_8x16x1_1x16x1x8_4x4x1_1x1_intrawave_v1,56.35,557.22,0.0
304,64,2112,7168,torch.float8_e4m3fnuz,10,0,10.8823,a8w8_bpreshuffle_128x16x32x512_16x16_16x16_32x4x1_32x4x1_1x16x1x8_4x4x1_1x1_intrawave_v1,178.07,1458.14,0.0
304,72,192,7168,torch.float8_e4m3fnuz,10,0,9.1322,a8w8_bpreshuffle_128x16x32x512_16x16_16x16_32x4x1_32x4x1_1x16x1x8_4x4x1_1x1_intrawave_v1,21.7,210.25,0.0
304,72,1536,7168,torch.float8_e4m3fnuz,11,0,12.0055,a8w8_bpreshuffle_256x16x64x512_16x16_16x16_32x8x1_32x8x1_1x16x1x16_4x4x1_1x1_intrawave_v1,132.06,978.5,0.0
304,72,3072,1536,torch.float8_e4m3fnuz,8,0,6.3895,a8w8_bpreshuffle_128x32x16x512_16x16_16x16_32x4x1_32x4x1_1x32x1x4_4x4x1_1x1_intrawave_v1,106.34,825.03,0.0
304,72,576,7168,torch.float8_e4m3fnuz,11,0,10.681,a8w8_bpreshuffle_256x16x64x512_16x16_16x16_32x8x1_32x8x1_1x16x1x16_4x4x1_1x1_intrawave_v1,55.66,442.64,0.0
304,72,7168,256,torch.float8_e4m3fnuz,75,0,7.271,a8w8_bpreshuffle_128x16x256x64_16x16_16x16_4x16x1_4x32x1_1x16x1x8_8x8x1_1x2_intrawave_v1,36.34,396.87,0.0
304,72,7168,2048,torch.float8_e4m3fnuz,113,0,10.4425,a8w8_bpreshuffle_256x48x64x256_16x16_16x16_16x16x1_16x16x1_1x16x1x16_4x4x1_1x1_intrawave_v1,202.44,1518.77,0.0
304,72,4608,7168,torch.float8_e4m3fnuz,12,0,19.1149,a8w8_bpreshuffle_256x32x64x512_16x16_16x16_32x8x1_32x8x1_1x32x1x8_8x8x1_1x2_intrawave_v1,248.83,1789.69,0.0
304,72,7168,2304,torch.float8_e4m3fnuz,113,0,11.4516,a8w8_bpreshuffle_256x48x64x256_16x16_16x16_16x16x1_16x16x1_1x16x1x16_4x4x1_1x1_intrawave_v1,207.67,1546.78,0.0
304,72,512,7168,torch.float8_e4m3fnuz,10,0,10.4876,a8w8_bpreshuffle_128x16x32x512_16x16_16x16_32x4x1_32x4x1_1x16x1x8_4x4x1_1x1_intrawave_v1,50.39,406.18,0.0
304,72,4096,512,torch.float8_e4m3fnuz,9,0,4.8536,a8w8_bpreshuffle_128x16x32x128_16x16_16x16_8x16x1_8x16x1_1x16x1x8_4x4x1_1x1_intrawave_v1,62.22,561.2,0.0
304,72,2112,7168,torch.float8_e4m3fnuz,11,0,15.3704,a8w8_bpreshuffle_256x16x64x512_16x16_16x16_32x8x1_32x8x1_1x16x1x16_4x4x1_1x1_intrawave_v1,141.83,1038.3,0.0
304,80,192,7168,torch.float8_e4m3fnuz,10,0,7.9308,a8w8_bpreshuffle_128x16x32x512_16x16_16x16_32x4x1_32x4x1_1x16x1x8_4x4x1_1x1_intrawave_v1,27.77,249.71,0.0
304,80,1536,7168,torch.float8_e4m3fnuz,5,0,11.8758,a8w8_bpreshuffle_256x16x64x512_16x16_16x16_32x8x1_32x8x1_1x16x1x16_4x4x1_1x1_intrawave_v1,148.34,996.08,0.0
304,80,3072,1536,torch.float8_e4m3fnuz,8,0,6.5632,a8w8_bpreshuffle_128x32x16x512_16x16_16x16_32x4x1_32x4x1_1x32x1x4_4x4x1_1x1_intrawave_v1,115.03,812.56,0.0
304,80,576,7168,torch.float8_e4m3fnuz,10,0,9.5076,a8w8_bpreshuffle_128x16x32x512_16x16_16x16_32x4x1_32x4x1_1x16x1x8_4x4x1_1x1_intrawave_v1,69.48,504.27,0.0
304,80,7168,256,torch.float8_e4m3fnuz,75,0,7.2764,a8w8_bpreshuffle_128x16x256x64_16x16_16x16_4x16x1_4x32x1_1x16x1x8_8x8x1_1x2_intrawave_v1,40.35,412.62,0.0
304,80,7168,2048,torch.float8_e4m3fnuz,113,0,10.4575,a8w8_bpreshuffle_256x48x64x256_16x16_16x16_16x16x1_16x16x1_1x16x1x16_4x4x1_1x1_intrawave_v1,224.61,1529.12,0.0
304,80,4608,7168,torch.float8_e4m3fnuz,12,0,19.2899,a8w8_bpreshuffle_256x32x64x512_16x16_16x16_32x8x1_32x8x1_1x32x1x8_8x8x1_1x2_intrawave_v1,273.97,1780.25,0.0
304,80,7168,2304,torch.float8_e4m3fnuz,113,0,11.5811,a8w8_bpreshuffle_256x48x64x256_16x16_16x16_16x16x1_16x16x1_1x16x1x16_4x4x1_1x1_intrawave_v1,228.17,1540.98,0.0
304,80,512,7168,torch.float8_e4m3fnuz,10,0,9.4903,a8w8_bpreshuffle_128x16x32x512_16x16_16x16_32x4x1_32x4x1_1x16x1x8_4x4x1_1x1_intrawave_v1,61.87,455.77,0.0
304,80,4096,512,torch.float8_e4m3fnuz,9,0,4.8691,a8w8_bpreshuffle_128x16x32x128_16x16_16x16_8x16x1_8x16x1_1x16x1x8_4x4x1_1x1_intrawave_v1,68.91,573.71,0.0
304,80,2112,7168,torch.float8_e4m3fnuz,5,0,14.781,a8w8_bpreshuffle_256x16x64x512_16x16_16x16_32x8x1_32x8x1_1x16x1x16_4x4x1_1x1_intrawave_v1,163.87,1085.87,0.0
304,88,192,7168,torch.float8_e4m3fnuz,10,0,9.0108,a8w8_bpreshuffle_128x16x32x512_16x16_16x16_32x4x1_32x4x1_1x16x1x8_4x4x1_1x1_intrawave_v1,26.88,226.49,0.0
304,88,1536,7168,torch.float8_e4m3fnuz,5,0,11.6154,a8w8_bpreshuffle_256x16x64x512_16x16_16x16_32x8x1_32x8x1_1x16x1x16_4x4x1_1x1_intrawave_v1,166.83,1025.46,0.0
304,88,3072,1536,torch.float8_e4m3fnuz,11,0,6.0665,a8w8_bpreshuffle_256x16x64x512_16x16_16x16_32x8x1_32x8x1_1x16x1x16_4x4x1_1x1_intrawave_v1,136.89,889.22,0.0
304,88,576,7168,torch.float8_e4m3fnuz,10,0,10.6406,a8w8_bpreshuffle_128x16x32x512_16x16_16x16_32x4x1_32x4x1_1x16x1x8_4x4x1_1x1_intrawave_v1,68.29,456.83,0.0
304,88,7168,256,torch.float8_e4m3fnuz,75,0,7.1782,a8w8_bpreshuffle_128x16x256x64_16x16_16x16_4x16x1_4x32x1_1x16x1x8_8x8x1_1x2_intrawave_v1,44.99,434.52,0.0
304,88,7168,2048,torch.float8_e4m3fnuz,113,0,10.5342,a8w8_bpreshuffle_256x48x64x256_16x16_16x16_16x16x1_16x16x1_1x16x1x16_4x4x1_1x1_intrawave_v1,245.27,1530.43,0.0
304,88,4608,7168,torch.float8_e4m3fnuz,12,0,19.5874,a8w8_bpreshuffle_256x32x64x512_16x16_16x16_32x8x1_32x8x1_1x32x1x8_8x8x1_1x2_intrawave_v1,296.79,1759.9,0.0
304,88,7168,2304,torch.float8_e4m3fnuz,119,0,11.654,a8w8_bpreshuffle_256x32x128x256_16x16_16x16_16x16x1_16x16x1_1x16x1x16_8x8x1_1x2_intrawave_v1,249.41,1542.77,0.0
304,88,512,7168,torch.float8_e4m3fnuz,10,0,10.5853,a8w8_bpreshuffle_128x16x32x512_16x16_16x16_32x4x1_32x4x1_1x16x1x8_4x4x1_1x1_intrawave_v1,61.02,414.81,0.0
304,88,4096,512,torch.float8_e4m3fnuz,9,0,4.8319,a8w8_bpreshuffle_128x16x32x128_16x16_16x16_8x16x1_8x16x1_1x16x1x8_4x4x1_1x1_intrawave_v1,76.39,592.54,0.0
304,88,2112,7168,torch.float8_e4m3fnuz,11,0,13.5256,a8w8_bpreshuffle_256x16x64x512_16x16_16x16_32x8x1_32x8x1_1x16x1x16_4x4x1_1x1_intrawave_v1,196.99,1193.39,0.0
304,96,192,7168,torch.float8_e4m3fnuz,10,0,7.9,a8w8_bpreshuffle_128x16x32x512_16x16_16x16_32x4x1_32x4x1_1x16x1x8_4x4x1_1x1_intrawave_v1,33.45,265.98,0.0
304,96,1536,7168,torch.float8_e4m3fnuz,10,0,11.1711,a8w8_bpreshuffle_128x16x32x512_16x16_16x16_32x4x1_32x4x1_1x16x1x8_4x4x1_1x1_intrawave_v1,189.23,1073.58,0.0
304,96,3072,1536,torch.float8_e4m3fnuz,11,0,5.9558,a8w8_bpreshuffle_256x16x64x512_16x16_16x16_32x8x1_32x8x1_1x16x1x16_4x4x1_1x1_intrawave_v1,152.12,916.06,0.0
304,96,576,7168,torch.float8_e4m3fnuz,10,0,9.2909,a8w8_bpreshuffle_128x16x32x512_16x16_16x16_32x4x1_32x4x1_1x16x1x8_4x4x1_1x1_intrawave_v1,85.32,530.36,0.0
304,96,7168,256,torch.float8_e4m3fnuz,75,0,7.2567,a8w8_bpreshuffle_128x16x256x64_16x16_16x16_4x16x1_4x32x1_1x16x1x8_8x8x1_1x2_intrawave_v1,48.55,445.91,0.0
304,96,7168,2048,torch.float8_e4m3fnuz,113,0,10.3494,a8w8_bpreshuffle_256x48x64x256_16x16_16x16_16x16x1_16x16x1_1x16x1x16_4x4x1_1x1_intrawave_v1,272.34,1570.42,0.0
304,96,4608,7168,torch.float8_e4m3fnuz,12,0,19.3383,a8w8_bpreshuffle_256x32x64x512_16x16_16x16_32x8x1_32x8x1_1x32x1x8_8x8x1_1x2_intrawave_v1,327.94,1789.35,0.0
304,96,7168,2304,torch.float8_e4m3fnuz,113,0,11.7389,a8w8_bpreshuffle_256x48x64x256_16x16_16x16_16x16x1_16x16x1_1x16x1x16_4x4x1_1x1_intrawave_v1,270.12,1542.95,0.0
304,96,512,7168,torch.float8_e4m3fnuz,10,0,9.3218,a8w8_bpreshuffle_128x16x32x512_16x16_16x16_32x4x1_32x4x1_1x16x1x8_4x4x1_1x1_intrawave_v1,75.59,478.07,0.0
304,96,4096,512,torch.float8_e4m3fnuz,9,0,4.8551,a8w8_bpreshuffle_128x16x32x128_16x16_16x16_8x16x1_8x16x1_1x16x1x8_4x4x1_1x1_intrawave_v1,82.93,604.05,0.0
304,96,2112,7168,torch.float8_e4m3fnuz,11,0,12.7608,a8w8_bpreshuffle_256x16x64x512_16x16_16x16_32x8x1_32x8x1_1x16x1x16_4x4x1_1x1_intrawave_v1,227.78,1272.06,0.0
304,104,192,7168,torch.float8_e4m3fnuz,10,0,9.0593,a8w8_bpreshuffle_128x16x32x512_16x16_16x16_32x4x1_32x4x1_1x16x1x8_4x4x1_1x1_intrawave_v1,31.6,238.61,0.0
304,104,1536,7168,torch.float8_e4m3fnuz,5,0,11.7301,a8w8_bpreshuffle_256x16x64x512_16x16_16x16_32x8x1_32x8x1_1x16x1x16_4x4x1_1x1_intrawave_v1,195.23,1029.4,0.0
304,104,3072,1536,torch.float8_e4m3fnuz,108,0,6.4552,a8w8_bpreshuffle_256x16x64x256_16x16_16x16_16x16x1_16x16x1_1x16x1x16_4x4x1_1x1_intrawave_v1,152.04,854.71,0.0
304,104,576,7168,torch.float8_e4m3fnuz,11,0,10.7532,a8w8_bpreshuffle_256x16x64x512_16x16_16x16_32x8x1_32x8x1_1x16x1x16_4x4x1_1x1_intrawave_v1,79.86,464.42,0.0
304,104,7168,256,torch.float8_e4m3fnuz,75,0,7.1689,a8w8_bpreshuffle_128x16x256x64_16x16_16x16_4x16x1_4x32x1_1x16x1x8_8x8x1_1x2_intrawave_v1,53.24,467.66,0.0
304,104,7168,2048,torch.float8_e4m3fnuz,119,0,10.9848,a8w8_bpreshuffle_256x32x128x256_16x16_16x16_16x16x1_16x16x1_1x16x1x16_8x8x1_1x2_intrawave_v1,277.97,1491.52,0.0
304,104,4608,7168,torch.float8_e4m3fnuz,12,0,20.8625,a8w8_bpreshuffle_256x32x64x512_16x16_16x16_32x8x1_32x8x1_1x32x1x8_8x8x1_1x2_intrawave_v1,329.31,1664.9,0.0
304,104,7168,2304,torch.float8_e4m3fnuz,119,0,12.3221,a8w8_bpreshuffle_256x32x128x256_16x16_16x16_16x16x1_16x16x1_1x16x1x16_8x8x1_1x2_intrawave_v1,278.78,1480.72,0.0
304,104,512,7168,torch.float8_e4m3fnuz,11,0,10.5142,a8w8_bpreshuffle_256x16x64x512_16x16_16x16_32x8x1_32x8x1_1x16x1x16_4x4x1_1x1_intrawave_v1,72.6,430.08,0.0
304,104,4096,512,torch.float8_e4m3fnuz,9,0,4.9767,a8w8_bpreshuffle_128x16x32x128_16x16_16x16_8x16x1_8x16x1_1x16x1x8_4x4x1_1x1_intrawave_v1,87.65,603.28,0.0
304,104,2112,7168,torch.float8_e4m3fnuz,11,0,13.4815,a8w8_bpreshuffle_256x16x64x512_16x16_16x16_32x8x1_32x8x1_1x16x1x16_4x4x1_1x1_intrawave_v1,233.57,1210.81,0.0
304,112,192,7168,torch.float8_e4m3fnuz,10,0,8.2192,a8w8_bpreshuffle_128x16x32x512_16x16_16x16_32x4x1_32x4x1_1x16x1x8_4x4x1_1x1_intrawave_v1,37.51,270.35,0.0
304,112,1536,7168,torch.float8_e4m3fnuz,11,0,11.4351,a8w8_bpreshuffle_256x16x64x512_16x16_16x16_32x8x1_32x8x1_1x16x1x16_4x4x1_1x1_intrawave_v1,215.67,1063.12,0.0
304,112,3072,1536,torch.float8_e4m3fnuz,108,0,6.4494,a8w8_bpreshuffle_256x16x64x256_16x16_16x16_16x16x1_16x16x1_1x16x1x16_4x4x1_1x1_intrawave_v1,163.89,865.0,0.0
304,112,576,7168,torch.float8_e4m3fnuz,10,0,9.3966,a8w8_bpreshuffle_128x16x32x512_16x16_16x16_32x4x1_32x4x1_1x16x1x8_4x4x1_1x1_intrawave_v1,98.42,538.56,0.0
304,112,7168,256,torch.float8_e4m3fnuz,75,0,7.2853,a8w8_bpreshuffle_128x16x256x64_16x16_16x16_4x16x1_4x32x1_1x16x1x8_8x8x1_1x2_intrawave_v1,56.42,476.21,0.0
304,112,7168,2048,torch.float8_e4m3fnuz,119,0,11.091,a8w8_bpreshuffle_256x32x128x256_16x16_16x16_16x16x1_16x16x1_1x16x1x16_8x8x1_1x2_intrawave_v1,296.49,1489.05,0.0
304,112,4608,7168,torch.float8_e4m3fnuz,12,0,21.0909,a8w8_bpreshuffle_256x32x64x512_16x16_16x16_32x8x1_32x8x1_1x32x1x8_8x8x1_1x2_intrawave_v1,350.8,1653.09,0.0
304,112,7168,2304,torch.float8_e4m3fnuz,119,0,12.3399,a8w8_bpreshuffle_256x32x128x256_16x16_16x16_16x16x1_16x16x1_1x16x1x16_8x8x1_1x2_intrawave_v1,299.79,1489.38,0.0
304,112,512,7168,torch.float8_e4m3fnuz,10,0,9.3641,a8w8_bpreshuffle_128x16x32x512_16x16_16x16_32x4x1_32x4x1_1x16x1x8_4x4x1_1x1_intrawave_v1,87.79,489.91,0.0
304,112,4096,512,torch.float8_e4m3fnuz,9,0,4.9195,a8w8_bpreshuffle_128x16x32x128_16x16_16x16_8x16x1_8x16x1_1x16x1x8_4x4x1_1x1_intrawave_v1,95.49,624.45,0.0
304,112,2112,7168,torch.float8_e4m3fnuz,5,0,13.2466,a8w8_bpreshuffle_256x16x64x512_16x16_16x16_32x8x1_32x8x1_1x16x1x16_4x4x1_1x1_intrawave_v1,256.0,1239.16,0.0
304,120,192,7168,torch.float8_e4m3fnuz,10,0,9.3346,a8w8_bpreshuffle_128x16x32x512_16x16_16x16_32x4x1_32x4x1_1x16x1x8_4x4x1_1x1_intrawave_v1,35.38,244.52,0.0
304,120,1536,7168,torch.float8_e4m3fnuz,5,0,12.006,a8w8_bpreshuffle_256x16x64x512_16x16_16x16_32x8x1_32x8x1_1x16x1x16_4x4x1_1x1_intrawave_v1,220.09,1019.39,0.0
304,120,3072,1536,torch.float8_e4m3fnuz,6,0,6.7168,a8w8_bpreshuffle_256x16x128x512_16x16_16x16_32x8x1_32x8x1_1x16x1x16_8x8x1_1x2_intrawave_v1,168.6,839.71,0.0
304,120,576,7168,torch.float8_e4m3fnuz,5,0,10.6913,a8w8_bpreshuffle_256x16x64x512_16x16_16x16_32x8x1_32x8x1_1x16x1x16_4x4x1_1x1_intrawave_v1,92.68,479.56,0.0
304,120,7168,256,torch.float8_e4m3fnuz,75,0,7.0572,a8w8_bpreshuffle_128x16x256x64_16x16_16x16_4x16x1_4x32x1_1x16x1x8_8x8x1_1x2_intrawave_v1,62.4,508.14,0.0
304,120,7168,2048,torch.float8_e4m3fnuz,119,0,11.1785,a8w8_bpreshuffle_256x32x128x256_16x16_16x16_16x16x1_16x16x1_1x16x1x16_8x8x1_1x2_intrawave_v1,315.18,1489.12,0.0
304,120,4608,7168,torch.float8_e4m3fnuz,12,0,21.5035,a8w8_bpreshuffle_256x32x64x512_16x16_16x16_32x8x1_32x8x1_1x32x1x8_8x8x1_1x2_intrawave_v1,368.65,1627.47,0.0
304,120,7168,2304,torch.float8_e4m3fnuz,119,0,12.5298,a8w8_bpreshuffle_256x32x128x256_16x16_16x16_16x16x1_16x16x1_1x16x1x16_8x8x1_1x2_intrawave_v1,316.34,1477.43,0.0
304,120,512,7168,torch.float8_e4m3fnuz,11,0,10.6606,a8w8_bpreshuffle_256x16x64x512_16x16_16x16_32x8x1_32x8x1_1x16x1x16_4x4x1_1x1_intrawave_v1,82.62,436.47,0.0
304,120,4096,512,torch.float8_e4m3fnuz,9,0,4.9904,a8w8_bpreshuffle_128x16x32x128_16x16_16x16_8x16x1_8x16x1_1x16x1x8_4x4x1_1x1_intrawave_v1,100.86,629.54,0.0
304,120,2112,7168,torch.float8_e4m3fnuz,5,0,14.6937,a8w8_bpreshuffle_256x16x64x512_16x16_16x16_32x8x1_32x8x1_1x16x1x16_4x4x1_1x1_intrawave_v1,247.27,1123.33,0.0
304,128,192,7168,torch.float8_e4m3fnuz,10,0,7.9881,a8w8_bpreshuffle_128x16x32x512_16x16_16x16_32x4x1_32x4x1_1x16x1x8_4x4x1_1x1_intrawave_v1,44.11,293.3,0.0
304,128,1536,7168,torch.float8_e4m3fnuz,11,0,11.579,a8w8_bpreshuffle_256x16x64x512_16x16_16x16_32x8x1_32x8x1_1x16x1x16_4x4x1_1x1_intrawave_v1,243.42,1064.06,0.0
304,128,3072,1536,torch.float8_e4m3fnuz,6,0,6.6971,a8w8_bpreshuffle_256x16x128x512_16x16_16x16_32x8x1_32x8x1_1x16x1x16_8x8x1_1x2_intrawave_v1,180.37,851.36,0.0
304,128,576,7168,torch.float8_e4m3fnuz,10,0,9.4052,a8w8_bpreshuffle_128x16x32x512_16x16_16x16_32x4x1_32x4x1_1x16x1x8_4x4x1_1x1_intrawave_v1,112.38,552.22,0.0
304,128,7168,256,torch.float8_e4m3fnuz,75,0,7.0591,a8w8_bpreshuffle_128x16x256x64_16x16_16x16_4x16x1_4x32x1_1x16x1x8_8x8x1_1x2_intrawave_v1,66.55,524.54,0.0
304,128,7168,2048,torch.float8_e4m3fnuz,119,0,11.1284,a8w8_bpreshuffle_256x32x128x256_16x16_16x16_16x16x1_16x16x1_1x16x1x16_8x8x1_1x2_intrawave_v1,337.7,1507.6,0.0
304,128,4608,7168,torch.float8_e4m3fnuz,12,0,21.5652,a8w8_bpreshuffle_256x32x64x512_16x16_16x16_32x8x1_32x8x1_1x32x1x8_8x8x1_1x2_intrawave_v1,392.1,1628.89,0.0
304,128,7168,2304,torch.float8_e4m3fnuz,119,0,12.3299,a8w8_bpreshuffle_256x32x128x256_16x16_16x16_16x16x1_16x16x1_1x16x1x16_8x8x1_1x2_intrawave_v1,342.89,1512.18,0.0
304,128,512,7168,torch.float8_e4m3fnuz,10,0,9.2821,a8w8_bpreshuffle_128x16x32x512_16x16_16x16_32x4x1_32x4x1_1x16x1x8_4x4x1_1x1_intrawave_v1,101.22,508.35,0.0
304,128,4096,512,torch.float8_e4m3fnuz,9,0,4.8855,a8w8_bpreshuffle_128x16x32x128_16x16_16x16_8x16x1_8x16x1_1x16x1x8_4x4x1_1x1_intrawave_v1,109.89,657.31,0.0
304,128,2112,7168,torch.float8_e4m3fnuz,5,0,14.829,a8w8_bpreshuffle_256x16x64x512_16x16_16x16_32x8x1_32x8x1_1x16x1x16_4x4x1_1x1_intrawave_v1,261.35,1119.23,0.0
304,136,192,7168,torch.float8_e4m3fnuz,10,0,9.5749,a8w8_bpreshuffle_128x16x32x512_16x16_16x16_32x4x1_32x4x1_1x16x1x8_4x4x1_1x1_intrawave_v1,39.1,251.0,0.0
304,136,1536,7168,torch.float8_e4m3fnuz,12,0,14.3238,a8w8_bpreshuffle_256x32x64x512_16x16_16x16_32x8x1_32x8x1_1x32x1x8_8x8x1_1x2_intrawave_v1,209.07,865.88,0.0
304,136,3072,1536,torch.float8_e4m3fnuz,112,0,7.3888,a8w8_bpreshuffle_256x32x64x256_16x16_16x16_16x16x1_16x16x1_1x32x1x8_8x8x1_2x1_intrawave_v1,173.7,779.97,0.0
304,136,576,7168,torch.float8_e4m3fnuz,11,0,10.4502,a8w8_bpreshuffle_256x16x64x512_16x16_16x16_32x8x1_32x8x1_1x16x1x16_4x4x1_1x1_intrawave_v1,107.46,503.37,0.0
304,136,7168,256,torch.float8_e4m3fnuz,75,0,7.2903,a8w8_bpreshuffle_128x16x256x64_16x16_16x16_4x16x1_4x32x1_1x16x1x8_8x8x1_1x2_intrawave_v1,68.46,523.92,0.0
304,136,7168,2048,torch.float8_e4m3fnuz,120,0,12.0862,a8w8_bpreshuffle_256x48x128x256_16x16_16x16_16x16x1_16x16x1_1x16x1x16_8x8x1_1x2_intrawave_v1,330.37,1398.97,0.0
304,136,4608,7168,torch.float8_e4m3fnuz,113,0,23.6258,a8w8_bpreshuffle_256x48x64x256_16x16_16x16_16x16x1_16x16x1_1x16x1x16_4x4x1_1x1_intrawave_v1,380.27,1492.37,0.0
304,136,7168,2304,torch.float8_e4m3fnuz,120,0,13.715,a8w8_bpreshuffle_256x48x128x256_16x16_16x16_16x16x1_16x16x1_1x16x1x16_8x8x1_1x2_intrawave_v1,327.53,1369.17,0.0
304,136,512,7168,torch.float8_e4m3fnuz,11,0,10.4559,a8w8_bpreshuffle_256x16x64x512_16x16_16x16_32x8x1_32x8x1_1x16x1x16_4x4x1_1x1_intrawave_v1,95.47,457.55,0.0
304,136,4096,512,torch.float8_e4m3fnuz,9,0,5.199,a8w8_bpreshuffle_128x16x32x128_16x16_16x16_8x16x1_8x16x1_1x16x1x8_4x4x1_1x1_intrawave_v1,109.72,631.06,0.0
304,136,2112,7168,torch.float8_e4m3fnuz,12,0,16.6087,a8w8_bpreshuffle_256x32x64x512_16x16_16x16_32x8x1_32x8x1_1x32x1x8_8x8x1_1x2_intrawave_v1,247.93,1004.78,0.0
304,144,192,7168,torch.float8_e4m3fnuz,10,0,8.6054,a8w8_bpreshuffle_128x16x32x512_16x16_16x16_32x4x1_32x4x1_1x16x1x8_4x4x1_1x1_intrawave_v1,46.06,286.3,0.0
304,144,1536,7168,torch.float8_e4m3fnuz,20,0,15.2743,a8w8_bpreshuffle_256x16x128x512_16x16_16x16_32x8x1_32x8x1_1x16x1x16_8x8x1_1x2_intrawave_v2,207.6,817.36,0.0
304,144,3072,1536,torch.float8_e4m3fnuz,112,0,7.4413,a8w8_bpreshuffle_256x32x64x256_16x16_16x16_16x16x1_16x16x1_1x32x1x8_8x8x1_2x1_intrawave_v1,182.62,782.73,0.0
304,144,576,7168,torch.float8_e4m3fnuz,10,0,9.9013,a8w8_bpreshuffle_128x16x32x512_16x16_16x16_32x4x1_32x4x1_1x16x1x8_4x4x1_1x1_intrawave_v1,120.09,537.99,0.0
304,144,7168,256,torch.float8_e4m3fnuz,75,0,7.3968,a8w8_bpreshuffle_128x16x256x64_16x16_16x16_4x16x1_4x32x1_1x16x1x8_8x8x1_1x2_intrawave_v1,71.45,532.16,0.0
304,144,7168,2048,torch.float8_e4m3fnuz,120,0,12.114,a8w8_bpreshuffle_256x48x128x256_16x16_16x16_16x16x1_16x16x1_1x16x1x16_8x8x1_1x2_intrawave_v1,349.01,1406.58,0.0
304,144,4608,7168,torch.float8_e4m3fnuz,113,0,22.7067,a8w8_bpreshuffle_256x48x64x256_16x16_16x16_16x16x1_16x16x1_1x16x1x16_4x4x1_1x1_intrawave_v1,418.94,1558.55,0.0
304,144,7168,2304,torch.float8_e4m3fnuz,120,0,13.1839,a8w8_bpreshuffle_256x48x128x256_16x16_16x16_16x16x1_16x16x1_1x16x1x16_8x8x1_1x2_intrawave_v1,360.77,1434.42,0.0
304,144,512,7168,torch.float8_e4m3fnuz,10,0,9.6789,a8w8_bpreshuffle_128x16x32x512_16x16_16x16_32x4x1_32x4x1_1x16x1x8_4x4x1_1x1_intrawave_v1,109.2,501.06,0.0
304,144,4096,512,torch.float8_e4m3fnuz,9,0,5.2236,a8w8_bpreshuffle_128x16x32x128_16x16_16x16_8x16x1_8x16x1_1x16x1x8_4x4x1_1x1_intrawave_v1,115.63,641.42,0.0
304,144,2112,7168,torch.float8_e4m3fnuz,12,0,16.7158,a8w8_bpreshuffle_256x32x64x512_16x16_16x16_32x8x1_32x8x1_1x32x1x8_8x8x1_1x2_intrawave_v1,260.83,1003.8,0.0
304,152,192,7168,torch.float8_e4m3fnuz,10,0,9.0859,a8w8_bpreshuffle_128x16x32x512_16x16_16x16_32x4x1_32x4x1_1x16x1x8_4x4x1_1x1_intrawave_v1,46.05,277.81,0.0
304,152,1536,7168,torch.float8_e4m3fnuz,11,0,13.8814,a8w8_bpreshuffle_256x16x64x512_16x16_16x16_32x8x1_32x8x1_1x16x1x16_4x4x1_1x1_intrawave_v1,241.12,905.28,0.0
304,152,3072,1536,torch.float8_e4m3fnuz,112,0,7.4501,a8w8_bpreshuffle_256x32x64x256_16x16_16x16_16x16x1_16x16x1_1x32x1x8_8x8x1_2x1_intrawave_v1,192.54,790.05,0.0
304,152,576,7168,torch.float8_e4m3fnuz,11,0,10.5759,a8w8_bpreshuffle_256x16x64x512_16x16_16x16_32x8x1_32x8x1_1x16x1x16_4x4x1_1x1_intrawave_v1,118.68,509.97,0.0
304,152,7168,256,torch.float8_e4m3fnuz,75,0,7.2639,a8w8_bpreshuffle_128x16x256x64_16x16_16x16_4x16x1_4x32x1_1x16x1x8_8x8x1_1x2_intrawave_v1,76.8,557.96,0.0
304,152,7168,2048,torch.float8_e4m3fnuz,120,0,12.6976,a8w8_bpreshuffle_256x48x128x256_16x16_16x16_16x16x1_16x16x1_1x16x1x16_8x8x1_1x2_intrawave_v1,351.46,1352.26,0.0
304,152,4608,7168,torch.float8_e4m3fnuz,114,0,25.7548,a8w8_bpreshuffle_256x64x64x256_16x16_16x16_16x16x1_16x16x1_1x32x1x8_8x8x1_2x1_intrawave_v3,389.88,1379.18,0.0
304,152,7168,2304,torch.float8_e4m3fnuz,120,0,15.0999,a8w8_bpreshuffle_256x48x128x256_16x16_16x16_16x16x1_16x16x1_1x16x1x16_8x8x1_1x2_intrawave_v1,332.49,1261.22,0.0
304,152,512,7168,torch.float8_e4m3fnuz,5,0,10.4638,a8w8_bpreshuffle_256x16x64x512_16x16_16x16_32x8x1_32x8x1_1x16x1x16_4x4x1_1x1_intrawave_v1,106.62,469.73,0.0
304,152,4096,512,torch.float8_e4m3fnuz,9,0,5.3425,a8w8_bpreshuffle_128x16x32x128_16x16_16x16_8x16x1_8x16x1_1x16x1x8_4x4x1_1x1_intrawave_v1,119.33,640.18,0.0
304,152,2112,7168,torch.float8_e4m3fnuz,12,0,16.9042,a8w8_bpreshuffle_256x32x64x512_16x16_16x16_32x8x1_32x8x1_1x32x1x8_8x8x1_1x2_intrawave_v1,272.25,998.0,0.0
304,160,192,7168,torch.float8_e4m3fnuz,10,0,8.0943,a8w8_bpreshuffle_128x16x32x512_16x16_16x16_32x4x1_32x4x1_1x16x1x8_4x4x1_1x1_intrawave_v1,54.41,319.31,0.0
304,160,1536,7168,torch.float8_e4m3fnuz,11,0,13.4678,a8w8_bpreshuffle_256x16x64x512_16x16_16x16_32x8x1_32x8x1_1x16x1x16_4x4x1_1x1_intrawave_v1,261.6,939.16,0.0
304,160,3072,1536,torch.float8_e4m3fnuz,112,0,7.3724,a8w8_bpreshuffle_256x32x64x256_16x16_16x16_16x16x1_16x16x1_1x32x1x8_8x8x1_2x1_intrawave_v1,204.81,806.71,0.0
304,160,576,7168,torch.float8_e4m3fnuz,10,0,9.4126,a8w8_bpreshuffle_128x16x32x512_16x16_16x16_32x4x1_32x4x1_1x16x1x8_4x4x1_1x1_intrawave_v1,140.37,580.07,0.0
304,160,7168,256,torch.float8_e4m3fnuz,75,0,7.3977,a8w8_bpreshuffle_128x16x256x64_16x16_16x16_4x16x1_4x32x1_1x16x1x8_8x8x1_1x2_intrawave_v1,79.38,563.65,0.0
304,160,7168,2048,torch.float8_e4m3fnuz,120,0,12.7798,a8w8_bpreshuffle_256x48x128x256_16x16_16x16_16x16x1_16x16x1_1x16x1x16_8x8x1_1x2_intrawave_v1,367.58,1353.82,0.0
304,160,4608,7168,torch.float8_e4m3fnuz,113,0,25.5237,a8w8_bpreshuffle_256x48x64x256_16x16_16x16_16x16x1_16x16x1_1x16x1x16_4x4x1_1x1_intrawave_v1,414.11,1396.8,0.0
304,160,7168,2304,torch.float8_e4m3fnuz,120,0,15.005,a8w8_bpreshuffle_256x48x128x256_16x16_16x16_16x16x1_16x16x1_1x16x1x16_8x8x1_1x2_intrawave_v1,352.2,1278.07,0.0
304,160,512,7168,torch.float8_e4m3fnuz,10,0,9.2871,a8w8_bpreshuffle_128x16x32x512_16x16_16x16_32x4x1_32x4x1_1x16x1x8_4x4x1_1x1_intrawave_v1,126.46,536.31,0.0
304,160,4096,512,torch.float8_e4m3fnuz,9,0,5.2852,a8w8_bpreshuffle_128x16x32x128_16x16_16x16_8x16x1_8x16x1_1x16x1x8_4x4x1_1x1_intrawave_v1,126.98,660.3,0.0
304,160,2112,7168,torch.float8_e4m3fnuz,12,0,16.764,a8w8_bpreshuffle_256x32x64x512_16x16_16x16_32x8x1_32x8x1_1x32x1x8_8x8x1_1x2_intrawave_v1,288.98,1011.78,0.0
304,168,192,7168,torch.float8_e4m3fnuz,10,0,9.5537,a8w8_bpreshuffle_128x16x32x512_16x16_16x16_32x4x1_32x4x1_1x16x1x8_4x4x1_1x1_intrawave_v1,48.4,276.86,0.0
304,168,1536,7168,torch.float8_e4m3fnuz,5,0,14.094,a8w8_bpreshuffle_256x16x64x512_16x16_16x16_32x8x1_32x8x1_1x16x1x16_4x4x1_1x1_intrawave_v1,262.48,903.25,0.0
304,168,3072,1536,torch.float8_e4m3fnuz,112,0,7.7474,a8w8_bpreshuffle_256x32x64x256_16x16_16x16_16x16x1_16x16x1_1x32x1x8_8x8x1_2x1_intrawave_v1,204.64,775.59,0.0
304,168,576,7168,torch.float8_e4m3fnuz,5,0,10.614,a8w8_bpreshuffle_256x16x64x512_16x16_16x16_32x8x1_32x8x1_1x16x1x16_4x4x1_1x1_intrawave_v1,130.7,520.68,0.0
304,168,7168,256,torch.float8_e4m3fnuz,75,0,7.3692,a8w8_bpreshuffle_128x16x256x64_16x16_16x16_4x16x1_4x32x1_1x16x1x8_8x8x1_1x2_intrawave_v1,83.67,581.67,0.0
304,168,7168,2048,torch.float8_e4m3fnuz,120,0,13.3126,a8w8_bpreshuffle_256x48x128x256_16x16_16x16_16x16x1_16x16x1_1x16x1x16_8x8x1_1x2_intrawave_v1,370.51,1309.48,0.0
304,168,4608,7168,torch.float8_e4m3fnuz,114,0,26.4048,a8w8_bpreshuffle_256x64x64x256_16x16_16x16_16x16x1_16x16x1_1x32x1x8_8x8x1_2x1_intrawave_v3,420.31,1355.16,0.0
304,168,7168,2304,torch.float8_e4m3fnuz,120,0,15.4047,a8w8_bpreshuffle_256x48x128x256_16x16_16x16_16x16x1_16x16x1_1x16x1x16_8x8x1_1x2_intrawave_v1,360.22,1253.55,0.0
304,168,512,7168,torch.float8_e4m3fnuz,11,0,10.5208,a8w8_bpreshuffle_256x16x64x512_16x16_16x16_32x8x1_32x8x1_1x16x1x16_4x4x1_1x1_intrawave_v1,117.21,479.65,0.0
304,168,4096,512,torch.float8_e4m3fnuz,9,0,5.4774,a8w8_bpreshuffle_128x16x32x128_16x16_16x16_8x16x1_8x16x1_1x16x1x8_4x4x1_1x1_intrawave_v1,128.65,649.84,0.0
304,168,2112,7168,torch.float8_e4m3fnuz,12,0,17.7558,a8w8_bpreshuffle_256x32x64x512_16x16_16x16_32x8x1_32x8x1_1x32x1x8_8x8x1_1x2_intrawave_v1,286.48,960.4,0.0
304,176,192,7168,torch.float8_e4m3fnuz,10,0,8.6103,a8w8_bpreshuffle_128x16x32x512_16x16_16x16_32x4x1_32x4x1_1x16x1x8_4x4x1_1x1_intrawave_v1,56.26,314.21,0.0
304,176,1536,7168,torch.float8_e4m3fnuz,5,0,13.8577,a8w8_bpreshuffle_256x16x64x512_16x16_16x16_32x8x1_32x8x1_1x16x1x16_4x4x1_1x1_intrawave_v1,279.67,924.56,0.0
304,176,3072,1536,torch.float8_e4m3fnuz,112,0,7.7605,a8w8_bpreshuffle_256x32x64x256_16x16_16x16_16x16x1_16x16x1_1x32x1x8_8x8x1_2x1_intrawave_v1,214.03,782.2,0.0
304,176,576,7168,torch.float8_e4m3fnuz,10,0,9.4318,a8w8_bpreshuffle_128x16x32x512_16x16_16x16_32x4x1_32x4x1_1x16x1x8_4x4x1_1x1_intrawave_v1,154.09,593.0,0.0
304,176,7168,256,torch.float8_e4m3fnuz,75,0,7.351,a8w8_bpreshuffle_128x16x256x64_16x16_16x16_4x16x1_4x32x1_1x16x1x8_8x8x1_1x2_intrawave_v1,87.87,598.99,0.0
304,176,7168,2048,torch.float8_e4m3fnuz,120,0,13.5701,a8w8_bpreshuffle_256x48x128x256_16x16_16x16_16x16x1_16x16x1_1x16x1x16_8x8x1_1x2_intrawave_v1,380.79,1294.29,0.0
304,176,4608,7168,torch.float8_e4m3fnuz,114,0,26.1533,a8w8_bpreshuffle_256x64x64x256_16x16_16x16_16x16x1_16x16x1_1x32x1x8_8x8x1_2x1_intrawave_v3,444.56,1373.2,0.0
304,176,7168,2304,torch.float8_e4m3fnuz,120,0,14.8724,a8w8_bpreshuffle_256x48x128x256_16x16_16x16_16x16x1_16x16x1_1x16x1x16_8x8x1_1x2_intrawave_v1,390.88,1307.37,0.0
304,176,512,7168,torch.float8_e4m3fnuz,10,0,9.3562,a8w8_bpreshuffle_128x16x32x512_16x16_16x16_32x4x1_32x4x1_1x16x1x8_4x4x1_1x1_intrawave_v1,138.07,546.36,0.0
304,176,4096,512,torch.float8_e4m3fnuz,9,0,5.4046,a8w8_bpreshuffle_128x16x32x128_16x16_16x16_8x16x1_8x16x1_1x16x1x8_4x4x1_1x1_intrawave_v1,136.59,671.48,0.0
304,176,2112,7168,torch.float8_e4m3fnuz,12,0,17.6411,a8w8_bpreshuffle_256x32x64x512_16x16_16x16_32x8x1_32x8x1_1x32x1x8_8x8x1_1x2_intrawave_v1,302.07,971.81,0.0
304,184,192,7168,torch.float8_e4m3fnuz,11,0,9.8489,a8w8_bpreshuffle_256x16x64x512_16x16_16x16_32x8x1_32x8x1_1x16x1x16_4x4x1_1x1_intrawave_v1,51.42,280.83,0.0
304,184,1536,7168,torch.float8_e4m3fnuz,11,0,15.1015,a8w8_bpreshuffle_256x16x64x512_16x16_16x16_32x8x1_32x8x1_1x16x1x16_4x4x1_1x1_intrawave_v1,268.3,853.84,0.0
304,184,3072,1536,torch.float8_e4m3fnuz,112,0,7.8615,a8w8_bpreshuffle_256x32x64x256_16x16_16x16_16x16x1_16x16x1_1x32x1x8_8x8x1_2x1_intrawave_v1,220.88,779.97,0.0
304,184,576,7168,torch.float8_e4m3fnuz,11,0,10.6848,a8w8_bpreshuffle_256x16x64x512_16x16_16x16_32x8x1_32x8x1_1x16x1x16_4x4x1_1x1_intrawave_v1,142.2,529.69,0.0
304,184,7168,256,torch.float8_e4m3fnuz,75,0,7.6,a8w8_bpreshuffle_128x16x256x64_16x16_16x16_4x16x1_4x32x1_1x16x1x8_8x8x1_1x2_intrawave_v1,88.85,594.73,0.0
304,184,7168,2048,torch.float8_e4m3fnuz,120,0,13.2584,a8w8_bpreshuffle_256x48x128x256_16x16_16x16_16x16x1_16x16x1_1x16x1x16_8x8x1_1x2_intrawave_v1,407.46,1334.6,0.0
304,184,4608,7168,torch.float8_e4m3fnuz,114,0,26.4294,a8w8_bpreshuffle_256x64x64x256_16x16_16x16_16x16x1_16x16x1_1x32x1x8_8x8x1_2x1_intrawave_v3,459.91,1363.81,0.0
304,184,7168,2304,torch.float8_e4m3fnuz,120,0,15.4121,a8w8_bpreshuffle_256x48x128x256_16x16_16x16_16x16x1_16x16x1_1x16x1x16_8x8x1_1x2_intrawave_v1,394.34,1270.22,0.0
304,184,512,7168,torch.float8_e4m3fnuz,11,0,10.5944,a8w8_bpreshuffle_256x16x64x512_16x16_16x16_32x8x1_32x8x1_1x16x1x16_4x4x1_1x1_intrawave_v1,127.48,488.69,0.0
304,184,4096,512,torch.float8_e4m3fnuz,9,0,5.6258,a8w8_bpreshuffle_128x16x32x128_16x16_16x16_8x16x1_8x16x1_1x16x1x8_4x4x1_1x1_intrawave_v1,137.18,657.45,0.0
304,184,2112,7168,torch.float8_e4m3fnuz,12,0,17.9516,a8w8_bpreshuffle_256x32x64x512_16x16_16x16_32x8x1_32x8x1_1x32x1x8_8x8x1_1x2_intrawave_v1,310.34,960.08,0.0
304,192,192,7168,torch.float8_e4m3fnuz,10,0,8.7668,a8w8_bpreshuffle_128x16x32x512_16x16_16x16_32x4x1_32x4x1_1x16x1x8_4x4x1_1x1_intrawave_v1,60.28,322.38,0.0
304,192,1536,7168,torch.float8_e4m3fnuz,5,0,14.4545,a8w8_bpreshuffle_256x16x64x512_16x16_16x16_32x8x1_32x8x1_1x16x1x16_4x4x1_1x1_intrawave_v1,292.49,897.72,0.0
304,192,3072,1536,torch.float8_e4m3fnuz,112,0,7.7598,a8w8_bpreshuffle_256x32x64x256_16x16_16x16_16x16x1_16x16x1_1x32x1x8_8x8x1_2x1_intrawave_v1,233.5,798.11,0.0
304,192,576,7168,torch.float8_e4m3fnuz,10,0,9.5589,a8w8_bpreshuffle_128x16x32x512_16x16_16x16_32x4x1_32x4x1_1x16x1x8_4x4x1_1x1_intrawave_v1,165.86,599.04,0.0
304,192,7168,256,torch.float8_e4m3fnuz,75,0,7.6985,a8w8_bpreshuffle_128x16x256x64_16x16_16x16_4x16x1_4x32x1_1x16x1x8_8x8x1_1x2_intrawave_v1,91.53,602.28,0.0
304,192,7168,2048,torch.float8_e4m3fnuz,120,0,13.0008,a8w8_bpreshuffle_256x48x128x256_16x16_16x16_16x16x1_16x16x1_1x16x1x16_8x8x1_1x2_intrawave_v1,433.6,1371.13,0.0
304,192,4608,7168,torch.float8_e4m3fnuz,113,0,25.7729,a8w8_bpreshuffle_256x48x64x256_16x16_16x16_16x16x1_16x16x1_1x16x1x16_4x4x1_1x1_intrawave_v1,492.13,1403.64,0.0
304,192,7168,2304,torch.float8_e4m3fnuz,120,0,15.033,a8w8_bpreshuffle_256x48x128x256_16x16_16x16_16x16x1_16x16x1_1x16x1x16_8x8x1_1x2_intrawave_v1,421.86,1311.11,0.0
304,192,512,7168,torch.float8_e4m3fnuz,10,0,9.2698,a8w8_bpreshuffle_128x16x32x512_16x16_16x16_32x4x1_32x4x1_1x16x1x8_4x4x1_1x1_intrawave_v1,152.03,565.59,0.0
304,192,4096,512,torch.float8_e4m3fnuz,9,0,5.6086,a8w8_bpreshuffle_128x16x32x128_16x16_16x16_8x16x1_8x16x1_1x16x1x8_4x4x1_1x1_intrawave_v1,143.58,671.88,0.0
304,192,2112,7168,torch.float8_e4m3fnuz,112,0,17.4651,a8w8_bpreshuffle_256x32x64x256_16x16_16x16_16x16x1_16x16x1_1x32x1x8_8x8x1_2x1_intrawave_v1,332.85,992.04,0.0
304,200,192,7168,torch.float8_e4m3fnuz,11,0,10.25,a8w8_bpreshuffle_256x16x64x512_16x16_16x16_32x8x1_32x8x1_1x16x1x16_4x4x1_1x1_intrawave_v1,53.71,281.62,0.0
304,200,1536,7168,torch.float8_e4m3fnuz,12,0,15.8667,a8w8_bpreshuffle_256x32x64x512_16x16_16x16_32x8x1_32x8x1_1x32x1x8_8x8x1_1x2_intrawave_v1,277.56,822.98,0.0
304,200,3072,1536,torch.float8_e4m3fnuz,119,0,7.9056,a8w8_bpreshuffle_256x32x128x256_16x16_16x16_16x16x1_16x16x1_1x16x1x16_8x8x1_1x2_intrawave_v1,238.75,791.16,0.0
304,200,576,7168,torch.float8_e4m3fnuz,11,0,10.8704,a8w8_bpreshuffle_256x16x64x512_16x16_16x16_32x8x1_32x8x1_1x16x1x16_4x4x1_1x1_intrawave_v1,151.93,532.89,0.0
304,200,7168,256,torch.float8_e4m3fnuz,75,0,7.8872,a8w8_bpreshuffle_128x16x256x64_16x16_16x16_4x16x1_4x32x1_1x16x1x8_8x8x1_1x2_intrawave_v1,93.06,602.67,0.0
304,200,7168,2048,torch.float8_e4m3fnuz,121,0,15.8234,a8w8_bpreshuffle_256x64x128x256_16x16_16x16_16x16x1_16x16x1_1x16x1x16_8x8x1_1x2_intrawave_v3,371.1,1134.83,0.0
304,200,4608,7168,torch.float8_e4m3fnuz,119,0,28.5395,a8w8_bpreshuffle_256x32x128x256_16x16_16x16_16x16x1_16x16x1_1x16x1x16_8x8x1_1x2_intrawave_v1,462.94,1272.16,0.0
304,200,7168,2304,torch.float8_e4m3fnuz,121,0,16.6183,a8w8_bpreshuffle_256x64x128x256_16x16_16x16_16x16x1_16x16x1_1x16x1x16_8x8x1_1x2_intrawave_v3,397.52,1194.05,0.0
304,200,512,7168,torch.float8_e4m3fnuz,11,0,10.8151,a8w8_bpreshuffle_256x16x64x512_16x16_16x16_32x8x1_32x8x1_1x16x1x16_4x4x1_1x1_intrawave_v1,135.74,490.83,0.0
304,200,4096,512,torch.float8_e4m3fnuz,76,0,5.6703,a8w8_bpreshuffle_256x32x64x128_16x16_16x16_8x32x1_8x32x1_1x32x1x8_8x8x1_2x1_intrawave_v1,147.94,676.85,0.0
304,200,2112,7168,torch.float8_e4m3fnuz,12,0,18.6451,a8w8_bpreshuffle_256x32x64x512_16x16_16x16_32x8x1_32x8x1_1x32x1x8_8x8x1_1x2_intrawave_v1,324.78,934.14,0.0
304,208,192,7168,torch.float8_e4m3fnuz,24,0,8.9681,a8w8_bpreshuffle_128x16x32x512_16x16_16x16_32x4x1_32x4x1_1x16x1x8_4x4x1_1x1_intrawave_v2,63.84,328.62,0.0
304,208,1536,7168,torch.float8_e4m3fnuz,6,0,16.6448,a8w8_bpreshuffle_256x16x128x512_16x16_16x16_32x8x1_32x8x1_1x16x1x16_8x8x1_1x2_intrawave_v1,275.17,789.43,0.0
304,208,3072,1536,torch.float8_e4m3fnuz,119,0,7.9472,a8w8_bpreshuffle_256x32x128x256_16x16_16x16_16x16x1_16x16x1_1x16x1x16_8x8x1_1x2_intrawave_v1,247.0,794.75,0.0
304,208,576,7168,torch.float8_e4m3fnuz,10,0,10.1036,a8w8_bpreshuffle_128x16x32x512_16x16_16x16_32x4x1_32x4x1_1x16x1x8_4x4x1_1x1_intrawave_v1,170.0,579.92,0.0
304,208,7168,256,torch.float8_e4m3fnuz,75,0,7.8916,a8w8_bpreshuffle_128x16x256x64_16x16_16x16_4x16x1_4x32x1_1x16x1x8_8x8x1_1x2_intrawave_v1,96.73,617.13,0.0
304,208,7168,2048,torch.float8_e4m3fnuz,117,0,16.2428,a8w8_bpreshuffle_256x112x64x256_16x16_16x16_16x16x1_16x16x1_1x16x1x16_4x4x1_1x1_intrawave_v3,375.98,1113.6,0.0
304,208,4608,7168,torch.float8_e4m3fnuz,119,0,28.7975,a8w8_bpreshuffle_256x32x128x256_16x16_16x16_16x16x1_16x16x1_1x16x1x16_8x8x1_1x2_intrawave_v1,477.14,1265.32,0.0
304,208,7168,2304,torch.float8_e4m3fnuz,121,0,16.7204,a8w8_bpreshuffle_256x64x128x256_16x16_16x16_16x16x1_16x16x1_1x16x1x16_8x8x1_1x2_intrawave_v3,410.89,1194.72,0.0
304,208,512,7168,torch.float8_e4m3fnuz,10,0,9.717,a8w8_bpreshuffle_128x16x32x512_16x16_16x16_32x4x1_32x4x1_1x16x1x8_4x4x1_1x1_intrawave_v1,157.12,553.05,0.0
304,208,4096,512,torch.float8_e4m3fnuz,76,0,5.7581,a8w8_bpreshuffle_256x32x64x128_16x16_16x16_8x32x1_8x32x1_1x32x1x8_8x8x1_2x1_intrawave_v1,151.51,678.62,0.0
304,208,2112,7168,torch.float8_e4m3fnuz,12,0,18.7507,a8w8_bpreshuffle_256x32x64x512_16x16_16x16_32x8x1_32x8x1_1x32x1x8_8x8x1_1x2_intrawave_v1,335.87,933.74,0.0
304,216,192,7168,torch.float8_e4m3fnuz,5,0,10.5082,a8w8_bpreshuffle_256x16x64x512_16x16_16x16_32x8x1_32x8x1_1x16x1x16_4x4x1_1x1_intrawave_v1,56.58,286.2,0.0
304,216,1536,7168,torch.float8_e4m3fnuz,12,0,16.1629,a8w8_bpreshuffle_256x32x64x512_16x16_16x16_32x8x1_32x8x1_1x32x1x8_8x8x1_1x2_intrawave_v1,294.28,818.04,0.0
304,216,3072,1536,torch.float8_e4m3fnuz,119,0,8.055,a8w8_bpreshuffle_256x32x128x256_16x16_16x16_16x16x1_16x16x1_1x16x1x16_8x8x1_1x2_intrawave_v1,253.06,791.74,0.0
304,216,576,7168,torch.float8_e4m3fnuz,11,0,10.8674,a8w8_bpreshuffle_256x16x64x512_16x16_16x16_32x8x1_32x8x1_1x16x1x16_4x4x1_1x1_intrawave_v1,164.13,545.29,0.0
304,216,7168,256,torch.float8_e4m3fnuz,75,0,7.9429,a8w8_bpreshuffle_128x16x256x64_16x16_16x16_4x16x1_4x32x1_1x16x1x8_8x8x1_1x2_intrawave_v1,99.8,627.84,0.0
304,216,7168,2048,torch.float8_e4m3fnuz,121,0,15.918,a8w8_bpreshuffle_256x64x128x256_16x16_16x16_16x16x1_16x16x1_1x16x1x16_8x8x1_1x2_intrawave_v3,398.4,1144.55,0.0
304,216,4608,7168,torch.float8_e4m3fnuz,119,0,28.9764,a8w8_bpreshuffle_256x32x128x256_16x16_16x16_16x16x1_16x16x1_1x16x1x16_8x8x1_1x2_intrawave_v1,492.44,1262.03,0.0
304,216,7168,2304,torch.float8_e4m3fnuz,121,0,16.7813,a8w8_bpreshuffle_256x64x128x256_16x16_16x16_16x16x1_16x16x1_1x16x1x16_8x8x1_1x2_intrawave_v3,425.15,1198.32,0.0
304,216,512,7168,torch.float8_e4m3fnuz,11,0,10.6594,a8w8_bpreshuffle_256x16x64x512_16x16_16x16_32x8x1_32x8x1_1x16x1x16_4x4x1_1x1_intrawave_v1,148.74,510.3,0.0
304,216,4096,512,torch.float8_e4m3fnuz,76,0,5.6967,a8w8_bpreshuffle_256x32x64x128_16x16_16x16_8x32x1_8x32x1_1x32x1x8_8x8x1_2x1_intrawave_v1,159.03,698.16,0.0
304,216,2112,7168,torch.float8_e4m3fnuz,12,0,18.807,a8w8_bpreshuffle_256x32x64x512_16x16_16x16_32x8x1_32x8x1_1x32x1x8_8x8x1_1x2_intrawave_v1,347.74,935.79,0.0
304,224,192,7168,torch.float8_e4m3fnuz,10,0,8.9054,a8w8_bpreshuffle_128x16x32x512_16x16_16x16_32x4x1_32x4x1_1x16x1x8_4x4x1_1x1_intrawave_v1,69.23,344.5,0.0
304,224,1536,7168,torch.float8_e4m3fnuz,12,0,16.386,a8w8_bpreshuffle_256x32x64x512_16x16_16x16_32x8x1_32x8x1_1x32x1x8_8x8x1_1x2_intrawave_v1,301.02,811.9,0.0
304,224,3072,1536,torch.float8_e4m3fnuz,119,0,8.0821,a8w8_bpreshuffle_256x32x128x256_16x16_16x16_16x16x1_16x16x1_1x16x1x16_8x8x1_1x2_intrawave_v1,261.56,796.69,0.0
304,224,576,7168,torch.float8_e4m3fnuz,10,0,10.1329,a8w8_bpreshuffle_128x16x32x512_16x16_16x16_32x4x1_32x4x1_1x16x1x8_4x4x1_1x1_intrawave_v1,182.54,591.39,0.0
304,224,7168,256,torch.float8_e4m3fnuz,75,0,7.9513,a8w8_bpreshuffle_128x16x256x64_16x16_16x16_4x16x1_4x32x1_1x16x1x8_8x8x1_1x2_intrawave_v1,103.39,641.86,0.0
304,224,7168,2048,torch.float8_e4m3fnuz,121,0,16.1961,a8w8_bpreshuffle_256x64x128x256_16x16_16x16_16x16x1_16x16x1_1x16x1x16_8x8x1_1x2_intrawave_v3,406.06,1132.99,0.0
304,224,4608,7168,torch.float8_e4m3fnuz,119,0,28.6392,a8w8_bpreshuffle_256x32x128x256_16x16_16x16_16x16x1_16x16x1_1x16x1x16_8x8x1_1x2_intrawave_v1,516.69,1281.47,0.0
304,224,7168,2304,torch.float8_e4m3fnuz,119,0,17.0097,a8w8_bpreshuffle_256x32x128x256_16x16_16x16_16x16x1_16x16x1_1x16x1x16_8x8x1_1x2_intrawave_v1,434.97,1190.05,0.0
304,224,512,7168,torch.float8_e4m3fnuz,10,0,9.6245,a8w8_bpreshuffle_128x16x32x512_16x16_16x16_32x4x1_32x4x1_1x16x1x8_4x4x1_1x1_intrawave_v1,170.83,571.98,0.0
304,224,4096,512,torch.float8_e4m3fnuz,76,0,5.8291,a8w8_bpreshuffle_256x32x64x128_16x16_16x16_8x32x1_8x32x1_1x32x1x8_8x8x1_2x1_intrawave_v1,161.18,694.25,0.0
304,224,2112,7168,torch.float8_e4m3fnuz,12,0,18.5676,a8w8_bpreshuffle_256x32x64x512_16x16_16x16_32x8x1_32x8x1_1x32x1x8_8x8x1_1x2_intrawave_v1,365.27,952.77,0.0
304,232,192,7168,torch.float8_e4m3fnuz,10,0,10.545,a8w8_bpreshuffle_128x16x32x512_16x16_16x16_32x4x1_32x4x1_1x16x1x8_4x4x1_1x1_intrawave_v1,60.56,296.66,0.0
304,232,1536,7168,torch.float8_e4m3fnuz,12,0,16.8754,a8w8_bpreshuffle_256x32x64x512_16x16_16x16_32x8x1_32x8x1_1x32x1x8_8x8x1_1x2_intrawave_v1,302.73,793.21,0.0
304,232,3072,1536,torch.float8_e4m3fnuz,119,0,8.3176,a8w8_bpreshuffle_256x32x128x256_16x16_16x16_16x16x1_16x16x1_1x16x1x16_8x8x1_1x2_intrawave_v1,263.23,781.52,0.0
304,232,576,7168,torch.float8_e4m3fnuz,11,0,10.9782,a8w8_bpreshuffle_256x16x64x512_16x16_16x16_32x8x1_32x8x1_1x16x1x16_4x4x1_1x1_intrawave_v1,174.5,551.91,0.0
304,232,7168,256,torch.float8_e4m3fnuz,73,0,7.9545,a8w8_bpreshuffle_256x32x256x64_16x16_16x16_4x32x1_4x64x1_1x32x1x8_8x8x1_2x1_intrawave_v1,107.04,656.28,0.0
304,232,7168,2048,torch.float8_e4m3fnuz,121,0,16.5577,a8w8_bpreshuffle_256x64x128x256_16x16_16x16_16x16x1_16x16x1_1x16x1x16_8x8x1_1x2_intrawave_v3,411.38,1116.17,0.0
304,232,4608,7168,torch.float8_e4m3fnuz,114,0,30.6135,a8w8_bpreshuffle_256x64x64x256_16x16_16x16_16x16x1_16x16x1_1x32x1x8_8x8x1_2x1_intrawave_v3,500.63,1203.1,0.0
304,232,7168,2304,torch.float8_e4m3fnuz,121,0,16.9789,a8w8_bpreshuffle_256x64x128x256_16x16_16x16_16x16x1_16x16x1_1x16x1x16_8x8x1_1x2_intrawave_v3,451.32,1200.05,0.0
304,232,512,7168,torch.float8_e4m3fnuz,5,0,10.8491,a8w8_bpreshuffle_256x16x64x512_16x16_16x16_32x8x1_32x8x1_1x16x1x16_4x4x1_1x1_intrawave_v1,156.96,513.46,0.0
304,232,4096,512,torch.float8_e4m3fnuz,76,0,5.6394,a8w8_bpreshuffle_256x32x64x128_16x16_16x16_8x32x1_8x32x1_1x32x1x8_8x8x1_2x1_intrawave_v1,172.55,729.95,0.0
304,232,2112,7168,torch.float8_e4m3fnuz,12,0,19.3022,a8w8_bpreshuffle_256x32x64x512_16x16_16x16_32x8x1_32x8x1_1x32x1x8_8x8x1_1x2_intrawave_v1,363.92,921.23,0.0
304,240,192,7168,torch.float8_e4m3fnuz,24,0,8.9279,a8w8_bpreshuffle_128x16x32x512_16x16_16x16_32x4x1_32x4x1_1x16x1x8_4x4x1_1x1_intrawave_v2,73.99,357.17,0.0
304,240,1536,7168,torch.float8_e4m3fnuz,12,0,17.324,a8w8_bpreshuffle_256x32x64x512_16x16_16x16_32x8x1_32x8x1_1x32x1x8_8x8x1_1x2_intrawave_v1,305.06,777.4,0.0
304,240,3072,1536,torch.float8_e4m3fnuz,119,0,8.4245,a8w8_bpreshuffle_256x32x128x256_16x16_16x16_16x16x1_16x16x1_1x16x1x16_8x8x1_1x2_intrawave_v1,268.85,778.89,0.0
304,240,576,7168,torch.float8_e4m3fnuz,5,0,10.2872,a8w8_bpreshuffle_256x16x64x512_16x16_16x16_32x8x1_32x8x1_1x16x1x16_4x4x1_1x1_intrawave_v1,192.65,595.46,0.0
304,240,7168,256,torch.float8_e4m3fnuz,75,0,7.9685,a8w8_bpreshuffle_128x16x256x64_16x16_16x16_4x16x1_4x32x1_1x16x1x8_8x8x1_1x2_intrawave_v1,110.54,669.77,0.0
304,240,7168,2048,torch.float8_e4m3fnuz,122,0,16.5201,a8w8_bpreshuffle_256x80x128x256_16x16_16x16_16x16x1_16x16x1_1x16x1x16_8x8x1_1x2_intrawave_v3,426.54,1126.64,0.0
304,240,4608,7168,torch.float8_e4m3fnuz,114,0,30.4506,a8w8_bpreshuffle_256x64x64x256_16x16_16x16_16x16x1_16x16x1_1x32x1x8_8x8x1_2x1_intrawave_v3,520.66,1213.84,0.0
304,240,7168,2304,torch.float8_e4m3fnuz,121,0,17.6698,a8w8_bpreshuffle_256x64x128x256_16x16_16x16_16x16x1_16x16x1_1x16x1x16_8x8x1_1x2_intrawave_v3,448.63,1160.66,0.0
304,240,512,7168,torch.float8_e4m3fnuz,10,0,9.6258,a8w8_bpreshuffle_128x16x32x512_16x16_16x16_32x4x1_32x4x1_1x16x1x8_4x4x1_1x1_intrawave_v1,183.01,585.52,0.0
304,240,4096,512,torch.float8_e4m3fnuz,76,0,5.7031,a8w8_bpreshuffle_256x32x64x128_16x16_16x16_8x32x1_8x32x1_1x32x1x8_8x8x1_2x1_intrawave_v1,176.51,734.01,0.0
304,240,2112,7168,torch.float8_e4m3fnuz,12,0,19.5086,a8w8_bpreshuffle_256x32x64x512_16x16_16x16_32x8x1_32x8x1_1x32x1x8_8x8x1_1x2_intrawave_v1,372.48,916.15,0.0
304,248,192,7168,torch.float8_e4m3fnuz,5,0,10.695,a8w8_bpreshuffle_256x16x64x512_16x16_16x16_32x8x1_32x8x1_1x16x1x16_4x4x1_1x1_intrawave_v1,63.83,303.8,0.0
304,248,1536,7168,torch.float8_e4m3fnuz,12,0,17.0789,a8w8_bpreshuffle_256x32x64x512_16x16_16x16_32x8x1_32x8x1_1x32x1x8_8x8x1_1x2_intrawave_v1,319.75,793.35,0.0
304,248,3072,1536,torch.float8_e4m3fnuz,119,0,8.4599,a8w8_bpreshuffle_256x32x128x256_16x16_16x16_16x16x1_16x16x1_1x16x1x16_8x8x1_1x2_intrawave_v1,276.65,782.9,0.0
304,248,576,7168,torch.float8_e4m3fnuz,5,0,11.2793,a8w8_bpreshuffle_256x16x64x512_16x16_16x16_32x8x1_32x8x1_1x16x1x16_4x4x1_1x1_intrawave_v1,181.56,548.98,0.0
304,248,7168,256,torch.float8_e4m3fnuz,73,0,7.9513,a8w8_bpreshuffle_256x32x256x64_16x16_16x16_4x32x1_4x64x1_1x32x1x8_8x8x1_2x1_intrawave_v1,114.47,685.9,0.0
304,248,7168,2048,torch.float8_e4m3fnuz,121,0,16.148,a8w8_bpreshuffle_256x64x128x256_16x16_16x16_16x16x1_16x16x1_1x16x1x16_8x8x1_1x2_intrawave_v3,450.91,1160.72,0.0
304,248,4608,7168,torch.float8_e4m3fnuz,119,0,30.4706,a8w8_bpreshuffle_256x32x128x256_16x16_16x16_16x16x1_16x16x1_1x16x1x16_8x8x1_1x2_intrawave_v1,537.66,1217.35,0.0
304,248,7168,2304,torch.float8_e4m3fnuz,121,0,17.2742,a8w8_bpreshuffle_256x64x128x256_16x16_16x16_16x16x1_16x16x1_1x16x1x16_8x8x1_1x2_intrawave_v3,474.2,1194.95,0.0
304,248,512,7168,torch.float8_e4m3fnuz,5,0,11.0254,a8w8_bpreshuffle_256x16x64x512_16x16_16x16_32x8x1_32x8x1_1x16x1x16_4x4x1_1x1_intrawave_v1,165.1,517.14,0.0
304,248,4096,512,torch.float8_e4m3fnuz,76,0,5.7243,a8w8_bpreshuffle_256x32x64x128_16x16_16x16_8x32x1_8x32x1_1x32x1x8_8x8x1_2x1_intrawave_v1,181.71,743.45,0.0
304,248,2112,7168,torch.float8_e4m3fnuz,12,0,19.6962,a8w8_bpreshuffle_256x32x64x512_16x16_16x16_32x8x1_32x8x1_1x32x1x8_8x8x1_1x2_intrawave_v1,381.23,912.06,0.0
304,256,192,7168,torch.float8_e4m3fnuz,10,0,9.4001,a8w8_bpreshuffle_128x16x32x512_16x16_16x16_32x4x1_32x4x1_1x16x1x8_4x4x1_1x1_intrawave_v1,74.96,352.08,0.0
304,256,1536,7168,torch.float8_e4m3fnuz,112,0,16.6159,a8w8_bpreshuffle_256x32x64x256_16x16_16x16_16x16x1_16x16x1_1x32x1x8_8x8x1_2x1_intrawave_v1,339.26,820.39,0.0
304,256,3072,1536,torch.float8_e4m3fnuz,119,0,8.472,a8w8_bpreshuffle_256x32x128x256_16x16_16x16_16x16x1_16x16x1_1x16x1x16_8x8x1_1x2_intrawave_v1,285.17,789.03,0.0
304,256,576,7168,torch.float8_e4m3fnuz,11,0,10.3967,a8w8_bpreshuffle_256x16x64x512_16x16_16x16_32x8x1_32x8x1_1x16x1x16_4x4x1_1x1_intrawave_v1,203.33,601.99,0.0
304,256,7168,256,torch.float8_e4m3fnuz,73,0,7.9176,a8w8_bpreshuffle_256x32x256x64_16x16_16x16_4x32x1_4x64x1_1x32x1x8_8x8x1_2x1_intrawave_v1,118.66,703.57,0.0
304,256,7168,2048,torch.float8_e4m3fnuz,121,0,16.1447,a8w8_bpreshuffle_256x64x128x256_16x16_16x16_16x16x1_16x16x1_1x16x1x16_8x8x1_1x2_intrawave_v3,465.55,1169.08,0.0
304,256,4608,7168,torch.float8_e4m3fnuz,114,0,29.2682,a8w8_bpreshuffle_256x64x64x256_16x16_16x16_16x16x1_16x16x1_1x32x1x8_8x8x1_2x1_intrawave_v3,577.81,1271.84,0.0
304,256,7168,2304,torch.float8_e4m3fnuz,121,0,17.0182,a8w8_bpreshuffle_256x64x128x256_16x16_16x16_16x16x1_16x16x1_1x16x1x16_8x8x1_1x2_intrawave_v3,496.86,1220.75,0.0
304,256,512,7168,torch.float8_e4m3fnuz,10,0,10.1525,a8w8_bpreshuffle_128x16x32x512_16x16_16x16_32x4x1_32x4x1_1x16x1x8_4x4x1_1x1_intrawave_v1,185.08,568.05,0.0
304,256,4096,512,torch.float8_e4m3fnuz,76,0,5.8461,a8w8_bpreshuffle_256x32x64x128_16x16_16x16_8x32x1_8x32x1_1x32x1x8_8x8x1_2x1_intrawave_v1,183.67,739.87,0.0
304,256,2112,7168,torch.float8_e4m3fnuz,112,0,19.3769,a8w8_bpreshuffle_256x32x64x256_16x16_16x16_16x16x1_16x16x1_1x32x1x8_8x8x1_2x1_intrawave_v1,400.02,931.79,0.0
304,264,192,7168,torch.float8_e4m3fnuz,11,0,10.4296,a8w8_bpreshuffle_256x16x64x512_16x16_16x16_32x8x1_32x8x1_1x16x1x16_4x4x1_1x1_intrawave_v1,69.67,323.12,0.0
304,264,1536,7168,torch.float8_e4m3fnuz,12,0,18.8518,a8w8_bpreshuffle_256x32x64x512_16x16_16x16_32x8x1_32x8x1_1x32x1x8_8x8x1_1x2_intrawave_v1,308.37,727.43,0.0
304,264,3072,1536,torch.float8_e4m3fnuz,113,0,9.1199,a8w8_bpreshuffle_256x48x64x256_16x16_16x16_16x16x1_16x16x1_1x16x1x16_4x4x1_1x1_intrawave_v1,273.18,739.71,0.0
304,264,576,7168,torch.float8_e4m3fnuz,11,0,11.0887,a8w8_bpreshuffle_256x16x64x512_16x16_16x16_32x8x1_32x8x1_1x16x1x16_4x4x1_1x1_intrawave_v1,196.6,570.42,0.0
304,264,7168,256,torch.float8_e4m3fnuz,75,0,8.1095,a8w8_bpreshuffle_128x16x256x64_16x16_16x16_4x16x1_4x32x1_1x16x1x8_8x8x1_1x2_intrawave_v1,119.48,701.31,0.0
304,264,7168,2048,torch.float8_e4m3fnuz,122,0,18.3082,a8w8_bpreshuffle_256x80x128x256_16x16_16x16_16x16x1_16x16x1_1x16x1x16_8x8x1_1x2_intrawave_v3,423.37,1038.08,0.0
304,264,4608,7168,torch.float8_e4m3fnuz,120,0,33.8411,a8w8_bpreshuffle_256x48x128x256_16x16_16x16_16x16x1_16x16x1_1x16x1x16_8x8x1_1x2_intrawave_v1,515.35,1103.85,0.0
304,264,7168,2304,torch.float8_e4m3fnuz,123,0,19.8981,a8w8_bpreshuffle_256x96x128x256_16x16_16x16_16x16x1_16x16x1_1x16x1x16_8x8x1_1x2_intrawave_v3,438.23,1050.76,0.0
304,264,512,7168,torch.float8_e4m3fnuz,11,0,10.786,a8w8_bpreshuffle_256x16x64x512_16x16_16x16_32x8x1_32x8x1_1x16x1x16_4x4x1_1x1_intrawave_v1,179.66,540.77,0.0
304,264,4096,512,torch.float8_e4m3fnuz,76,0,5.8581,a8w8_bpreshuffle_256x32x64x128_16x16_16x16_8x32x1_8x32x1_1x32x1x8_8x8x1_2x1_intrawave_v1,189.02,750.24,0.0
304,264,2112,7168,torch.float8_e4m3fnuz,12,0,21.9558,a8w8_bpreshuffle_256x32x64x512_16x16_16x16_32x8x1_32x8x1_1x32x1x8_8x8x1_1x2_intrawave_v1,364.06,826.49,0.0
304,272,192,7168,torch.float8_e4m3fnuz,24,0,9.1194,a8w8_bpreshuffle_128x16x32x512_16x16_16x16_32x4x1_32x4x1_1x16x1x8_4x4x1_1x1_intrawave_v2,82.1,376.17,0.0
304,272,1536,7168,torch.float8_e4m3fnuz,12,0,18.4897,a8w8_bpreshuffle_256x32x64x512_16x16_16x16_32x8x1_32x8x1_1x32x1x8_8x8x1_1x2_intrawave_v1,323.94,746.11,0.0
304,272,3072,1536,torch.float8_e4m3fnuz,113,0,9.1362,a8w8_bpreshuffle_256x48x64x256_16x16_16x16_16x16x1_16x16x1_1x16x1x16_4x4x1_1x1_intrawave_v1,280.96,745.12,0.0
304,272,576,7168,torch.float8_e4m3fnuz,11,0,10.8062,a8w8_bpreshuffle_256x16x64x512_16x16_16x16_32x8x1_32x8x1_1x16x1x16_4x4x1_1x1_intrawave_v1,207.85,591.49,0.0
304,272,7168,256,torch.float8_e4m3fnuz,75,0,8.0748,a8w8_bpreshuffle_128x16x256x64_16x16_16x16_4x16x1_4x32x1_1x16x1x8_8x8x1_1x2_intrawave_v1,123.62,718.78,0.0
304,272,7168,2048,torch.float8_e4m3fnuz,122,0,18.361,a8w8_bpreshuffle_256x80x128x256_16x16_16x16_16x16x1_16x16x1_1x16x1x16_8x8x1_1x2_intrawave_v3,434.94,1042.24,0.0
304,272,4608,7168,torch.float8_e4m3fnuz,120,0,32.8345,a8w8_bpreshuffle_256x48x128x256_16x16_16x16_16x16x1_16x16x1_1x16x1x16_8x8x1_1x2_intrawave_v1,547.24,1141.68,0.0
304,272,7168,2304,torch.float8_e4m3fnuz,122,0,19.9611,a8w8_bpreshuffle_256x80x128x256_16x16_16x16_16x16x1_16x16x1_1x16x1x16_8x8x1_1x2_intrawave_v3,450.09,1054.11,0.0
304,272,512,7168,torch.float8_e4m3fnuz,5,0,10.1915,a8w8_bpreshuffle_256x16x64x512_16x16_16x16_32x8x1_32x8x1_1x16x1x16_4x4x1_1x1_intrawave_v1,195.9,578.74,0.0
304,272,4096,512,torch.float8_e4m3fnuz,76,0,5.909,a8w8_bpreshuffle_256x32x64x128_16x16_16x16_8x32x1_8x32x1_1x32x1x8_8x8x1_2x1_intrawave_v1,193.07,755.57,0.0
304,272,2112,7168,torch.float8_e4m3fnuz,12,0,22.1619,a8w8_bpreshuffle_256x32x64x512_16x16_16x16_32x8x1_32x8x1_1x32x1x8_8x8x1_1x2_intrawave_v1,371.61,822.92,0.0
304,280,192,7168,torch.float8_e4m3fnuz,11,0,10.3181,a8w8_bpreshuffle_256x16x64x512_16x16_16x16_32x8x1_32x8x1_1x16x1x16_4x4x1_1x1_intrawave_v1,74.69,338.32,0.0
304,280,1536,7168,torch.float8_e4m3fnuz,12,0,18.7269,a8w8_bpreshuffle_256x32x64x512_16x16_16x16_32x8x1_32x8x1_1x32x1x8_8x8x1_1x2_intrawave_v1,329.24,741.03,0.0
304,280,3072,1536,torch.float8_e4m3fnuz,113,0,9.2246,a8w8_bpreshuffle_256x48x64x256_16x16_16x16_16x16x1_16x16x1_1x16x1x16_4x4x1_1x1_intrawave_v1,286.45,744.64,0.0
304,280,576,7168,torch.float8_e4m3fnuz,5,0,11.5099,a8w8_bpreshuffle_256x16x64x512_16x16_16x16_32x8x1_32x8x1_1x16x1x16_4x4x1_1x1_intrawave_v1,200.88,561.11,0.0
304,280,7168,256,torch.float8_e4m3fnuz,73,0,8.1452,a8w8_bpreshuffle_256x32x256x64_16x16_16x16_4x32x1_4x64x1_1x32x1x8_8x8x1_2x1_intrawave_v1,126.16,726.9,0.0
304,280,7168,2048,torch.float8_e4m3fnuz,122,0,18.4884,a8w8_bpreshuffle_256x80x128x256_16x16_16x16_16x16x1_16x16x1_1x16x1x16_8x8x1_1x2_intrawave_v3,444.65,1042.14,0.0
304,280,4608,7168,torch.float8_e4m3fnuz,120,0,34.5598,a8w8_bpreshuffle_256x48x128x256_16x16_16x16_16x16x1_16x16x1_1x16x1x16_8x8x1_1x2_intrawave_v1,535.21,1088.48,0.0
304,280,7168,2304,torch.float8_e4m3fnuz,122,0,20.0996,a8w8_bpreshuffle_256x80x128x256_16x16_16x16_16x16x1_16x16x1_1x16x1x16_8x8x1_1x2_intrawave_v3,460.13,1053.47,0.0
304,280,512,7168,torch.float8_e4m3fnuz,11,0,10.9519,a8w8_bpreshuffle_256x16x64x512_16x16_16x16_32x8x1_32x8x1_1x16x1x16_4x4x1_1x1_intrawave_v1,187.66,544.54,0.0
304,280,4096,512,torch.float8_e4m3fnuz,76,0,5.9503,a8w8_bpreshuffle_256x32x64x128_16x16_16x16_8x32x1_8x32x1_1x32x1x8_8x8x1_2x1_intrawave_v1,197.37,762.02,0.0
304,280,2112,7168,torch.float8_e4m3fnuz,12,0,22.1036,a8w8_bpreshuffle_256x32x64x512_16x16_16x16_32x8x1_32x8x1_1x32x1x8_8x8x1_1x2_intrawave_v1,383.55,829.21,0.0
304,288,192,7168,torch.float8_e4m3fnuz,24,0,9.0819,a8w8_bpreshuffle_128x16x32x512_16x16_16x16_32x4x1_32x4x1_1x16x1x8_4x4x1_1x1_intrawave_v2,87.29,391.02,0.0
304,288,1536,7168,torch.float8_e4m3fnuz,12,0,18.4506,a8w8_bpreshuffle_256x32x64x512_16x16_16x16_32x8x1_32x8x1_1x32x1x8_8x8x1_1x2_intrawave_v1,343.72,756.57,0.0
304,288,3072,1536,torch.float8_e4m3fnuz,113,0,9.1248,a8w8_bpreshuffle_256x48x64x256_16x16_16x16_16x16x1_16x16x1_1x16x1x16_4x4x1_1x1_intrawave_v1,297.86,759.52,0.0
304,288,576,7168,torch.float8_e4m3fnuz,5,0,11.2323,a8w8_bpreshuffle_256x16x64x512_16x16_16x16_32x8x1_32x8x1_1x16x1x16_4x4x1_1x1_intrawave_v1,211.73,580.91,0.0
304,288,7168,256,torch.float8_e4m3fnuz,75,0,8.1852,a8w8_bpreshuffle_128x16x256x64_16x16_16x16_4x16x1_4x32x1_1x16x1x8_8x8x1_1x2_intrawave_v1,129.13,737.61,0.0
304,288,7168,2048,torch.float8_e4m3fnuz,123,0,18.4897,a8w8_bpreshuffle_256x96x128x256_16x16_16x16_16x16x1_16x16x1_1x16x1x16_8x8x1_1x2_intrawave_v3,457.32,1049.16,0.0
304,288,4608,7168,torch.float8_e4m3fnuz,120,0,32.8206,a8w8_bpreshuffle_256x48x128x256_16x16_16x16_16x16x1_16x16x1_1x16x1x16_8x8x1_1x2_intrawave_v1,579.68,1150.15,0.0
304,288,7168,2304,torch.float8_e4m3fnuz,123,0,19.6817,a8w8_bpreshuffle_256x96x128x256_16x16_16x16_16x16x1_16x16x1_1x16x1x16_8x8x1_1x2_intrawave_v3,483.33,1082.6,0.0
304,288,512,7168,torch.float8_e4m3fnuz,11,0,10.2968,a8w8_bpreshuffle_256x16x64x512_16x16_16x16_32x8x1_32x8x1_1x16x1x16_4x4x1_1x1_intrawave_v1,205.3,585.55,0.0
304,288,4096,512,torch.float8_e4m3fnuz,76,0,5.9515,a8w8_bpreshuffle_256x32x64x128_16x16_16x16_8x32x1_8x32x1_1x32x1x8_8x8x1_2x1_intrawave_v1,202.97,773.57,0.0
304,288,2112,7168,torch.float8_e4m3fnuz,113,0,21.1958,a8w8_bpreshuffle_256x48x64x256_16x16_16x16_16x16x1_16x16x1_1x16x1x16_4x4x1_1x1_intrawave_v1,411.4,869.03,0.0
304,296,192,7168,torch.float8_e4m3fnuz,5,0,10.5179,a8w8_bpreshuffle_256x16x64x512_16x16_16x16_32x8x1_32x8x1_1x16x1x16_4x4x1_1x1_intrawave_v1,77.46,343.38,0.0
304,296,1536,7168,torch.float8_e4m3fnuz,12,0,19.2769,a8w8_bpreshuffle_256x32x64x512_16x16_16x16_32x8x1_32x8x1_1x32x1x8_8x8x1_1x2_intrawave_v1,338.12,728.39,0.0
304,296,3072,1536,torch.float8_e4m3fnuz,119,0,9.3224,a8w8_bpreshuffle_256x32x128x256_16x16_16x16_16x16x1_16x16x1_1x16x1x16_8x8x1_1x2_intrawave_v1,299.64,750.01,0.0
304,296,576,7168,torch.float8_e4m3fnuz,11,0,11.5831,a8w8_bpreshuffle_256x16x64x512_16x16_16x16_32x8x1_32x8x1_1x16x1x16_4x4x1_1x1_intrawave_v1,211.02,569.06,0.0
304,296,7168,256,torch.float8_e4m3fnuz,73,0,8.1916,a8w8_bpreshuffle_256x32x256x64_16x16_16x16_4x32x1_4x64x1_1x32x1x8_8x8x1_2x1_intrawave_v1,132.61,751.29,0.0
304,296,7168,2048,torch.float8_e4m3fnuz,122,0,18.6157,a8w8_bpreshuffle_256x80x128x256_16x16_16x16_16x16x1_16x16x1_1x16x1x16_8x8x1_1x2_intrawave_v3,466.84,1049.1,0.0
304,296,4608,7168,torch.float8_e4m3fnuz,115,0,35.8813,a8w8_bpreshuffle_256x80x64x256_16x16_16x16_16x16x1_16x16x1_1x16x1x16_4x4x1_1x1_intrawave_v3,544.96,1055.7,0.0
304,296,7168,2304,torch.float8_e4m3fnuz,122,0,20.4289,a8w8_bpreshuffle_256x80x128x256_16x16_16x16_16x16x1_16x16x1_1x16x1x16_8x8x1_1x2_intrawave_v3,478.58,1049.52,0.0
304,296,512,7168,torch.float8_e4m3fnuz,5,0,10.9353,a8w8_bpreshuffle_256x16x64x512_16x16_16x16_32x8x1_32x8x1_1x16x1x16_4x4x1_1x1_intrawave_v1,198.68,557.36,0.0
304,296,4096,512,torch.float8_e4m3fnuz,76,0,6.5558,a8w8_bpreshuffle_256x32x64x128_16x16_16x16_8x32x1_8x32x1_1x32x1x8_8x8x1_2x1_intrawave_v1,189.38,712.89,0.0
304,296,2112,7168,torch.float8_e4m3fnuz,113,0,23.2995,a8w8_bpreshuffle_256x48x64x256_16x16_16x16_16x16x1_16x16x1_1x16x1x16_4x4x1_1x1_intrawave_v1,384.65,794.47,0.0
304,304,192,7168,torch.float8_e4m3fnuz,10,0,9.097,a8w8_bpreshuffle_128x16x32x512_16x16_16x16_32x4x1_32x4x1_1x16x1x8_4x4x1_1x1_intrawave_v1,91.98,403.66,0.0
304,304,1536,7168,torch.float8_e4m3fnuz,12,0,19.1612,a8w8_bpreshuffle_256x32x64x512_16x16_16x16_32x8x1_32x8x1_1x32x1x8_8x8x1_1x2_intrawave_v1,349.36,737.06,0.0
304,304,3072,1536,torch.float8_e4m3fnuz,119,0,9.3374,a8w8_bpreshuffle_256x32x128x256_16x16_16x16_16x16x1_16x16x1_1x16x1x16_8x8x1_1x2_intrawave_v1,307.25,755.38,0.0
304,304,576,7168,torch.float8_e4m3fnuz,5,0,11.2272,a8w8_bpreshuffle_256x16x64x512_16x16_16x16_32x8x1_32x8x1_1x16x1x16_4x4x1_1x1_intrawave_v1,223.59,593.03,0.0
304,304,7168,256,torch.float8_e4m3fnuz,75,0,8.213,a8w8_bpreshuffle_128x16x256x64_16x16_16x16_4x16x1_4x32x1_1x16x1x8_8x8x1_1x2_intrawave_v1,135.84,763.54,0.0
304,304,7168,2048,torch.float8_e4m3fnuz,122,0,18.6876,a8w8_bpreshuffle_256x80x128x256_16x16_16x16_16x16x1_16x16x1_1x16x1x16_8x8x1_1x2_intrawave_v3,477.62,1052.08,0.0
304,304,4608,7168,torch.float8_e4m3fnuz,115,0,35.5917,a8w8_bpreshuffle_256x80x64x256_16x16_16x16_16x16x1_16x16x1_1x16x1x16_4x4x1_1x1_intrawave_v3,564.24,1067.97,0.0
304,304,7168,2304,torch.float8_e4m3fnuz,122,0,20.4234,a8w8_bpreshuffle_256x80x128x256_16x16_16x16_16x16x1_16x16x1_1x16x1x16_8x8x1_1x2_intrawave_v3,491.65,1056.32,0.0
304,304,512,7168,torch.float8_e4m3fnuz,10,0,10.6337,a8w8_bpreshuffle_128x16x32x512_16x16_16x16_32x4x1_32x4x1_1x16x1x8_4x4x1_1x1_intrawave_v1,209.84,579.33,0.0
304,304,4096,512,torch.float8_e4m3fnuz,76,0,6.5126,a8w8_bpreshuffle_256x32x64x128_16x16_16x16_8x32x1_8x32x1_1x32x1x8_8x8x1_2x1_intrawave_v1,195.78,728.31,0.0
304,304,2112,7168,torch.float8_e4m3fnuz,113,0,23.3481,a8w8_bpreshuffle_256x48x64x256_16x16_16x16_16x16x1_16x16x1_1x16x1x16_4x4x1_1x1_intrawave_v1,394.22,796.72,0.0
304,312,192,7168,torch.float8_e4m3fnuz,11,0,10.6017,a8w8_bpreshuffle_256x16x64x512_16x16_16x16_32x8x1_32x8x1_1x16x1x16_4x4x1_1x1_intrawave_v1,81.0,352.06,0.0
304,312,1536,7168,torch.float8_e4m3fnuz,12,0,19.2034,a8w8_bpreshuffle_256x32x64x512_16x16_16x16_32x8x1_32x8x1_1x32x1x8_8x8x1_1x2_intrawave_v1,357.76,739.71,0.0
304,312,3072,1536,torch.float8_e4m3fnuz,119,0,9.3976,a8w8_bpreshuffle_256x32x128x256_16x16_16x16_16x16x1_16x16x1_1x16x1x16_8x8x1_1x2_intrawave_v1,313.31,757.08,0.0
304,312,576,7168,torch.float8_e4m3fnuz,11,0,11.7075,a8w8_bpreshuffle_256x16x64x512_16x16_16x16_32x8x1_32x8x1_1x16x1x16_4x4x1_1x1_intrawave_v1,220.06,574.38,0.0
304,312,7168,256,torch.float8_e4m3fnuz,73,0,8.3253,a8w8_bpreshuffle_256x32x256x64_16x16_16x16_4x32x1_4x64x1_1x32x1x8_8x8x1_2x1_intrawave_v1,137.54,767.27,0.0
304,312,7168,2048,torch.float8_e4m3fnuz,122,0,18.8879,a8w8_bpreshuffle_256x80x128x256_16x16_16x16_16x16x1_16x16x1_1x16x1x16_8x8x1_1x2_intrawave_v3,484.99,1047.86,0.0
304,312,4608,7168,torch.float8_e4m3fnuz,120,0,35.3393,a8w8_bpreshuffle_256x48x128x256_16x16_16x16_16x16x1_16x16x1_1x16x1x16_8x8x1_1x2_intrawave_v1,583.23,1079.31,0.0
304,312,7168,2304,torch.float8_e4m3fnuz,122,0,20.5511,a8w8_bpreshuffle_256x80x128x256_16x16_16x16_16x16x1_16x16x1_1x16x1x16_8x8x1_1x2_intrawave_v3,501.45,1056.23,0.0
304,312,512,7168,torch.float8_e4m3fnuz,5,0,11.1154,a8w8_bpreshuffle_256x16x64x512_16x16_16x16_32x8x1_32x8x1_1x16x1x16_4x4x1_1x1_intrawave_v1,206.03,560.12,0.0
304,312,4096,512,torch.float8_e4m3fnuz,76,0,6.6422,a8w8_bpreshuffle_256x32x64x128_16x16_16x16_8x32x1_8x32x1_1x32x1x8_8x8x1_2x1_intrawave_v1,197.02,724.58,0.0
304,312,2112,7168,torch.float8_e4m3fnuz,113,0,23.2432,a8w8_bpreshuffle_256x48x64x256_16x16_16x16_16x16x1_16x16x1_1x16x1x16_4x4x1_1x1_intrawave_v1,406.43,804.24,0.0
304,320,192,7168,torch.float8_e4m3fnuz,24,0,9.1803,a8w8_bpreshuffle_128x16x32x512_16x16_16x16_32x4x1_32x4x1_1x16x1x8_4x4x1_1x1_intrawave_v2,95.94,413.16,0.0
304,320,1536,7168,torch.float8_e4m3fnuz,112,0,18.7708,a8w8_bpreshuffle_256x32x64x256_16x16_16x16_16x16x1_16x16x1_1x32x1x8_8x8x1_2x1_intrawave_v1,375.39,761.12,0.0
304,320,3072,1536,torch.float8_e4m3fnuz,119,0,9.3362,a8w8_bpreshuffle_256x32x128x256_16x16_16x16_16x16x1_16x16x1_1x16x1x16_8x8x1_1x2_intrawave_v1,323.46,768.64,0.0
304,320,576,7168,torch.float8_e4m3fnuz,11,0,11.0875,a8w8_bpreshuffle_256x16x64x512_16x16_16x16_32x8x1_32x8x1_1x16x1x16_4x4x1_1x1_intrawave_v1,238.32,612.51,0.0
304,320,7168,256,torch.float8_e4m3fnuz,73,0,8.2505,a8w8_bpreshuffle_256x32x256x64_16x16_16x16_4x32x1_4x64x1_1x32x1x8_8x8x1_2x1_intrawave_v1,142.34,788.37,0.0
304,320,7168,2048,torch.float8_e4m3fnuz,122,0,18.393,a8w8_bpreshuffle_256x80x128x256_16x16_16x16_16x16x1_16x16x1_1x16x1x16_8x8x1_1x2_intrawave_v3,510.81,1083.18,0.0
304,320,4608,7168,torch.float8_e4m3fnuz,115,0,34.5922,a8w8_bpreshuffle_256x80x64x256_16x16_16x16_16x16x1_16x16x1_1x16x1x16_4x4x1_1x1_intrawave_v3,611.1,1106.41,0.0
304,320,7168,2304,torch.float8_e4m3fnuz,122,0,19.8815,a8w8_bpreshuffle_256x80x128x256_16x16_16x16_16x16x1_16x16x1_1x16x1x16_8x8x1_1x2_intrawave_v3,531.63,1098.5,0.0
304,320,512,7168,torch.float8_e4m3fnuz,5,0,10.6233,a8w8_bpreshuffle_256x16x64x512_16x16_16x16_32x8x1_32x8x1_1x16x1x16_4x4x1_1x1_intrawave_v1,221.1,592.23,0.0
304,320,4096,512,torch.float8_e4m3fnuz,76,0,6.2111,a8w8_bpreshuffle_256x32x64x128_16x16_16x16_8x32x1_8x32x1_1x32x1x8_8x8x1_2x1_intrawave_v1,216.09,786.08,0.0
304,320,2112,7168,torch.float8_e4m3fnuz,114,0,22.9109,a8w8_bpreshuffle_256x64x64x256_16x16_16x16_16x16x1_16x16x1_1x32x1x8_8x8x1_2x1_intrawave_v3,422.89,819.88,0.0
304,328,192,7168,torch.float8_e4m3fnuz,5,0,10.4266,a8w8_bpreshuffle_256x16x64x512_16x16_16x16_32x8x1_32x8x1_1x16x1x16_4x4x1_1x1_intrawave_v1,86.59,369.57,0.0
304,328,1536,7168,torch.float8_e4m3fnuz,12,0,19.665,a8w8_bpreshuffle_256x32x64x512_16x16_16x16_32x8x1_32x8x1_1x32x1x8_8x8x1_1x2_intrawave_v1,367.28,730.68,0.0
304,328,3072,1536,torch.float8_e4m3fnuz,119,0,9.4479,a8w8_bpreshuffle_256x32x128x256_16x16_16x16_16x16x1_16x16x1_1x16x1x16_8x8x1_1x2_intrawave_v1,327.63,766.06,0.0
304,328,576,7168,torch.float8_e4m3fnuz,11,0,11.8664,a8w8_bpreshuffle_256x16x64x512_16x16_16x16_32x8x1_32x8x1_1x16x1x16_4x4x1_1x1_intrawave_v1,228.25,577.91,0.0
304,328,7168,256,torch.float8_e4m3fnuz,73,0,8.4096,a8w8_bpreshuffle_256x32x256x64_16x16_16x16_4x32x1_4x64x1_1x32x1x8_8x8x1_2x1_intrawave_v1,143.14,787.34,0.0
304,328,7168,2048,torch.float8_e4m3fnuz,123,0,20.4613,a8w8_bpreshuffle_256x96x128x256_16x16_16x16_16x16x1_16x16x1_1x16x1x16_8x8x1_1x2_intrawave_v3,470.65,980.09,0.0
304,328,4608,7168,torch.float8_e4m3fnuz,120,0,36.0279,a8w8_bpreshuffle_256x48x128x256_16x16_16x16_16x16x1_16x16x1_1x16x1x16_8x8x1_1x2_intrawave_v1,601.42,1065.95,0.0
304,328,7168,2304,torch.float8_e4m3fnuz,120,0,21.5866,a8w8_bpreshuffle_256x48x128x256_16x16_16x16_16x16x1_16x16x1_1x16x1x16_8x8x1_1x2_intrawave_v1,501.88,1017.9,0.0
304,328,512,7168,torch.float8_e4m3fnuz,5,0,11.4709,a8w8_bpreshuffle_256x16x64x512_16x16_16x16_32x8x1_32x8x1_1x16x1x16_4x4x1_1x1_intrawave_v1,209.88,554.18,0.0
304,328,4096,512,torch.float8_e4m3fnuz,76,0,6.5911,a8w8_bpreshuffle_256x32x64x128_16x16_16x16_8x32x1_8x32x1_1x32x1x8_8x8x1_2x1_intrawave_v1,208.73,751.33,0.0
304,328,2112,7168,torch.float8_e4m3fnuz,113,0,23.5525,a8w8_bpreshuffle_256x48x64x256_16x16_16x16_16x16x1_16x16x1_1x16x1x16_4x4x1_1x1_intrawave_v1,421.66,801.42,0.0
304,336,192,7168,torch.float8_e4m3fnuz,10,0,9.4882,a8w8_bpreshuffle_128x16x32x512_16x16_16x16_32x4x1_32x4x1_1x16x1x8_4x4x1_1x1_intrawave_v1,97.47,412.48,0.0
304,336,1536,7168,torch.float8_e4m3fnuz,113,0,19.3676,a8w8_bpreshuffle_256x48x64x256_16x16_16x16_16x16x1_16x16x1_1x16x1x16_4x4x1_1x1_intrawave_v1,382.02,746.13,0.0
304,336,3072,1536,torch.float8_e4m3fnuz,119,0,9.5256,a8w8_bpreshuffle_256x32x128x256_16x16_16x16_16x16x1_16x16x1_1x16x1x16_8x8x1_1x2_intrawave_v1,332.88,766.26,0.0
304,336,576,7168,torch.float8_e4m3fnuz,5,0,11.5147,a8w8_bpreshuffle_256x16x64x512_16x16_16x16_32x8x1_32x8x1_1x16x1x16_4x4x1_1x1_intrawave_v1,240.96,601.34,0.0
304,336,7168,256,torch.float8_e4m3fnuz,75,0,8.2801,a8w8_bpreshuffle_128x16x256x64_16x16_16x16_4x16x1_4x32x1_1x16x1x8_8x8x1_1x2_intrawave_v1,148.93,813.75,0.0
304,336,7168,2048,torch.float8_e4m3fnuz,120,0,20.3799,a8w8_bpreshuffle_256x48x128x256_16x16_16x16_16x16x1_16x16x1_1x16x1x16_8x8x1_1x2_intrawave_v1,484.06,990.44,0.0
304,336,4608,7168,torch.float8_e4m3fnuz,120,0,35.8998,a8w8_bpreshuffle_256x48x128x256_16x16_16x16_16x16x1_16x16x1_1x16x1x16_8x8x1_1x2_intrawave_v1,618.28,1073.41,0.0
304,336,7168,2304,torch.float8_e4m3fnuz,120,0,21.3817,a8w8_bpreshuffle_256x48x128x256_16x16_16x16_16x16x1_16x16x1_1x16x1x16_8x8x1_1x2_intrawave_v1,519.05,1033.88,0.0
304,336,512,7168,torch.float8_e4m3fnuz,5,0,11.3916,a8w8_bpreshuffle_256x16x64x512_16x16_16x16_32x8x1_32x8x1_1x16x1x16_4x4x1_1x1_intrawave_v1,216.5,563.8,0.0
304,336,4096,512,torch.float8_e4m3fnuz,84,0,6.7155,a8w8_bpreshuffle_256x32x128x128_16x16_16x16_8x32x1_8x32x1_1x32x1x8_8x8x1_2x1_intrawave_v1,209.86,747.78,0.0
304,336,2112,7168,torch.float8_e4m3fnuz,113,0,22.2776,a8w8_bpreshuffle_256x48x64x256_16x16_16x16_16x16x1_16x16x1_1x16x1x16_4x4x1_1x1_intrawave_v1,456.66,851.37,0.0
304,344,192,7168,torch.float8_e4m3fnuz,11,0,10.3857,a8w8_bpreshuffle_256x16x64x512_16x16_16x16_32x8x1_32x8x1_1x16x1x16_4x4x1_1x1_intrawave_v1,91.17,382.66,0.0
304,344,1536,7168,torch.float8_e4m3fnuz,12,0,19.5511,a8w8_bpreshuffle_256x32x64x512_16x16_16x16_32x8x1_32x8x1_1x32x1x8_8x8x1_1x2_intrawave_v1,387.44,743.31,0.0
304,344,3072,1536,torch.float8_e4m3fnuz,119,0,9.5413,a8w8_bpreshuffle_256x32x128x256_16x16_16x16_16x16x1_16x16x1_1x16x1x16_8x8x1_1x2_intrawave_v1,340.25,771.44,0.0
304,344,576,7168,torch.float8_e4m3fnuz,11,0,12.2132,a8w8_bpreshuffle_256x16x64x512_16x16_16x16_32x8x1_32x8x1_1x16x1x16_4x4x1_1x1_intrawave_v1,232.58,572.4,0.0
304,344,7168,256,torch.float8_e4m3fnuz,73,0,8.4,a8w8_bpreshuffle_256x32x256x64_16x16_16x16_4x32x1_4x64x1_1x32x1x8_8x8x1_2x1_intrawave_v1,150.3,816.03,0.0
304,344,7168,2048,torch.float8_e4m3fnuz,123,0,20.6321,a8w8_bpreshuffle_256x96x128x256_16x16_16x16_16x16x1_16x16x1_1x16x1x16_8x8x1_1x2_intrawave_v3,489.52,984.69,0.0
304,344,4608,7168,torch.float8_e4m3fnuz,120,0,37.922,a8w8_bpreshuffle_256x48x128x256_16x16_16x16_16x16x1_16x16x1_1x16x1x16_8x8x1_1x2_intrawave_v1,599.25,1019.63,0.0
304,344,7168,2304,torch.float8_e4m3fnuz,123,0,21.946,a8w8_bpreshuffle_256x96x128x256_16x16_16x16_16x16x1_16x16x1_1x16x1x16_8x8x1_1x2_intrawave_v3,517.74,1013.36,0.0
304,344,512,7168,torch.float8_e4m3fnuz,11,0,11.6459,a8w8_bpreshuffle_256x16x64x512_16x16_16x16_32x8x1_32x8x1_1x16x1x16_4x4x1_1x1_intrawave_v1,216.81,557.11,0.0
304,344,4096,512,torch.float8_e4m3fnuz,76,0,6.7502,a8w8_bpreshuffle_256x32x64x128_16x16_16x16_8x32x1_8x32x1_1x32x1x8_8x8x1_2x1_intrawave_v1,213.75,754.25,0.0
304,344,2112,7168,torch.float8_e4m3fnuz,113,0,24.3833,a8w8_bpreshuffle_256x48x64x256_16x16_16x16_16x16x1_16x16x1_1x16x1x16_4x4x1_1x1_intrawave_v1,427.16,781.59,0.0
304,352,192,7168,torch.float8_e4m3fnuz,24,0,9.2672,a8w8_bpreshuffle_128x16x32x512_16x16_16x16_32x4x1_32x4x1_1x16x1x8_4x4x1_1x1_intrawave_v2,104.55,435.36,0.0
304,352,1536,7168,torch.float8_e4m3fnuz,12,0,19.3488,a8w8_bpreshuffle_256x32x64x512_16x16_16x16_32x8x1_32x8x1_1x32x1x8_8x8x1_1x2_intrawave_v1,400.6,755.32,0.0
304,352,3072,1536,torch.float8_e4m3fnuz,119,0,9.4567,a8w8_bpreshuffle_256x32x128x256_16x16_16x16_16x16x1_16x16x1_1x16x1x16_8x8x1_1x2_intrawave_v1,351.27,784.84,0.0
304,352,576,7168,torch.float8_e4m3fnuz,11,0,11.8861,a8w8_bpreshuffle_256x16x64x512_16x16_16x16_32x8x1_32x8x1_1x16x1x16_4x4x1_1x1_intrawave_v1,244.54,593.75,0.0
304,352,7168,256,torch.float8_e4m3fnuz,73,0,8.2901,a8w8_bpreshuffle_256x32x256x64_16x16_16x16_4x32x1_4x64x1_1x32x1x8_8x8x1_2x1_intrawave_v1,155.83,840.93,0.0
304,352,7168,2048,torch.float8_e4m3fnuz,123,0,20.7271,a8w8_bpreshuffle_256x96x128x256_16x16_16x16_16x16x1_16x16x1_1x16x1x16_8x8x1_1x2_intrawave_v3,498.61,986.5,0.0
304,352,4608,7168,torch.float8_e4m3fnuz,120,0,38.5668,a8w8_bpreshuffle_256x48x128x256_16x16_16x16_16x16x1_16x16x1_1x16x1x16_8x8x1_1x2_intrawave_v1,602.93,1005.98,0.0
304,352,7168,2304,torch.float8_e4m3fnuz,123,0,22.1296,a8w8_bpreshuffle_256x96x128x256_16x16_16x16_16x16x1_16x16x1_1x16x1x16_8x8x1_1x2_intrawave_v3,525.39,1010.97,0.0
304,352,512,7168,torch.float8_e4m3fnuz,5,0,11.412,a8w8_bpreshuffle_256x16x64x512_16x16_16x16_32x8x1_32x8x1_1x16x1x16_4x4x1_1x1_intrawave_v1,226.4,574.27,0.0
304,352,4096,512,torch.float8_e4m3fnuz,84,0,6.6897,a8w8_bpreshuffle_256x32x128x128_16x16_16x16_8x32x1_8x32x1_1x32x1x8_8x8x1_2x1_intrawave_v1,220.7,771.48,0.0
304,352,2112,7168,torch.float8_e4m3fnuz,113,0,24.0218,a8w8_bpreshuffle_256x48x64x256_16x16_16x16_16x16x1_16x16x1_1x16x1x16_4x4x1_1x1_intrawave_v1,443.67,797.14,0.0
304,360,192,7168,torch.float8_e4m3fnuz,19,0,10.8006,a8w8_bpreshuffle_256x16x64x512_16x16_16x16_32x8x1_32x8x1_1x16x1x16_4x4x1_1x1_intrawave_v2,91.75,379.14,0.0
304,360,1536,7168,torch.float8_e4m3fnuz,12,0,20.0031,a8w8_bpreshuffle_256x32x64x512_16x16_16x16_32x8x1_32x8x1_1x32x1x8_8x8x1_1x2_intrawave_v1,396.3,734.71,0.0
304,360,3072,1536,torch.float8_e4m3fnuz,119,0,9.5985,a8w8_bpreshuffle_256x32x128x256_16x16_16x16_16x16x1_16x16x1_1x16x1x16_8x8x1_1x2_intrawave_v1,353.95,779.64,0.0
304,360,576,7168,torch.float8_e4m3fnuz,25,0,12.3647,a8w8_bpreshuffle_256x16x64x512_16x16_16x16_32x8x1_32x8x1_1x16x1x16_4x4x1_1x1_intrawave_v2,240.42,576.15,0.0
304,360,7168,256,torch.float8_e4m3fnuz,73,0,8.8855,a8w8_bpreshuffle_256x32x256x64_16x16_16x16_4x32x1_4x64x1_1x32x1x8_8x8x1_2x1_intrawave_v1,148.69,797.72,0.0
304,360,7168,2048,torch.float8_e4m3fnuz,123,0,20.7411,a8w8_bpreshuffle_256x96x128x256_16x16_16x16_16x16x1_16x16x1_1x16x1x16_8x8x1_1x2_intrawave_v3,509.6,992.15,0.0
304,360,4608,7168,torch.float8_e4m3fnuz,120,0,39.083,a8w8_bpreshuffle_256x48x128x256_16x16_16x16_16x16x1_16x16x1_1x16x1x16_8x8x1_1x2_intrawave_v1,608.49,996.04,0.0
304,360,7168,2304,torch.float8_e4m3fnuz,123,0,22.3532,a8w8_bpreshuffle_256x96x128x256_16x16_16x16_16x16x1_16x16x1_1x16x1x16_8x8x1_1x2_intrawave_v3,531.95,1006.81,0.0
304,360,512,7168,torch.float8_e4m3fnuz,11,0,11.7342,a8w8_bpreshuffle_256x16x64x512_16x16_16x16_32x8x1_32x8x1_1x16x1x16_4x4x1_1x1_intrawave_v1,225.19,564.09,0.0
304,360,4096,512,torch.float8_e4m3fnuz,84,0,6.9576,a8w8_bpreshuffle_256x32x128x128_16x16_16x16_8x32x1_8x32x1_1x32x1x8_8x8x1_2x1_intrawave_v1,217.02,751.78,0.0
304,360,2112,7168,torch.float8_e4m3fnuz,113,0,24.3104,a8w8_bpreshuffle_256x48x64x256_16x16_16x16_16x16x1_16x16x1_1x16x1x16_4x4x1_1x1_intrawave_v1,448.37,791.43,0.0
304,368,192,7168,torch.float8_e4m3fnuz,10,0,9.1779,a8w8_bpreshuffle_128x16x32x512_16x16_16x16_32x4x1_32x4x1_1x16x1x8_4x4x1_1x1_intrawave_v1,110.37,452.76,0.0
304,368,1536,7168,torch.float8_e4m3fnuz,12,0,20.3755,a8w8_bpreshuffle_256x32x64x512_16x16_16x16_32x8x1_32x8x1_1x32x1x8_8x8x1_1x2_intrawave_v1,397.7,725.3,0.0
304,368,3072,1536,torch.float8_e4m3fnuz,119,0,9.5915,a8w8_bpreshuffle_256x32x128x256_16x16_16x16_16x16x1_16x16x1_1x16x1x16_8x8x1_1x2_intrawave_v1,362.08,786.62,0.0
304,368,576,7168,torch.float8_e4m3fnuz,11,0,12.0671,a8w8_bpreshuffle_256x16x64x512_16x16_16x16_32x8x1_32x8x1_1x16x1x16_4x4x1_1x1_intrawave_v1,251.82,595.88,0.0
304,368,7168,256,torch.float8_e4m3fnuz,73,0,8.5677,a8w8_bpreshuffle_256x32x256x64_16x16_16x16_4x32x1_4x64x1_1x32x1x8_8x8x1_2x1_intrawave_v1,157.63,840.93,0.0
304,368,7168,2048,torch.float8_e4m3fnuz,123,0,20.6662,a8w8_bpreshuffle_256x96x128x256_16x16_16x16_16x16x1_16x16x1_1x16x1x16_8x8x1_1x2_intrawave_v3,522.81,1002.09,0.0
304,368,4608,7168,torch.float8_e4m3fnuz,120,0,38.4035,a8w8_bpreshuffle_256x48x128x256_16x16_16x16_16x16x1_16x16x1_1x16x1x16_8x8x1_1x2_intrawave_v1,633.02,1017.08,0.0
304,368,7168,2304,torch.float8_e4m3fnuz,123,0,22.3703,a8w8_bpreshuffle_256x96x128x256_16x16_16x16_16x16x1_16x16x1_1x16x1x16_8x8x1_1x2_intrawave_v3,543.36,1011.99,0.0
304,368,512,7168,torch.float8_e4m3fnuz,5,0,11.3127,a8w8_bpreshuffle_256x16x64x512_16x16_16x16_32x8x1_32x8x1_1x16x1x16_4x4x1_1x1_intrawave_v1,238.77,590.9,0.0
304,368,4096,512,torch.float8_e4m3fnuz,84,0,6.9954,a8w8_bpreshuffle_256x32x128x128_16x16_16x16_8x32x1_8x32x1_1x32x1x8_8x8x1_2x1_intrawave_v1,220.65,757.67,0.0
304,368,2112,7168,torch.float8_e4m3fnuz,113,0,24.3847,a8w8_bpreshuffle_256x48x64x256_16x16_16x16_16x16x1_16x16x1_1x16x1x16_4x4x1_1x1_intrawave_v1,456.93,792.75,0.0
304,376,192,7168,torch.float8_e4m3fnuz,11,0,10.6241,a8w8_bpreshuffle_256x16x64x512_16x16_16x16_32x8x1_32x8x1_1x16x1x16_4x4x1_1x1_intrawave_v1,97.41,396.82,0.0
304,376,1536,7168,torch.float8_e4m3fnuz,12,0,20.4606,a8w8_bpreshuffle_256x32x64x512_16x16_16x16_32x8x1_32x8x1_1x32x1x8_8x8x1_1x2_intrawave_v1,404.66,726.29,0.0
304,376,3072,1536,torch.float8_e4m3fnuz,119,0,9.5923,a8w8_bpreshuffle_256x32x128x256_16x16_16x16_16x16x1_16x16x1_1x16x1x16_8x8x1_1x2_intrawave_v1,369.92,792.96,0.0
304,376,576,7168,torch.float8_e4m3fnuz,11,0,12.3564,a8w8_bpreshuffle_256x16x64x512_16x16_16x16_32x8x1_32x8x1_1x16x1x16_4x4x1_1x1_intrawave_v1,251.27,587.31,0.0
304,376,7168,256,torch.float8_e4m3fnuz,73,0,8.9444,a8w8_bpreshuffle_256x32x256x64_16x16_16x16_4x32x1_4x64x1_1x32x1x8_8x8x1_2x1_intrawave_v1,154.28,818.57,0.0
304,376,7168,2048,torch.float8_e4m3fnuz,123,0,20.8665,a8w8_bpreshuffle_256x96x128x256_16x16_16x16_16x16x1_16x16x1_1x16x1x16_8x8x1_1x2_intrawave_v3,529.05,998.75,0.0
304,376,4608,7168,torch.float8_e4m3fnuz,120,0,38.9359,a8w8_bpreshuffle_256x48x128x256_16x16_16x16_16x16x1_16x16x1_1x16x1x16_8x8x1_1x2_intrawave_v1,637.94,1006.54,0.0
304,376,7168,2304,torch.float8_e4m3fnuz,123,0,22.5013,a8w8_bpreshuffle_256x96x128x256_16x16_16x16_16x16x1_16x16x1_1x16x1x16_8x8x1_1x2_intrawave_v3,551.94,1012.02,0.0
304,376,512,7168,torch.float8_e4m3fnuz,11,0,12.1371,a8w8_bpreshuffle_256x16x64x512_16x16_16x16_32x8x1_32x8x1_1x16x1x16_4x4x1_1x1_intrawave_v1,227.39,556.16,0.0
304,376,4096,512,torch.float8_e4m3fnuz,84,0,7.0656,a8w8_bpreshuffle_256x32x128x128_16x16_16x16_8x32x1_8x32x1_1x32x1x8_8x8x1_2x1_intrawave_v1,223.2,760.0,0.0
304,376,2112,7168,torch.float8_e4m3fnuz,113,0,24.5508,a8w8_bpreshuffle_256x48x64x256_16x16_16x16_16x16x1_16x16x1_1x16x1x16_4x4x1_1x1_intrawave_v1,463.71,791.1,0.0
304,384,192,7168,torch.float8_e4m3fnuz,24,0,9.2831,a8w8_bpreshuffle_128x16x32x512_16x16_16x16_32x4x1_32x4x1_1x16x1x8_4x4x1_1x1_intrawave_v2,113.86,460.65,0.0
304,384,1536,7168,torch.float8_e4m3fnuz,112,0,19.952,a8w8_bpreshuffle_256x32x64x256_16x16_16x16_16x16x1_16x16x1_1x32x1x8_8x8x1_2x1_intrawave_v1,423.8,748.91,0.0
304,384,3072,1536,torch.float8_e4m3fnuz,119,0,9.8517,a8w8_bpreshuffle_256x32x128x256_16x16_16x16_16x16x1_16x16x1_1x16x1x16_8x8x1_1x2_intrawave_v1,367.84,778.31,0.0
304,384,576,7168,torch.float8_e4m3fnuz,5,0,12.5737,a8w8_bpreshuffle_256x16x64x512_16x16_16x16_32x8x1_32x8x1_1x16x1x16_4x4x1_1x1_intrawave_v1,252.18,582.46,0.0
304,384,7168,256,torch.float8_e4m3fnuz,73,0,8.9135,a8w8_bpreshuffle_256x32x256x64_16x16_16x16_4x32x1_4x64x1_1x32x1x8_8x8x1_2x1_intrawave_v1,158.11,834.5,0.0
304,384,7168,2048,torch.float8_e4m3fnuz,123,0,20.9394,a8w8_bpreshuffle_256x96x128x256_16x16_16x16_16x16x1_16x16x1_1x16x1x16_8x8x1_1x2_intrawave_v3,538.42,1001.53,0.0
304,384,4608,7168,torch.float8_e4m3fnuz,120,0,37.134,a8w8_bpreshuffle_256x48x128x256_16x16_16x16_16x16x1_16x16x1_1x16x1x16_8x8x1_1x2_intrawave_v1,683.12,1058.91,0.0
304,384,7168,2304,torch.float8_e4m3fnuz,123,0,22.2285,a8w8_bpreshuffle_256x96x128x256_16x16_16x16_16x16x1_16x16x1_1x16x1x16_8x8x1_1x2_intrawave_v3,570.6,1030.43,0.0
304,384,512,7168,torch.float8_e4m3fnuz,5,0,11.2019,a8w8_bpreshuffle_256x16x64x512_16x16_16x16_32x8x1_32x8x1_1x16x1x16_4x4x1_1x1_intrawave_v1,251.62,608.45,0.0
304,384,4096,512,torch.float8_e4m3fnuz,84,0,7.0859,a8w8_bpreshuffle_256x32x128x128_16x16_16x16_8x32x1_8x32x1_1x32x1x8_8x8x1_2x1_intrawave_v1,227.3,767.65,0.0
304,384,2112,7168,torch.float8_e4m3fnuz,113,0,23.8919,a8w8_bpreshuffle_256x48x64x256_16x16_16x16_16x16x1_16x16x1_1x16x1x16_4x4x1_1x1_intrawave_v1,486.63,816.73,0.0
304,392,192,7168,torch.float8_e4m3fnuz,10,0,10.7375,a8w8_bpreshuffle_128x16x32x512_16x16_16x16_32x4x1_32x4x1_1x16x1x8_4x4x1_1x1_intrawave_v1,100.49,403.88,0.0
304,392,1536,7168,torch.float8_e4m3fnuz,119,0,22.4983,a8w8_bpreshuffle_256x32x128x256_16x16_16x16_16x16x1_16x16x1_1x16x1x16_8x8x1_1x2_intrawave_v1,383.67,667.79,0.0
304,392,3072,1536,torch.float8_e4m3fnuz,120,0,10.9954,a8w8_bpreshuffle_256x48x128x256_16x16_16x16_16x16x1_16x16x1_1x16x1x16_8x8x1_1x2_intrawave_v1,336.45,702.94,0.0
304,392,576,7168,torch.float8_e4m3fnuz,5,0,12.6907,a8w8_bpreshuffle_256x16x64x512_16x16_16x16_32x8x1_32x8x1_1x16x1x16_4x4x1_1x1_intrawave_v1,255.07,582.33,0.0
304,392,7168,256,torch.float8_e4m3fnuz,73,0,9.1755,a8w8_bpreshuffle_256x32x256x64_16x16_16x16_4x32x1_4x64x1_1x32x1x8_8x8x1_2x1_intrawave_v1,156.79,823.4,0.0
304,392,7168,2048,torch.float8_e4m3fnuz,122,0,22.2095,a8w8_bpreshuffle_256x80x128x256_16x16_16x16_16x16x1_16x16x1_1x16x1x16_8x8x1_1x2_intrawave_v3,518.21,950.16,0.0
304,392,4608,7168,torch.float8_e4m3fnuz,121,0,43.6475,a8w8_bpreshuffle_256x64x128x256_16x16_16x16_16x16x1_16x16x1_1x16x1x16_8x8x1_1x2_intrawave_v3,593.29,903.89,0.0
304,392,7168,2304,torch.float8_e4m3fnuz,122,0,24.4431,a8w8_bpreshuffle_256x80x128x256_16x16_16x16_16x16x1_16x16x1_1x16x1x16_8x8x1_1x2_intrawave_v3,529.71,942.51,0.0
304,392,512,7168,torch.float8_e4m3fnuz,11,0,12.1375,a8w8_bpreshuffle_256x16x64x512_16x16_16x16_32x8x1_32x8x1_1x16x1x16_4x4x1_1x1_intrawave_v1,237.06,566.94,0.0
304,392,4096,512,torch.float8_e4m3fnuz,84,0,7.4497,a8w8_bpreshuffle_256x32x128x128_16x16_16x16_8x32x1_8x32x1_1x32x1x8_8x8x1_2x1_intrawave_v1,220.7,739.51,0.0
304,392,2112,7168,torch.float8_e4m3fnuz,114,0,26.4542,a8w8_bpreshuffle_256x64x64x256_16x16_16x16_16x16x1_16x16x1_1x32x1x8_8x8x1_2x1_intrawave_v3,448.66,741.07,0.0
304,400,192,7168,torch.float8_e4m3fnuz,24,0,9.181,a8w8_bpreshuffle_128x16x32x512_16x16_16x16_32x4x1_32x4x1_1x16x1x8_4x4x1_1x1_intrawave_v2,119.92,478.93,0.0
304,400,1536,7168,torch.float8_e4m3fnuz,119,0,22.4523,a8w8_bpreshuffle_256x32x128x256_16x16_16x16_16x16x1_16x16x1_1x16x1x16_8x8x1_1x2_intrawave_v1,392.3,672.81,0.0
304,400,3072,1536,torch.float8_e4m3fnuz,120,0,10.9421,a8w8_bpreshuffle_256x48x128x256_16x16_16x16_16x16x1_16x16x1_1x16x1x16_8x8x1_1x2_intrawave_v1,344.99,711.98,0.0
304,400,576,7168,torch.float8_e4m3fnuz,11,0,12.3693,a8w8_bpreshuffle_256x16x64x512_16x16_16x16_32x8x1_32x8x1_1x16x1x16_4x4x1_1x1_intrawave_v1,267.03,602.84,0.0
304,400,7168,256,torch.float8_e4m3fnuz,73,0,8.7921,a8w8_bpreshuffle_256x32x256x64_16x16_16x16_4x32x1_4x64x1_1x32x1x8_8x8x1_2x1_intrawave_v1,166.97,872.58,0.0
304,400,7168,2048,torch.float8_e4m3fnuz,122,0,22.0584,a8w8_bpreshuffle_256x80x128x256_16x16_16x16_16x16x1_16x16x1_1x16x1x16_8x8x1_1x2_intrawave_v3,532.41,962.61,0.0
304,400,4608,7168,torch.float8_e4m3fnuz,85,0,45.1794,a8w8_bpreshuffle_256x64x128x128_16x16_16x16_8x32x1_8x32x1_1x32x1x8_8x8x1_2x1_intrawave_v3,584.87,876.15,0.0
304,400,7168,2304,torch.float8_e4m3fnuz,122,0,24.0415,a8w8_bpreshuffle_256x80x128x256_16x16_16x16_16x16x1_16x16x1_1x16x1x16_8x8x1_1x2_intrawave_v3,549.55,963.79,0.0
304,400,512,7168,torch.float8_e4m3fnuz,5,0,11.8138,a8w8_bpreshuffle_256x16x64x512_16x16_16x16_32x8x1_32x8x1_1x16x1x16_4x4x1_1x1_intrawave_v1,248.52,588.03,0.0
304,400,4096,512,torch.float8_e4m3fnuz,84,0,7.4251,a8w8_bpreshuffle_256x32x128x128_16x16_16x16_8x32x1_8x32x1_1x32x1x8_8x8x1_2x1_intrawave_v1,225.95,751.34,0.0
304,400,2112,7168,torch.float8_e4m3fnuz,114,0,26.2716,a8w8_bpreshuffle_256x64x64x256_16x16_16x16_16x16x1_16x16x1_1x32x1x8_8x8x1_2x1_intrawave_v3,460.99,749.69,0.0
304,408,192,7168,torch.float8_e4m3fnuz,11,0,10.4777,a8w8_bpreshuffle_256x16x64x512_16x16_16x16_32x8x1_32x8x1_1x16x1x16_4x4x1_1x1_intrawave_v1,107.18,425.42,0.0
304,408,1536,7168,torch.float8_e4m3fnuz,119,0,22.8665,a8w8_bpreshuffle_256x32x128x256_16x16_16x16_16x16x1_16x16x1_1x16x1x16_8x8x1_1x2_intrawave_v1,392.9,664.2,0.0
304,408,3072,1536,torch.float8_e4m3fnuz,120,0,10.9855,a8w8_bpreshuffle_256x48x128x256_16x16_16x16_16x16x1_16x16x1_1x16x1x16_8x8x1_1x2_intrawave_v1,350.5,714.76,0.0
304,408,576,7168,torch.float8_e4m3fnuz,11,0,12.9951,a8w8_bpreshuffle_256x16x64x512_16x16_16x16_32x8x1_32x8x1_1x16x1x16_4x4x1_1x1_intrawave_v1,259.26,578.94,0.0
304,408,7168,256,torch.float8_e4m3fnuz,73,0,9.2119,a8w8_bpreshuffle_256x32x256x64_16x16_16x16_4x32x1_4x64x1_1x32x1x8_8x8x1_2x1_intrawave_v1,162.55,845.49,0.0
304,408,7168,2048,torch.float8_e4m3fnuz,124,0,23.1374,a8w8_bpreshuffle_256x112x128x256_16x16_16x16_16x16x1_16x16x1_1x16x1x16_8x8x1_1x2_intrawave_v3,517.73,923.39,0.0
304,408,4608,7168,torch.float8_e4m3fnuz,85,0,44.9156,a8w8_bpreshuffle_256x64x128x128_16x16_16x16_8x32x1_8x32x1_1x32x1x8_8x8x1_2x1_intrawave_v3,600.07,884.21,0.0
304,408,7168,2304,torch.float8_e4m3fnuz,124,0,25.1985,a8w8_bpreshuffle_256x112x128x256_16x16_16x16_16x16x1_16x16x1_1x16x1x16_8x8x1_1x2_intrawave_v3,534.81,924.82,0.0
304,408,512,7168,torch.float8_e4m3fnuz,5,0,12.3742,a8w8_bpreshuffle_256x16x64x512_16x16_16x16_32x8x1_32x8x1_1x16x1x16_4x4x1_1x1_intrawave_v1,242.01,566.69,0.0
304,408,4096,512,torch.float8_e4m3fnuz,76,0,7.6473,a8w8_bpreshuffle_256x32x64x128_16x16_16x16_8x32x1_8x32x1_1x32x1x8_8x8x1_2x1_intrawave_v1,223.78,738.61,0.0
304,408,2112,7168,torch.float8_e4m3fnuz,114,0,26.2902,a8w8_bpreshuffle_256x64x64x256_16x16_16x16_16x16x1_16x16x1_1x32x1x8_8x8x1_2x1_intrawave_v3,469.88,752.63,0.0
304,416,192,7168,torch.float8_e4m3fnuz,24,0,9.5517,a8w8_bpreshuffle_128x16x32x512_16x16_16x16_32x4x1_32x4x1_1x16x1x8_4x4x1_1x1_intrawave_v2,119.88,472.99,0.0
304,416,1536,7168,torch.float8_e4m3fnuz,119,0,22.4694,a8w8_bpreshuffle_256x32x128x256_16x16_16x16_16x16x1_16x16x1_1x16x1x16_8x8x1_1x2_intrawave_v1,407.68,679.59,0.0
304,416,3072,1536,torch.float8_e4m3fnuz,120,0,11.0624,a8w8_bpreshuffle_256x48x128x256_16x16_16x16_16x16x1_16x16x1_1x16x1x16_8x8x1_1x2_intrawave_v1,354.88,715.35,0.0
304,416,576,7168,torch.float8_e4m3fnuz,5,0,12.4054,a8w8_bpreshuffle_256x16x64x512_16x16_16x16_32x8x1_32x8x1_1x16x1x16_4x4x1_1x1_intrawave_v1,276.91,611.82,0.0
304,416,7168,256,torch.float8_e4m3fnuz,73,0,8.7919,a8w8_bpreshuffle_256x32x256x64_16x16_16x16_4x32x1_4x64x1_1x32x1x8_8x8x1_2x1_intrawave_v1,173.65,899.15,0.0
304,416,7168,2048,torch.float8_e4m3fnuz,124,0,23.1415,a8w8_bpreshuffle_256x112x128x256_16x16_16x16_16x16x1_16x16x1_1x16x1x16_8x8x1_1x2_intrawave_v3,527.79,928.89,0.0
304,416,4608,7168,torch.float8_e4m3fnuz,121,0,45.2421,a8w8_bpreshuffle_256x64x128x256_16x16_16x16_16x16x1_16x16x1_1x16x1x16_8x8x1_1x2_intrawave_v3,607.42,880.73,0.0
304,416,7168,2304,torch.float8_e4m3fnuz,124,0,25.2218,a8w8_bpreshuffle_256x112x128x256_16x16_16x16_16x16x1_16x16x1_1x16x1x16_8x8x1_1x2_intrawave_v3,544.79,929.25,0.0
304,416,512,7168,torch.float8_e4m3fnuz,11,0,12.375,a8w8_bpreshuffle_256x16x64x512_16x16_16x16_32x8x1_32x8x1_1x16x1x16_4x4x1_1x1_intrawave_v1,246.74,571.95,0.0
304,416,4096,512,torch.float8_e4m3fnuz,76,0,7.6492,a8w8_bpreshuffle_256x32x64x128_16x16_16x16_8x32x1_8x32x1_1x32x1x8_8x8x1_2x1_intrawave_v1,228.11,747.53,0.0
304,416,2112,7168,torch.float8_e4m3fnuz,114,0,26.2012,a8w8_bpreshuffle_256x64x64x256_16x16_16x16_16x16x1_16x16x1_1x32x1x8_8x8x1_2x1_intrawave_v3,480.72,758.66,0.0
304,424,192,7168,torch.float8_e4m3fnuz,11,0,10.5615,a8w8_bpreshuffle_256x16x64x512_16x16_16x16_32x8x1_32x8x1_1x16x1x16_4x4x1_1x1_intrawave_v1,110.5,433.49,0.0
304,424,1536,7168,torch.float8_e4m3fnuz,114,0,23.4101,a8w8_bpreshuffle_256x64x64x256_16x16_16x16_16x16x1_16x16x1_1x32x1x8_8x8x1_2x1_intrawave_v3,398.82,655.78,0.0
304,424,3072,1536,torch.float8_e4m3fnuz,120,0,11.4877,a8w8_bpreshuffle_256x48x128x256_16x16_16x16_16x16x1_16x16x1_1x16x1x16_8x8x1_1x2_intrawave_v1,348.32,694.21,0.0
304,424,576,7168,torch.float8_e4m3fnuz,5,0,13.3986,a8w8_bpreshuffle_256x16x64x512_16x16_16x16_32x8x1_32x8x1_1x16x1x16_4x4x1_1x1_intrawave_v1,261.31,571.44,0.0
304,424,7168,256,torch.float8_e4m3fnuz,73,0,9.4535,a8w8_bpreshuffle_256x32x256x64_16x16_16x16_4x32x1_4x64x1_1x32x1x8_8x8x1_2x1_intrawave_v1,164.6,848.58,0.0
304,424,7168,2048,torch.float8_e4m3fnuz,124,0,23.3502,a8w8_bpreshuffle_256x112x128x256_16x16_16x16_16x16x1_16x16x1_1x16x1x16_8x8x1_1x2_intrawave_v3,533.13,926.2,0.0
304,424,4608,7168,torch.float8_e4m3fnuz,121,0,44.8999,a8w8_bpreshuffle_256x64x128x256_16x16_16x16_16x16x1_16x16x1_1x16x1x16_8x8x1_1x2_intrawave_v3,623.82,890.36,0.0
304,424,7168,2304,torch.float8_e4m3fnuz,124,0,25.4374,a8w8_bpreshuffle_256x112x128x256_16x16_16x16_16x16x1_16x16x1_1x16x1x16_8x8x1_1x2_intrawave_v3,550.56,926.61,0.0
304,424,512,7168,torch.float8_e4m3fnuz,11,0,12.7965,a8w8_bpreshuffle_256x16x64x512_16x16_16x16_32x8x1_32x8x1_1x16x1x16_4x4x1_1x1_intrawave_v1,243.21,558.23,0.0
304,424,4096,512,torch.float8_e4m3fnuz,76,0,7.7229,a8w8_bpreshuffle_256x32x64x128_16x16_16x16_8x32x1_8x32x1_1x32x1x8_8x8x1_2x1_intrawave_v1,230.27,749.41,0.0
304,424,2112,7168,torch.float8_e4m3fnuz,114,0,26.5765,a8w8_bpreshuffle_256x64x64x256_16x16_16x16_16x16x1_16x16x1_1x32x1x8_8x8x1_2x1_intrawave_v3,483.05,751.38,0.0
304,432,192,7168,torch.float8_e4m3fnuz,10,0,9.3934,a8w8_bpreshuffle_128x16x32x512_16x16_16x16_32x4x1_32x4x1_1x16x1x8_4x4x1_1x1_intrawave_v1,126.59,493.83,0.0
304,432,1536,7168,torch.float8_e4m3fnuz,113,0,22.7976,a8w8_bpreshuffle_256x48x64x256_16x16_16x16_16x16x1_16x16x1_1x16x1x16_4x4x1_1x1_intrawave_v1,417.27,676.99,0.0
304,432,3072,1536,torch.float8_e4m3fnuz,113,0,11.3572,a8w8_bpreshuffle_256x48x64x256_16x16_16x16_16x16x1_16x16x1_1x16x1x16_4x4x1_1x1_intrawave_v1,358.97,707.6,0.0
304,432,576,7168,torch.float8_e4m3fnuz,11,0,12.4023,a8w8_bpreshuffle_256x16x64x512_16x16_16x16_32x8x1_32x8x1_1x16x1x16_4x4x1_1x1_intrawave_v1,287.63,622.71,0.0
304,432,7168,256,torch.float8_e4m3fnuz,73,0,9.151,a8w8_bpreshuffle_256x32x256x64_16x16_16x16_4x32x1_4x64x1_1x32x1x8_8x8x1_2x1_intrawave_v1,173.25,889.38,0.0
304,432,7168,2048,torch.float8_e4m3fnuz,124,0,23.5576,a8w8_bpreshuffle_256x112x128x256_16x16_16x16_16x16x1_16x16x1_1x16x1x16_8x8x1_1x2_intrawave_v3,538.41,923.61,0.0
304,432,4608,7168,torch.float8_e4m3fnuz,121,0,45.6477,a8w8_bpreshuffle_256x64x128x256_16x16_16x16_16x16x1_16x16x1_1x16x1x16_8x8x1_1x2_intrawave_v3,625.18,878.64,0.0
304,432,7168,2304,torch.float8_e4m3fnuz,124,0,25.3921,a8w8_bpreshuffle_256x112x128x256_16x16_16x16_16x16x1_16x16x1_1x16x1x16_8x8x1_1x2_intrawave_v3,561.95,933.5,0.0
304,432,512,7168,torch.float8_e4m3fnuz,5,0,12.452,a8w8_bpreshuffle_256x16x64x512_16x16_16x16_32x8x1_32x8x1_1x16x1x16_4x4x1_1x1_intrawave_v1,254.65,578.94,0.0
304,432,4096,512,torch.float8_e4m3fnuz,84,0,7.7518,a8w8_bpreshuffle_256x32x128x128_16x16_16x16_8x32x1_8x32x1_1x32x1x8_8x8x1_2x1_intrawave_v1,233.74,755.6,0.0
304,432,2112,7168,torch.float8_e4m3fnuz,114,0,26.6246,a8w8_bpreshuffle_256x64x64x256_16x16_16x16_16x16x1_16x16x1_1x32x1x8_8x8x1_2x1_intrawave_v3,491.27,753.44,0.0
304,440,192,7168,torch.float8_e4m3fnuz,11,0,10.6032,a8w8_bpreshuffle_256x16x64x512_16x16_16x16_32x8x1_32x8x1_1x16x1x16_4x4x1_1x1_intrawave_v1,114.22,443.18,0.0
304,440,1536,7168,torch.float8_e4m3fnuz,119,0,23.5157,a8w8_bpreshuffle_256x32x128x256_16x16_16x16_16x16x1_16x16x1_1x16x1x16_8x8x1_1x2_intrawave_v1,412.02,659.8,0.0
304,440,3072,1536,torch.float8_e4m3fnuz,120,0,10.8756,a8w8_bpreshuffle_256x48x128x256_16x16_16x16_16x16x1_16x16x1_1x16x1x16_8x8x1_1x2_intrawave_v1,381.81,744.58,0.0
304,440,576,7168,torch.float8_e4m3fnuz,11,0,13.8305,a8w8_bpreshuffle_256x16x64x512_16x16_16x16_32x8x1_32x8x1_1x16x1x16_4x4x1_1x1_intrawave_v1,262.7,563.22,0.0
304,440,7168,256,torch.float8_e4m3fnuz,73,0,9.1217,a8w8_bpreshuffle_256x32x256x64_16x16_16x16_4x32x1_4x64x1_1x32x1x8_8x8x1_2x1_intrawave_v1,177.03,905.04,0.0
304,440,7168,2048,torch.float8_e4m3fnuz,124,0,24.0866,a8w8_bpreshuffle_256x112x128x256_16x16_16x16_16x16x1_16x16x1_1x16x1x16_8x8x1_1x2_intrawave_v3,536.33,908.76,0.0
304,440,4608,7168,torch.float8_e4m3fnuz,117,0,46.766,a8w8_bpreshuffle_256x112x64x256_16x16_16x16_16x16x1_16x16x1_1x16x1x16_4x4x1_1x1_intrawave_v3,621.53,860.44,0.0
304,440,7168,2304,torch.float8_e4m3fnuz,124,0,25.5854,a8w8_bpreshuffle_256x112x128x256_16x16_16x16_16x16x1_16x16x1_1x16x1x16_8x8x1_1x2_intrawave_v3,568.03,931.65,0.0
304,440,512,7168,torch.float8_e4m3fnuz,11,0,12.9154,a8w8_bpreshuffle_256x16x64x512_16x16_16x16_32x8x1_32x8x1_1x16x1x16_4x4x1_1x1_intrawave_v1,250.06,563.24,0.0
304,440,4096,512,torch.float8_e4m3fnuz,76,0,7.9517,a8w8_bpreshuffle_256x32x64x128_16x16_16x16_8x32x1_8x32x1_1x32x1x8_8x8x1_2x1_intrawave_v1,232.09,745.36,0.0
304,440,2112,7168,torch.float8_e4m3fnuz,114,0,26.7281,a8w8_bpreshuffle_256x64x64x256_16x16_16x16_16x16x1_16x16x1_1x32x1x8_8x8x1_2x1_intrawave_v3,498.43,753.94,0.0
304,448,192,7168,torch.float8_e4m3fnuz,8,0,9.633,a8w8_bpreshuffle_128x32x16x512_16x16_16x16_32x4x1_32x4x1_1x32x1x4_4x4x1_1x1_intrawave_v1,128.01,494.09,0.0
304,448,1536,7168,torch.float8_e4m3fnuz,114,0,22.7642,a8w8_bpreshuffle_256x64x64x256_16x16_16x16_16x16x1_16x16x1_1x32x1x8_8x8x1_2x1_intrawave_v3,433.36,685.18,0.0
304,448,3072,1536,torch.float8_e4m3fnuz,120,0,10.8543,a8w8_bpreshuffle_256x48x128x256_16x16_16x16_16x16x1_16x16x1_1x16x1x16_8x8x1_1x2_intrawave_v1,389.51,751.71,0.0
304,448,576,7168,torch.float8_e4m3fnuz,11,0,12.9133,a8w8_bpreshuffle_256x16x64x512_16x16_16x16_32x8x1_32x8x1_1x16x1x16_4x4x1_1x1_intrawave_v1,286.48,608.37,0.0
304,448,7168,256,torch.float8_e4m3fnuz,73,0,9.4662,a8w8_bpreshuffle_256x32x256x64_16x16_16x16_4x32x1_4x64x1_1x32x1x8_8x8x1_2x1_intrawave_v1,173.69,884.43,0.0
304,448,7168,2048,torch.float8_e4m3fnuz,124,0,23.3656,a8w8_bpreshuffle_256x112x128x256_16x16_16x16_16x16x1_16x16x1_1x16x1x16_8x8x1_1x2_intrawave_v3,562.94,942.42,0.0
304,448,4608,7168,torch.float8_e4m3fnuz,121,0,43.9189,a8w8_bpreshuffle_256x64x128x256_16x16_16x16_16x16x1_16x16x1_1x16x1x16_8x8x1_1x2_intrawave_v3,673.86,919.2,0.0
304,448,7168,2304,torch.float8_e4m3fnuz,124,0,25.0861,a8w8_bpreshuffle_256x112x128x256_16x16_16x16_16x16x1_16x16x1_1x16x1x16_8x8x1_1x2_intrawave_v3,589.87,955.5,0.0
304,448,512,7168,torch.float8_e4m3fnuz,5,0,12.3908,a8w8_bpreshuffle_256x16x64x512_16x16_16x16_32x8x1_32x8x1_1x16x1x16_4x4x1_1x1_intrawave_v1,265.39,592.38,0.0
304,448,4096,512,torch.float8_e4m3fnuz,76,0,7.747,a8w8_bpreshuffle_256x32x64x128_16x16_16x16_8x32x1_8x32x1_1x32x1x8_8x8x1_2x1_intrawave_v1,242.55,774.05,0.0
304,448,2112,7168,torch.float8_e4m3fnuz,114,0,26.0002,a8w8_bpreshuffle_256x64x64x256_16x16_16x16_16x16x1_16x16x1_1x32x1x8_8x8x1_2x1_intrawave_v3,521.7,778.55,0.0
304,456,192,7168,torch.float8_e4m3fnuz,25,0,10.862,a8w8_bpreshuffle_256x16x64x512_16x16_16x16_32x8x1_32x8x1_1x16x1x16_4x4x1_1x1_intrawave_v2,115.55,443.75,0.0
304,456,1536,7168,torch.float8_e4m3fnuz,113,0,23.7315,a8w8_bpreshuffle_256x48x64x256_16x16_16x16_16x16x1_16x16x1_1x16x1x16_4x4x1_1x1_intrawave_v1,423.12,660.7,0.0
304,456,3072,1536,torch.float8_e4m3fnuz,120,0,11.1183,a8w8_bpreshuffle_256x48x128x256_16x16_16x16_16x16x1_16x16x1_1x16x1x16_8x8x1_1x2_intrawave_v1,387.05,739.38,0.0
304,456,576,7168,torch.float8_e4m3fnuz,5,0,13.842,a8w8_bpreshuffle_256x16x64x512_16x16_16x16_32x8x1_32x8x1_1x16x1x16_4x4x1_1x1_intrawave_v1,272.03,572.37,0.0
304,456,7168,256,torch.float8_e4m3fnuz,73,0,9.4863,a8w8_bpreshuffle_256x32x256x64_16x16_16x16_4x32x1_4x64x1_1x32x1x8_8x8x1_2x1_intrawave_v1,176.42,894.87,0.0
304,456,7168,2048,torch.float8_e4m3fnuz,123,0,24.3828,a8w8_bpreshuffle_256x96x128x256_16x16_16x16_16x16x1_16x16x1_1x16x1x16_8x8x1_1x2_intrawave_v3,549.08,908.48,0.0
304,456,4608,7168,torch.float8_e4m3fnuz,121,0,47.7651,a8w8_bpreshuffle_256x64x128x256_16x16_16x16_16x16x1_16x16x1_1x16x1x16_8x8x1_1x2_intrawave_v3,630.66,847.93,0.0
304,456,7168,2304,torch.float8_e4m3fnuz,123,0,26.2774,a8w8_bpreshuffle_256x96x128x256_16x16_16x16_16x16x1_16x16x1_1x16x1x16_8x8x1_1x2_intrawave_v3,573.18,917.25,0.0
304,456,512,7168,torch.float8_e4m3fnuz,5,0,13.1648,a8w8_bpreshuffle_256x16x64x512_16x16_16x16_32x8x1_32x8x1_1x16x1x16_4x4x1_1x1_intrawave_v1,254.24,562.53,0.0
304,456,4096,512,torch.float8_e4m3fnuz,84,0,8.2096,a8w8_bpreshuffle_256x32x128x128_16x16_16x16_8x32x1_8x32x1_1x32x1x8_8x8x1_2x1_intrawave_v1,232.97,738.91,0.0
304,456,2112,7168,torch.float8_e4m3fnuz,114,0,28.0376,a8w8_bpreshuffle_256x64x64x256_16x16_16x16_16x16x1_16x16x1_1x32x1x8_8x8x1_2x1_intrawave_v3,492.43,725.22,0.0
304,464,192,7168,torch.float8_e4m3fnuz,10,0,9.3706,a8w8_bpreshuffle_128x16x32x512_16x16_16x16_32x4x1_32x4x1_1x16x1x8_4x4x1_1x1_intrawave_v1,136.29,520.82,0.0
304,464,1536,7168,torch.float8_e4m3fnuz,113,0,23.7935,a8w8_bpreshuffle_256x48x64x256_16x16_16x16_16x16x1_16x16x1_1x16x1x16_4x4x1_1x1_intrawave_v1,429.42,662.42,0.0
304,464,3072,1536,torch.float8_e4m3fnuz,120,0,11.0523,a8w8_bpreshuffle_256x48x128x256_16x16_16x16_16x16x1_16x16x1_1x16x1x16_8x8x1_1x2_intrawave_v1,396.19,749.36,0.0
304,464,576,7168,torch.float8_e4m3fnuz,5,0,13.0589,a8w8_bpreshuffle_256x16x64x512_16x16_16x16_32x8x1_32x8x1_1x16x1x16_4x4x1_1x1_intrawave_v1,293.4,611.79,0.0
304,464,7168,256,torch.float8_e4m3fnuz,73,0,9.5344,a8w8_bpreshuffle_256x32x256x64_16x16_16x16_4x32x1_4x64x1_1x32x1x8_8x8x1_2x1_intrawave_v1,178.6,902.59,0.0
304,464,7168,2048,torch.float8_e4m3fnuz,123,0,24.5058,a8w8_bpreshuffle_256x96x128x256_16x16_16x16_16x16x1_16x16x1_1x16x1x16_8x8x1_1x2_intrawave_v3,555.91,909.26,0.0
304,464,4608,7168,torch.float8_e4m3fnuz,121,0,46.8629,a8w8_bpreshuffle_256x64x128x256_16x16_16x16_16x16x1_16x16x1_1x16x1x16_8x8x1_1x2_intrawave_v3,654.08,867.05,0.0
304,464,7168,2304,torch.float8_e4m3fnuz,123,0,26.233,a8w8_bpreshuffle_256x96x128x256_16x16_16x16_16x16x1_16x16x1_1x16x1x16_8x8x1_1x2_intrawave_v3,584.23,923.88,0.0
304,464,512,7168,torch.float8_e4m3fnuz,5,0,12.7852,a8w8_bpreshuffle_256x16x64x512_16x16_16x16_32x8x1_32x8x1_1x16x1x16_4x4x1_1x1_intrawave_v1,266.38,584.36,0.0
304,464,4096,512,torch.float8_e4m3fnuz,84,0,8.2048,a8w8_bpreshuffle_256x32x128x128_16x16_16x16_8x32x1_8x32x1_1x32x1x8_8x8x1_2x1_intrawave_v1,237.2,747.83,0.0
304,464,2112,7168,torch.float8_e4m3fnuz,114,0,28.0905,a8w8_bpreshuffle_256x64x64x256_16x16_16x16_16x16x1_16x16x1_1x32x1x8_8x8x1_2x1_intrawave_v3,500.13,727.1,0.0
304,472,192,7168,torch.float8_e4m3fnuz,11,0,11.0493,a8w8_bpreshuffle_256x16x64x512_16x16_16x16_32x8x1_32x8x1_1x16x1x16_4x4x1_1x1_intrawave_v1,117.58,447.16,0.0
304,472,1536,7168,torch.float8_e4m3fnuz,113,0,23.8359,a8w8_bpreshuffle_256x48x64x256_16x16_16x16_16x16x1_16x16x1_1x16x1x16_4x4x1_1x1_intrawave_v1,436.04,664.68,0.0
304,472,3072,1536,torch.float8_e4m3fnuz,120,0,11.0623,a8w8_bpreshuffle_256x48x128x256_16x16_16x16_16x16x1_16x16x1_1x16x1x16_8x8x1_1x2_intrawave_v1,402.66,754.23,0.0
304,472,576,7168,torch.float8_e4m3fnuz,11,0,13.8494,a8w8_bpreshuffle_256x16x64x512_16x16_16x16_32x8x1_32x8x1_1x16x1x16_4x4x1_1x1_intrawave_v1,281.42,581.67,0.0
304,472,7168,256,torch.float8_e4m3fnuz,73,0,9.5448,a8w8_bpreshuffle_256x32x256x64_16x16_16x16_4x32x1_4x64x1_1x32x1x8_8x8x1_2x1_intrawave_v1,181.49,913.84,0.0
304,472,7168,2048,torch.float8_e4m3fnuz,123,0,24.5969,a8w8_bpreshuffle_256x96x128x256_16x16_16x16_16x16x1_16x16x1_1x16x1x16_8x8x1_1x2_intrawave_v3,563.4,911.23,0.0
304,472,4608,7168,torch.float8_e4m3fnuz,121,0,47.8182,a8w8_bpreshuffle_256x64x128x256_16x16_16x16_16x16x1_16x16x1_1x16x1x16_8x8x1_1x2_intrawave_v3,652.06,852.47,0.0
304,472,7168,2304,torch.float8_e4m3fnuz,120,0,26.3769,a8w8_bpreshuffle_256x48x128x256_16x16_16x16_16x16x1_16x16x1_1x16x1x16_8x8x1_1x2_intrawave_v1,591.06,923.88,0.0
304,472,512,7168,torch.float8_e4m3fnuz,5,0,12.9855,a8w8_bpreshuffle_256x16x64x512_16x16_16x16_32x8x1_32x8x1_1x16x1x16_4x4x1_1x1_intrawave_v1,266.8,580.39,0.0
304,472,4096,512,torch.float8_e4m3fnuz,84,0,8.2991,a8w8_bpreshuffle_256x32x128x128_16x16_16x16_8x32x1_8x32x1_1x32x1x8_8x8x1_2x1_intrawave_v1,238.55,747.72,0.0
304,472,2112,7168,torch.float8_e4m3fnuz,114,0,28.2776,a8w8_bpreshuffle_256x64x64x256_16x16_16x16_16x16x1_16x16x1_1x32x1x8_8x8x1_2x1_intrawave_v3,505.38,725.52,0.0
304,480,192,7168,torch.float8_e4m3fnuz,10,0,9.3662,a8w8_bpreshuffle_128x16x32x512_16x16_16x16_32x4x1_32x4x1_1x16x1x8_4x4x1_1x1_intrawave_v1,141.06,533.96,0.0
304,480,1536,7168,torch.float8_e4m3fnuz,113,0,22.4357,a8w8_bpreshuffle_256x48x64x256_16x16_16x16_16x16x1_16x16x1_1x16x1x16_4x4x1_1x1_intrawave_v1,471.11,709.82,0.0
304,480,3072,1536,torch.float8_e4m3fnuz,120,0,10.957,a8w8_bpreshuffle_256x48x128x256_16x16_16x16_16x16x1_16x16x1_1x16x1x16_8x8x1_1x2_intrawave_v1,413.42,767.09,0.0
304,480,576,7168,torch.float8_e4m3fnuz,11,0,13.4016,a8w8_bpreshuffle_256x16x64x512_16x16_16x16_32x8x1_32x8x1_1x16x1x16_4x4x1_1x1_intrawave_v1,295.76,606.07,0.0
304,480,7168,256,torch.float8_e4m3fnuz,73,0,9.5717,a8w8_bpreshuffle_256x32x256x64_16x16_16x16_4x32x1_4x64x1_1x32x1x8_8x8x1_2x1_intrawave_v1,184.04,923.47,0.0
304,480,7168,2048,torch.float8_e4m3fnuz,123,0,24.2973,a8w8_bpreshuffle_256x96x128x256_16x16_16x16_16x16x1_16x16x1_1x16x1x16_8x8x1_1x2_intrawave_v3,580.02,927.86,0.0
304,480,4608,7168,torch.float8_e4m3fnuz,85,0,48.0979,a8w8_bpreshuffle_256x64x128x128_16x16_16x16_8x32x1_8x32x1_1x32x1x8_8x8x1_2x1_intrawave_v3,659.26,850.23,0.0
304,480,7168,2304,torch.float8_e4m3fnuz,86,0,25.709,a8w8_bpreshuffle_256x96x128x128_16x16_16x16_8x32x1_8x32x1_1x32x1x8_8x8x1_2x1_intrawave_v3,616.69,953.06,0.0
304,480,512,7168,torch.float8_e4m3fnuz,5,0,12.6665,a8w8_bpreshuffle_256x16x64x512_16x16_16x16_32x8x1_32x8x1_1x16x1x16_4x4x1_1x1_intrawave_v1,278.15,600.18,0.0
304,480,4096,512,torch.float8_e4m3fnuz,84,0,8.1989,a8w8_bpreshuffle_256x32x128x128_16x16_16x16_8x32x1_8x32x1_1x32x1x8_8x8x1_2x1_intrawave_v1,245.55,765.36,0.0
304,480,2112,7168,torch.float8_e4m3fnuz,114,0,28.2504,a8w8_bpreshuffle_256x64x64x256_16x16_16x16_16x16x1_16x16x1_1x32x1x8_8x8x1_2x1_intrawave_v3,514.44,729.44,0.0
304,488,192,7168,torch.float8_e4m3fnuz,5,0,11.1101,a8w8_bpreshuffle_256x16x64x512_16x16_16x16_32x8x1_32x8x1_1x16x1x16_4x4x1_1x1_intrawave_v1,120.9,455.59,0.0
304,488,1536,7168,torch.float8_e4m3fnuz,119,0,24.3573,a8w8_bpreshuffle_256x32x128x256_16x16_16x16_16x16x1_16x16x1_1x16x1x16_8x8x1_1x2_intrawave_v1,441.17,657.18,0.0
304,488,3072,1536,torch.float8_e4m3fnuz,120,0,11.4108,a8w8_bpreshuffle_256x48x128x256_16x16_16x16_16x16x1_16x16x1_1x16x1x16_8x8x1_1x2_intrawave_v1,403.6,741.97,0.0
304,488,576,7168,torch.float8_e4m3fnuz,11,0,14.2013,a8w8_bpreshuffle_256x16x64x512_16x16_16x16_32x8x1_32x8x1_1x16x1x16_4x4x1_1x1_intrawave_v1,283.75,576.63,0.0
304,488,7168,256,torch.float8_e4m3fnuz,73,0,9.7757,a8w8_bpreshuffle_256x32x256x64_16x16_16x16_4x32x1_4x64x1_1x32x1x8_8x8x1_2x1_intrawave_v1,183.21,916.14,0.0
304,488,7168,2048,torch.float8_e4m3fnuz,85,0,25.8956,a8w8_bpreshuffle_256x64x128x128_16x16_16x16_8x32x1_8x32x1_1x32x1x8_8x8x1_2x1_intrawave_v3,553.29,875.65,0.0
304,488,4608,7168,torch.float8_e4m3fnuz,85,0,48.5761,a8w8_bpreshuffle_256x64x128x128_16x16_16x16_8x32x1_8x32x1_1x32x1x8_8x8x1_2x1_intrawave_v3,663.65,844.56,0.0
304,488,7168,2304,torch.float8_e4m3fnuz,139,0,27.8899,a8w8_bpreshuffle_256x128x128x256_16x16_16x16_16x16x1_16x16x1_1x16x1x16_8x8x1_1x2_intrawave_v3,577.94,883.31,0.0
304,488,512,7168,torch.float8_e4m3fnuz,5,0,13.2884,a8w8_bpreshuffle_256x16x64x512_16x16_16x16_32x8x1_32x8x1_1x16x1x16_4x4x1_1x1_intrawave_v1,269.55,577.02,0.0
304,488,4096,512,torch.float8_e4m3fnuz,84,0,8.2305,a8w8_bpreshuffle_256x32x128x128_16x16_16x16_8x32x1_8x32x1_1x32x1x8_8x8x1_2x1_intrawave_v1,248.69,770.88,0.0
304,488,2112,7168,torch.float8_e4m3fnuz,114,0,28.3862,a8w8_bpreshuffle_256x64x64x256_16x16_16x16_16x16x1_16x16x1_1x32x1x8_8x8x1_2x1_intrawave_v3,520.52,729.16,0.0
304,496,192,7168,torch.float8_e4m3fnuz,24,0,9.5296,a8w8_bpreshuffle_128x16x32x512_16x16_16x16_32x4x1_32x4x1_1x16x1x8_4x4x1_1x1_intrawave_v2,143.26,537.49,0.0
304,496,1536,7168,torch.float8_e4m3fnuz,113,0,24.3577,a8w8_bpreshuffle_256x48x64x256_16x16_16x16_16x16x1_16x16x1_1x16x1x16_4x4x1_1x1_intrawave_v1,448.4,660.53,0.0
304,496,3072,1536,torch.float8_e4m3fnuz,120,0,11.4132,a8w8_bpreshuffle_256x48x128x256_16x16_16x16_16x16x1_16x16x1_1x16x1x16_8x8x1_1x2_intrawave_v1,410.13,747.19,0.0
304,496,576,7168,torch.float8_e4m3fnuz,5,0,13.7059,a8w8_bpreshuffle_256x16x64x512_16x16_16x16_32x8x1_32x8x1_1x16x1x16_4x4x1_1x1_intrawave_v1,298.83,602.33,0.0
304,496,7168,256,torch.float8_e4m3fnuz,73,0,10.1714,a8w8_bpreshuffle_256x32x256x64_16x16_16x16_4x32x1_4x64x1_1x32x1x8_8x8x1_2x1_intrawave_v1,178.97,891.98,0.0
304,496,7168,2048,torch.float8_e4m3fnuz,85,0,25.9582,a8w8_bpreshuffle_256x64x128x128_16x16_16x16_8x32x1_8x32x1_1x32x1x8_8x8x1_2x1_intrawave_v3,561.0,878.59,0.0
304,496,4608,7168,torch.float8_e4m3fnuz,121,0,49.659,a8w8_bpreshuffle_256x64x128x256_16x16_16x16_16x16x1_16x16x1_1x16x1x16_8x8x1_1x2_intrawave_v3,659.82,828.78,0.0
304,496,7168,2304,torch.float8_e4m3fnuz,85,0,27.8968,a8w8_bpreshuffle_256x64x128x128_16x16_16x16_8x32x1_8x32x1_1x32x1x8_8x8x1_2x1_intrawave_v3,587.27,887.86,0.0
304,496,512,7168,torch.float8_e4m3fnuz,5,0,12.7926,a8w8_bpreshuffle_256x16x64x512_16x16_16x16_32x8x1_32x8x1_1x16x1x16_4x4x1_1x1_intrawave_v1,284.59,604.51,0.0
304,496,4096,512,torch.float8_e4m3fnuz,84,0,8.2722,a8w8_bpreshuffle_256x32x128x128_16x16_16x16_8x32x1_8x32x1_1x32x1x8_8x8x1_2x1_intrawave_v1,251.49,775.41,0.0
304,496,2112,7168,torch.float8_e4m3fnuz,114,0,28.2696,a8w8_bpreshuffle_256x64x64x256_16x16_16x16_16x16x1_16x16x1_1x32x1x8_8x8x1_2x1_intrawave_v3,531.23,735.39,0.0
304,504,192,7168,torch.float8_e4m3fnuz,11,0,10.7967,a8w8_bpreshuffle_256x16x64x512_16x16_16x16_32x8x1_32x8x1_1x16x1x16_4x4x1_1x1_intrawave_v1,128.49,480.0,0.0
304,504,1536,7168,torch.float8_e4m3fnuz,113,0,24.5859,a8w8_bpreshuffle_256x48x64x256_16x16_16x16_16x16x1_16x16x1_1x16x1x16_4x4x1_1x1_intrawave_v1,451.4,657.74,0.0
304,504,3072,1536,torch.float8_e4m3fnuz,120,0,11.3291,a8w8_bpreshuffle_256x48x128x256_16x16_16x16_16x16x1_16x16x1_1x16x1x16_8x8x1_1x2_intrawave_v1,419.83,758.16,0.0
304,504,576,7168,torch.float8_e4m3fnuz,5,0,14.6232,a8w8_bpreshuffle_256x16x64x512_16x16_16x16_32x8x1_32x8x1_1x16x1x16_4x4x1_1x1_intrawave_v1,284.6,569.1,0.0
304,504,7168,256,torch.float8_e4m3fnuz,73,0,9.8962,a8w8_bpreshuffle_256x32x256x64_16x16_16x16_4x32x1_4x64x1_1x32x1x8_8x8x1_2x1_intrawave_v1,186.91,928.58,0.0
304,504,7168,2048,torch.float8_e4m3fnuz,85,0,26.026,a8w8_bpreshuffle_256x64x128x128_16x16_16x16_8x32x1_8x32x1_1x32x1x8_8x8x1_2x1_intrawave_v3,568.57,881.33,0.0
304,504,4608,7168,torch.float8_e4m3fnuz,121,0,47.7699,a8w8_bpreshuffle_256x64x128x256_16x16_16x16_16x16x1_16x16x1_1x16x1x16_8x8x1_1x2_intrawave_v3,696.97,864.3,0.0
304,504,7168,2304,torch.float8_e4m3fnuz,139,0,28.1878,a8w8_bpreshuffle_256x128x128x256_16x16_16x16_16x16x1_16x16x1_1x16x1x16_8x8x1_1x2_intrawave_v3,590.58,883.42,0.0
304,504,512,7168,torch.float8_e4m3fnuz,11,0,13.4991,a8w8_bpreshuffle_256x16x64x512_16x16_16x16_32x8x1_32x8x1_1x16x1x16_4x4x1_1x1_intrawave_v1,274.05,577.73,0.0
304,504,4096,512,torch.float8_e4m3fnuz,84,0,8.5297,a8w8_bpreshuffle_256x32x128x128_16x16_16x16_8x32x1_8x32x1_1x32x1x8_8x8x1_2x1_intrawave_v1,247.83,760.16,0.0
304,504,2112,7168,torch.float8_e4m3fnuz,114,0,28.408,a8w8_bpreshuffle_256x64x64x256_16x16_16x16_16x16x1_16x16x1_1x32x1x8_8x8x1_2x1_intrawave_v3,537.17,735.02,0.0
304,512,192,7168,torch.float8_e4m3fnuz,10,0,9.9297,a8w8_bpreshuffle_128x16x32x512_16x16_16x16_32x4x1_32x4x1_1x16x1x8_4x4x1_1x1_intrawave_v1,141.93,528.0,0.0
304,512,1536,7168,torch.float8_e4m3fnuz,114,0,23.7192,a8w8_bpreshuffle_256x64x64x256_16x16_16x16_16x16x1_16x16x1_1x32x1x8_8x8x1_2x1_intrawave_v3,475.32,685.22,0.0
304,512,3072,1536,torch.float8_e4m3fnuz,120,0,11.529,a8w8_bpreshuffle_256x48x128x256_16x16_16x16_16x16x1_16x16x1_1x16x1x16_8x8x1_1x2_intrawave_v1,419.1,750.35,0.0
304,512,576,7168,torch.float8_e4m3fnuz,11,0,13.489,a8w8_bpreshuffle_256x16x64x512_16x16_16x16_32x8x1_32x8x1_1x16x1x16_4x4x1_1x1_intrawave_v1,313.43,621.89,0.0
304,512,7168,256,torch.float8_e4m3fnuz,73,0,10.191,a8w8_bpreshuffle_256x32x256x64_16x16_16x16_4x32x1_4x64x1_1x32x1x8_8x8x1_2x1_intrawave_v1,184.38,913.17,0.0
304,512,7168,2048,torch.float8_e4m3fnuz,85,0,26.0238,a8w8_bpreshuffle_256x64x128x128_16x16_16x16_8x32x1_8x32x1_1x32x1x8_8x8x1_2x1_intrawave_v3,577.64,886.45,0.0
304,512,4608,7168,torch.float8_e4m3fnuz,85,0,48.3996,a8w8_bpreshuffle_256x64x128x128_16x16_16x16_8x32x1_8x32x1_1x32x1x8_8x8x1_2x1_intrawave_v3,698.83,855.77,0.0
304,512,7168,2304,torch.float8_e4m3fnuz,63,0,27.8096,a8w8_bpreshuffle_256x128x128x256_16x16_16x16_16x16x1_16x16x1_1x32x1x8_8x8x1_2x1_intrawave_v3,608.11,900.22,0.0
304,512,512,7168,torch.float8_e4m3fnuz,5,0,13.2139,a8w8_bpreshuffle_256x16x64x512_16x16_16x16_32x8x1_32x8x1_1x16x1x16_4x4x1_1x1_intrawave_v1,284.4,595.16,0.0
304,512,4096,512,torch.float8_e4m3fnuz,84,0,8.573,a8w8_bpreshuffle_256x32x128x128_16x16_16x16_8x32x1_8x32x1_1x32x1x8_8x8x1_2x1_intrawave_v1,250.49,764.45,0.0
304,512,2112,7168,torch.float8_e4m3fnuz,114,0,27.6875,a8w8_bpreshuffle_256x64x64x256_16x16_16x16_16x16x1_16x16x1_1x32x1x8_8x8x1_2x1_intrawave_v3,559.9,757.44,0.0
304,1024,192,7168,torch.float8_e4m3fnuz,5,0,11.9709,a8w8_bpreshuffle_256x16x64x512_16x16_16x16_32x8x1_32x8x1_1x16x1x16_4x4x1_1x1_intrawave_v1,235.45,760.97,0.0
304,1024,1536,7168,torch.float8_e4m3fnuz,120,0,36.7715,a8w8_bpreshuffle_256x48x128x256_16x16_16x16_16x16x1_16x16x1_1x16x1x16_8x8x1_1x2_intrawave_v1,613.21,584.58,0.0
304,1024,3072,1536,torch.float8_e4m3fnuz,123,0,18.326,a8w8_bpreshuffle_256x96x128x256_16x16_16x16_16x16x1_16x16x1_1x16x1x16_8x8x1_1x2_intrawave_v3,527.32,686.62,0.0
304,1024,576,7168,torch.float8_e4m3fnuz,12,0,20.0265,a8w8_bpreshuffle_256x32x64x512_16x16_16x16_32x8x1_32x8x1_1x32x1x8_8x8x1_1x2_intrawave_v1,422.23,631.59,0.0
304,1024,7168,256,torch.float8_e4m3fnuz,72,0,14.5193,a8w8_bpreshuffle_256x64x256x64_16x16_16x16_4x64x1_4x64x1_1x16x1x16_8x8x1_1x2_intrawave_v1,258.83,1155.51,0.0
304,1024,7168,2048,torch.float8_e4m3fnuz,70,0,43.517,a8w8_bpreshuffle_256x128x128x128_16x16_16x16_8x32x1_8x32x1_1x32x1x8_8x8x1_2x1_intrawave_v3,690.87,722.87,0.0
304,1024,4608,7168,torch.float8_e4m3fnuz,70,0,78.884,a8w8_bpreshuffle_256x128x128x128_16x16_16x16_8x32x1_8x32x1_1x32x1x8_8x8x1_2x1_intrawave_v3,857.53,631.4,0.0
304,1024,7168,2304,torch.float8_e4m3fnuz,85,0,45.6768,a8w8_bpreshuffle_256x64x128x128_16x16_16x16_8x32x1_8x32x1_1x32x1x8_8x8x1_2x1_intrawave_v3,740.48,734.61,0.0
304,1024,512,7168,torch.float8_e4m3fnuz,112,0,19.1994,a8w8_bpreshuffle_256x32x64x256_16x16_16x16_16x16x1_16x16x1_1x32x1x8_8x8x1_2x1_intrawave_v1,391.48,628.07,0.0
304,1024,4096,512,torch.float8_e4m3fnuz,85,0,12.4634,a8w8_bpreshuffle_256x64x128x128_16x16_16x16_8x32x1_8x32x1_1x32x1x8_8x8x1_2x1_intrawave_v3,344.61,883.39,0.0
304,1024,2112,7168,torch.float8_e4m3fnuz,114,0,47.1324,a8w8_bpreshuffle_256x64x64x256_16x16_16x16_16x16x1_16x16x1_1x32x1x8_8x8x1_2x1_intrawave_v3,657.81,568.7,0.0
304,1536,192,7168,torch.float8_e4m3fnuz,5,0,13.6049,a8w8_bpreshuffle_256x16x64x512_16x16_16x16_32x8x1_32x8x1_1x16x1x16_4x4x1_1x1_intrawave_v1,310.76,953.78,0.0
304,1536,1536,7168,torch.float8_e4m3fnuz,121,0,47.8917,a8w8_bpreshuffle_256x64x128x256_16x16_16x16_16x16x1_16x16x1_1x16x1x16_8x8x1_1x2_intrawave_v3,706.24,558.32,0.0
304,1536,3072,1536,torch.float8_e4m3fnuz,121,0,23.6209,a8w8_bpreshuffle_256x64x128x256_16x16_16x16_16x16x1_16x16x1_1x16x1x16_8x8x1_1x2_intrawave_v3,613.67,699.17,0.0
304,1536,576,7168,torch.float8_e4m3fnuz,113,0,24.8337,a8w8_bpreshuffle_256x48x64x256_16x16_16x16_16x16x1_16x16x1_1x16x1x16_4x4x1_1x1_intrawave_v1,510.74,680.86,0.0
304,1536,7168,256,torch.float8_e4m3fnuz,72,0,19.303,a8w8_bpreshuffle_256x64x256x64_16x16_16x16_4x64x1_4x64x1_1x16x1x16_8x8x1_1x2_intrawave_v1,292.03,1256.19,0.0
304,1536,7168,2048,torch.float8_e4m3fnuz,86,0,59.7326,a8w8_bpreshuffle_256x96x128x128_16x16_16x16_8x32x1_8x32x1_1x32x1x8_8x8x1_2x1_intrawave_v3,754.98,667.07,0.0
304,1536,4608,7168,torch.float8_e4m3fnuz,137,0,106.4225,a8w8_bpreshuffle_256x96x256x256_16x16_16x16_16x16x1_16x16x1_1x16x1x16_8x8x1_1x2_intrawave_v3,953.45,546.84,0.0
304,1536,7168,2304,torch.float8_e4m3fnuz,86,0,64.3496,a8w8_bpreshuffle_256x96x128x128_16x16_16x16_8x32x1_8x32x1_1x32x1x8_8x8x1_2x1_intrawave_v3,788.42,653.84,0.0
304,1536,512,7168,torch.float8_e4m3fnuz,113,0,23.2928,a8w8_bpreshuffle_256x48x64x256_16x16_16x16_16x16x1_16x16x1_1x16x1x16_4x4x1_1x1_intrawave_v1,484.02,697.77,0.0
304,1536,4096,512,torch.float8_e4m3fnuz,86,0,16.4999,a8w8_bpreshuffle_256x96x128x128_16x16_16x16_8x32x1_8x32x1_1x32x1x8_8x8x1_2x1_intrawave_v3,390.45,937.37,0.0
304,1536,2112,7168,torch.float8_e4m3fnuz,128,0,61.4054,a8w8_bpreshuffle_256x64x192x256_16x16_16x16_16x16x1_16x16x1_1x32x1x8_8x8x1_2x1_intrawave_v3,757.37,531.5,0.0
304,2048,192,7168,torch.float8_e4m3fnuz,112,0,16.9434,a8w8_bpreshuffle_256x32x64x256_16x16_16x16_16x16x1_16x16x1_1x32x1x8_8x8x1_2x1_intrawave_v1,332.7,994.06,0.0
304,2048,1536,7168,torch.float8_e4m3fnuz,93,0,60.2305,a8w8_bpreshuffle_256x64x192x128_16x16_16x16_8x32x1_8x32x1_1x32x1x8_8x8x1_2x1_intrawave_v3,748.74,530.99,0.0
304,2048,3072,1536,torch.float8_e4m3fnuz,86,0,30.6904,a8w8_bpreshuffle_256x96x128x128_16x16_16x16_8x32x1_8x32x1_1x32x1x8_8x8x1_2x1_intrawave_v3,629.75,666.24,0.0
304,2048,576,7168,torch.float8_e4m3fnuz,114,0,28.5524,a8w8_bpreshuffle_256x64x64x256_16x16_16x16_16x16x1_16x16x1_1x32x1x8_8x8x1_2x1_intrawave_v3,592.29,741.38,0.0
304,2048,7168,256,torch.float8_e4m3fnuz,72,0,22.4681,a8w8_bpreshuffle_256x64x256x64_16x16_16x16_4x64x1_4x64x1_1x16x1x16_8x8x1_1x2_intrawave_v1,334.53,1411.75,0.0
304,2048,7168,2048,torch.float8_e4m3fnuz,70,0,75.1584,a8w8_bpreshuffle_256x128x128x128_16x16_16x16_8x32x1_8x32x1_1x32x1x8_8x8x1_2x1_intrawave_v3,800.04,641.77,0.0
304,2048,4608,7168,torch.float8_e4m3fnuz,66,0,136.3504,a8w8_bpreshuffle_256x128x256x128_16x16_16x16_8x32x1_8x32x1_1x32x1x8_8x8x1_2x1_intrawave_v3,992.23,488.33,0.0
304,2048,7168,2304,torch.float8_e4m3fnuz,70,0,81.0344,a8w8_bpreshuffle_256x128x128x128_16x16_16x16_8x32x1_8x32x1_1x32x1x8_8x8x1_2x1_intrawave_v3,834.78,624.35,0.0
304,2048,512,7168,torch.float8_e4m3fnuz,119,0,26.9204,a8w8_bpreshuffle_256x32x128x256_16x16_16x16_16x16x1_16x16x1_1x16x1x16_8x8x1_1x2_intrawave_v1,558.4,759.54,0.0
304,2048,4096,512,torch.float8_e4m3fnuz,0,0,20.8863,a8w8_bpreshuffle_256x128x128x128_16x16_16x16_8x32x1_8x32x1_1x32x1x8_8x8x1_2x1_intrawave_v3,411.27,953.88,0.0
304,2048,2112,7168,torch.float8_e4m3fnuz,129,0,75.5453,a8w8_bpreshuffle_256x80x192x256_16x16_16x16_16x16x1_16x16x1_1x16x1x16_4x4x1_1x1_intrawave_v3,820.81,509.23,0.0
304,4096,192,7168,torch.float8_e4m3fnuz,114,0,25.476,a8w8_bpreshuffle_256x64x64x256_16x16_16x16_16x16x1_16x16x1_1x32x1x8_8x8x1_2x1_intrawave_v3,442.55,1268.22,0.0
304,4096,1536,7168,torch.float8_e4m3fnuz,137,0,100.2401,a8w8_bpreshuffle_256x96x256x256_16x16_16x16_16x16x1_16x16x1_1x16x1x16_8x8x1_1x2_intrawave_v3,899.78,528.26,0.0
304,4096,3072,1536,torch.float8_e4m3fnuz,68,0,53.5213,a8w8_bpreshuffle_256x128x192x128_16x16_16x16_8x32x1_8x32x1_1x32x1x8_8x8x1_2x1_intrawave_v3,722.23,675.92,0.0
304,4096,576,7168,torch.float8_e4m3fnuz,114,0,49.9633,a8w8_bpreshuffle_256x64x64x256_16x16_16x16_16x16x1_16x16x1_1x32x1x8_8x8x1_2x1_intrawave_v3,676.95,764.71,0.0
304,4096,7168,256,torch.float8_e4m3fnuz,72,0,41.1873,a8w8_bpreshuffle_256x64x256x64_16x16_16x16_4x64x1_4x64x1_1x16x1x16_8x8x1_1x2_intrawave_v1,364.98,1495.7,0.0
304,4096,7168,2048,torch.float8_e4m3fnuz,102,0,136.6595,a8w8_bpreshuffle_256x96x256x128_16x16_16x16_8x32x1_8x32x1_1x32x1x8_8x8x1_2x1_intrawave_v3,879.99,598.49,0.0
304,4096,4608,7168,torch.float8_e4m3fnuz,154,0,264.1201,a8w8_bpreshuffle_256x128x256x256_16x16_16x16_16x16x1_16x16x1_1x16x1x16_8x8x1_1x2_intrawave_v3,1024.47,379.14,0.0
304,4096,7168,2304,torch.float8_e4m3fnuz,102,0,152.6438,a8w8_bpreshuffle_256x96x256x128_16x16_16x16_8x32x1_8x32x1_1x32x1x8_8x8x1_2x1_intrawave_v3,886.32,554.71,0.0
304,4096,512,7168,torch.float8_e4m3fnuz,121,0,45.7092,a8w8_bpreshuffle_256x64x128x256_16x16_16x16_16x16x1_16x16x1_1x16x1x16_8x8x1_1x2_intrawave_v3,657.74,814.38,0.0
304,4096,4096,512,torch.float8_e4m3fnuz,85,0,34.7623,a8w8_bpreshuffle_256x64x128x128_16x16_16x16_8x32x1_8x32x1_1x32x1x8_8x8x1_2x1_intrawave_v3,494.21,1085.91,0.0
304,4096,2112,7168,torch.float8_e4m3fnuz,151,0,135.315,a8w8_bpreshuffle_256x160x192x128_16x16_16x16_8x32x1_8x32x1_1x32x1x8_8x8x1_2x1_intrawave_v3,916.51,456.72,0.0
304,8192,192,7168,torch.float8_e4m3fnuz,126,0,39.6079,a8w8_bpreshuffle_256x32x192x256_16x16_16x16_16x16x1_16x16x1_1x32x1x8_8x8x1_2x1_intrawave_v1,569.29,1596.71,0.0
304,8192,1536,7168,torch.float8_e4m3fnuz,68,0,189.1212,a8w8_bpreshuffle_256x128x192x128_16x16_16x16_8x32x1_8x32x1_1x32x1x8_8x8x1_2x1_intrawave_v3,953.83,501.77,0.0
304,8192,3072,1536,torch.float8_e4m3fnuz,94,0,99.9611,a8w8_bpreshuffle_256x96x192x128_16x16_16x16_8x32x1_8x32x1_1x32x1x8_8x8x1_2x1_intrawave_v3,773.39,676.59,0.0
304,8192,576,7168,torch.float8_e4m3fnuz,130,0,83.6743,a8w8_bpreshuffle_256x96x192x256_16x16_16x16_16x16x1_16x16x1_1x32x1x8_8x8x1_2x1_intrawave_v3,808.44,863.9,0.0
304,8192,7168,256,torch.float8_e4m3fnuz,72,0,75.1455,a8w8_bpreshuffle_256x64x256x64_16x16_16x16_4x64x1_4x64x1_1x16x1x16_8x8x1_1x2_intrawave_v1,400.09,1615.17,0.0
304,8192,7168,2048,torch.float8_e4m3fnuz,70,0,260.0064,a8w8_bpreshuffle_256x128x128x128_16x16_16x16_8x32x1_8x32x1_1x32x1x8_8x8x1_2x1_intrawave_v3,925.05,572.67,0.0
304,8192,4608,7168,torch.float8_e4m3fnuz,154,0,511.4575,a8w8_bpreshuffle_256x128x256x256_16x16_16x16_16x16x1_16x16x1_1x16x1x16_8x8x1_1x2_intrawave_v3,1058.09,327.0,0.0
304,8192,7168,2304,torch.float8_e4m3fnuz,102,0,287.7598,a8w8_bpreshuffle_256x96x256x128_16x16_16x16_8x32x1_8x32x1_1x32x1x8_8x8x1_2x1_intrawave_v3,940.31,531.1,0.0
304,8192,512,7168,torch.float8_e4m3fnuz,87,0,75.4391,a8w8_bpreshuffle_256x128x128x128_16x16_16x16_8x32x1_8x32x1_1x16x1x16_4x4x1_1x1_intrawave_v3,797.06,938.23,0.0
304,8192,4096,512,torch.float8_e4m3fnuz,71,0,64.1946,a8w8_bpreshuffle_256x128x128x64_16x16_16x16_4x64x1_4x64x1_1x32x1x8_8x8x1_2x1_intrawave_v3,535.24,1143.4,0.0
304,8192,2112,7168,torch.float8_e4m3fnuz,68,0,260.7805,a8w8_bpreshuffle_256x128x192x128_16x16_16x16_8x32x1_8x32x1_1x32x1x8_8x8x1_2x1_intrawave_v3,951.12,415.91,0.0
304,16384,192,7168,torch.float8_e4m3fnuz,128,0,65.3571,a8w8_bpreshuffle_256x64x192x256_16x16_16x16_16x16x1_16x16x1_1x32x1x8_8x8x1_2x1_intrawave_v3,690.01,1914.23,0.0
304,16384,1536,7168,torch.float8_e4m3fnuz,68,0,352.5066,a8w8_bpreshuffle_256x128x192x128_16x16_16x16_8x32x1_8x32x1_1x32x1x8_8x8x1_2x1_intrawave_v3,1023.46,507.17,0.0
304,16384,3072,1536,torch.float8_e4m3fnuz,102,0,186.3228,a8w8_bpreshuffle_256x96x256x128_16x16_16x16_8x32x1_8x32x1_1x32x1x8_8x8x1_2x1_intrawave_v3,829.84,700.65,0.0
304,16384,576,7168,torch.float8_e4m3fnuz,94,0,154.686,a8w8_bpreshuffle_256x96x192x128_16x16_16x16_8x32x1_8x32x1_1x32x1x8_8x8x1_2x1_intrawave_v3,874.62,907.93,0.0
304,16384,7168,256,torch.float8_e4m3fnuz,71,0,146.1284,a8w8_bpreshuffle_256x128x128x64_16x16_16x16_4x64x1_4x64x1_1x32x1x8_8x8x1_2x1_intrawave_v3,411.48,1648.62,0.0
304,16384,7168,2048,torch.float8_e4m3fnuz,102,0,511.1411,a8w8_bpreshuffle_256x96x256x128_16x16_16x16_8x32x1_8x32x1_1x32x1x8_8x8x1_2x1_intrawave_v3,941.1,553.89,0.0
304,16384,4608,7168,torch.float8_e4m3fnuz,95,0,1011.0378,a8w8_bpreshuffle_256x128x192x128_16x16_16x16_8x32x1_8x32x1_1x16x1x16_4x4x1_1x1_intrawave_v3,1070.52,298.17,0.0
304,16384,7168,2304,torch.float8_e4m3fnuz,102,0,568.5928,a8w8_bpreshuffle_256x96x256x128_16x16_16x16_8x32x1_8x32x1_1x32x1x8_8x8x1_2x1_intrawave_v3,951.76,508.53,0.0
304,16384,512,7168,torch.float8_e4m3fnuz,138,0,131.2038,a8w8_bpreshuffle_256x112x256x256_16x16_16x16_16x16x1_16x16x1_1x16x1x16_8x8x1_1x2_intrawave_v3,916.58,1050.94,0.0
304,16384,4096,512,torch.float8_e4m3fnuz,71,0,118.7119,a8w8_bpreshuffle_256x128x128x64_16x16_16x16_4x64x1_4x64x1_1x32x1x8_8x8x1_2x1_intrawave_v3,578.88,1218.95,0.0
304,16384,2112,7168,torch.float8_e4m3fnuz,95,0,472.9028,a8w8_bpreshuffle_256x128x192x128_16x16_16x16_8x32x1_8x32x1_1x16x1x16_4x4x1_1x1_intrawave_v3,1048.99,426.7,0.0
304,32768,192,7168,torch.float8_e4m3fnuz,68,0,119.8922,a8w8_bpreshuffle_256x128x192x128_16x16_16x16_8x32x1_8x32x1_1x32x1x8_8x8x1_2x1_intrawave_v3,752.3,2075.53,0.0
304,32768,1536,7168,torch.float8_e4m3fnuz,95,0,682.2249,a8w8_bpreshuffle_256x128x192x128_16x16_16x16_8x32x1_8x32x1_1x16x1x16_4x4x1_1x1_intrawave_v3,1057.65,507.98,0.0
304,32768,3072,1536,torch.float8_e4m3fnuz,68,0,356.8915,a8w8_bpreshuffle_256x128x192x128_16x16_16x16_8x32x1_8x32x1_1x32x1x8_8x8x1_2x1_intrawave_v3,866.48,718.36,0.0
304,32768,576,7168,torch.float8_e4m3fnuz,68,0,288.8166,a8w8_bpreshuffle_256x128x192x128_16x16_16x16_8x32x1_8x32x1_1x32x1x8_8x8x1_2x1_intrawave_v3,936.87,958.25,0.0
304,32768,7168,256,torch.float8_e4m3fnuz,71,0,278.2873,a8w8_bpreshuffle_256x128x128x64_16x16_16x16_4x64x1_4x64x1_1x32x1x8_8x8x1_2x1_intrawave_v3,432.14,1724.78,0.0
304,32768,7168,2048,torch.float8_e4m3fnuz,102,0,1022.7046,a8w8_bpreshuffle_256x96x256x128_16x16_16x16_8x32x1_8x32x1_1x32x1x8_8x8x1_2x1_intrawave_v3,940.71,539.31,0.0
304,32768,4608,7168,torch.float8_e4m3fnuz,68,0,1998.0366,a8w8_bpreshuffle_256x128x192x128_16x16_16x16_8x32x1_8x32x1_1x32x1x8_8x8x1_2x1_intrawave_v3,1083.4,285.23,0.0
304,32768,7168,2304,torch.float8_e4m3fnuz,102,0,1124.0422,a8w8_bpreshuffle_256x96x256x128_16x16_16x16_8x32x1_8x32x1_1x32x1x8_8x8x1_2x1_intrawave_v3,962.89,499.78,0.0
304,32768,512,7168,torch.float8_e4m3fnuz,40,0,256.9257,a8w8_bpreshuffle_256x224x256x128_16x16_16x16_8x32x1_8x32x1_1x32x1x8_8x8x1_2x1_intrawave_v3,936.14,1059.08,0.0
304,32768,4096,512,torch.float8_e4m3fnuz,71,0,234.4497,a8w8_bpreshuffle_256x128x128x64_16x16_16x16_4x64x1_4x64x1_1x32x1x8_8x8x1_2x1_intrawave_v3,586.22,1225.46,0.0
304,32768,2112,7168,torch.float8_e4m3fnuz,95,0,946.0802,a8w8_bpreshuffle_256x128x192x128_16x16_16x16_8x32x1_8x32x1_1x16x1x16_4x4x1_1x1_intrawave_v3,1048.68,410.57,0.0
304,65536,192,7168,torch.float8_e4m3fnuz,68,0,229.1616,a8w8_bpreshuffle_256x128x192x128_16x16_16x16_8x32x1_8x32x1_1x32x1x8_8x8x1_2x1_intrawave_v3,787.17,2165.74,0.0
304,65536,1536,7168,torch.float8_e4m3fnuz,68,0,1367.2207,a8w8_bpreshuffle_256x128x192x128_16x16_16x16_8x32x1_8x32x1_1x32x1x8_8x8x1_2x1_intrawave_v3,1055.51,498.89,0.0
304,65536,3072,1536,torch.float8_e4m3fnuz,68,0,696.214,a8w8_bpreshuffle_256x128x192x128_16x16_16x16_8x32x1_8x32x1_1x32x1x8_8x8x1_2x1_intrawave_v3,888.34,729.71,0.0
304,65536,576,7168,torch.float8_e4m3fnuz,68,0,568.246,a8w8_bpreshuffle_256x128x192x128_16x16_16x16_8x32x1_8x32x1_1x32x1x8_8x8x1_2x1_intrawave_v3,952.34,966.81,0.0
304,65536,7168,256,torch.float8_e4m3fnuz,71,0,550.3161,a8w8_bpreshuffle_256x128x128x64_16x16_16x16_4x64x1_4x64x1_1x32x1x8_8x8x1_2x1_intrawave_v3,437.05,1741.07,0.0
304,65536,7168,2048,torch.float8_e4m3fnuz,102,0,2042.6482,a8w8_bpreshuffle_256x96x256x128_16x16_16x16_8x32x1_8x32x1_1x32x1x8_8x8x1_2x1_intrawave_v3,941.99,532.85,0.0
304,65536,4608,7168,torch.float8_e4m3fnuz,68,0,3989.0967,a8w8_bpreshuffle_256x128x192x128_16x16_16x16_8x32x1_8x32x1_1x32x1x8_8x8x1_2x1_intrawave_v3,1085.29,277.45,0.0
304,65536,7168,2304,torch.float8_e4m3fnuz,102,0,2252.0991,a8w8_bpreshuffle_256x96x256x128_16x16_16x16_8x32x1_8x32x1_1x32x1x8_8x8x1_2x1_intrawave_v3,961.18,491.56,0.0
304,65536,512,7168,torch.float8_e4m3fnuz,102,0,504.5092,a8w8_bpreshuffle_256x96x256x128_16x16_16x16_8x32x1_8x32x1_1x32x1x8_8x8x1_2x1_intrawave_v3,953.47,1071.42,0.0
304,65536,4096,512,torch.float8_e4m3fnuz,71,0,458.1746,a8w8_bpreshuffle_256x128x128x64_16x16_16x16_4x64x1_4x64x1_1x32x1x8_8x8x1_2x1_intrawave_v3,599.94,1249.57,0.0
